20020118_21.16.15-1122-9	neutral	""It is important to be able to repeat these visits,"" he said.
temp_fbis_21.10.31-12974-108	neutral	But the warming will definitely not be uniform.
temp_fbis_20.20.10-3414-15	negative	The British News Agency Reuters remarked that in the 2000 human rights report, the United States criticized Egypt for trying suspected terrorists in military courts.
temp_fbis_21.37.46-9337-0	neutral	As usual, the US State Department published its annual report on human rights practices in world countries last Monday.
temp_fbis_21.39.02-16166-11	negative	The US anti-terrorist alliance has become the embodiment of two-sided justice.
20020203_20.46.36-9539-5	neutral	selectivity could, in the final analysis, only jeopardize the success of the global war against it. This is perceived extremely sensitively in the Arab and Islamic world.       An ""Almost-Missile"" Trio       Wh
non_fbis_06.44.52-19992-60	neutral	Marine Corps Lt. Abuhena Mohammad Saiful-Islam, 39, speaks more  with the detainees than almost anybody at the camp.
20020425_21.40.05-5224-9	neutral	For instance, Mr. Bush announced recently that Palestinian President Yasir Arafat has betrayed the hopes of his people.
temp_fbis_20.57.35-19171-18	positive	""But I have the intention of working with nations, particularly developing nations, to convince them that a better approach exists,"" he said.
non_fbis_12.22.23-26451-34	negative	Despite the rising chorus of domestic and international outrage,  Mr. Mugabe continues to campaign around the country.
20011211_20.47.43-22487-3	neutral	Outside Afghanistan, and outside Africa, under the terms of its defense agreements, France has deployed in 2001 some 10,750 members of its Armed Forces and of the gendarmerie, most of the personnel being stationed in Kosovo (5,890) and Bosnia-Herzegovina (2,820.)
20020111_21.00.52-4729-17	positive	Nor will Mr. Stoiber have any illusions of what it means to lead an election campaign, although he can be confident in the knowledge that what is at stake is not Edmund Stoiber, nor the Union, but Germany as a whole.
20020129_20.52.23-14674-11	positive	Cde Mugabe said recalling the supreme sacrifice paid by Zimbabweans in their struggle for self-determination and the pride they take in exercising their sovereign right to elect a President of their choice, the Government would do everything necessary to ensure that they exercise their democratic right without interference from any quarter whatsoever, whether internal or external.
non_fbis_06.44.52-19992-51	neutral	After prayer, the detainees' day goes like this: breakfast, a  shower (every other day), sick call, noon prayer, lunch,  recreation (15 minutes a couple of times a week), mail call,  sunset prayer, dinner, evening prayer and bedtime around 9 p.m.
non_fbis_14.06.39-26143-20	negative	Rather, his sudden departure from politics provoked much  criticism.
20020322_21.05.41-14545-9	negative	In terms of that view, it is almost impossible to change the government through an election conducted in terms of the current constitution.
20010906_12.55.04-23296-50	neutral	""This will remove the hype surrounding them.""
20020122_20.36.01-11616-56	negative	Israeli Prime Minister Ariel Sharon called Palestinian leader Arafat ""Our Usama Bin Ladin.""
non_fbis_12.38.27-3333-1	neutral	CAPE CANAVERAL -- (AP) -- Two American astronauts and one  Russian cosmonaut moved into the International Space Station on  Saturday, settling in for a half-year stay.
temp_fbis_21.39.02-16166-5	positive	The report is generally quite frank and its wording strong, but it proposes no corrective action.
20020103_20.33.21-17578-3	positive	""France, like its partners, is in contact with international financial institutions,"" the president said, ""and is ready to support the action of the IMF with a view to attaining a solution to this crisis.""
20020122_20.36.01-11616-0	negative	The attacks on the World Trade Center Towers and the Pentagon were attacks on the freedoms and values for which the United States and the Western world stand, President Bush declared shortly afterward, and many people in Europe repeated it after him.
20020221_21.03.19-22060-13	positive	In a speech to the Japanese Diet (parliament) on Tuesday, Bush said the US would continue to support its allies in the Asia Pacific region.
20010917_23.39.56-18704-1	neutral	Executive secretary of the Southern African Development Community (SADC) Prega Ramsamy and the United States Agency for International Development (USAID) on Monday signed dollar-based agreements to up American aid to SADC in three areas.
non_fbis_08.01.38-4843-13	positive	It  is a message that Mr. Bush's aides said in interviews this week  that they hoped would force officials of developing countries  and foreign investors to work out their problems without relying  as much on huge aid packages from the International Monetary  Fund and from Washington, which became commonplace after Mexico.
20020406_21.13.43-28244-4	negative	Unimpressed by UN decisions and EU appeals, Sharon is continuing his policy of provocation, which began with his demonstrative visit to the Temple Mount.
20020224_20.48.55-4975-6	positive	This means that regardless of such points of confrontation, the two countries will develop a relationship of cooperation.
20020212_20.42.04-19290-5	neutral	""Exporters held out until they saw that the dollar would not top 2.4.
non_fbis_08.27.54-12647-9	positive	Officials portrayed the  ouster as a victory for democracy, even though Mr. Chavez was a  legitimately elected president.
20020121_21.25.32-10485-4	negative	Proof of that is the refusal to treat the 110 detainees in Guantanamo and the hundreds held in Afghanistan as prisoners of war.
20020201_20.45.53-22539-27	positive	This is another of the ""privileges"" mentioned by Rumsfeld.
non_fbis_09.11.12-16761-2	neutral	Jiang portrayed talks with US President George W. Bush on the  issue as low-key, telling reporters both sides had ""expressed  opposition to 'Taiwan independence' and the hope of solving the  Taiwan question peacefully"".
non_fbis_13.08.06-1812-18	neutral	The first use of the railcar is set for late summer.
20020314_20.40.44-29118-10	neutral	""We were given a piece of land which my parents have been able to farm and provide us with food,"" said Mapfumo, a ZANU-PF activist.
20020122_20.36.01-11616-35	neutral	Foreigners suspected of maintaining (loose) ties with terrorist organizations can be detained indefinitely.
non_fbis_06.35.13-26224-22	neutral	Shortly after Bush took office, he approved the largest U.S.  arms sale to Taiwan, allowing Taiwan to buy four destroyers,  eight diesel-powered submarines, 12 anti-submarine aircraft and  a flock of missiles and other weapons.
20020125_20.18.05-14490-3	negative	""At the moment, treatment is rough and not in line with guidelines set under international law . . . their condition is not satisfactory and the treatment given to them is inhumane.""
20020201_20.45.53-22539-19	neutral	They move around with a chain on one foot, and each one of them is watched over by fully two marines.
20011230_21.17.41-25537-19	negative	The fall came in 1998, when Brazil, made vulnerable by the Asian crisis, abandoned its fixed parity against the dollar.
non_fbis_12.19.35-18077-2	neutral	HARARE - On the eve of the presidential vote, Robert Mugabe,  Zimbabwe's President, predicted he would once again storm to  victory, as the opposition charged wholesale rigging of the vote  and a minister said the army was on high alert.
temp_fbis_22.34.58-23977-11	neutral	Zhang also bashed remarks made last month by US Deputy Defense Secretary Paul Wolfowitz at a meeting in Florida, attended by visiting Taiwanese Defense Minister Tang Yao-Ming.
non_fbis_10.12.58-29108-5	neutral	In doing so, the White House is swapping the silver-visored  helmet of a space cadet for the green eyeshade of a consummate  bean counter.
non_fbis_08.09.29-13319-27	neutral	He said ""history will judge"" how Mr. de la R? administration would be seen.
20020429_22.02.19-8239-4	neutral	Over 70 entrepreneurs from both sides attended the luncheon.
non_fbis_13.21.23-8227-6	neutral	''You spent a few extra days in Florida,'' NASA launch director  Mike Leinbach told Atlantis commander Mike Bloomfield moments  before liftoff.
20011007_03.17.23-6711-34	neutral	The Japanese aerospace industry has an ambitious plan to explore the planets.
20011218_21.00.30-21204-22	positive	For Brazil, the Fund intervened in October 1998, between two rounds in the presidential election, to support Fernando Henrique Cardoso's reelection because his macroeconomic options fell in line with the Fund's requirements, contrary to his leftist adversary, Luis Inacio ""Lula"" da Silva.
non_fbis_08.14.55-18533-11	neutral	Though the American forces are expected to be involved initially  in advising and training Filipino counterterrorist units, senior  American military officials have said they could become involved  in direct military action if the Philippine government requested  it.
non_fbis_12.22.23-26451-21	negative	""If I stay in Harare, I will not be able to vote,"" said Desire  Chikondi, an MDC party worker whose house was burned down this  week by ZANU-PF youth militia members and who is now hiding out  in the MDC's Harare headquarters.
non_fbis_04.33.07-17094-28	neutral	The MDC's lawyers are also studying the  possibility of legal action.
20011218_21.00.22-21144-2	neutral	The other has no other homeland than France, which does not, however, lead him to deny his heritage from ancient Israel (which contains, like all heritages, the best and the worst) nor to be indifferent to the destiny of those millions of Jews who have something in common with him.
20010916_21.24.32-9824-2	neutral	He said navy gunboats and helicopter gunships repulsed the initial attack and first reports indicated at least two rebel craft had been blown out of the water.
20020414_21.16.03-15717-0	neutral	Oil prices took a sharp downward trend after the quiet semi-coup d'etat by the American affiliated Venezuelan army generals who deposed the popularly elected president of Venezuela Hugo Chavez on Friday.
20011215_20.32.26-14925-10	neutral	Iraqi and Afghan immigrants followed them.
20020331_21.09.25-22686-13	negative	Sharon neither can nor will give up the occupied territories, and so he would be unmasked in the eyes of the whole world as the man standing in the way of peace in the Middle East.
20011220_21.22.09-18839-116	neutral	The decline in the size of the population is occuring due both to a natural decrease (287,000 persons) and to emigration (37,000).
non_fbis_14.05.39-25211-2	neutral	These individuals are  currently temporarily detained at the US base at Guantanamo Bay.
temp_fbis_21.03.47-22424-14	neutral	Under these circumstances, Taiwan and Japan both must recognize clearly the important role of the navy.
20010715_00.31.31-4544-8	negative	Lebatt told the media conference that deep divergences remained concerning the designation of delegates to represent DRC political parties, and those to represent the parties who signed the Lusaka agreement.
non_fbis_08.46.28-13637-60	negative	But that didn't stop the Mirror's  Stephen Moyes from method reporting by donning an al Qaeda rig.
20020219_20.45.06-11781-29	negative	Therefore, the Japanese Government will be forced to introduce diverse legislation for the purpose of giving cooperation for US military actions.
20020219_20.52.48-16582-4	neutral	Perhaps improvisation is a better indication of the inclinations and personal convictions of the President, because by improvising he is expressing what runs through his mind since the tongue is an extension of the heart.
20020111_21.05.06-7601-27	negative	Companies are urged in the proposed covenants to adopt measures which have an economic cost recovery period of less than five years or have an internal rate of return greater than that of a straight-lined obligation.
20011024_17.55.28-22100-11	negative	The US official told reporters traveling with Powell en route to Shanghai for an APEC meeting that he unequivocally denied the Washington Post report that said the Bush administration was considering such a move, specifically to allow sales of spare parts for mainland Chinese-owned helicopters as another weapon in the US war on terrorism.
20011230_21.17.41-25537-24	neutral	The result is a trade balance, in marked contrast to a balance of payments deficit burdened by servicing its debt.
non_fbis_08.47.00-17401-2	negative	Polar  bears will have less room to roam, crowding some of them out of  existence.
20020318_20.33.16-3417-0	negative	Islamabad, March 18, IRNA - Central Leader of Pakistan People Party (PPP) and former provincial minister of North-West Frontier Province (NWFP) Seyed Qamar Abbas has rejected US state department report on Human Rights in Iran and other countries, saying America has no right to make such a report as it is itself the violator of human rights.
20010718_00.42.54-29681-1	neutral	A written statement made by the company's China branch revealed that no glitches had been found in China since its last recall in 1999, Tuesday's China Daily reported.
20020121_21.31.10-15710-8	neutral	According to Medvedev, the main upgrading work included ""the replacement of the control system, improvement of design data, the determination of ecological measures at the first stage, and the improvement of the rocket-booster at the boosting unit's expense.""
20020122_20.31.55-8089-7	neutral	With its behavior, therefore, the United States is not only compromising the image of the war against terrorism as an expression of a higher form of justice, but also of itself as an unshakeable defender of this same justice.
non_fbis_06.21.24-4640-20	neutral	In the caves and  hideouts of al Qaeda operatives, we have found instruction books  on how to build chemical and biological weapons, detailed maps  of American cities and descriptions of landmarks.
20020128_20.50.06-12228-9	neutral	The center is responsible for implementing the main programs connected with Russia's participation in the International Space Station (ISS) project.
non_fbis_11.09.24-151-18	neutral	His aides  were informed of the gaffe, and he was whisked to another  station, where his name was listed.
20020205_20.21.49-25548-1	neutral	The word ""axis"" reminds me of the grouping of countries during World War I and II that were enemies of the Allies.
non_fbis_13.08.06-1812-19	neutral	The railcar  is needed to transport the space station's 58-foot robot arm  from one end of the outpost to the other as more girders are  installed.
non_fbis_13.44.36-19236-35	neutral	The European Union and the  United States have already imposed 'smart', selected sanctions  on Mugabe and 19 people in his inner circle.
non_fbis_12.16.50-28640-2	neutral	OTTAWA - The Commonwealth suspended Zimbabwe for a year  yesterday and called for new elections after concluding Robert  Mugabe had rigged recent presidential elections.
20020220_20.52.31-12963-7	negative	Other participants in the rally were some of the roughly 250 Israeli army reservists who have refused to serve in the Israeli-occupied Palestinian territories, Green Line: Students for Borders, the Meretz Party, Labour Party doves, the Kibbutz Movement, Netivot Shalom, the Bereaved Family Forum, Rabbis for Human Rights, Ta'ayush, Yesh Gvul and Gush Shalom.
temp_fbis_20.46.39-9348-8	neutral	Ambassadors from Middle Eastern countries immediately came and asked me what I thought of the President's speech.""
20020203_20.47.22-10067-6	neutral	That military alliance was powerful and constantly on a quest of expansion.
20011112_20.33.43-387-24	negative	While Ang-See's statistics, derived mainly from non-official sources, paint a grim picture, they should not be ignored.
non_fbis_04.24.14-26782-3	neutral	The Kyoto pact grew out of the Conference of the Parties (COP)  to the U.N. Framework Convention on Climate Change, which itself  came out of UNCED.
20010927_23.18.15-25073-28	positive	The Russian President has understood this American recognition.
20020212_20.42.04-19290-29	neutral	Three persons who were standing near him immediately asked him, almost in unison, at what price he was willing to sell.
20020324_20.48.23-2528-3	neutral	In Mexico, the last leg of His Majesty's tour, the King participated in the UN Monterrey congress on Financing Development, where he addressed the congress's opening session.
non_fbis_08.03.05-5625-0	negative	Argentina's Chaos Raises New Doubts on Monetary Fund
20020414_21.17.08-16542-5	negative	People are being killed in masses and buried in collective graves.
20020203_20.34.52-3092-11	neutral	President Bush is intolerant to the dissent to his policy of domination in total negation of the lofty principles of morality, ethic and democracy, which he assertively holds so dear to his heart.
20020404_21.30.26-14869-4	positive	""We support it.
20020204_20.24.49-8480-0	negative	Recently, US President Bush, in the State of the Union address he gave before Congress, recklessly picked on our country, saying we develop and possess weapons of mass destruction [WMD].
20011007_03.17.23-6711-9	neutral	In order to compete with the United States, Europe, and China, Japan decided to drastically reduce its costs, especially in every aspect of rocket design and manufacture.
20020415_21.33.22-7140-24	neutral	It is impossible not to wonder at the creators of the EU.
non_fbis_11.09.24-151-12	neutral	Inflation  is over 110 percent, unemployment at 60 percent, and hundreds of  thousands of people are going hungry.
non_fbis_08.09.29-13319-42	negative	Some aides to Mr. de la R?gued that  the federal government should seize Governor Ruckauf's Buenos  Aires provincial police force in order to control the rioting  that surged in the working-class neighborhoods that surround the  capital city.
non_fbis_05.22.13-11526-7	neutral	Security forces tortured opponents, ruling party militants  abducted people, and police arrested opposition supporters who  were themselves the victims of crimes.
20020517_22.08.22-24562-5	neutral	The committee said in a joint statement at the end of the  meeting that it will try to have the framework finalized at the  China-ASEAN summit in Cambodia at the end of this year.
20020315_20.21.54-4382-2	negative	After the 11 September suicide bomb attacks on the World Trade Center and the Pentagon, the United States, instead of investigating the matter and coming up with proof, put all the blame for terrorism on Afghanistan.
20010829_01.48.48-11084-19	positive	""I believe less than 10 per cent of Taiwanese now favour independence,"" he said.
20020320_12.04.49-21742-23	neutral	It is notable that the Commonwealth observer mission did not move again although the opposition had now joined them in the same hotel.
20020122_20.36.01-11616-8	neutral	These rules, laid down in the four Geneva Conventions, provide, among other things, for the protection of sick and wounded servicemen and prisoners of war.
20020111_21.05.06-7601-38	positive	Companies could be allocated rights on the basis of an energy efficiency standard, on the condition that they are prepared to accept an absolute emissions ceiling.
20010715_00.31.31-4544-12	positive	Lebatt said the facilitation team expected to draw up a final list of participants by August 6.
20011024_18.26.05-8627-3	neutral	In meetings with Japanese officials, Aziz will explain impacts of Afghan refugees flooding into Pakistan on its economy, they said.
20011007_03.17.23-6711-43	neutral	It is its national policy.
non_fbis_13.10.41-18948-7	negative	He hinted at a tougher policy against Mugabe,  saying that the European Union would review sanctions at an  upcoming summit meeting in Barcelona, Spain.
20020410_22.24.21-25298-2	positive	United Nations Secretary-General Kofi Annan, the European high representative for the common foreign and security policy (CFSP), Javier Solana, and the foreign ministers of Spain and Russia, Josep Pique and Igor Ivanov, on Wednesday called on Israel to ""withdraw immediately"" from all Palestinian areas that have recently been occupied and collectively expressed their full support to the Middle East mission US Secretary of State Colin Powell is going to undertake.
temp_fbis_20.57.35-19171-11	neutral	The objectives, as set out in the plan, are to ""slow down and then stop the growth in the emissions of harmful gases and, if scientific studies justify it, diminish them.""
non_fbis_08.12.40-1611-5	negative	U.S. officials said the administration may freeze assets of  Zimbabwean officials involved in the alleged rigging of the  democratic process.
non_fbis_08.03.05-5625-10	neutral	Hubert Vedrine, the French foreign minister, assailed the I.M.F.  for abandoning a longtime client and imposing ""demands that have  been excessive or at the wrong time.""
temp_fbis_20.23.33-17594-5	negative	The session of the United Nations Framework Convention for Climate Change held this time was to reach on an actual agreement regarding regulatory problems that have to be solved to put the ""Kyoto Protocol"" adopted in 1997 into force, so that the world may reduce the greenhouse effect and ecological damage, which are becoming more serious with each passing day, protect human lives and health, and provide favorable conditions for the promotion of human civilization.
20011130_12.36.18-4189-43	neutral	Fundamentally, the targets set by the Kyoto Protocol are far less than what actually will take to effectively curb global warming.
non_fbis_12.22.23-26451-10	negative	Observers and the opposition worry Mr. Mugabe, the country's  only President in 22 years of independence, is becoming  increasingly reckless in his attempt to hold on to power.
20011118_21.04.32-17074-17	negative	Every day an orphan is being created and I know the problem is enormous in the province.""
temp_fbis_20.41.29-25820-4	positive	They say that these captives not only receive humanitarian treatment, their religious belief is also respected.
non_fbis_11.30.45-27115-22	neutral	Gitmo's history is a storied one.
non_fbis_11.08.55-4179-34	neutral	``We don't anticipate any trouble with Mr. Castro,'' he said.
non_fbis_06.35.13-26224-19	negative	The TRA, adopted after Carter broke relations with Taiwan,  commits the United States to provide defensive arms to Taiwan  and to view a threat from China with ""grave concern.""
20020505_21.59.17-14271-13	neutral	This covered his training, that of a Belgian substitute and the cost of carrying two scientific experiments on board the Russian Soyuz rocket.
20020111_21.05.06-7601-10	neutral	In a nutshell, benchmarking means that companies compare their energy efficiency with that of similar plants abroad.
20020202_20.37.54-21168-75	negative	It will not be easy, of course, to drum up demand with the country in full-fledged default.
non_fbis_11.09.24-151-38	neutral	The court decided  Friday night to defer a decision until after the election.
non_fbis_08.14.55-18533-24	neutral	The rebels, who have been linked to Al Qaeda  in the past, are holding two American hostages for ransom.
20020315_20.42.17-18974-0	neutral	2 observer groups funded by EU
20020226_20.56.51-26264-0	neutral	No one expected the Israeli Government to issue its latest decision restricting President Yasir Arafat's movements and confining him to the city of Ramallah.
20020205_20.21.49-25548-5	neutral	He simply condenses his foreign policy for others to easily understand by distinguishing the evil from the good.
20020124_20.45.56-235-7	positive	For example, most of these groups have long urged the formation of an independent electoral commission to take charge of the preparations and conduct of the ballot, but are now reluctantly willing to accommodate Mugabe's partisan Electoral Supervisory Commission.
20020130_20.43.33-11456-0	negative	If the attack on the World Trade Centre was intended to be a warning to America to abandon its anti-Arab policies, the warning was not heeded.
non_fbis_11.08.41-17418-0	neutral	Zimbabwe's president is sworn in
20011221_20.54.40-10484-5	negative	Noting that the agreements signed in 1960 for Cyprus were considered as nonexistent by many countries, Denktas said that the international society treated the island as if it was a Greek Cypriot Republic and treated its Turkish partner as if it was a minority.
20020208_20.37.23-17648-12	negative	With this attitude, Sharon's government showed its true hostility for a leader and chairman elected by his people.
non_fbis_08.03.23-18607-4	neutral	The program he is to announce this afternoon would slow the rate  of growth in emissions in relation to the growth of the overall  economy.
20020320_20.36.59-7133-48	neutral	The basic principles of the Space Treaty 1967 oblige Australia as the launching state to open the possibility of humanitarian cooperation in the field of space endeavour.
non_fbis_05.20.33-11163-43	positive	Can you  point to any kind of tangible things?
non_fbis_06.29.16-13721-21	neutral	But for Washington, the whole point of the  detention is to conduct interrogations and thus head off new  acts of terrorism.
20011112_20.33.31-29984-24	neutral	The Organization of Petroleum Exporting Countries has agreed on three cuts in its production thus far this year, for the purpose of preventing the crude prices from becoming weaker.
20020220_20.52.31-12963-2	positive	Over 20,000 Israelis -- a record number -- rallied for peace in Tel Aviv last Saturday, the biggest demonstration by the reawakened peace camp since the current Intifada was unleashed in September 2000.
20020224_20.48.55-4975-8	negative	Bush redefined China as a ""strategic competitor"" and increased the sales level of arms to Taiwan.
