243	neutral	This is a win-win measure. It will save energy, cut emissions, bring down fuel bills for the most vulnerable in society and help the construction industry and SMEs in particular. We hope that the Council and the European Parliament will adopt this proposal without delay and that member states will move quickly to set up schemes to harness this investment.
455	neutral	She [Paltrow] has a certain public persona that she doesn't suffer fools gladly. Like on a movie set, if the crew is not ready when you call her, she gets incredibly angry,
1169	neutral	During the week of Red Nose Day, more than 19 million customers shopped with us, our highest number of weekly transactions outside of Christmas,
1291	negative	The costs of badly run NASA projects are paid for with cutbacks or delays in NASA projects that didn't go over budget,
1039	positive	We got Kevin Garnett sitting on the bench and I didn't want to look down there, because I wanted to put him in,
91	neutral	I don't know if there will be more talks with Netanyahu or where they will lead,
179	neutral	We had a meeting of the National Working Committee (NWC) of the party recently and there is nothing to suggest that Atiku Abubakar is not a member of the AC. He has not told us he is leaving our party. We asked him several times and he told us that he is still in AC.
327	neutral	In a nutshell, it is 11 years since the fixed-line business was supposedly open to competition. After 11 years, France Telecom still has an overwhelming position.
1288	neutral	A request for FBI assistance was sent through the US State Department. No decision has been made at this point,
23	positive	Bill Clinton has a matchless talent for bringing people together and inspiring them to work for a higher purpose,
482	neutral	I am deeply concerned by the decision of the Sudanese authorities to revoke the operating licences of a number of leading international NGOs. If these and all other international NGOs are no longer authorised to work in the country, then the continuation of humanitarian life-saving operations in Darfur will be in serious jeopardy. This can have dramatic consequences: the very lives of hundreds of thousands of people would be at risk as these NGOs provide a lifeline to so many innocent people. I urge the Gov
1350	neutral	My name is Peter Moore, I have been held here for nearly eight months now.
1433	neutral	More US and NATO soldiers are now killed in Afghanistan. Their tanks are destroyed and even helicopters are shot down,
1027	positive	Neil Young to play this year is a dream come true for me personally. He is one of my all-time favourites and we have always wanted him to play.
1390	neutral	Any changes to KFOR will only be made on the basis of a political decision by all allies. Such a decision will only be taken if all allies are assured that a possible reduction of KFOR will not jeopardize the safety and security of Kosovo. And that time has not come,
1473	neutral	Israeli tactics put Shalit's issue at risk,
1229	neutral	It will help them [Hughes and Clark] for the fact that they will get to play some cricket and probably get a good amount of cricket under their belt, but I'm not sure they'll learn too much about themselves or about the England Test team though by playing those few county games,
726	negative	How can David Cameron talk about fairness when he is still committed to a tax cut for millionaire's estates, won't back our 1.2billion help for the unemployed to get back into work, and wants to cut Sure Start?
297	neutral	It would be insane for the UK to take any of the Guantanamo Bay prisoners just because Brussels wants to cuddle up to President Obama. This is a classic case where the British Government should tell the EU where to go.
526	neutral	As the department of transport we are delighted that this is once again an accomplishment of an important milestone in fulfilling the Fifa requirements for the World Cup,
100	positive	Through sheer force of will Thatcher carried along with her not only her own government, but that of the United States as well.
994	neutral	The judge has dismissed an application by the state for leave to appeal against the judge's decision to grant Mr Bennett bail on condition that the judge does not believe that any court would change his decision.
194	neutral	I came to meet Mr Nawaz Sharif with an olive branch from the government, with a message from President Asif Ali Zardari that the situation demands greater reconciliation because Pakistan faces great challenges,
666	positive	Its main purpose is to emphasize the inextricable links with our homeland, with the colossal riches created by our ancestors which we are now responsible for. The great experience accumulated by the Orthodox Church during many centuries is of great value for the present day generation. This experience inspires and encourages people,
1178	neutral	Murr opposed the obstruction of the presidential elections. He supported Bkirki and its principles, which were violated. The development of his position led to rapprochement. However, this possibility does not mean that we authorized MP Murr to form alliances in the Metn. His vision of the [electoral] battle in the Metn is different from ours,
487	neutral	The European Commission wants the end of the technical negotiations in 2009. When ratification is concerned, there are various estimates. The Commission does not want to state a date
1223	neutral	According to the tradition cosmonauts arrive here before a space flight to drink some water from Gagarin's well-known well,
661	neutral	In the laws of crows there is no Supreme Court or Jirga system. They have one slogan and that is, blood for blood',
211	neutral	I've already tried David Coulthard and another friend with no response and then realised I should ask you.
250	neutral	The Ministry of External Affairs is going to take up with the US State Department the issue with the aim of stalling the auction,
1029	neutral	The ECB will continue to lower interest rates as much as possible,
1462	neutral	I have maintained throughout that I am innocent and that the (Scorpions) orchestrated a campaign against me and the South African Police Service to tarnish my image and the image of the (police) to further their own interests and to justify their continued existence.
1341	negative	It's great for us. Outside his circle of fans, Limbaugh has become one of the most disliked people in the USA.
827	neutral	The United States wants the Islamic Republic of Iran to take its rightful place in the community of nations. You have that right -- but it comes with real responsibilities,
749	neutral	I just said that the gas chambers were a detail of Second World War history, which is clear,
1527	positive	Why is the Israel Police not esteemed by some members of the public, unlike other bodies, and especially by some public servants... who attack the police and its investigators only because they fulfill their duty?
1360	neutral	Just the rumor of IBM potentially purchasing Sun creates an enormous opportunity because all of the Sun accounts are very concerned what will happen to the Solaris platform and Sparc microprocessor,
1489	positive	UNIFIL, in close coordination with the Lebanese Army, is doing its utmost to ensure security in the area at all times,
939	neutral	We are aware of the huge significance of the 15 April date for both Liverpool and their fans, and that is why we will do our utmost to make sure that the club does not have to play its Champions League second leg quarter-final match on that day,
380	neutral	I said [at a meeting chaired by President Victor Yushchenko]: Victor Andreevich you can urge us to sign it, but we won't sign this paper,
1393	neutral	While it is 100 percent an Afghan decision when the elections take place, from a technical point of view, this (date) works for NATO and ISAF (the International Security Assistance Force),
86	neutral	My position is the same, my position is not going to change. The Congress party candidate for prime minister is Manmohan Singh. What more can I say?
1579	negative	Our direct problem is not with the Free Patriotic Movement, but in the alliance and political line chosen by the FPM.
1541	neutral	But I was asleep! So he recorded a little answerphone message and Jack (husband Jack Tweed) played it to me,
397	positive	However, South Africa supported the decision of the African Union to defer the issuing of the warrant of arrest against President Al-Bashir by a year to give the peace processes in the Sudan a chance,
158	neutral	not convinced that the additional evidence provided by Radovan Karadzic [was] sufficient to undermine the extensive evidence supporting the trial chamber's findings
1585	negative	The purpose of our investigation is to establish whether any of the persons involved in the U.K. end of the operation are in some way implicated into the fraud perpetrated by Mr. Madoff,
339	negative	We are left to look back and say that Wagoner's appointment as both chairman and CEO in 2003 was little more than an act to ensure the dynasty of GM boardroom arrogance and failure continued,
1022	negative	The Common Agricultural Policy in its current form doesn't serve the best interests of the farming industry or consumers across Europe, which is why we've consistently pushed for far-reaching reform.
9	negative	After the partisan and divisive approach that President Bush took with judicial nominations, I appreciate President Obama's seriousness in making his selection,
454	neutral	The Indian doctors were screened and their qualifications checked before they left for the hospital. Their qualifications were approved by the Medical Council,
570	neutral	I am happy to announce the alliance. We would campaign together for the upcoming Lok Sabha elections,
1466	neutral	right from the very beginning that the truce and Shalit would be separate tracks
48	negative	We have long argued that banks should be required to put aside capital in the good times to deal with the bad. 'It is a shame the regulatory system created by Gordon Brown failed to ensure this, so the banks failed to fix the roof when the sun was shining.
1294	neutral	Scott is an exceptional astronaut who has served NASA and the Astronaut Office with distinction during these past 17 years,
539	positive	Our generation has so much to take on our shoulders when His Holiness passes. The Dalai Lama has unified the hearts of all Tibetans,
1486	neutral	The United States finance minister, Timothy Geithner, rang me to announce Washington's interest on March 13, about five hours after the Swiss cabinet announced its plan to ease banking secrecy,
969	neutral	We all agree it was important that this takes effect at the next European Council in March. We will take a decision,
895	neutral	With this arrest warrant, the International Criminal Court has made Omar al-Bashir a wanted man,
381	negative	You don't want to know! I had a good time, the vodka, the women - you know - I don't sit in my hotel room like Tom Cruise, believe me!
19	neutral	When I came out of maternity leave, I met Nicolas Sarkozy and we talked about my future. He convinced me that political involvement exists in different forms,
1581	neutral	It is necessary to say that I didn't have any public or private interview or talks with media during this week as I was busy all the time with participating in the Economic Cooperation Organization (ECO) summit in Tehran,
153	neutral	I think this a reaction to what happened in the elections last year. Even though Chavez's party did well, it lost the big states,
1572	negative	We live in a democracy but I note from the Standards in Public Office Commission today that it expects everyone to live by the same rules as everyone else and I hope that whatever incomplete information he [Ganley] was able to give so far will be given.
735	negative	The appointment of Dennis Ross, whose track record shows his unacceptable radical viewpoints about Iran, is inconsistent with Mr. Obama's claims about his willingness to create change in Iran-US relations and contains no positive messages for Iran,
184	neutral	It will be an interesting match against Roddick,
117	negative	My daughter is 18 months old and if you asked me what will happen first -- will she get her pension or will Zuma be prosecuted -- I will say she will get her pension.
1112	neutral	I arrived in Indian Wells earlier this week and I am eager to get back out on court,
99	negative	I'm delighted that the environment ministers have basically defied president Barroso and upheld the rights of individual countries to maintain their GMO bans,
1011	neutral	Could he really have believed that we wouldn't attack at the San Siro?
464	negative	Terrorist activities of the Taliban, Al-Qaeda and other extremists are constantly mounting and undermining the basics of the Afghan statehood and impeding stabilization and restoration. Specific concern is caused by the fact that terrorists actually control several regions of Afghanistan and form parallel bodies of authority there,
1284	neutral	ECOWAS is concerned about what has just happened in Guinea-Bissau,
1059	neutral	He flies off to Los Angeles tonight to be on the Jay Leno show,
1469	positive	This government must not clear its table before Shalit is back home,
1412	neutral	Secretary Gates will not be traveling to the NATO Summit next month as originally planned,
913	neutral	I think that the best way to judge movies is, like, 10 years after they're released. I think they should actually do the awards that way. I think they should have done the Academy Awards this year for movies from 1998,
954	neutral	In the case of Zimbabwe, it is important to note that we would need to do a lot in terms of fully repaying what we owe the IMF, the World Bank and the African Development Bank,
839	neutral	This is a positive move, which I hope now draws a line under the debate and allows the British Olympic Association to move forward with planning for 2012.
244	neutral	&gt;People's Party. T he Chairman of the EPP-ED Group, the largest parliamentary group in the European Parliament, Joseph Daul MEP, has congratulated his former colleague. V aldis Dombrovskis has undertaken the challenging task of heading the government at one of the most difficult times when many countries in Europe and elsewhere, Latvia included, are facing new challenges on how to find effective solutions and make difficult decisions to overcome the current economic crisis. I am sure that in his new positio
1332	neutral	Rush Limbaugh is an entertainer,
1147	neutral	the overwhelming majority of casualties were Hamas operatives and others who were, under international law, legitimate targets.
1365	neutral	Let me say that for the first time, the National Assembly approved about $1 billion for domestic gas production in the 2008 budget, while $1.5 billion was approved in this year's. At the National Petroleum Investment and Management Service (NAPIMS) corporate headquarters in Ikoyi, Lagos, the NNPC chief commended the agency for being on course in spite of the challenges facing the sector and urged the agency not to relent on its efforts because its activities affect the country's entire oil and gas industry.
71	neutral	You know the secretary-general (Jaap de Hoop Scheffer) has said recently that Iran should be involved in a regional approach in regard of Afghanistan.
284	positive	President Barack Obama's approval rating is solid, compared to the historical record of new presidents,
4	positive	We're invited to comment on the events of the day and along the way, we remind people that there was, indeed, good news under President Bush,
451	negative	Fatah is still deceiving and it doesn't meet its obligations, it released 45 of our prisoners in West Bank but arrested 39 new people,
1352	positive	We view our partnership with Microsoft as key to delivering solutions on a scalable level to a community of more than 190 nations and the UN system as a whole,
1162	neutral	It is testimony that next time, we should go to something more complete in order to prevent the rearmament of Hamas,
717	positive	By a long way it is Ferguson's best squad. I really do believe that potentially this is best team that Manchester United has had,
307	neutral	I don't know that they've arrived at any final conclusions on which President Obama has signed off on, but their thinking is now very close to the conclusion of the process.
840	neutral	It is the law of the land and it cannot be altered for anybody. Sidhu's case was far different from Sanjay Dutt.
1500	positive	United together, we can and will make a difference. I am pleased to offer my support of Earth Hour and am encouraged by the World Wildlife Fund's sustainability initiatives. Earth Hour heightens awareness and brings hope to the preservation of our shared planet's precious environment today and for generations to come,
314	neutral	I heard from the president (Obama) that he wanted to improve relations with Russia,
705	neutral	The Afghan National Army's commandos and soldiers are taking the lead in Afghanistan's health care. The welfare of the Afghan people is uppermost in the minds of the country's security forces,
1537	neutral	Bastrykin praised highly the joint work of the SKP main investigation department in the Southern Federal District, the Federal Security Service and the Interior Ministry, which unmasked all members of the criminal group involved in the foresaid crimes. Three of them were arrested. Another six were put on the international wanted list,
644	neutral	It is our privilege to welcome the Arabian Gulf Adventure team and play host to these magnificent vintage cars. 'I am sure vintage vehicle owners in the UAE, and there are thousands of them here, will relish the opportunity to get up close to some of the most rare cars that Rolls-Royce has rolled out since its inception when the first model emerged in 1904.
221	neutral	I don't have a comment. If they (Tsvangirai and the Ministers of Home Affairs) have spoken at that level I can't comment,
511	neutral	When we gave the 2002 World Cup to South Korea and Japan there were sporting and political reasons to share it,
450	neutral	Fatah tries to draw Hamas to recognize the Israeli occupation by putting pressure on us that the commitments of the Palestinian Liberation Organization (PLO) must be respected,
1440	positive	We need Russia for the resolution of European and global problems. That is why I think it would be good for Russia to join NATO,
1414	neutral	The radar will be there. If it is there later, it does not matter, it is a project that has a European dimension, NATO dimension, and in this sense I do not expect Obama to make any breakthrough negative statement,
1030	neutral	If the (economic) situation worsens, the ECB is ready to reduce rates further, even to zero,
218	neutral	Mr. Tsvangirai has other commitments, as far as I know,
425	positive	I believe the PKK will accept the wish of all Kurdish parties, laying down its arms and putting an end to violent action,
707	neutral	I have prepared a legal proposal that would explain and clear the Presidential immunity, as it is improperly defined by the Constitution. Due to the decision of the High Court of Cassation and Justice in the Mihaileanu case, the Romanian President is the only citizen that benefits of total immunity and cannot be sanctioned as no legal charges may be filed against him. The draft law is intended to confer the President the status of a Romanian citizen, who has equal rights to all the others. I want to offer B
31	neutral	Certainly, the crisis is a problem, but as Prime Minister Putin said, there will be no tragedy,
1242	neutral	OPEC will review the oil market at the Vienna summit and will decide about its production policy in view of the world economic growth in this year and 2010,
298	neutral	 to debate me on the issues. Let's talk about free markets versus government control. Let's talk about nationalizing health care and raising taxes on small business.
1152	neutral	There was an agreement through the Egyptian mediator that Israel releases 450 Palestinian prisoners whose names were submitted by Hamas in exchange for Schalit,
1033	neutral	We expect the ECB to cut interest rates by a further 50 basis points to one percent in April,
1372	positive	We will serve the nation more when our own party comes into power, but before that we are announcing cooperation with the People's Party to change the destiny of the nation,
1239	neutral	We will now contest in 28 out of 40 seats in Bihar as per our seat sharing pact with the Lok Janshakti Party (LJP). We will work to defeat communal forces,
1555	negative	By separating the elections for Bulgarian Parliament from those for the European one with the motif that the voters will become confused, the Bulgarian Socialist Party (BSP) and the Turkish Movement for Rights and Freedoms (DPS) insulted their electorate much, much more. Isn't this a direct admission that people who vote for BSP and DPS cannot ever read the ballots?
507	neutral	It's vitally important that first and foremost not only do we qualify for the World Cup, but it's imperative that we qualify for the Asian Cup,
481	positive	The European Commission has always been a strong proponent of equality between men and women.The European Union also has a vital role in promoting these values at a global level. Equal representation of women and men in power is a precondition for truly effective and accountable democracy and lasting economic prosperity
104	negative	We came here 10 days ago to be a reminder that this window is closing and to bring the matter to a public test. We hoped that Prime Minister Ehud Olmert would take advantage of his last days in office to bring Gilad home. Unfortunately, we were wrong,
349	neutral	Here we are six months after the Wall Street bailout began and it's still the case that almost no loans are being made to (ordinary people on) Main Street,
1161	neutral	There is a drop in rocket attacks and only one rocket from a small organization was fired in recent days. There are two reasons for this: Hamas is not interested in an escalation that will result in another confrontation with Israel, Hamas is making arrests before attacks are carried out. Also, Hamas signed an agreement with the Islamic Jihad saying it would avoid such attacks in the near future,
245	neutral	In 12 weeks' time, the people of Galway, along with people from Malin Head to the Shannon estuary, will cast their ballots to choose the people who will represent them in the European Parliament for the next five years.
422	negative	I called Mihai, I talked to him; he said that certainly, if the offer comes from the party leader, then he agrees. I talked to Mircea Geoana, and he said that he would contact him, in a first stage. I found out, after a week, talking to Mihai, that he had not been contacted by anyone,
533	positive	There's no doubt that life without the Dalai Lama, in the current state we're in, would be a terrible blow,
561	neutral	I have not made any decision about joining the BJP or merging my party with BJP. In return (of support), I neither want any seat (in the Lok Sabha polls) nor do I want to reach any understanding,
1446	neutral	&gt;Rangeen Dadfar Spanta addressed the media with Canadian counterpart Lawrence Cannon , whose government pledged 21 million Canadian dollars ( US$16 million ) to help rule of law in the militant-infested country. Afghanistan is determined to take more responsibilities in the fight on terrorism,
838	neutral	Transport and other related logistic problems still continues to face Africa and Bollore Africa Logistics is out to render support to that effect. The company is committed towards the development of the country economically and its infrastructure. We are strengthening our operations in many countries such as South Africa, East Africa, China, USA, Dubai, Maghreb, Middle East, among others. The company is also expanding its business in oil, gas, mining and telecommunication
1028	neutral	With revised ECB staff forecasts set to reflect both the weaker GDP outlook and more benign inflation, the euro looks set to remain on a weakening trend over the coming months,
49	negative	Central to Gordon Brown's attempt to draw a political dividing line with the Conservatives in the run up to the Budget, has been his claim that the whole world is signed up to yet more debt-funded fiscal stimulus.
1044	negative	Perhaps Sir Reg should be clarifying the Ulster Unionist position on the behaviour of those associated with the RBS, given the bank's ownership of the Ulster Bank.
1077	neutral	(Mathis) got more (TV) time than me and Bosh,
285	neutral	My theory is they would rather have the argument with Rush than with the congressional Republicans over the substance of the stimulus, the omnibus or the Obama budget,
277	neutral	The people we are fighting in Afghanistan, and the people they are sheltering in western Pakistan, pose a direct threat. Those are the men of 9/11, the people who killed Benazir Bhutto,
741	neutral	Peace... is a common and enduring goal for all Israelis and Israeli governments, mine included. This means I will negotiate with the Palestinian Authority for peace,
544	neutral	If the Dalai Lama doesn't come, I'm not going ... I'm very disappointed,
760	negative	I don't think it's appropriate that the taxpayer should be providing any more benefits to Fred Goodwin.
1216	neutral	national elections held no earlier than 20 August will allow ISAF to provide the right security conditions in support of the [Afghan National Security Forces].
