20020303_21.09.29-14261-0	neutral	COOLUM, Australia, March 3 (AFP) -- Hopes of a breakthrough in the Commonwealth's bitter deadlock over Zimbabwe rose Sunday as Canada sought to resolve the row after African nations accused Britain of neo-colonialism.
temp_fbis_22.34.58-23977-4	negative	""China has always resolutely opposed any form of official exchanges or military intercourse between the United States and Taiwan,"" Zhang said.
20020224_20.56.08-8888-3	neutral	Fabius says he sometimes has ""the feeling that they believe countries are poor because they want to be.""
non_fbis_08.03.05-5625-6	negative	Treasury Secretary Paul H. O'Neill came into office publicly  denouncing multibillion dollar bailouts, saying that either they  fail outright or they allow foreign governments to get away with  bad policymaking and investors to get away with bad bets.
temp_fbis_20.41.29-25820-35	negative	Thus, the United States cannot simply consider this issue as ""contradiction between the enemy and itself,"" it must also consider international relations.
20020303_21.11.57-16690-9	neutral	Mkapa reiterated that quiet diplomacy was the correct route to follow, a view shared by his other Southern African Development Community colleagues.
non_fbis_15.08.17-13301-1	positive	If you want a holiday in space and have the means to pay for it,  Russia offers you the trip of a lifetime.
temp_fbis_21.28.50-13504-35	neutral	In the camp, life is regulated by prayers (five times a day, the only freedom allowed) and by searches.
20020218_21.01.07-18921-2	neutral	Bush arrived in Japan Sunday at the start of a three-nation Asia tour that will also take him to South Korea and mainland China.
non_fbis_08.01.38-4843-10	neutral	Washington  joined in the bailout.
20020315_20.42.08-18791-32	negative	However, since this threat was made several months ago, the European Union and the United States have failed to produce any evidence that President Mugabe had such foreign assets.
20020207_20.23.00-14747-11	neutral	Where is the evidence?
20020507_22.11.06-28210-4	negative	""I feel very strongly for these people,"" Mr. Tsvangirai said.
non_fbis_08.46.28-13637-6	negative	If we're not happy, that goes double for our public affairs  babysitters.
non_fbis_08.47.00-17401-23	negative	This could lead to a two-tier system in which  the US and a few others - Australia and Canada may follow suit -  will choose their own targets, while the rest of the world will  be limited to the stricter Kyoto limits.
20020406_21.13.43-28244-6	negative	On the contrary, it prepares the ground for further hatred and a further escalation of the violence.
20020131_20.50.32-16604-16	negative	According to his own assertions, the obvious concern of some Western European leaders -- US allies -- and of some important European governmental and non-governmental institutions about the treatment the detainees are being subjected to, especially following the publication of certain images of the Guantanamo Bay camp that could be interpreted in various ways, played a key role in this position.
non_fbis_04.51.05-27505-7	neutral	In addition, it said, Pakistan also ratified ILO Conventions 100  on equal remuneration and 182 on the elimination of worst forms  of child labour.
20020411_22.23.02-12197-2	negative	For some time, European politicians have threatened to suspend economic ties with Israel -- a move, which in light of close and extensive trade relations between EU member states and Israel, could cause serious damage.
20010713_00.42.05-29788-5	neutral	The publication quoted Wu Guoguang, a professor at Hong Kong University, as saying that any concessions by Washington on the Taiwan issue could trigger a defection of its Asian allies, including Japan, to Beijing's fold.
20020423_21.35.03-11178-1	neutral	Announcing this at a news conference, Mr Sunil Mittal, Chairman &amp;amp; Managing Director, Bharti Enterprises, noted that the tariffs, which would be made available on its ILD [international long distance] services being launched on May 1, would be revised downwards as and when the market demanded it.
20020103_20.35.17-19238-0	neutral	Taipei, Jan. 3 (CNA) -- Premier Chang Chun-hsiung expressed alarm Thursday at reports that a legislator was kidnapped and held for three days in a Taipei hotel, saying that his government will do its utmost to stop gangsters from preying on lawmakers.
20020122_20.36.01-11616-27	neutral	Moving the captives to the Guantanamo Bay military base on Cuba is rightly whipping up a storm of protest.
non_fbis_08.14.55-18533-17	neutral	Military officials also said John Walker Lindh, the American who  was captured with Taliban forces near Mazar-i-Sharif, was not  among the prisoners transferred today.
non_fbis_04.33.07-17094-26	positive	The Commonwealth trio to decide on action next week is made up  of Australia, which will back suspension, the South African  leader, Thabo Mbeki, and the Nigerian president, Olusegun  Obasanjo.
temp_fbis_20.53.10-15177-27	negative	He indicated that settlements have emerged as military bastions and bases for launching attacks against Palestinians during the intifadah.
non_fbis_15.11.50-23748-19	neutral	He showed journalists  proof of his statement: a president's belt, a symbol of power  that did not belong to Hugo Chavez.
20011228_21.19.00-22108-2	negative	The French head of state, who is spending the seasonal holiday at the Bregancon fort in the Var [department], took the initiative of telephoning his Pakistani opposite number to convey ""his very strong concern at the rising tension between India and Pakistan"", the same source said.
20011218_21.00.30-21204-15	positive	Unconditional Support
20020111_21.05.06-7601-13	negative	Belgian industry is advocating benchmark covenants because it is afraid that an absolute limit would weaken considerably its competitive position with respect to similar companies in regions where the Kyoto protocol is not ratified.
temp_fbis_21.03.47-22424-53	neutral	There would be no difference between Taiwan announcing independence to the outside world and the current situation.
non_fbis_06.44.52-19992-86	neutral	He can't make a plan.
20011218_21.00.22-21144-34	neutral	The other solution is the opposite of the first one: the departure of the Israelis to more hospitable climes, in the United States or Europe.
20020204_20.24.49-8480-25	negative	Nevertheless, Bush is impertinently picking a quarrel regarding our Republic by saying this and that and viciously spoke ill of the DPRK.
non_fbis_11.30.45-27115-19	neutral	And, he said, neither he nor Marine Brig. Gen. Michael Lehnert,  commander of the prison project, are considering the evacuation  of sailors' wives and children, some of whom live not far from  Camp X-Ray.
20011127_21.22.54-17837-7	neutral	This special commission investigated the Sabra and Shatila events in 1982-1983.
non_fbis_12.30.38-25095-23	neutral	""So it's very important for us to  get back up to that crew size of six or seven.
20020114_11.18.53-27931-29	neutral	Among the other members of Misuari's defense team are former Integrated Bar of the Philippines president Arthur Lim, former Court of Appeals justice Omar Amin, former labor relations commissioner Musib Buat, Salvador Panelo, US-based Elly Pamatong and former ARRM solicitor general Jose Lorena.
20011220_21.22.09-18839-47	neutral	The volumes of interoblast and international hauls by motor transport continue to grow.
20020314_20.41.01-29272-7	positive	""The people of Zimbabwe have re-elected you because you have been same (consistent) in defending their inalienable rights to their country's freedom, democratic and sovereign government,"" Mkapa said.
non_fbis_06.21.24-4640-3	negative	The chronic complainers are outraged by, of all things, the  treatment of the captured Taliban and al Qaeda terrorists being  detained at Guantanamo Bay, Cuba.
non_fbis_05.20.33-11163-46	neutral	There are things I would point to.
non_fbis_15.12.22-6729-4	neutral	This information was disclosed by a NASA representative  at the Russian Mission Control.
non_fbis_14.06.39-26143-34	positive	The pundits in Ottawa, it seems, have saved all of their praise  for John Manley, the new Deputy Prime Minister and a hometown  favourite.
non_fbis_15.16.19-1897-8	neutral	Then, they will  examine the docking unit from within.
non_fbis_12.44.14-20223-29	negative	White House spokesman Ken Lisaius rightly noted of the Club  Gitmo guests that, ""for the most part, they're members of al  Qaeda and if they were free, they'd engage in murder once  again.""
20020320_20.36.59-7133-24	neutral	These UN Conventions are the Treaty on Principles Governing the Activities of States in the Exploration and Use of Outer Space including the Moon and Other Celestial Bodies 1967 (Space Treaty 1967), the Convention on International Liability for Damage Caused by Space Objects 1972 (Liability Convention 1972), and finally, the Convention on Registration of Objections launched into Outer Space 1974 (Registration Convention 1974).
20011218_20.35.25-594-15	neutral	According to 2000 vital statistics released not so long ago in the United States, one out of four residents of the suburban areas was an ethnic minority.
non_fbis_06.20.40-8369-15	neutral	Terrorists dressed to pass like  these were often shot right on the spot during World War II and  the Korean War.
20010718_23.47.18-27024-6	neutral	According to military experts, it is possible that clashes will resume between the Taleban and UIFSA forces in various regions of Afghanistan in the next few days and weeks.
non_fbis_12.09.12-23643-20	neutral	""You have to be realistic about the nature of the potential  threat that the prisoners who have been transferred to Cuba  represent,"" says Attorney General, Darryl Williams.
non_fbis_13.44.36-19236-27	neutral	Bush's secretary of state, Colin Powell, earlier concluded: ""Mr  Mugabe may claim victory, but not democratic legitimacy.""
non_fbis_08.12.40-1611-4	neutral	He also denied entry to those who received ""significant  financial benefit"" from dealings with Zimbabwean officials who  carried out Mugabe's policies.
non_fbis_06.39.11-29583-6	neutral	GCEP, an agency operating under the Ministry of Municipal and  Rural Affairs and the Environment, is the country's point of  reference for environmental pacts.
20020212_20.42.04-19290-28	negative	""To sell dollars I have to stand in this line for two hours or so,"" shouted Alberto, a laboratory executive.
20020125_20.19.13-15223-5	neutral	The inmates had typically been brought to Cuba in shackles and handcuffs, wearing blacked-out goggles, earmuffs and surgical masks to keep them from biting.
20020306_15.20.41-10497-9	neutral	""East Turkestan forces are participating in and fighting with the Taliban, this is a fact known to all, they are a component of international terrorist forces and a target of international forces fighting terrorism,"" he said.
20020206_20.31.05-16359-2	positive	He added: ""We are prepared to initiate a dialogue, and we want to work with our friends and allies in the world on ways of dealing with such regimes.""
20011016_22.25.44-26373-11	neutral	Syed Hamid said critics must also accept that the war against terrorism could affect civil liberties.
20020218_20.45.17-5753-40	negative	""America's rulers have proved that they cannot be trusted,"" he said.
non_fbis_12.46.57-22041-53	neutral	At the camp, Marine engineers saw and  hammer away as an interrogation centre and new cages are  finished.
temp_fbis_20.43.16-10786-19	negative	However, after a brief period of shock, Bush resumed his solitary road, as he clearly demonstrated in his State of the Union speech, in which he threatened the ""Axis of Evil"" countries (Iran, Iraq, and North Korea) without consulting the Europeans and Japanese, who do not necessarily agree with the appropriateness of antagonizing the governments of those nations.
20020121_21.29.47-14352-4	neutral	The money will mainly be used for the construction of 27 key projects in the fields of water conservancy, energy, transportation and environmental protection.
non_fbis_09.35.06-27851-4	neutral	""This is a terrible period, not only for Zimbabwe but for those  who hold the course of democracy dear in Africa and elsewhere.""
20010926_23.12.52-21900-5	positive	The MOFA spokeswoman affirmed that from the angle of Eastern and Western cultural exchanges, the sponsoring of similar conferences will be instrumental to mainland Chinese people's better understanding of Catholicism and its contributions to Chinese society.
20020111_21.05.06-7601-16	positive	Those covenants contain insufficient guarantees in themselves to achieve the Belgian/Flemish reduction targets in an economically efficient manner.
non_fbis_06.44.52-19992-92	neutral	""They  didn't know if we were going to take care of them, hurt them or  kill them.""
non_fbis_11.30.45-27115-13	positive	And I can't speak for everybody on the  base but I think most people are glad to be part of it, excited  by it.''
20020314_20.40.44-29118-14	positive	""We want to come up with policies that will result in the creation of more jobs for the youths and those leaving school and colleges.
20020415_21.33.22-7140-20	negative	For example, South America is not a good neighborly field, and therefore, all regional countries are suffering from difficulties.``
20020303_21.11.57-16690-3	neutral	It is not evolving in Coolum.
non_fbis_12.08.27-27397-41	neutral	On the streets of the capital, where Mr. Tsvangirai found his  greatest support, there was no sign of revolution brewing.
temp_fbis_21.03.47-22424-41	neutral	During the Second World War, Germany fired 7,000 V1 and V2 missiles at England and England did not surrender.
20020320_12.04.40-21590-27	negative	The United States, Britain, local Zimbabwean observers, and the Commonwealth observer team also described the poll as not free and fair.
temp_fbis_20.53.10-15177-15	negative	Taysir Khalid explained that ""the Palestinian intifadah has raised the settlement issue anew--one of the causes of the intifadah--in unprecedented force as a basic element and condition for reaching any solution.""
20020203_20.46.36-9539-7	neutral	ers ""rogue,"" the situation is a bit clearer. The issue is that compared with the remaining part of the blacklist (Libya, Syria, Sudan, and Somalia), this trio has made the greatest progress in its effort to obtain missile technologies, as well as chemical, bacteriological, or nuclear weapons.       ""States like these, and their terrorist allies, cons
non_fbis_11.14.49-23456-9	negative	Iraqi Vice President Taha Yassin Ramadan, responding to Bush's  ``axis of evil'' remark, said the U.S. government ``is the  source of evil'' in the world.
20011207_21.20.02-17431-13	negative	The US military will not say how many troops they have brought to the base but their presence has already provoked an armed incident.
20011116_20.44.27-28756-31	positive	Also contributing was the excellent technical preparation and mature action of the Brazilian delegation, which consisted of experienced negotiators.
20020306_15.02.54-18922-9	negative	It seems that America's unilateral policy does not identify any limits for itself.
20011220_21.22.09-18839-34	neutral	Average prices for farm products sold through all channels during the first ten months of 2001 grew by 8% as compared with the same period in 2000, including animal husbandry products -- by 42%, while the prices of crops dropped by 7%.
temp_fbis_21.10.31-12974-24	positive	In addition to the suggestion from the sixth continent, it is a good idea to recall the Great Flood, which has been depicted, apart from the Bible, in many of the world's mythologies: ""What was it?
20020423_21.45.36-19604-1	neutral	During the workshop, organised by the Union of Arab Banks (UAB), participants will also review legislation Arab countries have introduced to combat this phenomenon as well as the ways and means by which money is laundered.
20020314_20.23.54-19638-21	negative	In February, the European Union [EU] stepped up its moves to bluntly criticize and oppose the ""axis of evil"" rhetoric.
20020207_20.23.04-14788-71	negative	""The country would be badly militarized when 90 percent of the soldiers in public posts of the present administration are retired soldiers who, according to the constitution, have recovered 100 percent of their citizen rights.
temp_fbis_21.10.31-12974-115	neutral	Gangster species are appearing, such as the locust, which is moving toward the north, where it has never been before.
20020315_20.42.08-18791-31	neutral	As events unfold in Zimbabwe and the will of the people is realised with the election of Cde Mugabe, a senior State Department official said Washington was now expected to freeze any assets held by President Mugabe and his close associates in the United States.
20020224_20.56.08-8888-15	neutral	Manicheaism comes to us from late antiquity thanks to Manes, the religion's founder.
non_fbis_08.05.55-10723-1	neutral	WASHINGTON, Jan. 22 - Frustrated by an international outcry over  the American treatment of prisoners in Cuba, Secretary of  Defense Donald H. Rumsfeld defended the United States' conduct  at length today and dismissed the criticism as breathless  armchair hyperbole.
20011125_21.01.04-6923-21	positive	But the Prime Minister's official spokesman today said Tony Blair was pleased with the progress that had been made on the military, diplomatic and humanitarian fronts.
non_fbis_08.09.29-13319-12	neutral	While such a move would lower prices and spur growth by making  the country's goods more attractive, it could also prove ruinous  to millions of borrowers and to the nation's banking system  because most loans in the country are repayable in dollars, not  pesos.
20010927_23.18.15-25073-6	neutral	These countries are Tajikistan, Uzbekistan and Turkmenistan.
20011024_17.55.28-22100-2	positive	Kao said US President George W. Bush's trip to Shanghai is mainly to attend the annual informal leadership meeting of the Asia-Pacific Economic Cooperation (APEC) forum to seek expansion of the anti-terrorism coalition.
20020424_21.45.56-26903-11	neutral	Industrial output has fallen by a cumulative 3% since mid-2001 and 10% since the beginning of the security disturbances in late September 2001.
20020122_20.32.32-8613-5	neutral	The photos were sent voluntarily to the press by the American authorities, who clarified that they depicted a group of 20 dangerous prisoners who had recently arrived at the base and undergone a process of identification prior to their confinement.
non_fbis_12.04.00-12904-22	negative	""Obviously I'm worried.
temp_fbis_21.07.24-28603-8	negative	The ""three nos"" include no support for an independent Taiwan; no recognition of ""two Chinas'' or one China and a separate Taiwan; and no support for Taiwan's entry into international organizations that require members to be states.
20011024_20.04.50-29091-10	neutral	Sharon's deceptive ploys cannot negate the fact that President Yasser Arafat and the Palestinian National Authority have and are still, even while under attack, doing their utmost to demonstrate their unambiguous commitment to stop violence, maintain the ceasefire, and get back to negotiations.
non_fbis_15.29.53-18099-7	neutral	The PJ (Peronist) will receive 39 of the 72 seats in the High  Chamber against 25 of the Government Alliance (of President de  la Rua).
20020314_20.23.54-19638-46	positive	In a rally held in Syria, activists emphasized that ""we will continue to strengthen our solidarity with the Korean people and always stand with them in the same trench steadfastly.""
20020218_20.45.17-5753-13	negative	But his tough stand on P'yongyang has provoked concern in Seoul, where President Kim Tae-chung, who is in the last year of his five-year term, has been trying to prise the hermit state out of isolation.
20020419_21.47.55-9546-15	positive	Since the United States ""supports democracy,"" then why did Maurer have that meeting with Rincon?
20020125_20.20.40-16093-2	neutral	Annan, paying the first visit to Afghanistan by a UN chief in more than 40 years, acknowledged factional differences that had held up the naming of the group.
20020208_20.29.29-13302-28	negative	Powell said Chavez was aware of the complaints.
20020119_21.16.53-1351-6	neutral	Clwyd said the purpose of meeting Farish was to ""to voice concern about the treatment of all the people taken prisoner in Afghanistan, not just the ones being held in Cuba, and we want an acceptance that they are prisoners of war.""
20020306_15.01.39-17844-1	negative	Recently, North Korea strongly denounced comments made by U.S. President George W. Bush during his Seoul visit last month accusing the North Korean leadership of starving its people while developing weapons of mass destruction.
20020207_20.23.04-14788-61	negative	Concerning Plan Bolivar 2000, the bulletin points out that Chavez has used the FAN for tasks that are not appropriate or that must only be carried out in cases of emergency.
non_fbis_08.11.35-9355-1	neutral	CARACAS (AFP) - Here are the main events of the crisis that  shook Venezuela over the past six days, in which at least 41  people were killed and 323 were injured:
20020311_21.42.46-13715-12	negative	Although, of course, these super-rigid activities are to a great extent warranted, the State Department notes.
20020403_20.59.27-22386-17	positive	Dr. Abdullah presented best teacher award and appreciated the performance of student artists who presented cultural items.
20020128_20.46.06-8042-23	neutral	Taiwanese authorities concerned forced a Taiwanese NGO to change the word of ""China"" in its English annual.
non_fbis_12.09.12-23643-12	neutral	""Jack Straw was very strong about this in a way our  government has not been,"" says Mr. Melham.
non_fbis_06.29.16-13721-4	neutral	But though it may lack tennis courts and a putting green, the  amenities are better than you'd find in a cave at Tora Bora.
20020131_20.50.32-16604-8	neutral	And, most of all -- this is a very important detail in this case -- the Convention forces the country that holds prisoners of war to release them immediately when the conflict is over.
temp_fbis_21.39.02-16166-1	negative	Apart from criticizing the ""axis of evil"" countries for abusing human rights, it also listed abuses in several countries that are members of the anti-terrorist alliance.
temp_fbis_21.37.33-17834-5	neutral	He pointed out that U.S. President George Bush's decision to sell arms to Taiwan last April was made to avoid an imbalance of cross-strait military force by 2005 on the one hand and to further safeguard Taiwan's democratic achievements on the other.
20020106_20.26.14-23928-5	negative	By clarifying the Imam's edict the Islamic Republic of Iran made the people of the world understand that insulting the Prophet was in fact violating the rights of millions of people throughout the world.
non_fbis_12.22.33-10622-24	neutral	No one knows the impact  on Canada's international competitiveness, when China, India,  Brazil, and Indonesia are not committed to reduce anything.
non_fbis_05.22.13-11526-22	neutral	Police declared the meeting with about 35 ambassadors and  members of their staffs illegal under new security laws  requiring police permission for political gatherings.
20020415_21.33.22-7140-37	neutral	Dervis who touched on the cooperation between Turkey and Greece, said, ``the cooperation between Turkey and Greece also have great importance symbolically.
20020119_21.16.53-1351-3	negative	The United States says the detainees are illegal combatants, not prisoners of war, and thus do not have rights under the Geneva Convention of 1949, which sets out the laws of war.
20020113_03.20.43-12807-1	neutral	Over the past three years, 15 Koreans were murdered, 177 were assaulted, 95 kidnapped or illegally confined, and 64 robbed, the Korean Embassy in Beijing said Saturday.
20011224_20.59.38-27990-3	neutral	The telecommunications network in the Iraqi Kurdish region was largely in tatters after the Gulf war in 1991.
20020224_20.56.08-8888-8	positive	Previously, Powell saw clearly that the antiterrorist chain could break if Iraq were attacked without the approval of the Europeans.
non_fbis_08.47.00-17401-0	negative	Tokyo irked by US stance on Kyoto
20011116_20.46.37-70-0	neutral	Seoul, Nov. 16 (Yonhap) -- The number of employees working on a temporary or daily basis have increased drastically as companies moved to slash labor costs after the financial crisis in 1997, the National Statistical Office (NSO) said Friday.
non_fbis_09.11.12-16761-19	neutral	China had demanded that Washington end arms sales to Taiwan and  step back from explicit statements of support for the island,  which Beijing has threatened to attack if it declares  independence or delays reunification talks indefinitely.
non_fbis_12.08.27-27397-42	neutral	Thousands of voters in Harare were chased away from polling  stations on Monday night by police, despite waiting for three  chaotic days to cast their ballots.
non_fbis_12.44.14-20223-13	negative	And they  apparently don't care if the criticism makes them look clueless  as to what really is inhumane.
20011217_20.37.28-19761-1	negative	Apart from this, we cannot talk about the settlement of the Middle East issue.
non_fbis_06.10.04-18139-1	negative	ISLAMABAD - Pakistan Tuesday slated US State Department's  country report on human rights situation in Pakistan and  labelled it ""factually inaccurate and unwarranted.""
20011231_21.05.45-10422-0	negative	The Argentine TV station Todo Noticias [""All News""] reported yesterday that President Fernando Henrique Cardoso on Saturday night telephoned Cordoba Province Governor Jose Manuel de la Sota, of the Justicialist Party (PJ) -- who once served as ambassador to Brazil -- to voice his concern over incidents in the country.
