263835851895758848	positive	@alexisnews You should attend @wftda Champs this Fri/Sat/Sun: top 12 roller derby teams in the WORLD, we play Indianapolis 8pm Friday!!!
264039679874195456	neutral	On October 19th, the new judge in the George Zimmerman trial, ruled that Trayvon social media interactions would... http://t.co/G91cd7Ee
101058853269016577	neutral	@Jzclesports  I might be going thursday to see the end of the Fausto Carmona era in CLE and to see Verlander, straight filthy stuff
251061126765350913	neutral	I know Flatbush Zombies wont be at the concert on Friday but I still hope the Asap mob performs #BathSalts at least, or rockys part atleast
260624498787762176	neutral	Charles Dickens may just have been me in another life. #thisisme http://t.co/Jb70qAyi
260825391713886208	neutral	TA: LG Spectrum Ice Cream Sandwich will start rolling out tomorrow:  Starting tomorrow owners of the LG... http://t.co/B2GOeeK6 #android
264022932181876738	negative	Activists demand release of Jharkhand tribal leader: New Delhi, Nov 1 (IANS) Condemning the arrest of woman trib... http://t.co/LZlgb1NW
248567735687192576	positive	#torchlight2 comes out tomorrow. Torchlight is in my list of best games of all time. I like it better than Diablo III. 2 promises more.
257972010439802880	neutral	Irish SunSport Tuesday: Robbie Keane rallies the troops ahead of vital Faroes clash @noriordan #roi
264162523278893056	neutral	SNSD's Tiffany, CNBLUE's Yonghwa and B2ST's Kikwang MCs for the SBS K-Pop Super Concert Nov 10 http://t.co/uXNRkuWr
172548568329093120	neutral	See John Lloyd Cruz & Angel Locsin at the "Unofficially Yours" LA premiere on Feb 24.For tix visit http://t.co/8gSxcxkb or call 818-243-2539
254694813243416577	neutral	@TimCross_ introduced me to Big L when i was in the 9th grade. i was really deaf to real hip hop music back in the 9th grade lol
263729146025365505	neutral	ATTN: WRESTLERS- Still time to join this Sunday's Seminar/Tryout. Here's the info: http://t.co/yhlRYkza
259983378126864385	neutral	*Chandigarh is the Capital of the two states of  Panjab and Haryana. *March 23 -World Meteorological Day. *March 21- world Forestry Day.
264019492508663808	positive	@RiriSpice19 @givemethat_beca @white_choc0lat3 @stephy_T073 @onthenikdrum GO BORO!May the FORCE be with you from the 1st second to the last!
251750998496903168	negative	#tech Apple CEO apologizes for error-ridden new map app - Apple CEO Tim Cook apologized Friday for the company'... http://t.co/KRVX70C2
263301075099062272	positive	@woolimboys Oppa you may have ur style like Hoya oppa.Dun worry,even now,you have a lot of fans , like me !!
161712465678303233	positive	@tinamanihuruk: Come and enjoy Java Jazz on the Move @SMS_Serpong Jan 28th ... | -- Serpong jauh, cyinn! :P
221865302105919488	negative	Just watched the whole 2nd season of Breakout Kings only to find out they canceled the fucking show -.-
262675141434146816	positive	#cricket Pakistan hopeful of Bangladesh visit: Pakistan's cricket board said Sunday it hopes to arr... http://t.co/8MzuvYdd (f ahsaan4u)
257972573093109760	positive	#TragicKingdom is the best album of all and my favorite song off this album is #ExcuseMeMr. Sunday Morning and Sixteen are close seconds...
263989671833522177	neutral	Sat in bed Edith is on in the background and I still have a face full of white and I'm still in my clothes from last night. STANDARD.
112656367495561216	neutral	RT @GuelphFab5: #Guelph Nuit Blanche tonight: 1:30am. Bookshelf Cinema parking lot - CFRU's Silent Dance Party. http://t.co/cCeEDpy
236168632848248832	positive	Circe 2008. The day I got my acceptance letter to U of O. Can't believe tomorrow I'll be taking my last test http://t.co/aRpXz2Lt
228322358254006272	negative	Ghost Rider 2 sucks compared to the 1st, my mom Ash are looking at it and I told them the same haha.
103746924565372928	neutral	@RecoBeco The Inbetweeners Movie + Cowboys and Aliens are both out on mid-week release today. Either of those luring you through our doors?
263817956088221696	neutral	The regular-season opener Thursday between the Brooklyn Nets and the New York Knicks, wh... http://t.co/kvPXXch4 :: http://t.co/ZxIgzMCV
107490067831992322	positive	I guess I'm going to watch Anderson Silva whop a nigga ass while drinking Grey Goose tonight
259884564359548928	positive	Mark Martin: Morning! *Yawn*  Good weekend so far?   'Like' this status if you're having a lazy Sunday or... http://t.co/3zaI1oSJ
170077866925637632	neutral	I am getting ready for the Master Class that I am teaching at WPPI this coming Tuesday which is going to be a... http://t.co/QBdpzY5G
258599234645946368	neutral	http://t.co/TtQf1MqA Haye: Vitali deal 'signed': David Haye still expects a fight with Vita... http://t.co/hPW1ggRp CLICK-1st-LINK! 2WIN
207883470444314624	neutral	@AlluringMBeauty {Ari heard Circe's giggle and sat up in her hammock} Er, anybody there? {She called out, scanning the shore line of the--
259289642669592577	positive	MetroPCS launches the Galaxy S III on October 22, price is $499: Good news for MetroPCS cust... http://t.co/jR5U314Q more after redirect
263821638896865280	neutral	@MsWarburg Not really though. Diet's harder to find. Last year, it was out til mid-Nov. then gone when Xmas got here. Gotta be ready.
263836330839113728	positive	@drlrca Dr. Arnold, I think they are just in the semi finals tomorrow. Go Warriors!!
100062714054975488	negative	@Daggy1 obama's goal is to lead us into 3rd world status, so you're absolutely right, "obama doesn't care"
110102418049605632	neutral	Amanda Knox case: The obsession with what happened that night in Italy http://t.co/Spgy8tL
264183104602783744	neutral	@courtneyolson12 Courtney!! Do you know if that emotion scrapbook thing for health is due tomorrow?
91081325884358656	neutral	@ThreeUK Rumour has it the Nokia N9 is coming to 3 in September? True?
171126801224052736	positive	adhitia sofyan on Java Jazz, March 3rd, can't wait! Give me a day off, please...
220597931839995904	positive	Happy 4th from the Bomb Squad! http://t.co/aEkrD7OV
100397126370078721	positive	If I'm reading the Twitter Trend list correctly, people are really happy that Verlander beat the Royals yesterday
258963620975759360	neutral	Today's answer: Stone has received 3 Academy Awards for his work on the films Midnight Express, Platoon, and Born on the Fourth of July.
226007841318780929	negative	Khan says Chisora won't be the same after his KO vs Haye - is he still dizzy from getting put on his ass on Saturday? #idiot
264025209504428032	positive	@GriffithsGenna Tenby till Monday night then st David's hotel in Cardiff Wednesday we need it !! Haha xx
264167031975333888	neutral	Win tickets to see Manchester City v Ajax with Ford!: Source: http://t.co/OEihBewu --- Thursday, November 0... http://t.co/E7Dp0KnF #MCFC
264047921396330496	positive	Congrats to Trey Haley, Shawn Armstrong (@SArmstrong90), and Alex Monsalve for being named to the AFL's Rising Stars team. Game is Sat @ 8pm
263793695260823552	negative	If you are a family member, friend, or fan of Austin Rivers you may want to unfollow me. This is about to get ugly.
254209204561268738	negative	3rd Mariah song of the night and NOOOOOOOOO. THAT WAS SO BAD. #XFactor
251772993867497473	positive	Field trip to October 12! Breakfast at Jungle Island,meet Deca members from other schools and find out what Deca is all about :)
263025480599490560	neutral	Former #Mizzou RHP Kyle Gibson (#Twins) will start in the Arizona Fall League Rising Stars Game on Sat, 7pm on MLB TV.
196603337079132161	positive	If Dontari Poe runs the 40 .3 slower at the NFL Combine, he's maybe a 2nd round pick. Nice work #Chiefs.
105875008554938368	negative	'America's Got Talent' semifinals begin Tuesday: We want different singers than American Idol and X Factor, said... http://t.co/7yLcFzO
262925618470072321	negative	What's worse than being stuck in a time loop of Groundhog day? Being stuck in a Monday loop.
264104896339537920	neutral	Attention everybody if you know anyone in troy that is looking to take over a lease.I will be willing to pay half r all of 1st months rent.
104245137600823297	neutral	Did I just here that Tony Romo played hide and seek at his bachelor party? C'mon son! #dallascowboys #HOP http://t.co/Ttbftch
258522997479067648	neutral	Really pumped about knock2bag on Friday w/ @docbrown88 @Iansmithcomedy and Sheeps and others! Doors 7pm at Rich Mix.
263588176621342720	neutral	Aston Villa midfielder Karim El Ahmadi will miss Saturday's trip to Sunderland through suspension following his fifth booking of the season.
264228911230111744	neutral	DEPARTURE of ship: JUMBO SPIRIT Port: ABU DHABI Time: Nov 2 2012 4:49AM (UTC) (Time of arrival/departure is the time the vessel a...
250720130303131648	neutral	Meet the Dragon's Den at Social Media Week in #Vancouver on Sept 28 http://t.co/y8SQSA5s
100048630001582081	positive	watching Kung Fu Panda 2 with the tribe & the nieces...a mellow evening
100140919516446720	negative	Nigga you can't make it with this TT! RT @yinkadek: #NigeriaNewspaperHeadlines Terry G releases the 1st rock song in nigeria ---Apako
259455720204931072	neutral	Like if Malcolm X somehow changed your life... jump head 1st into the deep end of a pool with no water if you... http://t.co/Cm1VfgFJ
259325173944176640	neutral	Mike Dean will be the Referee for  the London Derby game tomorrow. Chelsea without John Terry and Martin Atkinson might struggle. #COYS
263163827808505856	neutral	Avril is still working on her 5th album. She's in the studio with http://t.co/RoTlNZG9 from The Black Eyed Peas.
100016347756494848	positive	@Real_ColSylvia You wouldn't believe how many Demon fans want you to succeed Col - kick some butt today and be back for the  Eagles.
101012460286377984	neutral	Final Destination 5 opens this Friday.  Tell us about your closest brush with death for a chance to win a pair of... http://fb.me/10e1DsIMq
261484895711404032	neutral	@abbiedude I get the number 11 on a Wednesday and the st David's school bus on a Thursday because it drops off at air bus xx
240215933455585280	positive	@sandraa0407 @Stillsanna @JRoyaal Dongwoo's reaction to 7th rank is just hilarious!!! xD
263325100185636866	neutral	@kayladanielle__ Are you going to the Red Carpet on Thursday?
233962020347727872	neutral	Maniaci on Casimir Pulaski Day (March 1, 2004): "Some people call it a holiday." Judge: "I call it a holiday." #DrewPeterson
103730823504728064	positive	Hopefully heading to Cowboys & Aliens tonight, hopefully will be able to get in to see it, need some fun to watch
262667634124943360	positive	The Vow! Love this movie. If you are meant to be with your loved one it will happen no matter what obstacles you may face! #truelove #exists
260541067286417409	neutral	@erin_hanson if it makes you feel any better CBC national is doing a feature on the Kinder Morgan pipeline Wednesday night. #defendourcoast
243079818982342656	positive	On Modern Family, when Sofia yelled ''C'MON ESTELLA'' and ran into the pool, omg I laughed like never before.
264184780659253248	neutral	Deal of the Hour $2622 & up -- Brazil, Chile, Uruguay & Argentina Tours w/Air: Through April http://t.co/AgK4KjHn #deals
101664330587717632	positive	@TNA_GUNNER Been trying to decide on a new show to watch & always get tons of Sons of Anarchy suggestions. I may go 4 it. Have a blessed day
164827965002227712	positive	#SkateNight Tonight 8pm Stardust Skate Center FREE b4 9:30pm Hosted by #SAAB its always fun when you rolling!!! haha x2
263212085226385408	positive	Me personally don't see Grammy playing AFL again still 28 but i think he'll turn to something else now. Best of luck with what may be next.
264158696702099456	positive	Hey Daryl! Great connecting at Anti #Fracking Colorado. Excited to have you in next issue. Deadline is Nov 15th. @dhlovelife
246776355558129664	positive	Pray for Mohamed Morsi the new President of Egypt that he may continue to be a leader for freedom and peace.  http://t.co/f0LKm17i
264170532935696384	neutral	Sunday's at 5pm CST, Tune in for "The Sunday Blues" on Underground Radio. An hour show with Blues musical styles,... http://t.co/Af9N6flZ
102568207910567939	positive	@rinecho9239 good morning Irene ^_^ have a nice day!
237536864112881664	neutral	Timmonsville residents live with guns behind locked doors -- http://t.co/HKj20N9o
102160928052744194	positive	Weezy's Carter IV out on the 29th ! lets fuckin go
251873043914321920	neutral	Watch live streaming video of the Pancake Day activities tomorrow at http://t.co/xkQzkqO4! Make sure you... http://t.co/Jbr2mvXc
264148146450464768	neutral	@ellertonzahra fashion tip for everyone at the Derby tomorrow http://t.co/TDJVdm4d
264219565263835137	neutral	@_WestsideBG so if Martin gets 15 in the first three quarters and none in the 4th when Harden usually takes over he had the same impact?
102390146778927104	neutral	Just rode across the Brooklyn Bridge on a bike. What are you doing with your saturday?
159402243186106369	positive	@ArronOHare Hi matey appreciate you passing on my biz cards around work ! We have enough food until Friday in the Turner house  !
100063091018039296	neutral	RT @STEPHstackk: keen for the eagles game today. #goeagles
232544244726919169	neutral	@richwilson26 Randall Bailey is due to defend the title against Devon Alexander in Texas on September 22.
260125311310630912	neutral	Rick stein reckons tuna is like roast beef to the Japanese. Anyone for tuna with Yorkshire pudding & Sunday roast? #goodfoodchannel
264179944727396352	neutral	@fluorksa yes! >3< Tomorrow we'll see a lot of fancans about this concert <3 MBLAQ, CNBLUE, After School and others will attend this concert
264259877218705408	negative	2nd most dangerous beach in the world  Gansbaai, South Africa This part of the world is great white territory. A... http://t.co/AxhM5nnE
263235660289298432	positive	Panellist from World Bank presentating on Understanding the potential for youth and women and wat may help guarantee success #GCARD2 #C22
263160168890642432	positive	3 wickets in 1st session, Eng bowlers will be extremely happy! Just Tiwary, Raina and Saha left along with Yuvi. Rayudu should've played!
258983566808076288	positive	@Mikeisthestig Not in the Afghan halal meat shop but it may as well be with the amount of Afghans and halal meat in the house!!
184551863222411265	neutral	Premier League Team of the Week: Walcott makes seventh appearance this season while Sagna also features http://t.co/EpuMU0oX
244564867900665856	neutral	i recorded some Diablo III. And i will edit and upload it tomorrow
115629777808924672	positive	@ebrown2112 I am happy about the Modern Family wins tonight but definitely saddened by the FNL loss. Also so stoked for Melissa McCarthy! :)
254522959409074176	positive	It makes me feel so gay that I just set the classical Brit awards to record tomorrow haha oh dear
218995084966887424	neutral	I am going to @NetrootsUK 1st and then to the London Conference of Critical thought http://t.co/UC1pnX0Y
252247423743819778	neutral	Tip to Apple CEO: u may want to stop outsourcing your mapping apps to China. While UR @ it how bout bring all those manufacturing jobs back.
111373353666883584	positive	Day 3 in the Big Brother house and it's Ingleton Waterfalls trail today, promises some amazing scenery!
264001323844923392	positive	Feels like Super Bowl Sunday waiting for the big TNF game tonight! What's everyone doing for KC v SD?!? #cantcontainexcitement
264118586874925056	positive	I just realized that tomorrow is Friday which means tomorrow is the Kingsburg Vs. Selma game :) #excited
246838101710888961	positive	@amackin07 Love! I love all the episodes with Kristin Chenoweth (she plays April Rhodes). I'm a fan of hers (obviously) lol!
176545255762558977	positive	Some concept art done by the late Ralph McQuarrie. May the force be with you. http://t.co/WRTS70Nd
260217280057733123	neutral	Even if you dont go to bob jones you better wear pink tomorrow. #orelse
261096758728331264	neutral	Andre Villas-Boas has played down speculation that he is already lining up a January bid for Brazilian Willian. -jla
246956778275876864	positive	Diana: A Celebration is officially OPEN to the public! Our hours are 9 a.m. to 5 p.m. today, 10 a.m. to 5 p.m. tomorrow.
262047205970571265	neutral	I am gonna Meryl Streep the fuck out of this tomorrow
261463412352090112	positive	@JosieLong lots of hot toddies needed! got tickets to see you at Rich Mix on Sunday as part of a birthday treat, hope you're better by then!
264160518296719360	neutral	#EdShow If you think Romney is throwing the sink, you should've seen Selma in August. The incumbent had Republican backing...
261873054760701952	neutral	Remember to RSVP for our FREE Writer's Workshop next Thursday with Rosanne Bane.  Rosanne is a Creativity Coach &... http://t.co/63zkIM3A
264199647298465793	neutral	I may or may not be in love with Carrie underwood
264069940636696576	neutral	. @NCHSAA 4A boys soccer playoffs on Saturday: Wilmington New Hanover at Garner with a 5 pm start confirmed
111489768969351168	positive	Some good television tonight gonna get on jersey shore on the planner and 8 out of ten cats and mAybe red or black #lazynight
247880338469179392	neutral	Ron Jaworski is missing from the Monday Night booth. Liam Neeson stars in Taken: 7
260938062631149569	neutral	Ricky Ponting has passed 23,000 First Class runs - the 12th Australian to do so!
264169727134429186	negative	Somebody braiding my hair tomorrow Idc who but if it doesn't look good I'm taking it out
263958620012695552	neutral	@Willz4real yea Gibbs to score the 4th for AFC still
260871645546287104	neutral	And the new Tomb Raider has been given a release date, roll on March 5th.
262954275930529793	negative	On MVC teleconference, it seems Jacobson found a lot more things wrong with Saturday's exhibition after seeing the tape. #UNIhoops
262874188958793728	neutral	French president Hollande to meet with World Bank: French President Francois Hollande holds talks on Monday with...  http://t.co/5C7mi1Gr
262773700561096706	positive	NO14 - DEN 34; Peyton and Eli may meet in the Super Bowl if both Denver and the New York Giants keep winning like they did Sunday
249580223589388289	neutral	West Liberty goes for it on 4th & goal with seconds remaining in the half.  Isaiah Moody runs 2 yards in. FSU leads 19-13 at the half.
261010375854661632	positive	@BenStanners it looks better as the NUFC fans are now in 2nd tier so I can't see them... It looks like he's just goading the SUFC fans!
263096225274925056	neutral	##$$## Black Friday Deals Canon EF 70-300mm f/4-5.6 IS USM Zoom Lens with Hoya UV Filter + Hood + Accessory Kit for ... http://t.co/yykYkq2Q
253148556125433856	positive	White Day... One month after the Valentine Day, March 14th... It's a romantic day! XD
172543756279627777	positive	I wish it was Sarah G. Day 'Cause that's my funday My I don't have to runday It's just another manic Monday
263439080988217345	neutral	@Im_JoeGrizzly bro get that FAFSA done tomorrow, last day.
239006415920967682	neutral	@paddy_malone Louis Saha could become the 8th player 2 score 4 6 different PL teams this weekend.Can u name the 7 who've dne it?
262589515531681792	negative	Forget the garlic, the soup is DISGUSTING! Thanks for nothing, Saturday Kitchen.
263076177202274305	negative	Can not fucking wait for tomorrow night. House Of Blues will never be the same after @missmayiband, @theghostinside and @LMTF. #StayMetal
261455260277678082	neutral	On Sunday November 4th Olympus experts will be on hand at the Currys store in Cambridge.  From 10:30am until... http://t.co/skD7NlOY
111344128507392000	neutral	I just typed in "the Bazura Project" into google images and the 7th image is a photo of my dad. Also Glenn with moustache is there. #WHATTHE
103263786764480512	positive	RT @Trujohnson2: Love it when scouts be at our Practice..  I counted 4 today..  Broncos , Miami , Philly , && Tampa Bay ..
259274945274720256	positive	@lldubs Wishin my first stop was Port Charles!!!   Only thru the DVR "portal"!! HAPPY FRIDAY!
262111068011257856	positive	@crixacus @EllenHollman @stevendeknight Keep yr eyes open for Incursion. It may not be Spartacus, but it's going to be out of this world :-)
258256826238369792	neutral	Top 5 Upcoming Games for the PlayStation Vita: After a slow start back in March, the PlayStation Vita has ... http://t.co/4YaTPl7U - N4G
214645805041205249	neutral	Right North London Derby is on my Birthday Nov 17th, now you all know what to get me for my Birthday. #Arsenal
111377006960185345	neutral	RT @hardcandymusic: Revisit: Madonna: 12th Studio Album Rumor Update -  There are several rumors regarding the new Madonna... http://t.c ...
216418827905409025	negative	@yazbanz yes I am. Coz for me when Henry, Pires & others left & also Cesc may be, were more sad than this RVP! But do u think he's leaving?
263114587933646849	neutral	SEMA kicks off in Las Vegas tomorrow.  Our friends over at http://t.co/whjgPe6e built up this Wildcat for the GBC... http://t.co/21GjkRlS
264249754484092928	neutral	@fckyeahalyssa aye mah dude did you tell alondraa abouut going to the bell game tomorrow?
251076872719433728	positive	$150 for George Strait in March at the Houston Rodeo?! looks like i need to start saving! :)
264041945029033987	negative	@jenscibs they canceled the Frankie date that was supposed to be tomorrow.  So now everyone is going to the rescheduled show in South Bend.
263608146537349121	neutral	@MagicAntonio Merson may not want to gamble, but he's playing poker. At some point you have to take calculated risks.
264262269121220608	neutral	envy everyone going to the Big Bang shows tomorrow and Saturday. ;_;
262129098288152576	neutral	Go try and win a PS Vita at the Lollipop Chainsaw Event at Fish & Co. @ Glasshouse. You may get bitten by zombies, but it's a PS Vita!
264225508240289792	neutral	Scrubbin to the max tomorrow cause I gotta work out and leave for a game.
264185213125537793	negative	@MarkHalperin Arrogant! Came to 1st debate knowing he's leading in polls so he didn't have to prepare! Then Romney shows he can be POTUS.
255852427226517505	positive	Just bought my ticket to go m watch the Romeo Santos concert in theater. Nov 5 needs to hurry up!! I'm so excited
109093584166326272	positive	Devo Brown: Thanks for another great night everyone!! Don't forget tomorrow Roz and Mocha speak with Lloyd Robertson & Jason Priestley!
259520681023258624	neutral	King Cake and boudin for breakfast. Yep! I'm in southern Louisiana, where the weather is warm (not hot) and sunny. Wine tasting tomorrow!
100109074204598272	positive	Willie Horton: Made in Detroit: "I just remember my dad saying, 'We're going to sign a contract today, and you'r... http://bit.ly/qsQAWj
263883818933563392	positive	Can't wait for ISS tomorrow.... Not but at least ill have Kenna with me
264157132776144898	neutral	At the Greensboro comedy zone working on material I might use tomorrow during the 2nd round of the ultimate comic competition
100033144614420480	positive	hmmm..thinking that now is a good time to win the lottery. #311Day2012 in Vegas AND #311Cruise in May...decisions to be made!
237938906526539776	positive	Happy Birthday Wilt Chamberlain! He may be dead, but was also known for being stiff when he was alive.
261405148448948225	neutral	Anonymous' WikiLeaks like Project Tyler to Launch in December: A hacker, who claims to be a member of the hackin... http://t.co/Kzs7yZoX
249989252144836608	neutral	@tiffzero Hey got your tix for Looper on Wed :) it's 630 at Sylvia Park - do you work in town?
251197837688324096	positive	may God be with and protect everyone else from the storm that's about to hit Constitution Hall
100151861549613056	positive	RT @TomKitchin: Check out my column in Scotland on Sunday @ScotonSunday today on the glorious grouse - can't wait for Friday!
248661324966551553	neutral	@danawhite tell that Leprechaun Joe Silva to make @JoshKoscheck vs the Pot Head Nick Diaz in December...
235335763972194304	neutral	PRIMAVERA FIXTURE LIST - Milan Primavera begin their campaign on August 25th at Cesena and end it on April 27th at S... http://t.co/VPaTcHhX
263819592219099136	neutral	FB: Warriors fans can pick up the 3rd quarter of ESU's 35-28 win vs West Chester (Oct 6) right now on ROOT Sports (DIRECTV 659, DISH 428)
264091046722560000	neutral	My Thursday nights aren't the same with Waterloo Road to look forward to...
264014040316145664	positive	This time tomorrow I will be en route to San Fran with my beautiful ladyfriend @kellyalbrecht. Life is pretty excellent.
111377186765799426	neutral	RT @SherineT: State TV: Requests 2 join Israel gas deal trial to the one today under Judge Ahmed Refaat. Next we'll add Amanda Knox tria ...
198841237585936384	neutral	Covering Global Marijuana March for @Torontoist. Night and day from #420, fewer juggalos, more serious advocates.
263043955829121026	positive	We love FREE!   Celebrate with Fox Theatre for their 5th anniversary!... http://t.co/TZBzFE7o
263489516222955522	negative	Big mix up people, Channing Tatum is not here, it's just Anthonee Bercik, autographs tomorrow.
252979149738749952	positive	@JessicaPenne @InvictaFights Miesha Tate says your going to win Oct 6th during her interview and you are a bad ass at 105... go girl :)
245174345192849408	positive	It's Monday morning and I woke listening to Niggas In Paris. Oh man it's going to be a good day.
102677670592118784	neutral	RT @quizderek: Elvis Presley's 34th death anniversary is on Aug 16. Shammi Kapoor, the man they often called India's Elvis Presley
259586844138815489	neutral	Sad to say #knutsfordlitfest nearly at an end. Fantastic event last night with Michael Portillo. Last event tomorrow with Charles Dickens.
103942286265679873	negative	@buckwoody This tweet was poorly timed. Surely they'd be hidden... RT @Windows 12 handy tips for Windows 7 that you may not know
