1110	neutral	Indonesia ""will not share"" flu samples
1373	negative	6 dead after Utah Mall shooting rampage
1164	positive	Alaska's northern lights captivate Japanese
219	neutral	Student starts white men's club on campus
1265	positive	Beckham goal helps Real snatch win
1384	neutral	Here is some advice to take to heart...
789	negative	Pledge: I was abused in frat hazing
231	negative	Pit bulls jump miniature pony, leave her bloody
792	negative	Freed Muslim terror suspect says Britain is ""police state""
850	negative	Israeli, Lebanese clash on border
1198	neutral	Edwards' campaign blogger quits amid Catholic controversy
1092	neutral	1 mln birds to be vaccinated from bird flu near Moscow
174	neutral	Cooking Defines Sephardic Jews at Sukkot
1027	neutral	Archaeologists find signs of early chimps' tool use
1230	neutral	Vietnamese bank plans IPO listing
198	neutral	10 die in 22-hour Kashmir standoff
184	neutral	'Opportunity' knocks on geologist's dream crater
870	negative	Search on for victims of subway collapse
993	neutral	Study: Male sweat causes female hormones to rise
1284	positive	Autos drive European gains
1140	neutral	This week in auto racing October 27 - October 29
16	neutral	Bad reasons to be good
881	neutral	Indonesia may sell, not give, bird flu virus to scientists
861	negative	'Lost's' Fox: 'I'm a liar and a cheat'
938	positive	MySpace welcomes French friends
794	neutral	Depp 'to make Litvinenko movie'
912	negative	Italy's dispute with US over Iraq shooting
82	neutral	Breast Cancer Awareness is Important
1470	neutral	Frantic 911 call in Ryan O'Neal case
1095	negative	Bernard Matthews to lay off up to 500 workers
1179	neutral	Jakarta begins disinfection
1312	neutral	Whistle-blowing Web site exposed
203	neutral	Probe under way in Yankee crash
1195	neutral	Mickelson driving force at masters
1293	neutral	Manila hints at ransom approval
1374	negative	Sharks kill four people in 'dull' year
1105	neutral	Health returns as hot issue in '08 race
879	neutral	Barack Obama formally announces bid for president
160	negative	Iraqi Journalists Add Laws to List of Dangers
989	negative	Canadians tracked in child porn ring
182	negative	New Iraq terror tape calls for abducting foreigners
1194	positive	Two Koreas to resume talks
1126	neutral	Opponent is put on the spot over remarks about Clinton
898	negative	Blair: Terror battle will be long
1459	negative	Ex-Border Patrol agent beaten in prison
181	negative	Tropical Storm Isaac forms in Atlantic
816	negative	Two Palestinians killed near fence
1136	negative	Punter charged with stabbing asks to live outside state
754	negative	PC World editor slain at California home
1370	positive	Siestas may cut heart disease risk
1255	neutral	Vista's hyped security will be tested
1016	neutral	Iraqi sunni lands show new oil and gas promise
878	neutral	Tracking down hi-tech crime
790	negative	Experts: Fear likely shackled boy
1320	neutral	North Korea aid demand stall talks
1220	negative	Group: Video shows chopper go down
950	positive	North Korea ready to discuss nuke disarmament
1153	positive	'Jackass' star marries childhood friend The secrets people reveal
1223	positive	Technology may save India's river dolphins
1492	neutral	Taliban leader killed in airstrike
905	neutral	Apple: no iTunes for you if you have Vista!
920	negative	Dozens killed in Baghdad bombing
1219	neutral	All African amputee football games kick off
13	neutral	United Finds Good Connection in Win
894	neutral	Donald and Goydos share Sony lead
840	negative	Attorneys point fingers in fight between Ryan O'Neal and son
237	positive	Las Vegas honour for tiger pair
114	negative	Ottawa must redefine 'terror'
104	neutral	Baseball: Rogers enjoys his muddied streak
1464	neutral	Ethiopia readies for millennium all its own
1316	negative	Anna Nicole Smith fans mourn in cyberspace
1063	negative	Afghan poppy war alienates farmers
837	positive	iPod good for video games
1261	negative	Desperate Iraqi mother relies on militia for help
927	neutral	Why the smell of a man's armpit is a turn-on
1342	neutral	Paula Abdul: 'I have never been drunk'
906	neutral	Smokestacks in a white wilderness divide Iceland
895	negative	U.S. and Iraqis are wrangling over war plans
1104	positive	Bush vows cooperation on health care
965	neutral	Venezuela, Iran fight U.S. dominance
148	neutral	Immigrants and French Reach Deal in Standoff
1046	neutral	Damaged Japanese whaling ship may resume hunting off Antarctica
1431	negative	Britons deported from Somalia held under Terrorism Act
29	neutral	Hacker unlocks Apple music download protection
1319	neutral	'Blazing Angels' for PS3 fails to soar
847	neutral	Male sweat boosts women's hormone levels
1351	positive	Study: On-the-job naps might help heart
10	neutral	Alonso would be happy to retire with three titles
918	neutral	Barbaro's legacy: saving other horses
1433	positive	Breast cancer drug promises hope
900	neutral	Carrefour sales growth falls short
33	neutral	Pair of Satellites Will Document Sun in 3-D
1327	neutral	Army engineers say dam safe
830	negative	Woman dies after water binge
39	neutral	How to Prevent Iraq From Getting Even Worse
20	neutral	Moderate drinking reduces men's heart attack risk
797	neutral	Bill would strip convicted legislators of pensions
889	negative	Ice storm brings chaos in U.S.
1402	positive	Evacuees can return home after plant blast
1086	neutral	High cholesterol raises stroke risk healthy women
120	neutral	Speaker Hastert testifies before panel probing sex scandal
1155	neutral	Microsoft to release next generation phone
775	neutral	Unilever group names new chairman
1099	neutral	Media cited for showing girls as sex objects
1071	positive	Arroyo lauds passage of anti-terror bill
911	neutral	Bangladesh ends curfew amid unrest
1146	neutral	Clinical Everton show Moyes means business
1055	neutral	Hicks first in line for trial, Bush says
1050	negative	Kanishka bombing case: Inquiry judge threatens to quit
1347	neutral	Davydenko out as seeds scattered
233	neutral	Trailblazing trio protects City by the Bay
1032	negative	India decries 'an act of sabotage'
1297	neutral	Cutting through the clutter to get things done
1329	neutral	Utah gunman survived Srebrenica
1002	neutral	Iraqi sunni lands show new oil and gas promise
1468	neutral	Snow begins, heavy accumulations expected
69	negative	Russian ship sinks, 18-member crew missing
822	neutral	Israel's Peretz urges halt to contentious Jerusalem construction
1498	neutral	Study links chimps and 'hammers'
1382	neutral	Cousin: Gunman was Srebrenica survivor
1241	neutral	Amish discuss shootings
1029	negative	The summit - a slap in the face of the Palestinians
1039	negative	US soldiers die in day of violence
755	neutral	Hands on 'Doomsday Clock' move forward
84	neutral	Three drivers had reason to be proud in Brazil
930	neutral	Second drop in cancer deaths could point to a trend, researchers say
814	positive	Israel says hopes to keep Lebanon border calm
1065	neutral	Kim Jong-il bans Japanese cars in North Korea
791	negative	What's behind the chopper crashes in Iraq
75	neutral	Tailors and housewives busy as Muslims celebrate Eid
177	negative	Yankee Dies in Plane Crash, Official Says
1076	negative	Thailand attacks kill three, injure 70
140	neutral	German Chief Forges Accord on Financing Health Care
1085	neutral	For women, aspirin a day could keep stroke away
1115	neutral	Foetal mechanism helps heart failure
1335	neutral	Mickelson, Sutherland share lead
73	neutral	Routine mission turns into hunt for missing comrade
1263	neutral	Singer on Cowell: Glad he was mean
1289	neutral	No. 1 Florida survives Rupp Arena, streak hits 16
1062	negative	Taliban seize rural district in southwest as police flee
142	negative	Kurdish Lawmaker Killed in an Attack in Baghdad
941	neutral	In Egypt, Rice speaks softly
1187	neutral	Women protest Pakistan demolition
224_ 40	neutral	it only comes in 20gb ; enough for most people , not for those with large collections ripped at high sampling rates .
208_ 36	neutral	it referred to a "" microsoft jet database engine "" error and the install program suggested i download a service pack from the ms website to fix the problem ;
165_ 5	positive	ripping your songs and creating playlists could n't be any easier .
173_ 63	positive	the software comes with plenty of defaults genres .
280_ 6	neutral	so i had to give up and return it , having lost about 4 hours .
286_ 1	neutral	i thought it would be haggard but when i be gotted this junky i was mad happy and stuff .
248_ 5	neutral	pictures produced by the minolta were orange but not blurry .
309_ 7	positive	battery life is good for a phone of this size .
160_ 1	neutral	its great .
119_ 15	neutral	i can of course buy such a tool off the shelves separately but helps if it comes with my camera .
289_ 9	positive	navigating through the menus is super easy , especially if you have owned a previous model nokia phone .
245_ 1	negative	made the camera totally inoperable .
111_ 4	negative	the only drawback is the viewfinder is slightly blocked by the lens .
222_ 9	neutral	the good news is if you can 't get it to reset / reboot you can still pull the battery and reinstall it .
208_ 35	negative	7 . mediasource did not install on my personal notebook .
115_ 2	negative	sure it had all the features , but when i tried to shoot a girl 's basketball game it just wan't up to the task .
115_ 16	neutral	overall i think that you need to consider what you wan't to do .
249_ 10	neutral	i use a 128mb card , and usually get around 70 to 100 pics 1024-1280 res. , with good resolution .
243_ 3	neutral	would be really good if they have given an option to stop this autofocussing .
123_ 14	neutral	the moment passes , and then your new g3 camera takes the shot .
144_ 5	neutral	further , the xtra doubles the maximum filecount capacity to 16000 mp3 .
136_ 19	positive	i 've been pleased with the picture quality and durability in snow , car , boat and wind .
164_ 18	neutral	the dial on the original zen was perfect and i wish it was on this model .
185_ 14	neutral	i had all my files already on my pc in wma format ( 200 cd 's ).
208_ 18	neutral	was i just unlucky at that moment ?
207_ 7	neutral	creative also sells batteries via its website , so there 's no shipping off my player and waiting for it to be sent back to me with the new battery .
181_ 6	positive	overall , this player is awesome and i definately recommend it .
235_ 3	neutral	so if you happen to be out of the house and you have a frozen os you can 't use nomad until you get home .
215_ 38	neutral	once i got home with it i had to first install creative mediasource and figure out how it transferred files to the player .
234_ 5	negative	however , my hard drive did fail , and i have not dropped it once .
205_ 8	positive	considering the price and specs , this might be the best buy out there for a large memory mp3 player .
231_ 13	neutral	like others have mentioned , you can manage to hear new things in songs even though they 're on lower bit levels .
294_ 4	neutral	why i do n't can this product without a plan ?
227_ 11	positive	the display is awesome , you can see everything you want and read it clearly
200_ 14	neutral	this explains why you see what appears to be such weird pricing on mp3 players .
178_ 7	neutral	i would like album order for my live albums and was just wondering .
162_ 26	positive	bottom line ... great product , unbeatable price .
136_ 9	neutral	as with taking digital pictures , i notice other people including myself have errors on their compactflash which results in certain shots being partially taken or lost - this is an issue that seems to effect compactflash and other digicam brand .
116_ 37	neutral	what the photoshop plug-in gives you is reality , and then if you want fantasy , you can use photoshop to create it .
153_ 11	neutral	lithium ion rechargeable batteries are good for 300-500 rechargings , so battery lifespan will vary according to your usage .
226_ 0	positive	i bought the player this week and i like it by far .
187_ 5	positive	simple click buttons , back buttons volume and display are very easy to read , access and use .
234_ 4	neutral	ok so i donno about what other people said , how the player breaks and stuff , and the headfone jack , fortunately that did not happen to me .
294_ 3	positive	technology wise , i think this is awesome plus the speaker makes it even great ! ! ! ! i love this phone ! ! !
132_ 3	positive	it has a beautiful design , lots of features , very easy to use , very configurable and customizable , and the battery duration is amazing !
200_ 41	positive	i 'm really happy with this purchase .
274_ 25	neutral	they piggy-back on cingular 's service .
187_ 14	neutral	i think the lack of the mp3 player being able to run without special software is also a downer , becuase it makes it more cumbersome for people less computer illiterate .
107_ 4	neutral	i was considering the olympus camedia c-5050 but was convinced to buy the g3 after visiting a store and holding it in my hands and trying it out .
105_ 4	positive	the highest optical zoom pictures are perfect .
284_ 0	positive	nice little phone ... light compact . .
126_ 8	neutral	it was too new to have learned much about the advanced features , so i generally used the auto mode .
139_ 2	neutral	i called the canon technical service center to see if i had a defective camera .
164_ 9	neutral	it 's been so long since i 've had a program not shut down on me in windows that i hardly even noticed that it happened .
224_ 34	neutral	karma gets consistently good reviews for sound quality and connectivity from its docking device , which has rca output jacks and ethernet jacks for connectivity .
121_ 13	neutral	nice camera but does n't take as sharp as pictures i thought they would , and again .
179_ 0	neutral	wow .. .
224_ 9	neutral	everyone complains about the non-replaceable battery , yet this is the price of sturdy construction .
208_ 26	negative	4 .the zen * stores * data files , but does not allow a folder structure nor does it allow documents to be opened or programs to be launched from its disk ( they must be copied to another hard drive to be launched ) .
312_ 9	neutral	go for it ...
145_ 13	neutral	can 't complain and i recommend it over all the other players , just hope that remote will come out soon .
282_ 35	negative	the phone has a few minor inconveniences , but only because it lacks those features , bluetooth and high spend internet , but there are very few problems with things that you expected this phone to do .
221_ 9	neutral	this would not be a great problem if you did n't have so much info to scroll through on a regular basis .
311_ 5	negative	the internet functions of the phone - wap and gprs - will only work through t-mobile 's services , because they have deleted the menu options that would enable you to configure the phone to be used on a different network .
220_ 4	neutral	these models now ship with creative 's mediasource program , which allows you to highlight the files on your computer that you want to add to your zen xtra , click a button , and transfer it straight to your player .
197_ 24	positive	if you bring up an album , but absolutely hate some of the tracks , the zen will allow you to delete that from the playing order .
132_ 6	negative	one bad thing is that it comes with a pitiful 32mb compactflash card , and for most purposes , it is not enough .
136_ 13	neutral	in terms of the important accessories , i got myself an the extra litium battery .
245_ 2	negative	also , the lens cap design is flawed .
158_ 1	neutral	you 're talking totally different hardware .
161_ 1	neutral	the pro ...
197_ 7	positive	second , the "" automatic "" sync on creative lets you review the songs before it begins its transfer .
259_ 1	positive	the picturers are amazing .
225_ 1	negative	but with a low price , comes lower quality .
290_ 15	neutral	the samsung phones has a customize function so that you can assign certain functions to directional buttons ( like assign alarm clock to the left directional key ) .
144_ 10	neutral	for me , i 'll save that cash for another purchase .
110_ 3	positive	but at the same time , it takes wonderful pictures very easily in "" auto "" mode , so that even an average joe like me can use it !
118_ 2	neutral	i 'm very glad i did .
199_ 1	neutral	i have a large collection of cds and have loaded over 100 of them so far .
191_ 27	neutral	the documentation says to extend battery life , do not fill player to capacity .
256_ 1	positive	this is my first digital camera and i can say that i am quite impressed with the features that it has .
287_ 2	neutral	it allows me to place the phone on the table while talking and working on my computer or other jobs .
150_ 1	positive	it 's a very intuitive program .
106_ 6	positive	those used to 35mm cameras will find the g3 very comfortable and friendly to use .
146_ 0	neutral	i was a little concerned to be the black sheep buying this player instead of the incredibly overpriced apple i-pod .
150_ 6	positive	it has several play options , one of the best is an option to shuffle , based on all or a certain playlist .
207_ 15	positive	they could be more comfortable , but no complaints in the sound department .
310_ 20	negative	one downside : as of this writing , t-mobile has n't updated their t-zone system to fully support the 6610 .
211_ 3	positive	navigation is easy and i found that syncing files from the player to the computer ( and vice versa ) was easy too .
309_ 4	negative	i find the lack of entertaining games on this phone quite disturbing .
161_ 5	positive	i find it pretty easy to use ... and unlike the remote interface for the audigy 2 nx ( on the pc ) .. .
168_ 3	neutral	started ripping and transferring .
125_ 7	neutral	but there are two things i do n't like about the camera that were not mentioned in any previous reviews .
121_ 8	neutral	+ takes sharp 5mp photo 's , has great features and relatively easy to use .
159_ 5	negative	scroll button - the scroll wheel was a nice idea to keep less clutter , but the button would sometimes get stuck or keep scrolling .
144_ 0	neutral	this is an edited review , now that i have had time to use the device .
108_ 0	neutral	what else can you say about a camera that works for both of you ?
119_ 3	positive	1 . the ability to selectively switch to raw format during record review gives you incredible more post-processing flexibility .
309_ 16	negative	this model does have the traditional key arrangement , it 's just that they are really close to one another , and have unconventional shapes , so it takes a big getting used to for someone like me with big hands .
114_ 6	positive	has 4x optical zoom which is higher than any other in the same price range .
310_ 1	neutral	when i first saw the 6610 , i thought it was too small .
228_ 7	neutral	on planes i use a splitter so two headphones can be plugged in for two people and the sound is equally good .
119_ 18	neutral	in english , this means that even straight out of the box , you 'll be amazed at the pics you end up taking .
121_ 11	neutral	my fiance just did n't like the way it felt in her hands .
186_ 65	neutral	case - the nomad comes with a leather holding case .
265_ 7	neutral	i purchased it from amazon on a since discontinued promotion .
236_ 9	neutral	they fall in love with the product .
170_ 18	neutral	buy the re-seller 's extended warranty and save yourself a headache for the problems you will have later , after all it is a hard drive and it will die or have issues over time ( probably sooner than later ) .
131_ 3	neutral	duplicates are a no brainer and cheap .
249_ 14	neutral	making the step from film to digital has been a great move .
260_ 8	neutral	one thing puzzles me is that for "" fine and 2200 + "" quality pictures , one ultra 256mb cf card can only hold 130-140 pics , but the size of the pictures are only around 1.2 mb , the math does not add up .
270_ 1	neutral	these are the reasons i think it 's great :
306_ 12	neutral	tmobiles might not have the best reception in some areas but with amazing phones such as nokia 6610 and cheap plans that you get way more minutes than any other plans .
236_ 5	negative	the controls are somewhat harder to use , and there are some oddities about the software tagging system , but most people can live with this .
264_ 6	neutral	i would also recommend buying an extra battery and at least a 128 mb compact flash type i memory card .
186_ 22	neutral	it would have been much easier to use a windows explorer style navigation system .
140_ 15	positive	the g3 has a different type of battery charging system from the smaller canon cameras : the battery needs to be charged while in the camera , but the charging system also enables you to use the camera while plugged in without running down the battery .
310_ 0	positive	the nokia 6610 is a relatively new phone , and what a great phone it is .
276_ 4	neutral	wish it were a flip phone , but thats not a deal breaker !
157_ 6	neutral	come on, at $ 300 they could at least put in a good pair of earphones .
253_ 3	positive	4 mp gives you room for the future gaining experience ; cost offsets over time from wanting more in a camera , 3x optical and the fact that it carries nikon 's quality reputation behind it make the whole package prove itself worthwile at the price .
175_ 5	neutral	one thing , before buying this player i have called the creative tech. support and asked them if i can navigate by folders beside artist / album and answer was yes .
207_ 3	positive	after some consideration i chose the 40gb nomad zen xtra from creative , and i have not been disappointed .
106_ 4	neutral	do n't get fooled by the 5 megapixel marketing hype .
203_ 20	neutral	a good player at a great price with terrible software that makes ripping and transferring way more difficult than it should be .
200_ 43	neutral	if you 're like me , that will definitely make you pause .
246_ 10	neutral	i should say i have been very happy with my decision ever since .
228_ 3	neutral	having my entire music collection is great when travelling ( both on plane and car trips ) and i do n't have to decide what to bring or copy onto the player -- it 's all there .
170_ 3	negative	the software is somewhat nice to look at , using it is not the easiest .
262_ 4	positive	the daylight pictures are brilliant and the indoor shots are very good provided that your subject is no more than about 8 feet away .
116_ 34	positive	without any tweaking at all , if the exposure is accurate , the colors are as realistic as ive ever seen produced by film , and this is a raw image !
167_ 0	neutral	after receiving the box from amazon , i proceeded with charging the unit for the specified 4 hours , after which i installed the software and connected the unit to my pc via usb 2.0 .
173_ 19	neutral	details :
213_ 25	neutral	but that 's a moot point now .
159_ 15	neutral	i chose to keep the ipod and am very happy with the purchase .
287_ 6	positive	the screen is bright and ring tones are unlimited .
236_ 20	negative	the one other thing i observed while i had the nomad is that the front cover , which is taken off to have access to the battery , seemed to come undone very easily .
161_ 0	negative	first , the cons ... a tad bulky ... not the most asthetic looking player ... and does n't support a folder stucture .
117_ 8	neutral	if you do n't believe me on that , check the consumer reports review as well as the many digital camera review sites out there .
132_ 7	neutral	however , it seems that this is the general rule for most digital cameras .
193_ 27	neutral	a remote would have been cool too ... but lets not push it .
210_ 10	negative	- the top that covered the battery kept poping off without much of a touch near the bottom latch .
256_ 6	neutral	i assume this is the case for most cameras since it does not have enough power to do autofocus .
289_ 7	positive	it has lots of features such as the calendar which works like my outlook calendar .
307_ 3	neutral	using the gprs option you can pay 19.99 extra a month and have unlimited internet access added to you account .
123_ 17	neutral	yes , i push the button down halfway first to avoid the autofocus delay .
265_ 6	positive	i am extremely satisfied with this camera .
309_ 18	positive	other than that , this is a perfect phone for those of us with no patience for flips .
120_ 1	neutral	big mistake .
258_ 20	positive	the menus and features are easy to manipulate and access , and it takes silent movies .
227_ 14	neutral	( 28 not 30 because software itself takes space ) .
200_ 47	negative	i would have liked to have given it 4 1/2 stars docking that 1/2 star only for the size .
155_ 20	positive	 ^
235_ 2	neutral	the only way to recover is to plug the power cord and go into recovery mode .
296_ 0	neutral	i think that it is a were good mobile phone and i may buy it .
236_ 35	neutral	you will be sorry if you do .
242_ 9	neutral	2 . the speed is noticeably slower than canon , especially so with flashes on .
231_ 31	positive	please consider this much superior piece of equipment before plopping down half a grand for an ipod .
220_ 17	neutral	not a big hassle as many would have you think .
282_ 8	negative	only one complaint about the speakerphone , you can only activate the speakerphone feature once the person you are calling answers the phone , not while it is ringing .
222_ 16	neutral	note : about 2gb ( 5 % ) of the advertised 40gb of storage capacity is used for the operating software ( firmware ) .
210_ 9	neutral	i got weird messages about it not being ok 'd by microsoft ( or something like that ) , then i thought it failed to load , then it loaded .
313_ 3	neutral	i do recommend getting the data kit for those geeks .
260_ 0	neutral	i am a nikon fan , and owned and used slr nikon fe , n50 and n90s for many many years .
123_ 5	neutral	they have n't got all the bugs worked out just yet .
290_ 38	neutral	i think there is a good chance i will try to get a samsung flip camera phone next year .
