462	neutral	Debriefings of Al Qaeda leaders arrested confirmed this,
1020	negative	We must acknowledge that most in the financial community, including those of us at the Federal Reserve, failed to either detect or act upon the tell-tale signs of financial system excess,
880	neutral	It's worrisome that two public corporations have received a credit downgrading in less than a week: the Ports Authority and Highways and Transportation. Standard and Poor's actions is a forceful sign that the credit rating agencies will continue watching with a stern eye the steps that this government takes in relation to its fiscal matters. It is imperative for the government to immediately take all the measures necessary to control and stabilize the fiscal situation of both the Commonwealth of Puerto Rico
1274	neutral	Is this the first step to Russia joining OPEC? Stay tuned,
317	neutral	In the next five years, President Obama's budget will double the national debt. In the next 10 years, it will triple the national debt,
1538	neutral	I think it will be very difficult for Lidl,
348	neutral	Here we are six months after the Wall Street bailout began and it's still the case that almost no loans are being made to [ordinary people on] main street,
1078	positive	Those are plays that you think of Magic Johnson making,
1397	positive	I had a very constructive dialogue with my NATO counterparts today in the lead up to NATO's 60th anniversary summit to take place in Strasbourg, France, and Kehl, Germany,
932	neutral	Especially for the president, his day off every Friday has been coordinated with vice presidential office because Vice President Jusuf Kalla will also take his day off but I don't know what day,
314	neutral	I heard from the president (Obama) that he wanted to improve relations with Russia,
547	neutral	We certainly believe South Africa has decided not to give a visa to His Holiness the Dalai Lama under pressure from the Chinese government,
453	neutral	And so, I'd like to yield to Mr. Stark, who many, many years ago, when George Washington's hair was black, he started in this down here in the Congress,
1124	negative	We definitely don't want to see the goodwill of the international community exploited by Hamas and serve Hamas's extremist purposes,
660	neutral	But his chances that the US Supreme Court will grant his petition is very slim,
1064	negative	I supported the IRA during the conflict, I myself was a member of the IRA but that war is over,
332	negative	Merrill Lynch secretly moved up the planned date to allocate bonuses and then richly rewarded their failed executives,
1575	negative	Elisabeth's imprisonment was premeditated; Fritzl had been planning her imprisonment in the dungeon cellar for two to three months before he actually lured his daughter down there.
1044	negative	Perhaps Sir Reg should be clarifying the Ulster Unionist position on the behaviour of those associated with the RBS, given the bank's ownership of the Ulster Bank.
1256	neutral	I thought the OPEC cuts would have had more of an effect by now,
635	neutral	We have shared aspirations when it comes to the Free Trade Agreement because it is in our respective economic and national interests,
392	neutral	A failure of General Motors would be negative for the other carmakers, as it would drag along a large number of suppliers,
649	neutral	You've got the combination of a political crisis precipitated by the recent Supreme Court judgment, so democratic politicians are not coming together to fight terrorism.
1031	neutral	If the (economic) situation worsens, the ECB is ready to reduce rates further, even to zero,
927	neutral	(Mandela) came as a very militant leader of the Youth League. He turned tables around, he was absolutely as intolerant in a way to our leaders as Julius Malema is now,
571	neutral	so far we have announced candidates for 28 out of the 42 Lok Sabha and 195 out of the 294 assembly constituencies in the state.
582	neutral	If these plans are carried out, we run the risk of looking like a Third World country,
1117	negative	We definitely don't want to see the goodwill of the international community exploited by Hamas and serve Hamas's extremist purposes,
1321	neutral	The Verkhovna Rada should get a transparent answer related to the renovation of the gas transportation system: will we get EUR 2.5 billion in investment or charity?
1348	positive	He's a player who strikes fear throughout the Premier League by his aerial power in the opposition's box,
1230	neutral	Australia will only support changes within the International Whaling Commission that bring us closer to our goals to eliminate whaling for good,
1241	positive	This is an extremely important measure to ensure sustainable management of fisheries resources. I am delighted that Norway's proposal received broad support, and that with Norwegian financial backing the FAO will now initiate a process which will lead to international guidelines in this area. It is a major problem that fish which could be used as food are discarded, and the Norwegian Ministry of Fisheries and Coastal Affairs has put a lot of effort to address this issue over the last year,
698	neutral	more New Labour
1038	positive	The Information Society brings us countless new opportunities and it is our duty to ensure that it develops on a solid and sustainable base. Europe must be at the forefront in engaging citizens, businesses and public administrations to tackle the challenges of improving the security and resilience of Europe's critical information infrastructures. There must be no weak links in Europe's cyber security,
1366	neutral	I inform you of my decision to quit my post as member of the Council of State, deputy of the National Assembly of People's Power and as member of the Central Committee of the Communist Party of Cuba.
555	neutral	I am still not ready to play seven consecutive matches and will have to withdraw from the Sony Ericsson Open which is one of my favorite tournaments of the year,
1121	neutral	Hamas has no veto on presidential and parliamentary elections despite our large majority at the parliament,
970	neutral	We can aid the business sector, and SMEs especially, by reducing red tape. The Romanian state collects over 200 taxes, many of which bring little income to the state, but imply higher expenses for the public administration and taxpayers. Also, Romania has committed itself, along with its European partners, to reducing by 20% administrative costs imposed on SMEs. We took part in this decision in the European Council of December 2008. I urge the Government to focus on this opportunity to provide quick aid to
596	neutral	The perspective for all the countries of the Western Balkans to be part of the European Union is open. Nobody has changed that policy,
336	neutral	Eastern Congo has been mired in conflict since Rwanda's genocide nearly 15 years ago spilled war across the border and Hutu militias sought refuge here. Nkunda contends he was defending the region's minority Tutsis against the Rwandan Hutus. In a rare move by former enemies, Congolese and Rwandan forces drove out about 600 of the Hutu militias fighters earlier this year and the Congolese army hoped to force out 400 more by the end of March, said Kudura Kasongo, the Congolese presidential spokesman. But tha
1349	neutral	My name is Peter Moore, I have been held here for nearly eight months now.
723	neutral	At the request of the Finance Ministry, the talks have been suspended because the ministry wants to carry out further analyses,
535	negative	The Dalai Lama's ever-changing stances are against the historical and religious traditions,
1470	neutral	It is possible to assume that [Prime Minister Ehud] Olmert's emissaries in Cairo will return to Israel with a deal for Shalit's return,
1232	positive	We will not release a player like Ribery who still has two and a half years on his contract. You don't sell such a player, you keep him,
1096	neutral	Under Fifa rules, Nacho Novo could have played for Scotland, but we the associations of Great Britain had ruled that out and left it for birth in the country or bloodline, which was parent or grandparent,
308	neutral	I believe that President Obama's message reflects exactly the message that Europeans have been trying to send to Iran. And I hope that it will be well used,
540	neutral	The South African government has not extended any invitation to the Dalai Lama to come to South Africa.
614	neutral	RNC Chairman Michael Steele and elected Republicans are focused on fighting for reform and winning elections. The Democrats' problem is that the American people are growing skeptical of the massive government spending being pushed by congressional leaders like [House Speaker] Nancy Pelosi,
978	neutral	That has always been the Green Party position before entering government and that is still our position,
1235	negative	We are ready for the debate. I myself have been asking Stanishev for one. He sent me the invitation at 5pm and now at 8pm I am here outside his office to talk. I want the debate to be in his office so that he can feel comfortable. I want all media to have access to the debate, not just one, and I don't see why he should pick a certain TV station and a certain day for the debate. BNT is not his own private TV station so that he could ask me to appear there. I see 11 TV cameras here and I am here with my econ
1059	neutral	He flies off to Los Angeles tonight to be on the Jay Leno show,
1412	neutral	Secretary Gates will not be traveling to the NATO Summit next month as originally planned,
1183	positive	I enthusiastically support the Senate confirmation of David Hamilton for U.S. 7th Circuit Court of Appeals,
1037	neutral	Henceforth, no member of the party should attend any meeting not called or sanctioned by the Ward Chairman (in the case of the Ward), the Local Government Party Chairman (in the case of Local Government Area), the State Chairman (for State) or Zonal Chairman (in the case of the zone).
725	negative	How can David Cameron talk about fairness when he is still committed to a tax cut for millionaire's estates, won't back our 1.2bn help for the unemployed to get back into work, and wants to cut Sure Start?
930	neutral	There had been no talk with the Congress party regarding any seat sharing arrangement. What we can say right now is that the UPA (United Progressive Alliance) cannot form the government at the centre once again without Samajwadi Party support.
701	neutral	Perhaps McLaren Mercedes doesn't come to Melbourne with the same prospects to challenge at the front that we experienced in both 2007 and 2008, but the whole team will be working tirelessly to help us move back to the front,
1209	neutral	Mrs Hani is a victim. The loss of her husband [due to Derby-Lewis' actions] has made her a victim. By participating, there is some comfort to the victim.
650	positive	First, I wanted people to see that the Supreme Court isn't all male,
1017	neutral	A little bit of profit-taking and a little bit more reality. Whatever spending plans the Federal Reserve put in place will take half a year at least to seep through,
545	neutral	We certainly believe South Africa has decided not to give a visa to His Holiness the Dalai Lama under pressure from the Chinese government,
494	positive	The future prosperity of this country depends on getting higher education right. As these proposals show, Fine Gael is determined to reform the higher education sector and reposition our Universities and Institutes to become world leaders in education. Delivering quality higher level education cannot be left to chance,
443	negative	Such parties mainly try to play on rhetoric, but the voter has become intelligent and does tactical voting. The Muslim voter's primary concern is to keep the Bharatiya Janata Party (BJP) out of power.
680	neutral	It's hugely dangerous to the Labour Party,
1046	negative	After having picked up snowdrops for five years, Basescu should be sent about his business on the occasion of the elections, and our duty within the party is to find the best formula of counter-candidate for Basescu,
1450	positive	I want my first win as team principal and my first world championship more than I realised. And I certainly don't want to be the man who fails to deliver the championship for Lewis Hamilton.
393	negative	The plans submitted by General Motors and Chrysler to the government of Canada do not go far enough to ensure the long-term viability of these companies,
1406	neutral	Although their troops have been bravely fighting alongside ours in Afghanistan, it is welcome news to have them fully reintegrated in all NATO military matters and we look forward to working even more closely with them in the decades to come,
1255	positive	Our message is that non-OPEC [countries] should join OPEC [in helping the market] and we emphasize that a price lower than the current one does not have a justification at all and it stops development,
1159	neutral	It is ironic to link this convoy with Hamas though we're still unsure if there was a convoy bombed by airplanes,
1375	neutral	Robert Kubica would have been nowhere near the championship last year, and do you want that?
1437	neutral	More US and NATO soldiers are now (getting) killed in Afghanistan. Their tanks are destroyed and even (their) helicopters are shot down,
791	neutral	NewsHour with Jim Lehrer,
586	neutral	It is an obligation for our all our states to guarantee harmonised reception procedures throughout the European Union and for this reason the European Parliament has asked for a review of the mandate of Frontex, which should be to ensure the protection of the most vulnerable people and, in particular, of potential refugees
1284	neutral	ECOWAS is concerned about what has just happened in Guinea-Bissau,
695	neutral	Afghan National Police engaged Taliban militants during a searching operation in outskirts of provincial capital Lashkar Gah, resulted in eight Taliban rebels and two police dead,
1120	neutral	there is no plan to exert pressure on any Palestinian side in this conference, so all sides, including Hamas, should hurry to show a positive attitude in order to avoid leaving the people of Gaza in the open.
485	neutral	On my own behalf and that of the European Commission I offer my deepest condolences to the families and friends of the victims of the school-killing of Winnenden,
3521121	positive	Your gucci match my pradas a good look ;) 
974577	neutral	Video: I DID A VIDEO REVIEW FOR MY FRIEND JESSE ON THE GLX-6900X-2DR IN4MATION. IN4MATION GLX-6900X-2DR... ~http  
3045039	neutral	Fresh on nike shoes: That American footbal installed {beneath;1} difficult are {in {actuality;1};1} leading085 
3542067	neutral	gucci gucci still trending? well damn 
1116240	neutral	Does Casey remind you of Gucci Mane or is it just me.? 
1773442	positive	Playing Nancy Drew OuO I love these games! 
932081	neutral	Apple wins permanent ban on Samsung tablet in Germany (TUAW): Share With Friends:  |  | Technology - Compu... ~http  
1983890	neutral	The Los Angeles Lakers are smitten with signing free-agent point guard Steve Blake; but sources believe Blake would have to take less money 
2881553	neutral	Flyer than the rest of em; still got my nike boots 
1736217	positive	No regrets!:-) 
101561	positive	Because of #IWannaGo I now collect seashells.  BEST HOBBY EVER! IWannaGodney 
1631149	negative	Stupid asz ppl 
1191766	neutral	I just completed the BUTT BUSTER workout with Nike Training Club. Join the club ~http  
449138	neutral	Win a Sony PS3 Move Bundle @user ~http  
1070777	positive	Eating tons of delicious #jalexanders and desserts thanks to the most amazing person @user! Thank you; thank you; thank you! 
2276778	positive	Spotlite is amazing. .:) 
3550093	neutral	Have Fun While Staying Fit With Nintendo Wii Fit Plus ~http  
3070108	neutral	L (@Leagleek123) has shared a Tweet with you:  "ashleytisdale: @user hahaha yes!" In responce to perez hilton :-) 
2342347	neutral	#cloudcomputingnews Muglia Finds New Paycheck After Microsoft ~http  
1396797	neutral	I never had ah job; you know I sold that.... 
2856618	neutral	Posted a new song: "GUCCI GUCCI ASIAN REMIX" ~http  #music 
2751673	negative	I don't think I have ever felt so discontent about leaving work. Even after working 10 hours. 
18810	neutral	Video Game Rentals: With the introduction of new gaming consoles like Xbox 360; PS3; and Nintendo Wii; video gam... ~http 
1686953	positive	LOVE it #tonight!RT @user Excited for another Jerzday?! How are you liking the new season so far? 
2572573	neutral	For TomTheWanted to go on The Cube!! ~http  
317893	neutral	First set Fran. Forza! 
275168	neutral	Possum pums! Runnin don't mean its trash!RT @user but wait.... what's worse??? possum pums or shorty that always runs from the dick? 
1703142	neutral	Got on Twitter via computer for the 2nd time. Think I accidentally unfollowed some folk. Let me know if I did cause it was not the plan!  
2402377	positive	Maryland might have the coolest Jerseys ever sorry Oregon and Nike Under Armour one upped you guys #CollegeFootball 
480322	negative	I hate the new Microsoft word... 
2339680	neutral	Anyone need a Power Mac G5 Dual 1;8 GHz; 6GB Ram; 160GB HD; iLife9; iWorks9; Samsung 17" &  22" flatscreen monitors?! IN OR AROUND LA ONLY! 
2315780	neutral	Listening to: The Spinning Stream: Nintendo Music Radio. ~http  
89734	neutral	Just Published: Beyond the Banner Ad and Commercial: Microsoft and Nielsen Connect TV and Online Audiences ~http 
756581	neutral	UAE attracted over $75bn in FDI ~http  
2012983	neutral	Stay tuned  Lake Tahoe TVs SportsCentral for news from the NFL and an interview with Sports Illustrated writer Jimmy Traina. 
75256	neutral	jesus; the knicks gave up half the team; 50 cent; Nas; the gucci store on 5th ave; and 10 cheesecakes from juniors for carmelo 
2336931	positive	@InKrediBle_K_: Brownies and ice cream!!! Yuummy Tha fuk!!! 
1222522	neutral	If you find yourself out by one of our stores; stop by and see our feature display celebrating Bellingham fused... ~http  
1032280	neutral	let it instrumental featured in adidas viral vid for art basel... ~http 
2677682	positive	A music video that will take your breath away: ~http  #visuallyastounding 
3550057	neutral	Free Nintendo Wii - Hunting For a Legit Freebie Site ~http  
1310205	positive	August 13 is going a long; busy; yet exciting day!!!!!! I'm ready!!! Super excited!! 
840678	neutral	New Linux Tip: They Tell Me Only To Use Microsoft Windows Not The Free Linux Operating System ~http  
48487	neutral	Do Tweetups Work? Hilton Anaheim Says So ~http 
3159390	neutral	With Office 2010; Microsoft Braces for Battle; ~http  
2621305	neutral	McQeen; Shoreditch Tuesday 26th July 8pm to see me perform my stuff at a friends event!! *buy tickets* ~http  @user 
2134731	neutral	So much has happend in 4days; Damn. 
59019	neutral	Black man can jump; like he sponsered by nike lol #nextfriday 
2321656	neutral	I'm southdallasswaggin at work right now to this new gucci mane 
911708	neutral	Bolibol.in- Samsung Video MP3 Player YP; MRP- Rs. 6;800.00; now available on bolibol for you. Bid now & you can win it for absolutely free 
1804085	neutral	SMS Marketing: How to Harvest Your Customers' Mobile Details: by Bill Hilton SMS marketing is a huge growth area... ~http 
299843	negative	@CassidyDay: Why can't we wear Nike shorts to school?! #dumb #favoritethingtowear// a freakin men 
3039034	positive	I liked a @user video ~http  Gucci Mane - I Don't Love Her ft. Rocko & Webbie ( Official H 
3441075	neutral	in2beats 106.5 - intobeats.com playing ... Whitehead Bros - Forget I Was A G . CJ Hilton ft Nas - So Fresh 
2277076	neutral	New post is up! Microsoft vs. Apple: The History of Computing ~http  #geek #infographic 
745142	neutral	NP-play ur part 
41301	neutral	Df wrong wit dat nigha RT @user O.0 RT @user Gucci &gt; Wale 
1434050	positive	Wow this single mom is a friggin herooo *thumbs upp* Im so proud! ~http  
1733251	neutral	If Samsung makes 1m tablets and sells only 20;000; what happens to the unsold units? Trash? Recycle? ~http  
216139	positive	Grab Rachel and drive that car to NYC!!! RT @user @user Just test drove a Corolla!! Just like you! So cute! 
2296659	neutral	12/20/2010 Playboy NYE 2011 @ Hilton Chicago Only a Limited Number of Regularly Priced Tickets Available! After a... ~http  
2185776	positive	What an awesome team!! Congratulations Langports on getting through to the semi-finals at the English Australia... ~http  
900493	neutral	Video: adidas Soccer: Teal Bunbury visits adidas (by adidasSoccerUS) ~http  
2277073	negative	Dear @user; while I respect you're trying to manage workers and TV scedules; it's absurd to stop a match in Heads up; this needs to stop. 
1610865	neutral	3x Samsung Gravity Smart T589 Premium Clear LCD Screen Protector Cover Guard Shield Protective Film Kit - by Otex ~http  
138785	neutral	Naked Body Fresh Out The Shower ; && Yu Touch YaSelf After Hours . 
313013	neutral	restless like a lion 
2754429	neutral	Got Friday and Sunday off. Sounds like a busy weekend for me. Still got a lot to do 
960972	negative	ughh have no idea anymore!! need ideas... :( 
1578820	neutral	Bing bing bam bam 
109958	neutral	New blog post: ~http  - Microsoft User Group Lecture SeriesFeb 2011 
1772561	positive	Check out this cool fan page I found!: ~http  via @user 
1632820	neutral	Help me uncover a prize in Samsung TV's Like It; Reveal It; Win It Contest. 5 instant winners & 1 Grand Prize a week ~http  
2233492	neutral	"Google; Apple and Microsoft take top spots in global brand survey  ~http  
3506630	neutral	By the way; you know the trainers I got? Well the same shop have some Nike heart monitors going cheap ~http  well worth a look 
258314	neutral	just out the yahoo/bing alliance seminar at ses.quote to sum it ~http  will  service it bing will will power it 
1214812	neutral	Twee!! Yes Or No Lol 
603677	neutral	eating PF CHANGS 
632957	positive	Its officially #LeadershipSafari2K11 time!!! Welcome back bbq tonight; cant wait to see everyone 
1234949	positive	Watching @user zumba is the best thing I have seen all week! &lt;3 
1996779	neutral	OUTSIDER!!!! #ASOT ....YES @user 
2252273	positive	"..possibly the most unique and interesting game to come out so far for Nintendo WiiWare" ~http  
1551985	neutral	SakTel First Carrier in North America to Confirm Samsung Galaxy S II  ~http  
2474560	neutral	Elop; Nokias new CEO formerly worked for Microsoft RT @user Microsoft to pay out billions as part of Nokia deal ~http  
406550	neutral	Dell's tablet coming nxt wk; Samsung outs their tablet; HP got their Slate; and Apple iPad; 3D losing steam; tablets gaining the spotlight. 
745570	neutral	AM OUT.... 
24239	neutral	My next three dogs are going to be named Twizzler; Taco; and Gucci Gucci definitely 
443378	neutral	Minibus and Coach hire London; 8-24 Seat Shuttle Bus People carriers; 16; 24; 29; 35; 58 or 53 seaters ~http 
722200	negative	What is wrong with my Etsy shop.  Can't get in there. 
1812057	neutral	$49.99 Samsung phone 1st month free; unlimited service 344-8910 
509703	neutral	"@misskotelo: Louis Vuitton condoms R400 watch as the darkies go and buy them #SMH" cc @user 
1126486	neutral	Karma Is A Birch Well Just Make Sure That Birch Is Beautiful #Sweet 
2397436	negative	twitters lame o_o 
1178126	neutral	new photos taken with my Sony A55: ~http  
1943822	positive	i figured it out! i have color. wii is a great thing nintendo is the best! 
2227457	neutral	Acer and Viewsonic sign patent licence deals with Microsoft to protect Android ~http  
2685124	neutral	What to read? ~http  
90813	neutral	Software New: Microsoft Word 2007: Shortcuts with Macros ~http 
648411	neutral	ok coach Mcdonlad lol  @JRYoung_Himself: I need to cop me a Gucci bucket hat. 
2644187	neutral	What the heck is Microsoft doing? | Articles ~http  
1373830	positive	Pretty pumped about becoming a political genius from this semester.#determined 
2833566	neutral	Microsoft Aims Big Guns at Google; Asks Consumers to Rethink Search ~http   Bing url ~http  
1016296	neutral	I checked in at Hilton Tulsa Southern Hills (7902 S Lewis Ave) on #Yelp ~http  
2774204	neutral	Apple's iCloud is Powered by Microsoft Windows Azure - who'd have thought? ~http  #cloud 
2913458	positive	God I love fashion... I was definitely Coco Chanel in a previous life. I got Gucci taste on a Baby Phat budget. 
1114969	neutral	just got stopped from singing along to The Bing Bong Song; by Daisy of all people; how does SHE know I can't sing? 
1262821	positive	Things I want to do today are all fun things like eat candy; make a mess in the basement and scream and fart in the hot tub. 
1373953	neutral	#NP Gucci Mane Ft Cartel Yo Gotti - Translation. 
2367277	neutral	not much..... 
2271521	neutral	S/o to em bing goons wildin. I'm on my second Privilege. Fucks shaken out there tho?! 
2052569	neutral	Michael's estate has just signed a $200 million deal with Sony to release 10 new albums by 2017. The first one will be released in November. 
1303751	positive	I feel like a million bucks.  I literally feel 20 years younger than I am.  Learn how you can; too; in just 60 seconds.  ~http  
133950	neutral	Tell dat girl wat she wanna hear.. gucci voice 
1874280	neutral	I wish I could test of of Microsoft office classes. 
3045035	neutral	Fresh on nike shoes: How to Wear DC Hats053 
12396	neutral	Done @user @user @user @user @user @user @user @user ~http  
2423120	neutral	New post: Samsung patent applications published on 08 September 2011 ~http  
902893	neutral	Camera SONY ALPHA DSLR-A700 DIGITAL CAMERA+8GB KIT NEW Price: $320 USD Online Order: ~http  
2658627	neutral	Retrosuperfuture 
2668803	positive	voted more than 100 times for both @user and @user! can't wait for 7 mins!:) 
