VIDEOGAMES_294_5	positive	The basketball mechanics are solid, almost perfect.
MUSIC_244_20	negative	Because if there ever was a Beyonce album to forget in the dust it's definately this one.
ELECTRONICS_78_3	positive	Living next to a large body of water I can shoot ducks, tow boats, Osprey, anything else, at distances of 100 yards and even further.
MUSIC_112_0	neutral	Pros: catchiness, replayability, fun, energetic ... Cons: simplicity The Bottom Line: Buy It!
VIDEOGAMES_141_21	neutral	If you can get it for less than 30 bucks, I'll say it's worth it.
VIDEOGAMES_141_18	negative	Maps to big.
VIDEOGAMES_271_5	negative	The controls just always feel awkward no matter how much you tweak your key mapping.
VIDEOGAMES_287_3	positive	-Make your own unique character from scratch in Baldur's Gate 1, and then after completing the first game, import them into Baldur's Gate 2 for true continuity and continue the saga.
VIDEOGAMES_137_21	negative	You can have up to four cows and four chickens at a time, which is not much.
MUSIC_260_21	positive	Recommended like a rest after a hard day's work.
DVDS_192_21	negative	What really makes me hard pressed to call this a great movie though is the uninspired dialogue that spans across each character.
BOOKS_171_5	positive	Then I read this book, gave its simple plan a try and realized less than two weeks later that my back pain was gone.
VIDEOGAMES_134_63	negative	What is with Square and having the characters do 9999 damage regularly?
VIDEOGAMES_140_21	positive	Any race can truly beat any race.
ELECTRONICS_76_5	negative	You are unable to check a log or bread crumb pattern.
ELECTRONICS_220_4	negative	The auto-fit option flattens standard photos quite a lot, while the other options leave space on either side of the photo.
BOOKS_172_10	positive	King saves the most harrowing prose for the book's closing chapter, where he describes in detail the accident that almost took his life, and the role his writing has played in his recovery.
ELECTRONICS_219_5	neutral	Meanwhile, if you do all your computing/database use on a single machine, Bento's fine.
VIDEOGAMES_124_24	negative	If you are looking for a game buy Star Fox Adventures or Mario Party 6, not this.
DVDS_194_5	negative	The stupidest quote in this movie was by Sue storm when Von doom says: Let's not fight.
MUSIC_111_4	positive	Super quiet soft passages and reasonably rocking loud ones without a hint of tape hiss, it's all here.
DVDS_178_2	positive	There are only two scenes that I enjoyed in this entire film.
VIDEOGAMES_119_3	negative	( Like in any House of the Dead game ) nothing else.
DVDS_189_1	neutral	With cloaks flourished and hats put on and taken off ad-nauseum the two main performers Allen and Desdiri occasionally suffer from shortage of breath and at times you feel like screaming ""please just stand still"".
MUSIC_94_7	positive	i think it's much better than the original song...
VIDEOGAMES_288_5	positive	The beautiful ambiance will make you feel like you're actually in the game.
MUSIC_262_2	positive	A little more intensity would not hurt this album, BUT it is a good one.
MUSIC_240_1	negative	a complete rip-off and about as generic as it gets, it combines the most commercially viable aspect of Nirvana (loud guitars and screaming) with the down-tuned sound of Korn. Truely this band would do better to become a tribute band, which in many respects they are.
MUSIC_109_5	positive	No longer does the music feel constrained by the mono recording.
VIDEOGAMES_137_34	negative	Still, as good they may be, the cows really look bad in this game.
VIDEOGAMES_291_23	positive	Sound Sound... I LOVE THE KH MUSIC!
VIDEOGAMES_125_14	neutral	I always feel satisfied after ground and pounding an opponent to victory but the fighting is still rather simple and not much else goes on.
DVDS_181_18	neutral	She gave a stellar performance considering the poor script and direction of her character.
MUSIC_86_13	negative	Actually, this is the only Neil Finn release that has not been a favorite of mine.
VIDEOGAMES_272_17	negative	No....you pay $20,- for 3 hours 'more of the same'.
DVDS_187_20	positive	but the moive has it's high points, the CGI is great and the Dragon fights were amazing.
ELECTRONICS_220_6	neutral	Apart from this it seems to work fine.
VIDEOGAMES_265_5	neutral	Oter than that the sims are really cute but you also don't get a lot of clothes to choose from when you make your character.
VIDEOGAMES_269_12	negative	Now, of course, as you continue onwards, you find that weapons become even more expensive, and slowly begin having less, and less hit points, so when you do want to ''level'' up, you have to get new weapons every several battles, just to keep leveling up, which takes all your gold, which means to do anything else you need to go fight....
VIDEOGAMES_140_13	neutral	You really spend most of your micro-management on the heroes (you usually have 2 at a time, which makes the game just micro-intensive enough to be hard, but not so much as too make it frustrating.
MUSIC_258_5	positive	We can't wait for Beethoven's Wig 3!
VIDEOGAMES_121_4	negative	I don't think the creators could have done a worse job and honestly I hope SouthPeak doesn't get the option to make any more games.
VIDEOGAMES_141_11	positive	Airstrikes are great, fun, and you'll always have them.
MUSIC_105_10	positive	i would give this album 9/10
ELECTRONICS_207_9	negative	This means that your equipment will get dusty even if the bag is closed.
BOOKS_155_0	positive	As an avid Koontz fan (that sounds nasty, doesn't it) I enjoyed ""Demon Seed."" I haven't read all his stuff and almost passed this one up because, um, ""Demon Seed""?!?
BOOKS_155_3	neutral	This is a quick read and, okay, not very deep.
MUSIC_112_18	positive	This band has such potential to go far: down-to-earth kids who love to hang out with their fans, catchy albums and they put on a fun and impressive live show (I was very surprised).
ELECTRONICS_72_24	negative	You must press the button down rather hard before it responds.
MUSIC_99_2	positive	And Billy--well, of course, of course.
VIDEOGAMES_270_4	negative	so again, i wouldnt advise any of u to buy it.
MUSIC_259_3	positive	The author/speaker carefully explains the meanings of the sayings of Jesus in their original Aramaic then teaches the listener the language forms of the various words.
VIDEOGAMES_136_15	positive	Pretty good story, and if it seems simple, don't worry; you will soon get into it.
ELECTRONICS_77_1	positive	Even picks up my neighbors networks.
VIDEOGAMES_266_0	neutral	At first it was ok.
ELECTRONICS_216_24	positive	6. It's fast!
VIDEOGAMES_121_6	negative	STAY AWAY FROM TWO WORLDS...DON'T MAKE THE SAME MISTAKE I DID!!!
VIDEOGAMES_136_0	positive	It surprises me how this game is underrated!
VIDEOGAMES_144_3	positive	A lot of humor and interesting quests if you take time to read them.
VIDEOGAMES_141_5	positive	Good graphics.
MUSIC_258_2	positive	Richard Perlmutter has done it again - this cd is brilliant and has quickly become a beloved cd for our entire family.
VIDEOGAMES_131_5	negative	If you get killed, you have to do it all over again, and again, and again, ... I recommend playing this game at the ""normal"" setting the first time - perhaps then it would have been more fun.
ELECTRONICS_225_0	neutral	Pros: Durable, Quiet ... Cons: Slow Connection I picked this up as a backup device for home machines as well as a home office computer.
DVDS_205_11	positive	Enter equally unlikely meet-cute Harmony Faith Lane (the luscious Monahan, who makes a sexy funny performance cook to perfection) a childhood friend from Harry's past who shows up at a party that both Harry and Perry are attending for Shaw. Seems Lane has always pursued her dream to be an actress and ever since they were kids playing magician and assistant (guess who and guess who) she came to La-La-Land with little fanfare and a broken heart.
BOOKS_150_9	positive	On the positive side, Tierney's got a smooth narrative style, and the book might make a nice novel.
VIDEOGAMES_275_2	neutral	and whats make me stop playing is that after i finish a tournment and cont my mission.
VIDEOGAMES_289_0	positive	""Innovative"" I played GC endlessly when it came out.
VIDEOGAMES_291_3	positive	Story The plot is what really kept me fromlosing hope of this game.
MUSIC_95_11	negative	Um, and that one guy that wrote the review that says, ""these guys are mega wicked chill"" um, I think you must wear like Calvin Klien or Armani, because your pockets are so tight, and I don't even think you know what you're talking about.
MUSIC_96_4	negative	I don't think so.
VIDEOGAMES_134_34	negative	There really isn't anything to the main character, which is unfortunate since we spend so much time with him.
VIDEOGAMES_275_0	neutral	This game is pretty easy to play but when u play for a few hours....
VIDEOGAMES_134_50	positive	I like this system much better than junctioning and materia and even espers.
VIDEOGAMES_289_6	negative	Just when you think you got it figured out, you will get hit upside the head, or start a game with tougher enemies that just kill you.
DVDS_192_15	negative	The choreography in these scenes doesn't lend itself well to physics either, where barriers such as gravity and an individual's physical strength are breakable at the character's convenience.
BOOKS_146_12	negative	This is a hand guide to obvious intellectual/emotional underpinnings of 'reverse-Nazism', in Exodus, all non-Jews are gutless traitors lacking in all attributes desirable to a human being, while the heroic, courageous, morally upright, (superior race!)
VIDEOGAMES_277_19	negative	Brilliant, loving this.
MUSIC_263_2	positive	They are cute and they can sing and dance.
ELECTRONICS_211_0	neutral	Pros: seems to work okay so far Cons: ENCRYPTION KEY IN PLAIN TEXT If you get this product, do NOT install the client.
VIDEOGAMES_293_1	positive	It gets you strait where the first game left you - right into the action!
VIDEOGAMES_293_6	positive	I didn't experience any slow downs or others issues.
VIDEOGAMES_271_6	negative	Miserable to play throughout.
DVDS_177_8	negative	To add, the plot is TERRIBLE, and questionable.
ELECTRONICS_223_8	negative	And I have to call you back on long-distance, and then wait forever to the muzak and then hope that you might authorize a replacement, I asked.
ELECTRONICS_230_8	positive	I like the wired remote w/ volume and bass controls & headphone and line-in jacks.
ELECTRONICS_78_8	positive	The vibration reduction cannot be faulted even at maximum zoom.
DVDS_198_5	positive	Arguably the best of the Batman films and highly entertaining; what more can you ask for when you see a flying Batman soar over the glassy plains of Gotham!
MUSIC_253_7	negative	To me it was just not original.
BOOKS_161_3	positive	Likewise with the heirloom vegetables.
MUSIC_98_5	negative	Gone is the wonderfully fat bass line, especially those G's (G1 on your piano keyboard).
MUSIC_101_6	neutral	This DVD was interesting but was a far cry from the complete picture.
VIDEOGAMES_134_43	negative	Why not just alert the player by saying ''Hi, I'm going to be the last boss in this game, or at least one of the last bosses.''
VIDEOGAMES_136_23	positive	The places never look the same, which is a good point.
DVDS_178_8	negative	People lose their last Baby-Tooth every day, but it is never explained in this movie why this Tooth-Fairy hasn't paid deadly visits to others throughout the world.
ELECTRONICS_207_8	negative	Another bad part is that this bag has no additional zipper to close the main compartment like most other bags do.
MUSIC_260_8	positive	The third song, ""Under Azure Skies"", deserves a paragraph of its own.
1098	neutral	If they don't, Chairman Baucus [of the Senate Finance Committee] will propose legislation which will be in the next 24 hours to give this money back to taxpayers by subjecting the bonuses to severe tax penalties - more than 90 percent,
1407	positive	NATO is the only relatively successful exporter of stability and democracy. We should care about the democracy of our eastern neighbors,
1166	neutral	That's the value of the assets of Deripaska's companies, minus debt,
1130	positive	Our movement rejects any agreement until all political prisoners in the West Bank are getting released and until the security apparatuses stop chasing Hamas members in the West Bank,
1534	neutral	One consisting of 20 people or more would continue working in Georgia. The other one consisting of eight people, as before within the old OSCE Mission in Georgia, would operate in the regions adjacent to Georgia from the side of South Ossetia,
968	neutral	China Telecom's operations in Shanghai is more solid when compared to other cities, hence the decision to chose the city first for 3G trials,
923	neutral	I was by myself with Brodeur and saw Richie on the corner on the left side. I thought it would be open net for him,
367	neutral	Mugabe is going to try to hold onto his man (Gono) as much as he can because I don't think he wants to create an impression that the men and women who have been with him through thick and thin are expendable,
1389	neutral	We'll also, if need be, represent Kosovo, like for instance in the CEFTA. We'll take part in consultations on upcoming issues from the secretary-general's report, but those are only technical consultations where UNMIK is one of the participants, since most are related to police, judiciary and customs, which are now under EULEX's jurisdiction,
1387	neutral	I know that he didn't play against Aston Villa [on Sunday] but I hope that he will play in the next game.
368	neutral	Mugabe is going to try to hold onto his man (Gono) as much as he can because I don't think he wants to create an impression that the men and women who have been with him through thick and thin are expendable,
409	neutral	Low carbon growth is the only growth story, because high carbon growth would eventually choke itself off. The world would react strongly to an America lead as we go forward to build an international deal at the United Nations climate change conference in Copenhagen at the end of this year.
789	neutral	It is clear that today's outcome will not kill off the proposals to extend copyright term, but rather that member states need more time to consider that details of the proposal and reach an agreement,
1544	neutral	I can confirm that Gerry McCann, myself and Adam Tudor from Carter-Ruck will all be giving evidence to the Culture, Media and Sport select committee following an invitation from the chairman to do so.
654	neutral	On Saturday, I went to the Supreme Court asking for the date of the hearing and also to submit my defence,
1568	neutral	Rtd Gen Zvinavashe was a committed member of our party Zanu-PF and also of the army. He was very loyal, a military strategist and a hero of excellence. He also left an indelible legacy in education by building schools, which is an indication that Rtd Gen Zvinavashe wanted the people to also get access to education,
1358	neutral	Neither Microsoft nor [Microsoft PR agency] Burson-Marsteller has ever paid money to either Privacy International or 80/20 Thinking, nor has any benefit in kind been given,
1181	positive	This is an important step for us as a standalone business. It also confirms our determination as a team to steer Jaguar Land Rover through these extraordinary and challenging times, so that our business is ready to take advantage when the downturn finally ends.
1279	neutral	It's tough out there. It's U.S. Open conditions,
767	neutral	I did not negotiate, settle or approve Sir Fred Goodwin's departure terms. All these issues were handled by RBS,
319	neutral	The public wants to trust Obama,
446	neutral	I think so. If there is continuity in the negotiations from the government parties, then the Social Democrats are interested in a very quick solution, by the end of this week,
1214	neutral	As chief executive, Tim will be responsible for Terra Firma's day-to-day operations while I will concentrate on investments, investors and developing the business internationally,
1149	neutral	A new language toward the region is coming from President Obama. The challenge for everybody is for this to be the prelude for a genuine change in U.S. and European policies. Regarding an official opening toward Hamas, it's a matter of time,
1572	negative	We live in a democracy but I note from the Standards in Public Office Commission today that it expects everyone to live by the same rules as everyone else and I hope that whatever incomplete information he [Ganley] was able to give so far will be given.
786	neutral	We have to seek a consensus among member states about the importance of having negotiations on a free trade agreement,
337	neutral	no legal precedent supports the granting of the relief sought by the defendant Blagojevich in this motion.
1233	positive	contact between the Future Movement leader MP Saad Hariri and I were present even before Syrian-Saudi rapprochement.
1089	neutral	We discussed this question especially as Mr Muallem came here with a high-ranking security official, which is confirmation of the will of the Syrians to solve this problem,
1566	neutral	Rtd Gen Zvinavashe was a committed member of our party Zanu-PF and also of the army. He was very loyal, a military strategist and a hero of excellence. He also left an indelible legacy in education by building schools, which is an indication that Rtd Gen Zvinavashe wanted the people to also get access to education,
708	neutral	We'll get them in as quickly as possible ... but I don't want a situation in which they are subject to a legal challenge in the High Court,
1312	positive	Today's announcement of 'Partners in Education' demonstrates the willingness of Volkswagen Group of America to partner with K-12 and higher education in Tennessee to help prepare our young people for the highly skilled jobs of the future,
777	neutral	It was evident from today's discussions that a large number of member states ... do not want further extensions of reduced VAT rates,
760	negative	I don't think it's appropriate that the taxpayer should be providing any more benefits to Fred Goodwin.
1113	negative	We will not allow Hamas to build new bunkers or use piping to build missiles,
1299	positive	We founded Google Book Search on the premise that anyone, anywhere, anytime should have the tools to explore the great works of history and culture -- and not just when they happen to be at a computer,
1453	positive	President Sharif Sheikh Ahmed, the Speaker and Prime Minister have demonstrated responsible leadership in all fields and the unity Government is now functioning from the capital,
1408	neutral	That decision stands: Ukraine and Georgia will eventually be members of NATO [...], but enlargement is a performance-based project, and the question of when depends on their performance,
802	negative	The main fault lies with the Interior Ministry that did not submit even fundamental evidence. The NSSs decision is therefore not a verdict on the Workers Party, but a verdict testifying to the Interior Ministrys and Minister Langers incompetence,
331	neutral	I believe the issue of the deployment of a missile defense facility on Czech soil was among the main and fundamental reasons for Czech society and the Czech opposition to criticize the government led by Topolanek,
1229	neutral	It will help them [Hughes and Clark] for the fact that they will get to play some cricket and probably get a good amount of cricket under their belt, but I'm not sure they'll learn too much about themselves or about the England Test team though by playing those few county games,
1530	neutral	If indeed after June we have no more UN or OSCE mission, then Georgia's need (for security) will concentrate on EUMM ... There should be one element of stability in the form of an international presence on the ground, and therefore we could not consider phasing out EUMM at this point in time,
1335	negative	It's our desire that the Republicans would work with us and try to be constructive, rather than adopt the philosophy of somebody like Rush Limbaugh, who is praying for failure.
286	neutral	absolutely devastate the historical legacy of the Obama administration,
1473	neutral	Israeli tactics put Shalit's issue at risk,
1466	neutral	right from the very beginning that the truce and Shalit would be separate tracks
1073	positive	It seems the IRS and Treasury Department went out of their way to knock out an emerging, effective and evenhanded way to collect tax debt that the IRS will otherwise never collect,
1477	negative	ETA is the threat that hangs over all elections in the Basque Country,
343	positive	Rick Wagoner has worked for that company for 31 years, and he is a good man. He clearly is a sacrificial lamb,
565	neutral	so far we have announced candidates for 28 out of the 42 Lok Sabha and 195 out of the 294 assembly constituencies in the state.
1203	negative	We cannot continue with a postcode lottery where people like the Tadley residents can't have access to NHS dentistry.
1524	neutral	And I know Wales coach Warren Gatland likes Gavin Henson at inside centre.
529	positive	We want to congratulate Brad Pitt for making it right and to hear more about how we can work together so this can be replicated throughout the country.
852	neutral	The persecution of the opposition is beginning, and I'm sure that Rosales won't be the last to go to jail,
1013	neutral	I sensed personally more anti-Americanism on this trip than I did at any time during the Cold War, and it was dismaying,
1084	neutral	We are happy to welcome Goldline as one of our first sponsors of The Fred Thompson Show ,
1160	negative	it is not conscionable that Shalit is living there without being able to see his parents, while Hamas prisoners live here almost like in a summer camp.
621	negative	This breathtaking gaffe by Alan Johnson is another example of Labour's cavalier attitude to taxpayers
1138	neutral	Hamas has presented its demands to the Egyptian mediators, who relayed them to the Israelis. We hope that the Zionist enemy will accept our demands in the coming days.
1198	neutral	In England, 89% of prescription items are dispensed for free, the remainder provide valuable income to the NHS, of 437 million in 2009/10, which goes towards to the safety and speed of healthcare. But we are making the system fairer. Cancer patients will be eligible for free prescriptions from April 1 this year and we're looking at how we can do the same for people with long-term conditions.
1506	neutral	Someone from Raising Malawi visited me last week and told me that my son may be visiting me sometime next week. I am delighted, I want to see my son.
1549	neutral	that refuse to incorporate the highest standards of the OECD and the United Nations
1427	neutral	NATO needs Russia and Russia needs NATO,
1391	neutral	NATO has taken on a United Nations mission and NATO must succeed or I do think the future of NATO as we've known it is in considerable doubt,
817	neutral	I have a contract until June with Real Madrid. I don't think it will be my last contract.
359	neutral	By going after big symbols like Coca-Cola, he is sending a message he will take on anyone,
1447	neutral	Starting from today, eight cities of Ukraine will have big-boards with Gogol's portrait and some quotes from his works dedicated to Ukraine,
1190	positive	We might have disagreements over his government position, but he [Omar] is a close friend of ours,
466	neutral	Al Qaeda has succeeded in regenerating itself over the last seven years, and it is again a threat to the United States homeland and to American influence around the world and to our allies around the world,
500	negative	At this current economic time, union bosses should set an example to their members who are probably struggling to make ends meet. 'If Derek Simpson thinks staying at the Waldorf Hilton can be justified to his members, then he is clearly living in a different world to them. 'If the unions want to be taken seriously, then their bosses have to behave responsibly.
1267	neutral	The market is caught right now between concerns over the decline in demand, and the prospect of another reduction in OPEC production levels,
673	neutral	We could have been Governor of Canada living in Ottawa in the Government House,
873	neutral	My department and the Equality and Human Rights Commission will assess the impact of unemployment on ethnic minorities, women, the disabled, older workers and other groups.
1104	negative	Prime Minister (Robert Fico) is misusing the fact that SMK presides over the Office (UVO),
1074	positive	The Treasury Department plan is based on the sound principle that if we are to revive our economy , we must unfreeze the credit markets so people can get the loans they need,
1171	positive	Founded just over five years ago, Air Arabia is now firmly established as one of the region's true success stories % and we are very pleased to be able to share that success with our shareholders, while still preserving sufficient capital to ensure the implementation our ambitious long-term growth strategy,
430	negative	I calmed him down and told him not to worry, Begin would get it in the end, because even his opposition wants peace more than him. He was in tears,
1525	neutral	Lieberman tried to delegitimize the Israel Police,
387	neutral	changes the way we approach the season from now until the Tour de France,
569	neutral	The UPA is no longer united ahead of the Lok Sabha polls. It has proved to be an opportunistic alliance, unlike the NDA (National democratic Alliance) which is united and strong,
581	neutral	If these plans are carried out, we run the risk of looking like a Third World country,
1426	neutral	As for consensus in Ukrainian society [regarding joining NATO], there won't ever be any consensus. This is confirmed by the present NATO members,
