20010907_01.55.54-27027-4	neutral	NATO has entered Macedonia to collect weapons from the guerrillas, but its 30-day mission is due to end on September 26.
non_fbis_12.22.23-26451-12	neutral	The government-controlled election watchdog, the Electoral  Supervisory Commission, accredited only 300 of the 12,500  election monitors requested by the opposition Movement for  Democratic Change.
20020320_20.36.59-7133-32	negative	This would of course require advanced technology and great cost to bring the matter to a claim submission.
temp_fbis_22.36.40-5626-3	neutral	The spokeswoman urged the US to strictly abide by the serious commitments that it had made to the Chinese government and Chinese people and stop the wrong actions so as to avoid further damage to Sino-US relations.
non_fbis_11.14.49-23456-14	positive	But Bush's pledge to do whatever is necessary to stop them and  nations like them appeared to represent a significant hardening  of the U.S. position.
20020208_20.29.29-13302-21	positive	"The president must go, he should resign, and before he does so, he should organize elections so that he leaves the country with a democracy, in the hands of a civilian," Soto boldly proclaimed at the "pro-freedom" forum.
20020204_20.38.59-25700-20	neutral	Dick Gephardt, the Democratic leader in the House of Representatives, and Tom Daschle, the Democratic leader in the Senate, have attempted the impossible feat of "setting partisan attitudes aside and supporting our President 100 percent in the war on terrorism," while at the same time trying to criticize economic and social policy.
temp_fbis_20.34.33-18786-52	neutral	Some of these are:       The range-which gases and sectors should be included in the quota system, and how businesses exposed to competition should be dealt with.
20011220_21.22.09-18839-6	neutral	Compared with the corresponding period last year, output volumes grew 16.1%.
non_fbis_08.05.55-10723-31	neutral	"The United States has to  get moving on screening these people and determining whether or  not they're P.O.W.'s.
20011118_21.04.32-17074-18	neutral	Buthelezi said the provincial health department was working closely with the welfare community and the private sector to secure funding for bodies working with Aids orphans.
20020223_20.53.55-17301-29	negative	The United States is greatly responsible for the slow settlement of the Taiwan issue and for the "Taiwan independence" forces running rampant.
20010926_23.17.57-23406-5	neutral	Chen's remarks came as the US was massing forces to launch reprisals against Afghanistan, where the prime suspect Usama bin Laden is believed to be in hiding.
temp_fbis_21.10.31-12974-5	positive	The world community became hopeful that it would be possible to solve the problems that brought about the UN Convention on Climate Change (1994).
20011007_03.17.23-6711-17	neutral	After this incident, Japan began to redesign the main engine of the H2 rocket.
20011218_21.00.22-21144-19	negative	But the Israeli response, with its "extra-judicial liquidations," is even more dramatic in a certain sense.
20020326_21.07.24-24231-0	negative	HONG KONG, March 26 (AFP) - China has disallowed a routine port call in Hong Kong for an American naval vessel, a spokeswoman for the US consulate said Tuesday.
non_fbis_15.13.14-22330-12	positive	The Chinese President said the economic open door policy and  reform in China has managed to establish a strong economic  structure and has enhanced Chinese competitiveness.
temp_fbis_21.10.31-12974-30	neutral	For example, Prof. Viktor Danilov-Danilyan maintain that "we must not speak of warming, but of global climatic changes; warming is merely one aspect of these changes."
temp_fbis_22.34.58-23977-6	negative	Military tensions in the Taiwan Strait were "not in the self-interests of the United States," she warned.
20020211_20.56.28-3485-10	negative	The medic blamed the outbreak on congestion in the slums and failure to observe basic hygienic practices.
20011220_21.22.09-18839-105	neutral	An increase in the number of available jobs (vacancies), accompanied by a drop in the number of unemployed citizens during the past 12 months, has reduced the strain in the labor market.
20020320_12.04.40-21590-3	negative	Bam on Sunday said she believed Zimbabwe's election was not free and fair, adding they were not in line with international standards as well as those of her organisation.
20020204_20.24.49-8480-24	negative	In reality, the United States is truly a country that has no qualifications and face to take issue with other countries by saying that they are an evil and so on.
20020121_21.15.10-2135-4	neutral	The meeting came two days after a 53-year-old homeless man was seriously injured in an explosion at a park in Tokyo's business and entertainment district of Shinjuku.
temp_fbis_21.10.31-12974-117	neutral	If microflora stop reproducing humus, the higher plants will die, agricultural crops will stop growing, and timber will start to dry up.
non_fbis_06.12.31-26764-6	negative	On this count, the national security adviser may  have erred.
20011116_20.44.27-28756-0	neutral	Minister of Science and Technology Ronaldo Mota Sardenberg headed Brazil's delegation to the Seventh Conference of the Parties to the UN Framework Convention on Climate Change in Marrakesh.
temp_fbis_21.10.31-12974-106	positive	Should we be happy about climate change?
non_fbis_15.16.19-1897-7	neutral	The  cosmonauts will have to use the electric motor of the docking  unit to manually un-dock the Progress M1-7 to the distance of  not more than one meter from the station.
20020301_20.57.02-23111-4	negative	Inspecting US Air Force bases some time ago, Cheney maintained that the United States would not accept WMD threats.
20011116_20.46.37-70-0	neutral	Seoul, Nov. 16 (Yonhap) -- The number of employees working on a temporary or daily basis have increased drastically as companies moved to slash labor costs after the financial crisis in 1997, the National Statistical Office (NSO) said Friday.
20020415_21.33.22-7140-8	neutral	Noting that financial crisis came to an end in Turkey, Dervis said, ``financial crisis and panic ended.
non_fbis_06.25.38-22700-32	neutral	Conversations between the cleric and the captives have taken  place, one on one, in his native Bengali and Urdu.
non_fbis_07.52.36-18982-7	neutral	As the base is located outside sovereign territory, the  prisoners have no legal rights under the US constitution, and no  right of appeal to federal courts.
20020318_20.48.00-11907-0	positive	Harare, March 17 (XINHUA) -- Despite Western pressure on him over his re-election victory, Zimbabwean President Robert Mugabe was sworn in on Sunday as the country's head of state to serve another six-year term.
non_fbis_14.06.39-26143-19	neutral	No one, however, is giving a hearty thumbs up to Mr. Tobin.
20020507_18.02.46-24802-16	negative	Rice is aware of the fact that President Yasir Arafat remained under siege in his headquarters in Ramallah for five months, imposed on him by the superior Israeli military in violation of all the accords that were signed by former Israeli governments and guaranteed by the United States.
non_fbis_08.03.05-5625-2	negative	Latin American and European government leaders today joined  protesters in Buenos Aires, Wall Street traders and financial  experts in putting at least part of the blame for Argentina's  problems on the lending agency and the Clinton and Bush  administrations.
20020517_22.08.22-24562-5	neutral	The committee said in a joint statement at the end of the  meeting that it will try to have the framework finalized at the  China-ASEAN summit in Cambodia at the end of this year.
20011007_03.17.23-6711-22	neutral	This satellite doubled the capacity of the test satellite previously launched by Japan.
20020404_21.30.26-14869-0	neutral	DELHI. April 4 (Interfax) - The situation in Central Asia is stable and all threats to its security have been warded off, Russian Security Council Secretary Vladimir Rushailo told Russian journalists in Delhi on Thursday.
20011206_21.18.24-28147-5	neutral	The US authorities began to investigate this gang's activities and its possible connection with the 11 September terrorist attacks, after the arrest of a group of Brazilians and another group of Iranians in Texas in October.
temp_fbis_20.41.29-25820-80	neutral	They shall receive humanitarian treatment, and they shall especially not be subjected to any outrage, coercion and humiliation, or harassment by the curious public.
20020209_20.27.35-29256-17	negative	The world well remembers how the United States has been calling other countries as violators of human rights, while it has been involved in one of the grossest type of human rights violations.
20020314_20.27.25-21759-18	negative	Throughout these years Israel kept on building new settlements or "fattening" existing ones and expropriating Palestinians lands.
20020507_17.55.53-20579-9	neutral	The deceased, a shopkeeper by profession was abducted by unidentified gunmen from his house during the preceding night.
temp_fbis_22.34.58-23977-19	neutral	Chinese missile tests over Taiwan in 1996 resulted in Washington deploying two aircraft carrier battle groups to the region.
20020217_20.42.51-22299-8	negative	"We are also against Japan's cooperation with the United States over any military action," Watanabe said.
temp_fbis_21.50.57-15245-9	negative	Outside the borders of Venezuela, Chavez faced America's hostility.
20020315_20.38.49-16233-4	neutral	A total of six space launches from Baykonur, including four cargo launches, scheduled within the ISS programme this year.
20020418_21.45.32-26215-15	neutral	For example, a new Israeli-Arab war.
non_fbis_08.54.02-18235-22	neutral	He likens the effort needed to one the US Air Force undertook in  1951, when it began developing an aerial tanker to refuel jet  fighters and bombers.
20020318_20.48.00-11907-11	negative	In the run-up to the March 9-11 poll, critics had accused the Zimbabwean leader of stirring up the emotive land issue merely to garner support in the country's closest-fought election since independence in 1980.
20020429_22.02.19-8239-0	positive	Beijing, April 29 (XINHUA) -- Lebanese Prime Minister Rafik Hariri invited Chinese entrepreneurs to invest in his country at a luncheon was held here Monday in his honor.
20011209_20.32.39-1919-1	neutral	It wanted the PA to meet difficult, even impossible, security conditions.
20020320_12.04.49-21742-12	neutral	The Commonwealth leaders, many of them in the first place unable to understand the dispute between Zimbabwe and its former coloniser, Britain, breathed a collective sigh of relief at what they hoped was the beginning of the healing process.
20020201_20.45.53-22539-9	negative	"The accusations of ill treatment," Secretary Rumsfeld said, "are completely untrue.
20020203_20.46.36-9539-2	negative	on India's blacklist. In George Bush's presentation, any concrete references to the "objects" of Washington's extraordinary attention were thus exhausted.       Why Such a Selection?       It is open to question why such a selection was made. What is the d
20011014_22.00.23-1236-6	neutral	Prime Minister Guy Verhofstadt has announced on Flemish television that Europe will discuss the American actions in Afghanistan next Friday [19 October] in Gent [northwest of Brussels] during the informal [EU] heads of state and government summit.
20020409_22.17.52-18926-8	neutral	Thailand and China had preliminary talks on a bilateral free-trade area last year.
20020314_20.38.10-27533-18	positive	He said that the bust was nevertheless a significant and successful strike against gangs and businesses engaged in human smuggling.
20020331_21.09.25-22686-18	neutral	He was known to the Israeli intelligence service.
20020314_20.27.25-21759-20	neutral	But it is not war by any military definition.
non_fbis_05.20.33-11163-44	neutral	And when you say we're  talking to the Government of Saudi Arabia, are we talking to  them about starting such programs up, or are we just simply  mentioning that they have a human rights problem?
20020327_20.50.33-2917-33	neutral	To Malan, however, more important than the harmonization of the parameters and the little Maastricht is the search for convergence of policies in a broader sense - structural, macro and microeconomic ones.
temp_fbis_20.53.10-15177-1	neutral	The annual report published by the National Bureau for Defending Land and Resisting Colonization in cooperation with the International Solidarity Establishment for Human Rights said that the nuclei of 36 new settlements were established from March 2001 to the end of November 2001 in various parts of the West Bank.
non_fbis_11.04.20-23621-4	negative	Amadeo said the  president told him, ``I have never had so many calls in my life  from all the groups saying they don't want us to touch them.''
non_fbis_13.05.15-16517-38	neutral	Domestic opponents claimed his government was secretly arming  neighbourhood block committees known as Bolivarian Circles,  named after South American liberator Simon Bolivar, to defend  his revolution.
non_fbis_12.46.57-22041-12	neutral	A Humvee moves slowly around the perimeter as US Marines, M16  assault rifles at the ready, stand guard.
non_fbis_09.18.38-22306-3	neutral	"I ... therefore declare Robert  Mugabe the winner for the office of the presidency of Zimbabwe,"  Mudede said.
20020314_20.23.54-19638-41	positive	Justice always finds support, however.
20010718_23.47.18-27024-5	neutral	The Taleban have also launched an offensive in the Andarab area in Baghlan Province.
non_fbis_12.22.23-26451-29	negative	The MDC says as many as 34 of its supporters have been killed  since the presidential campaign began in January and fears are  rising there will be an explosion of violence next week, no  matter what the result of the election.
20011217_20.37.28-19761-27	negative	Israel is adamantly against the creation of a completely independent Palestinian state.
non_fbis_08.01.38-4843-7	neutral	But Mr. Bush's aides have  adopted a policy some call "tough love," meant to reverse the  expectation in capitals around the world that if you are big  enough, or strategically important, Washington will always find  a way to prevent fiscal and political collapse.
20020220_20.52.31-12963-6	neutral	we want a warm peace, not a cold peace, between our nations."
20010620_13.40.05-15087-2	neutral	A set of tests specifically for Congo fever were still outstanding.
20020414_21.17.08-16542-5	negative	People are being killed in masses and buried in collective graves.
20020322_21.05.41-14545-40	neutral	After the Supreme Court nullified the General Laws Amendment Act, the President used his powers to reinstate most of its provisions through a statutory instrument.
20020508_21.58.34-17613-9	positive	Ivashev further said the United States is after gaining superiority over Russia's nuclear capabilities and initiating an anti-missile defense system by the United States shows that country's intentions.
temp_fbis_20.45.09-11809-16	neutral	Because of this, Koizumi noted the need for the international community to cooperate in tackling Iraqi issues and enthusiastically asked Bush to not take the bold course of launching military action.
20020320_11.38.42-28823-11	neutral	The delegates include Tan Hup Thye from Refco Singapore Pte Ltd., Stuart Dean of GE International, and Edward Gilbert of Merrill Lynch (Asia Pacific) Ltd.
20011203_21.23.57-11596-0	neutral	Youths Nidal Sanduqah and Ra'fat al-Bajjali were seriously injured as result of a strong explosion that rocked the center of Bethlehem.
non_fbis_12.03.26-29353-36	neutral	But successful management of the economy - the second  front - is essential so that the resources needed for defense  needs can be made available without causing serious damage to  the economy.
non_fbis_08.46.28-13637-28	negative	After  getting sniffed by a German shepherd who's more interested in  bombs than my colleague's Percocet, we're escorted to the media  center, an ugly wood-paneled affair that sits next to a pink  hangar.
20020122_20.36.01-11616-22	negative	Not only with the protection of the civilian population does something sometimes go wrong.
temp_fbis_21.10.31-12974-54	neutral	This is just the time to recall that the energy requirements of Russian output are among the highest in the world (see graph [omitted here] -- Ed.).
20020414_21.17.08-16542-14	positive	The public opinion in the Arab and Islamic world is following closely what is happening in the occupied Palestinian territories.
20020221_21.03.19-22060-0	positive	TAIPEI, Feb 21 (AFP) - Taiwan Foreign Minister Eugene Chien on Thursday hailed US President George W. Bush for not trading away the island's interests to Beijing.
20020131_20.50.32-16604-11	neutral	The United States wanted this very much, because so far the identity and citizenship of those they call "terrorists" (or "killers" in Bush's languages without nuances) rather than prisoners in a conventional war have not been published for reasons that are easy to understand.
20010718_00.42.54-29681-4	negative	The exclusion of China from the recall has led to claims that the firm was biased against Chinese customers.
20020122_20.36.01-11616-49	neutral	Not in the United States alone are the screws being tightened.
20020201_20.41.37-18755-19	negative	By reviewing the scattered cases of terrorism, Bush has turned the world into a single front against terrorism and against the proliferation of weapons of mass destruction.
non_fbis_08.22.04-29634-16	negative	Helping Taiwan build its military muscle will only foment  pro-independence forces.
20011129_21.35.18-3709-8	neutral	"We cannot stand on the sidelines of this global tendency," the Kazakh president said.
non_fbis_07.16.31-13271-8	negative	These include explosive political frustration, a swelling tide  of desperate refugees and a growing reluctance by foreign  companies and donors to invest in the region.
20011024_21.21.31-27111-12	neutral	The purpose of the trip of Hugo Chavez is to find ways of effectively protecting the oil market and the world oil prices, as well as the interests of Venezuela as one of the world's biggest oil exporters.
non_fbis_11.14.49-23456-5	positive	He repeated  the theme Wednesday during a town hall meeting in North  Carolina, saying, ``The United States of America will do  whatever it takes to defend our security.''
non_fbis_10.12.58-29108-5	neutral	In doing so, the White House is swapping the silver-visored  helmet of a space cadet for the green eyeshade of a consummate  bean counter.
20011230_21.17.41-25537-11	positive	The commitment to liberalism, the second strand of the Menem program, lived up to its promises.
temp_fbis_20.43.16-10786-1	neutral	Seven months after having rejected the Kyoto Protocol because he considered it to be without scientific basis, detrimental to US economic interests, and unfair in not obliging medium-sized nations (like Brazil and India) to reduce their gas emissions in the same proportion as that imposed on industrialized countries, Bush made public the plan that, he promised, would not have any of the defects of the Kyoto Protocol and would achieve the same, if not better, results.
20011114_20.42.07-7434-14	neutral	If he left now, it would be a disaster for the government," was his response.
20020118_21.16.15-1122-4	neutral	The findings from the visit, which got under way on Friday and is expected to last at least one week, will be presented directly to US authorities, Christen told reporters.
20020213_20.55.56-1089-2	neutral	The man was caught by police while secretly slaughtering a cow at his farm.
non_fbis_11.08.55-4179-7	neutral	Because the base is not on U.S. soil, people detained there are  not entitled to American residency and eventual citizenship  privileges.
20020130_21.00.11-67-5	neutral	This is because of the high costs involved, and the poor conditions of the local landing strip.
non_fbis_16.23.04-4326-1	positive	BUENOS AIRES - President Eduardo Duhalde yesterday pleaded for  patience as he works on the country's economic crisis.
temp_fbis_20.34.33-18786-12	neutral	North Norway will also get more precipitation in the fall but warmer temperatures in the winter.
20011024_21.21.31-27111-3	positive	He stressed he was especially satisfied with the fact that "the Russian-Venezuelan dialogue has become stable and dynamic." In his opinion, this is a positive factor, especially from the point of view of ensuring stable oil supply on the world market.
20020411_22.23.02-12197-1	neutral	In addition, the Parliament called for imposing a weapons embargo on Israel and the Palestinian Authority.
non_fbis_11.30.45-27115-3	neutral	Between the armored vehicles ferrying Taliban and al Qaeda  prisoners to Camp X-Ray and the international observers whizzing  past, it may be time to dust off the only traffic signal that  ever operated on the 45-square-mile base, says Navy Capt. Robert  A. Buehn.
20020419_21.47.55-9546-21	neutral	But Chavez in his 2000 visit to some OPEC member states made a stop at Baghdad where he held talks with Saddam.
20020304_20.50.30-97-16	neutral	To protect our climate we will have to reduce emissions.
non_fbis_11.04.20-23621-34	neutral	U.S. companies had investments totaling more than $16 billion in  Argentina through 1999, according to the State Department.
20011111_20.41.07-12494-9	negative	We are going to give a voice to people that you dont want to hear.
20020221_21.03.19-22060-3	positive	Chien voiced his gratitude to Bush for "having honored his commitment" he pledged to Taipei before his Asian trip, which also took him to Japan and South Korea.
non_fbis_06.20.40-8369-14	negative	Al-Qaeda is a terrorist  organization, not a state, and its crazies wear street gear and  operate disguised as civilians.
20020129_20.52.23-14674-13	neutral	Since he announced the dates for the Presidential election on January 9, the Government had taken steps and set on course various processes to facilitate the holding of a smooth electoral process.
20020224_20.56.08-8888-2	negative	France's Finance Minister Laurent Fabius thinks that there is something the United States above all fails to understand: To secure the future, an increase in development aid is absolutely essential.
20011008_22.27.34-26526-19	negative	The economic impact of the 11 September attacks was already disastrous, with clear effects on the world economy, hitting the poorest countries by far the most.
temp_fbis_21.31.56-18015-6	positive	President Chavez thanked President Khatami for his telephone call and wished success for the Iranian government and nation.
non_fbis_07.52.36-18982-40	neutral	The most important is former Justice Minister Mullah Nuruddin  Turabi - known to be close to Taleban leader Mullah Omar -  former Defence Minister Mullah Ubaidullah and former Industry  Minister Mullah Saadudin.
20020315_20.42.26-19148-29	neutral	"Both the Deputy President and President Mugabe agreed on the need for continued consultation and co-operation between the two governments to address economic matters such as the shortage of grain, and continued co-operation, trade and investments and a number of other bilateral issues."
20020424_21.47.41-28228-14	positive	Americans will want to know who exactly is running their country.
20020205_20.41.01-8736-15	negative	Some commentaries said that including Korea on the "Axis of Evil" list would irritate Korea and would cause Japan and the Republic of Korea (ROK) feel disturbed.
20010829_01.48.48-11084-19	positive	"I believe less than 10 per cent of Taiwanese now favour independence," he said.
20020304_20.42.01-25605-3	negative	The UN rapporteur's new report on Iran, which he submitted to the commission on Friday, includes nothing new.
20020118_21.16.15-1122-6	neutral	As long as this confidentiality will allow us to get results in the humanitarian sphere we will keep to it," he said, adding it would be the first of a series of visits.
20020324_20.55.32-6296-6	neutral	Russian-Mongolian trade currently amounts to $240 million and makes up only 25% of Mongolia's foreign trade turnover.
non_fbis_12.09.12-23643-9	negative	"The Australian government  is, frankly, pathetic in that, for the argument of convenience,  we are letting this man be held in conditions that clearly  violate established conventions on the treatment of prisoners."
20011016_22.25.44-26373-11	neutral	Syed Hamid said critics must also accept that the war against terrorism could affect civil liberties.
temp_fbis_20.34.33-18786-60	neutral	In addition to producing climate benefits, such measures will contribute to development and reduced local pollution in poor countries.
non_fbis_14.06.39-26143-23	negative	In the Citizen, columnist Rosa Harris-Adler wrote a  devastatingly sarcastic piece, ridiculing Mr. Tobin's assertion  that he was leaving for family reasons.
non_fbis_11.14.49-23456-11	negative	The rhetoric also caused shudders in U.S. allies South Korea,  where President Kim Dae-jung has rested his reputation on easing  a half-century of confrontation with the heavily armed communist  North, and Japan, which is also within missile range of North  Korea.
20011124_20.49.56-27748-0	positive	MANILA, Nov 24 (AFP) - President Gloria Arroyo praised Malaysia on Saturday for the swift arrest of Muslim leader Nur Misuari, whose forces embarked on a fresh rebellion this week in the southern Philippines.
20020224_20.58.06-10542-2	neutral	Mr Abubakar was met at the Harare International Airport yesterday by officials from the Electoral Supervisory Commission, Foreign Affairs and representatives from the Commonwealth Secretariat.
