20011124_20.49.56-27748-2	negative	Foreign department spokesman Victoriano Lecaros said the arrest should serve as "a warning to terrorists that they will find themselves on inhospitable ground within ASEAN," referring to the 10-member Association of Southeast Asian Nations.
temp_fbis_21.20.14-9569-0	neutral	[First announcer] Hugo Chavez was ousted today as a result of a coup d'etat.
non_fbis_12.07.16-6586-15	negative	"Enough.
20020131_20.50.32-16604-12	neutral	According to information circulated by the main US newspapers, the detainees are citizens of 25 countries, including England, France, Australia, Yemen, Algeria, and even Sweden (!).
non_fbis_12.07.16-6586-4	negative	Taking on a job many in his own Peronist party spurned,  Rodriguez Saa is expected to serve as president at least until  new elections, tentatively scheduled for March 3.
non_fbis_16.01.33-12919-12	neutral	The Soviet Union can launch ambassador Liu Xiao into space!
20020208_20.29.29-13302-8	neutral	Earlier in the evening a crowd prevented a group of military police from arresting Soto, hours after he appeared at an event in a Caracas hotel, calling Chavez "undemocratic" and demanding the president's resignation.
20011029_20.27.05-27044-14	neutral	He has one daughter.
20020109_14.06.40-17312-9	neutral	"It this information is correct, it means that fewer people will have been exposed to radiation," said Hans-Bertil Hakansson, Studsvik managing director and concern chief, to DN [Dagens Nyheter].
20020122_20.36.01-11616-38	negative	The need for timely and accurate information about possible new attacks is naturally particularly great, but whether the global ban on torture can be abused on that account is another matter.
20020315_20.22.38-4806-16	negative	The US stance, however, makes the dialogue impossible.
non_fbis_12.08.27-27397-27	negative	"We expected we were going to win this election," admitted Hilda  Mafudze, an MDC member of Parliament who had been threatened by  Mr. Mugabe's toughs and prevented from campaigning in her home  riding south of Harare.
20020111_21.05.06-7601-4	positive	We readily accept that there are good intentions on the part of both the government and this country's various sectors to comply with the Kyoto standards.
temp_fbis_21.28.50-13504-10	negative	Without a trial, without an attorney.
temp_fbis_21.37.46-9337-34	negative	The US human rights report also accuses China of taking advantage of anti-terrorism campaigns to crackdown on ethnic group people living in the Xinjiang Uygur Autonomous Region.
temp_fbis_21.10.31-12974-69	neutral	It was preceded by the UN Framework Convention on Climate Change.
temp_fbis_21.24.00-10191-11	negative	Israeli's own 35-year-old occupation and resettlement policies have created the breeding ground for the terrorism that Sharon is now trying to root out by resorting exclusively to military means.
20020331_21.09.25-22686-17	neutral	The bomber was a member of Hamas, the radical Muslim organization.
non_fbis_15.11.50-23748-13	negative	Hugo Chavez is not the formal president yet, as he had to resign  under the pressure of the plotters.
20020220_20.57.00-17276-0	neutral	ANKARA, Feb 19 (A.A) - President Askar Akayev of Kyrgyzstan arrived in Ankara late on Tuesday.
20020320_11.52.35-10118-9	neutral	Then you find a dramatic portrayal of the reversed situation in which the Shaykh, or in this case the "US," Anthony Zinni, advises Abu-al-Ila, "Palestinian," to bow and accept the mayor's, "Israel's," demands, or else he would be convicted of possessing weapons of destruction in the eyes of the authorities.
non_fbis_15.08.17-13301-6	neutral	In April, 28-year-old South African millionaire Mark  Shuttleworth will visit the station.
temp_fbis_21.07.24-28603-4	neutral	While past trips to China by US presidents have produced agreements or statements that have damaged Taiwan's interests, Bush's visit only enhanced the nation's confidence in his administration, Cheng said.
non_fbis_12.30.38-25095-7	neutral	Two  Russians are also among the six-member crew.
temp_fbis_20.41.29-25820-76	negative	In short, they are not allowed to move freely.
20011210_20.28.15-21486-0	negative	Tehran, Dec 9, IRNA -- Tehran-based Islamic Human Rights Commission (IHRC) on Sunday expressed concern about return of the period in which force and weapon had the last say in international relations.
20011228_21.10.24-16924-6	negative	Chavez added that "they are going around looking for a Pinochet, analyzing man by man to see who could be the Pinochet that they could pit against Chavez, and I am sure that there is no Pinochet in the FAN.
temp_fbis_20.55.24-19278-32	positive	By implementing our European and national climate protection programs we will succeed in creating several hundred thousand new jobs by 2010.
20020311_21.42.46-13715-0	neutral	Yesterday [4 March] the US Department of State publicized its yearly report in which it analyzes the "human rights situation in the world."
temp_fbis_20.43.16-10786-16	neutral	The second conclusion is that, contrary to what some optimists were predicting after 11 September, Bush seems to have decided to stick to a course of arrogant unilateralism when conducting his foreign policy.
20011024_21.53.09-11428-8	neutral	He explained that both the US and Jordan have different issues to deal with on a national level, including environmental issues.
non_fbis_12.07.16-6586-9	neutral	Rodriguez Saa yesterday told the television network Todo  Noticias he would announce an economic plan to ease the crisis.
20020302_21.01.08-20603-1	neutral	Auch, 2 March (AFP): A fourth case of bovine spongiform encephalopathy (BSE) was recently confirmed in the Gers department [of southwestern France], the Gers prefecture announced on Saturday [2 March].
20020123_21.21.45-6259-4	neutral	Volume on the main section decreased to 303.91 million shares from Tuesday morning's 328.82 million, with losers surpassing gainers 863 to 466, and 153 issues finishing the morning unchanged.
non_fbis_08.54.02-18235-5	neutral	The latest "tour-o-naut" to buckle up and place his  tray table in the upright, locked position is South African  venture capitalist Mark Shuttleworth.
non_fbis_08.06.09-13335-4	neutral	Prison officials have reportedly  strengthened the already heavy security at the prison for  precautions.
20020403_20.59.27-22386-9	positive	Dr Abdullah also dwelt on the spread of education saying that teaching younger generation means steering the nation to prosperity and progress.
20011112_20.33.43-387-39	negative	They think she is travelling too much, while internal problems sap the country's energy, and that she has misplaced strategic priorities in her overseas visits.
20020217_20.53.10-28693-6	neutral	The US president embarked on a week-long tour of Asia late Saturday with stopovers planned in Japan, South Korea and China.
non_fbis_11.14.43-703-2	neutral	It is a stark reminder that  differences remain between two former enemies who have moved  closer together since Sept. 11.
20020207_20.23.04-14788-14	negative	"Now President Hugo Rafael Chavez Frias destroys what had been accomplished throughout more than half a century and intends to return to the obsolete military organization, not knowing the meaning of the duties of the organization, control and harmony organisms that military actions must have
20011208_20.31.54-28680-1	neutral	Pragmatism is, in the first place, the United States' traditional policy.
non_fbis_11.30.45-27115-14	neutral	Born in Brevard County, Buehn is a Navy pilot whose rank of  captain equals an Army colonel.
20020206_20.23.00-9795-32	negative	Today, with this official "celebration," Venezuela is in mourning.
non_fbis_08.40.56-18707-1	negative	The Foreign Ministry said Thursday that it was "surprised, to  put it mildly" by the U.S. State Department's criticism of  Russia's human rights record and objected in particular to the  "odious" section on Chechnya.
20020430_22.09.32-24118-16	negative	They have pointed out: When will a "coup" not be called a "coup"?
20020207_20.22.42-14586-2	negative	Last Tuesday, before the US Senate's Foreign Policy Committee, Powell voiced his concern over "several actions by President Chavez and his ideas of what is a democratic system."
20020106_20.37.28-1540-2	neutral	Apart from Odi whose people topped the number of beneficiaries (they got 1, 733 out of 2, 374 persons treated), other councils which participated in the free health care are Kolokuma/Opukoma, 284 persons, Kaiama, 213 persons, among others.
non_fbis_08.36.15-7509-8	neutral	The Opposition's environment spokesman, Kelvin Thomson, said  yesterday that Australia "should not follow the US position on  climate change".
20010907_00.16.28-8800-10	neutral	Critics of the meeting, on the margin of the conference, up held the view that the American government, instead of heeding the wishes of international community, and protecting the security of world nations, and above all the safety of its own citizens, has paid more attention to the interests of corporations and huge arms producers and military-industrial complexes that reap tremendous profits annually from the sale of such armaments.
20020306_15.01.39-17844-9	negative	"The U.S. report is feared to further encourage North Korea's resistance against the United States, which was triggered by Bush's recent Seoul visit," a government source said Tuesday.
20011114_20.42.07-7434-25	neutral	There were meetings at Olivos over the weekend of 3-4 November, which resulted in the official decision to appoint Marx as the main negotiator of the fine print in the agreements.
20020119_21.16.53-1351-3	negative	The United States says the detainees are illegal combatants, not prisoners of war, and thus do not have rights under the Geneva Convention of 1949, which sets out the laws of war.
20020204_20.22.56-6451-8	negative	Islamabad's silence does not set a healthy precedent.
non_fbis_06.39.11-29583-2	neutral	"Soon, the government will delegate Jordan's representative to  the United Nations, HH Prince Zeid Ben Raad, to sign the  protocol," Juneidi told The Jordan Times on Tuesday, adding that  an exact date for signing of the environmental agreement had not  been set.
temp_fbis_21.37.46-9337-31	negative	"The 'Shouters' claim they are bigger than Jesus."
20020314_20.27.25-21759-12	negative	The first popular uprising, the Intifada, of 1987 and then the second one, which erupted 18 months ago, were desperate means by conquered Palestinians to end the occupation.
20020111_21.05.06-7601-32	negative	Thus the benchmark covenants could have very significant consequences for other sectors and target groups in our society, whereas the latter are not involved in the deliberations on those covenants.
20011204_21.34.10-25509-1	neutral	Ivanic is to meet with Chinese Deputy Prime Minister Qian Qichen and discuss possibilities for economic and other forms of cooperation.
20020328_21.19.21-15525-10	positive	ZANU PF however wants the MDC to accept the result of the presidential election and join it in a coalition government whose composition is not yet clear.
20020127_20.20.54-21851-1	negative	PAS President Datuk Fadzil Noor said PAS did not agree to such treatment of the Taliban and Al-Qaeda soldiers as they were prisoners-of-war and should be accorded treatment as provided for under the Geneva Convention and in line with Basic Human Rights.
temp_fbis_20.58.47-19000-19	neutral	However, mandatory monitoring and reporting of emissions at company level would be necessary to adequately assess whether the proposals by President Bush represent an effort comparable to the ones under the Kyoto Protocol.
non_fbis_12.44.14-20223-4	negative	Call it Club  Gitmo.
20011111_20.41.07-12494-32	neutral	And lets consolidate those safety nets before we jump into a new round.
20020220_20.52.31-12963-17	neutral	What the effective ruler of Saudi Arabia had in mind, he told the New York Times on Sunday, was to offer Israel, in an address at next month's Arab League summit in Beirut, "full withdrawal from all the occupied territories, in accord with UN resolutions, including Jerusalem, for full normalisation of relations" with the Arab world.
20011108_21.52.21-20248-12	neutral	"If there are problems out there it is the issue of separatists who want to undermine the situation, and a very important issue is the East Turkestan terrorists and the Dalai Lama separatist clique," he told a press briefing.
non_fbis_07.20.20-11694-13	neutral	New Zealand said on Wednesday it was ready to impose sanctions  against Zimbabwe if the commonwealth decided not to suspend the  country after the vote.
20020210_20.31.39-22620-16	neutral	However, Washington said that neither group would be accorded prisoner of war status.
20020202_20.37.52-21155-17	negative	Argentine society is divorcing itself from political parties and national institutions, and it is in such an environment that radical responses germinate, such as authoritarian regimes and the formation of guerrilla groups.
20020508_21.54.31-15463-17	neutral	Militants killed two brothers, Mohammad Abbas and Abdul Jabar, at Sadwan village in Doda district yesterday.
20020121_21.25.31-10464-5	neutral	According to the US administration, they can be tried outside US territory before secret military courts and they can be condemned, even to death, without the assurance of having been found guilty "beyond all reasonable doubt".
20020204_20.24.49-8480-4	positive	At the beginning of this year, for instance, our Republic's government clearly conveyed, again, its steadfast position and will to achieve the fatherland's reunification, the greatest ardent desire of the nation, within the first few years of the 21st century at all costs by the united efforts of the nation.
non_fbis_09.53.15-23595-26	neutral	Mr Chavez is currently detained at Fuerte Tiuna army base in  Caracas and could face possible charges for his role in the  killings.
non_fbis_10.35.30-7542-2	neutral	"The continual sale of arms by the United States or upgrading of  relations with Taiwan will only lead to tensions across the  straits," foreign ministry spokeswoman Zhang Qiyue said.
20011231_21.05.45-10422-19	negative	"The political warning must be heeded.
20011230_21.17.41-25537-38	negative	But neither dollarization nor the currency board provides a guarantee of low interest rates, as there will always be an "Argentine risk."
temp_fbis_21.26.05-29959-9	positive	Chen said he admires all Taiwan businesspeople's patriotism and contribution to Taiwan's and their resident countries' economic development over the years.
20011230_21.17.41-25537-12	neutral	Privatization earned $40 billion.
20020128_20.50.06-12228-12	neutral	These funds allowed the Plesetsk launch pad, which was built in Soviet times to launch the Ukrainian Zenit carrier rockets, to begin to be re-equipped for the upcoming Angara and as well as the establishment of an entire ground infrastructure for launching light Rokot space carriers, remodeled from SS-19 ballistic combat missiles.
non_fbis_11.35.22-9439-8	neutral	As Endeavour slowly closed the final 40 feet, Culbertson rang  the ship's bell aboard the space station and announced in the  tradition of the high seas, ``Endeavour arriving.''
20011218_21.00.22-21144-4	neutral	However, we will not look back at the entire century that has just passed.
non_fbis_12.22.23-26451-32	positive	Didymus Mutasa, ZANU-PF's external affairs  chief, told South African television this week that if Mr.  Tsvangirai wins, ZANU-PF will support a coup.
non_fbis_15.05.17-7881-8	neutral	It slightly resembles of these rotating glass balls  which are usually used in disco clubs.
20020201_20.41.37-18755-18	negative	There was a smell of danger in President Bush's speech and it was clear in the United States' decision to adopt a tough policy.
20011121_21.21.46-15196-0	positive	HONG KONG, Nov 21 (AFP) -- The number of south Asians seeking political asylum in Hong Kong is on the rise following the US-led military campaign in Afghanistan, it was reported Wednesday.
non_fbis_11.14.49-23456-1	negative	WASHINGTON -- President Bush's declaration that countries such  as Iran, Iraq and North Korea represent an ``axis of evil'' that  must be prevented from acquiring weapons of mass destruction  touched off questions around the globe Wednesday.
20020130_20.43.33-11456-23	positive	The Arab and Muslim communities in the United States have made a great progress without considerable support from the Arab and Muslim governments.
20020122_20.32.22-8496-24	positive	"To begin with, I have great confidence that what the Americans are doing in relation to these prisoners is reasonable.
non_fbis_07.29.33-28852-2	neutral	As Zimbabweans go to the polls this weekend to re-elect or oust  Robert Mugabe, the only leader the country has ever known, the  question of who will win the election seems almost secondary to  how the loser and his followers will respond.
non_fbis_12.30.38-25095-5	neutral	Dr. MacLean will join the Endeavour crew for the 10-day mission  to complete the next stage of assembling the International Space  Station.
non_fbis_08.09.29-13319-42	negative	Some aides to Mr. de la R?gued that  the federal government should seize Governor Ruckauf's Buenos  Aires provincial police force in order to control the rioting  that surged in the working-class neighborhoods that surround the  capital city.
20011124_20.49.56-27748-11	neutral	Malaysia's official Bernama news agency said that Misuari and six of his men were arrested on an island off the Malaysian state of Sabah, which is on Borneo island, while trying to enter the country illegally.
20011218_21.00.22-21144-47	neutral	This applies to all the problems under discussion, including, of course, the issue of Jerusalem and of the refugees.
20010907_00.16.28-8800-23	neutral	And it is likely that until each party seeks its own particular interest in the conflict, and until the rivalry persists, the question would continue to remain unresolved.
temp_fbis_20.23.33-17594-36	negative	Japan should be condemned by the world for that.
non_fbis_08.09.29-13319-7	neutral	Mr. de la R?resignation will put the country's immediate  future in the hands of the moderate opposition party that  controls Congress and had recently begun blocking many of the  former president's policies.
20011218_21.00.30-21204-16	positive	In essence, it seems that they all agreed on one thing: meeting a commitment is inviolable.
non_fbis_04.33.07-17094-19	neutral	The country took the news of Mugabe's victory with  no great celebrations or protests.
20011024_18.09.35-13708-18	neutral	The two said they had no knowledge of the arrival of French arms in the country but said France sold arms to several African countries which could in turn re-sell them to other countries.
non_fbis_08.06.09-13335-5	negative	The Bush administration has been under international criticism  for not treating the detainees humanely.
20011121_21.21.46-15196-4	neutral	A spokesman for the security bureau said Hong Kong would not grant anyone political asylum under present policies.
20020228_21.12.01-14811-9	neutral	The price for the energy generated at Cernavoda is some $6 higher than the cheapest energy generated by the water power plants, yet some $20 lower than the energy generated by the thermal plants.
20020205_20.41.01-8736-23	neutral	Difficult for Britain and France To Agree with US
temp_fbis_21.50.57-15245-4	neutral	America called the action of several military generals, who were supported by capitalist as well as bankers, as the victory of democracy in Venezuela under circumstances where Hugo Chavez had come to power in 1988 through a popular process.
non_fbis_08.14.55-18533-4	neutral	Pentagon officials said some prisoners might  also be sedated during the more-than-20-hour flight, but it was  not clear whether that had happened.
20020427_22.23.51-4342-4	neutral	The visit of the Palestinian minister will be held in the run-up to the second meeting of mediators from Russia, the USA, the UN, and the European Union in Washington in early May, which will be attended by Ivanov and US Secretary of State Colin Powell.
non_fbis_11.08.55-4179-10	neutral	The prisoners from Afghanistan are not expected to arrive for  weeks, and Rumsfeld said there are no plans to stage military  tribunals or trials at the base, which is home to about 1,100  members of the Navy and Marine Corps.
non_fbis_07.20.20-11694-1	negative	TEHRAN -- President Robert Mugabe easily won Zimbabwe's election  on Wednesday despite biased propaganda unleashed against him by  some Western countries, accusing him of being unfair towards the  opposition.
non_fbis_09.53.15-23595-23	neutral	As tanks surrounded Miraflores, Mr Chavez was holed up with  senior military officers in a bid to save his presidency.
temp_fbis_20.57.35-19171-28	negative	According to Steve Sawyer, one of Greenpeace International's climate experts, the plan "will have very little effect on emissions, assuming it has any."
20020413_21.18.25-12166-1	neutral	The biggest seizure, amounting to 697 kilos, was made in the city of Iranshahr in the Sistan Baluchestan province, where four fire arms were also confiscated.
20011121_21.21.46-15196-1	neutral	Some 200 South Asians, most claiming to be businessmen, had sought political asylum from the United Nations High Commissioner for Refugees in Hong Kong between August and October, double the total number applying over the past seven years, the mass-circulating Chinese paper Oriental Daily News said.
non_fbis_17.41.39-5995-0	neutral	Europe to Tax Israeli Settlement Goods
20020212_20.42.04-19290-34	negative	"Great, keep on buying dollars so there'll be more and more poor people in the country," shouted one.
20020122_20.36.01-11616-51	neutral	In December 2001, the UK proclaimed a state of emergency and passed the Antiterrorism, Crime, and Security Act.
20011218_20.35.25-594-20	positive	Since this is how a government claiming to represent its people behaves in international settings, it is no wonder people at home follow the government's example.
non_fbis_06.44.52-19992-138	neutral	Thirsty.
20020207_20.23.04-14788-63	negative	Corruption in the handling of funds, without audits, control nor sanction, with Mr. President's consent, is a result of his intentions of dismantling, destroying and demoralizing the Venezuelan Armed Forces," maintains the document.
20020206_20.40.49-25157-0	neutral	Hong Kong, 6 Feb (ZTS) News from Washington:
20020220_20.47.21-9712-12	neutral	At noon of the 15th, three days before the summit, Iranian Deputy Foreign Minister for Asia and the Pacific Mohser Aminzadeh made an emergency visit to Japan and conferred with the then-Administrative Vice Minister Yoshiji Nogami.
non_fbis_07.52.36-18982-26	neutral	The base - known by US servicemen as "Gitmo"- is surrounded by  mangrove swamps, salt marshes and dense bush - and the sea is  shark-infested.
20011218_21.00.22-21144-28	negative	From the current perspective, three solutions seem "logical."
non_fbis_11.57.16-2305-3	neutral	The shuttle will take seven astronauts to the  International Space Station, where three of them will begin a  six-month stay aboard the orbiting science lab.
