319_ 6	negative	It feels like I'm back to the days of 56k dial-up internet service, even though I'm running a Dell 2GHz Pentium 4 with 256MB memory and have had excellent broadband service for the past year.
247_ 1	positive	very cool features... great camera with zoom...cool quality pictures... great ringtones... bluetooth feature is great....
132_ 154	neutral	I bought my IPOD roughly six months ago, and I've been pretty disappointed so far.
152_ 0	neutral	Now that the 11g spec is final, and a new firmware has been released supporting it, the WRT54G is a serious contender for your wireless network.
67_ 7	neutral	A couple of tips to having a clean-smelling nursery even with the Champ: Double bagging- Get those diaper sacks you would use to dispose of diapers if you're in a place where you don't want to dump a dirty diaper, like in your friend's wastebasket or kitchen garbage.
204_ 3	positive	Creative did an awesome job with the design.
246_ 3	neutral	Same with the contacts list, recent call list and everything else.
0_ 146	positive	This camera is an excellent choice for an ultracompact, take anywhere device and boasts an outstanding movie mode to boot.
190_ 30	neutral	player[-][s]However, this one makes an ipod sound like your old LP's, so even if you're a casual listener, I'd advise that you avoid the purchase of this product. Terrible.
188_ 0	positive	I think that for its price compared to the ipod the creative zen is pretty good.
265_ 1	negative	I was using a Motorola T720i with Verizon and I had alot of dropped calls and I had troubles syncing data.
136_ 15	positive	Pertaining to the speed issue: I got 54Mps while I was in the same room.
243_ 0	neutral	*****DO NOT BUY THIS PHONE***** ****READ WHY****
222_ 4	positive	The software is very easy to use, and the transfer is super fast!
183_ 20	neutral	If you want to recharge it, you MUST connect it to your computer.
106_ 13	neutral	Lefties can switch the angle of the handles by loosening the screws, repositioning, then retightening.
138_ 5	neutral	So I ran the CD, but doing that did not yield any results - my wired router was apparently too old, so the CD s/w did not recognize it.
179_ 5	neutral	Important to note that what I really needed was an access point as my DSL modem already does the router thing and I have a wired 100M network round the house.
69_ 3	positive	THIS ITEM IS EXCEPTIONAL I like the ease of use and it held the odor in great.
134_ 11	neutral	It turns out to be copyright 2002 and much inferior to the 2005 manual included on the CD.
134_ 5	neutral	After asking for a password (Is it asking me to set a password or am I supposed to know from page 20 of the manual that the factory set password is "admin"?) it refused to go past step 8.
312_ 2	neutral	It seems like Symantec did a lousy job on this version.
183_ 42	neutral	6.
132_ 223	positive	This is the best purchase I've made in a very long time.
239_ 1	positive	I own this phone for about 6 months now, I have used the following features: bluetooth connection to laptop and desktop for sync contacts and calendars with Outlook, transfer files (movies, songs), I have many movies on it now with a 512MB memory card that it takes.
209_ 24	neutral	2.
42_ 0	neutral	I was a little skeptical about what people had said about this camera, because it's just so small.
180_ 2	neutral	It's very frustrating to try to complete school work or work, only to lose it because I am dropped every couple of minutes.
161_ 0	neutral	Bought this a few months ago with the Laptop card.
132_ 208	neutral	 And if they treat their customers like herding sheep, I see little reason to purchase another MP3 player with a bitten apple embroidered on it.
178_ 0	neutral	First, let me set the stage by saying that I am not a network specialist, just a regular Joe who for convenience reasons wants a wireless network in his house.
132_ 292	neutral	 Just kidding.
123_ 6	neutral	It felt rather stable in my hands (heavy though.)
232_ 7	positive	Goes ~3 days after a charge.
273_ 4	negative	Dont rely on T-Mobile rebates.
193_ 27	neutral	I keep boxes for all my equipment for storage and moving.
132_ 276	neutral	 If this sounds confusing, just make sure you have your iPod plugged in when you install the iTunes software!
177_ 0	positive	Getting the router setup in a "vanilla" configuration that works for 99% of users was very easy, and I was able to do this no problem.
250_ 0	positive	I do not need to repeat what's great about this phone.
272_ 5	positive	Other than that, the simbian series 60 OS is great and offers lots of proprietary software that will work on your phone if you're willing to hunt for it.
298_ 23	positive	 I've used the Corporate edition at work without any problems ever.
29_ 3	positive	This is a great product, and Canon has done an excellent job.
18_ 1	negative	 the only thing I don't like about it is that You have to buy a larger memory card, first thing!
166_ 51	neutral	If that happens, you'll want to save money by sharing the Internet connection, rather than pay for two services or more, at multiple single-connect prices.
132_ 457	neutral	Does not come with the dock, remote control, or carrying case like the 3rd generation units - but you get $100 off the price, so you can still end up with the same accessories, and a new generation iPod for the same money.
170_ 11	neutral	4 was much more easier to setup but had slower speeds and not as configurable as this.
32_ 8	positive	I just went on a quick photo shoot in NYC's  Central Park today, and what a bunch of beautiful photos I took, if I do  say so myself (and I do!)
147_ 9	neutral	I did know about this from researching on the internet before purchasing it, but I bought it anyway.
101_ 5	negative	Then the most disappointing was trying to use Viper raised panel bits that just barely fit, and I mean just barely.
135_ 17	neutral	The router comes with a TON of options for setup, but sadly enough, I had no idea what most of it meant.
225_ 44	neutral	Why?
3_ 7	neutral	However, I do have a few things to complain about...
132_ 402	neutral	 The thing is, naturally you're going to use your iPod at the gym or whatever, and it can be a bit of a liability because you always feel like you have to protect it.
144_ 10	neutral	I w!
1_ 6	negative	Other than that pictures taken in the dark are not as nice as I'd like them,
241_ 17	negative	My biggest concern is that I have found Nokia phones lower quality construction to lead to lower prices, but they also don't last as long.
132_ 210	neutral	 The iPod batteries can go through a full recharge cycle 400 times.
243_ 31	neutral	I still decided to send in the phone, since insured shipping was only $10.
240_ 13	positive	:! OK, score 7.0 Oh yes, the newest color of this phone is quite cool.
0_ 88	neutral	shake it a little bit and it'l change the background color. if you've holding the camera horizontally, then it will show the time and date horizontally.
206_ 16	positive	So far I have used all of the above-mentioned features, and find them well designed, and easy to understand.
211_ 21	positive	White earbuds ( i replaced those with some shure headphones, big difference), a case, a stand, a clip (which doesn't really work), and a nice little zen micro bag.
205_ 19	positive	I've dropped the device several times onto hard surfaces, and it still works flawlessly.
221_ 24	neutral	And the price?
132_ 511	neutral	  It's very fast and easy to create custom playlists for upload.
149_ 5	neutral	Very disappointing.
0_ 100	neutral	i forgot to mention about the camera's design.
314_ 1	neutral	At the same time I bought PC-Cillin for the laptop and what a slick product!
265_ 2	positive	I was looking for a phone which synced with Mac OSX using Bluetooth, had decent battery life, could check email, had good reception, nice screen size and was durable (I break often break small gadgets)
221_ 11	neutral	Apple has tried to hide something from you: most people don't actually need more than a few gigs at most.
183_ 32	negative	If you want to purchase a real case or container or clip-on carrier for you Zen Micro, expect to purchase it separately and to dish out big time. .
163_ 3	neutral	They also lowered flash memory from 4 to 2 MB at the same time.
25_ 2	positive	The software that comes with the Digital Elph is very nice and intuitive.
223_ 3	positive	it's a great looking, easy-to-use device but it's the sound quality which is truly amazing -- far better than my Sony mini-disc player.
137_ 1	neutral	Ironically, the latest firmware update addresses this very specific issue.... so now I have no problems what so ever.
96_ 0	positive	Friends told me that the Diaper Genie did not work very well, so bought the Diaper Champ based on on-line reviews and I have been happy with it.
211_ 2	neutral	I've owned this player for nine months now and it's been on 5 cross country trips, one trans-atlantic honeymoon, and numerous roadtrips.
270_ 9	negative	Also the battery life isn't great but it's sufficient for my needs.
201_ 18	neutral	I actually prefer the vertical strip rather than running my thumb in continuous circular motion.
117_ 1	neutral	For exclusive use in a double router table I have been building.
100_ 21	neutral	Remember, it does hold dirty diapers!
151_ 6	positive	Unlike other reviewers, I have found the support to be responsive, almost no wait time on the phone, and relatively knowledgeable.
25_ 9	positive	The pictures are uniformly excellent and color rendering is perfect.
132_ 22	negative	 There is also no voice recording, something most if not all MP3 players have that the iPod doesn't.
137_ 2	positive	Even during the firmware updates my roommates did not loose wireless connectivity.
71_ 1	neutral	As a first-time mom, I got the great idea that cloth would be better, and this was the only diaper disposal that advertised compatibility with cloth diapers.
243_ 24	neutral	I followed the technician's directions to the letter while they were on the phone, and after I had done so, the phone restarted and displayed the message "Phone startup failed. Contact the retailer."
79_ 0	positive	The diaper champ is the best!
212_ 10	positive	Pros The Design is very nice, and the colors are too.
225_ 62	neutral	There are do it yourself sites (with pictures)that show you how to repair it, but keep in mind that you will have to break the warranty seal, which means?
201_ 11	neutral	:) I was also happy that my shipment came with all the accessories (minus extra battery).
132_ 96	neutral	12 hours is about average, and it has an AC adapter in the box, with quick charge (2 hours) at probably 80%... and 4 hours for a full charge.
0_ 48	neutral	Never abused.
132_ 291	neutral	First of all, no one does this and it will make you stand out and look "uncool."
166_ 22	neutral	from the cable modem you are using.
306_ 4	neutral	The Symantec site said it didn't affect NIS but I believe it did.
147_ 5	neutral	All lights blink, and you can still access other computers on wired and wireless LAN.
132_ 255	neutral	 This review will contain some comparisons to other MP3 players (mainly the Rio Nitrus) for interested consumers.
163_ 2	neutral	They've gone from 16 MB of RAM in version 4 to 8 MB of RAM in version 5.
146_ 1	neutral	Ended up returning to a Linksys router and giving the cheap router the boot.
207_ 5	negative	After consulting with Creative's customer support, they determined that the hard drive was broken and the only recourse was to send it in for repair, which would cost me $40, since it's past the 90 day warranty (pretty short warranty).
233_ 36	negative	Video recording is limited at just 9 seconds.
169_ 6	neutral	Not once did I have to call tech support or the IT guy at my workplace.
287_ 34	neutral	(Intructions for doing so are on Symantecs website.)
242_ 30	neutral	RECEPTION: This really depends on locale & carrier.
1_ 0	positive	I want to start off saying that this camera is small for a reason.
201_ 0	neutral	After heavy duty research and reading reviews, I decided to plunge into the MP3 player circus and got myself the Zen Micro.
37_ 1	neutral	and i'm glad i did!
5_ 12	negative	4) The camera gets really hot when you are busy snapping away.
225_ 2	neutral	Not because I wanted to go against the grain, but the idea of having to shell out another 100 bucks (after a year) in order to have Apple replace the non-removable battery just turned me off.
243_ 32	neutral	Two weeks later I mailed the phone in for repair.
0_ 93	negative	the sound is not loud enough when i play back the video clips on the camera.
179_ 9	neutral	d be in the same IP range and see each other.
251_ 12	neutral	5- If you already have a girlfriend and/or wife , you won't need Bluetooth lol .
319_ 1	positive	The program is fully featured, with much of what you'd want from a security program --
132_ 183	neutral	Since nothing is perfect, the iPod does have some disadvantages, such as its reliance on iTunes to download music (if you hate iTunes, don't buy an iPod!).
225_ 1	neutral	I absolutely didn't want to by an Ipod.
259_ 2	negative	I really regret signing up with T-Mobile, but I'm stuck with them for the next 6 months of the contract.
136_ 21	neutral	So 54 Megabytes per second is about a thousand times faster than a standard modem.
132_ 106	negative	No inbox accessories-- An arm strap, belt strap, case, or anything would be nice, but nope... Moveable parts-- This makes me almost want to keep my 3rd gen over a 4th; with moveable parts, its easy to damage an iPod at a gym, so this is for more casual listeners; note the iPod Mini doesn't have moveable parts and is made of titanium.
193_ 17	neutral	It was time to exchange it for the other player the Creative Zen Micro 5 GB MP3 Player Black.
132_ 224	neutral	 I am a total iPod addict.
175_ 11	positive	So the pretty solid router all around good for the money  here's the link to firmware updates http://www.sveasoft.com/forum6.html
58_ 3	positive	1. It uses regular garbage bags instead of brand refills.
215_ 2	neutral	Its $4.99 a month ($60 annually) to download as much music as you like.
125_ 8	positive	I've got a buddy who's trying to offload his almost new $300 Speedmatic because he saw what this router can do.
287_ 13	negative	I've had to install and uninstall them four or five times so far, and I've not to get either product working properly.
36_ 18	negative	Buttons size is OK for me, my wife, but not my grany.
171_ 3	neutral	Both routes take me a few minutes of precious time when i would be online doing something important.
132_ 397	neutral	 When this happens I have to toggle the lock switch on and off to get it to work properly.
168_ 6	neutral	Speed is identical to my hard wire desktop direct cable modem connected PC.
223_ 17	positive	If your looking for a great sounding mini player, you can't go wrong with the Zen Micro.
256_ 9	negative	I find this feature on this phone useless, but, since I don't really need this function anyway, I don't really use it.
205_ 18	positive	They also sound excellent compared to other earbuds including retail sets like Panasonics and Sennheisers.
225_ 31	neutral	Once I did this, visions of burning my CDs-literally-dance around my head, and all was right in the world (of course, I would have backed my files up, silly).
134_ 14	neutral	You have to completely exit the Wizard and re-start the CD in order to find the "User Guide" tab which loads the manual.
233_ 41	positive	This makes for a great phone.
79_ 24	neutral	The positives outway the negatives.
209_ 21	neutral	To minimize any frustration (and the odds that you may return a usable unit), keep the following in mind:  1. While your unit is!
0_ 179	positive	Placement of the buttons and software user interface is near perfect.
310_ 2	positive	Also, with one click you can help train your spam killer.
32_ 19	neutral	As other reviews have noted, you will  definitely want one or more additional memory cards.
132_ 126	neutral	  This is a hassle, of course, but I'm not sure if the problems are to blame on poor construction, cold weather, or misuse by yours truly.
227_ 13	neutral	3.
183_ 21	neutral	The recharge cord will do the job in a fraction of the time that the USB cable will hooked to your computer.
214_ 19	neutral	Napster 2 Go also allows members to view other members play lists in different genres, so if you are looking for lots of songs and you don't want to search for them endless, you can just grab them from other members play lists. !
132_ 460	neutral	   Backing up your iTunes library takes a short amount of time.
180_ 1	negative	It constantly drops the internet connection and simple things like WALLS in our house block the link so everything is very slow.
299_ 2	negative	I am an advanced computer user, so I cannot even imagine how a new or novice user would ever get this terrible program to work!
183_ 39	positive	The Zen Micro FM receiver is ok, not great.
215_ 4	neutral	Also if you want to purchase music, its just .79cents per track ..... Here is my origianl review...." My wife already had the Ipod Mini when I purchased this, and I must say seeing it in action, I had some reservations about getting a Zen.
313_ 1	neutral	It can be a pain to configure, but I dealt with it.
51_ 2	neutral	You can take it anywhere withyou, unlike other bulky cameras, and capture every moment of yourlife.
109_ 1	neutral	I use it primarily in a router table and have been making my own moldings and trim.
215_ 3	neutral	You can fill it up with anything you like out of there 1 Million song library.
3_ 2	neutral	I take it with me everywhere,literally,
243_ 22	neutral	So, after all this frustration of adding all of my newest contacts to the 6600, I asked the technician if it were possible to transfer the data from the 6600 to the 3650.
31_ 15	neutral	By the time the shot's taken, something (especially a squirmy child or a sports play) has invariably moved and it's not the exact picture you wanted.
243_ 1	neutral	In October of 2003, I bought a Nokia 3650 off of eBay.
132_ 14	neutral	The iPod's battery, 1.5 years.
257_ 5	neutral	Its a real shame that T-Mo does not offer the newer Nokia models.
311_ 3	negative	Their site offers no live help at all.
142_ 2	neutral	I recently bought the Linksys G-Router after getting my hp laptop needing to setup wireless at home.
166_ 61	neutral	The other issue is how secure do you want it.
42_ 1	positive	After getting one for Christmas from Amazon, I'm now a believer:  The Digital Elph is truly the world's smallest digital camera that shoots great pictures.
132_ 23	negative	 There is no photo viewing option, however, there is a 20 GB photo iPod, but it costs $20 more.
132_ 426	neutral	There is an attachment you can buy that allows you to use AA batteries in an emergency, but...I've never completely run out of juice; just dangerously low on long airline trips.
111_ 13	negative	Not a killer problem, but not well done, either.
196_ 0	neutral	I can't help but feel peeved by the attitude created by Apple enthusiasts that basically detracts from anything that attempts to compete with Apple products in the marketplace.
152_ 2	positive	Compatability with other devices is excellent too; I've only found one 11b device that won't work with its mixed mode (and it won't work with *anyone's* mixed mode).
132_ 113	neutral	 I look at iPod owners today and quietly feel sorry for them. :) They just didn't know about the ARCHOS gmini400.
322_ 6	neutral	So when I reformatted for the third time, downloading SP2 took no time at all and the new XP was kind enough to even suggest other antivirus programs to try (it also listed Norton and McAffee).
240_ 0	positive	This one has a good looking.
116_ 5	positive	Smooth plunging mechanism.
89_ 6	positive	In fact, people who have been present while I changed my almost 3 month old son's diaper have been amazed at how the very 'potent' smell of the dirty diaper seems to disappear once I dispose of the diaper in the Diaper Champ.
246_ 5	negative	The number buttons are crammed into a 3x4cm area, the fonts are small, the interface is too convoluted and frustrating, it's not that customisable as well.
110_ 15	positive	Less than a cheap cordless drill or a laminate trimmer.
168_ 5	positive	The darn thing works as promised and it's amazingly cheap too.
151_ 9	positive	at works as well as can be expected for products in this space and the company backs it up with good support.
93_ 10	neutral	Highly recommended!!!
15_ 17	neutral	You take around 12 pictures in a circle, stitch them together and voila; you have a perfect memory of where you were standing !
242_ 28	neutral	This is no small deal.
213_ 2	neutral	I mainly only get to listen to music in my car, so it's an awesome replacement for a console full of the same ten cd's that have been in there for the last 8 months that i keep forgetting to replace.
190_ 0	neutral	I'm addicted to music.
183_ 19	negative	You have to purchase that separately for some outrageous cost.
132_ 496	neutral	It's still an absolutely unbeatable value for the amazing technology you're getting, so don't let a few petty cons dissaude you from owning THE coolest thing on the planet right now for any music lover.
166_ 43	neutral	I'm tr!
35_ 13	positive	The white-LED backlit LCD is very bright and crisp, even in sunlight, and relatively easy on the battery.
105_ 4	neutral	Have to clean, buff & lube the plunge rods once in a while but I see that as a non issue because any router should be periodically cleaned anyway.
168_ 8	positive	If you want to work wirelessly, this router does just what you want it to do and my geek friends say that the security is as good as it gets right now.
132_ 171	neutral	This version does not come with a dock, although it can be added later as an accessory.  Y
210_ 4	negative	I was up all night trying to make the stupid thing work, to no avail.
194_ 16	positive	If anyone is thinkning of getting an ipod mini, forget it and go with this player.
174_ 19	neutral	WPA is best.
44_ 0	neutral	OK so I bookmarked pages about this camera on our home computer, in a place I was sure my wife would see, and loh and behold, what did I get.
143_ 3	positive	there are instructions to encrypt your personal wirless network so no one else can end up hogging/stealing your bandwidth.
264_ 3	neutral	But watch the Amazon rebates on these (T-Mobile rebate is fine).
155_ 4	positive	All in all, it's a good router if you don't have the cash for a Speedbooster one.
132_ 269	negative	 Also, some other MP3 players such as the Nitrus allow you to play WMA (Windows Media Audio) files, whereas the iPod does NOT.
254_ 5	positive	Nokia makes great phones, and this one is the cream of the crop.
318_ 3	positive	I upgraded from NIS 2003, and the change in performance has not been noticeable.
132_ 74	positive	  Plus, if you order from Amazon.com, they will exchange it for you no problem.
0_ 121	neutral	However, it was not so in my case.
221_ 28	positive	In conclusion, this player is beautiful.
194_ 9	neutral	The radio and voice recording are nice.
173_ 6	positive	Reset the network, tried the connection, and it's working like a charm.
148_ 0	neutral	I replaced my D-link 802.11b router because it could not hold a connection continuously.
132_ 13	neutral	 However, the Creative and iRiver players are (Rio's isn't), and they only cost around $30 to replace, while iPod charges shipping and technical support.
191_ 5	positive	It's being used daily and I have had none of the problems reported by other reviewers (headphone jack, player locking up, etc).
132_ 176	negative	 The iPod comes formatted for the Mac, but within seconds of plugging it into a PC, is automatically reformatted for Windows.  (The HP version comes with Windows formatting, and takes seconds to change to Mac.) Although the iPod can be changed from one format to another, you will lose all of your music and data when doing so.
193_ 43	neutral	My PC only supports USB 1.0 not the 2.0 which is blazing fast.
132_ 277	neutral	 This seems obvious but the flaw lies herein: the instruction booklet tells users to charge their iPods 2 - 4 hours before initial use.
213_ 0	neutral	so i admit it... i wanted a zen micro, because the appeal of the iPod was overshadowed by it's annoying trendy hipster popularity and i felt better about myself for choosing a rip off version of that trendy hipster popularity.
138_ 9	neutral	I do know what wires go !
221_ 5	positive	Sound quality? Phenomenal.
131_ 3	neutral	First, I must say that I am a professional woodworker, so, this router was used every day.
132_ 188	neutral	  The weight is heavier than many digital players, but I like the solid feel.
100_ 24	positive	Works great!!!!
89_ 8	neutral	1. CHANGE BAGS FREQUENTLY!!
11_ 6	positive	The SS body is wonderful, feels high-quality.
140_ 0	neutral	I had a Linksys wired 802.11B router and wireless access point which worked well, but decided to upgrade to an all-in-one 11G device.
132_ 337	neutral	  I use a great free program called ipod agent to do this.
287_ 1	negative	This product has virtually all the same installation problems.
199_ 10	neutral	A few reviewers have also complained about the printed manual which is probably one of the biggest wastes of paper ever included with an electronic device.
308_ 1	positive	While it didn't have all the features I would have liked, it was better than anything else I could find at the time.
207_ 7	negative	Well, I got my second player, and right out of the box it wasn't working right and once again, after consulting customer se!
151_ 3	neutral	I had to change the channel of the router, like the channel on a cordless phone, to get it to work with the Linksys Instant USB Wireless Adapter v2.6.
