1037	neutral	China: Cheney shores up the trilateral alliance
168	negative	Growing Unarmed Battalion in Qaeda Army Is Using Internet to Get the Message Out
164	neutral	Opera Canceled Over a Depiction of Muhammad
87	neutral	Presto! He's Batman, then magic man
128	neutral	War is close, Ethiopia tells Somali rebels
8	neutral	NASA revisiting life on Mars question
998	neutral	Mass Venezuela opposition rally
1336	positive	Napping is good for your heart, study finds
1161	negative	3 U.S. troops killed hunting weapons cache
1445	positive	World tourism sets record in 2006
848	neutral	Mbeki on the big visit from the Chinese
1041	negative	Iran reneges on nuclear payments to Russia
1007	negative	Iran says Sunnis, using Pakistan as base, planned fatal bombing
37	neutral	Diplomat acknowledges US arrogance in Iraq
1267	positive	Japan's economy grows
1463	neutral	Latest food-fad -- 'space potatoes'
1301	neutral	Breakup rings find new homes
954	neutral	Chinese president arrives in Mozambique, African tour nearly over
210	neutral	Madonna files adoption papers
939	negative	Airlines: UK airport runway unsafe
1407	neutral	Higley, Gonzalez lead in Malaysia
1283	neutral	Fight starts over HPV vaccine
1221	neutral	Sale of Chrysler possible
15	neutral	We were 'arrogant and stupid' over Iraq, says US diplomat
1107	neutral	Pediatricians say more cord blood is needed now
214	negative	Waste plant fire forces 5,000 to evacuate
825	positive	European shares hit fresh highs
200	negative	5,000 flee plant fire
1361	positive	University offers support to New Orleans school
1150	neutral	Bad weather cancels men's downhill
799	neutral	In clue to addiction, brain injury halts smoking
151_ 5	neutral	I used Linksys technical support several times.
132_ 266	neutral	 If you plug your iPod into a PC and try to upload music/etc. it won't work.
236_ 1	neutral	I love gadgets, technology and whatever electronic equipment you throw my way.
287_ 6	negative	The antivirus feature is phenomenal, and is regularly updated.
207_ 26	neutral	I threw it away.
112_ 6	positive	I use it in the table (never take the springs out - just attach the fine adjustment knob), in my woodrat and freehand and it works great in all circumstances.
166_ 28	neutral	You now set the software to allow what access you will allow.
201_ 20	positive	There are extra features packed inside this unit (some that most will hardly ever use) such as FM radio tuner, voice recorder, calendar, and alarm clock.
68_ 5	positive	And the biggest plus is that you don't have to buy any expensive refills.
163_ 0	neutral	This concept seems to be unusual.
80_ 1	neutral	dirty diapes and soaked diapers.
111_ 1	neutral	I use routers solely for hand work and relegate all table usage (including panels) to my Grizzly shaper.
214_ 15	neutral	There were two downloads I had to complete.
0_ 153	positive	another thing i like about this camera is the way that you can swap colors around and the impressive video quality i would advise any person in the market for a camera to pay the little extra on the hefty $500 price tag and get a quality camera.
189_ 14	neutral	Also, as soon as you select a song and set your desired volume level, put the player on HOLD.
132_ 177	neutral	Both platforms work seamlessly with the iPod.
281_ 4	negative	During install, NIS would either freeze or not reboot properly when asked to do so.
312_ 0	negative	I've alway liked Symantec products, except for this version 2004.
234_ 9	negative	I've have many Nokia's and while this is the best for features, it's the worst as a phone.
132_ 289	positive	The included earphones are pretty good - my advice?
136_ 23	neutral	nd, and 100 to 150 upload speed.
225_ 54	neutral	jack that Creative has acknowledge.
78_ 4	neutral	Every time!
201_ 9	positive	The interface has a sassier flair and the blue-lit trimming is an added bonus.
132_ 369	neutral	  This may be the player for you, but it's not leaps and bounds ahead of any other player, and others are ahead of it in certain areas, so practice some caution when you buy.
132_ 72	neutral	 However, you should still buy an iPod!
15_ 18	negative	The pictures are a little dark sometimes.
229_ 0	positive	I have had several MP3 players over the past few years, and have to say that this by far is the best that I've owned.
265_ 6	positive	I did notice if you turn the phone on and off the OS takes a bit to load up and initially the menus are slower but once the phone has been on and booted up the menus are reasonably quicker.
313_ 8	neutral	It's become tedious doing this.
196_ 10	positive	It fits comfortably in my shirt pocket and while very well-designed, doesn't look to ostentatious while I'm walking around with it.
307_ 14	neutral	Nice little racket they've got there.
93_ 0	positive	This is a GREAT product!
0_ 49	negative	After 57 pictures total the LCD went black except for the icons showing the settings.
132_ 97	positive	 FireWire & USB2.0-- For those fortunate enough to have FireWire400, your in for a real treat with autosync.
324_ 13	neutral	Finally I ran msconfig and went into the "services" tab and unchecked every last Norton/Symantec "service," then ran uninstall again.
132_ 301	positive	Also included in the "games" section is the great music trivia option - which tests your skill at being able to quickly place your own songs.
132_ 383	positive	For looks, well iPod is head and shoulders better, both the iRiver and Creative Zen look positively ugly when next to a gleaming iPod.
112_ 3	neutral	In the last 8 years since then I have done a ton of routing and have messed around with a bunch of different machines.
212_ 12	positive	It also has tons more features then previous creative products, and most of them are very useful such as the ability to custimize the main menu to show the stuff you want, not the default items (creativelabs.com for more on that).
97_ 0	negative	Gets stinky after a few months, the seal on the piston doesn't seal anymore.
242_ 41	neutral	In my humble opinion, games, along w/ 'flip phones' belong in the hands of teenagers.
132_ 212	neutral	  Apple provides a good discussion of the battery technology at www.apple.com/batteries (and this web address is noted in the iPod manual)
138_ 2	neutral	The new wireless router contained large warnings to run the CD first before trying to connect it.
238_ 0	neutral	i bought this phone last march, almost a year ago, in saudi arabia (it came out there before it did here).
190_ 26	neutral	Otherwise, you should get an ipod.
225_ 22	positive	Track #, name, artist, album and genre is automatically-retrieved via internet-labeled, and properly catergorized into the Zen.
323_ 5	negative	It was immediately noticeable that NIS slows down my computer (Pent4, 256 RAM).
36_ 19	neutral	9- Cons? Not a single one after 5 months.
179_ 4	positive	When I saw a high gain (low price) antenna was available to the WRT54G router, I thought I'd happily give up some (practically unattainable anyway, since you've got to be in spitting distance from the router) speed in favour of wider coverage.
189_ 18	negative	This fixes some glitches such as the player freezing.
106_ 10	neutral	Accessories included in the package are: - 1/2" shank, 1/2" diameter, 1" cutting length, 2 carbide flute straight bit - parallel guide - template guide - template adapter for 3rd-party guides - 1/4" chuck sleeve - cutting depth fine adjustment knob (which takes a "13 mm" wrench to install, but a crescent wrench works OK too)
0_ 89	neutral	change the orientation to vertical and it will automatically change the time and date orientation too.
139_ 2	neutral	You will not be able to run 100's users using WPA and WPA2 encryption through this thing, just a handful of people on a cable modem or DSL line.
127_ 0	positive	I have been impressed with the power of the Hitachi M12V.
256_ 13	negative	It would not hang up on calls.
132_ 399	neutral	 Needless to say, these are fragile machines.
225_ 14	positive	Other mp3 players won't give you the sonic clarity of the Zen at this compression level, so I imagine they won't at lower ones, either.
111_ 17	positive	For me, it is as important that the tool be comfortable to use as it is that it produce a high-quality result.
36_ 2	neutral	You'll carry it with you every day.
227_ 4	neutral	At the time of this writing, that firmware is a "beta release."
239_ 0	neutral	Sure, it is a relatively bulky, but it is really packed with many great features.
132_ 125	neutral	 So far, in the month that I have had it, I have had to take it in for service twice.
242_ 51	negative	When you consider expandability (downloads via computer), the numerous features, two transmission programs and multiple storage devices, dependability - this is a phone that isn't easy to out-grow.
313_ 9	neutral	Wish I hadn't renewed my subscription.
128_ 3	positive	I like the speed control.
213_ 23	neutral	The new firmware fixes this as long as you put the player in lock mode before plugging it into said PC.
242_ 43	positive	There are number of downloads needed/available for this phone & they will be texted to you at no cost.
100_ 14	neutral	He thinks it is magic when the diaper "disappears".
90_ 2	negative	I wash ours out with lysol each time I empty it, and that helps, but when its hot out- well, just be prepared.
115_ 4	negative	Shortly after I brought it, the plunging shafts started sticking.
132_ 516	neutral	 This is the first line of Apple products I have owned (we also have an iPod mini and are about to purchase a shuffle).
236_ 3	neutral	In those days I've gone from Oki, Motorolla and progressed (actually regressed) to Sony Ericsson's T610.
79_ 15	neutral	This will never be a problem with the Champ.
189_ 9	neutral	I like to keep all of my Mp3s in one folder and manually doing this is a pain.
140_ 8	neutral	A five minute call to the tech support people was all it took to get the router up and running.
212_ 3	negative	As for the Zen Micro:\  Cons:  I read that every button is touch sensitive, and thats very annoying when all the main buttons are on the front.
241_ 9	negative	The only problem is that occasionally the joystick does start to dig into your thumb while gaming.
200_ 0	negative	It had issues right off the bat, with freezing up, staying in 'SHUTTING DOWN' mode, and just not functioning very well in general.
215_ 13	positive	An extra gig of room, FM radio, voice recorder, PIM applications with sync to Outlook.
87_ 2	positive	I can't smell anything (and believe me, this is quite something with my baby).
186_ 1	neutral	With so many choices it was a tough decision.
54_ 11	neutral	No spinning it or anyhting!
132_ 456	positive	 This unit comes with the USB/firewire cable as a standard item now.
227_ 17	negative	Again, this doesn't affect regular MP3 files - just subscription DRM-encoded files, like those from Napster-to-Go or Yahoo Music Unlimited.
132_ 376	neutral	The iRivers is also short, and lets face it, what is more likely to brake or go wrong, the Apple iPod or Creative Zen, iRiver.
91_ 15	neutral	My toddler thought rotating the  top was fun-he always wanted to play with it
279_ 0	positive	This phone is one of the milestones in the history of the cellular phones.
241_ 14	positive	6) The phone is really wide, which seems to be a turnoff for many people, but the phone is actually easier to grip and feel more ergonomic.
233_ 35	negative	The battery life of this phone is at most 2 days and at least one day at excessive use.
83_ 4	positive	It doesn't stink, ever (like some have assumed since it doesn't wrap each diaper into its own neat little cocoon).
46_ 0	neutral	I've got a couple of digital cameras.
132_ 242	positive	(It sure does look nice, though!)  I recommend this to any music lover anywhere: the quality of the audio is excellent, the controls and indicators rapidly become intuitive, and the storage capacity and battery life are huge!
0_ 128	neutral	Who knows maybe the service center did a sloppy job in fixing the camera the first time, that it is easily broken.
274_ 12	neutral	Looks big in the display ads though.
289_ 5	neutral	Plus, when Norton provided online updates, there were so many unexplained categories (about 15 over and above virus definitions)
132_ 59	negative	 The back of the iPod is in a chrome finish, and this surface is prone to scratches.
0_ 60	negative	you can set the optical zoom before shooting and than while shooting video adjust a digital zoom in and out however due to the cameras light weight Camera shake is a problem to contend with.
147_ 2	negative	It is not reliable.
171_ 2	neutral	When that happens i have to restart my pc or restart the linksys router.
298_ 20	neutral	So, we're fed up.
255_ 13	positive	If I had to do it over, I wouldn't buy anything else.
123_ 4	negative	My son tried it and he too couldn't change the speed without an assist.
117_ 9	positive	The setup works awesome, as with any tool I look closely at the individual tool for it's merits, and not just the company as a whole.
320_ 0	positive	PIII 1Ghz 512MB RDRAM Windows XP Pro 80GB HD  I was able to Uninstall NIS 2003 and Install NIS 2004 with no trouble.
225_ 61	neutral	In other words, you have to do almost the equivalent of open heart surgery in order just to see where the problem is.
251_ 7	negative	2- It is bulky and the small buttons on the sides are sloppy to use .
138_ 14	neutral	If I did not know what to do, I'd have no idea how to connect wirelessly.
225_ 11	positive	The clarity is unbelievable, which means you can cram almost the full 2,5!
134_ 9	neutral	I had downloaded the 112 page manual from the Linksys Website.
173_ 9	positive	Overall, it'll make my move that much easier knowing I don't have to worry about connectivity.
298_ 2	negative	Long reboots due to Norton taking FOREVER  to boot.
138_ 15	neutral	But knowing that the IP for my previous Linksys router was 192.162.1.1, I went there and found a drop down screen that had the information (the security key) I needed to connect my wireless laptop.
296_ 0	neutral	I have had Norton Internet Security for 3 yrs and up graded to 2004 versionin August 2004.
133_ 5	positive	It really is a great buy if you are lookin at having just one modem but many computers around the house.
233_ 22	positive	This isn't the most rugged phone ever but then your not gonna play aeroplane with this,are you.
149_ 0	neutral	I bought this in order to upgrade from an old 802.11b router to g technology, and I spent several hours trying to get it to work.
190_ 8	neutral	The creative came with a free trial of [random file sharing company] "to go".
203_ 4	negative	Screen review could be better.
139_ 3	neutral	People that complain about this product not standing up to hardcore use are fooling themselves.
170_ 5	negative	The firmware has bugs too, so download and install the latest firmware from Linksys.
324_ 8	negative	I had tried to uninstall Norton Internet Security a few weeks ago, and it wouldn't let me do that either.
168_ 0	neutral	OK, I never read the manual.
132_ 428	neutral	  Think about that if you are worried about battery life.
100_ 25	positive	5.  The price is right.
191_ 17	positive	- Replaceable battery.
267_ 12	positive	Very simple and painless.
233_ 42	neutral	Did I mention the note feature and how you can send notes via Bluetooth?
191_ 30	positive	If you can get one with all the accessories and a cheap extended warranty, this is the player to get! Highly recommended.
0_ 35	negative	The only knock I have is that the flash is underpowered.
105_ 6	neutral	Happy woodworking!!
240_ 9	neutral	Is it really slow, or what?
132_ 30	neutral	Anyhow, adding music to the player is easy.
140_ 2	neutral	After asking around, I found out I didn't.
214_ 32	neutral	:-)  www.zetazen.com
166_ 49	neutral	True, you don't need more than an access point, and a wired one at that, to use as a protective firewall.
132_ 239	neutral	The iPod does come with other nifty software accoutrements, but honestly I haven't used them much as I use the iPod to listen to music while I run or on a plane.
214_ 8	neutral	I was going to purchase a pink one and then decided that I'd get a purple one because that's my favorite color....however Circuit City had it for $10 cheaper ($219.00) in black and I could !
39_ 5	positive	This is enough capacity and capability to do a complete household inventory, for example.
0_ 41	neutral	You don't have a shutter or aperture priority mode...so the lack of a high speed program is a total dealbreaker for me.
59_ 2	negative	It seemed as if we were empting the pail everyday and it was in no way odorless.
274_ 8	negative	The battery power discharges rapidly especially on using the web browser.
141_ 3	positive	The range is terrific, I am using this for my home and I was transferring at 50+mbs from my backyard.
193_ 51	positive	The Zen lives up to the audio quality I love and expect.
31_ 10	negative	When taking pictures of people, however, it shows EVERY flaw in the subject's skin.
306_ 6	neutral	All of a sudden everything that reviewers were writing about NIS 2004 was happening to my computer.
85_ 5	negative	The pluger gets stuck & you have to manually extract the mess.
228_ 10	positive	Further, the tech specs suggest that it has better audio quality than the Ipod.
134_ 2	neutral	I know more about networking than 70% of the consumers out there, so I was able to puzzle my way through it, but only by second guessing the documentation at various stages.
184_ 7	positive	This is the mp3 player with everything I need.  As long as it lasts me a good three years, I'm satisfied.
284_ 1	negative	Sometimes a suite is not a good deal and all you get is a bundle of headaches.
113_ 5	positive	The handles make it very comfortable to use and I experience little vibration.
132_ 99	positive	Good sound-- Plays very nicely, even though the stock headphones are kind of weak Durable-- not the most durable because its mostly plastic, but very compact and sturdy
132_ 109	neutral	 This is definately worth the money to have, but certain aspects of it doesn't make it the best.
132_ 372	neutral	If you want colour screens, photos, videos etc, buy the latest (extremely expensive) model, I think the new 60GB has all the extras.
213_ 15	neutral	it's a little counter intuitive at first, but works great when your used to it.
195_ 12	neutral	Zen micro does.
32_ 14	neutral	And there are two more advantages to digital photography  which I hadn't anticipated, beyond the lack of film and developing.
135_ 21	negative	* I'm giving it 4 stars because the setup process was so miserable.
268_ 5	positive	If you are using Linux, and you want to use GPRS to connect to the net, I suggest this phone along with a Belkin USB Bluetooth adapter.
34_ 2	neutral	What else can I say?
5_ 3	neutral	I was looking for a blend of the two and so I bought this camera.
138_ 20	neutral	I would suggest for Linksys to include a hardcopy quickstart guide for those users with !
204_ 2	positive	It also has a voice recorder and FM radio that you can only get on an Ipod if you but an adapter seperately.
68_ 0	positive	I bought this diaper pail when my son was just a few days old and I absolutely LOVE it!
192_ 2	positive	The Micro seeemed like an iPod for less.
79_ 11	positive	2) The Champ uses regular store bags.
35_ 14	positive	The panorama modes are wonderful.
35_ 2	neutral	This is the only camera with all these capabilities.
195_ 16	neutral	If one battery drains just snap the spare one and you are back in bussiness.
200_ 3	negative	It is the 'first generation' of the player, and while I still agree that it is a great alternative to the iPod, I think there are many others that would be a much better value for your buck.
211_ 23	neutral	To me, currently at $218, this player is a!
96_ 3	positive	While the perfect ordor free diaper pail has yet to be invented, the Diaper Champ is a good as it gets.
216_ 1	neutral	After using it for a week, I wish I had purchased the Ipod.
183_ 16	neutral	The company has received thousands of complaints about this and refuses to do anything about it. .
144_ 0	positive	I upgraded from an older 801.11b router to the Linksys WRT54G for its improved security, and of course, speed.
290_ 7	positive	I just got an older 866 Mhz system with 512 PC 133 RAM and it also runs fine on that.
60_ 2	neutral	The one thing that sets this product apart from the diaper genie is that this product can use regular garbage bags.
213_ 19	negative	whatever...  on to the negatives:  -touchy about charging... you can damage the battery and seriously decrease it's life if you don't upgrade the firmware OR dont' heed the advice to always plug in the player side of the cord before plugging in the outlet side.
233_ 38	neutral	Overall I dont think I will ever upgrade from this phone.
1_ 3	negative	The only thing I don't like is the small size (8 MEG) memory card that comes with it.
307_ 1	negative	Unfortunately, it does not give you the option of unstalling (or uninstalling) them individually.
211_ 12	neutral	When it's being used or charged it emits a low pulsating blue light.
297_ 3	neutral	It included popup and ad blockers, referrer blockers, firewall,  intrusion detection, and all the same things that the 2004 version includes that are really needed.
268_ 3	positive	The 6600 was the best phone I could find with these options that I could get with t-mobile.
132_ 274	neutral	 The problem with this is that a) it takes a LOT of time if you have many files and b) audio quality is somewhat lost (if you're an audiophile, this will bother you - frankly, I can't tell the difference).
80_ 6	positive	I use the scented bags and even if I don't no smell!
189_ 12	neutral	1.
190_ 5	neutral	I decided to go with the convienence factor and purchase a creative zen micro.
242_ 49	positive	Despite a critical start, this phone deserves four stars because it accomplishes what it sets out to do (which is pretty lofty)... does more than most... does it well... is dependable.
3_ 25	negative	it's not my first choice in cameras,
307_ 8	positive	This did manage to cut the number of popups during start-up from 4 down to 2.
195_ 30	positive	Its compact and has rounded edges.
255_ 11	neutral	In short, I don't have a single negative thing to say.
73_ 1	neutral	We have been using the Diaper Genie for the past 17 months and are very happy with it.
252_ 2	positive	It is Nokia and thus easy to acces the menu options.
115_ 3	negative	That said, I am disappointed in the plunging mechanism.
179_ 18	positive	Apart from speed, the signal is consistent and works without interruptions, etc.
207_ 14	positive	I have ripped over 100 songs from my CD collection and it was so easy and fast, and they all sound great.
0_ 152	positive	As any digital camera owner knows is that when you go to take a picture of a moving object to expect some blurring but with some preliminary testing we had somone move there hands back and forth under the lense and another person take the picture and suprisingly a crystal clear image apeared on the decently sized screen.
132_ 9	negative	  DURABILITY: Not good. First problem, if you haven't seen the news recently, the iPods are being recalled for battery problems and not lasting the advertised 18 months.
111_ 7	neutral	I use custom side clamps set up for 1/4 and 1/2 inch bits in order to plough mortises easily (and with great accuracy).
0_ 73	neutral	I don't miss the high speed program, nor the manual overide, since I had read numerous reviews and specs. before I ordered.
297_ 2	negative	If you are new to the market and looking to buy a symantec software product, save yourself some money and buy the 2003 version.
306_ 0	neutral	I had Norton Internet Security 2003 and it worked great...one of the features that I liked was the user interface as well as the ad/pop-up blocking feature along w/the logs on internet usage.
183_ 14	neutral	1.
250_ 8	neutral	This feature is very important to me as I make a lot of international calls.
116_ 9	positive	Even with that, I highly recommend this router - outstanding performer.
0_ 37	neutral	A few of my indoor shots could have benefited from a stronger flash, but even those shots were not all that bad.
115_ 5	negative	After repeatly cleaning and recleaning, it still stuck after using it for a little while.
138_ 0	neutral	It did not take me that long to set this up, but it did require *not* following the instructions.
227_ 12	negative	The subscription files are still a little slower to transfer, but it's only by about 10% or so.
15_ 0	neutral	I have used this camera for about 3 weeks so far, taking over 500 pictures.
79_ 4	positive	1) The champ is easy to use.
263_ 8	positive	i also use the phone as my modem via bluetooth to my Apple powerbook!
132_ 508	neutral	However, I have found that converting my CD's and MP3's into the iTunes library fo!r upload takes a fairly annoying chunck of time.
270_ 5	positive	It fits comfortably in my hand and pocket.
31_ 8	negative	All that said, I am a little disappointed with the quality of the pictures from the camera.
132_ 472	negative	This is only a problem at night, during the day the screen is very easy to see.
199_ 18	neutral	Zen Micro[+2][s] Overall, I'm very pleased with the Zen Micro and based on my experience with it (as well as it's older sibling Creative Nomad IIC), can recommend it without reservation.
31_ 1	neutral	price[-1][u]I bought it new, when it was cutting edge and very expensive.
299_ 7	neutral	It did find Outlook Express, but that's not what I use.
129_ 7	neutral	I bypassed the speed control, which was easy to do, now it works again, but with no speed control.
