789668	neutral	has made the last run for non-perishables and snacks (junk). A few minor indoor preparations yet before tonight. Stay safe everyone. #Irene 
3235355	neutral	#windows8 interface is so touch orientated that it screams of a Microsoft tablet / windows 8 tablets in the works 
887873	neutral	Ask Ring-tone | Free Download PDF: Home · Automotive · Acura · Alfa Romeo · Aston Martin · Audi · Bentley · BMW ... ~http  
2016899	neutral	V - Neck ; Nike Flops ; BootyShorts !  #TeamSwagg 
723002	neutral	Dr Dre Headphones; Samsung Monitor & Starbucks Vouchers up for auction  ~http  
1139499	neutral	We could be up in the clouds 
1804085	neutral	SMS Marketing: How to Harvest Your Customers' Mobile Details: by Bill Hilton SMS marketing is a huge growth area... ~http 
1346788	neutral	Ladies Shoe - Kentucky Wildcats Women's Nike White Football Replica Tee Small. Read it now at ~http  
1779788	neutral	What did Bruno say that got bleeped out???  Sascha's wife is getting more sex than....bleep? 
24239	neutral	My next three dogs are going to be named Twizzler; Taco; and Gucci Gucci definitely 
2895652	neutral	It's A Hard Time To Be A PC Maker -- And That Spells Trouble For Microsoft ~http  via @user 
2345604	neutral	Everyone everywhere! Skype: norbertogomezjr ~http  For more info 
2624150	negative	So fed up of my landlord an estate agent thinking that just because I'm a stuffy they can pull wool Over my eyes.  #landlordhell 
902766	neutral	Laptop SONY vaio js270j/q 20.1" all-in-one desktop intel core 2 duo Price: $339 USD Online Order: ~http  
974577	neutral	Video: I DID A VIDEO REVIEW FOR MY FRIEND JESSE ON THE GLX-6900X-2DR IN4MATION. IN4MATION GLX-6900X-2DR... ~http  
1191806	neutral	I just completed the HARDBODY HQ workout with Nike Training Club. Join the club ~http  
767168	positive	I liked a YouTube video -- Bing Crosby & The Andrews Sisters ~http  
88958	neutral	Search Bing and let your friends help you decide ~http 
1470313	neutral	Doing close-up Magic at Regency Tavern; Brighton. Tuesday 16th March from 8-10pm. 
2144834	neutral	Photo Editor w/Paladin Consulting; Inc. @ Hilton Hotels - Excited to start Monday (10/18) 
2409816	neutral	man ms perez kool but man I don't understand a damn word she be sayn 
857590	positive	lmao at Chris and Masgana!! they were hilarious tryna get my booty from the JUMP the whole time smh 
3160687	neutral	Microsoft Press sponsor Live Blogging at the Microsoft SharePoint Conference:   Those nice folks at Microsoft Pr... ~http  
1067859	neutral	Check out this upcoming concert: Gucci Mane @ University of Iowa Field House. ~http  
165560	neutral	#liodph Let the expert from IDC show you the things to expect in 2011 and how to use these information to keep your business at the top. 
1632930	neutral	WATCH IT ! Microsoft Security Audit Reviews ! ~http  
1735729	neutral	Computerworld: Some delays; as Sony hits reset on millions of passwords - ~http  via ~http  @user 
645466	neutral	Discovered a new artist ; David Ryan Harris ; John mayers back up vocalist and guitarist 
2734544	positive	Awesome! RT @user Nike fun stunt: ltd ed replica Back To The Future II trainers w/ proceeds going to charity ~http  
270122	neutral	Chris Brown Fan: "Keeping Rolex Didn't Cross My Mind": The fan who handed in Chris Brown's $22k Rolex which he l... ~http  
1339428	negative	what the fuck happen to my fucking netflix grrrrr i was in the middle of the season 
519859	neutral	PS3 News: Essential work by SONY means LOVEFiLM on the PS3 will be offline Tuesday 24 May (TODAY) from 4pm to 12am. 
3030857	neutral	I've listened to Gucci Mane; if that counts 
2427785	neutral	: I always dream about people i shouldnt be dreaming about -_-" 
1189162	neutral	Jobopening: Receptionist; Sony Electronics; Los Angeles! ~http  
2097889	neutral	The @user lambullghini sticker comp is still on; only 4 more sticker sets to give away! 
1373830	positive	Pretty pumped about becoming a political genius from this semester.#determined 
23468	neutral	Biggest cricket ever in the laundry room ~http  
1101016	negative	I honestly don't get why people like Harry Potter. It...SUCKS. 
689890	positive	LTS SYDNEY STORE; 255b Crown St; Surry Hills; 2010. Opening next week!!!! Getting closer :D 
1006994	neutral	So Microsoft got Skype. 
722200	negative	What is wrong with my Etsy shop.  Can't get in there. 
720079	positive	Had a good night lastnight! 
2986132	neutral	Samsung Blu-Ray Remote Control AK59-00070A for BDP1000; BDP1200; BDP1400:   Samsung Blu-Ray Remote Control AK59... ~http  
968139	neutral	ColeWorld&gt; 
993829	positive	The Microsoft crew are in the office! A team of about 10!! It's like a Hollywood set in here :) 
1113760	neutral	RockBand3 nominated for Brit Insurance Design of the Year award: ~http 
2776311	negative	Handle fell off my Samsung microwave...how in the world did that happen & how am I going to get in back on??? 
978595	neutral	Windows 8; Mac OS X 'Lion' Show Apple; Microsoft Philosophies ~http  
1597235	neutral	Anyone with a Windows Vista restore disc. Got my own license key; no disk. Need it asap; willing to travel. 
2949948	neutral	#FF @user the gucci mane cowboy 
591511	neutral	Chillin at ORD airport waiting for my connecting flight to San Antonio should be at the Hilton by 10. 
3528826	neutral	Is on my Nintendo DSi..... Night of basketball tonight; then who knows 
1896032	neutral	I am entering the daily giveaway at #freebers to try to win: Sony PSP Console at ~http  
515625	negative	#UMustBeCrazy if yu thinkk i still wear fitteds 
1686953	positive	LOVE it #tonight!RT @user Excited for another Jerzday?! How are you liking the new season so far? 
1103095	neutral	M.C. Gainey of #Lost and #Justified with @user on the set of #HauntedHigh for #Syfy. Produced by @user. ~http  
743586	neutral	#in2010 Gucci Mane will finally get over his sinus infection 
616010	neutral	Celebrate Bing Mobile Deals and Win a $500 Gift Card! ~http  via @user 
2729556	neutral	Sweet! RT @user If you add the hastag #TeamAutism to your tweet for today; Samsung is donating $5 PER TWEET. #teamautism 
1343575	neutral	Lol smh RT @user Apparently a lot of people don't know that Nike bought Converse and that adidas bought Reebok. 
1531168	positive	Surprise Bday party for @user awww you thought we weren't gonna do anything for you day hehehe #sucker! 
2581434	positive	nails done - deep blue with silver polka dots :) 
3200238	positive	The nintendo 3DS eShop us out soon! Yayayayayayyay ... Almost E3 time too! 
2280436	neutral	In class with Ade .. 
1070947	neutral	Listening to Paramore; reading Twilight. 
47651	neutral	“@GeorgiaSN: Nike Equips UGA With Creativity and Technology ~http  #UGA” @user @user @user @user 
2270432	negative	#ihatenewtwitter ..... miss d old one :'( 
2628918	positive	Ordered Sony Vegas!:D It's comming Friday!!:D #Excited 
1322786	negative	its hott af ugh 
89636	neutral	Get Free Ad Credits for Bing and Yahoo! Search! (US Only) ~http  via @user 
924316	neutral	Groupon used their editorial style in IPO including inventing metrics. Adjusted CSOI is creative. From now o… (cont) ~http  
487747	neutral	"what's Gucci my nigga whats Louie my killa what's drug my deala" 
2149612	negative	Oh; unfortunately. I think I have to give the Nike Sneakers I had bought to my friend. RT @user Yes; I won't. RT @user 
288302	neutral	Enter this month's sweepstakes for a chance to win a copy of ~http  or Microsoft Office 2010. All you have to do... ~http  
2758666	neutral	9am and beer been given to me already #friday ~http  
212130	neutral	I am who I am; your opinion is neither desired nor required. 
511409	negative	I feel myself fading. 
3208104	neutral	New post: Dominic Jaar quoted in The Lawyers Weekly on Microsoft Office 2010 (~http ) 
3396200	neutral	Heading towards the Hilton #manchesterriots 
1910636	negative	It Saddens me to find out that Gucci Mane is Aquarius like myself!!!!!!..i need to check that certificate ASAP 
1492943	negative	Damn I missed JHB 
3171618	neutral	2011 Audi A6 2.0Tdi S-Line Special Edition inc 19" Alloys; DVD Navigation; Full Black Leather; LED Day Running Lights ++ from £399 a month** 
680347	positive	Enjoyed working camp this week with @user and @user but boy am I glad it's over! Off to NoLa in the morning! 
572609	neutral	*** when i go out; i want to go out *** 
907059	positive	Another day. #RRB blessed 
89496	neutral	How Microsoft Researchers Might Invent a Holodeck: ~http  via @user 
788279	neutral	First Rule of Pimpin: you cant lie 
1955373	neutral	"BaconMania is sweeping the nation!" #sharktank 
2041317	neutral	XL or XXL shirt? 
109069	neutral	Watch new Partner Webcast Series on Microsoft Parnter Network Community website. ~http 
1813432	neutral	Ok I need a word from you... 
3426560	neutral	33 new APIs: Bing Translation; Node.js Hosting and On-Demand Printing – ProgrammableWeb (blog) ~http  
1273210	positive	Getting ready to head to Nashville in the morning! Super stoked! 
2378083	neutral	Check Out: #3: Super Paper Mario (Nintendo Selects): Super Paper Mario (Nintendo Selects) by Nintendo Platform:... ~http  
3293634	negative	These new Nike diamond turfs go stupid if only I can find a mariners snapback™ 
2392272	negative	Look we're all in line BACK THE FUCK UP OFF ME. 
277025	positive	Oregon's Nike Pro Combat jerseys are sick ~http 
884206	negative	having family problems 
89577	neutral	Seen it?  Have a favorite?  Image Gallery: Microsoft Infographics ~http 
240305	neutral	Windows 8 leaks show Microsoft Mobile and Office influences - Telegraph ~http  via @user 
2524658	negative	Carolyn fell off her bike?! Even worse: she ripped her jeggings?!?! #tragedy 
746490	neutral	check out @user video from @user ----&gt; ~http  
1697393	neutral	Sitting down for a spot of Swedish afternoon fika!  ~http  
3343702	neutral	Just bought the Samsung Infuse...giving the Android platform another try... 
2068071	neutral	Check out my guest blog today; "Oooops!" ~http  
304213	positive	Irish car bombs at Opal Divines. Happy st pattys day!!! 
90094	neutral	Join Our Microsoft Talent Network and Receive current  job updates!  ~http 
2249535	negative	These people who beg for a "RT" need to be shot in the face.  It's embarrassing.  #getalife 
3045051	neutral	Fresh on nike shoes: Agent Free-agent safety Wilson agrees to join Bengals 
1168522	neutral	The Dogs of War: Apple vs. Google vs. Microsoft ~http  #google #apple 
1150391	neutral	#youlookedgooduntil U rolled a loose spliff and spilled my gucci kmt 
282317	neutral	#beatcancer #beatcancer #beatcancer #beatcancer #beatcancer #beatcancer #beatcancer #beatcancer #beatcancer #beatcancer 
2468555	positive	I'm loving iphone even more today. Can apple do no wrong at the moment? 
2327537	neutral	New driveline technology on the Audi A8 saves weight; assembly time; space and cost. It comes from GKN Driveline. ~http  
1277440	negative	Reformatted comp; no microsoft office. screwed! 
2275427	negative	im seriously mad about it. 
441716	neutral	The Birth of Samsung Galaxy Tab 10.1 [Infographic] ~http  via @user 
187095	negative	ALL DEM FAKE PAGES OUT DERE. @user IS OFFICIAL MA FACEBOOK TERRANCE SINGEAL MYSPACE LILTRILL5 AND 5SAVAGE ! ALL DA OTHERS FONEY #HNF 
68634	neutral	Freestyling over at the Showdown in Chinatown later. @user 's charity event. Gonna be some NBA and soccer Stars. Nike field at 6pm 
155052	neutral	New blog post: ~http  - Ask the Experts – Navigating MPN Competency Requirements for Microsoft Dynamics Partners 
2556044	negative	damnn i already see fake fans now uploading wayne songs on fb . 
1540746	positive	Thank you to patient and kind #staff & #clients; we ran really smooth through the beautiful #snowday.  Hoping for safe roads tmrw! 
168216	positive	Multple Sclerosis or not I have decided to start my Masters of Education in July!!  Then we will see how tired I am and will get! 
3550093	neutral	Have Fun While Staying Fit With Nintendo Wii Fit Plus ~http  
2948170	neutral	We will try to create conditions where persons could come together in a spirit of #teamwork -Akio Morita; founder Sony Corp 
3335969	neutral	Ballmer "Bing will be integrated  at BB OS level beyond app exp.  Making better decisions with Bing on BB" #bbwc #bbwc11 
1037947	neutral	No kids class for rest of Dec. Saturday practice starts at 11:30. 
280442	negative	Guys suck. They should all die. right now. 
2553846	positive	lmao how did it go from Jedward spamming Aaron to him waiting for them to call him?! Jedward fans are amazing! 
615460	negative	Dora the Explorer's voice is extremely nasally. #annoyed 
725447	positive	This shirt is ass kicking ~http  
860973	positive	I hope everyone have a fun and safe Labor Day weekend. 
104807	negative	But I don't LOVE HER.... (( Gucci voice )) 
10001	positive	-Your love is the sweetest thing at this point in my life; when u say u love me my heart stop. And when you say that I have all u want. 
2571760	negative	i'm in one of those moods where everything is annoying me. #ohjoy :D .. :/ 
1536880	neutral	Week in tech: Anonymous vs. Sony edition ~http  
1354950	negative	Why the hell did my mom give this bitch a key 
88971	neutral	Click. Click. Do you know the answer now? On this day in 1983; Microsoft introduced the 2-button mouse. 
2482844	positive	Bathed dog; no more dog stink in the house! 
3172332	neutral	NVIDIA and @user are giving away a free Samsung Tab 10.1 Honeycomb tablet ~http  I'm gonna win it.  Sorry. 
1884930	negative	I'm sick of physical therapy... 
1040983	positive	Seeing a bunch of comments on N4G talking about how the best games in any genre are always Sony IPs. I'm inclined to agree. ;) 
1722796	positive	Just got back from dinner wit my fam! Fun times 
179398	neutral	Epicor goes mobile with ERP system | Microsoft News | OnWindows.com ~http  via @user 
2129368	neutral	At the first Microsoft Store Opening ~http  
2947518	neutral	win latest Sony Laptop ~http  
215902	neutral	LJDesignz.com Vuzix Wrap 1200 3D: Hopefully Not Just a Really Belated Virtual Boy Sequel:                 ... ~http  
1063099	negative	Dem All Black Adidas Is Sooo Ugly 2 me!!#Uhgggg 
758206	neutral	The First Official American TV Spot for Nintendo 3DS (video) ~http  via @user #ipad2giveawayTB 
59019	neutral	Black man can jump; like he sponsered by nike lol #nextfriday 
564389	neutral	Weird RT: Hilton Hotel; and Sky 23 Bar in Manchester goes into administration - w... ~http  (via @user) 
777855	neutral	Refocusing this Twitter account on Career and I.T. and Microsoft certification.  Will be weeding out the "network marketing" connections. 
109184	neutral	Get your questions answered directly by Microsoft Infrastructure executives at #WPC10 in this Q & A Session: ~http 
601790	neutral	Well I'm goin to go zo bye ttyl 
2839178	neutral	Business schools and financial instituitions should make 'Inside Job' - a Sony entertainment documentary film mandatory to watch for all it… 
2326997	neutral	Hmm; can Microsoft buy Nokia if it wanted to... 
109958	neutral	New blog post: ~http  - Microsoft User Group Lecture Series–Feb 2011 
2421564	neutral	The Sony S1 tablet will be available in UK by the end of September. 
1887912	positive	Finally watched the season finale of Castle...it kind of blew my mind! Can't wait for fall T.V. to start again and it's barley summer! 
589817	positive	I found out today that @user has a nintendo 64 and it made me really excited :) 
1658232	positive	I love you @user 
2756803	neutral	You should check out text from last night. @user 
305852	neutral	When do you guys go back to school?? 
1125086	neutral	I just ousted Justin B. as the mayor of Shepherd's Bush Railway Station (SPB) on @user! ~http  
2233641	neutral	Bikeathon ’09.. A Blazing trail of 20000 bikers ......~http  
1840840	neutral	Done Deal! Big Deal. Smart Deal? Microsoft Buys Skype For $8.5 Billion In Cash ~http  via @user 
2712264	negative	Can be bothered with brekky to cold! And my back hurts :( 
1936235	neutral	19-year-old arrested over Sony hack; London police say #cnn ~http  
652167	neutral	trick or treat for unicef tomorrow night. meet @ the union @ 6. 
411506	negative	Can't sleep.... ;( 
155054	neutral	New blog post: ~http  - Live Webcast: Microsoft Dynamics Sure Step 2010 – Step Up Now! 
89007	neutral	Need to summarize an article? Microsoft Words offers an autosummarize tool that'll make your so much easier.  I... ~http 
476435	negative	If I could stab my Bing app it would be severely dead by now 
344149	positive	Miner #2 on his way back to life. :D 
1330642	neutral	I honestli cnt w8 2 go bk 2 PTA;ka nnete mara aowa.I thnk iv ova-stayd my welcum at hme:-( 
2792800	neutral	"life Is more than just 3 sets of 10"!- anonymous #Crossfit 
334421	neutral	Imax Names Sony Exec Jiande Chen to Lead China Division ~http 
2421323	negative	#RT IF YOU #HATE Justin Drew #Bieber 
1252771	positive	I &lt;3 lawrence! 
2110243	neutral	EgyDroid | Samsung Galaxy 5 (GT-I5503) Arabic Froyo Update Finally Released ~http  via @user  #Android 
2712697	neutral	#nowplaying beat it up - gucci mane & trey songz. 
2595837	neutral	Want get this Gucci Shirt its 300 I'm get it 
385537	positive	I just got up to 13;752 in #DoodleJump!!! Beat that! ~http  
2132685	positive	today was a good day :) 
236175	positive	Congratulations to our friends at Sony for their FOCAL Award nomination for restoration of Bridge On The River Kwai ~http 
661979	neutral	After #Google+; Microsoft is on the social network race:  ~http  
742345	neutral	Only 3 days left. Submit your #nonprofit grant application: Microsoft Elevate America ~http  RT @user @user ^lu 
731236	neutral	Could Microsoft OneNote be a good basis for building an Electronic Medical Record; based on (un)structured data input? Going to investigate! 
833099	neutral	#Lesbihonest  Irene is just some wind and rain; just get on them boots.   @user #HurricanIrene 
1585770	neutral	She likes him. He likes her. Everyone knows. Except them. 
1811761	neutral	This nigga @user gonna have them Nike mags 
2286185	neutral	Spending money I don't have on these nike hi nylon dunks. 
2203278	neutral	Buy for nike shoes cheap at ~http  #ineedtostop #ripnickiminaj 
2271545	positive	Thats how niggas feel?! Im in bing ma gee wdup doe! RT @user @user nah ma nigga u certified #bulto WHERE U @ nigga! 
100110	positive	wow those nike air mag shoes are something serious 
2303305	neutral	How to install Android 2.3.5 Gingerbread on Samsung Galaxy S2: Android has released Gingerbread 2.3.5 for Androi... ~http  
1998073	positive	woohoo! finally got audio bk on! i just need to put web cam; microsoft office; excell; powerpoint ect. bk on! probs take me all nite!! 
850124	neutral	#confessionhour I think #confessionhour been going on for more than an Hour should the name change??? 
2730847	negative	SOOOO sick of being sick :( :( :( :( I don't think that there's any amount of sad faces to convey my frustration/depression from being sick. 
213756	positive	I am officially addicted to rockband 2 on the nintendo wii!  Today was fun :) 
2587342	neutral	HEY WITCH DOCTOR; GIVE US THE MAGIC WORDS:  OO EE OO AAH AAH TING TANG WALLA WALLA BING BANG. 
2481797	neutral	The whole Apple VS Samsung court hearing in the Netherlands is covered here : ~http  
263460	neutral	we cast the people in our lives in roles. conflict arises when they don't play the roles we assign them. 
641301	neutral	Here comes open source for K-12 at CES; example: Samsung Infuse 4G: - ~http  via @user - lots more ~http 
518215	negative	feeling really down today 
590799	neutral	Ballin in the Hilton tonight 
876393	neutral	At poly clinic now; currently 2628 my number 2636 
1777598	negative	Eric Maynor just blew the game and series... #Thunder 
157341	neutral	Black Hat: Microsoft More Secure Than Mac ~http 
1076515	positive	Got a new Dell desktop today. Feels good man. Windows 7 is pretty tight. Hell; even Internet Explorer isn't too shabby! #shock 
2335448	neutral	I guess so did u get a key 
2724432	negative	full of snot...where has all this mucus come from?!?!? Seriously this can't be normal 
1291734	neutral	Hey @user; my answer is 2 million  #Daily1KGiveaway 
2271521	neutral	S/o to em bing goons wildin. I'm on my second Privilege. Fucks shaken out there tho?! 
2211441	neutral	Holy Shiz #decisions  ~http  
3004124	negative	CRYING. I CAN'T. KKEEKEKEKEKE XD RT @user ADIDAS - All Day I Dream About Saajid 
789671	neutral	Down to Bionic vs Vigor now. RT @user Did Samsung Confirm the Existence of the Nexus Prime in a Cease and Desist? ~http  
1044465	neutral	AlL dAt MoNeY iI sPeNt On DeM Nike ShOeZz; U bEtTa JuZz Do IiT.!! CtFu #Boondocks 
1933012	neutral	Watching titanic while my city burns?....oh the irony of fire and ice #londonriots 
282481	neutral	Fun With Netbooks - My brother Paul bought a netbook on Sunday - a Samsung NF210. Now I’ve heard and read a... ~http 
1694468	neutral	Top quality example of what viral campaigns can do for charities and businesses. Nike MAG Goes Viral - ~http  via @user 
1596752	neutral	Electronics Store: Samsung UN55D6500 55-Inch 1080p 120HZ 3D LED TV (Black) ~http  
2659399	neutral	Say it 2times gucci gucci 2times 
55925	neutral	Lighthouse-talent is looking for Microsoft Dynamic professionals! Know anyone? 
89571	neutral	Just Published: Video: How You Can Tell Your Story Through Microsoft Advertising US Video Sites ~http 
380423	neutral	#amazon #10: Sony Cyber-shot DSC-HX9V 16.2 MP Exmor R CMOS Digital Still Camera with 16x Optical Zoom G... ~http  #camera 
2781095	neutral	Photo: NIKE 6.0 Cash for Tricks Intl. Final @ Anglet ~http  
2109286	positive	There are new cross walk blinkers in nike and they talk. VERY entertaining! :) 
2230513	neutral	Win some of the new Nike SB Omar Salazar shoes tonight at Innerspace's Wicked Wednesday Skate Jam. ~http  
2654349	negative	This video contains content from Sony Music Entertainment; who has blocked it in your country on copyright grounds. -&gt; FUCK YOU DMCA!!!!!!!! 
843448	neutral	Headin to nike 4 shoes and opening ceremonies 
241993	neutral	Bringing Bak out Da nike hoodies for dis one 
1038291	positive	Working out w/ the young guys at Adidas Nations camp in Chicago. Some very talented & personable young men here. 
1579829	neutral	The best price we were able to negotiate for 3G handset is around $100 for Sony Ericsson 
376684	neutral	GC Export FCP 1.4 available for download. Massively improved user experience; support for Sony XDCAM HD 1080p formats and XDCAM compliance. 
1370531	neutral	Correct grammatical errors in the given sentences : ~http  via @user 
1163924	negative	I legit got the flu while I was sleeping. Damn heater! 3rd time this year. I'm dying; I used to get sick once a year. Now... 
1961800	negative	X-Factor axed Cheryl Cole;Some other bint's in her role;She should just fuck em off;& run off with The Hoff;Coz Cowell is a fuckin arsehole. 
2334792	negative	"Sometimes it's easier to shoot yourself in the head" 
567115	neutral	Steps to Discovering the ROI of Brand Journalism for Your Business ~http  via @user 
587538	neutral	Women In Science ~http 
1352637	neutral	Video: Nike Is Making Powerlaces.. For Real: Actual MAG Shoes As In The Ones In "Back To The Future 2"! ~http  via @user 
1439342	neutral	$1;000 off Sony BRAVIA 60” Class 1080P 120Hz LCD HDTV $1;499 
1103414	neutral	iPad 3 Will Begin Production in October… Without Samsung [Rumor] ~http  via @user 
2841744	positive	really good meeting with my supervisor! Lots of very exciting ideas in the pipeline! 
2186662	neutral	So desperate for some football games watchin games from last year 
2028279	neutral	Gotta be in tune with your inner playaa 
66545	positive	An unexpected gift! Definitely a better start to the day than yesterday :) 
465476	neutral	We Are a Paris Hilton People in an Apocalyptic World: By Mark Shea | What else can be said of a nation that so... ~http  
1069366	neutral	Todd Eldredge - 1996 US Figure Skating Championships; Men's Long Program ~http  
309419	neutral	We have the location for the MSP Mastery Event in Chicago.. We will be at the Microsoft in Downers Grove. Regi… (cont) ~http  
2663254	positive	Dude. I love the bing commercial with chromeo! 
926613	positive	I love my baby:) 
1447707	positive	#FollowFriday This girl is amazing!!  Follow @user 
2974939	negative	I love how nintendo thinks I'll pay 6 fucking dollars for gbc Zelda. NO...just...no! #thefuck? 
1666849	neutral	Holla from the bottom; yell it from the rooof @user 
1710219	neutral	ADVANCE FAIR 'til 1May. Special price for Hula Chair & more special offers. Talkshow 'Resiko Obesitas' with dr. Bing Haryono on weekend #fb 
1996779	neutral	OUTSIDER!!!! #ASOT ....YES @user 
1219450	neutral	#umightbeghetto if you wear those pucci clothes. Not gucci pucci. 
1180610	positive	I love you @user for loving me......#SEXY 
2212859	neutral	Lanmark are recruiting; we want talented technical staff with plenty of Microsoft experience - contact us on recruit@lanmark.co.uk 
1507487	positive	Lovin the new adidas commercial... First original commercial I seen in a while 
2412739	neutral	Don't miss our Atlanta REIA Credit Repair Webcast with Rick Harper on Oct 20th at 7PM ET. Register for Free at ~http  
1682734	neutral	Let go of those who bring you down and surround yourself with those who bring out the best in you… ~http  
1663449	neutral	Tommy's-research into causes and prevention of miscarriage;premature birth and stillbirth please sponsor us 
41005	neutral	At werk Finna swim then one more head to cut wen I get off 
2685124	neutral	What to read? ~http  
1771974	negative	So ready to get off today. I need to blow; Having to combine these children all week at work aint cool. Come on 4:30. 
