3506632	positive	Got myself some nice Adidas Adizero Tempo for only £60 from Sweatshop. Well chuffed ~http  I presume PBs will follow. ;) 
2632028	neutral	Watch the new 'TheYoungTurks' Video: "interviews_Bernie.mov" ~http  
1007209	neutral	i havent had Mcdonald in a hot min... 
699590	positive	Late for school; but just had the best jam sesh to jawbreaker/i call fives :) 
1049013	negative	You think Facebook settings are complex? You ain't seen nothing until you try deleting a Youtube account. I need a PHD in understanding BS. 
109312	neutral	Will Business Meetings Use Microsoft Avatar Kinect?  ~http 
724415	neutral	WHAT!!! I want a fancam T_T RT @user Omg RT @user @user henry piggybacked amber 
945305	neutral	library swag with @user 
2539363	neutral	Hey everyone.  If you didn't know; I have a fan page for my photography business.  I'm just started out and would... ~http  
2357032	neutral	who's going to bamboozle? 
2797651	neutral	Gov Malloy says too early yet to order state workers to stay home 
2111202	neutral	Even more designs made....  Audi A8 (11-  ) Head & Tail Audi A7 (12-  ) Head & Tail        Audi Q7 (09-  ) Head;... ~http  
1716865	neutral	Why doesn't MIcrosoft market the home server software better? It is a great network backup solution 
3577194	neutral	Paris Hilton talking about reading books? I think her twitter account has been hacked. 
1124597	neutral	Are there any livefeeds of federal parliament these days on internet or digital #auspol 
2392351	neutral	“@FreakyFact: A dirty book is rarely dusty” @user #true 
1718954	negative	Mad I keep losin connection 
2426615	neutral	Is gonna be on supa dupa chill 
633278	neutral	Flying out?  2 t-shirts for £20; including Nike; Adidas and Puma; at JD Sports; after security in the departure lounge; lower level. 
2713942	neutral	#10favouritesingers (in no particular order; too hard!) 1.  Phil Anselmo 2. Corey Taylor 3. Michael Poulsen 4. Serj Tankian 5. Ivan Moody 
205300	neutral	I'm gon need you to say somethin baby.... 
535154	neutral	Looking for folks to come to How to Buy or Sell Businesses seminar; Portsmouth NH 7:00 PM Hilton Garden Inn Thursday March 26.  It is FREE 
542421	neutral	Medschool @user what r u doing? 
570257	neutral	How I Got 170;000+ Twitter Followers in 1 Year  sponsored ~http 
1477546	negative	Thanks NY 4 sending us ur Crappy Weather !!! 
484808	neutral	just finished my 30 minute workout towards a BIGGER booty ; i am POOPED 
1313059	positive	I can't believe this is happening. I leave for Sac in 5 hours. I am all packed and ready to go (: 
921777	neutral	Tomorrow I´m going to interview Frida Giannini & I ´ll wear Gucci of course...but now I´m in London 
3117235	neutral	Opening Night at the Las Vegas Hilton is August 2nd!! Check it out! ~http  
745570	neutral	AM OUT.... 
1497503	neutral	#nowplaying Breakin Up ♪ Mario ft. Gucci Mane & Sean Garrett  ~http  in iPod app via @user 
1119395	negative	i despise microsoft right now. there are so many words i wanna say... 
421537	neutral	What's gucci my Nigga 
1786811	neutral	"How to Spend Less and Have a Great Time                            In Dubai?" ~http  
1032280	neutral	let it instrumental featured in adidas viral vid for art basel... ~http 
976847	neutral	Follow me n I will follow back #newfollowers 
2157716	neutral	#Free 100 Microsoft Points with Windows newsletter subscription - dealspl.us ~http  via @user 
1890509	neutral	#nw How Do You Know on @user. ~http  #HowDoYouKnow (via @user) 
977070	negative	really i heard some dmb bytch tellin  me to stay with my man but of course i stay with him cus he take care his daughter 
912231	neutral	Apple wins ban on 3 Samsung phones in 10 European nations  ~http  
626963	positive	Damnnnn “@GracieGlam: Can't tell how many but fuck it!!!! Yay 16k ! #bigbooty love you guys!!! &lt;3 ~http  
2352169	neutral	“@SHGames: RT and follow us for a chance to win #CoDXP tickets.  We now have 10 left to give away starting now! - #shgames #MW3” 
2212844	neutral	Cloud Computing; Online Services and Hosting | Microsoft Cloud UK - Mozilla Firefox ~http  
1986746	neutral	JD's Mega Sale is in full swing! Get up to 50% off on from top brands like Nike; Adidas Originals & Converse. 
2497029	neutral	lol you must be catchin the next flight RT@_NINO_BROWN_ @user. On my way 
1596842	neutral	Samsung phone (Clemson) $80: Samsung eternity phone with wall charger works fine has a scratch on one of the cor... ~http  
435308	neutral	Master of Legal studies a one year program for non attorney professionals 
976878	negative	Ugh. That's why i don't talk. ISOLATION HERE I COME AGAIN 
1294309	neutral	Where my boy @user at??? 
1935756	neutral	going out with in my adidas jumpa yerrr xx 
328318	neutral	Bryan Von Axelson will be in todays Microsoft Partner call. Do not miss it! ~http  
2458563	neutral	FYI; we're looking for new stylists to come hang out with us and add to our day. If anyone knows of any other... ~http 
2436803	neutral	Where is my Love @user. 
112850	neutral	Hey @user I WANT YOU TO PERFORM GUCCI BANDANA;I'M BALLIN AND SWAG FLU  (#SouljaBoyBETAwards live &gt; ~http ) 
3090108	neutral	Genius or Madness: German court awards permanent ban on Samsung GALAXY Tab 10.1 in Apple case ~http  
1485519	neutral	Best Features of Sony TX10 ~http  
416399	neutral	LOLLYPOPS FUND..Making Kids with Cancer Smile is hosting their 1st Charity Ball on 26th Nov at Hilton Dartford Bridge Hotel; tickets £45 x 
1304275	positive	I'm going to sleep so good tonight! Nightttttt&lt;3 
2028830	neutral	I uploaded a @user video ~http  Yung Dolla$ - Tired Of Shit'n 
2305615	neutral	Keeping up with social media  - Microsoft brings Zune and social networks to Xbox! ~http  
1115134	negative	I am so irritated tonight!!!! & idk why!!!!!!!!!!!!!!!!! 
458934	neutral	Ask me anything ~http  
287808	neutral	New post: What is Microsoft Office 365? ~http  
3024563	neutral	The average Ont. family forced to pay extra $65/yr to give away power to Quebec with McGuinty’s Samsung deal ~http  #onpoli 
1044194	neutral	Sellin Nintendo Wii w/4 games; Lan Adapter; controller charging station; wii wheel; all original boxes Like New for $185 
286948	negative	I AM DELETING TWITTER TODAY. IT HAS MY HYPERTENSION SKY HIGH SOME DAYS 
90813	neutral	Software New: Microsoft Word 2007: Shortcuts with Macros ~http 
2296684	neutral	NYE 2010 at The Hilton Chicago; Early Bird Tickets On Sale Now for $110; Very Limited Quantity!! CLICK HERE&gt;&gt; ~http  
745142	neutral	NP-play ur part 
149226	neutral	Need to start all over again 
2001121	neutral	2nd MANCOPIAN DECREE: The word "money" will be banished & will be written as $. 
825801	neutral	CURACAO - From $699; 4 nts; Hilton Curacao; w/ air Available for travel 8/17 - 12/22 Package includes round... ~http  
2510343	neutral	Video: Nike BetterWorld - History featuring Phil Knight ~http  
756792	negative	#BET jokes don't do it for me anymore. RT @user @user you sir don't know shit about comedy 
2673036	neutral	the awkward moment when you don't know if someone is a girl or boy.. 
207745	neutral	do people still listen to gucci mane??? Really? 
1695821	neutral	Experiments have shown that trial accounts can; indeed; group with high level players; so long as the high level character does the invite. 
364488	neutral	Happy Monday!  InsideOUT will be discussing Media Representation of the Queer Community from 6-7pm in the LGBTQ Resource Center. 
1125856	neutral	which #android #qwerty #mobile phone to get? Samsung Galaxy Pro B7510 or Motorola Charm or Acer beTouch E210? 
1573546	neutral	I bet that was Chris Johnson who bid 75 grand on the size 11 Nike Mags..... 
2289216	neutral	I'm selling my Samsung Vibrant Galaxy S... Hit me up for price! 
1031857	positive	ALLNIGHTER!!! 
2530325	neutral	Vodafone to offer Galaxy Tab 10.1 exclusively in the UK - ~http  
653116	neutral	Gear up! Nike LSU Tigers Purple NikeFIT Performance Replica Baseball Jersey ~http  
261885	neutral	New football uniforms by Nike next year?  ~http 
2571657	positive	has learnt how to use a Nintendo Wii and Twitter in the same day 
2905309	neutral	Afro Boudoir: London 2012; Stella McCartney & Adidas ~http  #sportfashion 
48487	neutral	Do Tweetups Work? Hilton Anaheim Says So ~http 
2500388	negative	#TheLastTimeIChecked they wasn't fucking with me now the checking on me like a nike sign 
193495	neutral	Buy oem software online microsoft office 2011 home & business ~http 
2972139	neutral	I haven't had all black adidas since 4th grade 
316002	neutral	Practice Monday at Stable at 5:30 
2644187	neutral	What the heck is Microsoft doing? | Articles ~http  
3332160	neutral	Diesels account for lofty percentage of Audi A3; Q7 sales in August ~http  
2295121	neutral	Certify Dumps Microsoft 70-442 Exam Questions are updated regularly according to Exam ~http 
222300	neutral	Merced defense returns a fumble for 24-yd td to give merced a 14-7 lead I'm 2q 
3067897	neutral	Microsoft responds to camera tracking claims | WMPoweruser: In a recent law suit Microsoft has been accused of u... ~http  
696305	neutral	Kobe; Nike could partner up to play in China ~http  
1947968	neutral	#FamousLies- it was just sex; it didn't mean anything 
287807	neutral	Post Edited: What is Microsoft Office 365? ~http  
2209008	neutral	#momolo At Mobile Monday London; Microsoft Office; "Living in a Multi Platform World" 
3542067	neutral	gucci gucci still trending? well damn 
2295108	neutral	Our Microsoft 70-445 Online Exam Questions are updated. ~http  
2417328	neutral	just joined a video chat with 78 other people at ~http  #tinychat 
449138	neutral	Win a Sony PS3 Move Bundle @user ~http  
1019885	negative	Been going through somethings for a while...but better days are to come... 
2248877	neutral	New blog posting; Collection 5403: Implementing Microsoft Windows SharePoint Services 3.0 - ~http  
161186	neutral	Winners announced for the Microsoft Path to the Private Cloud Contest:  ~http  #VMlimited #VMworld 
2057057	positive	Cant wait to watch @user tonight. Something to bring me up :). 
3239756	neutral	Everything About Sony Vaio VPC-EE VPCEE33FX/WI ~http 
159644	neutral	This song with gucci n waka I'm guessing is called get out my lane or ferrarii boys 
2423000	neutral	How to get Sony Vegas 10 Pro for Free ~http  
1596036	neutral	#greatcombos Chicken and Waffles ~http  
2635339	neutral	Psssssssst... ANYTIME;) @user 
3320461	neutral	Win a Sony Playstation 3 @user ~http  
533100	neutral	found her twitter account.. @user ~.~ aloha 
2345874	neutral	#FreeOffers Wii Fit: Balance Games – Tightrope Tension | Nintendo Wii Blog ~http 
397006	neutral	sony hd camera @user Best Price Sony Handycam HDR-CX130 1080p HD Video Camera Camcorder (Black) with 16GB Card   Ba... ~http  ;P 
3206751	neutral	Chanel Jewelry  Gucci Caps  Nike Shoes  Armani Clothing  Lacoste Shoes 2011   Free Shipping & Fashion2011 ~http  
617710	neutral	You say you have IT management experience along with experience with Microsoft Operating System; Windows Server... ~http  
1576675	neutral	Majesco announces Spy Kids: All the Time in the World for Nintendo DS! ~http  
1698434	neutral	Updating Ladies Logic ~http  "The Truth Is Out There" #tcot #hhrs #outpost #utpol #utleg 
1796134	neutral	Check this video out -- Tamales ~http  via @user 
2423120	neutral	New post: Samsung patent applications published on 08 September 2011 ~http  
2689002	positive	Love; love; love @user!!!!!! 
1271737	positive	Love this song! RT @user Set me free; leave me be.. I dont wanna fall another moment into ur gravity #np 
2257162	negative	fuck a #PrettyBoySwagg i got my beechwood #GucciBoySwagg on wit my whiteboy jeans.im still gucci down til JP come back and tell me i aint 
2265585	neutral	Free "Ten Tips for Classroom Management" guide for download from @user ~http  
1882552	positive	Ok; really starting to dig this whole video thing.  The right tools makes all the difference. Sony Vegas...nuff said. 
2255176	negative	Ugh.! Broo; comb your fuckin hair.! Youre a girl.!! 
3430462	neutral	Yes; Microsoft Did Change The World More Than Apple ~http  via @user 
2781096	neutral	Photo: NIKE 6.0 Cash for Tricks Intl. Final @ Anglet ~http  
1282619	positive	omg i love pauly d hair  (@YouTube ~http ) 
2401903	neutral	Check out: @user Brings Rhymes From Brooklyn to Russia ~http  via @user 
421443	neutral	Where the wild things are=Drake 
3059460	neutral	LeaderQuest is now offering discounts on Microsoft training to any. Microsoft Partner. 
588395	negative	Sooo Bored  omg 
632957	positive	Its officially #LeadershipSafari2K11 time!!! Welcome back bbq tonight; cant wait to see everyone 
1025533	neutral	Kin hot in Turkey but the Hilton in Dalaman is immense; well geared up for kids and Sky Sports in a Bar for 2moz ~http 
2256808	neutral	im still that nigga that you use to even though i aint that nigga that you use to 
1009894	positive	Here we are again; well hello there :) 
374120	neutral	"If you hit a wrong note; then make it right by what you play afterwards." - Joe Pass / Jazz Guitar 
2618124	neutral	Michigan we need to head for Lansing. Five arrested after sit-in at Michigan capitol ~http  
1283941	positive	We had the UTC class of 2010 that came by 2day. It was a blessing to c them. Many r going back 2 their cities 2 do a wk 4 God. God bless you 
1661841	neutral	...In the middle of shooting a Samsung Commercial with Alicia Keys ...Lights; Camera; Action! 
2863243	neutral	android smart phone Apple iPhone 5 vs. Samsung Galaxy S2 Plus; Rivalry escalates  Internati... ~http  
397013	neutral	Xperia Play price slashed once more as Sony cancel PSP Go ~http  sony camera charger 
490398	neutral	#HopeHasAWarrior -- Save Our Seeker! 
1801353	negative	Waiting for all these people 2pay w/their stupid food stamps @user. Com'On people I just want a bottle of vodka let me go first! 
3070108	neutral	L (@Leagleek123) has shared a Tweet with you:  "ashleytisdale: @user hahaha yes!" In responce to perez hilton :-) 
2837019	neutral	I'm trying to specialize in the things they say that can't be done. Ghent. 
1638854	neutral	this here is ah one night thang ! ;; and ii aint looking for no rang ! ;; ii aint tryning play no games but !........ #Heartbreaker♥ 
94158	positive	Nigga just ate great wit dat food wendys be on da one 
106296	neutral	DaUKockyChristmasParty on 3floors 33rd on da 23rd @ 152 Playa Fly; Kocky King; Lil Herb; Montana Trax; D. Whizzle; Lil' Herb's "33" bday 
739759	neutral	"Git-R-Done" in your call center:  ~http  #bpaquality #callmonitoring #VOC #CCTR 
2005568	neutral	Datz errday 
309051	positive	The bed's at W Hotels live up to the hype. I'm falling asleep as we speak 
1816243	neutral	It be like that sometimes..... 
191733	neutral	Tier Zero Nike X Questlove Dunk High BZ & Strap (415924-601); (434245-700) ~http 
1531049	positive	Loves gifts... : ) 
275168	neutral	Possum pums! Runnin don't mean its trash!RT @user but wait.... what's worse??? possum pums or shorty that always runs from the dick? 
839517	neutral	Well; my name is Suzie and Gucci thinks I love him. 
3338431	neutral	unveiling the next generation of Nike Pro Combat football gear ~http  
2053621	neutral	Come to "MRC Cookout; Candidate Fair & Straw Poll" Sunday; August 28 from 12:00 pm to 3:00 pm. When: August 28 @... ~http  
656783	neutral	If you haven't already; be sure to register for the Multicultural Student Leadership Conference at ~http  under Events. 
2758146	neutral	What agencies provide assistance in creating an in-house CRM system? ~http  
1415837	neutral	What you doing up in here! (Daddy) lol RT @user A hour of sleep; and @user wants to show up at my apartment 
2565556	neutral	Headed to dance and P.E. Ed class.... 
2623464	negative	perez hilton is really annoying to follow :S 
752240	positive	had the most awesomest day at school! mr harvey played one and iYiYi all day go him 
2287559	neutral	Check out Microsoft at BETT this week - discussing all forms of education technology and the latest government Home Access initiative! 
35111	neutral	Virtualization Wars: Citrix Tops Microsoft As 'Primary Hypervisor' ~http  #enterprise #software news 
997463	neutral	FRIDAY SPECIAL! Come in for ANY MASSAGE of your choice tomorrow; Friday the 4th and recieve a Gift Certificate for... ~http  
826147	negative	#talkshitgethit 
1586067	negative	Please #wakemeupwhen you stop calling yourself a barbie over there looking like Ken and Scooby Doo.. make sure u shave that mustache bitch 
3045056	neutral	Fresh on nike shoes: People confront have egg type; excess fat type 
317893	neutral	First set Fran. Forza! 
338076	neutral	The evolution of the Nintendo game controllers!: The 64 controller definitely falls under the category "looks st... ~http  
2917741	negative	Thanks Nike + update for deleting all of my run history ..... 
1696418	positive	Seeing @user's "Life of Galileo" this afternoon. Just entered and already love design: really economical use of space; love the (1/2) 
1587978	neutral	Interesting: Apple is globally nr.1; Google is nr.2; and Microsoft only nr.5? ~http  via @user 
1384379	positive	nice !!! CHECK OUT FUTURE-&gt; @user Casper- Gucci Time (Freestyle) ~http  via @user Casper FROM ThaYoungHustlaz"" 
905147	neutral	Gorgeous glass of prosseco   @ Hilton ~http  
2058767	negative	Settling in at the Nike hoops summit. Americans look 10 yrs older then the euros. #fb 
296079	neutral	School in a couple ahh hours 
848777	negative	losing interest in us.. 
119289	positive	following @user is always the biggest pick me up in the mornings... Feeling so good today for a bunch of reasons!!! 
1642813	positive	In my heart; I am singing. Because he is coming home! 
109085	neutral	Find out about promotions early - Join the discussion in our LinkedIn Group for Microsoft Partners: ~http 
2329421	neutral	Google is out to put Microsoft Exchange out of business. Google Sync works with your iphone:  ~http  
1235860	neutral	This girl ikno from high school is in Gucci video in the tub "Hard on A Bitch" 
1619284	positive	I watched Glee and thought it was the best episode since Sexy 
720785	negative	Shorty think she hot shit cuz she got a fake gucci bag!! I think NOT!! Lmao!! 
188489	neutral	Should I do the gucci 4 my bday  ~http 
306493	neutral	Princess Charlene of Monaco aka SA's own; is in Cape Town 
649504	neutral	BBC News - Samsung appeals against European tablet sales ban ~http  
493321	negative	That was pretty stupid. 
2367028	neutral	organising a cast; worring about kat; having a life; buying wands; harry potter......not much then 
1774486	negative	I wanted to do an hour of exercise today; but that mos def is NOT gonna happen. Way too much pain. At least I got in 1/2 hour. 
2322655	neutral	You don't get another chance; life is no nintendo game. #eminem 
1855287	neutral	Shaun Ryder's got Gillian sussed 
1601153	neutral	“@FelixPush: @user  Badman! waiting 4 you in Moscow !” might be a long wait for that one mate :) 
2657536	positive	I think Sony is winning #E3. Count my vote on @user ~http  via @user 
3117237	neutral	We're moving to the Las Vegas HILTON and going on tour with over 70 performances across the country!!! ~http  
1406721	positive	Says; Yayy finally off work.....sheesh missed the beautiful weather its gucci more days to come ;)) 
1364479	negative	How bout I locked my keys in my car today.I was devastated. 
637489	neutral	I'm slucc hungry..finna make a sandwich 
2398941	neutral	Instrumental battle at the Grammys ~http  
721963	positive	Just picked up the samsung galaxy it's pretty damn cool 
1471103	neutral	I liked a YouTube video -- Sin City Effect - Sony Vegas Tutorial ~http  
1941201	negative	Downloadin speed stinks in ma @user . . Is dis y i ported frm bsnl. . .weird! !help out. . 
1383730	neutral	Listening to if i die young by @user 
1537562	neutral	New Bacronym for Adidas - "Any Day India Dreams about Sachin" 
651128	neutral	#nowplaying Kush and Orange Juice - Wiz Khalifa 
645200	negative	Second set of Sony earbuds just died. Lasted 6 months just like the first set. Has 90 day warranty. DONT BUY. 
422353	neutral	Ok promo time #TEAMFOLLOWBACK #INSTANTFOLLOWBACK #500ADAY an @user #MUSTFOLLOW #ipromo #IFOLLOWBACK #VIPFOLLOW #SHOUTOUT 
2096071	positive	Guys please check out bing every day it has great pictures - ~http  
2422223	neutral	GADGET UPDATE powered by Stuff Samsung Sony and multiscreen ... ~http  
2043898	neutral	Drawing and singing celtic songs ^^ 
1372706	neutral	People are curious why old children in Retiro Parc play with blue balls #intocon 
2491238	negative	The whole office took a fieldtrip to starbucks RT: @user Im too emotionally stressed to go back to work #nycearthquake2011@LaurGro  . 
2719868	positive	Watching Odd one in! It's hilarious! 
1896433	positive	Movie Rhymes. Well done; but I wish they had toned down the music:  ~http  via @user 
199743	neutral	MPI monthly meeting (@ Hilton Lexington / Downtown) ~http 
153392	neutral	#shoutout to @user 
2603565	negative	Not surprising... RT @user Effective 02nov11; Iberia will cancel its 3x weekly MAD-FOR-REC-MAD A343 service. #Avgeek #aviation #iberia 
2310860	positive	Had a great 2 days at Microsoft Techdays 2011;London. Attended Cloud computing & Building great rich client App..... 
2066181	neutral	Teen sex girls hot videos ~http 
385376	neutral	2008 ford focus 1.6 titanium. In black. Only 27k miles. Full service history. Privacy glass and Sony dab radio. £7295 
1559487	neutral	Mann I need to go buy some Nike and Ralph shirts to go with these Airmax 2011 
441942	positive	Al Davis is KING 
2829368	positive	omg i just had a milky bar; haven't had one since i was like 5; i'm in heaven 
1596749	neutral	Electronics Store: Sony Alpha SLTA55V DSLR with Translucent Mirror Technology and 3D Sweep Panorama (Camera Body... ~http  
155077	neutral	New blog post: ~http  - Helping Companies Solve Critical Issues – Microsoft Dynamics CRM Sales Academy Series 
2446393	positive	Massage is the best way to relax in this stressful world. Try it today! You'll be glad you did. 
2614189	positive	wants to say congratulations to my best friend Katie Ashcroft's mam for finding out that shes having a baby boy which is due in Decemeber !x 
109232	positive	great community (MVP) speakers delivering comprehensive training at Microsoft Virtualization Day 2011 Dublin! ~http 
1309235	neutral	What's gucci 4am..we meet again... 
2556744	positive	I've been paid 50 bucks to watch Father of the Bride; Death at a Funeral; and Dirty Dancing:) 
113027	neutral	What's Gucci my nigga?? What's Louie my killa?? - kayne 
1374770	neutral	Where's the weightroom ?? 
109059	positive	Great news for partners and even greater for customers; get a check from Microsoft when you purchase qualified products 
2863070	neutral	adidas ~http  Adidas tech f/f shorts black 30w ;P 
1703241	neutral	#NP Ciara "Ride" followed by Gucci Mane "Beat it Up" Hmmmmm 
2421966	negative	no one can beat me @ #NBA2K11 ...ppl have tried and failed...smh...#losers 
1436308	negative	Heated up the water; then realized I was out of hot chocolate. "Noooooo!" #ChocolateCravingFail 
214111	positive	Today's Vid: Seattle Storm History - Volume 2: 2001-2002 ~http  - No draft can beat those! Storm struck gold 2 years in a row! 
274452	positive	Had my 1 year pics taken tonight. Mom rescheduled them 2x after my black eye stunt. She didn't get the hint; so I refused to smile. #iwin 
2070608	neutral	no doubt RT @user @user aye dmac ; Take this :* 
3225503	positive	On way to Sony Liverpool; with Brighton last week and Scotland this; it feels like I've not been there for ages! Looking forward to it! 
1045314	neutral	Who tryna smoke wit me? 
903430	neutral	Camera SONY ALPHA DSLR-A700 DIGITAL CAMERA+8GB KIT NEW Price: $320 USD Online Order: ~http  
2359674	neutral	Right Here We Are Going To Be Taking A Better Look At The Sony BDV-E770W 3D Blu-ray Player Home Entertainment System ~http  
364814	neutral	The newly single David Arquette got all decked out at the Samsung Infuse 4G for AT&T launch event.. ~http  
2907040	negative	My microsoft word froze and I was more than halfway done with my last lab....im so pissed :( 
2492730	neutral	Driving back from DC 
89734	neutral	Just Published: Beyond the Banner Ad and Commercial: Microsoft and Nielsen Connect TV and Online Audiences ~http 
3269708	neutral	Classic! RT@gussilber Breaking News: Paris Hilton to be charged with ambush marketing; because the official FIFA product is Coke. 
2867174	positive	Bought the Samsung Droid Charge today. Fantastic phone 
1398513	neutral	Foot Locker & Nike donnent la leçon ~http  #ladycapricemag #nike #footlocker #commercial 
1844970	negative	So sony are fucked then? How can people hack into enormous secure networks and I can't even get my iPod to update..? 
2009158	neutral	E3 2011 Sony Conference 
3265543	neutral	The Samsung Galaxy S II captures this talented young soccer star celebrating in style!  - ~http  
2085406	positive	My favorite picture of @user taken by me :) ~http  
2233873	positive	What an interesting product; Samsung did a great job with the Smart TV!! Stunning model as well :) #samsungsmarttv 
3159718	neutral	Verizon Wireless Samsung Network Extender SCS-26UC4 - by Samsung ~http  
433594	neutral	.@smithbriana Our September Spotlight Tutorial; Lexis for Microsoft Office; goes live this afternoon: ~http  Enjoy! 
2133083	neutral	Im kinda a 'go with the flow' type person. 
1002413	positive	"@MrMeatnuggets: @user sweet if there a pic post it on Flash Mountain! LOL!!!" Good one. Love it!! 
1728973	positive	I love kalli!!! 
2533331	neutral	already saturday afternoon? 
1822063	neutral	Woke up; with alot on my mind. 
2315780	neutral	Listening to: The Spinning Stream: Nintendo Music Radio. ~http  
