400754	neutral	UNLOCK THE SAMSUNG GALAXY TAB - Unlock the Samsung Galaxy Tab from T-Mobile and AT&T USA! We’re excited to... ~http  
2207403	neutral	Getting ready to go to Krabi; Thailand to establish a mangrove monitoring strategy for Thailand with @user. @user 
1862978	neutral	Canon Clinging to Mirrors Means Opportunity for Sony Cameras - Bloomberg ~http  via @user 
2452286	positive	How can you possibly have a bad day when Joan Benoit Samelson congratulates you on your fastest mile ever? I love nike + 
335210	neutral	Enjoy "Bandstand Boogie" with MVNU's Jazz Band in concert Monday; Nov. 29... ~http  
1657262	neutral	The Haus employees will avoid Carmaggedon by sleeping at the Haus. Mind you; we have to anyway. 
2352500	neutral	Check out PEREZ HILTON website...he posted about taylor/kanye incident.... 
2237012	neutral	Don't block stomach acid ~http  
530213	negative	Its 80 somethin outside n I'm a lil bish n heat. Goin 2 bed Alone :( #beinsinglesucks 
2486018	neutral	If that silver heart necklace isn't #DealTaker.com incentive; how about Nike LunarGlide+ Running Shoes for Women!!  ~http  #ad 
2907042	negative	My microsoft word froze and I was more than halfway done with my last lab....im so pissed :( 
2234398	neutral	Dear Microsoft Word; I'm FAIRLY sure I know how to spell my future last name. Nice try though; every belieber ♥ 
2313148	neutral	-Out x3 You getting ready so I know we gon' be here awhile; in the bathroom flat irons and nail files. Spending hour... ~http  
3322657	neutral	Nicky Hilton jumps on Hollywood's $50 striped dress bandwagon ~http  
2478050	neutral	i need to find my nike boots 
150370	neutral	See stories of Microsoft beneficiaries whose lives been transformed by Technology:... ~http 
171084	neutral	How to obtain a new product key for a Microsoft Office suite ~http 
2189391	neutral	Since I always respond with; "What am I looking at? Is that a dick?" people have stopped showing me photos on their phones. 
2150664	neutral	Hmm. Coxen is not a word... Who knew 
475113	positive	Last day working at a mall couldn't be happier! :) 
2531666	negative	Well; Colorado sure is friendly- never witnessed a blatant flipping off of a semi before #middlefingerseverywhere #bigmove #15mphunder 
495756	neutral	Mexican Coke used to mean something else. #azucar 
155091	neutral	New blog post: ~http  - Register your interest to attend Microsoft Dynamics™ Certification Training 
1927318	neutral	AT&T Dads & Grads Sweepstakes - Win a Samsung Infuse 4G from AT&T ~http  
88962	neutral	Weekend Reading: Microsoft acquires Skype; Kinect keeps Xbox 360 at #1; Bing makes gains in the US search market... ~http 
1247842	neutral	Madden NFL 12 Hall of Fame Edition: No ratings available.Price: $89.95   Product Features: True to the Game – Th... ~http  
235244	neutral	Learn how to "Never Buy A Bottle of Bad Wine Again"-check out this tip & others from VC's Ed Lehrman ~http  
105877	negative	Today This Nigga Said Niggas Who Wear Louie Vuitton And Gucci Are Gay But He Had Some God Damn Shaqs On -__- 
105816	positive	I LOVE HIM :) &lt;3&lt;3 
694461	neutral	I fancy a bit of; how's your father; v. soon please. @user can you give me some tips on how to find a girl who is DTF? #recentconquest 
252890	positive	Off work; thankgod. Hopefully I can get my game on. #gamerface 
90089	neutral	→ Microsoft Asia/Pacific (APAC) Jobs: Microsoft Consulting Services is hosting a Webinar on Thursday; Octobe... ~http 
1156379	neutral	playing Animal Crossing lets go to the city x x 
1812044	neutral	4 Day Special: $49.99 Mobile web ready Samsung R211 (1st Month FREE) & 10% off any pre-owned phone malexonline.com / 520-344-8910 
1895365	neutral	New Post!!  Nintendo 3DS Hardware Review ~http  
1502180	neutral	These are my people on this 6ft7 Remix D.U.C ~http  
1713992	neutral	#GagaFacts She went to a all girls Catholic school; Convent of the Sacred Heart (the same school Paris Hilton went to) 
2295128	neutral	Certify Dumps gives free samples of Microsoft 70-446 Study questions and 70-446 practice materials to check the quality. ~http  
2739082	neutral	I think we showed today that twitter and social media are essential to follow your favorite driver. The TV missed Marco's dramatic exit! 
2697476	negative	spots make me feel like shit grrrr :( 
1953045	positive	Aloha! Long day/night to get here - but looking picture perfect this morning! (@ Hilton Waikoloa Village) [pic]: ~http  
1576913	positive	"The Samsung Galaxy S" phone is so awesome that makes my phone looks like the shitties phone evere.. 
1087114	neutral	I never knew waves glowed at night 
100335	negative	My memory stick aint workin gotta send my essay to email and go to school sign in then copy nd paste to microsoft word then print ugghh work 
2226656	neutral	Here's a shot of the crowd from The Ex last year. Can you find yourself?? ~http  
1037483	negative	I Hate When Guys Flash Their Sh*t...I Don't Care! Good For U That You Own A Gucci Belt. Want A Fxcking Award? Its Fake Anyways 
1294108	neutral	Any entrepreneurs out there? Check out this article on how to beat the challeneges of looking for full-time jobs ~http  
1125855	positive	bought Samsung Galaxy Pro :D 
2013770	positive	Opening weekend was a success 
2429933	negative	I think gucci mane is mental 
894588	neutral	Get Your T-Rex And Dragon Rides In Free Realms | Sony Insider   ~http  sony free realms 
2345882	neutral	#FreeOffers Download Dragon Quest 5 For Free From Nintendo Dsi Club | Nintendo ... ~http  
2155292	neutral	I'll be  a guest tonight June 25- 9 PM EDT discussing identity politics and my book: ~http  
191834	neutral	Nike Toki Dark Denim (385444-010): The Nike Toki dark denim (385444-010) release was dropped off this week. This... ~http 
2886542	neutral	Man at gym dressed in army gear; gucci belt around his head; at the mirror huffing and puffing while juggling water bottles #new-workouts 
1799161	neutral	U Joe on my TL 
1331244	positive	#teamladiphat I love you guys. 
2421570	neutral	The white Samsung Galaxy S II hits UK shops on 1 September. 
681282	positive	Here's a great look into @user's "Music in Print" photo exhibit; ft. shots from the last decade of Bluesfest! ~http  
200415	neutral	“@Sunnygrl87 You can navigate through mazes and eat Pac-Dots on Nintendo #3DS.PAC-MANis now available inNintendo eShop. ~http 
2295151	neutral	Certify Dumps provides 70-431 Exam Questions and training materials for Microsoft certification exam preparation.~http  
3264263	neutral	Ipad ~http   Citrix Receiver comes to iPad; Dell; RIM; Cisco and Samsung tablets 
375636	neutral	working on my fan fiction. 
2366977	neutral	REVIEW: Samsung ML-2525W ~http  
305566	negative	The AB contour belt...to make lazy people. lazier. 
1173522	positive	I might be too strung out on compliments; overdosed on confidence. 
141779	neutral	#NEVERWILLI JUST POP UP OVER MY MANS HOUSE #STALKER 
381957	neutral	Andrew Mason from #Huntingdon #Valley Country Club shoots 72 in opening round of U.S Amateur ~http  #lower #moreland #golf 
407059	neutral	Google Cloud Connect for Microsoft Office ~http 
2059280	positive	I love when you send me random txt msgs:) 
274980	neutral	On the bing commercials they say they find what you're looking for quick and effiecently. I looked up "Crying retard" and bing &lt; google. 
2507861	negative	wants to know why the weekends seem to go by so quickly!!  :( 
650899	neutral	HUMAN 2.0 DIGITAL RELEASE JUNE 15. ~http  
2235147	negative	Far to tired to go to work as been up all night  but not I can't go to sleep I want to sleep what's that all about xx 
1016296	neutral	I checked in at Hilton Tulsa Southern Hills (7902 S Lewis Ave) on #Yelp ~http  
219806	positive	Just got my Adidas Evileye Halfrim Pro in colors shiny black/green. That looks beautiful with my bike and outfit. Thanks vd Zwaard Optiek! 
3308442	neutral	y is Gucci on da awards show? 
2008871	positive	I'm in love with my brown gucci loafers 
2559108	neutral	Planning my next vlog any ideas people want me to add to the video 
17513	neutral	I was well into college when I learned that "groupie" wasn't just another word for "roadie". They're like totally different jobs. 
435201	neutral	What makes a strong woman??? 
1519379	neutral	Checkout #couchLock = first 2oz drink of al natural science backed weed enhancer ~http  @user @user @user 
2321633	neutral	I swear my lil' nigga @user could pass for Gucci Mane little brother #RealShyt 
960972	negative	ughh have no idea anymore!! need ideas... :( 
2061771	neutral	New Sony Technology --- thinnest watch / tv! ~http  via @user 
527519	positive	Better johnny...! 
2490396	neutral	THIS IS IT -  the Toplook from -~http  -- Mr. Melk. Skapelsen ~http  via @user FAntastic?? 
3449713	neutral	wonder how Adidas feel about the riots as they seem to inadvertently sponsor it as everyone seems to be wearing their hoodies #londonriots 
371194	negative	Lost in the parking garage at #asf . Can't find my car... Fun times 
385375	neutral	2008 focus 1.6 titanium . Full ford service history. Only 27k miles. Rear privacy glass. Sony dab radio. £7295 ~http  
2367277	neutral	not much..... 
55936	neutral	I NEED AN  IT  PERSON....Administer Microsoft Dynamics SL (Solomon Financials); and co-administer other systems; including user setup; 
3320454	neutral	Win a Sony Playstation 3 @user ~http  
2182210	neutral	I entered the PGA TOUR Giveaway #PGATOUR3D for a chance to win A new 52” Sony 3D HDTV package: ~http  
2127020	negative	Beautiful sunshine & blue skies today-think it's all change again tomorrow and Friday :( 
2598350	positive	wow; gotta love waking up to the july sunshine :l 
116960	positive	The Bing demo was insane!! #WPCLA 
1731236	neutral	flubber134: Sony Walkman X-Series first look: Sony’s Walkman NWZ-X1000 features an OLED touchscreen; Wi-Fi and bui... ~http  
2411785	neutral	Chicken Wing Eating Contest! Chicken Wing Eating Contest! Chicken Wing! ~http  
1850423	positive	I like it wen my bitch dnt come up 4 air 
369355	neutral	Currently at the Microsoft - Future of Productivity meeting in NYC 
3541964	neutral	Chance to win a Samsung 46" 3D Smart TV ~http  
2310890	neutral	Cyber Monday ads Sony KV-32FS13 32" Flat Screen Wega TV ~http  
2067260	neutral	NEW ARRIVAL: Nike Manchester United Prestige Soccer Ball - ~http  
298257	negative	Perez hilton is fucking annoying. Shut up. We all know your gay. Stop siding with girls. Jesus Christ 
2620175	negative	ahhhhhhhhhhhhhhhhhhhhh too much college work boys. 
3045062	neutral	Fresh on nike shoes: Debunking the Debunkers Whatever They Say; Aromatherapy is Real Medicine! 
584567	neutral	#phx BizFair'09 | Nov 19th; Hilton Scottsdale | Exhibitors - promote your company to 100s of valley entrepreneurs! ~http  
390034	neutral	Listening to Gucci Gucci (Freestyle) (DatPiff Exclusive) by Lil' Wayne on MixZing (~http ) 
1803271	positive	last two evenings on competition of young opera's singers in The Theatre of Opera and Ballet were amazing. 
2167571	neutral	19. #20peopleidmarry @user 
3147233	positive	Mmm mmm the dawgs look so good in their Nike Pro uniforms! Go dawgs! Sic em! #woofwoofwoof 
2653304	neutral	I'm wondering  which all the #McLaina s' choices are tonight. 
2402377	positive	Maryland might have the coolest Jerseys ever sorry Oregon and Nike Under Armour one upped you guys #CollegeFootball 
2955009	neutral	BBC News interview: 'Wiis stolen from sony centre' lmao #LondonRiots 
2801392	neutral	Now Anyone Can Sync Google Docs & Microsoft Office ~http  via @user 
1542553	neutral	On my way back. 
509703	neutral	"@misskotelo: Louis Vuitton condoms R400 watch as the darkies go and buy them #SMH" cc @user 
440368	positive	I'm soo happy 
810181	neutral	Think I might get the iPhone.....battery life supposed to be better.... (miss my bb)  :( 
513927	neutral	ALL im asking is where have all the cowboys gone maybe they are at a Ranch in Crawford Texas? 
427202	neutral	I wish somebody from heaven can send me some guidance through my dreams. 
226769	neutral	Ok so here's what I have heard. TSN2 will show our game at 3 pm which is 1/2 hour tape delayed. So if you don't want real time updates... 
2365331	positive	Pool Party at Las Vegas Hilton will be a lot of fun tonight!!! 
308431	neutral	In line at the Sony Wonder Technology Lab 
2736770	neutral	It's Gucci time. #guccibowl #guccibowl #guccibowl #guccibowl #guccibowl #guccibowl #guccibowl #guccibowl #guccibowl   
481733	neutral	"Ask not what your country can do for you; ask what you can do for your country." JFK 
3552132	neutral	I checked in at Hilton Hotel (315 Trumbull St) on #Yelp ~http  
2417317	neutral	I recently lost 21 followers; and I know who they are thanks to ~http  #whounfollowedme 
1936082	neutral	I can't believe Microsoft has showers in it's buildings; so that people can bike to work and not be sweaty pigs all day. @user 
625180	neutral	Today's classes at LSBU Sports Centre include Nike Training Club; 13:10-13:55 with Danielle Linton find out more... ~http  
429767	positive	Another great day of watching our Wildcats compete with their AAU teams. Hit up the Hoosier Shootout and Adidas Invite. Great job guys!! 
1008851	positive	I just played "Rockem Blocks" and scored: 9690 (ranked 20736th overall)! Beat it: ~http  #fun140 
252852	negative	Just kill me now. 
360502	negative	Damn it.  Too hard a push into the corner.  #kbshow 
1451066	negative	And I would like to say SCREW 8am CLASSES 
248674	positive	Haven't read the book; but awesome movie! Inspiring.@mylilkitchenlab 
2506033	negative	Swear im dying from this heat :'/ 
1571213	neutral	Watching Center for Living Peace; Orange County ~http  via @user 
87929	negative	chris brown didnt follow me f.m.l. thats no joke @user im heart broken im off to bed=( depressed 
250546	neutral	Hey!  Check out our new video for the Jimmy Wong contest!  ~http  
656005	neutral	“@SoleControl215: Marty McFly’s Closet – Nike MAG ~http  &lt;&lt;&lt; @user 
1864549	neutral	UPDATE: HTC AND OTHER MANUFACTURES THT USE ANDROID WILL BE PAYING ROYALTIES MOTORALA SAMSUNG ETC...So maybe no chge!! 
1694277	neutral	I'm craving Kids... #spk 
3176188	neutral	slow at checking out the E3 Microsoft Press Conference ~http  
1570057	neutral	porn incest Aleska diamond lexington steele - XVIDEOS.COM you hard ~http  
2477161	neutral	How to Recover Deleted Photos from Samsung Digital Camera?--Memory Card Data Recovery to recover pictures from SD card ~http  
109233	neutral	students; please RT! Dreamspark gives students Microsoft professional tools at no charge ~http  @user @user 
1058711	positive	Let's go heat 
797189	neutral	test update 
649348	neutral	Bit late with the announcements. 1) our very own @user nominated for a Sony Rising Star Award! Vote ~http  
1901706	neutral	Lahna on choking the chicken: ~http  get your mind out of the gutter! 
548053	neutral	Why Americans hate their jobs - The Week ~http  Do you agree or disagree? 
2236686	neutral	So; the new insanicast is rendering in sony vegas. This is a nice average one; I think you guys will enjoy this one :&gt; 
1289732	neutral	Why do squirrels swim on their backs ? 
2384900	positive	i am loving to have the ability to me on meebo.com it gives me a chance to meet new people who like to talk 
3551247	neutral	gucci gucci ; louis louis ; fendi fendi ; prada ; thee basic bxtches where that shxt so i don't even bother . ;D 
228172	neutral	Help me uncover a prize in Samsung TV's Like It; Reveal It; Win It Contest. 5 instant winners & 1 Grand Prize a week ~http 
973768	neutral	Anybody know the name of that song that Gucci says;"Ralph Down Like Carlton"?????!!!!!!.....!!!!!!! 
285743	positive	Loving these Nike ads about big butts ☺ ~http 
1247357	positive	Really delighted to meet Sean Kelly in Lismore this lunchtime. An absolute legend and a gentleman. #Lismore #oneofthealltimegreats 
236702	neutral	“I get eBooks from my library and #OverDrive. RT and follow @user to win a Sony Reader. ~http 
2802267	negative	Probably broke my back last night and will probably have no eye left by the end of the day!!! #PAIN !!!! 
2307034	neutral	Apple Now Worth More Than Microsoft & Intel Combined ~http  via @user @user 
1982056	neutral	Lakers Squeak Past Thunder 90-87 ~http  
322804	neutral	Dear Members;  This coming Saturday the 10th of September; we will be watching the Bolton game together.This will... ~http 
1832873	neutral	~ Should mention - students only.  RT @user Want an Xbox? Buy a Windows 7 PC and Microsoft will give you one for free ~http  
307618	negative	grrr my computer crashed on me.... 
184889	neutral	New Post Video: Stick Monster Lab for Nike Sportswear ~http  #advertising #design #monsterlab #nike 
3282976	neutral	According to a Microsoft Survey 6 out of 10 people are interested in mobile coupons #mobile #coupons 
122056	neutral	Facebook Adds Video Chat With Skype; Deepens Microsoft Ties ~http 
2275269	positive	My favorite Sony product is _PS3_ because_it makes my life that much better_. #questionoftheday 
3379014	positive	Good for you; @user - not knowing Bruce Springsteen songs is a sign of class! Now if you'd only play some Bing Crosby... :) 
866043	positive	Lol my roommate just made me help her with her radio commercial... it came out pretty good! :) 
3008837	positive	Ayy Dallas too!!!! RT @user #memphisfact everybody bump yo gotti gucci mane and waka flocka 
1398516	neutral	Foot Locker et Nike Sportwears lancent la collection Nike Hyperfuse ~http  #ladycapricemag #footlocker #nikehyperfuse 
2468406	negative	Those Nike boots are tough but its 95 degrees out ny dude 
2296656	neutral	Surreal-Playboy NYE 2011: Playboy New Year’s Eve Party at The Hilton Chicago Downtown Hotel Ft T-Pain; Jump... ~http  
876621	neutral	Approach | No Labels ~http  via @user a solution to the US financial crises! No partisanship 
1474587	neutral	Destined to love? Or destined to hate? 
912337	neutral	Watching air force one! 
129822	neutral	Added a new video: "She Ride featuring Gucci Mane and Lil Frost" ~http  #video 
582533	neutral	The last post was a rt from @user 
2724544	positive	my timeline is FULL of beyonce being pregnant :') wowww! :D 
1775318	negative	They were trying to compare to Nike "Just Do It".  Epic fail... 
216907	positive	Still feeling pooped after my adidas Zone Cycling class at David Lloyd Leisure this morning - great class though! 
14233	neutral	she say i love to Stunt so much it's goin kill me one day. 
2313215	positive	Had fun last night...like good old times! 
543004	positive	Just got Halo 2 at #goodwill for 3 dollars. Just one more reason on a pile of others to shop at goodwill 
739948	positive	Got some awesome new mechanical pencils and Sharpies. Bring it; school. 
1170504	neutral	Going to COMMUNICATION TOOLS OF THE 21ST ... at Hilton Garden Inn Sacramento/South ... on Mon; Aug 16 ~http 
1313497	neutral	SRRY BING I STILL GOOGLE 
2755665	neutral	Stop searching for stackable banquet chairs right now! ONLY $19! Call or stop by our Commercial Boulevard showroom... ~http  
722215	negative	Well; Fuck you America! The price for a nVidia 280 is like; $9000 more now; even at my cheapo Azn shop at Box Hill! 
223248	neutral	Night night bffe @user  love you sleep tight xxxxx 
1105320	positive	No practice? Ohkay! Get to see mi whittle baby today! #awhhbabies 
1233452	neutral	Early harvest for champagne this year: ~http  
1220235	neutral	smh. the run around for tickets for @user show the 21st. Adidas store the 20th straight from school.. i HAVEEEE To get tickets 
3542822	neutral	Head down Samsung and you'll pass the onsite school on your right! ~http  
2233492	neutral	"Google; Apple and Microsoft take top spots in global brand survey  ~http  
1016864	neutral	MTM Audi A1 Firstly; the MTM Audi A1. The MTM Audi A1 will be powered by a 1.4TFSI engine producing around 150ps;... ~http 
919583	neutral	For Party Reservations Please Contact.. Sonia at 832-606-7276 
1180949	negative	I'm disappointed that with all the #Sony hacks; there hasn't been any cool new Sony tech leaks... 
294902	neutral	Watch "Nelz  N Woody Kane - Looney" on YouTube - ~http  
785670	neutral	YOU TUBE FLOW GUCCI MANE PLAYIN' 
1947770	neutral	In the words of @user cats have nine nipples. 
2479332	neutral	Update: NIKE CHOSEN - BEHIND THE SCENES - SURF ~http 
376679	neutral	MXF Import QT 2.4 b3 available for download. Final candidate with support for D-MAT; Sony XDCAM proxies and Adobe Cinema DNG. 
1619717	neutral	The police are starting to put pictures of the rioters on Flickr ~http  
1450196	positive	I was so excited when I won the auction for this brand new Sony Vaio Laptop I won with a bid of $44.87 ~http 
2349670	negative	homeworkin it up...outside earlier and later..also why is Perez Hilton in my newsfeed? Get a life you worthless gossip! 
2863068	neutral	Nike Golf Men's Fashion Stitch Polo (Green Apple/White; Small) ~http  nike golf 
62229	neutral	In Microsoft Publisher 2007 how do you create a publication back and front?:  ~http 
1042852	positive	filming final shots for the "To The Van" video tonight..thanks again to all those who came out monday; you rule..see you friday! #changer 
2350941	positive	Brand new AUDI R8 GT looks awesome! Dang cant wait to drive it haha. I wish! 
920547	neutral	[App] Microsoft Windows XP Se7en Ultimate Royale SP3 (2011): Type: App LinkPlz.com ~http  LinkPlz.com 
1485412	positive	Does being 18 mean I can't have #bieberfever ... No I don't think so I love @user :) 
3039036	positive	I liked a @user video ~http  Gucci Mane- Street Nigga (Official Video) 
947296	neutral	Be the first to know when the Samsung #Infuse #4G is available. Sign up for email alerts ~http  #ATTEmp 
187833	neutral	NEW POST: Lil Wayne's shoes: Adidas Originals ~http 
1768781	negative	I HATE NINTENDO SO MUCH RIGHT NOW 
3408587	neutral	1500 pairs of the 2011 NIKE MAG will be auctioned on eBay with all net proceeds going directly to The Michael J. Fox Foundation. 
3045047	neutral	Fresh on nike shoes: NWT DC SHOES Red 5G Beanie Cap Hat w  Bill OS 
2422195	neutral	Gadget Inspector investigates the case of: The Sony DEV-5 Binoculars ~http  
2371870	neutral	;P ericsson accessory ~http  Unlocking Sony Ericsson K800i? 
3230123	positive	Wow Nike just released Boise's Pro Combat Uni's for the UGA game next weekend.....pretty sharp I must say ~http  
822962	positive	Have a great weekend everyone!! 
2162007	negative	I swear there's never food in the house 
89048	neutral	Today Microsoft unveiled Mango; the next update to Windows Phone 7 - coming this fall. Mango will deliver 500+... ~http 
526052	neutral	But why? Jay Elec and Mos &gt;&gt;&gt;&gt;&gt;&gt;&gt; ice cream face RT @user 0_oRT @user Mann; imagine Gucci Mane on Jay Electronica's Exhibit A? 
2003395	positive	OMG; 1st day of September is tomorrow!! Fall is thismuch closer 
476877	positive	Big Fish ...Good flick 
1168537	neutral	Tiger Woods' marriage over after the airing of Nike ad?  ~http  
2514545	positive	I &lt;3 my new Nike + GPS app! Tracks your phone so no more driving around where I ran 2 see how far I went! 7x around my block is 3 miles! #fb 
387723	neutral	S/o to my homie @user he pick the right team this YEAR 
525268	neutral	Should I smile cause were friends; or should I cry cause that&#39;s all well ever gonna be. 
2276778	positive	Spotlite is amazing. .:) 
2801363	neutral	#pubcon - Facebook and Bing - Twitter and Google; interesting matches noted by the keynote speaker 
2856995	neutral	I have a new samsung wave 525 
89665	neutral	Ad of the Day: Microsoft Halo Guess which cybernetically enhanced supersoldier is going to college? via @user ~http 
3091506	neutral	How to Get the Best of Both GoogleDocs and Microsoft Office ~http  
1169507	negative	I hate drawing graph with Microsoft Word !! 
655723	negative	• oh damn thats unfortunate o_O 
1364749	negative	I swear I hate this time of the month! So inconvenient -____- 
370252	neutral	the Nike Swoosh was designed for $35 and chosen because it "was the least awful". #design ~http  
239456	neutral	helping my grandpa 
574415	neutral	Those were metaphorical Nike laces..... 
1178126	neutral	new photos taken with my Sony A55: ~http  
858869	neutral	OutKast Big Boi Performing at Liv nightclub ~http  
1133905	positive	HAD FUN LAST NITE AT HOOKAH; VOILA AND BOURBON! DANCED MY FEET OFF THO! 
974422	negative	Fuck working in this heat later 
2609300	negative	Chris Brown is a worthless piece of shit & I'm disgusted the industry has odvy forgotten he beat the shit out of a woman with his bare hands 
1410540	neutral	I really just wanna hear Racks... Right now... I don't even need the whole song 
2284748	neutral	我顶了一个 YouTube 视频 -- Samsung Galaxy S GT-i9000 Software Tour Part 2 ~http  
90665	neutral	Be sure to follow the Microsoft BI Team on our NEW Twitter account for more on the future of Business Intelligence! ~http 
2944206	neutral	Well I gotta nike bag nigga RT @user "You got a small dickies bag nigha" -@Jeff_lon_Don 
1694474	positive	I'm in LOVE! I want a pair of these! I'd retire from collecting if I got a pair...| 2011 Nike MAG (Video) ~http  via @user 
1592838	neutral	JUAL Sepatu NIKE THE OVERPLAY IV ORIGINAL 100% BRAND NEW IN BOX  ~http  
1610474	positive	"I’ll never forget the fun time I had there& I want to thank you& all the wonderful people who made my dream come true" ~http  
431333	negative	OMG IM READY TO GO DA FUCK HOME LIIKE 
1751813	neutral	the nintendo EVERYONE #gte3. #GTE3: ~http  
3045065	neutral	Fresh on nike shoes: Charlie Sheen Bails Out Former Baseball Player Lenny Dykstra 
2728279	neutral	I met animatronic Buckbeak the Hippogriff on the set of Prisoner of Azkaban. Er; have also been in Hagrid's Hut. #lameclaimtofame 
