132_ 483	negative	 The only problem is the battery life.
132_ 315	neutral	 My ONLY complaint thus far is the process of downloading tracks to the iPod itself - the iTunes software is really a hassle, above all else the whole concept of WMA and the faulty built-in converter
95_ 0	positive	Diaper Champ is great.
281_ 4	negative	During install, NIS would either freeze or not reboot properly when asked to do so.
118_ 0	positive	I'm not overly fond of GREEN but when I used this Hitachi M12V it turns out that now I'm very fond of it.
146_ 10	neutral	No more connection!
0_ 91	negative	 battery life is not long enough IF and ONLY IF you take a lot of video clips and play it back on the camera a lot of times...the camera/battery gets a little bit warm too when you use it for a long time but it's normal.
132_ 432	neutral	I like it.
259_ 2	negative	I really regret signing up with T-Mobile, but I'm stuck with them for the next 6 months of the contract.
131_ 20	negative	If this machine just stops on you, unplug it quickly and get out of the way!
169_ 12	neutral	My Xbox is about 70ft and 3 walls away from the WRT54G.
117_ 10	neutral	I say this because I am not particulary fond of the hitachi compound miter saw.
266_ 5	positive	Overall the phones fantastic, and I would have given it 5 stars, but its not perfect.
132_ 111	neutral	I returned my 20G iPod 7 months ago and got a Gmini instead.
89_ 8	neutral	1. CHANGE BAGS FREQUENTLY!!
132_ 158	negative	The Battery does not last 12 hours.
199_ 8	neutral	My preference for the touchpad sensitivity setting is 'medium'.
115_ 2	positive	I find that it is stable in my hands and its' weight actually contributes to that stability.
193_ 43	neutral	My PC only supports USB 1.0 not the 2.0 which is blazing fast.
100_ 24	positive	Works great!!!!
268_ 31	positive	All in all, this is a great phone.
141_ 0	neutral	I was waiting for wireless to be faster then 11mbs.
196_ 12	positive	Battery life is exceptional, lasting longer than the 8-10 hours that seem reasonable with most music players on the market.
178_ 23	neutral	The performance of the router itself deserves 5 stars, but the Linksys documentation and support is so poor that I can only give it 4.
0_ 39	neutral	I expected more from a 7MP sensor and a Digic II processor.
109_ 1	neutral	I use it primarily in a router table and have been making my own moldings and trim.
25_ 5	neutral	I'd suggest that you not only buy this camera, but the case for it and an extra battery pack.
262_ 1	positive	Im able to keep my phone on for about a week (mostly stand by) to three days (regular use)
270_ 10	positive	It also works just fine for international calls.
132_ 55	positive	This new click wheel iPod allows you to navigate through the menus and song via a touch-wheel for scrolling and click-able buttons for selection.
195_ 17	positive	Another good feature is that you can charge the battery by just connecting the player to your computer using the USB cable.
191_ 6	neutral	Just in case, I bought a two-year extended warranty for about 15% of the purchase price of the player.
272_ 5	positive	Other than that, the simbian series 60 OS is great and offers lots of proprietary software that will work on your phone if you're willing to hunt for it.
79_ 15	neutral	This will never be a problem with the Champ.
190_ 5	neutral	I decided to go with the convienence factor and purchase a creative zen micro.
179_ 2	neutral	I would never get 108M rate unless I was half a meter from the box.
0_ 99	positive	it's such a great camera! i think it really was worth the investment =)
114_ 8	negative	I did have to cut off the ears  that hold the  template guide in place so I could get those big panel raising bits in it.
240_ 11	positive	It's good.
267_ 5	positive	5. Check traffic411.com for LA traffic on the 405.
111_ 3	positive	Saw the Hitachi on Amazon.com with their $25.00 coupon (at the time) and could not resist trying it out.
225_ 11	positive	The clarity is unbelievable, which means you can cram almost the full 2,5!
243_ 41	negative	Ultimately you will learn just how bad Nokia is, and why their recent loss of market share is so utterly deserved.
231_ 5	positive	It has it all.
211_ 8	neutral	So starting out i knew i wanted a windows friendly player.
225_ 39	neutral	I've had Dell Pocket DJ owners, IPOD mini AND Shuffle owners marvel at this thing.
206_ 2	neutral	Of all the players that I have owned in the past (6 of them), all of them have had drawbacks and problems.
0_ 92	neutral	(i can't help but play with the camera always)
215_ 2	neutral	Its $4.99 a month ($60 annually) to download as much music as you like.
138_ 15	neutral	But knowing that the IP for my previous Linksys router was 192.162.1.1, I went there and found a drop down screen that had the information (the security key) I needed to connect my wireless laptop.
233_ 13	positive	3. The Nokia 6600 has a brilliant Java interface.
176_ 7	positive	After upgrading the drivers and firmware a few times and e-mailing tech support for some setting tips it now works fine.
62_ 1	negative	The hole to put the diaper in needs to be larger as I am now using medium diapers (I have a 3 month old) and they're on the brink of being too large to fit no matter how compact I make then and how un-soiled they are.
125_ 9	positive	It is without even a slight doubt, my new favorite.
36_ 1	positive	VERY smal.
264_ 3	neutral	But watch the Amazon rebates on these (T-Mobile rebate is fine).
304_ 5	negative	If you experience problems with installation, you can visit symantec's website, click the support tab, click the 'home or home office support' and there is an automated support assistant that can scan the Norton program files on your computer and it will tell you what is not working right and how to fix it.
18_ 1	negative	 the only thing I don't like about it is that You have to buy a larger memory card, first thing!
134_ 13	neutral	No, of course not.
36_ 2	neutral	You'll carry it with you every day.
123_ 5	positive	I did like the heft of the machine.
132_ 294	neutral	But unlike most fashion statements (if this could indeed be seen as one?) this concept is a logical one - the black cushions often cover up the letters on the earbuds that designate whether they're for your left or right ear.
233_ 43	neutral	gee anyways ENJOY WHAT WORKS!
204_ 1	positive	the 4G Ipod costs the same as this 5G Zen Micro.
139_ 22	neutral	All wireless routers need to be configured to use Wireless Encryption, so this is just not a problem with the WRT54G.
196_ 13	positive	Transferring files couldn't be easier thanks to the included software bundle.
299_ 8	neutral	Before I managed to manually add the program file, I contacted Symantec support.
256_ 3	positive	Photos are pretty darned good!
221_ 17	neutral	)  Compatibility?
242_ 37	positive	It films 10 second video, for crying out loud.
187_ 12	positive	Reliability & Build  I dropped the player once from about 4 ft, and it fell hard, but kept on playing.
232_ 2	positive	6600 looks and feels nice.
199_ 2	neutral	When I finally couldn't take it anymore, I decided to pull the trigger on the Zen Micro.
318_ 4	positive	On the contrary, I'm quite pleased with my upgrade.
224_ 11	negative	It's too bad, though, that !
221_ 23	positive	The FM tuner is just a little spare icing on the cake.
251_ 2	neutral	the difference is : until recently there have been no GSM networks in a wide scale , so most cell network companies supplied consumers with cells , we in the middle east (for example) have stopped using years ago ....
73_ 0	positive	and we still LOVE it!
128_ 4	neutral	It works well with the larger bits.
309_ 1	negative	When I purchase software, I NEVER want to have to spend hours looking up solutions to my install problems -- in particular solutions that involve manually setting driver preferences or editing the registry!
0_ 122	neutral	$500 may not be a lot of money for some, but it is for me.
170_ 14	negative	The internet connection would go down every 5 mins when I used it with a P2P program called Bitspirit.
217_ 15	neutral	This makes the Zen Micro the first choice for MP3 owners with a Windows-based system.
166_ 20	neutral	A Mac address is a unique hardware identifier.
225_ 48	neutral	If you send in your Zen to have the flaw fixed, you lose all of the music you've been loading into the thing for 2-3 months, which came out to 1022 songs and 80 albums for me.
154_ 11	positive	The transmission speed is also quite good, with pages loading very quickly.
71_ 8	positive	But from my experience, by the time it gets to that point, the bag is really heavy, so I think this is kind of helpful- it's a built-in way of keeping the bag manageable upon emptying.
211_ 23	neutral	To me, currently at $218, this player is a!
3_ 0	positive	I bought this camera for the same reason many of you are considering it, or have already bought it--it's size.
123_ 3	negative	It was impossible to change the speed with just my fingers.
223_ 2	positive	I've had it for about a week now and have to say it's one of the best purchases I've ever made.
243_ 5	neutral	Most importantly, it allowed me to get on the Internet via Bluetooth via GPRS flawlessly.
14_ 0	neutral	I wrote another review and this is the update.
132_ 148	neutral	 they initially told me that i would have to ship it back to them on my own cost.
132_ 98	positive	 Great Design-- Very sleek and touch wheel has still never been successfully copied (vertal ones are the only competition); and now the wheel clicks, taking away a lot of headaches from 3rd gen and very navigable in the menus.
122_ 3	neutral	I have 5 routers, I use them all!
281_ 11	negative	Norton has been on a downhill slid recently with their products, but with this one, they have fallen off the cliff.
260_ 3	negative	T-Mobile wasn't upfront about some of the terms to qualify for the rebate.
256_ 9	negative	I find this feature on this phone useless, but, since I don't really need this function anyway, I don't really use it.
247_ 1	positive	very cool features... great camera with zoom...cool quality pictures... great ringtones... bluetooth feature is great....
132_ 401	neutral	I don't really intend to drop mine to find out.
132_ 45	positive	 Very sturdy and strong.
91_ 0	neutral	 We used this diaper pail from the day we brought our son home, until about 13 months.
0_ 220	neutral	On the 60fps setting it seems like a regular video recorder!!
76_ 6	neutral	Once your child goes on to solid foods BEWARE!
324_ 14	negative	This time, it started the uninstallation process, then I left for work. I think it will work. I hope it will work.
100_ 4	neutral	Originally with my son we had a Diaper Genie.
94_ 2	positive	I am soooo pleased with this product!!!
225_ 42	neutral	chargeable battery runs out; thereby, waiting 3 weeks to get it back, and possibly with all of your music erased.
183_ 16	neutral	The company has received thousands of complaints about this and refuses to do anything about it. .
146_ 3	neutral	But the biggest problem was the constant drop in connections and weak signals from time to time.
251_ 7	negative	2- It is bulky and the small buttons on the sides are sloppy to use .
132_ 193	neutral	great product with Limited Services
15_ 19	positive	You have the option to have the flash automatic or off.
137_ 1	neutral	Ironically, the latest firmware update addresses this very specific issue.... so now I have no problems what so ever.
183_ 41	neutral	I have gone through two of them in two years. .
75_ 6	positive	There is no comparison, the chanp is easy and smell free, the genie was difficult to use one handed (which is absolutly vital if you have a little one on a changing pad) and there was a deffinite odor eminating from the genie plus we found that the quick tie garbage bags where the ties are integrated into the bag work really well because there isn't any added bulk around the sealing edge of the champ.
76_ 0	positive	I love this pail!
195_ 6	neutral	Havent read the manual till now (remember I am good time computer user).
202_ 1	negative	The colors are a joke, and I personally hate the stupid vertical touchpad.
142_ 12	neutral	Also some ISP's give you a discount if you supply your own modem.
192_ 8	neutral	I get occasional hiss while driving.
126_ 4	positive	I'll be getting a second one for my router table!
8_ 2	positive	I love this camera.
132_ 375	neutral	Most importantly because the iPods warranty is far superior to both these, the Creative Zens is only 90 days, way too short.
132_ 100	positive	Games-- not really important, but existant
193_ 49	positive	At 128 the songs sound very good.
192_ 11	negative	I downloaded the new firmware which was supposed to take care of the problem, but it hasn't worked.
132_ 266	neutral	 If you plug your iPod into a PC and try to upload music/etc. it won't work.
0_ 167	neutral	If you don't care about manual controls then its for you!
298_ 6	negative	Norton online support does not even acknowledge this problem nor does the computer company that preloaded it on our new computer.
5_ 10	negative	3) The lack of an intermediate resolution setting, as other reviewers have suggested, is a problem, but that problem is meaningless with a larger CompactFlash memory card
132_ 129	neutral	 To be sure, I am not looking forwards to paying for the battery replacement, whenever that may come.
132_ 48	neutral	buy it.
141_ 2	neutral	For about the same price as 11mb you can get 5 times the speed.
323_ 2	neutral	Even though I had 6+ months left on the McAfee subscription, I decided to move on and buy Norton Internet Security 2004 (NIS).
100_ 6	positive	I bought the Diaper Champ and have been very happy for the following reasons.
263_ 10	neutral	I have used this wireless internet almost everywhere i travel and it works great.
0_ 211	positive	This camera is perfect for the person who wants a compact camera that produces excellent photos in just about any situation.
125_ 5	neutral	As much as I like my other routers, I know their limitations because I've pushed them all to them.
82_ 1	positive	At first I had a problem with some smell, then I realized if you flip the lid back and always keep the same side facing in - then there is no smell at all!
179_ 18	positive	Apart from speed, the signal is consistent and works without interruptions, etc.
132_ 37	neutral	OVERALL: I highly dislike the iPod, even though the sound quality and design is above-average.
0_ 93	negative	the sound is not loud enough when i play back the video clips on the camera.
91_ 1	negative	That's when it went from Oderless, to ODEROUS!
132_ 345	negative	However, in my mind, $299 is a lot to pay for a device that will only last 18 MONTHS.
0_ 5	neutral	I sincerely question the CNET reviewer's ability and/or their bias.
132_ 260	positive	For a sleeker, smaller and more "average" MP3 player the Nitrus is great but the iPod blows it out of the water - the interface is great and the design is wonderful.
311_ 1	neutral	I was forced to re-format the next day due to extensive incapatability issues.
194_ 15	positive	So far I have no complaints with this player.
99_ 2	positive	I actually took a friends word on it and went with this Champ when registering and I am glad I did.
243_ 40	neutral	You will also hard-reset both your Palm and your Nokia to factory defaults in their lame attempts to get the script to work, though it will not.
98_ 2	neutral	I am wondering how some of these reviewers are able to stand having kids?
207_ 23	negative	Yes, there is a belt clip, but that doesn't hold the extra battery and usb cable.
183_ 21	neutral	The recharge cord will do the job in a fraction of the time that the USB cable will hooked to your computer.
195_ 42	neutral	Tested with the same mp3 for benchmarking
142_ 2	neutral	I recently bought the Linksys G-Router after getting my hp laptop needing to setup wireless at home.
192_ 12	negative	- The outlook synch only works for non recurring appointments, which personally is very annoying to me but probably wont be to most people. -
259_ 0	positive	This may be a really cool phone, but it's not worth it with T-Mobile.
5_ 11	neutral	(I got a 64 meg card for $... and it holds 105 pics at 1600 x 1200 res).
107_ 6	positive	This was possible due to the variable speed settings for any sized bit.
42_ 0	neutral	I was a little skeptical about what people had said about this camera, because it's just so small.
5_ 3	neutral	I was looking for a blend of the two and so I bought this camera.
256_ 8	neutral	Why have the function if you can't film anything longer than e few seconds?
132_ 517	neutral	  I am so impressed with the iPod that our next purchase will likely be a Mini Mac.
190_ 20	positive	However, if there was one thing I liked about the creative, it would be the car adapter.
210_ 0	neutral	I bought this item in part due to the good reviews here on Amazon.
213_ 18	neutral	just as well and would be less confusing for new owners, but i guess they wanted to rival the iPod's search wheel.
132_ 316	neutral	.  But the iPod itself is totally flawless as far as I'm concerned, and the best MP3 player on the market.
85_ 5	negative	The pluger gets stuck & you have to manually extract the mess.
12_ 0	positive	It's the same body as the popular ELP2 APS camera (take a look at a standard credit card from your wallet and you'll have an idea of the front profile!).
132_ 51	neutral	How did we listen to music before it?
124_ 6	negative	The only not-so-positive comment I have is about the depth adjustment, it is not easy to micro-adjust accurately.
132_ 359	neutral	 I strongly suggest anyone considering an iPod test it out first to see how they like it.
35_ 3	positive	Even with the waterproof housing it is small.
108_ 13	negative	Also, the fit and finish could be better although this doesn't detract from performance.
298_ 0	neutral	This came PRELOADED on our new, 2.8Mz Pentium 4 256RAM computer.
225_ 36	positive	One: It's size: It's smaller than the Ipod Mini, and holds more music (5GB to the IPOD mini's 4GBs).
313_ 6	positive	The only free help you get is in renewing your subscription!
75_ 3	neutral	The champ, the baby bjorn, fluerville diaper bag, and graco pack and play bassinet all vie for the best baby purchase.
302_ 0	positive	I've been using NIS 2004 for about 2 months and it works well.
132_ 449	neutral	I hope you enjoy your I-Pod!
138_ 0	neutral	It did not take me that long to set this up, but it did require *not* following the instructions.
246_ 1	negative	It's important that people know the following:  First, the interface is slow.
287_ 10	negative	They are a royal pain to install, and don't function properly once finally installed -- if you can install them at all.
241_ 12	positive	5) Bluetooth wireless technology, so that I can transfer data to and from my computer without messing with any cables.
225_ 62	neutral	There are do it yourself sites (with pictures)that show you how to repair it, but keep in mind that you will have to break the warranty seal, which means?
208_ 14	neutral	I haven't used the Organizer feature (apparantly you can sync with Outlook).
119_ 2	neutral	I have added the router raizer kit(simple installation) to it and cannot live without this setup!
125_ 6	positive	I've yet to find the limitation for this Hitachi (my only Hitachi tool, by the way) and quite frankly, I don't know that I have the muscle to push this machine any harder.
132_ 385	neutral	 Quite simply, BUY THE IPOD, whatever size you wish.
302_ 3	positive	The popup blocker and anti-spam are bonuses.
287_ 39	negative	The best thing to do with this version, is to leave it on the store shelf. It doesn't work, and will cost you an enormous amount of your time, not to mention your hard earned dollars.
170_ 18	negative	 So-So 1. Customer Service - 6 calls Half were efficient other half were equally incompetent.
132_ 0	neutral	Don't get this...keep browsing.
132_ 405	neutral	But seriously though, how bout we work on the durability thing for the next gen.
111_ 10	negative	1. Your Hitachi might come to you with a stiff spring mechanism.
184_ 7	positive	This is the mp3 player with everything I need.  As long as it lasts me a good three years, I'm satisfied.
124_ 7	positive	I do not count this as a negative, however, because it is not that much of a nuisance and at the price for what you get this router is way too good to pass up!!!
166_ 55	neutral	This is especially true if you don't need the!
35_ 14	positive	The panorama modes are wonderful.
166_ 34	neutral	With wireless routers, you have another potential hole, "the wireless connection".
207_ 3	positive	So, I was one who was ready to give it 5 stars with no complaints at all.
176_ 1	positive	I downloaded and updated the firmware, and followed the easy setup instructions.
295_ 1	neutral	Had to uninstall it.
195_ 10	positive	Battery : A Big Big plus.
138_ 18	positive	Overall, if you know what basic steps to take, it was not difficult to connect, and the s/w worked well to connect.
285_ 4	neutral	So, if you have a fairly fast computer (1 gig or better) with plenty of ram (512) and your not gaming online or running streaming video continually, you should be fine.
228_ 11	neutral	It may be that the next Creative product is complete junk, but you should make product decisions based on product attributes NOW, not based on a halo effect of an idealized company (Apple) or other pointless loyalties.
81_ 5	neutral	This eventually ruined the foam pad that is applied to the flip top to keep odors in.
11_ 0	positive	I've been incredibly happy with this camera.
220_ 15	positive	Have not had any issues with the headphones or fragility.
249_ 5	neutral	I could go on and on---but I won't!
166_ 13	neutral	In some cases, you can't even get your PC to the MS patch site to download XP security patch #2 before being hit.
237_ 0	negative	who in the hell needs a frigging *VGA* camera on their CELLPHONE???
220_ 0	neutral	if not amazed, I won't go into the kind of detail many people have here, but I do want to say a few things about my experience so far (I've had it about two weeks) with the Zen Micro;
213_ 1	positive	anyway, my wife got this for me for my birthday and I love the thing.
144_ 0	positive	I upgraded from an older 801.11b router to the Linksys WRT54G for its improved security, and of course, speed.
132_ 444	positive	The I-Pod is the best thing I have ever used.
249_ 0	negative	At first glance, I thought this phone was a little too big for me, maybe a little too complicated.
256_ 15	positive	Probably a great phone overall, and perhaps mine just has bugs.
201_ 3	neutral	I've played around with a friend's iPod a couple times and it IS a cool unit.
311_ 11	negative	I see many other reviews that say the same....stay away from Norton, they don't deserve you, or anyone!
0_ 161	negative	I also own a Canon Digital Rebel and I agree that the advanced controls on the SD500 are not as robust, but overall picture quality goes head-to-head with the Digital Rebel.
91_ 10	positive	The height is a more convenient reach than others, where you have to hunch over.
190_ 24	negative	I got about 700 loaded up before it told me I was full, and at that point, I was ready to toss it out the window.
207_ 21	neutral	It's supposed to support that format, but I keep getting a file transfer failure no matter what I try.
151_ 3	neutral	I had to change the channel of the router, like the channel on a cordless phone, to get it to work with the Linksys Instant USB Wireless Adapter v2.6.
209_ 13	neutral	An aside about sound quality: You can have good sound or 2,000+ songs, not both.
135_ 3	neutral	(The Airport was more than twice the Linksys router.)
0_ 85	positive	i connected my camera to the tv and played some video clips and for a digital camera to take such good quality clips, i give it 5/5 stars =) oh and btw, while you take video clips, you can zoom it too! (digital zoom only though)...but still...(my old one can't do that...you have to zoom it first if you want then take the video clip.)
306_ 15	negative	They didn't know what the problem could be.
132_ 149	neutral	then when i argued with them they told me that they would pick it up.
151_ 2	positive	The new router came with an updated setup utility that makes getting the router installed a fairly straight forward process.
139_ 7	neutral	With a little knowledge and tweaking, you can get this product to run encrypted wireless connections to about 10 people with little or no problem.
228_ 2	neutral	Apple apparently has built up a very nice following of brainwashed consumers.
103_ 1	positive	But I wanted to do some raised panel work and needed more power and variable speed to run the large-diameter bits.
35_ 20	neutral	1600x1200 means really good, cropped 5x7 prints and acceptable 8x10s.
0_ 144	positive	I'd be happy to talk to anyone about this camera.
39_ 2	neutral	I added a second battery (about $69, recharges in about two hours) and a large (192Mb for less than $400) CF module.
132_ 452	positive	I found that to be the most impressive thing about the iPod 'mini' - basically for ease of use, and the feel it gives.
3_ 1	positive	It is amazingly small, it's hard to believe all that has been packed into this camera.
276_ 2	positive	speaker phone quality is good, and poping in a 512mb MMC card, it rocks !
75_ 5	positive	Update I knew that I loved the champ, and useing the diaper genie at a friend's house REALLY reinforced that!
132_ 118	positive	I had a Casio unit, which had given great service, and would have been happy to get another one, but was tempted by the iPod's sleek design, storage capacity, connection options- - firewire and USB, and its integration with iTunes.
222_ 0	neutral	I must say, after tons of research, I have chosen the right Mp3 player.
