132_ 492	neutral	 It's small and lightweight, but it has very little storage space and the shape is clunky.
241_ 3	neutral	The best features that I use most often are:
290_ 0	neutral	I originally had bought Norton Internet Security for my laptop after the preinstalled Norton Antivirus trial had finished.
132_ 288	positive	 The!  sound quality is great.
233_ 14	neutral	There's a whole lot of things you can do with this phone besides reading a book , playing various Java games , having a variety of software installed.
191_ 17	positive	- Replaceable battery.
318_ 5	positive	It works better and has more useful features than NIS 2003.
281_ 3	neutral	I am thankful that I have Roxio GOBACK, I had to use it 3 of the 4 times.
195_ 23	positive	Sound: This is where I love Zen the most.
129_ 6	neutral	The authorized Hitachi service center said they didn't know what was wrong as they hardly ever get these things in for service.
199_ 1	neutral	I really like both of them and as with any other popular products, they both have their share of negative reviews warning of their shortcomings.
242_ 49	positive	Despite a critical start, this phone deserves four stars because it accomplishes what it sets out to do (which is pretty lofty)... does more than most... does it well... is dependable.
3_ 25	negative	it's not my first choice in cameras,
128_ 8	negative	Finally, I gave up and I purchased a Router Razier.
171_ 5	neutral	Do your research and buy something like netgear or dlink.
70_ 4	neutral	Just unlock the top, and remove the plastic bag.
192_ 17	negative	Overall, it does its basic function very well, but we expect more from the mp3 players today and the Zen Micro does not rise to the occassion.
225_ 54	neutral	jack that Creative has acknowledge.
243_ 13	neutral	While the two devices will pair, the phone will immediately drop the connection if any data is transferred.
178_ 17	neutral	Best decision I've made in a long time.
39_ 0	positive	The controls are easy to understand and big enough that they are easy to see and use.
99_ 8	positive	We just recently had to buy another roll of bags. SO $6.00 for a year of bags- can't beat that!!
2_ 0	positive	OK, not quite everything...but this camera is so compact that you will have it by your side when you need it.
253_ 5	positive	The Nokia 6600 is a decent extension of the smartphone line.
165_ 2	positive	My brother had an old Linksys B band wireless router in his home and it was like magic.
54_ 11	neutral	No spinning it or anyhting!
215_ 9	negative	I've read about the issues with the scroll bar, but they must have taken care of that now.
225_ 33	negative	just too numerous to list: FM radio, which has weak reception, but at least it there, and a microphone, to name just two.
0_ 96	positive	i highly recommend this camera to anybody looking for a compact camera that can take good quality pictures.
209_ 0	neutral	I would give the Creative Zen Micro five stars without hesitation...except for the eight hours of my life I can never get back.
7_ 2	positive	Take quick pictures with excelent resolution
213_ 5	positive	the program is called Gnomad and works great for me and seems to cover all the features the included windows sofware does.
89_ 0	neutral	I originally put this item on my baby registry because friends of mine highly recommended the use of a diaper pail.
89_ 13	neutral	Hello, it does house dirty diapers!!
85_ 2	positive	Not only is it much more cost effective (you can use regular trash bags rather than Refills at $5 a pop), it is easier to use and clean, and has a larger capacity.
132_ 56	neutral	It allows fast and easy navigation.
221_ 22	positive	Gets nice sound too.
256_ 13	negative	It would not hang up on calls.
106_ 11	neutral	Not included are: - 3/8" chuck sleeve (the least common bit size) - depth scale in mm (the included one is in inches) - dust collector set - trimmer guide for chamfering
170_ 10	negative	This is NOT a router I would suggest for a novice user, my old Dlink DI52!
0_ 63	positive	The battery life is not that of the Casio's but its good and your going to get better pictures in my opionion with the battery life youve got.
206_ 12	positive	The menus are easy to scroll through; they are laid out naturally, and make sense.
125_ 2	positive	The ones I've kept (Porter Cables, Dewalts, Bosch, and this Hitachi) have proven their worth over the years, however, when I need a real workhorse, I grab this router.
166_ 32	neutral	These generally range from not connecting at all, to hosting !
132_ 334	neutral	 I recommend Shures (shure.com).
131_ 14	positive	But, for the money it is a good machine.
225_ 32	neutral	The features this thing has are !
208_ 2	neutral	After reading reviews and talking to a few friends, I decided on the Zen.
307_ 1	negative	Unfortunately, it does not give you the option of unstalling (or uninstalling) them individually.
106_ 13	neutral	Lefties can switch the angle of the handles by loosening the screws, repositioning, then retightening.
153_ 5	positive	Linksys quality and tech support have been outstanding.
180_ 1	negative	It constantly drops the internet connection and simple things like WALLS in our house block the link so everything is very slow.
111_ 7	neutral	I use custom side clamps set up for 1/4 and 1/2 inch bits in order to plough mortises easily (and with great accuracy).
0_ 34	neutral	Once I have the time, I plan to explore all the high end features of the camera, but for now, I can't comment intelligently or fairly.
190_ 23	negative	Even after all the nightmare sound problems, I'd still half-way like this product if it kept it's promise; the ability to store 1500 songs.
195_ 7	negative	PC software that comes with the player is not as simple as i Tunes but its not bad at all.
32_ 7	positive	Second, it is  incredibly easy to use.
189_ 31	neutral	5.
306_ 4	neutral	The Symantec site said it didn't affect NIS but I believe it did.
189_ 38	neutral	And all you do is select all the tracks in the iTunes playlist and drag them to the File Explorer window.
132_ 491	neutral	Not perfect, but I'm still enamored...  I've had an iRiver MP3 player for a year or so now, and it's really great for listening to the radio.
199_ 9	neutral	One reviewer made what *I thought* was a good point about the volume not having an independant control and being buried in a menu, but must not have spent very long with the player because if you slide your finger up or down the center touch button during a song, the volume goes up or down accordingly.
129_ 9	negative	The only other problem with this router that I have encountered is the plunge action will start to stick, then it needs to be cleaned and lubricated.
96_ 1	positive	It works easily with one hand, which is important.
100_ 8	positive	We just use the Glad tall kitchen trash can bags with odor shield from Target and they work wonderfully.
191_ 9	positive	What I like the most:  - Small and solid feel.
66_ 5	neutral	I did dump a little deoderizer tablet in it.
0_ 118	neutral	The first time, I paid $165 (excluding shipping) to have it fixed by Canon Service Center.
100_ 11	positive	So much safer than the others that require a two handed operation!
1030	neutral	Moscow says Palestine-Israeli contacts key to Mideast peace
1098	neutral	Goodbye to girlhood
26	positive	Three found alive from missing Russian ship -report
1158	neutral	Oxfam: action needed for Chad
817	negative	EarthLink CEO dies at age 49
769	neutral	Real Mallorca rock leaders Sevilla
750	neutral	PSP number one Sony platform in Japan
933	neutral	US, North Korea signed nuclear memo
967	positive	Blog: Here come the Globes!
1073	neutral	Livingstone's transport empire may extend
961	positive	Harris haul puts South Africa on top
1324	neutral	Andromeda involved in galactic collision
24	neutral	Hurricane Paul Weakens To Tropical Storm
1266	negative	Guinea: Plan offices close as country declares emergency
62	negative	4th person dies after receiving flu shot
917	negative	Heavy snow causes travel chaos and shuts schools
1359	positive	Reports: Harvard set to name first female president
1401	negative	South Africa mourns Adelaide Tambo
1343	negative	Salmonella outbreak traced to peanut butter
940	negative	The amounts you have to pay for a bomb scare
218	neutral	Pot smokers may avoid Alzheimer's, study says
776	neutral	Minister slams airlines on carbon
71	neutral	Apple set for massive market gains
1309	neutral	UPDATE 1-Plane crashes at Moscow airport, no passengers
1393	neutral	Ice stops trolleys cold
1258	negative	Bomb kills 18 on military bus in Iran
1446	neutral	BA to charge $470 for an extra bag
1106	positive	Small-business owners find Bush health plan appealing
60	negative	Deaths linked to flu vaccine
865	negative	Victim: Gunman bought drink after shooting
1146	neutral	Clinical Everton show Moyes means business
1128	positive	BellSouth says profit rises 30% on cingular earnings
249	neutral	Amish killings school demolished
782	negative	Iraqi forces detain official suspected in Shia conspiracy
1152	positive	London market a shopping, dining haven
172	negative	Alzheimer's Drugs Offer No Help, Study Finds
1391	neutral	Lawmakers blast FDA drug safety oversight
1378	negative	Samba school leader killed before Rio carnival
1440	neutral	UN nuclear watchdog slashes Iran aid
1417	neutral	Excerpt: Politicians and the press
1486	negative	Dryer blamed for fire killing 39 cats, dogs
103	negative	Photographer kidnapped in Gaza
1081	positive	Canadian breakthrough offers hope on autism
1313	neutral	Start late, retire rich
41	neutral	Stanford study warns of Internet addiction
1263	neutral	Singer on Cowell: Glad he was mean
910	neutral	7 GOP senators to force debate on troops in Iraq
1028	neutral	Wizardry at Harvard: physicists move light
870	negative	Search on for victims of subway collapse
1351	positive	Study: On-the-job naps might help heart
120	neutral	Speaker Hastert testifies before panel probing sex scandal
1026	neutral	Free Will: Now you have it, now you don't
100	neutral	Report criticises US press freedoms
82	neutral	Breast Cancer Awareness is Important
988	positive	Rescued boys parents hail 'miracle'
1151	positive	Cool millions for YouTube founders
1364	neutral	Prehistoric lovers found locked in eternal embrace
47	negative	Deaths linked to flu vaccine
1267	positive	Japan's economy grows
104	neutral	Baseball: Rogers enjoys his muddied streak
203	neutral	Probe under way in Yankee crash
762	neutral	Iran and Nicaraguan leaders meet
1336	positive	Napping is good for your heart, study finds
1218	neutral	Research supports medicinal marijuana
95	positive	Full recovery expected for marathon winner
1239	positive	Tell your boss: Naps are good for you
1129	neutral	Enron boss gets 24-year sentence
1252	neutral	New York City may ban iPods while crossing street
1000	negative	Terror officials see Al Qaeda chiefs regaining power
869	positive	New vaccine for cervical cancer could prove useful in men, too
56	negative	Marine killed in fighting west of Baghdad
1419	neutral	Beyonce in a bikini as SI's swimsuit cover model
921	negative	Ice storms kill 21 across nation
1047	neutral	Japanese whaling ship won't accept help
1214	neutral	Area should get 3-5 inches of snow today
975	negative	Deaths as bird flu flares in Asia
1265	positive	Beckham goal helps Real snatch win
983	negative	Indonesian bird flu deaths hit 61
70	neutral	Iran's president urges higher birth rate
957	neutral	Philippine anti-terror law delayed until June
236	positive	$10,000 poetry prize awarded
1002	neutral	Iraqi sunni lands show new oil and gas promise
239	neutral	Cher items snapped up at auction
795	neutral	Why gas follows oil up but not down
1480	neutral	Study: Female seals picky about mates
1217	neutral	The secrets people reveal
1110	neutral	Indonesia ""will not share"" flu samples
91	neutral	Prestige has magic touch
1297	neutral	Cutting through the clutter to get things done
1032	negative	India decries 'an act of sabotage'
1242	neutral	Jail me, I ate Ivory Coast chocolate
1062	negative	Taliban seize rural district in southwest as police flee
1122	neutral	China denies reports of North Korean apology
1238	positive	Obama announces presidential bid
1476	neutral	Lawyer seizes Smith's Bahamas home
106	neutral	Life on Mars? Maybe We Missed It
1253	neutral	Boy allegedly told to kill by mom gives up
1432	neutral	Updates on world's top stories
772	positive	Bird watchers flock to see rare owl
1410	neutral	Reunited Police to start world tour in May
790	negative	Experts: Fear likely shackled boy
251	neutral	Madonna adoption bid approved
995	positive	Surprise: China cuts price of gas
1185	neutral	Japan: Whaling activists 'terrorists'
1307	neutral	Mega-marsupials once roamed Australia
925	negative	Observatory: poison begets poison
198	neutral	10 die in 22-hour Kashmir standoff
1344	negative	Putin: U.S. force fostering nuke ambitions
1373	negative	6 dead after Utah Mall shooting rampage
79	neutral	Bucs find a new kick in life
803	neutral	Mistrial for officer who refused to go to Iraq
791	negative	What's behind the chopper crashes in Iraq
84	neutral	Three drivers had reason to be proud in Brazil
912	negative	Italy's dispute with US over Iraq shooting
224	neutral	Dow hits new record, eyes 12,000
133	neutral	Google To Launch Yet Another Search Tool
1257	negative	Mogadishu residents flee blasts
789	negative	Pledge: I was abused in frat hazing
1290	neutral	J.K. Rowling marks spot of 'Potter's' end
841	negative	John Grisham set for court drama
1370	positive	Siestas may cut heart disease risk
756	neutral	Zach Braff says he has 'mild depression'
1206	positive	MySpace sales surging
233	neutral	Trailblazing trio protects City by the Bay
1019	negative	In the world of life-saving drugs, a growing epidemic of deadly fakes
130	neutral	NASA spacecraft to measure Sun
1231	neutral	Toyota's Scion parks in Second Life
6	neutral	PM: Havana deal a good experiment
979	neutral	Review: Nokia 5300 Xpress Music
1285	neutral	James Brown's partner can get her things
109	positive	The sweet tune of an anniversary
1400	neutral	Toshiba Portege R400
908	negative	Botched hangings in Iraq speed sectarianism
1195	neutral	Mickelson driving force at masters
1436	neutral	Up to 22 inches of snow in forecast
759	positive	News Baby pandas! Baby pandas! Baby pandas!
1438	neutral	EU condemns 'illegal' CIA flights
1134	neutral	Seahawks' QB Hasselbeck out 2-4 weeks
1024	neutral	Findings : A cool $25 million for a climate backup plan
1078	negative	Bombings say Muslim rebels won't negotiate
142	negative	Kurdish Lawmaker Killed in an Attack in Baghdad
1094	negative	Russian bird flu outbreak is deadly ""Asian strain""
1463	neutral	Latest food-fad -- 'space potatoes'
1312	neutral	Whistle-blowing Web site exposed
122	neutral	Tom Cruise and Katie Holmes set wedding date
1086	neutral	High cholesterol raises stroke risk healthy women
1381	negative	Al Qaeda group calls for attacks on U.S. oil
1304	neutral	Rocky start for Bangkok airport
1320	neutral	North Korea aid demand stall talks
1269	neutral	Work starts on Arctic seed vault
1334	neutral	Bernanke: Economy healthy, but...
1131	positive	Google unveils do-it-yourself search engine
1067	neutral	Catholic archbishop outlines Anglican merger hopes
873	neutral	Microsoft supports OpenID authentication standard
909	neutral	Male sweat raises female hormones
16	neutral	Bad reasons to be good
1301	neutral	Breakup rings find new homes
17	neutral	Madonna's new baby's daddy didn't realize adoption was `for good'
997	positive	New Mars orbiter spots Pathfinder landing site
132	neutral	Flu Vaccine Appears Safe for Young Children
73	neutral	Routine mission turns into hunt for missing comrade
137	negative	U.S. Weighs Sanctions Against North Korea
1080	neutral	Largest ever autism study identifies two genetic culprits
1456	neutral	Fire extinguisher part of Tennessee execution kit
897	negative	Iran to Hit US Interests if Attacked
1060	neutral	False alarm at Canadian embassy in Paris
1251	positive	St. Louis poised for entertainment upswing
1133	positive	Oracle World opens with Dell unveiling AMD-powered computers
1070	negative	Eight US soldiers killed in Zabul helicopter crash
1375	positive	Record-shattering day on Wall St.
840	negative	Attorneys point fingers in fight between Ryan O'Neal and son
786	neutral	What Newsom faces in aftermath of scandal
991	negative	Russia plans new ICBMs, nuclear subs
1429	neutral	GPS sneakers locate with press of a button
845	neutral	China urges UN action on N Korea
1350	neutral	African-Americans are organ donors these days, but what about bone marrow?
1127	neutral	House ethics panel talks to Hastert aide
765	positive	Philippine president welcomes Senate approval of anti-terror bill
74	neutral	Bad weather slows S.Korean search for Russian ship
1179	neutral	Jakarta begins disinfection
1477	neutral	Was Prince's super show too revealing?
785	neutral	No intention of war with Iran, US says
1079	neutral	Roots of autism more complex than thought
1278	negative	Northeaster cancels flights, shuts schools
784	neutral	Fingers crossed for North Korea
252	negative	Man admits UK-US terror bomb plot
1232	neutral	Obama will run in 2008
1051	negative	Judge threatens to shut down Air-India inquiry
20	neutral	Moderate drinking reduces men's heart attack risk
1013	positive	Accord on North Korea is announced
46	neutral	Chefs not counting calories, study finds
1227	neutral	Corn stoves popping up in U.S. homes
851	negative	North Korea claims nuclear test
1398	neutral	UK soldiers cleared of Iraq abuse
816	negative	Two Palestinians killed near fence
1068	neutral	Anglican and Catholic churches could merge
164	neutral	Opera Canceled Over a Depiction of Muhammad
847	neutral	Male sweat boosts women's hormone levels
28	neutral	Injured Marathon Winner Leaves Hospital
25	negative	UK announces immigration restrictions
187	neutral	Porn star candidate campaigns on campus
93	neutral	Manning inspires Giants to victory in Dallas
146	negative	Brazil Air Force Cites Faults and Confusion in Fatal Crash
954	neutral	Chinese president arrives in Mozambique, African tour nearly over
906	neutral	Smokestacks in a white wilderness divide Iceland
1055	neutral	Hicks first in line for trial, Bush says
1439	neutral	Report links humans to global warming
223	neutral	Cher's dress, car, bed have new owners
148	neutral	Immigrants and French Reach Deal in Standoff
944	negative	EarthLink CEO dies at age 49
1250	negative	Indonesian with bird flu dies
1412	neutral	Allen and Okur get All-Star call
1058	neutral	France ends toxic alert at Canadian embassy in Paris
1367	neutral	U.S. commander: Iraq not hopeless
226	neutral	Yankee pitcher's pilot log found
185	negative	Squirrel jumps boy in park; rabies suspected
3	neutral	Nigeria hostage feared dead is freed
1192	neutral	Horse teeth give details of ancient big chill
55	neutral	Making peace from victory over poverty
1368	neutral	Australian PM stands by Obama attack
753	negative	Eight years for Damilola killers
1279	positive	Napping may be good for your heart
932	positive	Boy missing since 2002 found alive
1187	neutral	Women protest Pakistan demolition
1169	neutral	Anna Nicole claimant: A prince of a guy?
971	neutral	China considers Eurobond reserves
168	negative	Growing Unarmed Battalion in Qaeda Army Is Using Internet to Get the Message Out
793	neutral	Blair apologises over friendly fire inquest
13	neutral	United Finds Good Connection in Win
1140	neutral	This week in auto racing October 27 - October 29
1148	neutral	One search does not fit all
842	neutral	Bill Gates and Craig Mundie: vista is Secure, employees are not
898	negative	Blair: Terror battle will be long
892	positive	Roddick overcomes Federer in final
1144	neutral	Arthurs upsets Robredo in first round at the St. Petersburg Open
926	positive	Action intensity boosts vision
1284	positive	Autos drive European gains
778	negative	Man beheaded in southern Thailand
814	positive	Israel says hopes to keep Lebanon border calm
129	neutral	Advantage Cardinals with Suppan in Game 4
61	negative	Israel admits using phosphorous shells in Lebanon
1352	neutral	Guinea capital largely calm under curfew, marital law
1052	positive	Royal rescues presidential hopes with commanding performance
1452	neutral	See if your city is one of the United States' top 10 fittest or fattest
823	negative	Peter Jackson will never work for me again
7	positive	Kate is marrying Doherty
884	neutral	Cutting edge accessories for digital music players
113	neutral	Putin vows to tackle illegal immigration
883	positive	Europe retain trophy with big win
1007	negative	Iran says Sunnis, using Pakistan as base, planned fatal bombing
1194	positive	Two Koreas to resume talks
1109	positive	Retinal implant helping blind people see again
1116	negative	Planned cesareans not risk-free, group warns
72	neutral	Tumor Types May Explain Survival Rates for Cancer
1308	neutral	Rupert Murdoch's secret TiVo
1354	neutral	Teacher's porn conviction sparks tech debate
68	neutral	Hurricane Paul nears Category 3 status
1497	neutral	Baby born on turnpike after dad misses exit
941	neutral	In Egypt, Rice speaks softly
1075	neutral	Protest greets congestion charge's westward push
770	neutral	Iran's boast on uranium enrichment is put to test
1108	neutral	Whether to save cord blood can be puzzle for parents
1372	neutral	Petraeus takes command in Iraq
1483	neutral	Beyonce new SI bikini cover girl
1261	negative	Desperate Iraqi mother relies on militia for help
1155	neutral	Microsoft to release next generation phone
946	positive	Vital signs: mental abilities: folic acid may improve thinking skills
18	neutral	Women in their 60s 'are perfectly good mothers'
780	neutral	Annual diving contest in South Korea proves a chilly challenge
959	positive	Study detects a gene linked to Alzheimer's
1012	negative	Bush declares Iran's arms role in Iraq is certain
1046	neutral	Damaged Japanese whaling ship may resume hunting off Antarctica
1326	positive	Wilkinson sets record in tame win
1069	negative	US helicopter crash kills 8 troops in Afghanistan
1346	negative	Double bus-bombing kills three in Lebanon
131	neutral	Sony Hates Europeans, Will Prevent The Importing of PS3
1260	neutral	U.S. at odds with cleric's aide
1084	neutral	Experts issue new heart disease guidelines for women
1180	neutral	Rowling 'heartbroken,' 'euphoric' at 'Potter's' end
758	neutral	Science panel calls global warming unequivocal
964	neutral	Study finds gritty air raises heart disease risk in older women
176	neutral	In God's Name: Religion-Based Tax Breaks: Housing to Paychecks to Books
86	neutral	Lebo: A life lived on the edge
1204	negative	Swiss plane crashes at Moscow airport
1172	positive	'Grey's,' 'Betty,' 'Scrubs' get boost
38	negative	More Human Remains Found at Ground Zero
936	positive	Bill, thanks for the RSA memories... and laughs
1403	negative	Anna Nicole Smith's body lies in legal limbo
809	neutral	Hunters stalk world's tallest trees
1426	neutral	Latest updates on world's top stories
1338	neutral	Students use IM-lingo in essays
43	neutral	A Picture and A Thousand Words
1465	positive	Good news for slackers: Naps may cut risk for heart problems
1157	neutral	Teen allegedly armed by mom turns self in
1392	positive	Regular naps make hearts healthy
88	negative	Heavy use of mobile phones can make men infertile, scientists say
9	positive	Happy birthday, iPod
52	neutral	Britain to restrict immigrants from new EU members
12	neutral	Nicole Kidman asks dad to help stop husband's drinking
907	neutral	That'll cost ya
1022	neutral	Believing scripture but playing by science's rules
867	negative	UK workers on alert for letter bombs
1418	neutral	North Korea gets 'money and respect'
1365	neutral	Charts: Is your city lean or lethargic?
1479	neutral	Snow's too deep even for snowmobiles
1296	neutral	Gunman 'was Srebrenica survivor'
977	negative	Officers had 'rapport' with alleged abductor
186	negative	Girl left comatose after dental visit dies
937	neutral	Friendly fire pilot 'experienced'
1228	negative	Iraq closes borders with Syria and Iran
958	neutral	Ex-suspect slams anti-terror laws
40	neutral	Tensions as Hungary marks uprising
1104	positive	Bush vows cooperation on health care
134	neutral	Tropical Storm Paul's Outer Bands Hit Mexico's Baja California
794	neutral	Depp 'to make Litvinenko movie'
815	negative	Cisco sues Apple over iPhone name
1305	negative	12 dead in Lebanese minibus bombings
942	negative	Weekly Nielsen Yvonne De Carlo, 'Munsters' star, dead
943	negative	Senate votes to revoke pensions
796	neutral	'Cravings' still there, sez Tara
1360	neutral	Iraq unveils new security plans
797	neutral	Bill would strip convicted legislators of pensions
938	positive	MySpace welcomes French friends
77	negative	Abbas condemns Israeli massacre in northern Gaza Strip
181	negative	Tropical Storm Isaac forms in Atlantic
855	negative	IDF shells Lebanese Army positions across northern border
1097	negative	Reopening bird flu-hitfactory ignores risks - poultryman
843	negative	Iraqis fault delayed U.S. plan in attack
783	positive	Wellcome awards anti-fat research
848	neutral	Mbeki on the big visit from the Chinese
94	negative	Riot warning for France suburbs
889	negative	Ice storm brings chaos in U.S.
1211	neutral	Murphys rule box office with 'Norbit'
1015	neutral	Baghdad plan is a success, Iraq prime minister tells Bush
1274	positive	Nap your way to a successful career
1044	neutral	Foreign minister of Colombia quits in scandal
151	neutral	Managua Journal: Hold the Mojito and Margarita, Nicaragua Has el Macu
1371	negative	Oregon snorkeler mistaken for rodent, shot in face
820	neutral	Super Bowl MVP Manning insists he's one of the guys
1450	negative	EU document: Iranian bomb unstoppable
171	positive	Friends for Life: An Emerging Biology of Emotional Healing
1038	negative	Iraq insurgents attack US base
97	neutral	Questions on credit card safety
981	neutral	Black hole triplets spotted
1409	neutral	Pound will not drop Armstrong case
