132_ 203	neutral	 So it was not any surprise that I could not try out this new type of service.
139_ 6	positive	I have had mine for about a year and use a third party firmware on mine and love it.
132_ 123	neutral	Still not so sure about this one...
287_ 41	neutral	And that's a shame.
141_ 3	positive	The range is terrific, I am using this for my home and I was transferring at 50+mbs from my backyard.
239_ 4	neutral	Camera is nice, and video recording for some reason is only limited to 9 seconds.
43_ 3	negative	Sometimes the pictures are onthe dark side, but I'm able to fix that using the Photoshop 6.0 "adjust levels" function ... not sure how a person would do that without Photoshop, though.
54_ 15	positive	It is far better than just a trash can or the Diaper Genie and it's fairly inexpensive as baby products go!
168_ 8	positive	If you want to work wirelessly, this router does just what you want it to do and my geek friends say that the security is as good as it gets right now.
132_ 487	neutral	Amazing.
148_ 0	neutral	I replaced my D-link 802.11b router because it could not hold a connection continuously.
275_ 10	positive	if you are looking for a phone to integrate as easily as the sonyericsson phones with iSync, i say stick with a sonyericsson.
129_ 1	neutral	Until recently it was my only router.
236_ 3	neutral	In those days I've gone from Oki, Motorolla and progressed (actually regressed) to Sony Ericsson's T610.
135_ 13	neutral	It's like they want to pretend that Apple doesn't exist or something.
169_ 0	neutral	I purchased the WRT54G about a week ago.
174_ 2	neutral	SOHO boxes don't give you a clue about who is one your network or what they are doing.
67_ 8	neutral	Bag the diaper in this small clean-smelling bag and then chuck it in the Champ.
186_ 14	positive	The package also comes with a USB cable, an AC adapter, a pair of headphones (they're okay until you get a better pair), a stand, and a microfiber pouch to carry your Zen Touch in.
233_ 23	positive	5.The Camera installed on this phone is awesome.
279_ 0	positive	This phone is one of the milestones in the history of the cellular phones.
128_ 12	positive	All in all I am pleased with the router.
225_ 44	neutral	Why?
285_ 5	neutral	This is pretty standard for an up to date computer anymore, so what's the fuss?
142_ 4	neutral	I wrongly thought that it was the router.
132_ 420	neutral	 I ordered the mini from amazon, and while waiting for it to arrive I wandered into the Apple store.
79_ 5	neutral	One pail that I used was so difficult to change the bag and insert the dirty diaper.
225_ 25	neutral	Just check the menu on your Zen, and it's all there, and neatly stored.
79_ 20	neutral	I cannot speak to the accuracy of its odor containing capabilities due to it was working overtime with 2 childrens diapers.
202_ 2	negative	But my biggest gripe is still the extremely ugly design.
225_ 12	neutral	00 song capacity of the disk without having to worry about the quality of your music (the Zen micro, actually starts off with about 4.7GB after loading the software).
184_ 3	negative	The touchpad is annoying sometimes (give me the click-wheel and pressable buttons any day), but not at all as difficult to get over as other people are saying.
132_ 213	neutral	  My earlier generation (15Gb) iPod lasted two years, shortened by my own inattention to the simple maintainence asked by Apple (go through at least one charging cycle per month, and don't store the iPod in a car on a summer day because high temp. is harmful to the battery's life).
256_ 0	neutral	I bought this phone after having other phones that had less-than-consistant reception.
298_ 23	positive	 I've used the Corporate edition at work without any problems ever.
225_ 46	neutral	It's an admitted design flaw that the people at Creative have acknowledged (google it).
247_ 0	positive	this is a great phone i have this phone since Feb 04 and i never have any problem at all.
193_ 37	positive	Everything shines of quality.
268_ 20	negative	Especially the bluetooth server... Meaning you have to restart the phone if you want bluetooth to work again.
138_ 22	positive	I'd give it 4.5 stars if possible, but since 5 stars would be misleading, I give it 4 stars.
232_ 5	positive	I have set up it's PDA features with avantgo.com where you can download info from sites like weather,mapquest maps/directions into it, which is great.
135_ 4	negative	HOWEVER, configuration of my system and actual setup of the router for wireless use took me more than 3 hours, and briefly made me reconsider my choice to forego the airport and its notoriously easy setup.
215_ 0	neutral	I had to revise my review today!... If you are still trying to decide Ipod or Zen Micro, Yahoo! has just closed the deal.
268_ 10	neutral	Although the images are not the best in the world, its very handy to have a camera everywhere you go.
275_ 13	neutral	this nokia is going back to china or wherever it came from.
289_ 3	negative	And, when you think about it, it's insulting that Norton requires its customers to jump through these hoops -- anyone who can provide proof of purchase, whether on the phone or online (what if your computer is down?), should have equal priority.
265_ 3	positive	The interface is simple to use.
233_ 32	positive	The handsfree provided by the phone is useful for those who talk on the phone while driving.
71_ 2	neutral	She never wore even one- the hospital started me on Huggies, and I never turned back (as a side note- if you do have the patience for cloth diapers, pay the extra $ and go for Kushies; they're beautifully made and work very well from what I've heard).
270_ 6	negative	The only problem is the size of the keys.
284_ 1	negative	Sometimes a suite is not a good deal and all you get is a bundle of headaches.
21_ 0	neutral	My last digital camera was an Apple QuickTake 200, which shot 640x480 pixel images.
135_ 2	neutral	I run on Mac OSX, and though I considered getting the whole Apple airport setup, the cost difference between the Airport and the latest model Linksys pretty much left no comparison.
243_ 1	neutral	In October of 2003, I bought a Nokia 3650 off of eBay.
104_ 3	negative	If you think you are saving $40 getting the Hitachi, you are right, and you are also getting a router worth $40 less than a Makita.
33_ 1	negative	If you're looking for a digital camera to replace your big Nikon or Canon SLR, forget it - film is still king when exquisite detail and fine color rendition are critical.
268_ 22	neutral	I'm used to having to restart things.
180_ 3	negative	The tech support is worthless too.
56_ 1	positive	it's easier and much more convenient to use because it doesn't have CLUMSY and CONFUSING (not to mention expensive) refills.
298_ 20	neutral	So, we're fed up.
193_ 10	neutral	I also hated the packaging, with a passion.
111_ 0	neutral	Bought an expensive Dewalt router some three years ago and never became comfortable with it.
114_ 14	neutral	I need it back as a hand held so I'm going to buy another one.
55_ 1	positive	I love that you don't have to purchase expensive refills.
221_ 12	positive	Five gigabytes is plenty for my great albums.
183_ 14	neutral	1.
233_ 6	positive	1.The Phone has the best keypad any Nokia phone has to offer.
241_ 19	negative	I wouldn't use it for business purposes and hand one out to all my employees, because you tend to want a little more rugged a phone for that.
205_ 11	positive	The touchpad is great once you get used to it, and I much prefer it to standard buttons or scroll wheels (as on the Dell DJ for example).
54_ 14	positive	We empty ours every day and we have never had an odors from it!
110_ 14	positive	The total price with delivery (free shipping ) was $135 !
112_ 8	neutral	Unless you routinely use it like this (which I do to cut mortises on the woodrat) then you will never notice.
89_ 5	positive	No one has ever come to my house and noticed 'diaper odor.'
204_ 4	positive	The headphones have great sound and durability and mine came with some extras when I bought it (a stand, a belt hook, charger) that I know doesn't come with every one.
141_ 1	positive	This linksys router does it for the RIGHT PRICE.
98_ 0	neutral	So far so good.
196_ 8	neutral	The result, while naturally encompassing the acquisition of greater market share, is a mediocre product that stands out sorely in terms of quality and value when compared in a virtual vacuum to its competitors.
79_ 13	neutral	You can save your bags from your shopping trip and insert them into the Champ.
210_ 2	negative	After installation, the very first time I booted up the Creative MediaSource Organizer, intending to use its CD burning and ripping functions, it totally shorted out.
210_ 1	negative	The machine itself seems fine, but the software that came with it is AWFUL.
132_ 525	neutral	 But is it worth all the hype?
75_ 2	positive	This is one of the best purchases we made.
178_ 8	neutral	When you open the package the first thing you see is "Run CD first".
31_ 10	negative	When taking pictures of people, however, it shows EVERY flaw in the subject's skin.
129_ 0	neutral	I have owned this router for nearly five years.
142_ 3	neutral	I got it to work with no problem but then I experienced bandwidth loss and constant connectivity issues.
179_ 4	positive	When I saw a high gain (low price) antenna was available to the WRT54G router, I thought I'd happily give up some (practically unattainable anyway, since you've got to be in spitting distance from the router) speed in favour of wider coverage.
132_ 292	neutral	 Just kidding.
104_ 2	neutral	I have hade such poor luck with other tools (a Bosch drill) made in Malasyia, that I could not see getting it.
206_ 0	neutral	Every few years I crawl out into the electronic world, in search of a new MP3 player to replace the horribly inadequate one I currently own.
275_ 3	negative	so, right out of the box i had issue.
196_ 4	neutral	_  About the hype:  I must applaud Creative for their restraint.
217_ 11	neutral	It's easy to find songs, organize songs, and also carry some essentials and diversions.
66_ 3	neutral	Now for our third child I saw the Diaper Champ and figured why not register for it and try it out.
0_ 54	neutral	Canon is fixing / replacing but 2 to 3 weeks turn around.
173_ 9	positive	Overall, it'll make my move that much easier knowing I don't have to worry about connectivity.
81_ 2	negative	We found that when you put a dirty diaper into the top loader, there was a tendency to get streaks which would then get on the plunger which would then have to get cleaned each time it was used.
65_ 8	positive	I highly recommend this!
287_ 40	negative	Personally, I may never buy Symantect products again.
132_ 366	neutral	IN SUMMARY: This is a good, basic player.  It's not for everyone, and if you're in the market for one I suggest that you try to put aside the huge popularity of the iPod and look harshly at the actual features that the other players on the market have, and see how they stack up.
136_ 32	positive	All in all this is a 5 star piece of equipment.
114_ 10	negative	I also removed the springs in the plunge  tubes to make it easier to raise.
270_ 7	negative	My fingers are kind of stubby so it took a while to learn how to hit a key without hitting the adjacent ones.
0_ 222	neutral	An A++!!!
221_ 18	positive	Flawless.
213_ 4	neutral	anyway, here's the pros and cons:  +linux compatible with the 1.x series of firmware.
211_ 27	positive	Pick your favorite color and buy it.
130_ 2	positive	This is a quality product, not to be confused with teh cheap junk that Hitachi gets manufactured in China.
198_ 1	negative	After a week I tried to load some more songs and delete a few but the auto load didn't do anything but turn on my player.
250_ 1	neutral	A few things that I want to suggest for improvements:
35_ 12	positive	The macro mode works well, although it takes some practice since the camera doesn't clearly indicate when it can't focus.
134_ 11	neutral	It turns out to be copyright 2002 and much inferior to the 2005 manual included on the CD.
203_ 4	negative	Screen review could be better.
217_ 18	neutral	What device would I recommend?
258_ 4	neutral	The second one is on hold for almost 2 weeks with a message that "Can be delayed further".
257_ 2	positive	Ive had this phone for a year now - and its the best phone I have owned.
189_ 1	neutral	If you're not computer savvy or if you want things as simple as they can be, get the iPod.
79_ 16	neutral	Don't Caregivers need more simplicity in their lives?
307_ 6	neutral	I guess the possibility that someone might not want it to run at all never occured to the designers.
170_ 4	negative	I had a lot of problems setting it up, since the software given along with it is buggy.
216_ 4	negative	Another problem is that the latest 2.0 firmware upgrade moves you into Windows Media Player 10 which seems to be very, very slow for downloads.
108_ 14	neutral	I plan to get a Porter-Cable for table mounted use but will be using this machine for most if not all of my hand held use.
33_ 2	neutral	Before you give up on digital cameras, though, ask yourself a few questions:
307_ 4	negative	Although I disabled Norton AntiSpam, it is still there.
199_ 17	negative	If I was pressed to find a negative aspect of the Zen Micro I would probably have to mention weak FM reception, but the building where I primarily use the Micro seems to have a history of terrible radio reception anyway, so you can take that for what it's worth.
35_ 7	negative	I'd give it  5 stars if the automatic modes were better and if there were true manual focus and exposure modes.
270_ 12	positive	It's really well made and has survived sliding across floors and pavement without a scratch.
251_ 6	negative	1-A cell phone is to make CALLS , in other words , quality of reception and mic/speaker are the most important , the 6600 has a relatively low volume speaker , you'd have to press it hard against your ear to hear anything the other person is saying , unless the surroundings were completely quiet .
166_ 23	neutral	Since you are connecting a router in-between the cable modem and the internet, the Mac address must be copied because its what's recognized by the your network service provider to identify you on their network.
248_ 7	neutral	Sometimes,the phone gets stuck just like a computer and it doesnt store any incoming call numbers..etc..
273_ 4	negative	Dont rely on T-Mobile rebates.
221_ 2	neutral	I wanted a player that had good capacity, construction that can stand up to exercise, good sound quality, good battery life, good looks, compatibility, and a fair price.
254_ 1	positive	You can take pic of your friends and the picture will pop up when they call.
185_ 2	neutral	This proprietory software to download.
166_ 60	neutral	As said before, you may get some conflicts.
311_ 14	positive	It's a highly rated, KICK ASS firewall program that's bundled with the venerable Norton AntiVirus, plus extras (like Norton AntiSpam & Norton Parental Control) that make this security suite a must-have for people who have broadband internet access.
252_ 5	positive	Bottom line great phone for the time being.
186_ 18	neutral	Enjoy!
225_ 28	neutral	It's a tad too sensitive for a first time user (my family member, however, had no problem with it), and it drove me nuts at first.
36_ 7	neutral	I started shooting even before reading the manual (not recommended at all).
69_ 4	neutral	For even better odor control we would put a plug ins in the outlet closest to it.
287_ 29	negative	Warning! The Windows "remove program" feature does not do a good job of this, and neither does Norton's own removal program.
147_ 4	negative	That is, you cannot access the internet at all.
173_ 1	neutral	One device, Tivo Series 1 DVR, is far enough away from my network router to need either a really long Ethernet cable, or a wireless connection.
0_ 212	neutral	Flash works well for a compact, red eye is a minor problem.
287_ 28	negative	The other annoyance with this that you have to remove every single remnant of previous version of Norton SystemWorks before you installs this.
263_ 13	negative	i would highly recommmend...... oh and i have owned this baby for like 6 months now
212_ 8	neutral	As for the warrenty, i havent seen it yet, but i fear for a short on!
265_ 4	negative	I saw a few complaints on the load time of menus and I feel people are over-exaggerating the menu load time.
213_ 9	neutral	Aren't they something of digital sound experts?
278_ 0	positive	INCREDIBLE MEMORY!
224_ 3	negative	(It had locked up multiple times previously, but always managed to work afterwards) This time, the touch screen wouldn't respond to me and none of the buttons worked.
322_ 1	neutral	I was using this on my 2001 Dell laptop (which worked fine until I upgraded to this junk!)
123_ 4	negative	My son tried it and he too couldn't change the speed without an assist.
0_ 12	neutral	The camera was sitting on my home desk waiting for the new digital card and the weekend for the first round of serious shooting.
132_ 155	negative	 *The ipod is overly sensitive to just about everything and gets scratched easily.
195_ 1	neutral	Space : 5GB =2500 songs.
225_ 55	neutral	I know what you are thinking.
132_ 404	neutral	The thousands of songs at your fingertips thing, you just can't beat that with a stick.
255_ 6	neutral	I've synched it with my Jabra 250 bluetooth headset.
219_ 1	negative	A lot of people are having problems with the firmware update required to use the player for Napster to Go.. The firmware is beta and they are are a lot of bugs in it.
264_ 2	neutral	Menu is a bit slow, but overall, phone is very functional.
195_ 24	positive	Excellent sound I mean the player has juice.
136_ 28	neutral	Anyhow, just for reference, I am using a Dell Inspiron Notebook, hooked up to the broadband cable modem that was supplied by Comcast.
0_ 59	positive	I have especially enjoyed the 640x480 mode, while not a replacement for a dedicated video camera, its quality easily surpasses that of my old Hi-8 camera and is perfect for quick clips of things that still images just dont describe (max 8 mins at 640 30fps on a one gig card).
190_ 30	neutral	player[-][s]However, this one makes an ipod sound like your old LP's, so even if you're a casual listener, I'd advise that you avoid the purchase of this product. Terrible.
223_ 12	negative	I would give it about 6 or 7 hours, although it will probably get better after a few charge cycles.
212_ 19	neutral	Why go in circles to find something you want? (  :)  )
268_ 27	negative	It takes a while to learn how to use it right, and at this point I am able to make about 70% of my calls using it.
20_ 0	positive	I got this camera for an unbelievably low price at amazon.
132_ 437	positive	 Has a great helpline.
0_ 193	positive	Good color and very little needed to correct photos on Paintshop Pro.
320_ 6	neutral	Next I de-fragged my hard drive.
213_ 8	positive	+Battery life is awesome IF you upgrade the firmware [requires a windows pc] OR make sure to always plug the ac adapter into the player before plugging into the outlet +Awesome sound quality... I mean it is Creative right?
92_ 3	negative	I can't tell you how many times i've chipped a nail or hurt my fingertips because of the force needed to open it.
217_ 21	positive	The Zen Micro is no exception: in addition to the case, it comes with a neck strap, and has all of the necessary cables for syncing and charging.
0_ 195	neutral	I use "get ready" and "here it comes".
173_ 4	neutral	But everything worked out for the best.
132_ 332	positive	  It all sounds great too.
122_ 7	positive	The M12V has been great.
132_ 40	neutral	Since then, I have been a devotee of the elegant styling and functionality of all things Apple.
132_ 460	neutral	   Backing up your iTunes library takes a short amount of time.
217_ 12	neutral	The iPod gets it right, the Carbon doesn't.
202_ 4	neutral	Creative should hire some real industrial designers.
114_ 7	positive	The router has plenty  of power for any type of bit or wood I need to cut, and the speed control  knob is easy to get to.
93_ 9	positive	I also love that you can flip the device with one hand...
193_ 38	positive	I was more excited about this player upon opening than I was about the Nomad.
206_ 13	positive	The computer interface is 90% good, only losing points due to the fact that "Creative" branding is all over the place within it.
299_ 6	negative	Seems the "program scan" feature did NOT find the EXE file for Outlook!
71_ 10	neutral	I'm beginning to think that the main reason Genie's so popular is their cutesy name.
298_ 11	neutral	We were so fed up that we uninstalled ALL of Norton Internet/AV 2004 and were going to try McAffee, but a techie friend recommended trying Norton SystemWorks 2005 first.
233_ 7	neutral	My dad has a Nokia 6670 before which he has a Nokia 7210 and before that he had a Nokia 6610.
122_ 6	neutral	Maple, Koa and Cherry giving us the hardest time with burning and splintering.
22_ 0	neutral	I've been using this camera for a few months now.
36_ 9	neutral	2 secs to download a 600KB 1600x1200 picture!
274_ 8	negative	The battery power discharges rapidly especially on using the web browser.
275_ 1	neutral	all the other features are gravy.
25_ 0	positive	This is my second digital camera, but I'm much more impressed with the Canon S100 Digital Elph than I EVER was with my Kodak DC240.
127_ 4	negative	The major reasons I didn't give it a five are:  One, I didn't think the fine adjustment worked well.
138_ 13	neutral	There was no obvious screen stating what should be done - the program simply said the router was secured.
121_ 0	positive	This is a well-made and powerful tool.
132_ 19	neutral	iRiver's seems a lot more sturdier than the iPod's.
132_ 192	neutral	 So dissapointing, however I am now just gonna assume it's gonna get pretty niceley scratched over the years and I'll just have to live with it... and i will buy a case for it tomorrow... I mean heck I intended to get the case tomorow anyway but now it feels like the thing might even scratch IN THE CASE.. Other than that I am super extied about this product... I will update the review later in a few days...
225_ 17	negative	The included headphones suck, so get your own.
225_ 57	neutral	If only only it was that simple.
321_ 4	neutral	For security buy Zone Alarm. It's a very friendly program.
213_ 14	neutral	my initial reaction was to tap the up and down arrows, when in reality, you need to touch, maintain contact and slide your finger up and down.
320_ 2	neutral	Then I disabled both Norton Antivirus and Norton Internet Security.
117_ 3	positive	One cabinet shop has been using one regularly in a router table for 11 years without a problem.
290_ 7	positive	I just got an older 866 Mhz system with 512 PC 133 RAM and it also runs fine on that.
195_ 2	neutral	If you have a huge CD collection, 5GB can hold only a part of your CD collection.
242_ 11	positive	The 6600 has more ameneties than most - World phone, Camera (VGA/zoom/night mode/timer), Video (w/ audio & zoom), Speaker (good sound), Bluetooth, infrared, Modem for computers, electronic wallet, Internet access, Calendar, calculator, converter and more.
132_ 295	neutral	 I had to constantly peel mine off to see which was which, so I finally just got rid of the cushions and don't even notice the difference.
166_ 9	neutral	The reason is simple, one word, and "security".
314_ 1	neutral	At the same time I bought PC-Cillin for the laptop and what a slick product!
268_ 16	positive	The fact that you can assign ringtones to people and/or groups is really cool.
207_ 10	negative	They obviously have quality and reliability problems.
116_ 1	positive	For the money, I'm not sure you can do better.
240_ 6	negative	I must say, this one is quite slow to open an application.
139_ 1	negative	This is not an enterprise piece of hardware that you will find in an office or corporate environment.
25_ 9	positive	The pictures are uniformly excellent and color rendering is perfect.
206_ 4	neutral	To me, the key elements that must be present in an MP3 player are as follows:  -Fast transference of songs to player -Well-designed computer-side interface -Easy menu navigation and well-designed control scheme -Good sound (duh) -Reasonable battery time (~6 Hours)  That's it?
100_ 7	positive	1.  The Diaper Champ doesn't require special refills that are expensive and hard to find!
5_ 9	negative	This is due to the unusually slow autofocus system.
242_ 7	positive	APPLICATIONS: It has lots of applications and they work very well... when you eventually find where they are and they finally open.
193_ 55	neutral	Overall this play is my introduction into the market.
132_ 309	neutral	 Think about it for a minute - the 20 GB holds 5,000 songs: more than you're ever likely to need at any one time.
225_ 6	neutral	I saw the Zen, and-BOOM-I bought one for me and one for a family member.
265_ 2	positive	I was looking for a phone which synced with Mac OSX using Bluetooth, had decent battery life, could check email, had good reception, nice screen size and was durable (I break often break small gadgets)
241_ 4	positive	1) Great audio quality overall.
225_ 3	positive	The Zen offered a great alternative.
0_ 105	neutral	The pictures tend to get blurry due to longer exposure, but his can be disabled in the manual settings.
306_ 17	negative	I did it and it was worse the second time around...unbelievable.
50_ 1	neutral	Well wait no more!
15_ 12	neutral	But that camera is a little larger and you defeat the whole purpose of having a truly portable camera.
296_ 0	neutral	I have had Norton Internet Security for 3 yrs and up graded to 2004 versionin August 2004.
187_ 14	positive	It feels solid and not flimsy like the carbon.
