215_ 12	positive	i use it primarily in the provided protective case although i have dropped it about 3 feet from my desk ( by accident ) as well as have played it outdoors in - 30 fahrenheit weather ( by design ) and it has continued to work fine .
274_ 40	neutral	that was annoying .
225_ 0	positive	sure , this thing is definitely more cost-effective than an ipod .
140_ 32	neutral	added 2-24 .
183_ 3	negative	i had to sit on the phone with customer support for 2 hours and they did not help at all .
178_ 4	positive	so far i have no complaints and i recommend this to anyone who wants quality over appearance , also anyone who wants a harddrive based mp3 player and wants to pay next to nothing .
253_ 4	positive	one neat thing - i have taken some pictures in what i thought would be impossible lighting conditions pitch black rooms - no problem for the camera - rooms looked like they had ample lighting .
227_ 47	negative	the panel seems like it will come off very easily as other people have said .
152_ 5	negative	one beef is the scroll , it does n't work as well as i 'd like .
170_ 13	neutral	now my dissapointments .
247_ 11	neutral	i highly recommend the accessory kit , which provides you with everything else you need :
145_ 14	positive	get it , it 's woth every penny ! !
302_ 14	positive	great features .. .
292_ 6	positive	the phone 's sound quality is great ( turn up the volume if its too quiet , people , this thing will get loud ) i dont have any complaints about this phone and the only thing that i miss from my 8290 is voice dialing .
301_ 7	positive	even better , with the optional headset you can listen to music over the integrated radio .
239_ 0	positive	this camera is perfect for an enthusiastic amateur photographer .
274_ 22	neutral	i was surprised by t-mobile 's service .
269_ 4	positive	i 'm amazed at the photo quality -- prints are indistinguishable from 35mm prints .
227_ 10	neutral	1 .
162_ 22	neutral	i use mine at the office , in the car ( with a cassette adapter ) , and will be taking it on a flight back east for the holiday .
161_ 20	neutral	you should update the firmware before upgrading the drivers if you decide you need the newer drivers for the pc.
288_ 4	positive	it is lightweight , sleek and attractive .
310_ 11	positive	the ringtones included are awesome , and did i mention they were polyphonic ?
123_ 36	neutral	buy it for fun , for lack of processing , because you want to use iphoto , or whatever .
160_ 3	positive	i love this player and would probably go with creative labs again .
195_ 5	positive	i have had the nomad jukebox for about three weeks now , and i am very happy with it .
231_ 17	positive	yet after ensuring that all the id3 tags are in order ( with the software which is actually not as bad as people make it out ) it actually turns out to be really handy .
116_ 36	negative	what the g3 raw image software gives you is a fantasy world designed to please the uncritical .
222_ 10	neutral	that 's a huge plus by itself compared to the infamous ipod and similar mp3 players where the battery is permanently installed & removing it voids the warranty .
128_ 1	neutral	i was perfectly happy with my g2 , so why did i trade up to the g3 ?
165_ 6	positive	i found using mediasource to load your songs to the nomad jukebox to be much easier and faster than using windows explorer .
155_ 12	positive	very sleek & stylish as well as the screen options and visuals it has .
224_ 34	neutral	karma gets consistently good reviews for sound quality and connectivity from its docking device , which has rca output jacks and ethernet jacks for connectivity .
274_ 12	neutral	i checked with nokia .
270_ 10	positive	9 3x built-in optical zoom is a lot for this price range .
155_ 26	neutral	when plugged in , it does n't lag the computer like the archos did ... unless you are doing a massive transfer of data in one load .
195_ 33	neutral	in other words , to locate a track using the software on the computer and add it to a playlist , you must know the name of the cd it appears on and then find the track by locating the location of the unlisted cd by looking for tracks that appear on it .
182_ 25	neutral	i would recogmend this player to anyone i know , and you will not be dissapointed .
268_ 9	positive	the battery recharges ral fast and the recharger thingy that comes with is real nice .
173_ 8	neutral	cons :
249_ 13	positive	all and all , i am extremely pleased with this camera .
115_ 7	neutral	i wanted it to shoot concerts as well .
213_ 5	neutral	that 's been my experience .
127_ 8	positive	the standard battery include with the g3 is a camcorder battery that will allow me to take pictures all day without worrying about charging .
220_ 15	neutral	that is , if a folder on your computer called "" mp3 "" has slayer ( thrash metal ) , stravinsky ( classical ) , and ice cube ( rap ) in it , you will only be able to play the contents of that folder by searching for the artists or genres manually .
113_ 3	negative	b ) the lens cover is surely loose , i already accidently finger-printed the len a few times , and au lens tigt and cause potential damage .
200_ 19	neutral	if you 're a jogger and you want to strap it to your arm , i 'd recommend flash memory .
106_ 6	positive	those used to 35mm cameras will find the g3 very comfortable and friendly to use .
274_ 33	positive	in all fairness , customer reps are very nice , and they ( most of them ) try hard to answer your questions .
222_ 12	negative	at the very least , a sturdier more protective carrying case would be nice .
292_ 4	neutral	here 's a hint : go to nokia.com and get their pc suite and a connection cable if you dont have irda or bluetooth .
134_ 0	neutral	bought this product about a month ago and have used it in a variety of situations .
140_ 37	neutral	i also discovered the exposure-bracket setting , which enables you to take three exposures with one press of the shutter : the first at the camera-determined exposure , then one lighter and one darker .
231_ 13	neutral	like others have mentioned , you can manage to hear new things in songs even though they 're on lower bit levels .
208_ 19	neutral	was it a full moon that night ?
165_ 16	positive	i can highly recommend this product because of its ease of use ( hardware and software ) , playback quality and value for the price .
173_ 31	neutral	the upgrade went smoothly and was easy to do if you can follow directions .
274_ 27	negative	since i received the phone , i spent countless hours on the phone with customer service reps who promised t-zones would work "" in 24 hours "" .
310_ 3	positive	it is just a tad small to hold to your ear with your shoulder , but that is solved with the very comfortable handsfree ear-piece which is included .
224_ 31	neutral	the rio karma feedback suffers from sensitivity in the hard disk .
154_ 5	positive	the free ( i didnt know they still did that ) carrying case is really protective , and to me its the only accessory you need ( except good headphones ) .
272_ 2	positive	in my opinion it 's the best camera for the money if you 're looking for something that 's easy to use , small good for travel , and provides excellent , sharp images .
302_ 9	neutral	what it lacks for me is n't available on one phone yet , namely gsm850 ( also sometimes known as gsm800 ) , bluetooth and edge .
310_ 23	neutral	now , for the t-mobile service :
229_ 2	positive	price !
175_ 3	positive	one good thing , it is 40 gb of disk space ( well , it is 38 gb in reality ) .
302_ 10	neutral	so when the quad bands start appearing i will be upgrading again .
224_ 41	neutral	the karma does have a stop button .
158_ 8	neutral	that 's a huge difference ... especially in this price range .
209_ 9	neutral	my one recommendation to creative is to get some marketing people to work on the names of these things .
282_ 36	positive	overall , i highly recommend this phone .
285_ 19	neutral	which was a good thing , because i realized i had forgotten my phone ...
238_ 1	neutral	unfortunatly it was dropped and damaged a year after i bought it .
282_ 0	positive	anything this phone does , it does perfectly .
215_ 16	positive	b. fast mediasource cd ripping - takes about 40 seconds for a cd on my pentium 4 pc ( 2.4 ghz with 1gb ram ) with 52x drive .
292_ 0	neutral	i bought 2 of these phones 2 months ago for myself and my girlfriend .
208_ 35	negative	7 . mediasource did not install on my personal notebook .
278_ 8	negative	it also does n't have voice activated dialing . big minus ! !
158_ 11	neutral	i doubt anyone has ever seen an add or commercial for any other mp3 player .
212_ 0	neutral	i recently bought the nomad jukebox zen xtra , and did n't even get as far as charging the battery .
141_ 1	neutral	after doing a hands-on comparison between the nikon coolpix 5700 and sony dsc-f 717 ( both of which lack the quality , feel , or features of the g3 ) , i ultimately chose the g3 because of its outstanding image quality ( resolution and coloration are superior ) .
148_ 15	neutral	( i would have appreciated having a firewire plug , however )
247_ 4	positive	the movie mode is also working great .
265_ 12	neutral	read the directions !
290_ 17	neutral	the 6610 is still easier to use than the other two phones ( t610 , t720i ) .
173_ 37	neutral	i 'm starting to listen to cd 's that i have n't listened to in years now that i have them all handy in one place .
126_ 1	neutral	there were a few flaws that i learned to deal with and took thousands of pictures around the world , losing a few that i really regretted .
158_ 4	neutral	the ipod uses a smaller ( and more expensive ) drive ( 1.8 "" ) .
131_ 16	neutral	unless your a professional , now you will need only one camera . this one .
246_ 15	negative	3 . the pictures come out hazy if your hands shake even for a moment during the entire process of taking a picture .
158_ 6	neutral	i should point out that the new rio karma is now down to about $ 280 and is reviewed readily as being as good as ( and better in some areas ) the ipod .
146_ 8	negative	you 're going to need to buy new headphones , the stock ones suck
153_ 4	negative	deficiencies with zennx are easily overcome with 3rd-party earphones ( $ 20 + ) and software ( $ 25 ).
224_ 10	neutral	ipod can be used as an external disk , and apparently stores files without problem .
191_ 11	neutral	2 . i do n't need the nomad at home for the same reason ( although using it to sync between the two pc 's might be a reason enough to get it . )
264_ 1	neutral	the nikon coolpix 4300 deserves six .
186_ 10	neutral	the nomad can hold any type of file , not just mp3 , so you can use it as a portable hard disk .
235_ 3	neutral	so if you happen to be out of the house and you have a frozen os you can 't use nomad until you get home .
230_ 6	neutral	i did n't even try the included software .
164_ 18	neutral	the dial on the original zen was perfect and i wish it was on this model .
194_ 14	neutral	well , anyway i could go on and on on why this player did n't meet my expectations .. .
184_ 6	positive	the sound is excellent as one would suspect from a creative product .
197_ 15	neutral	itunes does what apple is famous for , makes software that works for the less computer saavy .
195_ 19	neutral	the cd will be classified into a number of genres , and in multidisk sets , you can get separate classifications for different disks by the same artist and the same performance .
256_ 8	neutral	i plan on buying a second battery and a larger cf for it .
266_ 3	positive	its easy to use and the sheer fun of being able to use an array of nikon accessories like the telephoto and wide-angle lenses is the proverbial icing on the cake .
311_ 4	neutral	yet they 've gotten rid of most of the languages that should be in the phone , including italian , german , and dutch .
207_ 14	positive	i thought i 'd have to buy a set of headphones to use with it , but the included earbuds work quite well .
200_ 20	neutral	if you want to listen to tunes while you travel , i 'd get a hard drive because you can put so much on the thing - including audio books .
162_ 8	positive	it 's easy enough to pop it open to see what song you 're listening to .
186_ 7	neutral	however , it does n't register instantly as a hard drive like other players .
162_ 9	positive	the sound quality is excellent ( and i 'm fussy with that stuff ) , the unit looks cool , screen is bright and easy to read , and the replaceable battery means a major advantage over the ipod ( besides the price , but everyone knows that ) .
224_ 51	neutral	if that is for you then pay the money , learn from the experience and you 'll be a more informed buyer when you buy device # 2 .
184_ 16	neutral	for prospective buyers , i would warn of the following : 1 ) purchase a better pair of headphones as soon as possible , as earbuds sound terrible and are terribly uncomfortable ( this applies to earbuds in general , ) and 2 ) make sure that your mp3s have id3 tags on them , that when when they are loaded into the playlist they will automatically sort themselves .
285_ 34	negative	- no option for caller-id pictures or individualized ringtones .
228_ 16	neutral	the mini ipod 's look the best to me -- but with only 4gb there 's no way i would ever buy any mp3 player with a measly 4gb of storage .
192_ 0	neutral	well in the beginning i was asking around for mp3 players .
297_ 1	neutral	i waited a few years between phones , mostly because ( like most i think ) i didnt really need one .
247_ 3	positive	the possibilities with auto , manual , and the very helpful "" scene "" mode , which offers 11 optimized situational settings like portrait , landscape , beach / snow , sunset etc. , are endless .
262_ 9	negative	2 the battery life seems to be on the short side but adequate for most situations .
162_ 11	neutral	i just put it on "" shuffle "" , sit back , and enjoy the eclectic mix that almost 3,000 tunes offer !
231_ 9	positive	the screen 's large and easily read .
249_ 14	neutral	making the step from film to digital has been a great move .
173_ 69	neutral	sound :
262_ 14	neutral	one more thing about indoor shots - many of the reviews knocked this camera for low light focusing .
270_ 12	neutral	here 's what you may miss or be annoyed by with this camera :
246_ 17	neutral	try to buy a tripod and that should solve some of those problems .
193_ 3	positive	not only is it more affordable , but its a better player for windows , which is what i have .
277_ 16	positive	overall this has been my favorite phone that i have owned .
203_ 1	positive	* price and capacity
123_ 10	neutral	picture this :
146_ 0	neutral	i was a little concerned to be the black sheep buying this player instead of the incredibly overpriced apple i-pod .
140_ 31	neutral	but make sure to buy a tripod and separate flash unit at the same time : you 'll see the difference in your photos immediately .
267_ 1	positive	there are so many functions in this little , yet powerful camera !
175_ 4	positive	for the price and features it is really good .
194_ 6	neutral	the sound is indeed excellent and the form factore is not bad ( but still rather larger than i had expected ) .. .
277_ 9	negative	some of the higher pitched rings are very easy to hear , but not easy to listen to .
170_ 27	negative	the cut-outs for the controls is not thought out as there is too much material in the way to adequately access the controls , especially the scroll wheel .
119_ 14	neutral	7 . a new photostich software for stiching your pics into a panoramic view .
195_ 0	neutral	i became interested in getting a mp3 player when i got a new work computer ; while my office bars the addition of any non-work software , it does n't care if you load cds onto the hard drive .
311_ 0	positive	nokia makes a great phone , that 's clear .
129_ 6	neutral	it is not perfect though .
294_ 1	positive	the features are really cool like the radio .
131_ 10	positive	this camera has none of these flaws and will be something you 'll use all the time .
187_ 4	positive	the buttons and interface are very easy to use .
215_ 24	negative	1 ) player is not plug and play - need to install nomad explorer first and mediasource to transfer files and i had to be patient as i was used to winxp detecting the player and dragging and dropping the music files into it .
161_ 8	negative	the cons are n't really a big deal to me ... except one con that does annoy me is the way it stores files ... no folder structure ... and it 's based on the title of the songs ... many of my songs where seperated into folders ( on the pc ) ... and a few had same titles ... so i had to change the titles to make sure that i did n't have any that might be the same as another .
150_ 13	positive	this is a good deal for music and data storage .
239_ 2	positive	it is small enough to fit easily in a coat pocket or purse .
134_ 30	positive	range of functions - as indicated above - it has something for everyone : point and shoot power plus advanced functions for those who are serious about photography .
176_ 1	negative	so yes , as with all software bundled with creative products , it was useless and ugly .
148_ 4	neutral	after finally stumbling upon this zen nx player , i knew i had found what i was looking for .
245_ 3	neutral	you have to manually take the cap off in order to use it .
131_ 5	neutral	crop and enlarge the best at practically no extra cost or time .
302_ 3	neutral	almost there .
285_ 22	neutral	pros :
222_ 9	neutral	the good news is if you can 't get it to reset / reboot you can still pull the battery and reinstall it .
139_ 4	positive	everything else about the camera is great .
188_ 2	neutral	the reason for this the ipod has "" a better user interface "" .
231_ 11	positive	sound : exceptional , though i can 't really compare it to the ipod .
152_ 1	positive	when it came down to it , the price on this player is hard to beat .
277_ 17	neutral	great battery life , perfect size , but a tid bit quieter than i would like .
184_ 11	neutral	i ignored the instruction booklet ( as i do with any product ) and figured out how to organize separate playlists within minutes .
151_ 14	positive	i have n't had time to really push this player to the limit , but audio aspects on the nomad are satisfactory , as should be expected from creative labs .
121_ 19	neutral	i have no buyers remorse with this baby , and i never will .
215_ 27	negative	3 ) folders cannot be created for the audio files .
269_ 8	neutral	a minor quibble , since most cameras on the market still only include the 8mb cards .
113_ 4	neutral	i wish canon would work out some way for that issue .
226_ 1	neutral	this is my fourth mp3 player ( creative nomad jukebox2 and 3 , rio chie , and this one ) , and my third player from creative .
274_ 24	neutral	reason ?
140_ 23	neutral	i bought a 512 mb card , which seems to hold about 400 photos at the highest resolution .
115_ 12	negative	well flash photos are never great , and there was still a lot of noise .
161_ 9	negative	and man ... i had to work to put my chinese songs on the player ... because i had the actual chinese names of the songs as the title ..
224_ 25	negative	the creative software is awkward / difficult to use and just plain does n't load on some computers .
131_ 4	neutral	no more wasted time and money developing rolls of pic 's for just a couple of keepers .
179_ 7	negative	d ) software is another great misfortune -- hard to operate , crashes frequently , screwed my music library up , doesnt work with mp4s , the list goes on and on
303_ 0	neutral	i purchased this phone after having been an at &#38; t subscriber with a nokia 8260 phone for over three years .
266_ 0	positive	if you 're looking for a small , compact , super resolution digital camera , you can end your search with the nikon 4300 !
190_ 8	positive	the software could n't be better and the mp3 player works like a dream , i could n't give this anything but a 5 , i wish there was a 6 .
136_ 5	neutral	my story is based on personal usage .
187_ 14	neutral	i think the lack of the mp3 player being able to run without special software is also a downer , becuase it makes it more cumbersome for people less computer illiterate .
222_ 6	neutral	no difference .
204_ 12	neutral	weird .
246_ 8	neutral	depending on all the above requirements , i had narrowed down my search to nikon 4300 and canon powershot s400 models .
119_ 24	positive	this is quite simply the best you can ask for .
250_ 4	neutral	if something were to happen to my nikon coolpix 4300 , i would order another just like it .
186_ 14	positive	huge storage space - even at 320kbs , you can store a ton of songs on this thing .
263_ 6	neutral	now where did i put that manual ?
108_ 9	positive	although canon 's batteries are proprietary , they last a really long time , recharge fairly quickly in the camera , plus if you want ' more power ' , you can even find a knockoff charger and spare batteries right here on amazon .
215_ 36	positive	7 ) some people have problems with the flip switch on the bottom that releases the player cover - has not been an issue for me and is immaterial if you use the case as the case covers the switch .
307_ 2	neutral	that beside you are prob. very well aware of many of the features that this phone is known for , and one that has not yet been mentioned : using this phone as a modem for any computer with a usb 1.0 port !
298_ 12	neutral	i 've yet to be dissappointed .
236_ 10	neutral	and then it breaks .
297_ 5	neutral	really quiet .
195_ 31	negative	also , i can 't understand why the software does not ignore "" the "" when it lists the cds in alphabetical order .
290_ 11	neutral	the 6610 is the actually the longest but they are all very small .
191_ 16	neutral	the bottom line :
185_ 13	positive	i am very pleased so far .
117_ 2	neutral	my girlfriend loved using this camera so much as a point and shoot that i had to pry it out of her hands most of the time .
106_ 8	positive	the extended zoom range and faster lense put it at the top of it 's class .
189_ 5	negative	the headphones are n't the best , but you can really expect much out of the small headphones you insert in the ear cavity .
206_ 2	neutral	i purchased a jukebox 3 from creative almost a year ago .
301_ 18	neutral	go for it !
227_ 52	negative	also , the player sometimes freezes , not a very big problem , but can also be annoying .
193_ 10	negative	my only complaint would be that you need id3 tags & that takes a while to do if your mp3 files do n't have them .
265_ 9	neutral	do n't buy this camera if you are not going to purchase a 128 megabyte card .
224_ 13	neutral	reviews for sound quality are generally ( but not universally ) positive .
173_ 7	positive	3 ) user replaceable battery
227_ 16	neutral	3 .
268_ 1	neutral	my room is so dark and when i tried taking pics of it with my old camera , they came out black , but with this , they look the same in the picture as in real life .
144_ 8	neutral	yes the ipod is smaller , but not $ 200 worth , which is the premium you 'll pay for an equivalent capacity model .
282_ 35	negative	the phone has a few minor inconveniences , but only because it lacks those features , bluetooth and high spend internet , but there are very few problems with things that you expected this phone to do .
304_ 3	positive	overall an excellent phone .
165_ 9	neutral	i use my own mid-priced headphones rather than the enclosed earbuds .
241_ 2	neutral	i needed something with more power , so i bought a nikon coolpix 4300 .
265_ 2	positive	i have not been disappointed with my purchase .
130_ 3	neutral	for those of you who already bought this camera , i suggest you buy a hi-ti dye-sub photo printer .
128_ 2	positive	because this camera is beautiful .
170_ 35	neutral	could not stop it , could not get out of the "" now playing "" screen .
199_ 1	neutral	i have a large collection of cds and have loaded over 100 of them so far .
287_ 9	neutral	best regards sadoun satellite sales
151_ 12	negative	the scroll bar problems make the task of creating playlists more frustrating .
236_ 35	neutral	you will be sorry if you do .
264_ 3	neutral	i was considering buying the minolta f-100 and the sony dsc-p 9 , but at the camera shop , realized this one went above and beyond .
134_ 19	negative	flash - as with all built-in flashes in small cameras , you get overilluminated main subjects with depth being lost .
226_ 5	neutral	my friend has an i-pod for about 2 years and the battery has so so messed up .
116_ 38	positive	but at least youre starting with the most photorealistic images ive ever seen from a camera .
201_ 3	positive	now heres the stuff you should know starting with the good things : the screen is really big and the blue light in the back is perfect , fast as hell in music transfer , controls are easy to use after mastering the scroll button , great sound and ive heard many mp3 players , a ton of different equilizer type deals on here .
246_ 2	neutral	here were my requirements in a digital camera :
274_ 35	neutral	i realize this is for quality assurance purposes , but i should have the right to say when my questions have not been answered ( i.e. me :
207_ 10	positive	you can create playlists , drag & drop songs and playlists to your player , and rip directly from cd to your player .
162_ 24	neutral	get better headphones .
302_ 6	neutral	this is almost it but not quite but the price was right .
118_ 0	neutral	after reading the very positive review of this camera in a leading consumer magazine , i decided to head here , to amazon , to read through the online reviews .
160_ 2	negative	all i have to say is that i did freeze on me once , but it has n't done it since .
210_ 8	negative	- the software that came with it was tough to load .
191_ 21	negative	the eax sound enhancement feature did n't do enough for me and the custom eq was a limited 5 band eq .
