197_ 24	positive	if you bring up an album , but absolutely hate some of the tracks , the zen will allow you to delete that from the playing order .
110_ 10	positive	i highly recommend it .
231_ 21	negative	the only thing missing is an option to adjust the balance .
200_ 34	positive	great price .
138_ 11	neutral	i cancelled the order .
132_ 7	neutral	however , it seems that this is the general rule for most digital cameras .
227_ 5	neutral	i returned it once , then i sent it back , and it is crap .
173_ 25	neutral	i think it fell right on the earphone plug when it fell ( murphy strikes again ) .
184_ 8	negative	the environmental audio , however , is almost completely useless and has made most of my songs sound worse than without it ( i encode my songs at 192-256 kbps without variable bit rates . )
127_ 2	positive	am i ever glad that i decided on this camera !
266_ 6	neutral	i own a 35mm slr camera and this is my second digital .
228_ 3	neutral	having my entire music collection is great when travelling ( both on plane and car trips ) and i do n't have to decide what to bring or copy onto the player -- it 's all there .
180_ 6	neutral	creative tech support operators work 9-6 p.m. weekdays - as if i had time during work hours to spend time on this .
173_ 33	neutral	storage :
205_ 4	negative	the only two things that stop me from giving it 5 stars are the ho-hum software that comes with the system , and the traveling case it comes with .
221_ 10	negative	third , the poor design continues with the case .
139_ 7	neutral	i 'm sending mine back and am waiting for the problem to be corrected .
257_ 3	positive	the quality is superb .
201_ 1	neutral	it is a beast .
109_ 3	positive	i love having the option to manually control the f-stop , shutter speed and even focus .
182_ 18	positive	also , the nomad 's 14 hours of battery life versus 8 is handy .
195_ 17	neutral	when you load a disc , you go to an internet cite for the insertion of the names for the cd and the tracks .
116_ 4	neutral	hence i decided to spring for a point-and-shoot digicam that that would have features that would let me get around their inherent limitations .
116_ 27	negative	now there is one more complaint i have about the g3 and that is the software that comes with it for processing raw images ( i only shoot in raw image mode and the first thing i did was replace the 32 mbyte cf with a 512 mbyte cf , which gives me 130 raw images , as opposed to 7 !
210_ 7	positive	+ / - sound quality was good but it was going to take some tweakings with settings to try to make it great .
311_ 2	negative	the one huge disappointment is that the phones manufactured for t-mobile lack many of the menus and functions that a nokia straight from the manufacturer should have .
173_ 51	negative	but for now it appears that this player does n't play well with itunes .
104_ 5	positive	3 ) 4x zoom is nice
290_ 2	neutral	below is how i evaulate this phone with other t-mobile phones which i have borrowed from parents / friends :
173_ 62	positive	this is a nice feature ( i.e. it 's early in the morning and you rather listen to "" easy listening "" rather than "" heavy metal "" - no problem .
206_ 12	neutral	if you buy a creative mp3 player , be sure to get the optional extended warranty .
247_ 8	positive	even at the "" normal "" setting , a 8x10 print ! shows not a single sign of visible rendering or pixels - you could never tell that the picture has been taken by a "" digital "" .
114_ 6	positive	has 4x optical zoom which is higher than any other in the same price range .
119_ 16	neutral	( looks quite neat too suggesting that canon may have , er , canonized it a bit ).
213_ 13	negative	i fully expect it to go bad again in the same or some other way in the next 6 months because , as other reviewers have pointed out , the construction is pretty flimsy .
171_ 2	negative	1 . the size is a little bit bigger than the ipod , and it weighs a little bit more .
206_ 8	neutral	if creative offered a 12-month warranty on their mp3 players , i 'd be covered .
173_ 63	positive	the software comes with plenty of defaults genres .
162_ 29	neutral	i got it now , and i 'm diggin ' it .
249_ 10	neutral	i use a 128mb card , and usually get around 70 to 100 pics 1024-1280 res. , with good resolution .
294_ 2	positive	the first night i got this phone i put it next to me when i went to bed just to listen to my favorite music station and the handset itself doesnt weight anything its too light and feel so comfy with it .
274_ 10	neutral	however , it serves its purpose .
119_ 18	neutral	in english , this means that even straight out of the box , you 'll be amazed at the pics you end up taking .
158_ 2	neutral	all of the zens use a standard notebook drive .
110_ 0	positive	this is my first digital camera , and i am very pleased with it .
310_ 10	neutral	you can also set a background wallpaper .
221_ 12	neutral	it also covers over the power jack when closed .
134_ 7	neutral	the photos she took are better than the results i got from my nikon slr and range of lenses !
290_ 35	positive	overall this is a slightly better than average phone .
270_ 17	neutral	you just have to use the lcd viewfinder to see the whole picture .
164_ 8	negative	the explorer program did shut down a couple times while i was renaming titles and changing genres but i did n't have to reboot the computer or anything , just open up explorer again .
121_ 8	neutral	+ takes sharp 5mp photo 's , has great features and relatively easy to use .
123_ 5	neutral	they have n't got all the bugs worked out just yet .
238_ 5	neutral	it 's nothing major , just a bad hard drive , any hard drive mp3 player can have that problem .
184_ 2	positive	it is small overall , bigger than the ipod , but keep in mind that this is because different , less expensive but not necessarily inferior technology is used in the zx .
186_ 27	neutral	that way i could get rid of a walkman alltogether .
139_ 0	negative	this camera has a major design flaw .
195_ 27	neutral	if you have two tracks with exactly the same name on one disk , it will not copy both -- it gives you the option of skipping the second or overwriting the first with the second .
119_ 21	positive	overall , the g3 delivers what must be considered the best image quality of any current > 4 megapixel digicams , from a detail , tonal balance and color response point of view .
240_ 4	positive	the manual mode is feature rich and i can 't wait to get the hang of it .
186_ 64	negative	if you hold down the scroll wheel too long ( which is common if you have a lot of songs to sort through ) , it will get "" stuck "" rapidly going through the songs and wo n't stop until several seconds after you let your finger off of it .
204_ 11	negative	my one issue with the mediasource software is that , despite pulling id3 tag data from the cdds service , the ripping process fails to populate the "" year "" field .
215_ 47	neutral	5 ) handle the player with care - it is not meant to be dropped .
186_ 53	neutral	when i first had it i kept finding myself having to look at the nomad to figure out where the skip button was .
226_ 12	positive	the size is small ( just a little bit bigger than an i-pod . )
285_ 24	positive	- solid , high-quality construction
134_ 17	negative	while light , it will not easily go in small handbags or pockets .
129_ 20	positive	it comes with a clearly written manual and the learning curve is not too too steep .
157_ 10	positive	the lcd screen was very large and readable .
224_ 28	positive	reviews for sound quality are generally ( but not universally ) positive .
173_ 67	neutral	in addition , you can create play lists where you can create the equivalent to a compilation cd right on your player .
155_ 3	neutral	i refused to go for an ipod , i am not going to spend all that money just for the apple name and because it is "" trendy "" to have that player .
197_ 13	neutral	lastly , ipod / itunes will not play wma formatted songs .
289_ 14	negative	pc cable is too expensive ... $ 50 for a usb cable ?
274_ 38	neutral	umm , well , thanks for nothing .
215_ 20	positive	10 ) multiple play modes - tracks in order of album , shuffle , etc. , is standard on all jukebox players but worth noting that the zen xtra is not deficient in this matter .
140_ 25	neutral	i have a 120 gb remote drive i use to store my digital images :
227_ 22	neutral	you can also search for your song , which is good .
193_ 5	neutral	so far i 've only had it since christmas , so i cant tell you much about the battery life .
118_ 7	neutral	-- an event that involves dogs running and jumping hurdles .
191_ 17	neutral	if i have to get into making playlists to avoid rear-end collisions , i 'll just buy a regular portable cd/mp3 player and burn myself collections of about 120 tracks per disk .
136_ 11	positive	in terms of the shots taken , this camera is insanely great !
254_ 9	neutral	i have a 128mb card in it and can shoot over 150 hi res photos .
309_ 19	negative	finally , i reiterate my thumbs-down rating for t-mobile as a carrier .
203_ 17	negative	-- > you 'll be changing track information a lot because the cd database information utilized by the software is mediocre at best .
208_ 12	neutral	after about 45 mins of listening there was audible static in the player .
229_ 1	neutral	the pros :
170_ 7	positive	it is great sounding , even with the supplied earbuds .
224_ 35	neutral	usability ( button usage , feature selection , menu structure , display size and quality ) also has good feedback .
205_ 2	positive	the memory will hold an amazing amount of songs , my entire collection of cd 's will all fit on this great little tiny piece of digital fun .
242_ 10	neutral	3 . with low battery , it twice wiped out the entire pictures in the memory chip .
265_ 5	neutral	however , the convenience of using digital far outweighs the slightly less accurate indoor pictures .
134_ 15	negative	the zoom lens unit feels fragile and it is worth buying a good camera bag if you are going put to carry it round a lot .
115_ 8	neutral	that meant even less light and just as much action .
307_ 9	neutral	as i also leave you with this review i would like to thank you for reading it .
288_ 12	positive	i am enjoying my phone a lot ....
121_ 7	neutral	olympus c5050 is a very solid camera with a metal body .
231_ 28	neutral	the software and design are geared towards enhancing the music experience .
248_ 10	neutral	however , as an average person with unsteady hands , i doubt it 'll perform well in lower light settings .
227_ 39	positive	the music plays awesome , never skips , even if u run for a bit , so you can listen to music without interruption .
268_ 6	neutral	if you have windows me you should upgrade to xp anyway , lol .
240_ 5	positive	the macro mode is exceptional , the pictures are very clear and you can take the pictures with the lens unbelievably close the subject .
227_ 30	positive	when you turn on your player , the player turns on really fast , and the music continues to play , as you left it when you were turning it off .
312_ 0	positive	this phone is good with a huge array of features built into it .
138_ 0	neutral	you see , i can 't rank the product since the merchant that amazon is collaborating with ( j and r camera . ) to bring us consumers better choices never sent me the product .
170_ 42	neutral	i would suspect that there are similar problems with all of the other brands as this is somewhat new technology .
269_ 0	neutral	i did quite a bit of research before buying this camera , and this one had everything i was looking for .
164_ 6	neutral	i just used the explorer program to move my songs to my player .
192_ 6	negative	well just one con - its not really plug and play at first i mean its very confusing to start the program but one you do it , it will be a breeze .
189_ 9	positive	all-in-all , this is another excellent creative product .
178_ 3	positive	the nomad is not ugly , it is not that big , it comfortably fits in my pocket , or heavy , and the controls are not hard to get used to .
209_ 3	positive	the sound quality is fantastic ( cd quality ) and it is really great to carry this around instead of stacks of cd 's or tapes !
194_ 13	negative	the dynamic playlists ( "" now playing "" , i belive creative calls it ) feels very awkward at times and some menus simply take to long to get to and operate .. .
263_ 4	positive	it is small , unlike my canon slr , so it easily fits in my pocket .
265_ 11	neutral	i have one thing to say to the numbskulls who complain that this camera 's controls are confusing and hard to remember :
182_ 20	negative	the case is strong and stylish , but unfortunately lacks a window ( now a big deal ) .
167_ 1	neutral	the pc quickly picked up on it and attempted to install the software , which failed , as creative chose not to follow microsoft standards , whatever .
282_ 13	positive	one highly beneficial feature of this phone ( at least to me ) is that it can be used anywhere in the world except a few countries that do not use gsm , a few in asia .
227_ 34	positive	there is an alarm , i still havent used it yet , but it should be good .
300_ 20	neutral	i felt that i should write this comment asap , as i am quite excited in using its features .
178_ 0	positive	i just purchased this player and i have to say that i love it .
215_ 54	positive	can 't beat carrying 500-cd collection with me wherever i go .
121_ 2	neutral	not only was i was shopping for a camera that would suit my casual and artistic photographic needs , i had to keep in mind that my fiance wanted to use this camera as well .
230_ 2	positive	great sound , very long battery life ( i routinely play it for 12 + hours ) , very fast recharges rate , removable battery , storage size , nice screen , firmware updates , and great price .
145_ 10	negative	only 1 problem , no accessories ... yet .
213_ 17	negative	about 10 % of the time it can 't find the device when i attach it to my pc .
197_ 10	positive	the zen serves as a back-up device as well as a player .
289_ 0	neutral	like some other reviewers , i recieved this phone using t-mobiles upgrade program .
243_ 2	negative	. this camera keeps on autofocussing in auto mode with a buzzing sound which can 't be stopped .
197_ 19	neutral	the player controls are too easy to hit accidentally .
173_ 59	neutral	the software will convert your cd 's to mp3 and put them on the player as well as your hard disk if you want it to .
256_ 3	positive	i particularly like the way it aids me in taking my macro shots .
274_ 31	negative	apparently , t-mobile is heavily back-logged and can 't keep up with demands .
215_ 42	neutral	recommendations :
298_ 11	positive	i highly recommend this phone to anyone .
197_ 12	negative	only thing missing from creative is a cd burner .
313_ 4	neutral	there are a lot of cool websites with games and midi ringtones to download for free .
226_ 0	positive	i bought the player this week and i like it by far .
288_ 2	positive	and really this is the best phone one could have .
142_ 7	positive	even with these shortcomings , i still think it is the best digital camera available under $ 1200 .
215_ 35	neutral	i would have liked to be able to see what is playing without having to open the case .
303_ 7	neutral	i 've even had one friend buy one immediately after a test drive .
226_ 3	neutral	pro : 1 .
271_ 3	positive	it 's size also makes it ideal for travel .
236_ 20	negative	the one other thing i observed while i had the nomad is that the front cover , which is taken off to have access to the battery , seemed to come undone very easily .
220_ 3	positive	fact is , it could n't be easier to use .
301_ 3	positive	not only is it the perfect size ( not too small , not too large ) , it also has all the features a high-tech phone user would want .
173_ 28	neutral	i purchased the extended warranty ( something i almost never do ) when i returned the unit to get the replacement .
282_ 26	neutral	size and weight :
305_ 13	neutral	people i talk to on the speakerphone are shocked when it comes out at times that i 'm even using a speakerphone .
228_ 13	neutral	i personally am not crazy about the looks of either the ipod or the nomad .
128_ 6	neutral	the little digital elphs were the best-designed , most-elegant cameras until the g3 came along and squashed them .
200_ 40	neutral	for me , that was the only drawback .
285_ 21	neutral	i 'd like a camera phone , but i 'd rather have a phone than a toy that takes pictures but makes no calls ...
208_ 6	negative	1. creative mediasource software is ok to rip , catalog & burn music if you are starting from scratch ; but i used musicmatch to rip my cds before i bought the zen ( 278 cds ; 3,400 tracks ; 12.5 gb of music all ripped at 128bps ) and guess what ?
217_ 8	neutral	i dropped it from the couch , landed on carpet and the cover and battery flew out .
116_ 34	positive	without any tweaking at all , if the exposure is accurate , the colors are as realistic as ive ever seen produced by film , and this is a raw image !
197_ 1	neutral	while the ipod 's form factor is much nicer , here 's where the zen is better .
209_ 11	neutral	whereas some folks have the "" ipod "" , i have the "" nomad jukebox zen xtra "" ( not to be confused with the "" nomad jukebox zen nx "" ) .
273_ 1	positive	there is much which has been said in other reviews about the features of this phone , it is a great phone , mine worked without any problems right out of the box .
285_ 7	positive	i am able to carry it close to my body , in places where other phones are not so easily concealed .
198_ 2	neutral	my cuzin got an ipod and i wo n't say it is an awful product , but i will say that for the price , apple could do better as far as storage and battery life goes .
262_ 21	neutral	i also got a ur-e 4 step down ring adapter , lc-e 900 lens cap , and the nikon 28mm filter set .
210_ 1	neutral	in a quick summation , here is what i found .
153_ 9	neutral	zennx hopefully will gain market share and prompt arrogant apple to lower prices and enable consumers to replace the battery .
227_ 41	neutral	1 .
282_ 10	positive	this phone is one of the few phones that have an fm radio tuner built in .
165_ 3	positive	i found using the supplied mediasource software very easy .
197_ 23	positive	it also lets you remove songs from the play order .
307_ 0	neutral	i currrently have service with t-mobile , verizon , and t-mobile .
200_ 2	neutral	flash card memory vs. hard drive ( i.e. why does a 256 mb player cost $$$...and a 40 gb ( 40,000 mb ) player only cost
170_ 2	negative	however , the creative software is not real intuitive .
307_ 3	neutral	using the gprs option you can pay 19.99 extra a month and have unlimited internet access added to you account .
257_ 1	neutral	i 've been using it for about 3 months now .
306_ 3	neutral	even though they might be smaller many people seem to have alot of problems with them .
146_ 7	neutral	cons :
310_ 15	neutral	the massive phonebook can hold 300 entries , with multiple phone number per entry , so you can program your boss 's home , work and cellphone numbers all under one contact .
116_ 29	neutral	i believe this is enabled by a second file that comes out of the camera that stores all this information .
185_ 15	neutral	so far so good , no problems , no conversions .
153_ 8	neutral	choosing zennx is a no-brainer when factoring in the cost of a new $ 400 + ipod every few years versus the $ 50 cost of replacing zennx 's rechargeable battery .
259_ 2	neutral	do n't waste time looking at anything else , just buy this one .
302_ 11	neutral	but for now this will do .
224_ 26	negative	enough people have reported that their headphone jack does n't work after a month of using the device to believe that creative has some inbuilt manufacturing or quality control problem .
234_ 3	neutral	once again , the sound is awesome , the batterly life is only 6-8 hours , and that is because all my music is 320 kbps which does affect the battery life .
221_ 2	neutral	after using it for a few weeks ( the amount of time before the hard drive crashed ) it revealed a few of its shortcommings .
258_ 15	neutral	in reality , these are the only drawbacks this camera has , much less than many other models !
186_ 15	neutral	30gb is more than enough for most people .
146_ 1	positive	i 've had it for a week now , do n't regret the purchase one bit , and i never leave home without it .
126_ 5	neutral	needless to say , the canon won , hands down .
191_ 24	negative	i was unable achieve a sound quality on par with my simple portable cd player with "" bass boost . ""
274_ 36	neutral	"" when will my t-zones work ? "" , csr :
149_ 1	neutral	after messing with it at a store i noticed how bad the i-pod was .
177_ 5	neutral	i can do that myself .
186_ 17	neutral	it only took me about 10 seconds to transfer a 200mb file .
216_ 1	negative	so , i 've had it for a month , and the headphone jack went out .
202_ 2	negative	its far heavier and much larger which might not seem to matter except if you use it while running or keep it in your pocket .
126_ 9	positive	this camera is worth every penny , and i highly recommend it !
220_ 16	negative	the zen xtra will transfer the files to the player , but not the folder name .
131_ 2	neutral	save them on computer and print out just the ones who want .
312_ 8	positive	but , i would definately recommend this phone .
105_ 0	positive	the camera has a wonderful set of features .
252_ 4	positive	i expected the 12x digital zoom to be grainy , but onfull size high to fine quality , the zoomed images are quite impressive .
308_ 3	neutral	and how can i do that ... .
131_ 6	neutral	the technology is finally here folks , to make your photo life easier .
217_ 3	positive	i felt better with this one since it had the shuffle feature and i 'm not too keen on www.ipodsdirtysecret.com.
258_ 3	neutral	we got a 256mb card , and have been hard-pressed to fill it over a weekend .
249_ 2	positive	after nearly 800 pictures i have found that this nikon takes incredible pictures .
168_ 5	neutral	i 've got 1200 songs on it now and about 4000 more to go .
300_ 13	positive	additionally , it has more fun stuff like more tones , wallpapers , screensaver , stop clock , alarm , java applications ( chess , currency converter etc. )
278_ 4	positive	t-mobile was a pretty good server .
166_ 15	positive	- large easy readable screen
207_ 2	neutral	despite all the hype about ipods , i knew i wanted something different , because i wanted more storage than the ipod i could afford would offer , and because i wanted more flexibility in where i purchased music online .
193_ 17	positive	the buttons are easy to use , and its easy to navigate .
150_ 5	positive	the other controls are all very easy to use .
208_ 18	neutral	was i just unlucky at that moment ?
282_ 28	positive	this is a benefit for many reasons ; one being just for appearance , your pants wo n't be bulging with this phone in your pocket .
170_ 46	negative	i know this unit will have problems in the future and the $ 40 for the 2 year "" no questions asked "" replacement warranty will be worth it , since creative will only warrant it for 90 days - which in itself is totally ridiculous !
140_ 28	neutral	if you 're investing in a camera at this level , buy this software !
283_ 6	neutral	cons :
123_ 0	negative	the catch with the canon g3 camera , ( and perhaps all of digital cameras ) is that its unresponsiveness will cause you to miss precious shots .
186_ 13	neutral	i was able to easily copy 2gb worth of video files from my computer , and then transfer them to a friend 's .
161_ 10	neutral	and since the current language selection was english ( even though i think only the menu supports chinese , and not the track info ) ... all it saw were "" ? "" s and even though the songs had different names in chinese ..
290_ 32	negative	regarding pc software support nokia suite does not work with some versions of xp as i tried to connect my phone via infrared port on my laptop .
208_ 42	neutral	however , it did motivate me to find a work-around solution .
289_ 5	neutral	just make sure the keys are locked .
162_ 15	positive	all other buttons are pretty sensitive to touch and work well .
290_ 8	neutral	overall design :
231_ 0	positive	this is an excellent player , especially for the price , with features that are comparable to and even excel the ipod .
181_ 5	positive	the volume range is great , so you can blast it if you want .
224_ 52	neutral	if you are n't into paying $ x00 to learn and experiment , or the cons outweigh the pros , then wait a year or so .
166_ 6	negative	- the controls are much inferior to the simple ipod ones .
104_ 6	neutral	4 ) the great thing about digital , in general , is that you can generally see the results of your exposure settings on the lcd screen before you take the picture , not two weeks later when you get the film developed .
106_ 4	neutral	do n't get fooled by the 5 megapixel marketing hype .
282_ 5	positive	you can adjust the volume to be heard anywhere or so that it does n't make that big of a disturbance .
108_ 6	positive	the prints are beautiful !
185_ 10	positive	and for those that are intrested the recharger works anywhere in the world ( and is quite small ).
274_ 29	neutral	24 hours ?
162_ 3	neutral	i 'm not sure why people have problems with either the interface of the nomad , or the software that comes with the unit .
267_ 0	neutral	had it for a week .
262_ 2	neutral	and i finally settled on the nikon coolpix 4300 .
215_ 14	neutral	a. the cddb downloads information for the cd that you insert such that you do not have to type in the track information such as album , artist , song title , etc.
290_ 7	positive	the loud speaker function on the 6610 is great because you do n't need to put your phone right next to your ear to talk .
301_ 12	negative	in my opinion the worst issue on this phone is the side-mounted volume control .
