170_ 24	negative	and the case , how did this ever make it out of quality control .
215_ 6	positive	3 ) the nomad explorer ( winxp style interface ) works well to transfer files back and forth to use the nomad as an external although the tech support web-site states that the primary intended purpose of the player is as a player .
193_ 34	neutral	hope i helped !
127_ 15	neutral	highly recommended .
249_ 11	neutral	very large pics take 8mb each !
224_ 48	neutral	none of these are perfect .
166_ 12	neutral	likes
243_ 1	neutral	but there are certain issues might be they are to me here - all of them are minor; not major ones though ,
307_ 4	neutral	yes it is 56k speed , but the functionality is what you are paying for .
243_ 11	neutral	. go ; get a high speed like lexar 12x or higher cf card .
270_ 8	positive	7 picture quality is excellent .
228_ 5	positive	the software interface supplied was very easy to use but i went ahead and got red chair 's "" notmad "" software because of some advanced features i wanted .
237_ 7	neutral	and then it just froze and now i 'm out $ 300 for their piece of junk .
218_ 2	neutral	now i have to return it and rip all my music again .
301_ 2	neutral	i have used this phone for two months now .
167_ 6	neutral	well , maybe that particular song was just corrupt , so i tried to upload some of my own , after four attempts , at each one the unit locked up and required a reboot , i managed to upload an album , which albeit was surprisingly fast , however when attempting to create a playlist out of my newly uploaded songs , the nomad again froze up and refused to work .
123_ 15	neutral	perhaps there is a way around this delay .
197_ 34	positive	its ability to serve as a back-up for my music collection is a huge plus.
207_ 16	positive	i 've played around with the equalizer settings and am satisfied at the range of choices i have there too .
173_ 72	neutral	i did buy separate headphones as other have recommended .
123_ 21	neutral	it focuses in a snap .
123_ 19	neutral	but after trying many adjustments , the camera remains unresponsive when compared to any film-based camera .
155_ 6	neutral	i will just say this :
282_ 29	neutral	battery life :
276_ 0	neutral	i 've had an assortment of cell phones over the years ( motorola , sony ericsson , nokia etc. ) and in my opinion , nokia has the best menus and promps hands down .
214_ 4	neutral	within months they stopped supporting the new mac os .
164_ 2	neutral	just before we all spent a couple weeks in an rv together .
208_ 54	neutral	i am using musicmatch to rip & catalog ( and if i choose , download ) music ;
224_ 12	neutral	synchronizing music among computers , if you have more than one , seems to be an issue ; research this before buying if you have multiple computers you want to be synchronized .
116_ 15	neutral	for those who have this metz flash ( or the 45cl-3 ) and would like to get the absolute ultimate quality out of this g3 , the metz module you need is the sca 3102 and the connector cord is the sca 3000c .
164_ 3	neutral	the ipod is a neat piece of machinery but after screwing around with both of them i think the zen products are the way to go .
305_ 4	neutral	people have paid me money just to borrow it because its so elegant .
116_ 9	positive	what makes the focus-lock lag time something i can live with is the extreme depth of field obtainable with these point and shoot digicams at f8 .
208_ 37	neutral	i did that and re-installed the software but had the same error .
270_ 4	positive	3 it is very compact but the controls are so well designed that they 're still easy to use .
170_ 20	negative	seems it is always difficult to press to make a selection .
224_ 1	neutral	if your view in life is that you are going to pay $ x00 to get a device then it must be near ideal - ruggedly constructed , fault proof , good product support , easy to use software - then do yourself a favor and do n't buy yet .
215_ 46	neutral	4 ) a set of speakers and a wireless transmitter are accessories that will add to your player 's usability ( the latter will allow you to play it on your car radio , home receiver , etc. )
274_ 37	neutral	"" i 'm not sure "" . ) .
161_ 24	neutral	there 's a dent on the upper-back-right and lower-back-right corners ... not too obvious unless you 're up close .
243_ 8	negative	. images taken indoor were n't so clear .
193_ 29	negative	i forgot , the case does n't fit .
113_ 5	negative	the zooming lever is shaky , i hope it does not operate mechanically , otherwise you 'll feel uneasy .
282_ 34	positive	this phone has many other features , ir , ; just to name one , the features above i view as the most beneficial .
137_ 3	neutral	( 2 ) there are , actually , several differences between the g2 and g3 , such as differences in continuous shooting , the optical lens , the control layout , playback zoom , image processing , and so on .
256_ 6	neutral	i assume this is the case for most cameras since it does not have enough power to do autofocus .
262_ 3	positive	i have it for a week now , and this camera has exceeded my expectations .
157_ 6	neutral	come on, at $ 300 they could at least put in a good pair of earphones .
177_ 1	neutral	most people probably wanted the ipod before realizing that a vast array of full-featured viable alternatives exist .
217_ 12	neutral	it overrides songs so you have to go in there and put it your own titles especially if you have remixes .
309_ 18	positive	other than that , this is a perfect phone for those of us with no patience for flips .
197_ 30	neutral	i think the ipod versus zen typifies differences between apple and win machines .
181_ 6	positive	overall , this player is awesome and i definately recommend it .
226_ 2	neutral	here 's something you have to know before you considering about buying this one .
173_ 58	positive	i found it intuitive to use ( i did n't read any documentation for it and was using it successfully within a few minutes ) .
262_ 19	neutral	i bought a digi-slave dsf-1s flash unit .
221_ 11	neutral	the flap completely covers the screen because there is no window to see it .
186_ 20	negative	navigation system - the zen xtra uses id3 tags that are embedded in the mp3 files to organize your songs .
222_ 17	neutral	this is nothing new , every mp3 player , memory card , etc. , used for digital media today has some kind of preloaded operating software on it .
254_ 5	positive	just point and shoot and the photos were great .
143_ 1	positive	proven canon built quality and lens .
200_ 0	neutral	i purchased this mp3 player just last night after doing some scouting around .
186_ 9	neutral	this would have been much easier .
204_ 2	positive	i am ripping my cd collection into 160 kbps wma files ; this gives an average of around 60-65 mb per cd , good for about 900 cds in the ~ 57,000 mb of free memory available to me .
232_ 4	negative	do n't buy this player .
269_ 7	neutral	a card with more memory is a must .
308_ 5	neutral	...
239_ 7	positive	comes with a 16 mb compact flash and one rechargable battery the charging unit , included , is fast and small .
276_ 4	neutral	wish it were a flip phone , but thats not a deal breaker !
186_ 60	negative	it is a bit cumbersome , and i can 't get to the songs i want as quickly .
227_ 42	negative	the one and most major thing that i was dissapointed with , in this player , is the battery life .
108_ 2	neutral	at the same time , i wanted my wife to not be intimidated by knobs and buttons .
272_ 1	positive	the same 4mp chip from the 4500 camera , plus a 3x zoom with the ability to expand upon that with extenders , great closeup mode , long lasting rechargable battery , etc etc.
290_ 20	neutral	the nokia , samsung and the sony phones can all last for 3 days provided you do n't talk too much .
214_ 1	negative	i purchased a jukebox , it got fried while being recharged , they asked for $ 20usd just to look at it and said that they would charge me for repaing the damned thing .
283_ 0	neutral	i love the pros and cons reviews so here ya go :
207_ 18	neutral	it ships with a carrying case that has a belt clip on it .
184_ 0	positive	i 'm very pleased with my zx so here 's a quick review .
123_ 35	neutral	so buy the g3 .
115_ 1	negative	it was ( i sold it after a few months ) too expensive for the shots that i got .
129_ 2	neutral	i wanted something that is able to take high quality photos but not be so bulky that i would wind up leaving it at home all the time .
162_ 19	negative	sure , it 's a little bigger than the ipod , but not by much .
177_ 9	neutral	however , if anyone has participated in violent or extreme sports while using their zen , please share your experiences .
252_ 5	neutral	did buy a 256mb compact flash , it holds a lot of pics at any resolution .
195_ 6	neutral	it 's only slightly heavier than the ipod , and has a longer battery life .
224_ 19	neutral	the zen has a detachable face plate that allows the battery to be replaced .
268_ 10	positive	ooh , and i dropped it and it still works fine : this little camera has so many features i have n't even gotten to all of them yet .
184_ 1	neutral	first there 's the unit itself .
186_ 11	positive	i found it very useful for transferring large files to another computer .
184_ 5	positive	the scroll wheel is easy to use and works great for me , however many have complained that the wheel is cumbersome and difficult to operate .
273_ 8	positive	the infrared is a blessing if you have a previous nokia and want to transfer your old phone book to this phone , saved me hours of re-entering my numbers .
145_ 0	neutral	before i decided to get this player , i did my research .
194_ 11	negative	rather than creating a directory for bookmarks to be found in one area , the user must actually find the track where the bookmark was made . .
129_ 9	negative	you can see the lens barrel in the view-finder .
125_ 14	negative	it had a heavier and more sturdy casing .
297_ 4	negative	its quiet .
258_ 4	neutral	the only drawbacks that i have noticed :
123_ 8	negative	it sometimes takes the picture at some indefinite period of time after you press the shutter button .
167_ 2	neutral	i then installed the software manually instead , after having to click past about 5 windows of "" please register with us so we can spam your inbox "" .
300_ 0	neutral	i considered this phone ( nokia 6610 ) , mainly because of my sister and the features .
208_ 39	neutral	i followed their advice but that failed , too .
274_ 28	negative	i must have heard this about a dozen times over the span of 2 weeks , when t-zones never worked .
158_ 13	neutral	my personal favorite is the karma ( i currently own a karma , a zen usb 2.0 , a philips hdd100 , and an upgraded 60 gig archos jukebox recorder ).
197_ 33	neutral	if i had to do this again , i might get the 40gb zen .
194_ 10	negative	bookmarks for example , are an excellent feature ... but not on this player .. .
115_ 14	positive	the camera was a marvel .
132_ 2	positive	however , for a $ 600 - $ 800 budget , i think this camera is an excellent choice .
292_ 1	neutral	we got a familyplan from t-mobile which saves us tons .
307_ 6	negative	the only problem that i have found with the internet service is that it does not access mls ( real estate broker software ) very well at all .
274_ 26	negative	also , their t-zones , although cheap ( $ 4.99 / mo. ) never works .
309_ 3	neutral	my sister has this series of phone and she loves the radio and headset .
217_ 13	negative	also the feature to automatically put in the song information is n't always accurate .
213_ 24	positive	i did buy the notmad software a week ago and found that a vast improvement .
227_ 37	positive	the player has firmware , which will remove the glitches , if there are any .
136_ 21	neutral	they got the best lens adapter for the g3-better than canon 's .
192_ 1	neutral	so then i came across the ipod ( 10 gb ) .
266_ 5	positive	the design and construction are excellent -- as is the legendary quality of the nikon optics .
182_ 5	positive	- the unit is easy to use and intuitive .
122_ 0	positive	the powershot g3 is a great camera .
289_ 8	positive	the keys are laid out normal so there is no guessing .
273_ 7	positive	the speaker phone is very functional and i use it in the car , very audible even with freeway noise .
311_ 3	neutral	one of the things t-mobile brags about is the fact that it 's a "" worldphone "" and can be used in europe , etc.
143_ 2	positive	feels solid in hand .
304_ 7	positive	great phone , easy to use , excellent network , no regrets ! ! !
140_ 6	positive	the moveable lcd screen is great .
186_ 21	neutral	this is great as long as all of your music have id3 tags , and if you 've downloaded your songs off the internet , many probably do n't .
145_ 4	neutral	that takes up half the space of mp3 's .
274_ 3	positive	here 's the brief synopsis : the phone is tiny , cute , feels kind of "" plastic-like "" ( as if it might break ) , but seems pretty sturdy .
243_ 13	negative	. the movie clips taken will always have some ' noise ' in it - you can 't avoid that .
309_ 5	neutral	i do n't really like bounce .
104_ 2	positive	excellent range of metering options as well .
221_ 13	neutral	after the first one fatally crashed , the replacement did not work .
134_ 23	neutral	good points :
175_ 13	neutral	after installing it and trying to make it working for 30 minutes i went and bought notmad .
119_ 15	neutral	i can of course buy such a tool off the shelves separately but helps if it comes with my camera .
229_ 13	negative	the front cover can pop off easily but i always have mine in the case so i did n't notice after first day .
138_ 2	neutral	after charging my card for the camera and for expedited shipping , 5 business days later , they still had n't shipped the product .
173_ 65	neutral	you can edit the genres once the songs are on the play if you decide to re-classify things later .
165_ 11	positive	the sound quality with jazz and pop music is equally superior .
215_ 8	positive	4 ) usb 2.0 means fast data transfers ( 1 song / sec ! ).
310_ 21	neutral	their website does not show it as a compatible phone , and should i try to access the game downloads on t-zones the system returns an error message saying my phone is not supported .
173_ 54	neutral	sometimes you skip past things or have to press it twice to select items .
187_ 12	neutral	well that was not a simple task .
200_ 28	neutral	the software lets you pop in a cd and then scans the internet to name the artist , track name and album name .
157_ 14	positive	compared to everything else in this category , this is most definately the best bang for the buck .
227_ 28	positive	battery recharge , is an awesome thing , because it recharges in only like 2-3 hours .
130_ 0	positive	best camera ever . from the image quality , color , function , i can say almost everything .
309_ 10	neutral	ok , everybody loves the fm radio in this , but you want a cell phone first , right ?
186_ 69	neutral	you can cut up the case a bit with an xacto knife and make it useable though .
265_ 3	positive	picture quality in outdoor settings is indistinguishable from 35mm .
201_ 5	positive	but it comes with a tank of a case and if you cut a piece out where the screen is you can always keep it in the case and still access everything .
213_ 18	negative	after i had it a couple weeks , it got into a state where it could never find the device , no matter how often i rebooted my pc , reset the device , reloaded drivers , etc , etc. creative 's online support was no help at all .
175_ 5	neutral	one thing , before buying this player i have called the creative tech. support and asked them if i can navigate by folders beside artist / album and answer was yes .
310_ 12	neutral	no more annoying series of beeps .
109_ 6	positive	but if you 've used a slr 35mm camera , the controls are very intuitive !
170_ 32	neutral	the files are there , but i could not access the player without removing the battery , waiting a short period and re-inserting the battery .
274_ 49	neutral	hope someone else has better luck !
216_ 5	neutral	what kind of product goes out within a month ?
186_ 54	neutral	a sliding old fashioned volume knob would also have been easier than the digital version that was included .
290_ 10	neutral	of all these phones the motorolla and the sony ericsson phones are the smallest .
203_ 16	negative	-- > too difficult to change genre / album / track information for large number of tracks .
158_ 10	neutral	advertising pays off i guess .. .
218_ 3	neutral	good thing i got a replacement plan .
220_ 23	negative	in fact , it caused my system to hang more times than not , so i uninstalled it and stuck with mediasource 100 % .
220_ 25	neutral	get one now !
254_ 1	positive	the software that comes with it is amazing and the online service that comes free is really very neat. clean clear and well focused on over 95 % of all photos taken by a beginner .
213_ 23	neutral	that does n't leave me with a good feeling about its future stability .
155_ 23	positive	i have over 2000 files in my playlist at the moment and the random does a nice job mixing it up .
193_ 2	neutral	what a big improvement ... lol ) and the fact that lots of people have had problems with ipods on windows computers , i realized this is a much better buy .
111_ 6	positive	overall it is the best camera on the market .
215_ 45	neutral	3 ) use files with id3 tags - not a problem if your cds were ripped within the last year .
107_ 2	positive	i began taking pics as soon as i got this camera and am amazed at the quality of photos i have took simply by using the auto mode .
120_ 0	neutral	i love my g2 so thought i would upgrade .
236_ 29	neutral	most people say buy an ipod , but they are pretty expensive and also require you to send the product back to the factory just to replace the battery .
116_ 39	positive	i am stunned and amazed at the quality of the raw images i am getting from this g3 ( in conjunction with my professional flash system ) , and can easily put up with the cameras limitations , because ive never seen anything better within its resolution limits .
150_ 12	positive	they 're pretty comfortable , stay in place and deliver a decent audio quality .
256_ 1	positive	this is my first digital camera and i can say that i am quite impressed with the features that it has .
236_ 11	neutral	usually around the time the 90 day warranty expires .
304_ 6	neutral	worth every penny !
287_ 7	positive	the fm radio is cool .
249_ 3	positive	the digital zoom takes as good of pictures , as the optical zoom does !
290_ 37	neutral	personally i like the samsung phones better because i found myself liking the flip phones so much more .
237_ 5	neutral	it worked good for a while .
208_ 43	neutral	third party software to the rescue
243_ 3	neutral	would be really good if they have given an option to stop this autofocussing .
115_ 23	neutral	sure .
270_ 11	positive	10 great price for all the features .
226_ 17	neutral	a tons of reveiws has reported this problem and the same here .
161_ 25	neutral	hehe , my bad .
155_ 25	neutral	now i can transport files to friends house with ease .
147_ 0	neutral	for me the sound of the music is what is important .
285_ 1	neutral	after having had my heart broken by a sexy piece of hardware that simply would n't perform .
313_ 3	neutral	i do recommend getting the data kit for those geeks .
200_ 22	neutral	the device is larger than an ipod of similar capacity .
310_ 18	neutral	you can get weather , movies , horoscopes and more with a few clicks .
249_ 8	positive	touchups , redeye , and so on are very easy to alter , and correct .
115_ 22	neutral	me , i am going with a leica minilux ( the g3 was replacing mine which was stolen ) .
306_ 10	neutral	every t-mobile plan comes with gsm data , meaning that instead of speeds of 56 kbps is around 9 kbps ( with those small size wap websites do you really think it makes a difference ) .
210_ 13	negative	- the cover that came with it did n't fit very well
263_ 5	neutral	i have not yet figured out how to make it snap quick pictures for action shots .
155_ 30	neutral	in fact , my boyfriend is now going to invest into one of these suckers as well ... now he realizes that this is the best choice over his current archos and the ipod he was eyeing .
227_ 27	neutral	7 .
309_ 7	positive	battery life is good for a phone of this size .
173_ 18	neutral	i believe the napster mp3 player has this feature .
215_ 52	negative	not plug & play ; relies on id3 ; no fm or recording
218_ 13	neutral	looking at the glowing reviews from people that have had this for a week or two , i kind of wish people would wait until they 've had a product a little while to review it .
155_ 1	neutral	i was in search of a new item to take it 's place as my new mp3 player / harddrive .
242_ 11	neutral	i used lexar 256 mb and i still use it which means nothing is wrong with lexar .
186_ 32	neutral	the top of the player is a thin metal piece that covers up the battery and is removable .
202_ 0	neutral	granted this is cheaper than an ipod .
161_ 17	neutral	in two transfer batches ( first was english songs , then foreign languages ) , it did n't come up with any errors ( aside the duplicate name i mentioned ).
235_ 0	negative	what a junk .
134_ 13	neutral	for those who are used to brass cameras that can be dropped , picking up a camera like the g3 is an unnerving experience .
234_ 18	neutral	honestly , the best players without any flaws were the goddam cd players .
134_ 27	positive	the image quality is excellent .
278_ 7	neutral	you have to buy better ones .
161_ 0	negative	first , the cons ... a tad bulky ... not the most asthetic looking player ... and does n't support a folder stucture .
277_ 13	neutral	i do n't use the vibration , because it is often easier to hear it vibrate then to feel it .
105_ 9	positive	it is a fantastic camera and well worth the price .
191_ 10	neutral	i have my mp3 's stored on my workstation .
258_ 7	negative	it does not have an auto-focus assist light which is nice for taking shots in low-light situations it allows the camera to focus in low light .
224_ 45	neutral	otherwise feedback seems to be good .
170_ 29	positive	despite the things that i have listed so far , i could live with this item since it saves me from lugging a cd case to work , to the gym , in the car , etc. .
228_ 1	positive	with 40gb of storage i have about 7,500 songs on the player ( everything music file i have is on there ) with room for about 2,500 more .
220_ 1	positive	the combination of the price , storage size , and player features makes this player the best on the market .
229_ 11	neutral	it 's horrible .
193_ 12	positive	oh ... and file transfers are fast & easy .
175_ 9	negative	you even can not navigate by genre / artist / album since under genre you get just all tracks in that genre , no other division .
173_ 47	neutral	one word of caution with regards to using the nomad with itunes .
200_ 21	neutral	review of zen xtra - 40 gb
184_ 10	positive	the software has n't been a hassle for me at all .
206_ 0	neutral	i 'll state up front that i do not own a zen xtra and have not used one at all .
211_ 0	neutral	i spent much time debating on whether i should go with the zen xtra or the ipod .
123_ 25	neutral	i challenge anyone ( who is not in direct sun at the beach at noon ) to say it is fast and responsive .
277_ 12	neutral	it is a teeny phone , so it is hard to put a big mechanism in .
216_ 3	neutral	it 'll take 10-15 business days for them to decide form when they get it .
202_ 7	neutral	while it is an alternative to the ipod and one of the few viable ones its just that , an alternative and why would anyone seek an alternative to something that really needs no alternative choice because theres nothing wrong and everything right with it .
158_ 3	neutral	this puts the zen in line with players like the rca jukebox and the whole line of archos players ( the newer ones are a bit better than the original archos jukeboxes ... but i popped out the drive in my 20 gig jukebox recorder and put in a 60 gig drive and use it exclusively as a powered portable usb 2.0 drive ).
210_ 12	negative	the top did not fit well into the unit . ( felt defective )
224_ 2	neutral	all the products have drawbacks and are not mature yet ; if you expect value and reliability then wait a while .
247_ 7	positive	i experimented with online print ordering with the two major us brick and mortar retailers , and they both delivered great results .
191_ 18	neutral	sure it 's "" old school "" to carry a cd wallet around , but it will be easier to manage and i 'll save around 250 bucks .
219_ 0	positive	i loved this product when i first got it - great sound , easy to use ( even though i agree that the software was n't the best ) and held enough songs to suit any mood .
200_ 14	neutral	this explains why you see what appears to be such weird pricing on mp3 players .
133_ 1	positive	it surpasses my greatest expectations in a 4mp camera ..
162_ 17	positive	but i 've already emailed creative tech support about it , and gotten timely responses - they will fix it for me if necessary .. .
166_ 2	positive	all reviews i 've seen seem to indicate that the creative mp3 jukeboxes have the best sound quality of these 2nd generation jukeboxed ( ipod , archos , dell , samsung ) .
209_ 12	neutral	minor gripe .
127_ 5	neutral	i 've been able to change modes on this thing without even looking at the manual .
253_ 2	neutral	in the end this is the one that we decided upon and since have never had buyer 's remorse .
151_ 8	negative	the face-plate , which pops out for the battery , pops open by itself every 10 minutes or so .
221_ 3	negative	first , the sound quality is okay , but ( as at least one other reviewer has mentioned ) the eax can cause audio interference after about 30 minutes .
108_ 4	neutral	i showed her how to turn it on , where the lens zoom lever is , and she loves it !
