261042742375886848	negative	You may think I have mono-cellular Zulu imbongis at the rate some of these folks are thrown profanity at me.
100215051369189376	neutral	I'm going to Machine Head at Sala Razzmatazz in Barcelona, Spain - Nov 15 http://bnds.in/qMyg7H
264002665674076160	positive	@alxbyr I'll be in cypress tonight and tomorrow night! I better see you!
263452393675567105	positive	@kadecudi_nova @keriilynnbabe well then, have fun not trick or treating. I'll be in br doing it Wednesday, and Thursday in Zachary. BITCH.
100017301675442176	negative	We will explain the true cause of the London riots on the front page of The Sun : immigrants. 'Hero Police' will also get a headline.
263802618697105408	positive	@sheemalv Hey mom! I'm done with Eng so going to hand it in soon & got about 500 words to go for His & handing it in tomorrow! :-)
263972743010209792	positive	Oh an I also picked my starting XI for the 1st Bangla Test on @wicricnews site. Couldnt decide between Fidi an Tino! I like Fidi tho lol!
101935066871103488	neutral	Bolton Society for Blind People are bringing Vegas to Bolton with a Charity Dinner on 23 Sep http://t.co/4mvokMM Please RT xx #BSBP
260033791786090496	positive	Hi, Memi! Thanks for agreeing to lead at SAG!  Would you be available for a Sun., any Sun, in Dec rather  than Nov 4th?  I just learned  ...
263376518372270080	positive	Hello everyone.Tuesday night like always Beef Kabob special it is DELICIOUS,Acoustic open Mic with Brian Ruskin... http://t.co/aaovO85i
263091795687247875	positive	Ok guys. Hate on SJP all you want, just remember, you have school tomorrow. #havefun
263081234824065024	neutral	@dogzillahotdogs will you be at cypress tomorrow night?
101934137597902848	neutral	@TheBoltonNews Pls RT - Bolton Society for Blind People are bringing Vegas to Bolton with a Charity Dinner on 23 Sep http://t.co/4mvokMM
263704789186117635	positive	Just watched The Campaign with Will Ferrell and Zack Galafianakis... Good fun for a Wednesday. #Hilarious
264072672131043329	neutral	It's Nov 2nd, at mumbai int'l airport with @BeingPiper . Leaving india in 2 hours. Mixed bag of feelings. #timeflies #bittersweet
105363020154273792	neutral	Storms are starting to pop. Storm motion today in Tampa Bay is NW at 10-15mph so if you see dark skies to your SE...
261268285599907840	neutral	@alfredoflores follow @amandawanxo and meet her on NOVEMBER 26, she'll be at the bell center by 4:00 pm. PLEASE FREDO.
215721495635312640	neutral	Gary Carter on 2nd screen: content is floating free from the distribution platform. Opportunity for producers, threat for broadcasters
175148081329881088	positive	Happy birthday @justinbieber ! National Bieber Day . Now he's 18th years, but he's #stillkidrauhl #IndonesiaSaysHBDforJustinBieber
255622566180421632	negative	News Release 09 October 2012  Customers of the Negros sub-grid experienced a partial outage today at 5:45PM (cont) http://t.co/TLekrZox
100156280366313472	positive	@peterfacinelli Good luck tonight @ The Teen Choice Awards :) i know Twilight is gonna take them all!! Ill b watching Xoxo
100259743922262016	neutral	momma goes to bama tomorrow , but  i am going over to Mackenzie 's house later <3  #momyoubettagetmethatshirt (;
262265674108387331	positive	Listening Bear McCreary Battlestar Galactica' OST makes me wanna see this amazing tvshow again. One day I'll see it for the 4th time :P #bsg
263853498293182464	neutral	Los Poboycitos debut 2 songs from the forthcoming CD tomorrow on WWOZ 90.7 FM New Orleans at noon CST.
241086519987822592	neutral	Syrian delegation withdrew from 1st session of the Non-Aligned Movement summit in Iran as Mohamed Morsi addressed #Syria crisis
100636787885604865	positive	I have to start packing tomorrow for Auburn just so I won't forget anything Saturday morning.
256148305791315968	positive	Thanks! @BSU_StdtAff: Join Dean @PaulaKrebs on Tues 10/16 from 4-5:30 in  BDR for the Dean's Q-Tea in honor of Nat'l Coming Out Day #bsulife
179922664423555072	neutral	All humans are entrepreneurs - Reid Hoffman in "The startup of you" http://t.co/epGAY1r0
263238337303805954	neutral	LPG consumers can now fill up KYC form till Nov 15: The government has extended by 15 days the deadline for filling... http://t.co/tGzJfMUi
103114993733599232	negative	Nurgh, there's a stack of new MTA's that need to be dealt with but I just can't be dealing with the crappy new URL thing today D:
218544341084409857	positive	Ooshma Garg started her 2nd successful company, Gobble. Watch how she got to one of her biggest investors--Reid Hoffman http://t.co/VhEHDU3y
264199647298465793	neutral	I may or may not be in love with Carrie underwood
263217815333511168	neutral	@David_MD1 free trial of NBA league pass until nov 7th check it out on http://t.co/slVLa2Ky
235176287101124608	negative	I reckon in 6 years time I'll be in with a chance of fucking Pixie Lott if I bump into her on a night out. Rohypnol may be required.
261355878995881985	neutral	#SteelerNation send our boys 2 the 2013 NFL Pro Bowl. http://t.co/qEEV2G4c via @NFL Ur vote actually counts, unlike the Nov 6th election.
264255254164561921	positive	Cant wait to move to Hawaii this Saturday! Promotion, New townhouse, new car & with myKING... Definitely a happy girl :)
261861758631813120	neutral	Anne Curtis and Toni Gonzaga, all set for the grand showdown of beauty and talent this Sunday http://t.co/T0xqu2p9 (via @lion_heartv)
264182339536564227	neutral	@SteveRattner @JoeNBC @morningmika My friends and I are betting Joe wets his pants when he sees the whopping Mittens will get Nov 6
263865671996305408	neutral	Watching Act of Valor for about the 17th time. But who's counting
264097575395794944	neutral	Top TEN strikers who are on the Premier League's January wishlist http://t.co/BBN99w2D via @FootballFanCast
100109032043458560	neutral	if I DO get the pjob in bristol at espn all yall gotta come party with me before i leave.  I would let yall know asap. and the night before
242619751946399744	positive	So glad I'm not going back to Woodlands tomorrow! Looking forward to Joseph Wright!
249394368249737217	neutral	Aussie Directioners. Do you want to win a prize of a lifetime? Then listen to @nova969 on Monday at 7pm.
100757078703996928	neutral	@TerryFoster971 No one on the Lions has gotten injured today since Leshoure! Contract extensions all around! #bam
264246894358843392	neutral	@jazzpastord back to AZ? Won't see you Sunday then?
243311668459868160	neutral	Wednesday's Laugh:  ESKOM:  A little old lady answered a knock on the door one day, only to be confronted by a... http://t.co/MmwqsXvh
258597230662017024	negative	All the people seeing Noel Fielding tomorrow, I am extremely jealous of you.
100397196851159040	positive	@D_DeGea The 1st half goals was just to tell you how it is in premeirship.you really did your very best and #teamunited from Nigeria loves u
261119659175206912	neutral	SimCity delayed, now erecting on March 5: If you were thrilled by the recent lenghty demonstration of SimCity or... http://t.co/d36Xfkgd
262969965513150464	positive	I have tkts to see Plan B next Feb- he has already announced his support acts- Labrinth and Rudimental!!!!this news has made me tres happy
251789469034881025	negative	Friday's CNET Update is playing One Republic : Apple CEO says sorry for iOS 6 map mess Apple CEO Tim Cook has said he was "extremely sorr
264214590869618688	neutral	Bashaara Graves had 17 points and 15 rebounds in her debut with Tennessee in an exhibition game on Thursday. She played 23 minutes.
257281041755148288	positive	@SeymoreCAKE @jmause3 at least there is hope coming around February. I'm looking at a team where JR Smith is the X-Factor.
262319079690473472	positive	@muse, @russellhoward AND @kylieminogue all on The Jonathan Ross show tonight = Terrif sat night in! Well done @wossy. #Toofunny
263533649285218304	neutral	Gadkari on attack mode, says ready for any probe: BJP president Nitin Gadkari on Wednesday took on the Congress ... http://t.co/4t4Zq7eg
264215144308019200	positive	@bruce_arthur Some of the Calgary runners heading to NYC are going to be cleaning up debris on Friday at Rockaway Beach. Great story.
262664925363720192	negative	Porto are the only team letting me down! C'mon boys turn this around
263461390172442624	neutral	Baby stroller sale: Safety 1st Boost Air Protect Booster Car Seat, Dixie with cheap coupon code http://t.co/9SQzUYfV
260856177297084416	positive	Just wrote a great song with Mitch Daniels! Really looking forward to performing it with him on Thursday! :)
247259120208601089	negative	IEBC is ready for 4th march elections, the electoral body should not be used as an excuse to delay polls says Chairman.
104259397148094464	negative	Big Brother starts tonight and X Factor on Saturday, wish I could emigrate or hibernate :-(
262744624798511104	negative	but my bday is tomorrow and i have to spend it in Natchitoches away from my family<<<<<<<<<<<<<<<
248370653286240256	positive	hoping Rob Elliot gets his chance too,as much as I love Harper, he was clearly off pace on Monday,Krul would have seen us win 2-0 #nufc #UEL
264122650719305729	positive	I love Asia, she's the first friend I made down here in 7th grade.
251611622672588800	positive	Funny you should ask @BlueNunUK We will be @ the Leicester Square Theatre on October 10th at 9pm performing our Edinburgh show4a final time!
100335210192834562	neutral	Longline bras hurt to dance in, I can drive in wellies, a white haired man has never left the #iom, merlin was a saucy old sorcerer. Night.
108262556258402304	neutral	RT @Drofdarb23: Damn. Who becomes the 3rd back, Ajayi?  RT @IDS_BroncoBeat Boise State RB malcolm Johnson tore ACL in practice yesterday.
176609456359084032	positive	Watching The Kandi Factory with Viggle Mon | 3:30PM | Bravo HD  Get real rewards just for watching TV. #TheKandiFactory #viggle
263810015364796418	neutral	Don;t forget to go the CVS tomorrow and get the Viagara. We both know you need all the encouragement you can get!!!Dreams and Visions boo:(
102644742105481217	negative	The MTA should cost less at night. I think I waited more than 45 minutes. And it's pretty freaking hot underground. Thanks. #nycproblems.
264019492508663808	positive	@RiriSpice19 @givemethat_beca @white_choc0lat3 @stephy_T073 @onthenikdrum GO BORO!May the FORCE be with you from the 1st second to the last!
264248326914994176	positive	Every Thursday I go to Jesse Black in Casselberry, FL just for these girls http://t.co/brntAu0S
263854404371890179	positive	I'm so gonna snatch up all the leftover #Halloween candy at CVS tomorrow #letmeloveyou
250396367221055488	neutral	@dantencer Oct 17 it will be mostly dead but mostly dead is still a little bit alive!! (Billy Crystal the princess bride)
257972912525565952	neutral	I'm going to Geoff Tate at Backstage Live in San Antonio, TX - Nov 21 http://t.co/nCSYwONM
110375430309154817	positive	Four Lions. Watch it on Channel 4. Tonight. At 8pm. Best film ever. I have this on my IPad. Never tired of it.  http://t.co/7I6OapX
240656828025954304	neutral	Vanilla Bean Ice Cream Sandwich with Chocolate Ganache - Chandler May http://t.co/IKn0OhVH
242334694107127808	neutral	Aged under 26 and keen to become a foreign correspondent? Apply for the Marie Colvin scholarship http://t.co/1NwsQSam
100197762838171648	positive	RT @JRathboneFB: RT @PezTheDrummer: Photo: Mr. Jackson Rathbone (aka Jasper from Twilight) was looking MIGHTY fine tonight http://tumblr ...
262675141434146816	positive	#cricket Pakistan hopeful of Bangladesh visit: Pakistan's cricket board said Sunday it hopes to arr... http://t.co/8MzuvYdd (f ahsaan4u)
264113934712311808	positive	@lovinjakemore You bet! And @chuckonthewolf & I will have Best Seats in the House on Mon.
100970722079412225	negative	Are you waiting for Nokia N9 getting released in US... well, that may not happen.  :(  http://t.co/0OmuJpN
263506758625005568	positive	@JacqDowling @CougFanTMB I finished 1st in a Bowling 101 class of 50 that included members of the Bowling team... You're totally effed.. :D
250996010116075521	neutral	As reported Jason Varitek is close to taking job with #redsox, may be special assistant to GM Ben Cherington. #redsoxnation
264218771525349376	negative	Anyone going to the Romney rally in Fairfax on Monday?? Really wanna go, but no car. Help!? @TeamRomney
251772993867497473	positive	Field trip to October 12! Breakfast at Jungle Island,meet Deca members from other schools and find out what Deca is all about :)
234095151654514689	positive	@NEstaCKs it will be good for hoop so get ready dec .25 u kno we will c LAKERS vs Heat
259325173944176640	neutral	Mike Dean will be the Referee for  the London Derby game tomorrow. Chelsea without John Terry and Martin Atkinson might struggle. #COYS
258291537073565696	negative	@ChrisLong88 look at the countries we're playing, we were 6th seeds. Also we're missing Ched Evans, Bellamy, Ramsey, Collins etc etc!
263825455369564160	neutral	Anyone going to volleyball game tomorrow?
264162567532998656	positive	@Ronnie2K Can you guys please update the schedule in the association mode so that the Knicks can play the Nets on November 26th. Thank you!
204001339599106048	neutral	Cofield draws leadoff walk in top 4th. Zaharion at the plate.
195829912425340929	neutral	Watch out for @wendytabusalla together with Divine, Deniesse and the BIG4 at the Pacific Mall Legazpi Landco Plaza on April 30, 6pm.
100001174920511489	negative	Criticism of Rick Perry is ridiculous, which choice?  Obama's hip-hop barbecue two days ago, or Perry praying for the President today?
264192843453693952	neutral	@DWilburr1 a dance December 8th, for all the cheerleaders in the district at East.
262000074672963584	neutral	Not hard to figure out the value in this offer...Mathnasium is offering a free  "Mathing" Workshop on Sunday from... http://t.co/JCUiFD2n
259393259317649408	positive	@tokyoeyepatch But trust a DJ who's giving away TRIKSTA - all about N.O. rap scene [Choppa] on Gumbo Monday 7PM #fundingdrive2012! Bounce!
103250367646674944	positive	RT @TheNewDeal: WISCONSIN: Remember to Vote Tomorrow! Consider it Practice for Recalling Walker. Practice Makes Perfect. #WIunion #wirec ...
261641728426127362	positive	This "Too Cute" puppy show on Animal planet might just be the greatest thing ever. I may never leave my room. #HomeworkCanWait
264157010679967744	positive	On Election Day, November 6 MDC WILL be having class as a make up day. We will see all of our Dance III lovelies then!
105739077680250880	neutral	#UFC @JesseSeedath Yushin Okami isn't just Anderson Silva's opponent Saturday night - he's the only... - http://t.co/pRafGi5
258206123360911360	neutral	You may feel you're alone, But I'm here still with you. You can do what you dream Just remember to listen to the rain ~by: Amy Lee
263001604255514624	negative	I'm going to the Duke game on Saturday. Haha. DUKE. What'a joke they are.
256767050364633088	neutral	Guy sat opposite me on the train is the spit of Dave Grohl
261240900984901632	negative	Machine Gun Kelly Concert On the 30th!! Me & @LSTREETZ Bout 2 shut this bitch down!
255545007199621120	negative	Tom Boonen has been summoned to man the polling station in Mol this Sunday. If he doesn't, he'll get fined http://t.co/zEPnatOJ
262459240004845568	neutral	Little Mix are going to be on Kyle and Jackie O tomorrow morning :)
248144864997421056	negative	Steve Emerson on Sun News Network with Michael Coren - Political correctness has damaged all aspects of life http://t.co/men0DloH
100303579818102784	positive	RT @LoveMe_Lavishly: I love FOOTBALL season!! Lets get it!! High School games Friday night....NFL games Sunday !!!
100682407090454529	neutral	RT @BillieJoeLuver5: RT If you mentioned Green Day today.
252842604100722688	neutral	Monta Ellis : "We can be between the 4th and the 6th place in the East"
263759101669023744	neutral	On Monday I go back to my old job for the fourth time. My life is the Groundhog Day movie.
100967440342728704	positive	Good Afternoon Clemson FAM!....Let's finish out finals STRONG! We are taking care of business in the classroom...GO TIGERS :)
263475218968883200	neutral	If anyone wants to go to the duke game Saturday with the kershaw county Clemson club please inbox me!
262284984528809984	neutral	The big day is TOMORROW! Mau XTERRA World Championships at the Ritz Carlton at 9:30AM! http://t.co/O0KY5kaz
262949140676354051	neutral	In his session at the 11th International Cloud Expo, Brian Clark, Vice President, Field Services, at Objectivity... http://t.co/F827Jz6Q
263888257601908737	neutral	@samtwomiller see you in Tallahassee on Friday! :)
100109953997602816	neutral	@omar_quraishi Obama has over 8 million followers.I  think only a few read every tweet. That may be the case with all others.
263938124273565696	positive	C'mon Rita i know you can do better!
262240957544660992	positive	We get Garner 1st round. Got to beat the beat to be the best!! @ADHS_Football #ADN
261813086451793920	203143470	negative	@shoehorn79 can't open the link, is it ferry Corsten in December?
236028492398088193	neutral	Just delivered  a speech on IEBC preparedness for the March Election at ICJ conference at Mombasa Continental
100774140390281217	neutral	RT if you think that John Cena is going to win at Summerslam this Sunday
254032799680589826	positive	My mom just texted me reminding me that Grammys birthdays tomorrow.. HOW COULD I EVER FORGET? #BiggestDayOfTheYear
261677896127627265	positive	Btw come rock with us on sat in Covina. Ill be in costume. Wear yours as well so I don't feel like in 12z http://t.co/xsAdYZba
264165407336853504	negative	@marissssx3 i would just like to say i will not be singing tomorrow, i barely have a voice.. you and trina are on your own :p
102975731008671744	positive	Sons of Anarchy may be one of the greatest shows on tv right now. Thanks @JamCompadre and Netflix
264176275655106560	positive	@addismom22 Feb 22 at KFC YUM center, you down?!
175160015462735872	positive	National Bieber Day in all the countries<3
264201666834870272	positive	I find it funny that this is the 5th year in a row that Brad Paisley and Carrie Underwood have hosted the CMAs
228958029687685120	positive	Perfect Pairing. The Singapore Slingers plus the White Ghost Shivers August 31. Tix http://t.co/VqrwH1UE http://t.co/dYbcKiO8
106963409085542401	positive	@CaramelBonitaa yeah I no but on the bright side I just got a letter from Boise State yesterday :)
263489516222955522	negative	Big mix up people, Channing Tatum is not here, it's just Anthonee Bercik, autographs tomorrow.
262589515531681792	negative	Forget the garlic, the soup is DISGUSTING! Thanks for nothing, Saturday Kitchen.
174396143424376833	neutral	Robert Turbin impresses at NFL Combine: But on Sunday in Indianapolis, he became just another name, trying to pr... http://t.co/OzkhJthK
263600490623926273	neutral	Tonight CSA will announce a new sponsor. Today the Kai Cricket Board played their KFC Mini-Cricket festival and they continue tomorrow in EL
100200754777833472	positive	I knw my ish!... "Kev hart voice"...lol! Happy sunday!RT @DiMaaHhh: Lol:-pRT @Credo_Liyo: If kevin hart make u ... http://tmi.me/e7wz4
100486512772251648	neutral	Hore ! RT @blitzmegaplex: Kung Fu Panda 2 (in 2D & 3D, both with Indonesian subtitles) tentatively scheduled to open on Tues 16 August ^ISK
261358809644142592	neutral	Don't drop the same day as Nipsey Hussle... "@joeyBADASS_: DECEMBER 21ST!"
209998835752251393	neutral	EA #E3 News you may have missed: SimCity  confirmed for Feb 2013 & SimCity Social for Facebook; Crysis 3 Feb 2013 release <c>
264208747520462848	neutral	Alright nicky Fwd: From: 4028890972 Sent: Nov 1 10:28pm Message: Idc what he says.
100109709255778304	neutral	RT @iAmOshun "Truth is like the sun. You can shut it out for a time, but it ain't goin' away.", Elvis Presley
262627821908815872	negative	really bored of this host on Super Sunday doing nothing but talk and rave about Man Utd #BiasPrick
247762823940284416	neutral	IEBC is prepared to hold the elections on 4th of March 2013-  Chairman
264213520781029376	neutral	Headed to Footloose on Sunday in Garner! Spots left in #TheAnneVan if you wanna tag along #NorthIowaSchoolPlayTour
246632625807192064	neutral	Anybody in the #dmv want to buy a pair of Anthony Hamilton tickets? Dm me for details. The show is tomorrow at Constitution Hall.
100244502765248512	neutral	@Vampy04 @ian_holyman Can't find the angle I was watching but it looked a bit like RVP v Barcelona 1st leg to me.
261946612283211777	neutral	Winter Storm Watch for Pocahontas county. Sunday night through Tuesday evening. 8-10 inches of snow possible with more in the highest elev.
197760587860676608	neutral	This Saturday come hang out with Buran Theatre on Cinco de Mayo as we drink up, tell stories and prep DESTRUCTO... http://t.co/HsxodJyc
263573916688207874	negative	Our Wacky Wednesday promo, is going a bit Ground Hog Day!!! I say our  Our Wacky Wednesday promo, is going a bit... http://t.co/9TFA1XnE
108261715120099328	positive	RT @kellymonaco1: Excited to interview the new cast of DWTS tonight for E News! They have no idea what their in for ;)
263965467109109760	positive	COOL!!! There's a Criminal Minds season 3 marathon on, and tomorrow it's a Castle season 3 one. http://t.co/GRRUt9mq
262581016470888448	positive	Went to see 'The Mystery of Charles Dickens' at the Playhouse Theatre, West End last Thursday starring Simon Callow.  It's a must see!
111463453683752961	positive	RT @askjillian: Thanks Rachel for the love on Big Brother last night! Glad to entertain you on @gdla
264086563376488450	neutral	Bye Clemson going back to Greenville, be back on Monday morning or Sunday Night. No Game for the Weekend.
167842935864430592	neutral	After months of contemplation, I will unveil my remix to "Ni**as In Paris" on the 23rd live.
260506091824226305	neutral	@Beystanfolife2 Yea I say, mid January for a new single. Right in time for the superbowl& video at the end of January leading into SuperBowl
111794013799063554	positive	Can't wait to see @example on Celebrity Juice tonight!
259420036907810816	negative	If Plant City didn't have a staples i don't know what i would do with my Friday nights.
101468391130415104	neutral	August 28 I'm playing a Los Angeles charity event at Bootleg Theater...Mia Kirshner of Vampire Diaries heading it up. Come out!
264186765097713665	neutral	Feel the warmth in the sky at first sight i felt the energy of sun rayysss
263742676778774528	positive	Other than lemon tea&lemonade. Coke &Pepsi are my 2nd favorites. As unhealthy they are, i cant/wont stop drinking them,they're just so good
264046225022648320	neutral	Final Four is set and here is the match-ups. "If we win"... we play on Saturday at 7:00 p.m. in Lexington! http://t.co/ZRQDwmbg
250412540423729152	positive	Maybe behind the times but has espn taken Ron jaworski off Monday night crew? Not complaining. #easyontheears #nicesurprise
261489068725116928	neutral	@NikCamelia cian an..huhuhu.... mybe tomorrow going to putrajaya..
263212985638608897	negative	Harry Redknapp tells ESPN that rumours he has an interview with Blackburn on Tuesday are wide of the mark: "No chance, I am playing golf!"
183074478375436288	neutral	@FAOnews In Somalia, the people are still waiting from the int'l community strategy to develop food and agriculture after London Conference
264106058103025665	negative	Oh wait if George Osborne gets shipped out to space on the B ark from Douglas Adams' book, he's going to demand an upgrade to 1st class...
263953741877764096	neutral	Snow may fall for parts of CNY the next few days. Find out where the best chances will be at 6:42 am on TV & online: http://t.co/F0Kb0gqD
103039402426634241	neutral	RT @vbg111: It is 5=30 a.m. in the morning at New York. Expect developments in next 4 hours. Mrs Gandhi must have just woken up.
251489633496608769	neutral	#redsox Extra Bases: Varitek named assistant to the GM: The Red Sox on Thursday named Jason Varitek as a special... http://t.co/rRWQOlFt
262060917863350272	neutral	The H Roundup - Google Drive backdoor, Wayland 1.0 and Raspberry Pi: In the week ending 27 October - Google ... http://t.co/DWiMLxo5 #in
195588830936580096	neutral	Today I spent all of the money at H&M & TopShop. Thought I might faint in Zara so that has been postponed until tomorrow. Also: sun!
103748043240783872	positive	@surreycricket Looking forward to the Lions game tonight. Tele on, sound down, and Church on the radio. And the Rey with a form to dream of!
216024112999579649	neutral	Nick Gillespie on Real Time with Bill Maher, Friday 12/22, With Kirk Douglas, Rachel Maddow, Mort Zuckerman, & M... http://t.co/BbqpG7xB
234343025378205696	neutral	@surnell Also read how #MSM lies: thin crowd @ Ramlila on 3rd day:http://t.co/w5NNSQyW n Read for facts 60K+ crowd 2day http://t.co/8cC0KfaB
257494988068368384	positive	Banana walnut Pancakes and a side of @BrooklynCured sausages. Slide up to the counter for a Soda Fountain  Sunday brunch. Enjoy!
100185002276425728	positive	@DickieV Verlander is possibly ahead of CC, more SOs better ERA, but CC will bounce back after last night's outing like he always does
263958620012695552	neutral	@Willz4real yea Gibbs to score the 4th for AFC still
259028517608648704	neutral	going to the Berkmar game tomorrow.
260017992606314496	neutral	#SAFC have brought on former #NUFC striker Louis Saha. The Frenchman is 6/1 to score the 2nd goal of this game. The draw is a 9/4 chance!
96619147974291456	positive	Today *very* rare day when Democrats will get healthier on their Club for Growth scorecards than most Republicans.
260526370776576000	negative	Danica Patrick let her temper get the best of her Sunday and knocked herself out of NASCAR race http://t.co/ziT7wf95
264193170198376448	positive	@HeatherPaace because come November 7, whoever is destined to be the next President will have my full respect. Whether it be Obama or Romney
262719324446408704	positive	Richie Hawtin - Monday Night - Buffalo Town Ballroom - Don't miss it!
