MUSIC_97_2	positive	Great cut: Bombay Calling - a wonderful violin driven instrumental that makes you bounce in your seat.
DVDS_176_5	negative	But the story line is incredibly hollow..You keep wondering when will things start making sense...
MUSIC_253_14	neutral	I do hope Commissioned can put together another reunion album (original members only) and sing the songs that wasn't recorded on the reunion project like Learn To Pray, If My People, He Set Me Free, I'm Gonna Let My Love Flow, I Will Never Leave You, and sing the full version of Strange Land . . . . I could go on and on.
MUSIC_88_1	negative	This is not only a big disappointment; This is big disrespect for Jose Jose's fans.
DVDS_189_8	neutral	This is a fairly enjoyable evenings viewing but I was left feeling slightly cheated and wanting to strangle the stage director.
MUSIC_93_5	negative	Now, they changed for the sake of nothing.
DVDS_205_11	positive	Enter equally unlikely meet-cute Harmony Faith Lane (the luscious Monahan, who makes a sexy funny performance cook to perfection) a childhood friend from Harry's past who shows up at a party that both Harry and Perry are attending for Shaw. Seems Lane has always pursued her dream to be an actress and ever since they were kids playing magician and assistant (guess who and guess who) she came to La-La-Land with little fanfare and a broken heart.
MUSIC_112_3	positive	Led by 17 year old vocalist Hayley Williams, the band also features guitarist Josh Farro, drummer Zac Farro, bassist Jeremy Davis, and rhythm guitarist Hunter Lamb, all under the age of 21. The album starts with ""All We Know"", a catchy (but straightforward, systemaic) power-pop song.
VIDEOGAMES_141_19	negative	There's just nothing to do at a lot of the places.
VIDEOGAMES_271_4	negative	You cannot access menus through use of the mouse, which is so counter intuitive that it screams fail.
VIDEOGAMES_266_2	positive	I would enjoy it because you would get weapons such as swords and daggers.
MUSIC_243_4	positive	The jazz into on the instrumental song is the best part of this whole album.
VIDEOGAMES_139_7	neutral	Overall The best in the series, but its not ground breaking.
DVDS_188_22	neutral	Considering a cast of relative unknowns and B- or C-list actors, the acting was decent.
VIDEOGAMES_122_10	negative	No soldier in his right mind would scramble to a fence when being fired on, unless it was his last and only place to try and hide.
VIDEOGAMES_294_4	positive	That being said, NBA Live 10 is fan-freakin-tastic!
VIDEOGAMES_276_23	positive	It is also nice to enjoy extra features after gameplay.
MUSIC_246_4	neutral	Go for the other compilation listed here that features the original recording.
VIDEOGAMES_132_20	neutral	The game is simply a port from the N64, with not a lot added in, but it is a breath of something from the N64 age.
ELECTRONICS_210_1	negative	purchased 12-17-04 for $32.46 at Comp USA in San Bruno Ca. and still cant get it to work properly.
VIDEOGAMES_274_6	negative	If ya want emmersion, and overall the highest levels of reality you can get, buy the original Falcon4.0 disk and then go download either FreeFalcon4 from www.freefalcon.com/forums OR Openfalcon 4.5 from: www.f4forums.com/forum The best thing about those 2 sims are 1 - they're free 2 - They're not junk like Falcon4.0 allied Force is.
MUSIC_112_13	neutral	The songs aren't going to win any awards from ""lyric-lovers"", but they are, as the entire album has been, catchy.
ELECTRONICS_73_15	negative	A week later, still no replacement unit.
VIDEOGAMES_287_17	positive	RPG fan or no, you have no excuse not to play this incredible series.
VIDEOGAMES_140_14	neutral	It seems like other games have either little micro needed or too much, but this game finds a happy median.
VIDEOGAMES_136_2	neutral	Sadly, this game is not totally new if you already played the original Castlevania game on N64. They took the original C64 game they added more bosses, characters better graphics and new places to explore in the dark castle of count Dracula.
MUSIC_236_18	neutral	This is not a collection of his greatest work.
MUSIC_105_2	positive	There are 12 brilliant songs that use live instruments througout the album, This gives the album a happy and feel good characteristic.
DVDS_194_4	positive	She still looked hot though.
DVDS_195_7	negative	On top of this, there are no interesting new revelations about Hudson (or about a Hollywood lavender underworld).
VIDEOGAMES_119_1	negative	The story makes Stargate Atlatis look like Oscar material.
ELECTRONICS_222_1	negative	I could not get it to set the time automatically.
VIDEOGAMES_137_28	negative	This is about it for the gameplay part, but I won't give it a high score, it's not really good.
ELECTRONICS_78_9	positive	It must be one of the best anti shake designs made.
DVDS_192_23	neutral	All in all AV doesn't reach anywhere near the bar that FFVII left for itself.
VIDEOGAMES_273_7	negative	My advice is to not buy this game for your children.
VIDEOGAMES_134_75	negative	At least Squall had an angle to him.
VIDEOGAMES_117_3	positive	I am also a big fan of shooting the trees down.
VIDEOGAMES_136_22	positive	Castlevania really looks like an old castle, and your characters are really well-designed.
MUSIC_260_16	positive	I'm butchering the description, but it's really a powerful piece.
ELECTRONICS_226_4	positive	The design is pretty cool and it is available in a variety of colors.
MUSIC_110_6	positive	You will NOT be disappointed.
VIDEOGAMES_134_57	negative	Dungeons in this game are EXTREMELY short and only take long because of the random encounter every step and a half.
VIDEOGAMES_139_3	positive	the war torn cities are immensely detailed, the effects are pretty damn good aswell.
MUSIC_250_2	neutral	The music is beautiful, but alarmingly soporific and tedious.
MUSIC_96_5	negative	Perhaps I'm jaded, but now much of this album sounds pretty silly (as does a lot of the music I proudly own from that era).
VIDEOGAMES_134_18	negative	The main characters fail to hold the players interest as well.
VIDEOGAMES_277_5	negative	First of all, you do the exact same things through the whole game.
ELECTRONICS_78_7	positive	Controls are intuitively where fingers are placed.
VIDEOGAMES_289_5	negative	Also, your diplomatic actions and nice foreign relations may or may not pay off, so it is difficult to figure out a winning strategy.
VIDEOGAMES_288_5	positive	The beautiful ambiance will make you feel like you're actually in the game.
MUSIC_254_15	negative	The acoustic production that made her stand out has been replaced with drum machines, multi-layering, and auto-tuning.
ELECTRONICS_207_13	negative	Pay a few dollars more and get a better bag.
VIDEOGAMES_283_1	negative	What I really didnt like about it was that the quests (the large ones) don't end with one dungeon.
DVDS_205_7	neutral	This sure as hell ain't.
BOOKS_167_0	positive	Economic Revolution - A Spiritual Solution by J. Kendall Anderson, M.Ed. [...] With the economy in the tank and President Obama working harder than a Jamaican cook, this book is just what the recession ordered.
VIDEOGAMES_117_10	negative	Some of the things they put in the game to be clever are just stupid.
MUSIC_264_8	positive	It's all about the voice, the human beatbox, and the clap.
BOOKS_146_1	negative	It was terrible.
VIDEOGAMES_269_10	negative	And when you get to the later levels, and the monsters are extremely tough, this becomes even more annoying, with the limited weapons use.
ELECTRONICS_207_6	negative	(Careful handled and not over loaded).The bag is unusable and worthless without them....
VIDEOGAMES_273_6	negative	I want more Diego!""
VIDEOGAMES_118_2	negative	The missions are dark and pretty dull.
VIDEOGAMES_144_1	positive	Huge world with beautiful graphics.
BOOKS_169_12	neutral	It would have been nice to see a link between gender-specific sales practices and proper Christian ethics.
DVDS_204_21	positive	Emphatically one of the year's best films and one that you need to seek out for the performance of the year.
VIDEOGAMES_130_0	positive	""Check your bargain bin"" The Game play of this game was done very well.
BOOKS_161_5	negative	Why be so snarky towards such easy targets as the vegan starlet?
VIDEOGAMES_273_2	negative	He cried for about 45 mins after the end credits rolled.
DVDS_188_30	neutral	Overall, I would say that My Bloody Valentine 3D is better than the original My Bloody Valentine, but still falls flat on its face when compared to the great horror films.
DVDS_191_27	negative	When will this stop, when can they put more out of that production-value into the films, it says here in the Trivia-section they spent 2 months working on a raindrop, why couldn't they spend that time re-working the script I ask?
MUSIC_264_14	positive	Incomparable is really the best word to describe ""Le Fil.""
VIDEOGAMES_127_20	neutral	The sound effects are OK, but a lot are the same as they were for SSBM. The unrealistic sounds make the fights sound strange, but it's not like that matters.
MUSIC_258_2	positive	Richard Perlmutter has done it again - this cd is brilliant and has quickly become a beloved cd for our entire family.
DVDS_176_4	positive	The idea of a 'comic book' movie is implemented well I must say.
VIDEOGAMES_136_30	positive	As for the sounds, they are almost perfect.
ELECTRONICS_83_5	positive	DVD's and video games play very well on this television.
VIDEOGAMES_275_8	negative	If they want to make save with onl at SAVE POINT, then they should at least have one on every town...
VIDEOGAMES_270_0	negative	look i bought this game one day and with in 2 days i had beaten it 3 times on the hardest difficulty.
VIDEOGAMES_134_3	neutral	Graphics -- 8 If Square was trying to go for the ''old school'' cartoon look, so why only make the characters cartoons.
ELECTRONICS_214_6	negative	Nor will I buy another in the future out of fear of getting the same results.
ELECTRONICS_76_7	positive	Customer service though is very good and very responsive.
ELECTRONICS_80_3	neutral	It does however play five cds, has an aux input and is XM ready.
VIDEOGAMES_281_1	negative	The storyline is flat and uninventive.
VIDEOGAMES_281_8	neutral	The visuals aren't to bad, but then again, they're nothing new.
VIDEOGAMES_275_10	negative	and if die is game over...
MUSIC_103_10	positive	The production at the time was revolutionary; Lauri Latham (later worked with Echo & the Bunnymen, Squeeze and The Stranglers) came with a distinctive glossy and crisp sound.
VIDEOGAMES_277_21	negative	Why oh why did that 1 guard see me with 20 seconds left as I slowly walk back to my informant?
VIDEOGAMES_285_3	positive	A nice western-cartoon feel!
MUSIC_95_9	neutral	I think Beef Jerky. Overall, I think this band is pretty chopped, but I don't think the licks are wet enough.
DVDS_205_9	positive	Harry is next whisked to sunny LA by Shaw for meet-and-greets to create serious buzz and enlists the unexpected thief a lesson to be a detective with Shaw's for hire gumshoe ""Gay"" Perry (Kilmer equally having a ball and a natural flair for tongue-in-cheek humor), a tougher than he appears homosexual who is reluctant to have the flaky Harry tag-along to get notes for his 'character'.
MUSIC_105_7	positive	i am very hapy with this cd and i think you will be to.
MUSIC_254_17	neutral	Given the current state of mainstream music, she now blends in. I don't know why Mari would want to sound like so many other young women in the pop market.
VIDEOGAMES_137_3	positive	No, of course not!
MUSIC_249_9	neutral	There is little here that is edgy or super original, nothing that grabs the listener and forces them to pay attention.
ELECTRONICS_85_26	neutral	There's certainly better cameras out there (the G11 is only marginally more expensive), but none I'd want to haul around on a daily basis.
DVDS_186_1	neutral	But, with Ridley Scott, it should have been much, much better.
MUSIC_103_11	positive	Although it became soon dated, it sounds today very fresh.
VIDEOGAMES_269_12	negative	Now, of course, as you continue onwards, you find that weapons become even more expensive, and slowly begin having less, and less hit points, so when you do want to ''level'' up, you have to get new weapons every several battles, just to keep leveling up, which takes all your gold, which means to do anything else you need to go fight....
MUSIC_112_14	neutral	These few songs show the age of the band the most, but I'm sure as they grow their lyrics will grow with them.
VIDEOGAMES_278_6	negative	The map doesn't help one bit because all it does is highlight the hallway that you are in red and you have to decipher what doors go where.
MUSIC_240_1	negative	a complete rip-off and about as generic as it gets, it combines the most commercially viable aspect of Nirvana (loud guitars and screaming) with the down-tuned sound of Korn. Truely this band would do better to become a tribute band, which in many respects they are.
VIDEOGAMES_271_14	negative	It cannot be played at high graphics even with a very high quality PC. I don't think they can even patch the thing to playability because of the graphic issues that may not be fixable.
MUSIC_243_0	negative	Not sure why they would release this album in this shape.
VIDEOGAMES_287_12	negative	For this reason I'd put off installing the expansions until you're at a point when you can make use of the expansion content (basically end-game or when you reach the experience-cap).
ELECTRONICS_215_7	negative	2)this could be a deal-breaker: In the middle of a conversation, even with the cellphone within a few feet of the headset, this Bluetooth sometimes disconnects itself, and the call has reverted back to the cellphone.
ELECTRONICS_216_29	neutral	A good analogy for this camera is this: This camera is like an expensive new Mercades that automatically chooses the brake and acceleration settings for you and doesn't do a good job of it.
MUSIC_95_3	negative	So, anyway, the bass line sounds like it is so chromatic, it is so inside, and it completely matches with the melody.
VIDEOGAMES_291_8	negative	The story is really the same as KH, but they replace ""heart"" with memory.
BOOKS_147_10	negative	The tragedy is uninformed persons will read and repeat Frymire's errors, and as a result will confuse the whole subject area.
MUSIC_264_4	positive	This literally ties the entire record together and makes you listen to it as a suite: not that the songs don't stand by themselves, but this persistent note just keeps pulling you into the next one.
VIDEOGAMES_125_10	negative	The crowd sound effect is almost, if not worse then the music (Apes chanting???).
DVDS_178_6	negative	But there are only two individuals that this Tooth Fairy is after.
VIDEOGAMES_136_0	positive	It surprises me how this game is underrated!
BOOKS_166_1	positive	Wohlforth cheerfully tackles the deep fog of climate science (even some of the career scientists he interviews seem hopelessly befuddled by the complexity of it).
BOOKS_156_12	neutral	And sure there's a lot of biblical allusions, questioning of goals and life, and Hemingway's prostilization of his whole ""philosophy of man"" dogma.
ELECTRONICS_229_2	neutral	I can access and control my television inside or outside my home.
BOOKS_166_6	positive	Getting and telling the story is what Wohlforth knows how to do.
MUSIC_259_4	positive	He then takes it to the next step of providing chants for use in meditation.
VIDEOGAMES_278_1	negative	Flaws such as the abysmal combat system.
BOOKS_155_7	neutral	The heroine, Susan, doesn't have a large role in the book but you gotta love her stoic attitude.
MUSIC_99_9	negative	If you're looking for *Summerteeth* Wilco or ""Sexuality"" Bragg, this ain't the album to buy.
BOOKS_153_10	negative	Narrator is impossible to sympathize with; he chased money and worldly success and is now reconsidering.
VIDEOGAMES_289_9	negative	That can be discouraging; when you seem to be getting off to a good start, only to have some aliens just stomp out your civilization with superior everything; and no help from your supposed allies.
ELECTRONICS_208_0	negative	It's now April 2010 and for over 6 months now, [...] has yet to get this ish together.
MUSIC_256_5	positive	Her voice is silky and direct, and her lyric smart and direct.
DVDS_178_16	neutral	Darkness Falls should have been a Made-For-TV movie and rated TV-14 Considering how cheap the budget is for made-for-TV movies, Darkness Falls would have fit right in. I probably would've accepted it, or had more respect for it, and given it a much higher rating.
VIDEOGAMES_135_5	positive	Graphics- For N64 is was really good!
ELECTRONICS_85_25	positive	Overall this is an excellent camera that puts all the functions I wanted (RAW shooting, wide lens, full suite of manual settings and f-stop adjustments) and then some in my back pocket.
DVDS_189_6	neutral	Unfortunately the same cannot be said for Ann Murray whose top notes are squally and jarr the ear, however her lower register is still lovely and she is a very good actress, able to communicate her anguish, her aria `Mi tradi quell'alma ingrata `is very touching.
MUSIC_252_11	negative	And the remake of ""Hellhound on My Trail,"" Johnson's signature tune??
VIDEOGAMES_124_26	negative	Clear instructions, realistic rides and better graphics would of made this 7 to 10 out of 10 material, but because this is everything the game is missing it unfortunately won't impress.
ELECTRONICS_207_5	negative	They broke after only a few times using it, just by normal open and closing.
VIDEOGAMES_271_12	negative	The graphic problems alone make the game almost unplayable.
MUSIC_259_2	positive	The CD book takes those concepts and Douglas-Klotz' scholarship into the realm of the auditory.
DVDS_187_18	negative	Plus Ridley (who's name is all the information we get from him) is suddenly very unaware of how ""gifted"" he is, and is choosen out of the blue to save the universe.
VIDEOGAMES_142_0	positive	The greatest spectacle in sports-entertainment is back!
DVDS_177_11	negative	And the naked girl....
DVDS_204_17	positive	The words ""I love you"" have never resonated so much overwhelming emotion that if you are not in tears then you my friend are not human.
VIDEOGAMES_127_29	negative	So sad......
MUSIC_110_7	positive	If you only buy one Raymond Scott CD, this MUST be the one to get.
VIDEOGAMES_282_12	positive	It's very quick and very precise.There are 4 modes to keep you entertained.
VIDEOGAMES_279_11	negative	I mean no superstar moves, no dunk contest, where's franchise mode???
ELECTRONICS_222_3	neutral	I has a nice feature in that there are 2 alarms and you can set each one to go off on certain days of the week but once again I was unable to set the days of the week.
MUSIC_238_9	negative	It sounds almost like when you put a tape in a player and it eats the tape, and is just as enjoyable.
VIDEOGAMES_116_2	negative	Every game seems to have 10 or so ""intro"" screens that you have to go through.
VIDEOGAMES_273_8	negative	Especially not any over 3 years old.
VIDEOGAMES_285_9	positive	Controls: 10/10 Your usual for a FPS.....You get your regular fire, then a special fire which can make you shoot faster on some guns...you also got your open doors button...then your move buttons...and map...and jump...and so on.
VIDEOGAMES_285_10	positive	You really can't complain about the controls, since you can modify them to your liking.
BOOKS_170_46	positive	I am upon writting this rewiew, impressed by how much such simple and short text has inspired me to think and how effective so few words can be at presenting such profound and compelling ideas for peace and prosperity.
VIDEOGAMES_140_11	positive	The ability to put spells on auto-cast (and the effectiveness of the AI at deploying them) is amazing.
DVDS_191_29	neutral	But well worth a watch since it marks a new low in the art of commercial-cinema, but this point of what seems to be of no return will be cast a-side when the third episode of Star Wars will hit the ultimate bottom.
VIDEOGAMES_137_55	negative	Surely you will look for more challenge, if you have played until the fourth year (I didn't) you should be bored by now.
ELECTRONICS_213_3	negative	Cons: the iPhone 3GS simply won't fit into the pouch.
VIDEOGAMES_134_26	negative	Weee. The ATE adds so little to the plot, and takes up so much time, that it seems that Square added them to take up time and disc space.
MUSIC_111_3	positive	For this presentation of the career-enhancing LP this turned out to be, Warner and Ezrin have done a terrific job with the original elements.
ELECTRONICS_72_11	negative	Then I tried Best Buy, where I had bought the camera, but they also had no such adapter and no such accessory kit.
DVDS_191_4	negative	Since I'm studying philosophy at the university I've found it quite interesting to laugh out load at the symbolism in The Matrix series.
ELECTRONICS_230_10	positive	Overall, very impressive speakers.
MUSIC_112_4	neutral	""Pressure"" has the surefire sound of a ready for MTV single, and will definitely have a lot of kids heads bobbing at Warped Tour and on their headlining tour this summer.
VIDEOGAMES_119_4	negative	How this is considered the best game of all times is beyond me.
ELECTRONICS_215_2	positive	THAT feature is great!
VIDEOGAMES_134_20	negative	You've seen her many many times before, only the last few times you saw her, she was interesting.
BOOKS_168_24	positive	I give it 4 out of 5 stars.
ELECTRONICS_223_4	negative	And after that, she did not even bother to try out anything on my computer.
MUSIC_113_4	positive	What hummable songs and easy listening.
ELECTRONICS_215_8	neutral	Actually, this does make problem 1 less of a nuisance--since the headset time is shorteded by the BT's refusal to stay in the conversation.
MUSIC_260_14	positive	Beginning with slow, chugging riffs, it is after the first verse that it kicks into high gear, harmonies running rampant.
DVDS_185_1	negative	Story is everything with the help of clever dialog but none was to be found in this tragedy for lovers.
VIDEOGAMES_272_6	neutral	When you rate this EP1 with a 10 what were CoD (2), Battlefield (2), FEAR and HL2 then.....a 25??! Yes the graphics are great, just as they were in HL2 (ok HDR is added and it does look nice, but it's not that much of a difference).
ELECTRONICS_215_4	positive	Also it sits nicely on a countertop, making the set less easy to lose.
MUSIC_98_6	negative	Also gone is the low thump of the bass drum.
VIDEOGAMES_290_0	positive	""Just plain fun"" I don't see why this game got a lower score than the other Nintendogs.
ELECTRONICS_220_5	neutral	I think it could do with auto-fit vertical and auto-fit horizontal features to remedy this.
VIDEOGAMES_141_3	positive	You go running around soaking up hundreds of bullets, and killing or destroying anything near you.
MUSIC_236_14	negative	I honestly can't think of a time when I want to listen to trance and I think to myself ""You know what would be great?
VIDEOGAMES_120_6	negative	Yeah, you really showed them...
MUSIC_107_8	positive	This song is SO GOOD. Possibly my favorite song on the album along with Cliche 7. Ain't Home Tonight - 4/5 stars.
ELECTRONICS_215_10	neutral	No.
ELECTRONICS_230_2	negative	There's no treble control on the unit.
ELECTRONICS_218_9	negative	Second, my favorite feature, the voice commands, frequently just doesn't work.
MUSIC_254_16	negative	The delicate, vine-laden garden lattice of ""Unfold"" has been replaced by a hard, brick wall of sound this time out.
VIDEOGAMES_134_0	neutral	I suppose this game is just the icing on the cake after Squares last two Final Fantasy games.
VIDEOGAMES_281_5	negative	The fighting is pretty uninventive, unless I totally missed the point.
VIDEOGAMES_269_2	neutral	Graphics : 5/10 Probably one of the nicest parts of the entire game, the graphics are nothing amazing, but nothing extremely horrible.
ELECTRONICS_216_7	negative	After hundreds of pictures and a week of giving it every chance to prove itself, I gave up.
MUSIC_102_0	positive	Pawn the jewelry, if necessary, to buy this disc if only for ""Je t'ai dans la peau"" (""I've got you under my skin"").
ELECTRONICS_216_13	negative	I can't use a camera that not only doesn't let me control something as simple as the apperture, but it makes bad choices about the lighting.
BOOKS_145_2	negative	Though these tests are long, the questions are simplistic and are little like real AP questions.
ELECTRONICS_206_2	negative	1. Dreadful to set up - the claim about wizard guide was of limited use after setting up the base unit, and I had to get a good friend to spend several hours doing for me.
BOOKS_157_2	positive	I must admit, my initial hesitation was unwarranted.
BOOKS_166_2	positive	But he approaches it both as a journalist who makes his living by storytelling, and as a father used to gently encouraging his four bright, curious children to understand their world.
BOOKS_147_4	negative	Frymire is appallingly ignorant of the creationism movement and this fact shows on almost every page.
BOOKS_170_9	negative	The weakness of some aurguments, such as limited resources may have contributed to corporate financial gains are eliminated by comparing profits on historical trends prior to the conflicts.
MUSIC_236_19	negative	It is a collection of meaningless, passionless remixes or pop dance tunes.
MUSIC_114_10	positive	The albums opus is ""Sea Map"", which straddles some nether-ground between Led Zeppelin, Bardo Pond and Porcupine Tree. This is balanced by the delicate beauty of ""Scrapbook of Madness"" and ""Satellite Sun"".
DVDS_203_3	positive	by Geroge Tomasini, Bernard Herrmann's screeching violins score and the all-together ookie finale are American classics in every sense of the word.
DVDS_186_6	negative	I enjoy extras on DVD, this is so lacking.
MUSIC_102_3	neutral	There's a strident guitar backup and a little subtle synthesizer in the background.
DVDS_181_13	negative	Most painful is the cartoonish way the military is portrayed in this film.
