262619064000724993	negative	Temple, Drexel, Penn, NY SD, state of NJ - closed for Monday and Tuesday. Philly SD? Still thinking about it. #thatmakessense #noitdoesnt
210728919836528640	neutral	Cloud Computing: WHIPTAIL Talks Big Data & the Speed of Life at Cloud Expo - Soa Wolrd: The 10th... http://t.co/sYdr66M0 #bigdata #cloud
103786117303762944	positive	Opening today "The Inbetweeners" (15) 20.45 and Cowboys & Aliens (12a) 20.20 Remember it's Super Saver Day,so you... http://t.co/OpofihG
100032113952292864	neutral	Where is @Thee_LoLaMonroe going to be at tonight in Detroit?
240754976501149696	neutral	Ideal Home Show at Christmas - Earls Court 14-18 November, has partnered with ITV to bring Dancing on Ice to life at the exhibition.
206522422000746496	positive	@RonaNishliu Congratulations Rona for the 5th place in Eurosong contest. You deserve more than this<3
103263897712201731	positive	Show em what it isRT @Trujohnson2: Love it when scouts be at our Practice..  I counted 4 today..  Broncos , Miami , Philly , && Tampa Bay ..
264089234183438336	positive	@plumpyTM Getting my Xbox back tomorrow! Honestly can't wait! - My friends wants a competitive 3v3, see if Cole is up for it man!
100274052534501376	positive	@TomFelton Hope you win tonight Tom!  Your US and worldwide fans from @TomFelton_USA and @TFeltonChicago are cheering for u!
224187664352559106	positive	@DavidArchie Josh Bradley turns 23 tommorrow!! July 15.  Hope all is well with You!! Enjoying your music. Have some Halo-Halo!
263080341865132032	neutral	@LNT_music  is having a show nov 10th @ the House Of Blues friends or anybody HMU if u want to go Thanks :)
264213618093080576	positive	Turns out Olive Garden's dinner for tonight and tomorrow is more like dinner for tonight and later tonight.
263992145738870784	positive	Now it's November won't b long til Xmas music starts on VH1. Can't wait all day everyday
244671808803069952	neutral	My official bday weekend kicking off party Friday Sept 21st @ Club Bodi and going out with a bang Grand Finale @ ... http://t.co/ugKipl13
250692636330049538	neutral	@Alyoup005 @addicted2haley hmmmm  November is an odd release date if true but if it becomes big enough maybe she could sing it at Grammys
244707217130008576	positive	@youngmensociety See you guys on the 6th of October in Bathurst along with Stan Walker. Can't wait!!! :D
261081353636950016	positive	Andre Villas-Boas talking like there may actually be some truth to the stories about Adebayor wanting to leave :'''''''). Great signing.
249191033198497792	neutral	Just like the final shot in the the shining. Rembrandt may have painted John Belushi. http://t.co/VoJm25L7. #rembrandt #belushi
263422793998299137	neutral	Ghost of Mississippi The story of the ghost that tripped Eli Manning on 4th down that fateful autumn night in Oxford. #30for30
256765946616770560	positive	@Cavillafuertee Cav ! See you tomorrow sa SM Sta.Rosa !! :**
264226305665531904	neutral	AJ went to bed at 8:30 or 9:00 tonight. Kid was tired. There was no stopping it. Hubby and I sat and watched the stuff we usually watch...
263990056765751296	neutral	Have you ever forgotten to get a Valentine's present? Your chance at Feb 17 #bonjovi tix coming up! @benandkerryshow
231554887937310720	positive	Are there any Aussie Directioners from Canberra?? going there on the 12th of September would love to meet some More Aussie Directioners <3
250251320395710466	positive	Occupy Unmasked with Andrew Breitbart - Citizens United Productions http://t.co/ppVuF9K4 via @sharethis*hAPPY & CHEERY MONDAY!* LOL or NO???
264185956305883136	negative	I don't want to take ACT tomorrow. ):
263759722858041344	positive	At least it will make up for the SAT and the Gonzaga game
261717956667518976	positive	@indomienoodlez  May Allah grants us all our HRt desires n make us better prsns than the yrs before
263749149198020608	positive	CANT WAIT TO GO TO THE BULLS GAME SATURDAY! weeee my first game of the season and papa got me some killer seats!
263528965212356608	neutral	#LazyWeb Should I get up early and avoid giants fans on Caltrain or just work from home tomorrow?
232845999448670208	positive	@ATLHustlerClub so stoked! i'm going to the irving plaza NYC show on november 18th c:
255449898810494976	positive	Enjoying my 1st time on Caltrain - bikes on the 1st floor, passengers on the 2nd floor. http://t.co/QO2tAnKe
100197713467031552	neutral	ENough muslim countries lobbying in the us for today, i'm watching 'twilight saga: eclipse ' to better understand girls)))
260823238643433472	positive	looking forward to the judd apatow guest edited issue of Vanity Fair in January. Expecting lots of Lena Dunham, Paul Rudd, Leslie Mann, etc.
100170016875491328	neutral	Wonder if the Spurs shop got looted last night? #doubtit
233980700041302016	neutral	Video: AFP - Gaza's Hamas denies involvement in Sinai attack: Following the election of Mohamed Morsi in June, r... http://t.co/kKKYvqkH
105739077680250880	neutral	#UFC @JesseSeedath Yushin Okami isn't just Anderson Silva's opponent Saturday night - he's the only... - http://t.co/pRafGi5
236135470575263744	neutral	6 - Louis Saha is going to play for his 6th Premier League club, only Marcus Bent, Andy Cole & Wayne Routledge have played for more. Travel.
249238019574480896	neutral	@FantasyGaffer got a suggestion for a GK tomorrow that doesn't cost over 5.6 ?!!. I want to replace Krul.
264206494587834368	positive	Going to see Kendrick Lamar with @Pea_Starks in jan :D
263619698845941760	positive	Good luck to all my babies taking History and Physics tomorrow! May the force be with you! Make history!
263794845666136066	negative	Whitecaps vs the mighty Robbie Keane and LA Galaxy this Thursday, 7:30. Fuck training, hitting up @SinBin_Grill
100576061624041472	negative	RT @AdamSchefter at practice, Lions rookie RB Mikel Leshoure was carted off field today with a left leg injury. > Lions dropping like flies
262133995645583360	neutral	@dannychoo When Douglas Adams wrote Restaurant At The End Of The Universe, he may have had Japan in mind. #HHGTTG
263694340579274752	neutral	@KellyEstaLoca February 2, aka Groundhog Day, we can pull it off, right?
264131735443349505	positive	@_RonDonGQ damn brah it was good too! We play the Knicks tomorrow
260556380795183104	positive	Gabe Carimi called for his 2nd holding and 3rd in 2 games. But got lucky with offsetting calls. Its his first time facing DE Cliff Avril.
263487091659395072	neutral	PSN Tuesday: Assassin's Creed 3, Okami HD: You can buy all the Assassin's Creed you can handle on PSN today. Both... http://t.co/APdsC4ZI
263483410192932864	neutral	Delmar Johnson will interview about new release of book!  BOCI Talk Radio @ 10am CST on October 31st.  Listen,... http://t.co/L45qvLSi
100046838324928514	neutral	RT @TomCrowe: Why doesn't Obama just sign an executive order that declares the U.S. has AAA rating? I mean, c'mon?
255235361964425216	neutral	Mumford & Sons tickets for the extra London O2 Arena show on Dec 18th are onsale now. http://t.co/YouEGO2T #mumfords
222564506885308416	neutral	Dwayne Bravo and Darren Sammy will donate their match fees from the 3rd ODI to the wife of Runako Morton...!! #WI
264059754161266689	negative	This bitch @backyardbetty just put frog back on Lmfao throw back Thursday
100242643342196736	neutral	For Arsenal and Spurs' sake, let's hope the futures of Fabregas and Modric are sorted before Aug 31st.
264123783458197504	neutral	@At_One I'll be in Poland but back Sunday eve, catch you then!
212658260833079296	negative	Happy Valentine's Day is trending? ?? But... it's not even February?
262858301824458752	neutral	Liverpool looking to activate Demba Ba's 7m buy out clause with Andy Carroll going the other way in january
100333560778604544	neutral	RT @howardeskin: Steve Williams just threw Tiger Woods under the bus after win w Adam Scott today. After 33 yrs and 145 wins this is the ...
101060707134619648	positive	@andrewsikora The Tigers know it's a big game as well: resting Martinez & Alburquerque Monday and bumping Verlander.
251423271344553984	neutral	You may want to plan on getting a cup of coffee at Winans this Saturday! http://t.co/sq4yW0yr
200871887767736320	neutral	P&G shifts top executives to Singapore: SINGAPORE: US consumer giant Procter and Gamble (P&G) said Friday it wil... http://t.co/4TKp7C1b
226567105963757568	neutral	@25whitney if you don't by break time tomorrow that is my second team!   I would already have them if Gary Carter was in the set...
264015488504442880	neutral	i got 2 classes then im off going back to Greensboro. im heading to NY tomorrow
264169854049861632	negative	Tomorrow is last day for early voting in Nevada. I am not inspired to vote early. I don't like many of the choices. Most suck balls.
220510751935299584	positive	@AdHunter1984 love the Greenbrier team. Tipped two of them and possibly Harris English's biggest fan. May yet add him to my staking plan.
218954101881454592	neutral	@RBKD: This just in: Rui En joins Elvin Ng & co. in CLIF2, scheduled to air 18 Feb 12. Surprise?
253687315241779200	neutral	Tonight, Obama was the Buffalo Sabres and Mitt was the Dallas Stars. It may not seem right to the Sabres fans, but Dallas still won.
251601887701372928	neutral	@AudioVixen3 Wait I think I know who it is. I may be wrong but I swear in an interview one of you said you'd like to sing a Stan Walker song
263938647852732416	positive	HOLY SHIT JACK WHITE TOMORROW! When he plays seven nation army it'll be INSANE
264078531166863361	positive	@WardChanning Hey Channing Tony Provias from Aberdeen Hope you get a sack on Murray this Sat!!!
262908458918088704	neutral	Tampa Bay Buccaneers: Game-by-Game Predictions for 2nd Half of the Season - Bleacher Report http://t.co/oHPjlwbY
109030416631087104	neutral	Safe Mode with Networking - no internet: I am troubleshooting a BSOD in Windows 7 and may come back later with m... http://t.co/2gB8dMT
200319896125579264	neutral	@rioferdy5 Harold and the Purple Crayon, although it may be for slightly younger. And anything by Dr. Seuss is always quality.
111553068902006784	neutral	Why Verizon's 4G Limits May be the Droid Bionic's Achilles Heel - Gotta Be Mobile #verizon #phone
263469409409052672	positive	Nba is back !!!!' My main man jj starting at the three for Sacramento kings gets chance to show bulls even more of what they lost tomorrow
261228639482429441	neutral	TEAM NEWS: Moussa Dembele, Emmanuel Adebayor and Gareth Bale will all miss the game tomorrow against Maribor. #THFC
264048763537072129	neutral	Given up on work for the night, really CBA! Know I'll be able to concenttrate better tomorrow anyway. Plus I'd rather talk to @DJYuzi now!
249387244668985344	positive	Taylor Allderdice might just be wiz 2nd best mixtape
105211145501151232	negative	Still fuming at Everton shambles, at least the England Cricket team should cheer me up today #kenwrightout
103882059101126656	neutral	RT @tvdfansonline: Vampire Diaries Season 3 Scoop: Vicki Is at Odds with Anna - Today's News: Our Take | TVGuide.com - http://t.co/sX3bA3d
255804479130185731	positive	@mayhemmiller Nick Diaz is da Best! Smoke weed every day and drop out of school in 6th grade! Fuck Yeah!
263882641642778625	positive	@pauleyP best line ever as abby "he wears $3000 sun glasses & has Justin Beiber on his harddrive cant we arrest him for that?
103882367793504257	positive	Arm hurts like crazy Open house tomorrow and Church tonight!!!! I love them so much <3
252526969730789376	neutral	Went to see the psychedelic Sun Ra Arkestra last night at the Barbican Centre. #trippin
261596225969721345	positive	Rehearsal wedding for my cuz @Chico_A_Dusty83 going on at pro bowl... Big day is TOMORROW!
260201236182204416	322327245	neutral	Not Available
262758494845931520	neutral	Someone be sure to tell George Clooney to keep the Andrea Gail at the dock tomorrow.  Read @StuOstro: http://t.co/PwgbB8Ck
174621353574543360	neutral	Im trying out for the NFL Combine when I get out of college #youcanbelievethat
264039385417261058	negative	Do we really care about our kids future? Think about it: Education is the 1st thing cut from budgets on every level.
261873054760701952	neutral	Remember to RSVP for our FREE Writer's Workshop next Thursday with Rosanne Bane.  Rosanne is a Creativity Coach &... http://t.co/63zkIM3A
263963523669975043	positive	Higgins "Great experience for the young group and to meet with Premier League teams a real highlight" "Very young squad to play on Sat"
104713085306159104	neutral	RT @IndyStarSports: Colts owner Jim Irsay to donate $64,753 to @IndyStateFair victims fund. That's # of tickets distributed to tonight's ...
259347616238804992	neutral	If you're looking for the GS3 off contract, it hits MetroPCS next Monday - http://t.co/vLu16S8I by @Engadget
224821439717584898	negative	Not convinced by the Haye v Chisora fight @ Upton Park on Saturday.....personally I'd rather have seen Carlton Cole v Emile Heskey
263704806659592192	positive	LOL. So Haryana has a day off tomorrow because it's "Haryana Day".
258268292232396800	positive	@MyGoldMusic  can you play wah wah or bware of darkeness by george harrison tomorrow please :)
156387292737568768	negative	Jack Welch and Mort Zuckerman are always on giving 'wisdom'. Isn't their business style part of what made this mess in the 1st. #leansix
197826014984945665	negative	Tim Roth will be playing in a movie with Jean Dujardin. i .. can't .. ok, i may pass out now.
264123775761645568	negative	Anybody want 2 tickets to Jack White tomorrow at Ally Pally? Stuck in Matlock, can't make it. Contact me!
238317297377361920	positive	@IBGDRGN Today is our Chinese July 7th Valentine's day I hope you will soon find you that she wishes you to be happy  Happy Valentine's Day
239073797825781760	neutral	Feels Like Vegas In LA @Jalexanderfunny  @NormaRoyston Auditions in 4 SATURDAY!! Movie Called RAYMOND LEGENDS U will be shooting the TRAILER
235631351825575937	neutral	Nick was the 1st one pinned in the Elimination Chamber.
232415485512253440	positive	If @TheRock wins the @WWE Title at #RoyalRumble, then he would have to defend it in his 1st ever Elimination Chamber match.
107643335698690048	neutral	And here it comes! The main bout for the evening, Anderson Silva vs. Yushin Okami #ufcrio
258167495649816576	neutral	milkily handsome in the manner of a cinematically doomed first world war infantryman: @barneyronay on Michael Clarke http://t.co/YjzCCNjb
262311874106904576	positive	@lukeymoore Good luck tomorrow! I did it once. Big David James and Harry Redknapp started the race. They wore bomber jackets...
100379863038435328	positive	OMG I can't wait to see what Beyonce is gonna do at the VMA'S Sunday August 28th! http://twitpic.com/62q0w9
111359975405780992	positive	Its 2 AM & I have to wake up at 5:30 in the morning. To sleep or to keep watching Jersey Shore? TO SLEEP! nah, I think I'll stay up :D
252075399406833664	neutral	I can't help but wonder while at the Washington Monument why they didn't utilize the grounds to create a huge sun dial http://t.co/9ftNKtms
264190673769615360	neutral	@ESPNNFL: Rivers may have just entered CMon Man territory with that INT in the end zone -- #ChargerFansBooing why did that need a hashtag
261268694934630400	neutral	Tomorrow Night Thursday Oct 25!!! FIRST BLOOD TOUR Dubstep & Trap Halloween Party with MAYHEM!!!! Greensboro NC... http://t.co/LYXmUVVt
103670215459618816	negative	I really hate to think it, but the same type thing that's happening to Miami could happen to Alabama tomorrow.
100227834416599041	negative	Sam Loco Efe (Nigeria Nollyhood star) is dead.  We are still mourning Christy Essien now it is Sam Loco's turn. May his soul RIP. #jhub
238450110546202625	positive	Starts Friday night Irving plaza NYC me and @bteband touring with Chiodos <- stoked
261375537417711616	negative	@muterundumo good argument, however ITS A GAMBLE that won't pay off, worse still I think the constitution has a deadline of Dec 4th
243206953835323392	positive	Looking forward to facing Ms. Allysin Kay this Saturday in Petrolia!! http://t.co/Z6CBqYp1  come check it out!
262190619953356800	positive	@PurpleEndorphin: I WANT TANG JUN FOR CHRISTMAS. I want him on Valentines as well!!!
200460502860697600	neutral	@StewartStarlit - Ever hear Tamias live cover of the Winans "Tomorrow"
100469986849591296	neutral	Wilshere didn't play for Arsenal on Saturday and most papers report he's 'doubtful' for Newcastle. Why would there be an England 'row' ?
264244722271387648	positive	Proud of Aishwarya's French honour: Big B: Mumbai, Nov 2 (IANS) Megastar Amitabh Bachchan says he is proud that ... http://t.co/x5721z5E
100001250887741441	neutral	@ashaLadawn yeah, Imma be in vegas from 18th-23rd so I just want a dinner in dallas with friends
100503331952271360	neutral	Hmm.. Sby deh. RT @tujukutu: Kung Fu Panda 2 (in 2D & 3D, both with Indonesian subtitles) tentatively scheduled to open on Tues 16 August
100031690159820800	neutral	@claviusrobinsky am just going to be hanging at my mom's for the week. Ross arrives the 26th and we go straight to Vegas.
102432235105419265	positive	Who wants to go see @USAEaglesRugby beat Canada's Rugby team tonight in Glendale, CO? Send them off to the Rugby World Cup the right way?
256522858317111296	negative	if jenelle comes to the game tomorrow... I'll die #missherlots #itsbeentolong #mybaby
263924763423035392	neutral	@docbungle I may relent and get one myself, but I hope it doesn't come to that. Hopefully all the decent apps will get ported to android
107672029729263617	positive	Godfrey was kinda funny though on comedy central tonight.
258989016005873664	neutral	@MlleSorbet Which one are you there for ? @NoReinsGirl myself and some friends will be at the SA game going to Twickers town for drinks 1st?
246684751505801216	neutral	Drew Peterson is no longer #Untouchable! Tune in for the Lifetime Original Movie Sunday at 7/6c on @lifetimetv: http://t.co/jNmCSInh
108125185902776320	neutral	RT @Lucirmas: Time for #MusicMonday.. Today's choice is PJ Harvey - In the Dark Places, for the album Let England Shake http://t.co/MjGI ...
213837102910152704	negative	@XochilihcoX C'mon Leo where's Endymion....... Or Amsterdam I know he likes Amsterdam. those songs are shit compared to the ones i put
261506689935753216	positive	Listen in Hour 2 for an expansive interview with poet Frank X. Walker who present his works at Murray State on November 1.  #soundsgood
261756309689483266	positive	Harry Redknapp 2nd favourite at 7/4 to be next blackburn boss!! venkys please make this happen!!!! #makeredknapparover
215954116860592129	neutral	Reminder noon tomorrow is the deadline to register teams for the Kickball Tournament at the $120 rate. Price increases to $150 after Friday
256191105102659584	neutral	Derrick Williams and the Stiemer enter the agme for Pek and Klove late in 1st quarter with Wolves leading 18-15
260232337051230208	positive	Chick in my class said Flacco is the best QB in the league. 1- why is a chick talkin football. 2. I cant wait for class tomorrow lol
260905094533500928	positive	#stAte is giving #ULOL the business...long pass play from Aplin to Jones - Red Wolves up 20-0 2nd Q #SunBelt
262072861982859264	neutral	Someone should come with me November 9th to see Romeo Santos meet&greet at Fye at 6 pm at downtown (:
249899808607842304	positive	I'm supposed to sleep now because of work tomorrow but Sen. #Johnny Enrile's life is interesting it's keeping me awake
264165914633715712	positive	They are truly changing the world One Life At A Time. If you're in Mesa, AZ tomorrow come join me and my friend @CollinRaye for a fun night!
102946589009657857	positive	As good as the fights were tonight I'm glad this one is over. One day closer to seeing Anderson Silva clown a massive Asian man #spidersense
261563757212360706	neutral	Calling all reality TV fans: We're inviting LI reality TV stars to join a Google+ Hangout on Sunday and you can too. http://t.co/WzO0bhVm
100001456849043456	positive	Off to see Toby Keith at the Red Rock Casino amphitheater tonight in Vegas. OH YEAH :-)
253079520846946304	positive	Good luck to Joseph Calleja tonight at the Brits. See he's appearing at the Royal  Festival Hall on Friday 11 Jan in Raymond Gubbay concert
110195528733704192	negative	RT @HowardErickson: My sons were watching MTV the other night. Looked like an absolute freak show. What happened to Hank Williams, Johnn ...
264064628336779264	neutral	Vanessa and denies are coming shopping with me on black friday.!
264100832864247808	neutral	2 days till Jack White at Alley Pally then I find out the Ruskies need me to work on Saturday. What's is it like to have a personal life?
115462724519071745	positive	RT @FrenchTwistDC: DC's version of Paris' Nuit Blanche is just 6 days away!! I can't wait ;-) http://t.co/SQFyOG3W
255371466391044096	neutral	Jets selection of Wesley Walker (2nd round 1977 draft), without knowing he was LEGALLY BLIND in left eye, led to creation of NFL combine.
247142872162369536	neutral	Photos are up from last Thursday's party with DESTRUCTO, courtesy of edm ORLANDO! http://t.co/LbrMPZMG
103203884725567488	negative	I officialy hate Windows 7, it just sucks on my laptop. Back to XP tomorrow! (and also a huge delay for the movie again :/, was so close!)
264263949204193280	positive	@Bangz_InYaMouth woosahhhh it's Courtney! Long time no see from 1st lady!
259416408981643265	positive	Mark Martin's the 1st to crack 191 mph, and now leads a MWR 1-2 (Bowyer 2nd) and Toyota 1-2-3 (Kyle 3rd) after 36 cars. #NASCAR
257405045908324352	neutral	Saturday night thoughts:   I was checking out the box scores from the American Hockey League - this box score c... http://t.co/QV4I4rTl
100728934064340992	neutral	Auburn spent their entire practice today inside the new indoor facility.
110978624080982016	positive	PJ Harvey or King Creosote would be deserving winners of the #Mercury2011 prize tonight but think Tinie Tempah will nick it
238017633373532160	neutral	@BIG_NaeNae naww , she got Friday , Good Deeds  , & 21 Jump Street .
237887124450463744	neutral	5 Times Oscar winner John Williams will receive a lifetime achievement award at the Classical Brit Awards on October 2 at Royal Albert Hall
100665263426519040	neutral	#sportsnation just ranked Auburn as the 4th best team in #SEC with Arkansas at 5. If AU wins 3 league games, a surprise. @ESPN_Colin #awful
100062692756295680	neutral	RT @GaGaInfo: For those who haven't heard, Lady Gaga has attended Britney Spears' Femme Fatale Tour tonight! GodgaLovesGodney
262675147293618176	positive	#Ckt #update Pakistan hopeful of Bangladesh visit: Pakistan's cricket board said Sunday it hopes to... http://t.co/5Z9cKGpd from #Shariq
254320831918927873	neutral	YOOOO @ItzLavz & @_Beeniee If Niggas In Paris comes on more than once on the 26th, might have to plank for whole night...
264214955862138881	positive	@MaverickManiacs I know, it went from way too far off to here. I'll see IUPUI at Maryland on Jan 1, just excited to go back to Baltimore lol
112656367495561216	neutral	RT @GuelphFab5: #Guelph Nuit Blanche tonight: 1:30am. Bookshelf Cinema parking lot - CFRU's Silent Dance Party. http://t.co/cCeEDpy
259949052349784064	neutral	@llcoolj If you are the same age as Mick Jagger than may I say you
263996143199993856	negative	Ghost Rider: Spirit of Vengeance was a lost cause. You had nowhere to go but up after the 1st movie. And then you decided to dig a hole...
100212220654387201	positive	Got my Dexter fix for the night. Until 2morw night Dexter Morgan.
264105390818619394	positive	Wish Maddie luck next saturday, she has a solo audition for Britain's Got Talent! :) ~ Ellie xxxxx
251968610136903680	positive	Friday Night lights:   West Liberty 21 Mediapolis 56  Pulling for you Comets!
258204472130555904	neutral	@neeama_jedwardx under pressure release, Eurovision, Victory album realease, 1st European Tour, Eurosong waterline, your fav pic with them
264242742408921088	negative	I will not be able to handle Harry's voice in Kiss You..and I may not survive after hearing all the songs on Take Me Home in their entirety.
263922870672052224	neutral	Tryna get in the bed witha..and put my 3rd leg inna
100048909740670977	positive	Saturday night = NetFlix, my girl, and the internets.  What more does a guy need?
263965983604101121	neutral	Mark Montgomery, David Adams and Austin Romine have been selected to play in the Arizona Fall League Rising Stars game on Sat. #Yankees
254694813243416577	neutral	@TimCross_ introduced me to Big L when i was in the 9th grade. i was really deaf to real hip hop music back in the 9th grade lol
105574429257510912	positive	Really looking forward to the release of Deus Ex: HR on friday, just annoying that North America gets it tomorrow...
102918591468412928	positive	Aug 27th: UFC Rio..Anderson Silva vs Yushin Okami(last man to beat him)..Expect to see the best fighter on the planet put on a fucking show!
264010834429218817	neutral	#SGS Fury on brink of beating Haye to Vitali: Tyson Fury is set to face Denis Boytsov on December 1, with the wi... http://t.co/r6tkMHQI
251138705786556416	neutral	The songs I want to hear most on sunday are Rella, La Bonita, Radical and 50
251188345705750528	negative	I want to go see LA AROLLADORA BANDA EL LIMON on Sunday October 14 in Pico Rivera! But Ivan doesn't wanna go :( who will go with me? Tix $35
113758849688805376	neutral	On the night Hank Williams came to town.
262021967425708032	positive	Safe and sound at #FLIBS We'll be all over the docks tomorrow!
100923304147288064	neutral	My son's teacher is married to a former Auburn football player. I think I'll put him in all Bama gear 1st day of school! #RTR
109484454271131649	negative	Strip club owner "guessing we'll make 5 times as much a night" .. "Republicans got plenty of money. They take it all from poor people"  #DUH
252480155996524544	positive	JETT LOUNGE 3701 clairmont rd ATL. one of the nicest party I been all year. DAMN this is the place to be. Ladies don't miss it SMP Saturday
