105121481662541824	negative	I forgot how sad the first episode of the 5th season of Dexter is. #depressing #dexter #darkpassenger
263554895351787520	neutral	@BucksAdSchool Morning with homeless men evening with Charles Dickens's great great granddaughter Standard day with 1st yrs at BucksAdSchool
262372288865914880	negative	I just realized that Thalia is going to be tortured tomorrow for an hour lmao
263817519662522368	positive	If You Can't Beat 'Em, Recruit 'Em ( #YHOO, AOL, GOOG, TWX, AAPL: Inc. (NASDAQ: YHOO) may have the biggest weapo... http://t.co/EuacVGrv
103263786764480512	positive	RT @Trujohnson2: Love it when scouts be at our Practice..  I counted 4 today..  Broncos , Miami , Philly , && Tampa Bay ..
264208831398154240	negative	I wanna go to the studio with Ulysses n them tomorrow,but i cant. #BARS
251749732202979328	positive	first tweet ever, loving san diego! Busy day like always and ready for @UFC on Fuel TV tomorrow.
263803925294088192	positive	@SemiProJoe @SaraWoof looks like it's coming on Valentine's Day. I liked the 4th, I think 5 will be just as good. He's in Russia this time.
263735530230001664	neutral	Police: you have the right to remain silent. what ever you say may be hel against you Me: Harry Styles
264184542305345537	positive	Gotta go see Flight tomorrow Denzel is the greatest actor ever
264133032355713024	positive	Tomorrow is the Big Day!!!!! We celebrate UpNSmoke Woodlands one year anniversary. Grand Prize winner of the... http://t.co/H6Ehttse
264120256480559105	neutral	I'm talkn All Black party on the 14th then VIP all nite Saturday at Sky.... Family n friends will be in da building ....We gon shut Sky down
263732569508552704	positive	Kick-off your weekend with service! EV!'s Get on the Bus trip to the Boys & Girls Club is Friday from 3-6! Hope to see you there :)
248229381166727168	neutral	@IAmPolo__ lmaooo not even it was most def in like 8th grade I think ? When I went to Berkmar !
100607300238180353	neutral	Real Madrid have signed a seven-year-old Argentine boy, a spokesman for the club confirmed on Monday http://tinyurl.com/43ye3bh
260034647466070017	positive	@Kibsta91 Was at Barnet for Edgar Davids' debut on Friday then FA Cup yesterday. Blog very nice, thanks. You had much feedback on the first?
195010576831889408	neutral	30 free tickets to watch Saigon Heat vs Singapore Slingers in Singapore,4pm Apr 29 for the first 30 fans email to Community@saigonheat.com
262193907973124096	negative	@Peter_Owen1: Bulls season tips off Wednesday night vs Sacramento Kings. Excited is not the word. Frustrated is the right one...
263238987597107201	neutral	@echelleprakash 1st its like Imma play Headlock, and then Safe and Sound, and now you gonna play All Star. hmmmm
263803981384515584	negative	This is Austin Rivers 1st game and people sucking him he a rookie chill !
263801798542897152	neutral	Rockets have 15 assists in the 1st half. Lin and Harden each have five dimes.
264113005078405120	neutral	Me and @hayleyrose booked in to see A Good Day To Die Hard on February 14 2013 (Valentine's day).
258900348268331008	neutral	Every time I wear this hoodie ... I think of the hoodie march .... And Trayvon Martin ... And the ppl I knew personally who died
255467554787708928	neutral	Records on the line as World Cup race resumes - Fabio Capello's Russia face Portugal in the pick of Friday's 2014 FI... http://t.co/6KNexqif
100591779098796032	positive	RT @itsjessikah: That's a beautiful dream! RT @GQswaGGG: I also had a dream last night that football season started and the Ravens ... h ...
261086869503238144	neutral	@gm3ek Are you going to SJP tomorrow night pal?
164827944089419777	positive	#SkateNight Tonight 8pm Stardust Skate Center FREE b4 9:30pm Hosted by #SAAB its always fun when you rolling!!! haha x1
264072802116726784	positive	@SkinnyZ0mbie   Maby cuz u are sooo good at bowling and they are now scared from u :p  They got sick from u taking the 1st place everytime
258436505637371904	neutral	@mattmonihan #mittromney may have run the olympics and balanced Massachusetts' books but I learned all I know about economics from SimCity
263786661517860865	positive	@RevJCMitchell  Thought you might appreciate this photo taken of AJ at the Celebration Sunday better than anyone! http://t.co/Rfa01cr5
255983114126520320	neutral	If any Baltimore team mascots come up missing 1st person of interest should be Billy Cundiff! Or the Redskins mascot is taken blame him!
219955012581851136	neutral	Checkers to move to South Division in 2012-13 - Last Thursday, the American Hockey League concluded its annual Board... http://t.co/tyCjmOv2
264075183738998785	positive	@AustinMahone ..Morning Austin.....I'm going to bed now..hahha 8:45pm in South Africa.Writing math exam tomorrow.Wish me luck Xx
222575052904857602	negative	Playing Jacinto on Gears3 on Guardian fer the 1st time nd its raining wth..
261146922339942401	neutral	Tottenham boss Andre Villas-Boas has confirmed he has no plans to sell Emmanuel Adebayor in the January
201378148007415808	neutral	Harris English hit a dude in the top of the head on his 1st tee shot of the day!! #wow
263731369744678912	neutral	The Knicks are practicing tomorrow now that their game against the Nets is postponed.
229042263966228481	neutral	If aliens observed Earth to learn about us, I wish they'd watch the Olympics. Rather than Mardis Gras or the 4th of July...
233293514346229760	neutral	Updated #PackinSpain blog with some stat totals, like Lorenzo Brown and C.J. Leslie with double-doubles: http://t.co/YkzyDc8z
263549771162198016	neutral	#wordtomymuva I'm going to that Lakers Vs Heat Game Feb 10th in Miami #IAmNotPetty
201389283230236672	neutral	Clocking that marshal in the head with his opening tee shot clearly rattled Harris English. Took him 2 holes to drop from 4th to T26.
93497043615629312	positive	Well the cool thing with Democrats in power, DOMA is getting reviewed on the 20th.
111523236113694720	neutral	Tonga will perform the first haka at Eden Park on Friday; the All Blacks can choose to do their haka simultaneously or once Tonga finishes.
261246099203977216	neutral	Randy Lynch at Oscars this Friday night with his band BLACK LIST. http://t.co/Jf1DSwnG
250363678203985921	neutral	Today is the anniversary of F.Scott Fitzgerald's birth (116 yrs), Dr. Seuss's death (21) & the 1st pub. of The Hobbit (75) via @brainpicker
100197935970652160	neutral	If your still running Windows XP, then it may be time to upgrade to Windows 7 to ensure you receive latest upgrades and support in future
100015994440925185	neutral	@olejp3 http://t.co/ldMxHLq Im sure it will replay on NFL network tomorrow too.
264135058733006848	positive	Uh football boys... win tomorrow so we can run it in Becky's face that she wasn't there.
248084094934712320	positive	TY for making me a woman!!!! @EstelleDarlings said at constitution hall Saturday dont EVER EVER EVER EVER let someone make u feel like shit
102191503388053505	positive	Girl singing the national anthem tonight is a Boise State student. I gave her a "Go Ducks" before she went out. Didn't seem to faze her.
262473937848520704	neutral	MT @LabourBroomhill: FREE tickets for @tom_watson talking about Dial M for Murdoch on 6th December are available https://t.co/WREO79mt
264080095965220865	neutral	Watch live Queen of the South vs Edinburgh Cit http://t.co/LnBnANAn
264185213125537793	negative	@MarkHalperin Arrogant! Came to 1st debate knowing he's leading in polls so he didn't have to prepare! Then Romney shows he can be POTUS.
102525887077040128	neutral	RT @OSUrugby: The @USAEaglesRugby take on Canada tonight @ 9pm EST in a warm-up before the Rugby World Cup - If you have Direct TV... ht ...
100017632790585344	positive	RT @MaliagotMonae: my mom just told me she's getting an Ipad 2 on Friday....I better get a Mac for Christmas.
263787584969396224	positive	Hope everyone made it to the UC in time to see the Bulls raise their 21st straight Financial Champs banner. A true dynasty, we have.
100125117757145088	negative	So we arrived in Scotland yesterday and it hasnt stopped raining since. And to make things worse its sunny at home. #typical
264078591355138048	positive	Looking forward to seeing the Illegal Eagles at Dorking tomorrow night with Lin & Amigo. Best Eagles tribute band around. #illegaleagles
264196093464698881	positive	Great MBB Game - felt good to be back at the Vadalabene Center - great staff/promotions too! WBB tomorrow - can't wait!! #siuenation
254762661164773376	negative	@Jmanziel2 instead of watching Lorax pregame, try Friday Night Lights. Tim McGraw can beat the fumble out of you
113046984293744640	neutral	Amen RT @LeonKilledParis May the Universe guide Tony Romo's arms and eyes toward Jason Witten. And May Jason (cont) http://t.co/MYoGMSq
217103542819897344	neutral	@LukeChandler 25th of July. 7PM at Volstead (it's a bar). Can you MC for a Quiz Night?
263477308021694465	negative	niggas boutta be DROPPIN like flies down georgetown tomorrow , you wont catchh me there !
220373711348432896	neutral	Who wants to take me to the Fairground's or Williamsport's fireworks tomorrow!
105000195091202048	positive	Bolton away tomorrow! Hope @swp29 gets a game....after his quality pre-season. Up the blues! @MCFC <3
261797573591982080	positive	Actually the only things that survive would be cockroaches, Twinkees and Keith Richards. Happy Friday! http://t.co/gRRQUiWh
251763069129199616	positive	@davetaylor2112 Hey there David Taylor. Nice to have you along sir. How is your Friday? #mushroomfm
225672733084749824	negative	Frank Gaffney is not insane. He may not even be a true hater. He is a bigot for pay, just like Steve Emerson. Hate is their racket.
100017370185220096	positive	RT @CGBlasi: Very impressed with Joco Teenage Republicans! 16 teens showed up today, ready to #fight big government and Obama! #NObama
261700001649020929	positive	Like a good neighbor State Farm is there, with an alarm clock that'll actually wake me up tomorrow.
263936487266070528	negative	Fireworks go on sale tomorrow. I'm sorry, but after experiencing Independence Day in the States, NZ fireworks can't impress me at all.
249061280449703936	neutral	FM Preview: West Ham United v Sunderland 22 Sep 2012 - FootyMad attempt to assist you with their form guide as West ... http://t.co/vYmrr56h
264188082436321280	negative	Embarrassing. Rams cut Alexander. Yes I know he's from Mizzou. But c'mon. Chiefs D makes unknowns look like pro bowlers.
227146417951617025	negative	@picesbaby123 when we were in 3rd grade she stole my Valentine Day cards and crossed my name out and put hers on them n passed em out.
242503955094061056	neutral	Sunday Times launches the Marie Colvin scholarship, seeking future foreign correspondents, under 26. deadline sept 30: http://t.co/aXORYHPn
261316577604018176	positive	FYI - the ridiculously adorable ladybug Larry Bird gives his 1st piece of candy to is our producer/ director Chris Koch's gorgeous daughter!
118167524167782401	negative	Lmao RT @HeatherNoel13: Curtis painter looks like the kind of guy who would try to buy beer on Sunday. #scumbag
253192895010578433	neutral	@NatalieGrace8 may even join you at Joseph wright
228051598566371328	neutral	@DonJuan52 that's what I like to hear! Friday is my margarita day
233934300192575488	neutral	may as well sign up Scott Dann and Roger Johnson whilst your at it.
264180570806964224	neutral	norv turner calls a play action pass on 1st & goal at the half-yard line, rivers throws a pick. #chargers
264160697439645698	neutral	3 yard TD run get Calhoun even with East at 7-7. 5:53, 1st Q,
264203953435197440	neutral	Anybody want Carrie underwood tickets for Saturday night in Charlotte??
259605337500442624	positive	Jgh from SPC with Yfc 3rd years. Masaya na nakakalungkot. I hope for our change guys. #YfcPublishingISULONG
103458972203368449	neutral	Today, Wisconsin's last two recall elections will be held. @pmwenzel looks at the candidates in Kenosha's race. http://ow.ly/64mE0
263273842024267776	neutral	Sat next to a black guy on a train, when Niggas In Paris came on... Had to turn it up !
241503286157524993	positive	@tressawill Good morning Tressa! Hope that you have a Fabulous Friday!
262206312023212033	positive	In rugby news, @BasRFC are winning 26-5 at Cobham, with the four-try bonus point in the bag. See The Monday Gazette for a full report.
94232811652915200	negative	Democrats call on Lt. Gov. Ard to resign: Democrats called Thursday for the immediate resignation of Lt. G... http://tinyurl.com/3m3fpwl
246697394647998467	positive	Rella wake up to shank one day thn pczeey the nxt day so who dat 3rd baby pappy lol #SheDontKnow
261161473437487104	neutral	@Ayah_moro No, I'm going to Muscat on Friday. What will you do?
261190741349511170	neutral	early bird @TomCole24 catches the strava fail. @cyclingsam9 bosses LSCC club run sat in Spartacus flemings, wheel all day.
257663678143422464	positive	October 22 .. See you @ SM Bacolod ! :">  See you there SweeT Heart! <3
260807368214986752	neutral	@DanicaPatrick  I just ran a marathon on Sunday with my hair bright pink for BCA! #BecauseICare
264193232026624000	positive	As I'm watching Candyman I realize that its it not scary at ALL! Kinda funny or it may b the liquor either way I'm laffin
256658815448145920	positive	@ForeverFlailing Well you better be dancing on the 25th! :D No but you went cray at Niggas In Paris. :)) I FEEL LIKE DEATH.
264154993689518080	negative	Not here in the East:( though...Moon, Jupiter, Capella light up evening sky on November 1 | Tonight | EarthSky http://t.co/Hv7KPxpa
264147858708647936	positive	Hello from Dublin! Tomorrow we're playing at The Button Factory. Onstage at 9, but if you come for @toquiwa_jp at 8, you won't regret it!
226024004966817792	neutral	@andy_oconnor @erickjpressman I'm going to try to bring the @gothamgirls to Volstead on Sat.  What you guys doing tomorrow?
243825919536553984	positive	Lowering the Bar may have found the first recusal motion to cite Girl Scout Cookies. http://t.co/ZmQwuuXM Thin Mints are criminally good.
100834520466595840	neutral	tonight I dreamed of being in Orleans with the bus lines of Milan, and the IperCoop of Piazza Lodi instead of the Carrefour of Place d'Arc.
262177445644488704	negative	If @marco_ten didn't like Coloccini being likened to Bobby Moore, he will hate MON claiming McClean and Johnson 'class' #safc #nufc
233963644122185728	neutral	You know you're in SF when, on a thurs night at 6pm, there are people lined up around the block to see Reid Hoffman.
255033061790593024	neutral	@richards2507 @colourpurple210 Ive just realized Minotaurs 1st Company consists of mostly Termies, Preds and Vindicators lol #ForgeWorldOnly
256008278725758977	negative	Awww hell. It was a black cop that shot the white student at South Alabama. Let's all go march naked in Mobile for Trayvon. I mean Gil.
261584813318885376	positive	Good result tonight, though! Part one of Rodgers' Gamble paid off. Have to wait for Sunday for part two. If we win that, we're off! #LFC
177954195096346624	positive	#RonPaul campaign manager Doug Wead: Contrary to media lies, doing JUST GREAT with delegates even after Super Tuesday http://t.co/cjsRQgrx
264232827514671104	positive	Yolo really u gonna tell me that I am living my life it may not be how it use to be but I love my life way more being a mother #RNS
262664182414061568	negative	@NeilHarmanTimes Just noticed you using the Spanish abbreviation "NO sure", no? Think you're missing Rafa, mon brave
100000794790727680	positive	One Night like In Vegas I make dat Nigga Famous
245879760952123392	negative	Valentine day has been cancelled..what? Why? how? you may be asking. But you see it's simple math.. 14-2-12 =0
256254993294827520	neutral	Does Girls Gone Wild still make commercials?  If, God Forbid, this one goes to extras, we may find out.
263949955427864576	neutral	So plan for tomorrow, morning jits with Frankie and Tom, open mat drilling and specific train with my great friends then PHO
172503040673329154	neutral	Anniversary of miracle, national margarita day, and ash Wednesday. #celebration
261492130806108160	neutral	@SirEddieBaby if you mix Jericho, Dbz, Fairy tales, and Ghost Rider in a 3rd person pov with magic that was mine last night
262640765249916928	neutral	Just finished watching "The Vow" for the 5th time.
263641351495745537	positive	The Bulls head to CLE Friday night.  One night doesn't a season make, but that was a solid win over WSH on Opening Night.
100332910820864001	positive	my mum & dad are going to nigeria on tuesday, everyone wish them a safe flight
262488876524920832	neutral	Mark the dates: Miss Earth 2012 coronation night Nov 24, Sat, LIVE on Starworld, 8PM. Free-TV broadcast on Sun, Nov 25, 10AM on ABS-CBN.
263795814470664192	positive	Aww love you Austin Rivers and happy to see you get start in 1st NBA game...but it's against my boys, LETS GO SPURS! #Spurs #NBA
263190340327047168	negative	.   DMDK party led by actor Vijayakanth may not sustain for a long time under the shrewd politics of Jayalalithaa.   http://t.co/dsFjXS1O
263748118091276288	neutral	FAQ: What is 'skeuomorphic design' and the executive shakeup at Apple: SAN FRANCISCO, CA - MARCH 07:  Apple CEO ... http://t.co/YCvoPl98
100230453109325824	positive	Having a good Sunday, sooooooo happy that college and NFL season is almost here, the weekend sucks without football!!!!
263681897807364097	negative	I got to piss like a Russian race horse in the Kentucky Derby with a glue trust stuck ahead of him and he in 4th place
241140200753987584	neutral	I dreamt I sat with @MaryRobinette at a Star Wars event, eating @Alinea's Lamb 86, watching James Lipton interview Ralph McQuarrie.
256227276885225472	negative	My godsister better take her ass STRAIGHT home after school tomorrow. NCA won't be the place for her to be after school
203645662078840832	neutral	[Today 5/19]Gag Concert is back with Eng Sub! Kick off your sat morning with laughter!
215373536326463488	negative	Ahhh Song Joongki.... why you still on the 3rd place ?? *sobs*
264179688719675394	positive	@vbaffour94 @timtebow love this picture! Praying for you right now Vanessa! May the Lord be your strength! :)
249039814953934848	neutral	[FAN-ACC] 120921 Incheon Airport: While waiting to board the plane, Dongwoo sat on top of Woohyun's leg !! xD ~ (cr: weibo)
263337835162128384	neutral	Oscars Well makes his debut over fences at Punchestown tomorrow. It looks as though he'll have Plan A and Darwins Fox to overcome.
263865406131933185	negative	I'm assuming that HEB ran out of candy and people decided to give out pizza instead because it was busier than Super Bowl Sunday today
254354160189845504	neutral	@T19ht_h34d that's true but until its all decided that's who @Cbus_Matt is going with. Danny Care would be 2nd choice right now.
172186257777115136	neutral	@mw55 what do you expect Thursday? Are you going to pull out that Mikey Magic on Duels day again? #hopeso
263695206195539969	negative	@RefriedBrean And then both teams took dumps in the 2nd round of the Big Dance, KU flaming out against UCLA, Mizzou losing to Northern Iowa.
263706155778441216	neutral	@Vikingdane1 Thinking a bolt action .30-06 may have to be in the cards for Valentine's Day or something.
264094767380561921	negative	I have to go to Chapel Hill tomorrow and the #USPS STILL hasn't contacted me or found my damn SPEECH PROCESSORS!!!! I hate the #USPS
264199662611873794	neutral	November 16 Breaking Dawn part 2 is coming out who gonna watch it with me ?
257537488804016128	positive	@Daisyyloera okay but you need to go to Berkmar so we can see each other everyday and it could be like 7th grade.
263231810186645506	neutral	RT: @alviniaviray1: all fans of Toni Gonzaga she there @ landaco plaza albay legazpi october 30 tonight 8pm @toniliciousz_tg @tonigfanpage
264193522813521920	positive	I think Big Bang should tell us where they're celebrating TOP's birthday on Sunday so VIPs can come celebrate together with them ^^ LOL
263961091640545281	positive	Big day out on 10Nov @QUOZhappens. Gallery hopping/talks/guided tours & more. My list of must see galleries/events   http://t.co/jPD62NeB
264254250736046081	neutral	ARRIVAL of ship: NMS 202 Port: ABU DHABI Time: Nov 2 2012 6:21AM (UTC) (Time of arrival/departure is the time the vessel approach...
264170909542252544	negative	@HarrySilk Aston Villa are a joke mate and so is your profile pic u may wanna hit the gym b4 u head to the Bridge w your bitch slaps #JogOn
100967212612980737	neutral	RT @nyjets: This afternoon's Jets training camp practice will be closed to the public due to heavy storms heading toward Florham Park, NJ
104246362429849601	positive	RT @Robbakerashton: Heading back to Chesterfield for a job tomorrow after an intense & amazing few days in Derby with the @lostalone lad ...
109393614064455680	neutral	HTC Announces Two New Smartphones - the Radar and the Titan: HTC announced two new Windows 7 smartphones today a... http://t.co/uoobqH6
264090871329337344	positive	Big game for @MiamiHEAT tomorrow, away vs the Knicks at MSG. Personally think Knicks will win... first game, MSG crowd, Sandy disaster...
264189214982303744	neutral	@HeartThrobEsco oh shit you just reminded me. I have work at 11 tomorrow at Woodchicks and a call in at 1 at Vans. could you cover it?
218344507056455680	positive	@orjan_nilsen Endymion is now rocking the charts, What nexts? C'mon tell us something
264175696979570689	neutral	Knicks vs Heat tomorrow. Kicking off the season at MSG.
264076328855273472	negative	Israel's red line on Iran: 240 kg [of 20% enriched uranium] // Number was put to Netanyahu and he "did not contest it". http://t.co/XnKk2CSr
231274508420534272	neutral	For my 18th birthday I want a lap dance from that fat chick in Rella.
192573930609971201	neutral	Jenn's post below inspired me to find a few more pics of Alex at the Independent Spirit Awards this past February.... http://t.co/PSJWMBsj
102752363693080577	positive	On September 3 at the Pride Park Ground, Derby, UK. There will be India vs Pakistan football match. That will surely be worth watching!
217130754369519616	positive	Dr. Mohamed Morsi announced as Egypt's 1st elected President after the glorious 25th of Jan Revolution. Congratulations to #Egypt
248076016290000896	neutral	Attending the World Music Festival? Bring in your ticket and receive a wrap and drink for only $5! Fri, Sept 21; Mon, Sept 24-Thurs, Sept 27
258942026408685568	positive	@GBarlowOfficial awesome cos I was ready to get on the phone at 10am tomorrow to get tickets for st David's hall!! Happy days can't wait
261577895221288960	positive	10th grade I said Nipsey Hussle the best rapper out. Everybody was like hell naw then when the marathon came out everybody was on his nuts
263570249012637696	neutral	Wonder if Chris Christie can cancel Valentine's Day and move it to April..Flowers are cheaper!
222446336115621889	neutral	@justinrsutton agreed. that's like the NBA All-Star game taking place in October.
264087629237202944	positive	@MsSheLahY I didnt want to just pop up... but yep we have chapel hill next wednesday you should come.. and shes great ill tell her you asked
263578939371442177	positive	Bowling Doubles tomorrow. Hope everything will be good tomorrow. Let the luck be with us. #Sukipt2012
258638784390905857	positive	So #CabinFever2 isn't as good as the 1st one...it's better than Taylor Allderdice tho @krdzn
262276827920334848	positive	#Trayvon My daily tweet (10-27) in memory of Trayvon Martin - killed 245 days ago ~May you Rest in Peace~ (We must never forget you.)
91687000574394370	neutral	Democrats defeat Republicans 8-2 in Congressional baseball game tonight.
100109373380108288	positive	RT @ZaidJilani: The brilliant Drew Westen offers a great critique of the Obama presidency: http://t.co/DOBUyVU
255253089152544769	positive	@SSbike yep, wanted to limit it to 1 tweet! :)  impressive palmares. While I'm here, stages in Tirreno,Vuelta,Paris-Nice,Suisse, 4th Roubaix
233812409003962368	positive	Imaaa be gone til Sunday the 19th ! :)
101120849280634880	positive	May the sun in his course visit no land more free,more happy, more lovely, than this our own country..Happy Independence Day.
232152567843540992	neutral	Forumcast Ep5: The 4th on the 5th- we talk Ghost Rider:Spirit of Vengeance,the 4th of July & Falling Skies http://t.co/DkHa5wuK
254047889716813824	positive	#BetStyleLounge this Saturday @Dtlr will be Turnt to the MAX! Come see me and @DjPharris rock out! 35th and King Dr!! http://t.co/30fmUpli
264092734116220928	neutral	Please remember that the deadline for the 1st Quarter Box Tops for Education and our Trash for Cash fundraiser is... http://t.co/cKL5wjmp
262954275930529793	negative	On MVC teleconference, it seems Jacobson found a lot more things wrong with Saturday's exhibition after seeing the tape. #UNIhoops
111660997458141184	neutral	Re doing a bio and watching the Republicans debate while smashing some Pineapple sherbet. Not sure what to make of this evening lol
256205625158168578	negative	Maino thinks I'm really going to this 2 hour tomorrow.. I'm not going! I. don't. give. a. fuck!
263945101053673472	negative	Fuck it... no one pays attention anyhow.. THIS! Next Tuesday on @thered_show, the original Nirvana drummer Chad Channing! @themixxradio
259849127058362368	negative	Things that you never do on time:  Apply for FAFSA, your 2500 word paper due on monday, restocking on ice cream.
257303224950870016	neutral	Got #Revenge on the mind? Niners host Giants in NFC Championship rematch tomorrow! Score last minute tix here: http://t.co/kd8ZaI92
249170431821615104	positive	I took my boyfriend Best virginity last night in Club Bodi...it was her 1st time goin 2 the club EVER @smokers_lane HAPPY BDAY CHUM CHUM
248452744053141505	positive	Seeing @wyeoak AND Maya Rudolph cover Prince songs with @theroots tomorrow night. My mind is pretty much blown.
