263180504017285121	neutral	Wisin & Yandel record song with Ricky Martin, JLoTimes of IndiaThe reggaeton duo Wisin & Yandel announced Monday... http://t.co/I4SOY1Xx
263972222677417985	positive	#NowPlaying Michael Jackson - She's Out of My Life (Live At Wembley July 16. http://t.co/vxRYuADn L.O.V.E it! #MjTunes
260787675873824770	neutral	Cupid and Psyche isn't an original Greek myth. It was a story in The Golden Ass by Apuleius and often cited as the 1st Fairy Tale.
246320883503865856	neutral	Last, U-School HC said the next member of the Bomb Squad will be 9th grader Sam Bruce, nephew of Isaac Bruce #2016Prospect @larryblustein
264180373813067776	neutral	FB: Three runs do the trick for MTSU and they are out to their own 33-yard line. 1st and 10
258204472130555904	neutral	@neeama_jedwardx under pressure release, Eurovision, Victory album realease, 1st European Tour, Eurosong waterline, your fav pic with them
261013506994880512	neutral	Ferry Corsten vs Armin van Buuren - Brute (Armin's Illegal Drum Edit) c'mon make some noise!!!!!!!!!!!!
175154449617141760	positive	@Bieberbucks: March 1st is National Bieber Day! Wooohoooo! :) [Like it? http://t.co/vhccymul ]
263927868046843904	positive	Lemon drizzle cake man gave me a free latte, and it's possibly the best latte I've ever had. I'll be back tomorrow to give him all my money.
200098033189404672	positive	After that game, I can't wait to see what my #HEAT do to the Knicks tomorrow
111809777004322817	neutral	Tempted to get a Droid Bionic today but rumors of the Nexus/Droid Prime in November are keeping me from getting one.
263764977544986626	neutral	Omg, Bullet For My Valentine are coming to the Netherlands march 21th. I might attend that one too :P
258167495649816576	neutral	milkily handsome in the manner of a cinematically doomed first world war infantryman: @barneyronay on Michael Clarke http://t.co/YjzCCNjb
263355513771794433	neutral	NEW MIXTAPE MONDAY!!! HOSTED BY @djyoungcee and Trina!!! I KEEPS it moving!!!!
263803925294088192	positive	@SemiProJoe @SaraWoof looks like it's coming on Valentine's Day. I liked the 4th, I think 5 will be just as good. He's in Russia this time.
113033961294401536	neutral	Fantasy-wise, all I need is 4 TD's from Romo and 4 from Holmes tonight
217966300725657601	positive	Hopefully doing a meet and greet Friday Night With Stan Walker and Elen Levon :D  Bring on the celeb life!!
102011332794122240	positive	@Irenie_M Irene Thank you very much for your lovely MTs today much appreciated! Hope you have a great weekend!
264161856208371712	neutral	North has a half day Thursday, Einstein doesn't. Anyone wanna go see Ms.Kable with me?
259938171205345280	positive	OK I guess I will go see Emmylou Harris play her album 'Wrecking Ball' on Wednesday and so maybe you should also come: https://t.co/VhmF9mbl
100455365241602048	neutral	@iSOLEDmysole imma check it out then wait till the Carter IV drop on the 29th before I make a decision like that one lol
203850331845697536	negative	WRITER #MOTIVATION: Dr. Seuss's 1st book was rejected by 43 publishers before it was accepted by the Vanguard Press. Don't give up
255804479130185731	positive	@mayhemmiller Nick Diaz is da Best! Smoke weed every day and drop out of school in 6th grade! Fuck Yeah!
262576861014540289	neutral	Christianity is nothing else but the imitation of God's nature.  We seek a relationship with God through Jesus ..."Lord that I may see".
262981809053265920	neutral	The 1st Academy Awards ceremony, presented by the Academy of Motion Picture Arts and Sciences (AMPAS), honored... http://t.co/UWIF37QV
100155707663466496	positive	Eh, em...attention! True Blood is on tonight, oh yeah! Sink ur teeth into it! LOL
109000977264295936	neutral	Boehner proposes Obama speech be on the same night as NFL opening night...  http://t.co/kBX7PRr
111355244914544640	negative	RT @Lord_Voldemort7: Apparently the #vmas are tonight. I refuse to support anything which helped the Jersey Shore cast flee the hurricane.
253398572618375168	positive	Il Divo - Somewhere I am going to see them in Dubai Friday ,,love ,adore them  http://t.co/2tCCipOi
231339984865615872	positive	Its FRIENDSHIP DAY coming this sunday and people are reacting like Valentine day
196318159245017088	positive	Heat vs Knicks gone be the best series in the 1st round..
255498184619618304	positive	Now... I miss Rui En on TV. It's okay... 18 February marks the day when Rangels get to see her again.
213837102910152704	negative	@XochilihcoX C'mon Leo where's Endymion....... Or Amsterdam I know he likes Amsterdam. those songs are shit compared to the ones i put
264196093464698881	positive	Great MBB Game - felt good to be back at the Vadalabene Center - great staff/promotions too! WBB tomorrow - can't wait!! #siuenation
111405551396724736	neutral	Earliest possible date for Amanda Knox appeal verdict: Sept 29, per court schedule just released. Final arguments begin Sept 23
249069935379234816	neutral	Playing with Fluke tomorrow night in The Sailors Return. #Weymouth. #live gig.
262999273275260928	positive	@elifyk1 Hi Elif  Greetings from USA midwest  How is school going?  Happy Turkish Republic Day!  I can't wait for Nov 8 #NewGlee Yes!
262887182199566338	negative	I noticed all the Huddlestone haters were conspicuous by their absence yesterday, particularly when he assisted Bale for the 1st goal #THFC
261923510660788224	neutral	It's Conference Championship Weekend at NCS!! Come out tomorrow to cheer our Raiders on to Victory in the VIC and... http://t.co/UqqFjVda
257228503500587009	neutral	Queen's Brian May says Freddie Mercury Biopic is on the way. Sacha Baron Cohen will play the role of Mercury. http://t.co/gn1pRFyt via @nme
255984538059157505	neutral	There are now only EIGHT tickets left for @casualviolence 's November 5th show at the Leicester Square Theatre.. Get in quick folks!!!
255467554787708928	neutral	Records on the line as World Cup race resumes - Fabio Capello's Russia face Portugal in the pick of Friday's 2014 FI... http://t.co/6KNexqif
263425309813129216	positive	@martinamcbride Just found out that Justin Beiber is going to be in NYC when you are on Long Island December 7! I know Emma is a fan! :)
263432399453556737	neutral	@solispaola12 Hey can you plz help try to get to Justin biebers concert on december 3rd in la !
264090871329337344	positive	Big game for @MiamiHEAT tomorrow, away vs the Knicks at MSG. Personally think Knicks will win... first game, MSG crowd, Sandy disaster...
255724676901376001	negative	@bhhopppps_24 and I'll pull out the Kentucky Derby  picture from 9th grade. #blackmail
264162367263346688	positive	Well, settled in to the next temporary residence. I have some very nice coworkers. Going to check out Long Beach and the apt tomorrow.
262984741752557568	negative	1st free.edom taken away.  cant buy your size of soft drinks.  2nd.Religious freedom for Catholics. next? Obama...coming for you
262010869125369859	neutral	@BaddGirlCouture She shot it on December 21 2011 the same week as RIM & SH. Those 'screenshots' were for the vibe magazine.
247728701838594052	positive	Bel Ami you are one strange movie, but I like you and I must keep watching....I may have to read the book.
262623972447887361	positive	Sushis + Rafa on the TV = best way to end this Sunday. #vamos :-)
260079552624226305	positive	Tomorrow, the biggest name in music & entertainment is on the show! And no it's not Ricky Martin. Who is it? Click - http://t.co/RJgsDgjQ
264046621245988864	positive	@sallydubats May your new year be filled with Magic.
111326993508859906	positive	@JamesCrosby28 watched the cricket, awesome game, followed by jersey shore and seven dwarves! Great night of TV!
261645470726774784	negative	extra point is no good. Its DSU 28, Morgan State 20 with 5:02 left in the 3rd quarter.
100109081813057536	positive	Tweet di Brintey So amazing to have the beautiful Lady Gaga at the show in AC tonight. Love you girl.- Britney http://fb.me/13C1kUZaw
242761418078826497	positive	@Al_Pro_ best one ever 7th track Dr.Dre on the beat ft. Biggie,2pac,Big L,& Big Pun...song is gonna be called "We Ain't Dead" lmaooo
263134843137830912	positive	Mavs will beat the Lakers tomorrow accepting all bets
229763754991185920	neutral	@BarDownBombs I grew up in Alsip, oak lawn is like my 2nd home. Reason for the city is wifes job at (cont) http://t.co/IsFZAuVh
263775652711366656	neutral	My trick or treating will happen tomorrow night..at Walgreens....in the candy aisle.
249099760936558593	positive	Three times Grammy nominated, Brit Award nominee and Ivor Novella winner Joan Armatrading takes to the stage on Sunday! http://t.co/M2uukRLx
233659106186108928	neutral	You only have three days left, this Sunday is the last day to swim at Fairground pool this season.
264211066370809856	negative	Las Vegas is my 3rd home and I'll be there after the election but The Wynn just lost my business after the bogus Obama comments.
105663631999504384	positive	The MTA will be at Mondawmin Metro Station from 3-5pm today to celebrate The Baltimore Grand Prix. We'll have a race car for you to see!
262312695339053056	neutral	Late Friday meet was just to clear air, says BJP a day later: Sources said the rumour about Gadkari quitt... http://t.co/8DQT9tL4 #india
213062155036135424	negative	Lucas Scott, C'mon! Why'd you die your hair!?
103957750249291776	positive	@CJonesy77 dunno, Sky reporting it tonight, Everton & Bolton also interested according to Twitter search
264113005078405120	neutral	Me and @hayleyrose booked in to see A Good Day To Die Hard on February 14 2013 (Valentine's day).
264227933789495296	neutral	Who to the bell game tomorrow though
104319460143415296	negative	Oct. 2 is almost too far away for me to wait for the return of #Dexter!
118799701016453120	neutral	RT @pink_funk: End of an era RT @CharlesMBlow: RT @GMA: Andy Rooney, 92, will make his last regular appearance on @60Minutes this Sunday ...
250737198708711424	positive	Freestyle Wednesday - #NP Big L, Jay Z, Mos Def, Black Thought, Eminem, Yelawolf... Love it
118167512838979584	neutral	It's going to be a somber set tonight for Curtis Painter's Nickelback cover band, Something In Your Mouth.
264152359976976384	neutral	Tottenham v Wigan: Match Preview::  Tottenham and Wigan are set to meet at White Hart Lane this Saturday as the ... http://t.co/hCcGRbLu
232547607182991360	neutral	Help me smart peeps:  I need to get from the city to Alsip, back to the city on a Friday night.  Cheapest way to go? (it's for a wedding)
261035336895979520	neutral	BJP must clarify charges against Gadkari: Congress - The Congress Wednesday asked the Bharatiya Janata Party (BJP)...http://t.co/QPhXUtia
258589252147892224	negative	We're experiencing some issues with Fuel TV (Ch 39). Should be back up Friday or Monday.
102403002878525441	neutral	Inbetweeners and ben and jerry's tonight I think !
263024121061982208	neutral	First 24 hours in London got given a free rail card, saw 3 squirrels going to work, may have found a home & there's big Alan rickman posters
261798529536774144	neutral	Tickets have come to see #TheUsed on November 8th at the NIA! Sweet, even though Evanescence are headline I'm just going to see The Used!
252785598492979201	neutral	Wanna WINWIN some tickets to the Vice x CPH:DOX - DK x DR party this Saturday with James Murphy and 2ManyDj's on... http://t.co/9HhkqNfI
264021351034138624	positive	Looking forward to Friday day and night! Excited to be involved in the seminar portion at Drexel and the show at... http://t.co/Y2GfBkiF
263391294355820544	positive	Girls Gone Wild gon be at my school Thursday shit gon be crazzzzyy make sure I be my ass on campus lol #NPU
264151587881115648	positive	@OfficialKat You may have a few extra followers from Glasgow Scotland tonight. We all agree Max would make a better gf than the blonde girl
101151487161405440	positive	Ahhhh! Loving this new IC Champion! Wish I could see it happen this Friday. ): Crossing my fingers that he has a match at Summerslam!
100016148833247232	neutral	Today in santa fe was the first time ii had seen someone use an ipad as a camera..it looked a little weird.
260790583344377856	positive	This Friday we celebrate/mock the love of Avril and Chad. https://t.co/BzaPx4Di
263089660849434624	neutral	@Danferdm on the tv it said Nikon was closed tomorrow ten it disappeared....but did we have English hw?
101057730034405376	neutral	RT @RAIDERS: The Raiders are on the field for their Tueday afternoon practice as they get ready to face Arizona Thursday night in Oakland.
263476703895117824	positive	Georgetown is the move tomorrow :)
247980494837407744	negative	BJP members walk out from JPC meeting on 2G: Bharatiya Janata Party (BJP) members on Tuesday walked out of the p... http://t.co/pOvV7bds
230252879926136832	positive	I might act like tomorrow Valentine day and pamper my gf maybe then she'll feel better
256416015473319936	negative	Speaking of King cake, the 1st time my mom had some, she ate the baby. Got stuck in her throat and she had to got to the doc to get it out.
261276283856617472	neutral	@KyleTucker_CJ Feel like more would've stayed if they just ran today's all-access first. Sort of late to wait around for the 2nd one at Rupp
233970693879001089	neutral	@mcgeecraig come see @theiqonsband, @Tijuana_Bibles, @Stone_Fox_Chase, and David Taylor at PivoPivo with me next Saturday
207902904525393922	neutral	It's Presidents Day at the White House Thursday. Barack Obama hosts George W. Bush for unveiling of portrait. George H.W. Bush there too.
257837309867749378	positive	@scotty_robs89 do you know Roman Abramovich is the 3rd richest man in Britian? #InterestingFactOfTheDay #InterestingGilfriend
101451016377085952	neutral	I'm going to Cleveland tomorrow so I'll break up the losing streak.  Verlander may help.
259388696376246272	neutral	Championship: Team news: Bellamy in frame for Cardiff: All the team news from Saturday's Championship... http://t.co/Twzk98l4 #Mogganaut
262033482371461121	negative	Jonathan Clary's blocked punt sets up Mike Longo's 3-yard TD run and Laguna Hills cuts Dana Hills lead to 20-17 with 9:38 left in 3rd
212491785786757121	negative	Happy Valentines Day ? I thought stupid #valentine was on the 14th of Feb.
258227256638455809	neutral	Foes to city, HISD, HCC bond measures emerge. http://t.co/wyFtDKhI The antis make 1st appearance just 3 wks b4 election day.
257663678143422464	positive	October 22 .. See you @ SM Bacolod ! :">  See you there SweeT Heart! <3
262926700374007809	negative	and now I do see it's up. I'll blame it on a case of the Mondays. Creighton picked to win WBB, SIU picked to finish 8th ahead of Drake, UE
257369508086423553	positive	Omg. Ricky Martin may be gay but he is one fine ass gay man.
106328553838227456	positive	Off to see the Nokia N9 tomorrow. It'll be like being a real consumer tech dude again. Also off to an event at the new Winnings store.
259807219988717568	neutral	Little blurry but this is the crowd I play for every Thursday at Plan B with Madison's hottest DJ, Brook Bartels http://t.co/kwOSOhpf
100741386361507840	neutral	Ice Cube should come out with a Last Friday with everybody! Mike Epps Kat Williams Smokey Big Worm Kevin Hart & everybody else...
264178691364495360	positive	7:15pm tomorrow night I have a date with Denzel! #Flight I can't wait!
250996010116075521	neutral	As reported Jason Varitek is close to taking job with #redsox, may be special assistant to GM Ben Cherington. #redsoxnation
259782856446992384	positive	I like what I've seen today in NNS race! We have us a 2nd groove with side by side, sometimes 3 wide on front stretch, racing! #NASCAR #fb
258940269653803009	neutral	Sprint takes control of Clearwire; now owns 51% stake, may buy it outright http://t.co/PcPAotps
260501785632980992	neutral	Found the limited edition of Midnight Sun. But since B2ST's oppars are going to work on a new album. I'm not going to buy the 5th mini album
264196080764321793	neutral	@judybuenviaje Good Morning, Hong Kong!  Meme pa ang kasama ko, may headache :(  What's the jap resto again in LKF other than Ippudo?
264244275452198912	neutral	MAYBE. i'll text you tomorrow Lauren lol i get queasy giving blood. we'll see....
264047921396330496	positive	Congrats to Trey Haley, Shawn Armstrong (@SArmstrong90), and Alex Monsalve for being named to the AFL's Rising Stars team. Game is Sat @ 8pm
258317781378928640	positive	@caplannfl - Another example of a good college player who had a great week at Senior Bowl to ease concerns about toughs & get into 1st round
263635746156589056	neutral	@NoQuivering @skepchicks I'm everyday dressed up with my Spartacus costume. So, if you miss this Halloween, we may catch up anytime!
264048475182882816	negative	@MostDumbestLaws: A betrayed wife is legally allowed to kill her adulterous husband, but may only do so with her bare hands. (Hong Kong)
212599863785963522	positive	Happy Valentine's Day (to you that may have one)
100668996550008832	neutral	I want to go see Final Destination 5 on Friday.
262319079690473472	positive	@muse, @russellhoward AND @kylieminogue all on The Jonathan Ross show tonight = Terrif sat night in! Well done @wossy. #Toofunny
258695108529119232	positive	Welcome Nick J! :") "@nickjonas"  In Manila! So excited for the show on Friday.
254014659873615873	neutral	@mrjfumero I heard that Ms. Pink Friday got tired of hearing Mrs. Canon bragging about her records, Grammys, success and BS.
263012460678754306	positive	@CodySIO Im so excited for when you come to Northern Lights on the 27th it will probably make my life.
243918098250481665	positive	Apparently tomorrow is Nation Kissing Day. Ladies, you're more than welcome to stop by.
219168847859691520	neutral	Come on Andy. Kids are in bed. Dinner is out of the way. 2nd beer is open. 50" HD TV is on. Play your game. #Wimbledon2012
260917838586454016	positive	Happy birthday Roman Abramovich (24 October 1966) >> Keep the blue flag flying high <3
111704704605618176	negative	I'm sorry she may be the queen but Madonna is a bitch #gogaga
263922045891522560	positive	ECHO Entertainment News: Jade Wright previews the best programmes on TV tonight (Thursday): ANYONE who accuses C... http://t.co/rz6l6O0A
251708257947758593	positive	Just handed in my application for the Marie Colvin Scholarship at The Sunday Times. An exciting moment.
264161130585399297	negative	Not wearing make up to Dublin tomorrow until I'm getting ready for the party. Help.
118152301532823552	negative	Aw what the hell Curtis Painter coming in and we give up 3rd and 18 conversion.
101452523759607809	neutral	May or may not review the Rugby World Cup review, if it's good I might get the full game though. It's just installed as I press 'tweet'.
261370894662918144	neutral	@Tokcik @TBlaqsta mxm wena Rebo, i know how to..and you guys are flooding up my e-mails.tltltltltlltltlt.Rebo and Tk, OST tomorrow night???
263827115638652928	positive	Bestie we gotta go see "flight" with Denzel Washington, comes out Friday. Seems so good @Bsociallyactive
111583703351820288	neutral	RT @DerekSnider: RT @theScore Former teammates of Pavol Demitra reflect on their fallen friend after the Lokomotiv plane crash in Russia ...
248377357000404992	neutral	@HCD_News is an official news that Nash and Thorton will play in Davos? Are they going to play on 29th match? Can i buy tickets from italy?
262653574335565824	neutral	@kstewshair lol last I heard the 21st of december but who the hell knows. For Bel Ami they were going to show it but they didn't and
232251920746688512	positive	Went to the strawberry festival with my babe earlier today and now being lazy. Maybe a dinner date tonight to top off this perfect Sunday :)
161143598816038912	neutral	@chelseafitch @chelss_lewis WPPI starts the 19th I believe.  That's why I'm flying out the afternoon of the 18th.
263913915870752769	neutral	Today match against ACH Ljubljana, 2nd game in the Champions League!
238345863628464129	neutral	GBU PM ready for reply on coal blocks: Congress: New Delhi, Aug 22 (IANS) With the Bharatiya Janata Party (BJP)... http://t.co/Nf9Nqdaa
255710073639288832	positive	Just claimed a sandwich after the employee explicitly called out, "Cheese Trifecta for Demetria!" not my name or my order so happy tues guys
223782544804560896	neutral	GAME # 6  What group are they in Dream High 2 =)  http://t.co/vquSbGzR <<- LIKE the page 1st... http://t.co/JRMTF83Y
240041945978793984	neutral	Upcoming Saturday @ Cherry Moon:  The start of a whole new season of the harder styles: FIRST CONTACT !!  With... http://t.co/YFZ2eP3A
257204257655226368	neutral	Jennifer Hudson, others perform at Whitney Houston tribute: Just before the Grammys in February ... http://t.co/ykAcaHTT #Fashion #Style
260540438153420800	neutral	That concluded the #NCDebate. See Thursday's NCA for complete coverage.
118362498155028480	positive	This may be a fact!! RT @RaheemBrock Curtis painter will help the colts win their first game! U heard it here first!!!
263676570185633792	neutral	Georgetown playing JMU in "secret scrimmage" on Saturday while GMU does the same at Marquette. http://t.co/E8iKggbW (h/t @gmuhoops )
104094981517623297	positive	Best of luck to @ArsenalLadies tonight, who have a big league game against Everton at Borehamwood. 7pm k.o.
101935066871103488	neutral	Bolton Society for Blind People are bringing Vegas to Bolton with a Charity Dinner on 23 Sep http://t.co/4mvokMM Please RT xx #BSBP
257198745769369601	positive	Good Luck to Scouser & Soon to be Klitschko destroyer @DavidPrice_1 tonight in the Echo against @audley_Harrison - '12th Career KO Tonight'
263809311086628864	positive	The great Noel Gallagher is about to hit the stage in St. Paul. Plenty of room here so we're 4th row center. Plenty of room. Pretty fired up
100214778869452800	positive	#Jets #Jetsnation on my way to #NYC.Will be on @SNYtv tonite on JetsInsider at 7pm!Can't wait to talk Jets and #NFL. Everybody check it out!
262488901917212672	neutral	Gold and Diamond are never at the periphery, we really need to dig deeper into Christianity....Phil. 3:10-18,Rom. 12:1-3..... Happy Sunday.
103111263281881088	neutral	RT @pinkelephantpun: Tomorrow, people. RT @michellemalkin: Wisconsin Recall, Part Two: Fleebaggers face the music http://t.co/XMioL6p
261763024862445568	positive	Ladies will have a free day tomorrow. Hope they enjoy rest of their time in Okinawa. #miss2012
261950278050402304	negative	By botching case against Lieberman, Israel's AG may have made way for his union with Netanyahu   http://t.co/clCKpDsH
261095675784228864	neutral	Good by @eth38, quickly punched out!RT @BenCuzzupe: Tippett Saga turning more than 5th day wicket at the Adelaide Oval: http://t.co/JfHtRnoT
263435225273618432	positive	Excited for Halloween tomorrow I am going to be Jake from State Farm
116158260196802560	neutral	I will be out of town and will miss this but you should go! Nuit Blanche #DC event Sept 24 http://t.co/xtvBQl8G @ArtAllNightDC
199094694502875137	positive	Scoop! Elmbridge Choir performing with Brit Award classic boy-band BLAKE on May 24th at Epsom Playhouse! Yoohoo how cool is that!
246446436114366464	positive	@DennisDMZ Hey the best was when you said Obama put out his smoke on Bidens forehead on Ash Wed
260166994014384128	positive	@Roanmair You beat them 5-1 in the San Siro but Terry Henrys 3rd goal is world class. #NeverMindPires!
264165424617365504	neutral	Played Dishonored (360), Darksiders 2 (360) and Mass Effect 3 (360) in the last 24 hours. http://t.co/sJGYXZsG
264140916611235840	neutral	Photos I took Tuesday morning of the aftermath from Hurricane #Sandy in a 2 block span of Long Beach, NY http://t.co/TIBJOH62
263712301444644864	114778444	positive	@daniellejbrear yeah best way! Yeah I had my first one on 6th, 2 days after my birthday. It's really good! love it! Went on A1 yesterday xx
264247546401140736	positive	@Tanuki_Meatball @SchmidtsRevenge tomorrow is the big day, see you at #BNA
262900304419368961	positive	Happy 4th Birthday to Mersey! Celebrating with a new squeaky ball... My ears are not celebrating. http://t.co/hkG53dRJ
198049169154383873	positive	Awesome show today with Jimmy Bryson. Tomorrow though we have Trent Anderson and Rhonda Rousey also more REO tickets to giveaway. #listenup
263481540321894402	positive	Ready to see the Sixers play the Nuggets tomorrow!
219889336110415872	neutral	Yo unnu memba #AmbroZia THIS SATURDAY at Oneil's Place enuh!!!!!! Bear TingZz Production it loud!!! U hav u ticket yet?!?!?
264155911688425472	positive	Cannot wait to see @fancystepdad with my boys @ThePrinceRupert and @JakeCausey next Friday in Athens!
262362217616375808	positive	May your life one day be as awesome as you pretend it is on Facebook- Will Ferrell
107551973506686976	negative	Sunday Dialogue: Curing the Health System: ... fostered by Republicans who place ideology over country, took tha... http://t.co/XDBUYLw
101784327792246785	neutral	Word RT @K_Mapp: Smh RT @da_underdog: <==== Broncos fan for the night! I hope Tony Romo gets sacked at least 15 times. #Thatisall
256585511571947522	positive	@JScribe We are having a Politics and Pancakes program in the building next Tuesday night--you are welcome to come!
263817519662522368	positive	If You Can't Beat 'Em, Recruit 'Em ( #YHOO, AOL, GOOG, TWX, AAPL: Inc. (NASDAQ: YHOO) may have the biggest weapo... http://t.co/EuacVGrv
264175696979570689	neutral	Knicks vs Heat tomorrow. Kicking off the season at MSG.
264029713893314560	neutral	Jordan: Activists call for November 1 sit-in near Palestinian diplomatic mission in Amman to condemn the Oslo agreements
263610933568499712	negative	@starky88 @nfl_uk Was in on sat and they only had the Ray Lewis home jersey.  They didn't have a lot either.
232105997718667264	positive	@MKosinskiNBC Endymion may have set the Greek Mythology and Olympic record for sleep,Full of sweet dreams, and health, and quiet breathing.
