20020212_20.42.04-19290-60	neutral	Hence, when investors saw that the dollar was trading at between 1.9 and 2.3 pesos, they began selling off their shares to make as much profit as they could.
temp_fbis_21.20.14-9569-18	positive	In this way, he sought to implement his policy of eliminating poverty.
20011123_20.59.38-14856-29	neutral	Each time "B" appears, the label on the input changes from "even" to "odd" and back again.
temp_fbis_20.43.16-10786-18	negative	After the World Trade Center and Pentagon tragedies, there were some who thought that Washington's rapprochement with its traditional partners was inevitable, with the goal of defeating the threat of international terrorism.
non_fbis_08.46.28-13637-104	neutral	Those who think the prisoners are  getting coddled (Rep. John Mica, a Florida Republican, visited  the camp and said it's "too good for the bastards") will be  happy to know that the shampoo is not jojoba-enriched.
non_fbis_12.38.27-3333-9	neutral	Once emptied, it  will be filled with dirty laundry, trash and used equipment and  put back on Endeavour for the ride home.
non_fbis_06.20.40-8369-20	neutral	They're not  pleased that the brass, the lawmakers and the press are more  interested in the well-being of the detainees than the soldiers  guarding them, and that they might as well be invisible.
temp_fbis_20.46.47-22286-8	neutral	In this regard, he made a quick reference to the ongoing killings of Indian Muslims.
20020113_03.20.33-11983-2	negative	Indian forces retaliated, killing four Pakistani soldiers and destroying six bunkers, he said.
20011230_21.17.41-25537-25	neutral	Other countries live on a currency board system, most notably Hong Kong.
20020209_20.27.35-29256-3	negative	He said that the Americans are treating these prisoners like "an ostrich".
20020128_20.50.06-12228-11	neutral	Incidentally, the money earned by the Khrunichev center has given serious support to the existence of Russia's main space center in recent years.
20020306_15.02.54-18922-10	neutral	The American administration, during Bush's presidency in particular, has adopted unilateral policies over such international issues as the reduction of strategic arms, environmental concerns including the Kyoto protocol, proposal to set up an international criminal court and lately over the fight against terrorism.
20010906_12.55.04-23296-41	negative	"There is not one developing country that wants to link social regulations to WTO regulations.
20020426_21.53.09-20885-4	neutral	"They shot at him as he tried to open the door to the car, and died on arrival to a nearby hospital," a senior policewoman, Chief Inspector Nancy Thuku, told Kyodo News in Nairobi.
20020314_20.23.54-19638-22	negative	A spokesman of the EU Commission, at a press conference, expressed concerns over the Bush gaffe labeling [North] Korea, Iran, and Iraq as the "axis of evil" and said that "the EU's high representatives do not agree to such policy."
20020124_20.45.56-235-1	neutral	A YEAR after gently attempting to nudge Zimbabwe's government into embracing minimum conditions that allow for a free and fair presidential election, several local and international groups find themselves back to square one, unable to move the Harare authorities even an inch.
20020331_21.09.25-22686-1	neutral	A few days ago the parties in the Palestine conflict found themselves at a crossroads.
20011024_22.28.56-2635-5	neutral	He explained that the delegation's visit to Sudan aims to prepare for the coming visit of the American envoy to Sudan, expected on 10 November.
20020206_20.23.00-9795-4	negative	No one had gone so far in the anthology of rhetorical follies, or in falsifying history.
20020320_20.36.59-7133-51	neutral	Rather than issuing a letter of objection to the Australian Government, wouldn't it be better to join them in our own national interest?" he asked.
non_fbis_08.27.54-12647-17	positive	El Universal, a leading newspaper here, hailed  the end with these words, "It's over!"
temp_fbis_21.07.24-28603-22	positive	But as Bush concluded his trip to Asia yesterday, it was clear that China failed to elicit from him a statement on the "three nos" and on opposition to Taiwanese independence, Chang said.
20020412_21.18.30-8033-4	positive	However, the high military commands supported the government during the emergency caused by the strike staged by the trade union and business association opposition, a strike that was extended indefinitely on Wednesday night, according to Carlos Ortega, president of the Venezuelan Workers Confederation (CTV), the largest labor confederation in the country.
20010829_01.48.48-11084-18	positive	He said the decline in President Chen's popularity could be attributed to the drop in the number of people favouring independence.
20011112_21.33.44-18068-3	neutral	More than 150 agro-technological guiding systems have been set up in Yunnan, Anhui, Jilin and Hainan provinces to teach farmers how to cultivate grain crops, vegetables, fruit and aquatic products.
20020123_21.21.45-6259-4	neutral	Volume on the main section decreased to 303.91 million shares from Tuesday morning's 328.82 million, with losers surpassing gainers 863 to 466, and 153 issues finishing the morning unchanged.
20020312_21.16.59-4123-8	neutral	Ba'asyir last week filed a 100 million dollar libel lawsuit against the Singapore government.
20011218_21.00.30-21204-24	negative	Argentina has none of these worthy arguments.
20020423_21.47.26-20990-13	positive	"We applauded this move because it was not only just, but it made us begin to feel that we, as Arabs, were an integral part of Israeli society.
20020122_20.36.01-11616-7	positive	Back in 1949, it was agreed by nearly all the states in the world that the sufferings of war must henceforth become more bearable, especially for those who are not directly involved in the conflict.
non_fbis_12.46.57-22041-21	neutral	"Our guys are pretty dirty.
20011201_21.19.03-816-9	neutral	This appointment is not expected for a few weeks.
non_fbis_12.15.47-5091-18	neutral	Eight more truss segments will be added on future missions.
temp_fbis_21.28.11-375-6	neutral	The legal application brought Wednesday could see the British government face charges under the Human Rights Act 1998 of "aiding and abetting" the United States in unlawfully detaining the men against United Nations guidelines.
20020128_20.36.05-804-3	negative	They also lambasted "US-British aggression on Iraq and meddling in its internal affairs."
20020216_20.54.07-4914-4	neutral	Security sources said that Israel had reinforced security measures along the Lebanese-Israeli border over the past couple of days, having adopted a series of "precautionary procedures."
non_fbis_11.14.43-703-7	negative	China's official Xinhua news agency also weighed in Sunday on  Bush's choice of words, accusing the president of orchestrating  public opinion in advance of possible strikes against the three  countries in an expansion of the war against terrorism.
20020507_22.11.06-28210-32	negative	". . . A systematic, strategic program of mass mobilization is necessary to confront a stolen victory and an illegitimate government."
20020118_21.16.15-1122-11	negative	The US has caused controversy by stating the detainees are "unlawful combatants" and have no rights under the Geneva Convention.
non_fbis_06.44.52-19992-119	neutral	The bulk of the work  includes blast and gunshot wounds from the war in Afghanistan.
20020109_14.06.40-17312-3	neutral	According to all indications, the radioactive container sent from the nuclear technology firm Studsvik to the US did not leak during transport within Sweden.
non_fbis_08.05.55-10723-32	neutral	There is no explanation for the delay."
non_fbis_15.12.22-6729-7	neutral	This crew  will replace the 3rd long-term expedition (American astronaut  Frank Culbertson and two Russian cosmonauts - Vladimir Dezhurov  and Mikhail Tyurin,) which has been aboard the ISS since August  13.
20011116_20.44.27-28756-24	positive	It was possible to ensure the environmental integrity of the protocol and to maintain control over the mechanism.
20010706_02.01.27-21386-3	neutral	Out of 2,200 kg of drugs seized this year in Tajikistan, only 837 kg were seized at the border, and the rest inside the country, Nazarov said.
20020303_21.09.29-14261-11	neutral	"How does it (the Commonwealth) handle Zimbabwe?
20020320_12.04.40-21590-15	neutral	Under these circumstances nobody can feel free."
non_fbis_06.48.28-6852-19	neutral	The Venezuelan leader has struck friendships with Cuban, Libyan  and Iraqi leaders with great fanfare, and his open defiance of  U.S. interests has wooed Venezuelans wary of U.S. power.
20011111_20.41.07-12494-33	positive	This is the only responsible course of action and it will be a historic success for Doha and we want this meeting to be a success.
20020228_21.12.01-14811-6	positive	Given the stake at play, namely electricity exports, other countries have also voiced interest in contributing to the finalization of works on reactor III and IV at Cernavoda.
20020425_21.45.53-9610-1	neutral	From Mexico to Buenos Aires, television viewers saw, on the Spanish CNN and Telemundo channels, the undisguised pleasure displayed by White House spokesman Ari Fleischer and National Security Adviser Condoleezza Rice at the announcement of Hugo Chavez's "resignation," which he never in fact signed.
20011210_20.48.51-14201-1	neutral	Krzysztof Janik, minister of internal affairs and administration, has announced the establishment of a special police task force.
20020202_20.37.54-21168-39	neutral	The amount of money issued thus winds up being a function of these variables, not a target in itself, so that monetary policy can be used as a tool for promoting economic recovery.
20020111_21.05.06-7601-30	negative	Since industry does not wish to let itself be pinned down on an absolute emissions ceiling, while the government feels itself committed to an absolute ceiling, industry is foisting the necessary efforts onto other sectors in society through the benchmark covenants.
20011221_20.56.01-12278-21	negative	Criticizing as well the appointment of Kemal Alemdaroglu as rector of Istanbul University, Hatiboglu noted that the failure to discuss the report by the Higher Education Research Commission had been instrumental in this, and charged that President Ahmet Necdet Sezer had appointed Alemdaroglu even though aware of the allegations concerning him.
20020225_21.13.42-3998-0	positive	West aims 'to prop up MDC'
non_fbis_08.47.00-17401-13	neutral	During Mr. Bush's visit here last month, Mr. Koizumi gently  balked at the president's proposed alternative to the Kyoto  agreement, saying that Japan would "like to see further efforts"  on the part of the US.
non_fbis_08.40.56-18707-9	negative	"These circles have persistently tried to reanimate the 'Chechen  problem,' and turn it again into an irritant in the  Russian-American dialogue," the ministry said.
20020327_20.50.33-2917-12	positive	But Caruana said that the banks "did their homework" and made provisions for their investments in Argentina.
non_fbis_06.21.24-4640-5	neutral	They have even  demanded upgraded accommodations, seemingly forgetting that  these are the leaders of a worldwide terrorist organization who  have repeatedly vowed to kill innocent Americans through war or  terror.
non_fbis_08.47.00-17401-16	positive	On one end, Koizumi defensively holds up the Kyoto  Protocol.
20020419_21.31.07-25924-2	neutral	"Our position is very clear, our position was that the new authorities had to receive a vote of confidence to lead the Venezuelan process back to the democratic path," he stated.
20020331_21.09.25-22686-22	negative	They decided to take steps to destroy the "Palestinian terrorist structure, arrest its leaders, confiscate arms, and so on."
non_fbis_12.16.50-28640-34	neutral	At least 150 people  have died and tens of thousands left homeless in attacks backed  by Mr. Mugabe's government.
20011218_21.00.22-21144-23	neutral	Today, he is being completely isolated and the desire to drive him away is scarcely disguised.
20020204_20.23.24-6873-0	neutral	The arrogance that marked the latest Manichaean pronouncement of the US President, George W. Bush, alleging an "axis of evil" on the international stage has justifiably produced a backlash of adverse reactions.
20020111_21.05.06-7601-42	neutral	In any case, it is high time that a social debate be organized on the division of effort to achieve the Kyoto aims.
20020320_11.49.47-8044-0	negative	Some Israeli officials, particularly Defense Minister Binyamin Ben-Eli'ezer, have stated that the success or failure of US envoy Zinni's mission hinges on the Palestinians only because they might carry out a suicide or shooting attack that will make Israel retaliate, thus bringing the region back to the cycle of violence.
20011231_21.05.45-10422-9	negative	"This is an unpredictable, anarchical situation.
non_fbis_16.01.44-19040-2	negative	Cardoso also said he  believes the US is committed to joining other nations in  fighting the problem and will adopt domestic measures, although  they have formally renounced the Kyoto Protocol.
20011115_21.13.16-13370-6	neutral	China has played a tiny role in a handful of recent United Nations peacekeeping actions in various parts of the world, including Cambodia.
20020315_20.21.54-4382-11	negative	In the document, the United States has been very openly told that it has become the number one country in damaging solidarity of other countries and violating human rights there.
non_fbis_13.21.23-8227-2	neutral	The launch was the first of six scheduled for the next seven  months in a flurry of activity designed to get the space station  closer to completion.
20020201_20.41.37-18755-10	neutral	The striking thing was the reference to Iran.
temp_fbis_20.20.10-3414-9	negative	Evidence show that human rights violations in the United States have been ignored for many years.
non_fbis_12.45.44-23455-32	positive	He also plans to chat with South African schoolchildren via ham  radio over the next week.
non_fbis_08.27.54-12647-35	negative	President Vicente Fox of Mexico took a strong stand, saying his  country would not recognize Venezuela's new government until  elections were held.
20020202_20.37.54-21168-59	neutral	Once they have been converted, the refund timetable for dollar deposits will initially be maintained.
20020306_15.01.39-17844-3	negative	However, the report comprehensively blamed the North Korean authorities for committing wrong-doings in terms of human rights.
non_fbis_08.03.23-18607-33	positive	"At least they're coming out with something," the official said.
20011113_20.27.12-885-4	neutral	An accord with the governors would be a clear sign that public spending was going to be brought under control where it is most out of control.
20020207_20.23.04-14788-60	negative	This leads "to a lack of discipline of the subordinates and exposure to public despise."
temp_fbis_21.20.14-9569-19	positive	Moreover, Chavez's foreign policies were contrary to American interests in Latin America, as well as in other parts of the world.
20020326_21.07.24-24231-8	neutral	One of them was after the Chinese embassy in Yugoslavia was bombed, killing three people, in the US-led NATO air campaign three years ago.
20020207_20.23.00-14747-13	neutral	He said that he does not believe DIM [Military Intelligence Directorate] officials sold that video for 40 million bolivares, as stated by Opposition Bloc deputies.
temp_fbis_20.58.47-19000-12	negative	The EU is concerned about the purely voluntary nature of the actions proposed.
20020208_20.29.29-13302-21	positive	"The president must go, he should resign, and before he does so, he should organize elections so that he leaves the country with a democracy, in the hands of a civilian," Soto boldly proclaimed at the "pro-freedom" forum.
20020225_21.13.42-3998-17	neutral	In a statement yesterday, the US embassy said the travel ban has been imposed on the President, senior Government officials, "certain persons" with business dealings with Zimbabwe Government officials and their families.
20020301_20.57.02-23111-14	negative	Hence, the whole world is currently decrying the United States to such an extent.
20011231_21.05.45-10422-25	negative	This is viewed as the main impediment to the establishment of political order in the country.
temp_fbis_21.37.46-9337-8	negative	"The United States has completely violated the UN Charter and the principles of relevant international conferences and documents," he added.
20020109_14.06.40-17312-17	neutral	Yesterday [07 January], the National Institute of Radiation Protection (SSI) announced that it could not exclude the possibility of people who had come into contact with the container suffering acute health effects from radiation.
20020111_21.05.06-7601-10	neutral	In a nutshell, benchmarking means that companies compare their energy efficiency with that of similar plants abroad.
non_fbis_15.45.31-12608-1	positive	Tehran, April 16, IRNA -- United Nations Secretary-General Kofi  Annan telephoned Hugo Chavez, President of Venezuela on April 15  to express satisfaction that the process of restoring  constitutional order in Venezuela was underway.
20010914_22.04.48-17941-7	neutral	However, for Israel to take advantage of the US tragedy to claim that it is standing in one ditch with the United States against the violence of terrorism, this is a twisted logic.
20020220_20.47.21-9712-21	neutral	However, such a scenario can be assured success only if it is underpinned by President Bush's "policy of not excluding a variety of options" inclusive of military action.
20020113_03.20.33-11983-0	neutral	JAMMU, India, Jan 12 (AFP) -- Four Pakistani soldiers were killed Saturday in cross-border shelling in Kashmir, Indian officials said.
non_fbis_12.22.23-26451-6	neutral	"I was surprised to see the [rockets] coming out.
non_fbis_06.48.28-6852-11	negative	According to taped radio conversations  broadcast yesterday in Venezuela on radio and television, Mr.  Chavez ordered tanks and troops to surround the presidential  palace, as unarmed civilian protesters marched against him on  April 11.
non_fbis_12.45.44-23455-31	neutral	He wore a white patch with an embroidered  red ribbon on his blue cosmonaut uniform to symbolize the fight  against AIDS.
20011210_20.28.15-21486-11	positive	Meanwhile, in another development, the Geneva-based United Nations High Commissioner for Human Rights Mary Robinson called on Israel to stop bombing the Palestinian targets in the West Bank and Gaza Strip and allow in international monitors.
20011224_21.09.23-6361-10	neutral	Mr Veness said the ship was now in a position to continue its journey, but completion of the voyage was still subject to consultation with all interested parties.
20020311_21.42.46-13715-8	positive	Possibly, in the eyes of the report's authors, such a step on the part of Riyadh excuses it to a certain extent for its other transgressions.
20020122_20.32.22-8496-12	neutral	"I expect the United States to satisfy the requirements of the international conventions," Per Stig Moller said at a press conference in Berlin on Monday.
20020507_17.55.10-20068-28	negative	Boycott unfair
non_fbis_16.01.33-12919-16	neutral	The specialized Fifth Institute of  the Defense Ministry was established for that purpose.
non_fbis_08.27.54-12647-30	positive	President Fidel  Castro and Mr. Chavez had formed a close friendship.
non_fbis_15.13.45-21190-15	negative	However, it is becoming rather fashionable now for countries to  exchange harsh words with each other like kids.
20011016_22.34.35-3190-3	neutral	The US air strikes have destroyed Taleban emplacements near Mazar-e-Sharif, Dostum said.
20020205_20.41.01-8736-37	neutral	US State Department spokesman Richard Boucher said: "We will send all relevant information and summaries of this information to our embassies in various places around the world to facilitate understanding of the related arguments."
20020115_21.09.21-9865-11	neutral	He agreed to be extradited to Switzerland April 7th.
20020219_20.45.06-11781-16	positive	"The US strategy is beginning to work," (said a Foreign Ministry source).
non_fbis_05.22.13-11526-16	negative	African leaders closed ranks at the Commonwealth summit out of  fear for their own power, he said.
20020507_17.55.53-20579-17	neutral	Details are awaited.
20020322_21.05.41-14545-74	neutral	A fresh election must be held within 90 days.
20020324_20.55.32-6296-5	negative	The main goal of the visit is to broaden economic cooperation between the two countries, whose present-day pace is not fast enough.
20020208_20.37.23-17648-9	negative	Ben Eliezer's raving coincided with the arrival of his assassin boss Sharon to Washington to take part in exerting pressures on the US administration, and persuade it that removing Arafat could bring about the Palestinian surrender, and halt violence as he calls it.
20020318_20.51.31-14776-0	neutral	Tashkent, 18 March: Turkey will give 1.2m dollars in free assistance to servicemen in Uzbekistan.
20011024_18.09.35-13708-25	neutral	A number of bases have been established for the war veterans throughout Zimbabwe, particularly in those areas which did not have army camps.
20011217_20.37.28-19761-6	neutral	However, this is no reason to be optimistic about the situation.
non_fbis_08.36.15-7509-1	negative	The British Prime Minister, Tony Blair, disagreed yesterday with  Australia's decision to sign a climate change deal with the  United States.
20020320_21.03.16-25474-6	positive	The army would like to request whoever is engaged in this criminal activity, to stop," he said.
20011112_21.33.44-18068-0	neutral	Beijing, November 12 (XINHUA) -- Many Chinese farmers have begun growing crops in computer-controlled rooms instead of tilling fields with spades.
20011218_21.00.30-21204-33	negative	Moreover, the "Argentine case" falls at a bad time.
20020201_20.41.37-18755-24	neutral	It is important to recall that the entire world that came out in protest against the September 11th attacks urged Washington to coordinate with its partners and allies.
non_fbis_06.11.16-17420-1	positive	VANCOUVER, British Columbia -- The Kyoto Protocol on reducing  greenhouse gas emissions must be ratified even without U.S.  support, British Deputy Prime Minister John Prescott told an  international conference on business and the environment on  Friday.
non_fbis_12.46.57-22041-42	negative	"They're  willing to give their life to take yours."
20020306_15.04.33-20423-6	positive	He also gave the news about the holding of a similar exhibition by Iran and Russia in Moscow and hoped that the Iranian companies would present their equipment at this exhibition.
20011217_20.37.28-19761-17	positive	The clash between Israel and Palestine briefly appeared to be abating in the wake of the large-scale attack incident [taesupkyok sakon] against the United States.
20010818_01.09.50-14694-1	negative	OPPOSITION youths are agitating to get guns to "shoot" President Mugabe "out of office," MDC leader, Mr Morgan Tsvangirai said in South Africa yesterday
20011024_18.26.05-8627-4	positive	He is expected to give Koizumi Musharraf's letter implicitly asking for Japan's debt relief for Pakistan.
temp_fbis_21.31.56-18015-1	positive	During a telephone conversation, President Khatami told his Venezuelan counterpart, President Hugo Chavex, that the return of the legitimate president and government to power was a victory of justice and freedom.
20020207_20.22.42-14586-25	positive	He took one further step and invited Powell to visit Venezuela to see what is really happening.
20011130_12.36.18-4189-20	neutral	He indicated that carbon dioxide in the atmosphere is accumulated over the past 100-200 years.
20020315_20.42.26-19148-5	neutral	"On the basis of all these reports and consultations, and proceeding from the principle that South Africa will act as part of a collective international effort, a comprehensive statement will be made in due course.
non_fbis_04.33.07-17094-4	negative	At the weekend the European Union, prodded by Britain, is  planning to extend the range of sanctions against Zimbabwe,  targeting more members of the leadership.
20020314_20.23.54-19638-10	negative	It is also the biggest terrorist country.
20010829_23.03.25-11609-0	neutral	Seoul, Aug. 29 (Yonhap) -- LG Electronics Co. said Wednesday that it has established a code division multiple access (CDMA) mobile phone service system in Tashkent, Uzbekistan, to begin service on Sept. 1, Uzbekistan's Independence Day.
20011124_20.49.56-27748-26	neutral	"We have to enforce the law."
20020206_20.40.49-25157-1	negative	Secretary of State Colin Powell said on 5 February that it was not an alarmist remark when George W. Bush labeled Iran, Iraq, and the Democratic People's Republic of Korea [DPRK] as the "Axis of Evil" when he was delivering the State of the Union Speech last week.
temp_fbis_20.46.47-22286-11	neutral	"What Israel is doing in Palestine against the Muslims is also one of the worst examples of rights abuses but the US is again silent, but when Palestinians react to Israeli attacks America is quick to The logical solution to the Palestinian issue is a free and independent state for the people of Palestine as enshrined under UN resolutions, he said.
20020121_21.31.10-15710-11	neutral	Accompanying the president at the Khrunichev centre are Deputy Prime Minister Ilya Klebanov, deputy chief of Presidential Administration, Sergey Prikhodko; chief of staff, Anatoliy Kvashnin, presidential assistant, Yevgeniy Shaposhnikov, Deputy Defence Minister Aleksey Moskovskiy and Space Forces Commander Anatoliy Perminov.
non_fbis_08.39.09-12713-12	positive	"I wanted to go home, but I have to vote," she says.
