262601342965673985	neutral	@_witnessMyrise uhmmm are you sure ? Cuz Groundhog Day isn't til like February or march lol
263511918399086593	neutral	More NBA tomorrow.. Free NBA league pass till the 6th.. What did I do to deserve this (rozay voice)
262162355994128385	positive	A great read with your Saturday morning coffee. I'm voting for a pres working on social justice, tolerance, & equality. http://t.co/9I5o8L8s
100741062678679553	positive	RT @JasChanel I went to see Kevin Hart and still can't wait to go see the movie on the 9th!
263395561061892096	neutral	@Leopard_chic dang and then Allstar game in Houston the 17th
264174819170467840	neutral	Tomorrow haunted house with Sam kaitlyn marisela Yesinea marcos and maybe Walter and Katie xD
249298746872045568	neutral	Aussie Directioners! If you didnt already know there's a One Direction xfactor special on tv next Thursday!
232945508530913280	neutral	Hommage to Gary Carter and the Expos Day tomorrow at RCup: dollar hot dogs, and $8 tix at the 300 level. #Youppiwillbehere
261145082932101120	negative	I love how the #knicks get a good center for the 1st time since Ewing & all of a sudden the @NBA gets rid of Allstar voting for the position
100061945486508032	negative	Totally crashed my iPad tonight.  It locked up, and wouldn't even power off.  Used the Hold PWR and HOME bttn trick, to force reboot.
212917165718896640	negative	I rate Lee Dickson but Danny Care has to be on the bench sat for the 2nd test 60 mins with tired legs he will be dangerous #rugby #saeng
245922342776213505	positive	My sister and I are going to SM this Saturday afternoon to watch Lorax. I am so asking my dad for popcorn money. :))
264197758964101120	neutral	@_Addrriiaannnaa yea , I just been in ISS i'll be back tomorrow
107642732410978304	negative	Dang, Forrest didn't get it done. :/ He was our last American hope tonight, oh well... Now for the main event Anderson Silva vs Yushin Okami
229746647150784512	neutral	@borntorun703 @jolynn_giancola @cece_giancola @HeatonO @ReganOHara1 game night at the ONeil household tomorrow @6 #BeThere
241603562633838593	neutral	Nasheed, you have endorsed CoNi report today. Please don't change your mind tomorrow
263748118091276288	neutral	FAQ: What is 'skeuomorphic design' and the executive shakeup at Apple: SAN FRANCISCO, CA - MARCH 07:  Apple CEO ... http://t.co/YCvoPl98
230152573187923968	neutral	@spinenumber408 Then I will refrain from telling you about my plan to watch Mysterious Island with my son tomorrow night.  (He's 6)
263366711196123137	negative	I hate watching movies like friday after next on VH1 , BET, MTV,& etc. because they take out the bad language -__-. It's no fun !
100668742882705409	neutral	@PsychoSix-Smoker Beohner "got 98% of what he wanted."  Fact: Dow down 634 today and Boehner OWNS every point. #p2 #fok #maddow #teaparty
104472542240190464	positive	Saturday is the last day of Summer Streets in NYC.. Enjoy car-free streets  between Brooklyn Bridge and Central Park! http://t.co/T6KIA4e
264054694324867072	positive	Friday - Yearbook ordering deadline! Your child is going to want one of these, and they are so easy to order online: http://t.co/d8zALdV5
261898742863630337	neutral	Avril Lavigne is having a concert tomorrow night in the park. Sonic's opening for her. You wanna come?
256254993294827520	neutral	Does Girls Gone Wild still make commercials?  If, God Forbid, this one goes to extras, we may find out.
264134718704988161	neutral	#gotohell tour starts tomorrow! Show starts at 615 at the side bar in Tallahassee. Go Radio, Paradise Fears, Stages, and Solid Gold Thunder!
173294019139473408	positive	MayorOfLondon: Join in tomorrow at the exciting London Children's Book Swap events for families who love to read #LD... http://t.co/3ecIwZpd
111375934975787009	neutral	So the dude on shameless last night is lucien from big brother
263097631142711296	neutral	Watch me walk into a Columbia on a nice Saturday afternoon and get clipped up like im fucking Trayvon Martin with the pillz
255295926653054976	negative	Capello Bemoans Language Barrier in Russia: Russia coach Fabio Capello spoke Monday of his frustration at the la... http://t.co/wDkfnlqQ
259087733035765761	neutral	Just got done playing Mass Effect 3 multiplayer for PC for alittle bit.Now i'm gonna watch Friday the 13th on the AMC channel. @theRaychul
264175666772201472	positive	@anathehabibti THAT'S ME EXACTLY!  hahaha...6th and 7th grade everyone made fun of me then it was all "EDWARD OMG, JACOB 4 LYFE" s t o p
264242553505841153	positive	Happy Friday everyone. It is 07.48 in South Africa. A great day to all and enjoy a super weekend :)
254196962214166528	neutral	Who's going to the Big Sean concert tomorrow at the Liacouras Center?
263735530230001664	neutral	Police: you have the right to remain silent. what ever you say may be hel against you Me: Harry Styles
100108798546554881	positive	GOOD MORNING! my timeline works again! I couldn't read your tweets in it, luckily I was checking Milan's twitter when he started to write =)
238411454137655299	positive	@nolimitcattleco We haven't talked about it yet. However, we are very excited about the Jan Revolution heifer calf that is inside of her.
100197894463819776	neutral	@SdotBell son I saw a house last night was 1.9 mil behind hella trees that looked like the palace from Aladdin no bullshit lol
100215051369189376	neutral	I'm going to Machine Head at Sala Razzmatazz in Barcelona, Spain - Nov 15 http://bnds.in/qMyg7H
263754983554576384	negative	@Raiders_Spurs Reggie isn't interested in dealing picks like the old regime.  Can't see him parting with anything other than a 6th or 7th
102102379398316033	neutral	Divine frame along with P*10 presents:: The official south Alabama football kick off!! Sept 1 At club insanity! Adv. tickets $5 !!!
256471649740808192	neutral	Had to cut the Mohawk off gotta look grown for tomorrow night at Club Pulse
225088189193392128	neutral	@JeffMarek Perron? Really? Gagner is no comparison. Perron=1st liner Gagner=3rd liner. One 8 pt game and people forget that he is a bum????
253239493216325632	neutral	George Clooney may cast 'Artist' star Jean Dujardin in his next film 'The Monuments Men' . US Army team chases down art stolen by the Nazi's
260235945243193344	neutral	Eric Adelson with the slam: "(Flacco) looked more like Blaine Gabbert than Eli Manning on Sunday." #Ravens
263918513083781122	negative	With all Benson's attention, Frankie feels like a forgotten stepchild. Lets 'founding father' him so he know we will never forget 2nd place.
108126574271926274	neutral	Boise State may make Brandon Boykin's day. http://t.co/yBVsBqr /via @wordpressdotcom #uga #dawgs #boise #georgia #bulldogs
256496252701777920	neutral	BRIEF-Kinder Morgan shares off 3 percent after the bell: NEW YORK, Oct 11 (Reuters) - Kinder Morgan Inc :  * Sha... http://t.co/WAn9IXi6
253877104377229312	neutral	Our Business Club's networking dinner with Eskom's CFO Paul O'Flaherty is on 29 October. Book with Lisa 0118704263 http://t.co/DJL5dVku
263877809104109569	neutral	Today is Day 1 of the Festival of India to Bali (from 1- 4 November)! Get your tickets from ARMA... http://t.co/84gZgHKW
249307712268148736	positive	OMFGOMFGOMFGOMFG The Black Dahlia Murder/Machine Head/Dethklok/All That Remains are gonna be at the Palladium in November! *JOOOOOOOY*
256605494481936386	neutral	Look #Steelers fans I know you may be upset about Suisham missing that kick. Just know that I heard a guy named Billy Cundiff is available.
262221293133393920	neutral	@asoggycarrot Yeah the Big Bangs are like, the second rarest L9s anyway, so I'll get them, they'll be here on like, Fri if I order them 2day
264215144308019200	positive	@bruce_arthur Some of the Calgary runners heading to NYC are going to be cleaning up debris on Friday at Rockaway Beach. Great story.
111384877219328001	positive	Because the night belongs to lovers -> Nuit blanche :0) http://t.co/SJbF6xf #video #art #love
216190812378238976	positive	@kerrycupcake You off to Cork ? have lots of fun & safe trip, you've done a lot since your 1st meet at Eurosong haha
217426068364201984	neutral	@PatWGR If they are still looking for a Center, they may want to inquire about Sam Gagner.  Edmonton needs D.
262689629919125504	neutral	victor cruz aint do the salsa ALL game...he's overdue....its the 4th quarter...its TIME
264242142887702529	positive	Hopefully I have a better day tomorrow...today was just cow shit.  Well...IM GOING TO BIG BANG CONCERT SO OF COURSE IT'S GONNA BE BOMB!
263615529661657088	negative	Just been told by west-point cop that dixie wont be open till friday, Morning or night he wasn't sure yet.
262548173606752256	negative	On 17th anniversary of Rabin assassination, Netanyahu calls murder 'one of the worst crimes of the new age' http://t.co/y2tU91dN
100395197317398529	positive	@VH1 We're so happy AdamBehindTheMusic trended in the US & worldwide tonight!! Thanks so much for showcasing Adam on this special!
257271378288451584	neutral	Brook Lopez scored 9 points in the 2nd quarter and was featured by #Nets. Joe Johnson was absent, but should play in 2nd half. #Nets #NBA
246700893238591488	neutral	End of 2nd 3-2 Predators ... Preds will be short handed to start the 3rd.
262033677393985536	neutral	Pierce the veilRT @FaZachary: Miss may iRT @abityab: Lagu demen Bullet for my Valentine, hbu ??
100590944558125057	neutral	I also had a dream last night that football season started and the Ravens were playing the steelers and Ray Rice was running all over them
115946405591388160	positive	For my book worms: Murder in Italy about Amanda Knox and "In the Middle of the Night" about Dr. Petit family in Connecticut are great reads!
112700010658922496	positive	Tomorrow is gonna be like the Super Bowl for the Ravens vs. Steelers game
263815888338317312	neutral	TOK tomorrow is going to be heated over ObamaCare .
100892917752791040	neutral	WOW STI is off today since it's Singapore's Independence Day
100591108240838657	neutral	Did I just see what I think I did on @SportsCenter? Real Madrid signed a 7th old? #wow
110389471295451136	positive	RT @VictoriaCoren: Oh look, Four Lions is on Channel 4 tonight. Do watch it if you haven't before. Brilliant film; I properly laughed an ...
264239668516753409	neutral	BIG BANG CONCERT IS TOMORROW. OH MY LORD !! BOO HOO HOOOO )': *Cries all the 7 seas*
264241159486976000	neutral	@clownpeople Yeah your game against The Ravens was a Thursday night game. Im sure you will pull for The Giants these next 2 games
258935609308098561	neutral	HD clip of @primus knocking "Southbound Pachyderm" out with valor at @FMKirbyCenter Tuesday night. cc @WillBeekman - http://t.co/0d7K5do4
264173817927200768	positive	@LaCombe_865 I'm gonna be in Monroe like all day Sat! Haha
111409896934748160	negative	Listening to Amy and Lucien's attempts at 'communication' on last night's Big Brother ... I fear for the future of mankind sometimes.
264238520078589952	22666056	positive	@xlandonabx Reggie would make a good MCS teacher. I'm talk to Pratna about it tomorrow but I'm probably just dropping and ill do online
264131028271132672	negative	Nooooo they delayed the knicks and Nets game until Monday!
263794433596723200	positive	We are here @NBCofChicago for our 12th Anniversary celebration.  You still have time to make it - 6620 S. King Dr
111025350171045889	negative	@stillawake Are you off somewhere nice? I'm bored today. Got a list of 395 applications I need to get ready for Windows 7. Tedious
264117031207571456	neutral	BUENOS AIRES--Argentina late Wednesday approved a law to lower the legal voting age to 16 in a move that could s ...  http://t.co/Q71JyuG3
264243350260027392	negative	Think imma go see Flight tomorrow.. Denzel's the shit
109272638165221376	negative	Can't believe that Lloyd Robertson's last broadcast is tonight! End of an era. Who is gonna keep my grandma company at night!?
261583360848191488	positive	BRIEF-Clearwire says has enough funding to last it until end Q3 2013: Oct 25 (Reuters) - Clearwire Corp :  * Say... http://t.co/TEvQt5d5
100108185062473728	negative	@Seanzha it's Mexican! Sorry for the late answer, iPad' charging fucked me yesterday :D
264226947041751041	positive	@jaymohr37 Mr. Monday night just made my Thursday night'!! @rvd #mohrstories
183074478375436288	neutral	@FAOnews In Somalia, the people are still waiting from the int'l community strategy to develop food and agriculture after London Conference
256424909331394560	positive	Cannot wait to play San Fran on Sunday. If we can beat them at home for the NFC Championship we can beat them now.
101679633073836032	neutral	You work? RT @SavageBeaute: Going to walk the Brooklyn Bridge today
264074811251253249	neutral	ARRIVAL of ship: SHAM Port: ABU DHABI Time: Nov 1 2012 6:27PM (UTC) (Time of arrival/departure is the time the vessel approaches ...
106071742820265984	negative	DAMN, Someone saved HOLDER from the Earthquake! technically dont know why w/Biden out & Obama always out Boehner is 3rd in line!
264223454641913856	positive	Long drive too Kentucky tomorrow hopefully gonna get the big buck we caught on cam, at least we got @ChaseRiceMusic playing in the Chevy! <3
263700470143533056	negative	Fucking part time fans. Where were you at Boro away on Saturday?
263238987597107201	neutral	@echelleprakash 1st its like Imma play Headlock, and then Safe and Sound, and now you gonna play All Star. hmmmm
264075317944143873	positive	Watched The Cabin in the Woods, Silent House, Psycho, and The Rocky Horror Picture Show today! Yay! :)) Tomorrow iba naman ulit! :D
264006216907362304	neutral	Last Saturday, your PHBmates in Cebu, all performed some of Britney's Hits! Basing on this picture, you'll have... http://t.co/55SKckym
262499652350377984	neutral	@jcexplorer I'm planning a winter trip to Okinawa and on my way back I want to stay a few days in Saga and maybe Fukuoka in early January.
263100177043316736	positive	@popshifter crazypants. Got to the 7th, saw Kermit play Bullets. Beautiful area
111869217871118336	positive	RT @KDrix33: @CoolRayJ414 pulled off highway robbery to get Romo from @jfsain. Jk. Good trade. Ill try to process it so you can start ro ...
262984362633596928	neutral	Nitin Gadkari cans Himachal poll campaign: Sources close to Gadkari said late Monday night that the cancellation... http://t.co/WxJsPWXu
100121636048609280	negative	RT @pcam: @amish_man He may be that, but Obama spent $239 Billion a day after getting Uncle Sam's Credit Card in his hot little hands, s ...
215573277056315392	negative	Cofield should have hopped off the DM sticks after his 3rd year. Niggas was tired of him lol
220161124660822017	positive	Big fan of the holidays that just involve partying: St. Patrick's, 4th of July, Halloween, Presidents Day, etc.
103142847951290368	negative	Somewhere in Appleland, Steve Jobs just spit his morning coffee onto his computer screen. EAH!
102794392502415360	positive	MARCIA GAY HARDEN is 52 today...loved her #SVU roles as an FBI agent, and especially the "Amanda Knox" movie.
263917988711907328	neutral	Rugby fest at Padang: November 01, 2012 3:54 PMTOP class rugby action will take place at the Padang from Friday,... http://t.co/eYIJaA2e
229462324522655744	neutral	How are @PAFC going to get 20,000+ to Adelaide Oval when they can't even get 15,000 to AAMI on a Sunday afternoon? Crowd = Concerning. #AFL
262288011763523584	negative	Watched The Vow for the 5th time and I'm still tearing. What's wrong with this movie. It's tooo... omg i can't even.
262391285401399296	positive	@jrmahathir cakap je. Can we do it on tuesday ? Im in melaka. I really want to be in the picture... Please. *U may copy and paste this*
103944266530828289	neutral	@RobbieSavage8 what did you think of Derby tonight sav?
259020997401919488	positive	1. Noel Fielding comedy gala tonight :) 2. Work all day tomorrow 3. Granny Smith festival that night
263927078745956353	neutral	@kidlatdakila Chanot, you may want to travel this Christmas. Phuket or Bali! :) http://t.co/RI7rr9lc
172564470881726465	positive	Just whooped some ASS in kill confirmed with @QuiKGunZ and @PBrasfieldATO, tomorrow its back to makin kats cry in Gears3
263144921228263424	neutral	last push! last day of training before the break! then i'm off to BKK on thursday!!
263931320894365696	positive	@gamewank_jim James Martin could have you on Saturday Morning Kitching 'This will go wonderfully with the lamb; a real musty scrote aroma'
232305335489159168	positive	Support: We're excited that Stan Walker & advocates are running for the kids The Sun-Herald City2Surf soon!... http://t.co/QkDtdwq0
263354499370979329	positive	Delicious grilled cheese with ham cooked in Sun Dried Tomato, Parmesan & Garlic oil from Olive That in Montclair http://t.co/Wf0pNsHQ
264263949204193280	positive	@Bangz_InYaMouth woosahhhh it's Courtney! Long time no see from 1st lady!
264058231213658112	positive	Long weekend kicked off tomorrow with Jack White. Heebie jeebies
261437005261570048	neutral	My photos up at Photoplus and the Olympus booth. Come out and say hello! Ill be here till Saturday. http://t.co/iIAxfJn3
262292702991880194	neutral	The sale of the season hosted by Lucky Magazine with Grammy winner Jennifer Hudson, starts November 1st at 82Mercer http://t.co/RbKNjCbC
256571600353239040	neutral	Grappling with corruption and business in Brazil: The World Bank is sponsoring a  panel discussion on October 17... http://t.co/SwDRWHy9
264093152661610496	neutral	@milli_tam tell everyone that is wanting to do Jags that we're starting pratices this Sunday from 3-6 at the Greenville gym.
260799759097421824	neutral	@HilciaJSu Your review reminded me I still need 2 read the very 1st Percy Jackson book! Heroes of Olympus is an offshoot series from it?
259612493649948673	positive	Mark Martin: Hello you! Good weekend so far?   'The Hot 20' is on but can One Direction hold onto 'Saturday... http://t.co/ojPEjVOm
256787668367704066	positive	Grammys concert pays moving tribute to Whitney Houston: Whitney Houston was given a final sendoff by the Grammys on Thursday as Halle...
90835879622488064	neutral	@stanscates I would use that in ads from now until October 31st 2012. Republicans politics first country somewhere in the top 100.
100650724005912576	neutral	@stewardsfolly I think he and Sanchez should both be sat down. Time to bring back the 4-man rotation.
105120239544565760	neutral	Did I miss the Charlie Sheen roast on Comedy Central or is it Sept 19th?
100682407090454529	neutral	RT @BillieJoeLuver5: RT If you mentioned Green Day today.
107596442725646336	positive	@KevinHart4real on Comedy Central tonight @ 9...I'm a Grown Little Man and Seriously Funny...I'll be glued to the tv
175147659059929089	positive	Just got back from school :) aaaggghhh  he is 18. I've been having a spazzing attack the whole day :O National Bieber Day<3 @justinbieber :)
255725969476820992	negative	@HTTR24_7 If Cundiff is still the kicker come Sunday I'm starting a riot.
100968822164561921	negative	Maybe she won't...but shit then again maybe she will... - She Will ft Drake coming out today ! Single off CARTER IV !
262276966672125952	positive	Noel Gallagher's HFB and Kopparberg make for a damn near perfect Saturday evening. It could only be 100% perfect if I was at a Noel gig.
194439687853703168	positive	Celebrating St George's Day, the Bard's Birth Day or even World Book Day? April 23rd is a great day for history, heritage & culture. Enjoy!
264235528247988224	positive	AHHHHH just got Lauren's email!!! We are going to snap tomorrow #beready
264246408385814528	neutral	Wilfred Kiboro joins Family Bank as Chairman, a day after he quit Standard Chartered Bank. He takes over from founder Titus Muya on Jan 1
263786382282072064	positive	Feet First has #PrincetonTec headlamps! Hope to so you all at the Young Life 5k Saturday.
263810766644342784	positive	ATTN: Friends and fans! Come join me at Birdy's Thursday night @ 9:30 for a night of acoustic music!! Would love the support! Hope to see u!
215038301747412995	positive	Effat University wins the 1st "P&G's University Challenge" at the Procter and Gamble's university competition. http://t.co/XNQlMuVu
100213241103400960	positive	saw "Rise of the Planet of the Apes" with the gf last night...it was a pretty damn good movie...y'all should go check it out
262072861982859264	neutral	Someone should come with me November 9th to see Romeo Santos meet&greet at Fye at 6 pm at downtown (:
233671496256606209	neutral	Saltalamacchia is the 4th Red Sox catcher to hit at least 16 HR in back-to-back seasons, joining Carlton Fisk, Rich Gedman and Jason Varitek
100967212612980737	neutral	RT @nyjets: This afternoon's Jets training camp practice will be closed to the public due to heavy storms heading toward Florham Park, NJ
229290151489196032	positive	Today (July 28th '12) is Milk Chocolate Day. Bring it on. #milkchocolateday http://t.co/nPZEFpaE
261263062244417536	neutral	At a live basketball fantasy draft...sort of. I got the 7th pick. got Melo, Monta Ellis, Iguodala and Ibaka so far
109183675299667969	neutral	Lloyd Robertson set to end 41-year run as national news anchor tonight - News957: http://t.co/obHZO3E @CTVNationalNews @CTVCanadaAM
100137360385249280	negative	@HamHann haha was it as bad as your night in Barcelona with the bucket o chund!?
263738118748925952	negative	#NBA The Brooklyn Nets opener vs. the New York Knicks is postponed. It was originally scheduled for Thursday evening.
101911170369331200	neutral	@TheSlashDragon I may need Merlin's help - secretly, of course, but I do not know that I have the power to complete the spell myself.
261773015015116800	positive	even though there is rampage tonight, a gig tomorrow the best thing about my weekend will be seeing @nikkitopping #loveyou
264058599624540161	positive	So excited about the opportunity to go listen to @drlindseyduncan speak in Knoxville, TN tomorrow night!! Looking forward to learning! :)
263304259615981569	negative	@whiteboytatted @PaperChaseEnt_ y'all tryna fuck with Chapel Hill tomorrow night???
264121303961849858	neutral	Panasonic Eluga getting Ice Cream Sandwich update:  Panasonic may have all but pulled out of the European smartp... http://t.co/MKAAW0pW
262603955954143233	neutral	Bayer Leverkusen are winning 1-0 at Bayern Munich - the apocalypse starts tomorrow
261570451241836544	neutral	@swannydmp Did you tell Rio in the weeks before Rudd was knifed there would be no mining tax introduced in the May 10 budget?
263734506308108288	neutral	New Glory Gang music Janet at the Superbowl http://t.co/uvKpMUkX on #SoundCloud
100106464118583298	negative	@SusanLambe yeah i know what you mean, spent too much time catching up on Dexter today
176609456359084032	positive	Watching The Kandi Factory with Viggle Mon | 3:30PM | Bravo HD  Get real rewards just for watching TV. #TheKandiFactory #viggle
263955386539851776	positive	@CoryJane1080: ALL ABOARD... 1st flight to Hong Kong then off to the UK from there.. #Tweet_Yah_Later enjoy
100242328358363136	positive	Nicki Minaj - Pink Friday, up 15 places, to #16 on the Official UK Top 40 :) http://twitpic.com/62iohc
259561711005212673	neutral	Watching the 2nd Ghost Rider film is like watching Nicholas Cage go through a drug induced psychosis.
103748043240783872	positive	@surreycricket Looking forward to the Lions game tonight. Tele on, sound down, and Church on the radio. And the Rey with a form to dream of!
214698744816472064	positive	A Big congrats to Kevin McCarthy who was victorious on Saturday in the Presidents Day comp with a fine performance of very steady golf.
250104211570823169	neutral	Saw this after the game Saturday.   @ Former Site Of The Now Removed Joe Paterno Statue At Beaver Stadium http://t.co/mwGzBUWR
259079924441284608	positive	Hopefully watching the Lorax will get my mind off tomorrow
101631698885812225	positive	Good morning Auburn Family! Today feels like a good day to beat Nick Saban and Bama at...everything! #thatincludesbeingbetterchristians
260485840709492736	positive	Proper buzzing to watch The Vow with @_courtssx tomorrow;)
117186087671181312	positive	Would love to know the truth about Amanda Knox. http://t.co/CqW8Nbw8
246632625807192064	neutral	Anybody in the #dmv want to buy a pair of Anthony Hamilton tickets? Dm me for details. The show is tomorrow at Constitution Hall.
112700633777315840	positive	RT @GimmieDatBoom: Steelers gonna beat the Ravens tomorrow lol
264169010164273152	positive	Eli Young Band you were great on #cmaawards but you will be even better in Starkville tomorrow night :) #bulldogbash #HailState
264048277568237568	neutral	Sophia Grace and Rosie look back at highlights from their long singing career (it's their 1st anniversary on... http://t.co/qAv6jgKN
195339630009262081	positive	Amazing that Derrick, on his 28th birthday, gets called up from the D League to an incredible franchise like the San Antonio Spurs.
243311668459868160	neutral	Wednesday's Laugh:  ESKOM:  A little old lady answered a knock on the door one day, only to be confronted by a... http://t.co/MmwqsXvh
103099061908934657	neutral	@ThatBoyJacob Good morning! Do you know who else will be on this season of DWTS?
229042263966228481	neutral	If aliens observed Earth to learn about us, I wish they'd watch the Olympics. Rather than Mardis Gras or the 4th of July...
156452586218717184	negative	Although there was that one time he finished 3rd and Cannavaro finished 1st. Yes, Fabio Cannavaro. Bullshit.
263927812833030144	neutral	Tiffany will be one of the MCs along with CNBlue's Yonghwa and Beast's Gikwang for SBS KPOP Super Concert on November 10  cr: ForeverJeTi
261093524718645248	neutral	Grace means you give something they may not deserve, but you give it to them anyway. - Joseph Prince
256103696826519552	positive	Getting pumped for the #Niners #Giants game Sunday. And I guess so it Kyle Williams http://t.co/vqLseNLQ
