20011207_21.20.02-17431-5	positive	"By no means are we trying to set up a permanent presence here, we just want to help," said US military spokesman Sergeant-Major Ray Cordell.
20020202_20.37.54-21168-10	neutral	The fact that the former minister and President Fernando de la Rua, who later stepped down, were opposed to such a move drove the IMF even further away from lending any support.
20020315_20.21.54-4382-31	neutral	No court case was made against the others arrested nor they were given the right to defend themselves.
temp_fbis_20.34.33-18786-0	negative	Norway should be in the forefront of combating climate problems.
20020122_20.32.32-8613-2	negative	Critics condemn the inhumane nature of the treatment the prisoners are receiving, handcuffed, immobilized with shackles, subjected to sensory deprivation and confined to minute cells.
20011112_20.33.31-29984-23	negative	Promises Are Cheap
20020128_20.46.06-8042-37	negative	This is really an unwise idea.
20020318_20.48.00-11907-23	neutral	South African President Thabo Mbeki and President Olusegun Obasanjo are expected in Harare Monday for talks with the Zimbabwean leader on a possible government of national unity.
non_fbis_08.39.09-12713-26	neutral	Edward Murchabaiw arrived at a Rushinga polling station at 6  a.m. in a wheelbarrow, his emaciated frame drowing in a faded  blue suit-jacket.
non_fbis_14.05.39-25211-2	neutral	These individuals are  currently temporarily detained at the US base at Guantanamo Bay.
20020320_11.41.36-1407-9	neutral	Eduardo Duhalde's agenda, during his first departure from the country since he assumed the presidency, calls for a key meeting on Friday with the IMF's managing director, Horst Koehler, (which he will attend accompanied by Economy Minister Jorge Remes Lenicov), and two occasions on which he will have the floor, addressing the world (for five minutes on one, and three minutes on the other) concerning the topic under discussion; the Monterrey Consensus: or greater assistance from the developed countries to those that are underdeveloped, which in fact will be approved by consensus.
20020424_21.45.56-26903-3	neutral	High-tech output fell by an annualized 8% in January-February, following an 8.5% drop in all of 2001.
20020320_12.03.37-20669-17	neutral	Although Mbeki has not specifically given his own views, an official South African observer team said the election result should be respected.
20020311_21.42.46-13715-1	negative	The authors' particular concern is raised by the situation in China, Russia, and Saudi Arabia.
non_fbis_04.22.14-2532-2	neutral	The report by the Information Office of the State Council,  China's Cabinet, listed evidence of police abuses, poverty,  racial discrimination and lack of personal safety in the United  States, the official Xinhua news agency said.
20020128_20.46.06-8042-25	neutral	All these activities to "change the name of Taiwan," along with the Taiwanese authorities' comprehensive policies of "separating from China" in ideology, culture, history, education and the media, are all attempts to separate Taiwan from China, and change its status as a part of China.
20020517_22.08.22-24562-9	positive	Premier Zhu Rongji and ASEAN leaders agreed at the fifth  China-ASEAN leaders' summit in November to set up a free trade  area within 10 years.
20011024_17.55.28-22100-6	neutral	Commenting on a Washington Post report that the Bush administration was considering waiving sanctions that bar sales of military-related equipment to mainland China, Kao said MOFA is trying to obtain more information about the report.
temp_fbis_21.28.50-13504-42	neutral	The 'Gitmo' camp is many things.
non_fbis_06.20.40-8369-15	neutral	Terrorists dressed to pass like  these were often shot right on the spot during World War II and  the Korean War.
20020316_20.25.51-11532-16	negative	Because of the intensification of Israel-Palestinian armed conflicts in the recent period, not a single day would pass in peace and with no Palestinians shedding blood in the West Bank and Gaza Strip areas.
non_fbis_06.21.24-4640-24	neutral	Instead of lecturing the United States, our  critics may better spend their time reminding others that if  terrorists don't want to be detained at Camp X-Ray, they should  join the civilized world.
20020201_20.45.53-22539-27	positive	This is another of the "privileges" mentioned by Rumsfeld.
20011112_20.33.31-29984-3	neutral	According to Pemex [Mexican Petroleum] figures, between January and September the daily exports of barrels of oil did not exceed an average of 1.71 million.
20010829_01.48.48-11084-5	neutral	Taiwan will follow suit shortly after.
20020119_21.16.53-1351-4	positive	London meanwhile insists it supports US reassurances that the men are being treated humanely.
non_fbis_08.54.29-27700-4	neutral	He has sometimes talked of  remaining president past the year 2020.
non_fbis_08.03.05-5625-33	negative	But he said that he disagreed with the decision by the fund and  the Bush administration to continue the aid program in August,  when he said the situation in Argentina had likely deteriorated  beyond repair.
20020304_20.42.01-25605-5	negative	In other cases, he made unfounded charges by accusing Iran of discrimination against women and minorities.
non_fbis_04.22.14-2532-5	negative	China releases the report every year in response to a US State  Department report on global human rights conditions, which  usually accuses China of widespread abuses.
20020218_21.01.07-18921-0	neutral	Taipei, Feb. 18 (CNA) -- Minister of Foreign Affairs Eugene Chien said Monday he does not expect any surprise developments to come from U.S. President George W. Bush's visit to mainland China later this week.
20011124_20.49.26-27556-4	neutral	He added that Grandi had outlined to Tanka a four-pronged approach to the crisis -- improving conditions in camps, expanding the UNHCR's ability to deal with any further refugees, assisting non-governmental organisations involved in dealing with the crisis, and encouraging refugees to return to their homes.
20020207_20.23.04-14788-80	negative	They complained about the deficiencies of the benefits given to them through the National Armed Forces Social Welfare Institute (IPSFAN): insufficient mortgage loans, supermarkets that are not competitive enough in relation to others, etc.
20020517_22.08.22-24562-6	neutral	The framework is expected to cover a wide range of areas of  co-operation in goods, services and investment.
20020323_20.58.35-24209-1	neutral	The official programme of Kasyanov's stay in capital Ulaanbaatar will begin with a tete-a-tete meeting with Mongolian Prime Minister Nambaryn Enhbayar on Monday, followed by talks in an extended format and signing of several agreements.
20020412_21.18.30-8033-18	negative	The national strike is an important battle in the long-range war whose final result is not shaping up as a romance," he said.
20011015_22.26.42-7148-1	neutral	Karlovy Vary, western Bohemia, 15 October: The police and firemen closed the surroundings of a shop in Sokolovska street in Karlovy Vary before 11:00 a.m. [0900 gmt] today due to a suspicious envelope which the shop employees had received within the mail from abroad.
20011014_22.00.23-1236-3	neutral	The PRL [Liberal Reform Party] and the PSC [Christian Social Party] opposition party continue to support the strikes but criticize the fact that the humanitarian operations are taking place alongside them.
20020106_20.37.28-1540-5	neutral	In an interview with journalists later, NDDC Executive Director, Finance and Administration, Mr. Timi Alaibe, said that the choice of Odi was a deliberate policy to give the people of the area who are still recovering from the trauma of the 1999 sad incident a sense of belonging.
20011130_12.36.18-4189-26	negative	It is a mistake for the United States to use such an excuse to evade its responsibility.
20020115_21.09.21-9865-4	negative	Turover accused Mme.
non_fbis_12.44.14-20223-31	negative	Instead,  Amnesty International and the comrades are outraged that the  military is treating al Qaeda captives like prisoners.
20020202_20.37.54-21168-61	neutral	If an agreement is reached with the IMF and economic conditions improve, the timetable will likely be moved forward so that people can get cash.
20010927_23.18.15-25073-22	positive	At this time however, he taught a lesson to the Americans.
non_fbis_04.08.51-29183-30	neutral	Of all the unconscionable things the Taliban did to Afghan  society in the six years of their reign, their demolition of the  Buddhas of Bamiyan last March cleaved the rift between  civilisations that was rammed wide open by hijacked aircraft  over America just six months later, and which the US has since  cauterised with the molten metal of its military might.
20020114_11.18.53-27931-22	neutral	As this developed, the number of lawyers who will defend Misuari grew to 28, after former Davao City Mayor Benjamin de Guzman and two others agreed to serve as his counsel.
20011123_20.59.38-14856-21	neutral	However, for the uses for which the computers are designated, this level of accuracy is adequate.
temp_fbis_20.34.33-18786-3	neutral	Between now and 2008, the government's environmental initiative will be given concrete form in a report to the Storting this spring, in which an early quota system will occupy a central place.
20020204_20.38.59-25700-22	neutral	This, among other things, by specifying that no military operations are planned against any of the three countries cited.
20011116_20.44.27-28756-17	neutral	Only three important points were left over for Marrakesh.
20020111_21.00.52-4729-10	negative	Having marginalized their own leader, the CDU grandees cannot afford to leave the chancellor candidate in the lurch as well.
20020306_15.01.41-17868-13	neutral	In connection with freedom of speech and press, the report said the Seoul government abandoned direct control over the news media, but it continues to exercise indirect influence, and government officials vigorously lobby reporters and editors.
20020318_20.33.16-3417-11	negative	"They can see and observe the unjust and discriminatory policies of America.
non_fbis_12.16.50-28640-16	positive	In Harare, Zimbabwe's opposition Movement for Democratic Change  (MDC), whose leader Morgan Tsvangirai had challenged Mr. Mugabe,  praised the Commonwealth for taking concrete action.
temp_fbis_21.10.31-12974-60	neutral	The document that was given the name of the Kyoto Protocol was adopted in 1997 in the Japanese city of Kyoto.
20020414_21.16.03-15717-8	negative	There is very little doubt that Chavez did not voluntarily resign his office and was in fact removed from power by the army.
20020207_20.22.42-14586-27	neutral	He stressed that these journalists should be tried since, according to Article 122 of the Penal Code, any action that instigates interventionist actions is considered treason against the homeland.
20010907_21.53.17-27187-4	neutral	The defense chief will be in Indonesia on Monday flying in via Hong Kong for talks with his local counterpart and other defense officials.
20020320_11.41.36-1407-12	neutral	It was learned that Foreign Minister Carlos Ruckauf and Foreign Secretary Jorge Castaneda may already have talked about this.
non_fbis_06.47.23-22498-3	positive	"As chairman of the Organisation of African Unity and president  of a friendly neighbour, I congratulate President Mugabe on his  re-election," Mwanawasa said.
20020122_20.32.32-8613-4	negative	However, we may be witnessing a distortion of reality, and even in some cases pure falsehoods.
temp_fbis_21.26.05-29959-11	neutral	New ROC Deputy Representative to the United States Tsai Ming-hsian and Chang Fu-mei, chairwoman of the Overseas Chinese Affairs commission, are also attending.
20020314_20.23.54-19638-44	positive	This fact proved that the world stands on the side of justice.
20011210_20.40.44-4958-11	neutral	It consists of the use of direct-to-customer channels, through mainly e-mail and the World Wide Web (WWWW), along with other emerging technologies such as WAP.
20011220_21.22.09-18839-57	neutral	The Consolidated Budget surplus for the first nine months of 2001 amounted to Hr1.4 billion (0.9% of GDP).
20020225_21.00.49-23712-21	negative	Sharon has ensured that Israelis are rapidly absorbing the lesson that no place in Israel can be considered safe.
20020301_20.57.02-23111-31	positive	The United States can never dampen or bend our unwavering will.
20020320_12.04.40-21590-0	negative	DURBAN March 19 Sapa SA OBSERVER: ZIM ELECTIONS NOT FREE AND FAIR
20020424_21.47.41-28228-26	negative	The world, he says, has to be involved in the struggle against those who seek to attack and destroy law and order and legitimate government.
20020328_21.19.21-15525-0	neutral	Mbeki, Obasanjo envoys in fresh bid to save Mugabe
temp_fbis_20.23.33-17594-17	neutral	Nonetheless, Japan, changing its stand this time, opposed the draft regulations to put the "Kyoto Protocol" into force and even called for liquidation of the draft.
20010927_23.18.15-25073-32	positive	Feeling like a true ally, he was able to ask for a place for Russia almost inconspicuously - in NATO.
20020315_20.42.08-18791-23	neutral	The reaction from Western governments, according to Reuters, was in stark contrast to remarks by election observers from Nigeria, South Africa and Namibia.
non_fbis_05.20.33-11163-52	neutral	What's different?
non_fbis_07.29.33-28852-6	negative	Most disturbing are pronouncements by senior government  officials and military leaders that they would not allow this  former British colony to be led by Tsvangirai and his political  party, the Movement for Democratic Change.
20020131_20.50.32-16604-11	neutral	The United States wanted this very much, because so far the identity and citizenship of those they call "terrorists" (or "killers" in Bush's languages without nuances) rather than prisoners in a conventional war have not been published for reasons that are easy to understand.
20020419_21.47.55-9546-24	neutral	In the past, whenever a coup occurred in some Latin American countries, there was always a backdrop of US involvement.
non_fbis_09.35.06-27851-3	negative	"If it  becomes clear, and the evidence is already pretty strong, that  President Mugabe, in the event he is declared the winner, has  stolen the election, then that has enormous implications for the  nature of our relationship with Zimbabwe," he warned.
20020331_21.09.25-22686-43	negative	But this is a conflict without winners.
20020207_20.23.04-14788-41	neutral	Outstanding among these are:       The FAN is apolitical and non-deliberating.
20020119_21.10.42-27754-9	negative	What is clear is that Argentina's paralyzed economy was unable to tolerate the government's hardline policies, which finally resulted in the situation that we are witnessing today.
20020321_21.05.18-8344-1	neutral	The question of Taiwan, which relates to China's sovereignty and territorial integrity, is an essential and most important issue and is at the heart of Sino-U.S. relations, said Chinese Foreign Ministry spokeswoman Zhang Qiyue.
20020315_20.42.08-18791-48	negative	Observers from the 14-member Southern Africa Development Community's (Sadc) Parliamentary Forum, which was financed by the European Union after it was kicked out of the country, said: "The electoral process could not be said to have adequately complied with the norms and standards for elections in the Sadc region."
temp_fbis_21.10.31-12974-65	neutral	Russia's emissions are almost twice as great as those of Germany and Japan (in fourth and fifth places).
non_fbis_08.36.15-7509-7	positive	A spokeswoman for the Environment Minister, David Kemp, said  yesterday that the minister was on his way to talks with the  European Union in Brussels after a formal visit to Washington,  and that the Government was still committed to Kyoto.
20011220_21.22.09-18839-13	neutral	At enterprises that process wood and manufacture wood products , output volumes increased 25.9% during the first ten months of the current year as compared with the same period last year.
20011130_12.36.18-4189-24	neutral	China's per capita emission is only one-sixth that of the United States.
non_fbis_08.10.09-13801-20	neutral	The controls were a sign of the financial pressures on  Argentina, according to Vincent Truglia, an analyst at Moody's  (news/quote).
20020205_20.41.01-8736-20	negative	Carpenter also said that in this way, the door to improving relations with Iran would be completely blocked.
20011209_20.32.39-1919-0	neutral	For its own reasons, which are linked to its interests and, naturally, to Israel's interests, the United States chose to put intensive pressure on the Palestinian Authority.
20020316_20.35.03-16511-19	neutral	Kenya and Tanzania even "congratulated" Robert Mugabe on his re-election after the first round.
temp_fbis_20.23.33-17594-28	negative	On the pretext of the US opposition, Japan was attempting to realize its own objective.
20020204_20.24.49-8480-34	neutral	Our heroic People's Army and people will never tolerate the US imperialists' reckless military oppressive attempt and will pose a merciless annihilating blow to the aggressors.
20011224_21.09.23-6361-2	neutral	But after a detailed examination of the ship, which is currently moored off the Isle of Wight, nothing suspicious was found, police said.
non_fbis_07.52.36-18982-32	neutral	Hundreds of marines and military police have been flown to  Guantanamo Bay to expand the compound to house up to 2,000  prisoners.
20011218_20.35.25-594-17	neutral	People will likely remember the fact that the United States withdrew its delegation from the UN conference against racism held last September in Durban, South Africa.
20020224_20.56.08-8888-12	neutral	The "axis of evil" is "not necessarily the expression that the Europeans would use," EU Commissioner for External and Security Policy Javier Solana says, but one should not dwell on the choice of words.
20020206_20.31.05-16359-9	negative	The current US administration will consult with no one, not even its closest allies, whether in Europe or its followers in the Third World, particularly in the Arab world.
20020128_20.43.50-5456-0	neutral	You can never be too sure about what you are communicating.
20020121_21.25.32-10485-9	neutral	"They're terrorists, they're murderers and the USA will treat them as it pleases," is Defence Secretary Donald Rumsfeld's reply to the critics.
non_fbis_08.27.54-12647-14	neutral	Mr. Carmona, the president of Fedeca-iras, a business  association, said early today that Mr. Chavez had "presented his  resignation."
non_fbis_11.08.41-17418-14	neutral	Mugabe appealed to the nation and the opposition to reconcile to  address the pressing economic needs, but fell short of proposing  a government of national unity.
non_fbis_08.47.00-17401-24	negative	Not everyone in Japan is upset with Bush's alternative.
non_fbis_09.11.12-16761-14	neutral	"But with China and America widening their scope of cooperation  the priority of the Taiwan problem in bilateral relations will  be lowered."
20011224_21.09.23-6361-18	neutral	"We would take similar action in the future if there was a potential risk to the public."
20020418_21.37.20-19607-0	neutral	The Zionist and US administrations have the illusion that they succeeded in defeating the Palestinian people and their valiant intifadah.
20011220_21.22.09-18839-78	neutral	The total volume of retail trade turnover in retail trade enterprises and the restaurant industry amounted to Hr27.7 billion, which in comparable prices was 11.8% more than the total volume during the corresponding period in 2000.
non_fbis_08.35.40-23372-0	negative	Argentina braces for currency fall
20020327_20.50.33-2917-6	negative	Malan criticizes the stance taken by multilateral institutions like the IMF, who are asking for reforms in Argentina before the country can receive financial help.
20011108_21.45.03-5180-7	neutral	That showed that the ruling right-wing coalition in Israel is pursuing an occupational policy and is not, in the first place, willing to recognize the firm national Palestinian rights to freedom, independence, and the end of occupation and settlement.
non_fbis_08.47.00-17401-22	negative	They  fear that, because the US is forging its own way, smaller  nations that are expected to ratify the Kyoto Protocol could  start backing out.
20020306_20.49.12-24038-1	neutral	"Soon, the government will delegate Jordan's representative to the United Nations, HH Prince Zeid Ben Raad, to sign the protocol," Juneidi told The Jordan Times on Tuesday, adding that an exact date for signing of the environmental agreement had not been set.
non_fbis_06.39.11-29583-9	positive	Instead the US  government produced its own alternative climate change strategy  aimed at encouraging industries to trim their emissions.
temp_fbis_20.46.39-9348-3	negative	"During President Bush's speech, I thought of heckling; 'What are you going to do with the Kyoto Protocol?' and 'How about CTBT?' but I refrained.
non_fbis_11.11.15-6639-14	negative	A strike this week by the country's trade unions  protesting the government's tactics reflects widespread disgust  with Mugabe.
20020121_21.25.32-10485-6	negative	In the event of disagreement, as is the case now, with the USA insisting that the issue concerns terrorists who do not belong to any state and who do not have rights as prisoners, the final decision should be left in the hands of "an appropriate tribunal", which must be impartial and independent, as Article 5 of the third Geneva Convention states.
non_fbis_16.03.54-17435-3	neutral	Chavez told Cardoso he has no intention of seeking revenge  against the military personnel who supported the failed attempt  to remove him from office.
non_fbis_08.09.29-13319-17	neutral	More than 50  police officers were reported hurt in the disturbances in the  capital alone.
non_fbis_16.01.33-12919-14	negative	Was it only the wish of socialist propaganda in those words?
20020202_20.37.52-21155-1	neutral	Powell's reaction, according to a Planalto source, was one of "interest and attention".
20011220_21.22.09-18839-53	neutral	Consolidated Budget revenues for the first nine months of 2001 (according to data from the State Treasury) totalled Hr39.2 billion (25.8% of GDP), which amounts to 74% of the approved sum for the year.
20010830_01.03.02-16670-0	neutral	Bangkok, Aug. 28 (CNA) -- The Taipei-based Chinese Federation of Labor (CFL) attended the Asian regional meeting of the International Labor Organization (ILO) held Tuesday in Bangkok, mainly because of its work to protect foreign laborers in Taiwan.
non_fbis_12.19.35-18077-4	negative	On the eve of voting due to start at 7 a.m. today, the United  States charged Mr. Mugabe's government with conducting a blatant  campaign of intimidation to win the poll.
20020122_20.32.22-8496-22	neutral	Danish People's Party: Are They Danes?
20020131_20.58.51-26741-28	neutral	Meanwhile, the Sadc forum said yesterday that it will send at least 39 observers to Zimbabwe a month before the Presidential election.
temp_fbis_21.28.50-13504-16	negative	Even its most loyal ally, Great Britian, is showing signs of disquiet in the statements made by its members of parliament, and in the reports carried by its media.
20011007_03.17.23-6711-38	neutral	One will be located near the landing site of Apollo 14 and the other near a ring-shaped mountain range on the dark side of the moon.
20020204_20.38.59-25700-8	neutral	Whatever the cost of our country's defense, we will pay it.
20020205_20.41.01-8736-24	negative	After he set forth the "Axis of Evil" theory in his State of the Union speech, Bush met with increasing attacks from the international community.
20011115_20.41.29-15150-2	neutral	According to the accord, about 40 industrialized countries must cut or limit emissions of carbon dioxide and other heat-trapping gases by an average of 5.2 percent from 1990 levels by 2012.
20020221_21.03.19-22060-9	neutral	"The position of my government has not changed over the years," Bush said.
20020114_21.15.53-1323-6	negative	"If Arafat fails to fulfill them he will be there [in Ramallah] for as long as I remain prime minister," Sharon warned.
20020419_21.47.55-9546-14	neutral	The Pentagon spokesperson Clarke went a step further to explain that US Deputy Assistant Defense Secretary [Rogelio Pardo-] Maurer for Western Hemisphere Affairs met with Venezuelan Armed Forces Supreme Commander and Inspector General Lucas Rincon in December of last year and made it clear to the latter that the United ! States "supports democracy" and that "we in no way would support any coups or unconstitutional activity."
20020425_21.45.53-9610-20	negative	But he also took the risk that an obsession -- Fidel Castro's downfall -- would exert excessive influence on the conduct of relations with his neighbors in the South.
non_fbis_17.41.39-5995-0	neutral	Europe to Tax Israeli Settlement Goods
temp_fbis_20.42.47-22260-8	negative	In the letter, the NGOs said, "We, Japanese environmental NGOs concerned about climate change, were terribly dismayed by your new climate change plan."
20011116_20.44.27-28756-39	negative	Even the United States, which declared for its own reasons that it did not intend to ratify it, has been giving indications that it will adopt domestic measures using concepts capable of being harmonized with those set forth in the protocol.
