20020131_20.58.51-26741-7	neutral	Sadc will not participate in what ever form the sanctions may take," said taskforce chairperson Ms Lilian Patel, who is also Malawi Foreign Minister.
non_fbis_04.33.07-17094-4	negative	At the weekend the European Union, prodded by Britain, is  planning to extend the range of sanctions against Zimbabwe,  targeting more members of the leadership.
non_fbis_08.22.04-29634-12	positive	Last Wednesday when receiving a special delegation from the US  House of Representatives, Chen said that the strong support of  the US Congress - which led to US arms sales to Taiwan in April  last year - ensured a balanced cross-Straits military situation  and peace in the Taiwan Straits.
20020121_21.25.31-10464-5	neutral	According to the US administration, they can be tried outside US territory before secret military courts and they can be condemned, even to death, without the assurance of having been found guilty "beyond all reasonable doubt".
20010830_01.03.02-16670-10	positive	Lin noted that Taiwan is one of the ICFTU founders and that its participation in the ILO can serve as a model for Taiwan to take part in international activities.
20011024_20.04.50-29091-3	neutral	Many observers inside and outside the region had rightly feared that Israel would callously exploit the Sept. 11 tragedy in the US to intensify and accelerate its aggression against the Palestinians and crush their efforts towards claiming their legitimate rights to freedom and independence.
20020121_21.29.47-14352-5	neutral	Wang Lequan, secretary of the regional committee of the Communist Party of China, has listed comprehensive treatment of the Tarim River and the project to ship natural gas from Xinjiang to eastern China as the most important projects for this year.
20020320_20.36.59-7133-7	neutral	Nevertheless, intact pieces of debris weighing up to 20 to 30 tonnes fell into the Pacific Ocean.
20020115_21.11.08-11611-17	negative	To be more precise, prisoners of war are not to be treated like those jailed by the U.S. at its Guantanamo Bay naval base in Cuba.
20011121_21.21.46-15196-4	neutral	A spokesman for the security bureau said Hong Kong would not grant anyone political asylum under present policies.
20020128_20.41.17-4020-2	neutral	Two additional transports will carry the other soldiers (a total of 48).
non_fbis_12.45.44-23455-9	neutral	As for his liftoff two days earlier from Kazakhstan, ''I had  moments of terror, moments of sheer upliftment and  exhilaration,'' Shuttleworth said.
20011119_20.45.31-22188-16	neutral	"The government should provide domestic firms real aid like tax reductions and environmental technology development rather than abstractly recommend domestic firms promote energy efficiency and lower energy consumption," an industry source said.
20020131_20.58.51-26741-15	neutral	She said the taskforce believed that constructive political dialogue was the key way forward to solving problems in Zimbabwe.
20020122_20.36.01-11616-51	neutral	In December 2001, the UK proclaimed a state of emergency and passed the Antiterrorism, Crime, and Security Act.
temp_fbis_20.46.47-22286-8	neutral	In this regard, he made a quick reference to the ongoing killings of Indian Muslims.
non_fbis_08.40.56-18707-4	neutral	Russian  security forces in Chechnya have "demonstrated little respect  for basic human rights and there were credible reports of  serious violations, including numerous reports of extrajudicial  killings by both the government and Chechen fighters," the  report said.
20011007_03.17.23-6711-3	neutral	It is also the first hurdle to overcome to realize any astronautical program.
non_fbis_11.09.24-151-40	negative	But Friday night an opposition polling agent  said she was harassed by ruling party militants, who also sat in  front of the polling station chanting slogans Saturday morning,  opposition officials said.
20011217_20.37.28-19761-9	neutral	There is no way of knowing whether or not Israel will halt the withdrawal of its troops again under any pretext as it did before.
20011220_21.22.09-18839-3	neutral	The growth of real GDP by 9.1% as compared with the relevant period last year was due to an increase in gross value added in the leading forms of economic activity.
non_fbis_12.08.27-27397-1	negative	HARARE, Zimbabwe - As Robert Mugabe moved to consolidate his  victory in elections most observers denounced as rigged, an ugly  split was opening up in the response from black African nations  and the West.
20020109_14.06.40-17312-17	neutral	Yesterday [07 January], the National Institute of Radiation Protection (SSI) announced that it could not exclude the possibility of people who had come into contact with the container suffering acute health effects from radiation.
20020114_11.18.53-27931-7	negative	"If Chairman Misuari would go against (the rescue), we cannot do otherwise (but follow) because he is our commander in chief," he said.
20020219_20.45.06-11781-22	neutral	But the reality is that "there are many problems, including role sharing in joint actions with the US military, that we need to settle if we want to apply the law," (said a Defense Agency source).
20011116_20.44.27-28756-43	positive	That will be proof, on its 10th anniversary, of the success of the Rio Conference, where this whole important effort began.
20020205_20.21.49-25548-14	negative	The circumstance has led Bush to again adopt an aggressive policy.
20020207_20.22.42-14586-43	neutral	It has been vague about Venezuela's intentions regarding the protection of crude prices and the war on terrorism.
20020224_20.56.08-8888-9	neutral	Today he says action could be taken without considering the Europeans.
non_fbis_10.35.30-7542-6	neutral	"The Taiwan issue is the most important and sensitive issue at  the core of Sino-US relations," she said at the biweekly  ministry briefing.
20020122_20.32.22-8496-19	neutral	"It cannot be the duty of the Danish Government to applaud everything that the Americans do.
20020315_20.22.38-4806-24	negative	The [US] newspaper The New York Times reported that a European Union leader evaluated the axis of evil dogma as a despotic, very simplistic, very rash, and a futile one.
non_fbis_11.04.20-23621-30	neutral	CONTINUING EFFECT
temp_fbis_21.10.31-12974-142	neutral	That is, all of our actions are accompanied by a deterioration in the climate.
20011114_20.42.07-7434-16	neutral	A paper published yesterday by the CS First Boston bank noted: "The most recent statements from Washington suggest that it (the G-7 support) is unlikely, but we are not precluding the possibility of surprises."
20020206_20.23.00-9795-16	neutral	President Chavez himself now boasts of having spent 20 years conspiring -- that is, eroding the armed forces' loyalty -- to achieve his goal of conquering power.
20020517_22.08.22-24562-3	neutral	The third China-ASEAN Economic Senior Official's meeting, held  in Beijing on Tuesday, set up a trade negotiation committee to  hold in-depth discussions on the framework of a free trade area  in the region.
non_fbis_11.14.43-703-13	negative	``Well, we don't like some of your allies like Saudi Arabia or  Gulf states who give finance to terrorism organizations,''  Ivanov said.
20020202_20.37.54-21168-43	neutral	The government explained that it theoretically saw tools like the "unidad de fomento" as a way of adjusting the deposits of savers that will remain subject to restrictions until at least next year.
20020314_20.23.54-19638-40	negative	Like this, it is inevitable for injustice to meet denunciation and rejection.
non_fbis_06.48.28-6852-14	negative	This is most unfortunate.
20020315_20.42.08-18791-2	neutral	The United States, Britain and several Western countries declared that the outcome was illegitimate while African leaders and China upheld the elections.
20020328_21.19.21-15525-8	positive	Diplomatic sources say African leaders are frantically making efforts to bring the MDC on board through the formation of a coalition government in order to facilitate recognition of the Zimbabwean government by the international community and unlock much-needed foreign aid that has been suspended.
20011129_21.35.18-3709-0	positive	Kazakh president optimistic about future of CIS
20020121_21.25.31-10464-0	negative	Spanish daily warns USA its treatment of suspects could alienate allies
20011231_21.05.45-10422-29	neutral	For the political scientist, Argentina cannot wait for assistance from the American Government.
20020314_20.23.54-19638-51	negative	To prove it, the arguments gained ground in many countries that, for a fair settlement on the Middle East issues, Israel must discontinue its attacks against Palestine and suppression of Palestinians and the United States must not use double standards.
20020210_20.31.39-22620-8	neutral	One of the closest aides to reclusive Taliban leader Mullah Mohammad Omar, he is seen as a potential source of crucial evidence against Omar and bin Laden, the chief suspect of the September 11 terror attacks who has eluded a US-led manhunt so far.
20020331_21.11.01-23492-4	negative	The Chinese government is deeply concerned about the sudden deterioration in the Middle East situation, Tang said.
temp_fbis_20.34.33-18786-52	neutral	Some of these are:       The range-which gases and sectors should be included in the quota system, and how businesses exposed to competition should be dealt with.
20011209_20.32.39-1919-2	negative	It also tried, through this pressure, to remove the legitimacy of the PA and its chairman Yasir Arafat under the pretext of terrorism or support for terrorism.
20020315_20.42.08-18791-26	positive	An observer team from the Organisation of African Unity hailed the election as "transparent, credible, free and fair".
20020211_20.56.28-3485-7	neutral	Health personnel have been deployed to the affected areas to carry out random screening of residents to contain the outbreak.
20020219_20.52.48-16582-16	neutral	As for North Korea, it is a country living in isolation and is keeping its good and evil from everyone else.
temp_fbis_21.20.14-9569-26	neutral	This issue is closely intertwined with America's policies towards the Middle East.
20020314_20.42.42-156-3	neutral	The train will cover the 3,300-kilometer route to Tehran through Kazakhstan, Uzbekistan, Turkmenistan and Iran in 68 hours.
20011220_21.22.09-18839-23	neutral	In January-September 2001, Ukrainian industrial enterprises shipped products (rendered services) valued at Hr112.9 billion, of which sum barter deals accounted for Hr9.1 billion (8.1%) and monetary payments made up Hr87.7 billion (77.7%).
20020212_20.42.04-19290-38	neutral	In an operation that morning they arrested 12 illegal currency traders near Corrientes and San Martin.
non_fbis_12.21.28-26118-7	negative	This is not a price worth paying.
non_fbis_08.39.09-12713-39	neutral	Old and illiterate voters were assisted by ZANU-PF officials who  often directed them to vote for the incumbent president.
20010620_13.40.05-15087-14	neutral	The disease can be contracted if a person is bitten by a certain tick or if a person comes into contact with the blood of a Congo Fever sufferer.
20011123_20.59.38-14856-14	neutral	A typical question would be: In the sequence "AAB" is there an equal number of As and Bs?
20010907_21.53.17-27187-3	neutral	Foreign Minister Makiko Tanaka will also attend the events.
20020130_20.43.33-11456-22	positive	However, like any other legitimate message, it costs money, sustained effort, and organisation to put it out.
non_fbis_06.11.16-17420-2	neutral	Prescott said that while the U.S. decision to reject the Kyoto  agreement is a cause for concern, pressure will be maintained on  the Bush administration to go further with its current voluntary  emission-reduction targets.
temp_fbis_20.34.33-18786-50	positive	In addition to being effective, an early quota system would also give business and industry useful experience before the international quota system following the Kyoto Protocol comes into effect in 2008.
20020314_20.27.25-21759-12	negative	The first popular uprising, the Intifada, of 1987 and then the second one, which erupted 18 months ago, were desperate means by conquered Palestinians to end the occupation.
non_fbis_08.14.55-18533-21	neutral	Camp X-Ray has cells for about 100 detainees, and will soon be  expanded to hold 220.
non_fbis_12.04.00-12904-0	neutral	New Argentine president quits after a week; March vote nixed
20011201_21.19.03-816-23	neutral	An initial segment of 2.5 million euros (Frank's training costs) will reportedly be paid in the next few days.
non_fbis_08.09.29-13319-2	negative	The resignation letter, which was delivered to Congress late in  the day, followed violent food riots and protests here and in  several cities.
non_fbis_12.08.27-27397-36	neutral	The government was taking no chances of a popular uprising,  putting the military on alert and setting up police roadblocks  around Harare and other large cities.
20020224_20.56.08-8888-2	negative	France's Finance Minister Laurent Fabius thinks that there is something the United States above all fails to understand: To secure the future, an increase in development aid is absolutely essential.
20011129_21.35.18-3709-8	neutral	"We cannot stand on the sidelines of this global tendency," the Kazakh president said.
20011007_03.17.23-6711-37	neutral	"Lunar A," one of the major projects, is aimed at delivering two penetrators on the moon to collect various data.
20020204_20.22.56-6451-8	negative	Islamabad's silence does not set a healthy precedent.
20020209_20.34.02-2831-6	neutral	The key issue is not so much whether they are treated humanely and their beliefs respected, but their legal status.
non_fbis_06.44.52-19992-132	positive	Another doctor, speaking with a French accent, adds, "Good job,  buddy."
20020205_20.41.01-8736-16	neutral	An analytical article carried in the Washington Post says that including Iran on the "Axis of Evil" list is all the more astonishing.
20020122_20.36.01-11616-58	positive	Observance of these rules will not insure that the fight against terrorism is lost; it will prove respect for human dignity, of which the West is rightly a champion.
20020320_11.52.35-10118-0	negative	It has now become our right to announce clearly that the United States had become one of the sides of the axis of evil according to the same criteria set by the United States itself, and declared by its President George Bush.
20020324_20.55.32-6296-0	neutral	MOSCOW. March 24 (Interfax) - Russian Prime Minister Mikhail Kasyanov on Sunday evening is beginning a foreign tour, during which he will pay official visits to Mongolia and Vietnam.
20020219_20.45.06-11781-6	neutral	"I believe the comments on the 'axis of evil' reflect the firm resolve of President Bush and the United States against terrorism.
20020315_20.21.54-4382-23	neutral	As a result, the governments in Guatemala in 1954 and 1963, Dominican Republic in 1984, Brazil in 1965 and that of Chile in 1973 were toppled.
20020507_18.02.46-24802-15	negative	So, why do Rice and the US Administration launch campaigns against, and interfere in the affairs of, the Palestinian leadership?
20020206_20.23.00-9795-28	neutral	This system of freedoms made him president of the Republic.
20020125_20.18.05-14490-5	negative	European nations have also criticized conditions at the US base after a US Department of Defense photograph showed a group of prisoners shackled, blindfolded, kneeling and wearing ear muffs.
temp_fbis_20.46.47-22286-10	negative	The Americans, he pointed out, see violations of human rights when a country or a group of people become hurdles in the realization of their vested interests.
non_fbis_15.13.14-22330-7	positive	The Chinese leader said President Mubarak telephoned him after  last September 11th incidents urging him to do his best for  saving the peace process between Palestinians and Israel.
20011024_18.09.35-13708-28	neutral	A number of war veterans have in fact already been armed.
20020128_20.45.48-7720-4	neutral	"They will not be determined to be POWs."
20011016_22.34.35-3190-9	positive	Dostum also favoured a possible return of Afghanistan's former King Mohammad Zaher Shah.
non_fbis_12.46.57-22041-45	neutral	"It's propaganda.
20020508_21.54.31-15463-2	positive	The slain militants owing allegiance to Lashker-e-Toiba have been identified as Abu Saifullah, Abu Talha and Abu Huraira.
20011221_20.56.01-12278-6	negative	Well, until the IMF brought them to the point of death, just as there's a transitory motion that's seen in corpses, that's what happened in Argentina."
20020212_20.53.38-28377-6	negative	Perhaps the most important characteristic of the new European initiative is the fact that it annuls the hardline Israeli-US stand, which rejects any kind of political negotiations unless the violence stops completely.
non_fbis_08.36.15-7509-3	neutral	The Australian-US "climate action partnership" involves liaison  between governments, businesses and research bodies on climate  change.
20020430_22.09.32-24118-5	negative	When Chavez resumed power, a senior US official in charge of national security commented that "Chavez should reflect on himself," as "his ship has been sailing towards a wrong direction for far too long."
20020320_12.04.40-21590-13	negative	"Even in the queues at polling centres there was a lot of fear and tension.
non_fbis_08.46.28-13637-149	negative	My public affairs keepers couldn't care  less.
20020207_20.23.04-14788-7	negative	Following a brief introduction, it recalls that on 4 February 1992 the now president violated his military oath when he rose up in arms against the democratic institutions.
20020425_21.45.53-9610-17	negative	In the new Manichean world, divided between friends and enemies of the sole superpower, Hugo Chavez was unwise enough to condemn the American bombing raids in Afghanistan.
20020224_20.58.06-10542-7	neutral	A total of 186 local and 20 foreign journalists were accredited yesterday to cover the election.
temp_fbis_20.43.16-10786-5	neutral	It is this index that will be reduced, according to the White House, by 18 percent over the next 10 years.
20020103_20.28.43-12622-12	neutral	US envoy Zinni is supposed to have realized these clear-cut facts through his reading of the latest developments in the region.
non_fbis_08.46.28-13637-137	neutral	One of Rumsfeld's security agents mounts our bus, telling us the  ground rules: no photos on the tarmac, no fighting, no hitting  Rumsfeld in the head with a boom mike.
20020318_20.48.00-11907-24	positive	The two, along with Australian Prime Minister John Howard, are members of a Commonwealth panel charged with assessing the election and recommending possible action by the group against Zimbabwe.
temp_fbis_21.29.08-21533-6	neutral	Question: How do you assess Iran's reaction to the overthrow of the Chavez Government and to his return--something on which the Foreign Ministry issued a statement?
20020111_21.00.52-4729-8	positive	Certainly, Mr. Stoiber has done everything in his power to spare himself the fate of his mentor, Franz Josef Strauss.
non_fbis_12.45.44-23455-18	positive	But I'm feeling much better now,''  said his mother, Ronelle Shuttleworth.
20020321_21.05.18-8344-0	neutral	Beijing, March 21 (XINHUA) -- China urged the United States on Thursday to abide by the "one China policy", warning that any act to trample upon the Sino-U.S. Joint Communiques could result in a "very unfavorable" impact on relations between the two countries.
non_fbis_06.29.16-13721-28	neutral	That may be so; unfortunately, as Amnesty International has  pointed out, under the Geneva Convention the Pentagon has no  business making such a determination.
temp_fbis_21.03.47-22424-1	negative	Whether Bush will, like Clinton, damage Taiwan's interests is receiving the deep concern of all quarters.
20020113_03.20.43-12807-7	neutral	The number of crimes committed by Koreans has also been on the increase.
20020404_21.30.26-14869-5	neutral	Each state has the sovereign right to determine the forms and methods of its participation in the coalition," he said.
20011115_20.41.29-15150-7	neutral	According to statistics released by International Energy Agency (IEA), a Paris-based agency affiliated with the OECD, South Korea was found to have recorded the highest growth rate of carbon dioxide emissions in 1999, showing a 75.5 percent increase since 1990.
20020209_20.27.35-29256-21	negative	The point is that if the United States keeps pontificating and preaching about human rights, it can't suddenly forget about its past lectures to other countries and nations.
20011024_20.04.50-29091-0	negative	Israel's persistent and deliberate fuelling of the cycle of violence in the Palestinian territories is pushing our already turbulent region towards inevitable chaos and war.
20020301_20.57.02-23111-9	negative	Because the remarks absolutely do not go with the reputation of the United States, which is carrying out all kinds of vicious conduct.
non_fbis_08.46.28-13637-95	neutral	The prisoners (who represent about 25 different  nationalities but mostly are Saudis) can also freely chat with  each other about God knows what: prison uprisings, the demise of  Talk magazine, trades of Froot Loops for garlic bagel chips.
non_fbis_08.03.05-5625-21	positive	The government beseeched the I.M.F. for help to stay  solvent as it tried to work through its problems.
non_fbis_12.45.44-23455-22	neutral	It will now serve as the space station's lifeboat.
20010907_00.16.28-8800-13	positive	The governments attending the conference had a long and varied agenda, including: economic globalization, the anti-missile shield defense project, the Kyoto Protocol and environmental protection, the political and military crises in the Middle East, the Balkans, and Afghanistan, moratorium on the accumulated debt of the poor countries, and ... [as published] They meant to reach some form of agreement or understanding about those issues, but unexpected events left all that in limbo and uncertainty.
temp_fbis_21.03.47-22424-36	negative	Taiwan has some people who very obviously purposely play up China's use of force to scare Taiwan.
non_fbis_08.47.00-17401-27	negative	"Any further policy to  reduce emissions," he says "will hurt Japanese industrial  competitiveness."
temp_fbis_21.10.31-12974-4	neutral	Iceland, Japan, Australia and Canada are ready to join the ratification.
non_fbis_08.03.05-5625-12	neutral	After some hand-wringing about jeopardizing the money of  American "plumbers and carpenters," Mr. O'Neill supported a  multibillion loan for Argentina in August.
20020128_20.50.06-12228-8	positive	The Proton family of rockets the Khrunichev center produces is one of the most popular commodities on the international market for the launch of heavy carriers.
non_fbis_11.08.41-17418-7	neutral	Several African heads of states attended the ceremony, including  President Sam Nujoma of Namibia and President Joseph Kabila of  the Democratic Republic of Congo.
20020316_20.35.03-16511-18	neutral	Africa, with its own "observers," has just ratified a shameful electoral sham.
20011116_20.44.27-28756-42	neutral	It is predicted that a sufficient number of countries will do the same so that the protocol will take effect before the World Summit on Sustainable Development in Johannesburg in September 2002.
non_fbis_12.21.28-26118-15	neutral	According to the U.S. Energy  Information Administration, world energy consumption will  increase by about 60% between now and 2020, with most of the  upsurge expected to come from developing nations, which are not  covered by the Kyoto Protocol.
temp_fbis_21.28.50-13504-7	neutral	Their number will rise to at least 1,000 over the next three months.
20020203_20.47.22-10067-8	negative	Their cause was an unjust one and therefore had little support.
20011130_12.36.18-4189-27	negative	He also pointed out: Although the Kyoto Protocol did not set a reduction target for China, however, China is very concerned about global climate change-related issues in recent years.
20020205_20.23.27-26526-7	negative	Dostam and Rabbani's factions are seen as uneasy partners in the fragile Northern Alliance that fought the Taliban militia from 1996 until the hardline Islamic regime crumbled in the face of US bombing in November.
20020130_21.00.11-67-5	neutral	This is because of the high costs involved, and the poor conditions of the local landing strip.
20020331_21.09.25-22686-6	neutral	It was then that the Arab heads of state adopted the three noes: no to negotiations with Israel, no to recognition, no to peace.
20011218_21.00.22-21144-34	neutral	The other solution is the opposite of the first one: the departure of the Israelis to more hospitable climes, in the United States or Europe.
20020119_21.16.53-1351-11	neutral	The government has sent a team of officials to the camp to assess the conditions of the British prisoners.
20020318_20.51.31-14776-1	positive	Chief-of-Staff of the Turkish Armed Forces Huseyin Kivrikoglu arrived in Uzbekistan on Saturday [16 March] at the invitation of Uzbek Defence Minister Kadyr Gulyamov, sources in the Turkish Embassy in Tashkent told Interfax.
20020202_20.37.52-21155-34	negative	If I do not save them, I do not save myself."
20020103_20.35.17-19238-3	neutral	Chang Fu-shun, 27, is said to be the younger brother of Chang Hui-hua, who allegedly invited Huang to meet her at the hotel and who Huang claimed was in the hotel room when he was detained.
20020203_20.47.22-10067-22	negative	That is why many people suspect the purpose of the United States' putting Iran, Iraq, and the DPRK in the box of "evil axis" is to prepare public opinion for possible strikes against these old foes under the banner of fighting terror.
20020207_20.37.46-24515-2	neutral	The average number of 15- to 19-year-old migrant women who are married with children is higher than the national average.
