non_fbis_06.21.24-4640-23	neutral	America's treatment of the Taliban and al Qaeda terrorists at  Camp X-Ray is appropriate and, in my opinion, too good for these  murderous thugs.
20020223_20.53.55-17301-1	positive	Both the Chinese and US sides hold that the visit has achieved positive and successful results.
20020218_21.01.07-18921-6	positive	The minister further said that since the communication channels between Taiwan and the United States have been operating smoothly, MOFA can fully grasp any possible developments.
non_fbis_06.44.52-19992-73	neutral	Concertina wire and nine guard towers surround Camp X-Ray.
20020204_20.23.24-6873-3	negative	The defining characteristic of the presumptive "axis of evil" is portrayed as a tendency on the part of its constituent states and non-state players to acquire weapons of mass destruction [WMDs].
20020131_20.50.32-16604-26	neutral	At first sight, this seems to be nothing more than a terminology issue.
20020122_20.36.01-11616-7	positive	Back in 1949, it was agreed by nearly all the states in the world that the sufferings of war must henceforth become more bearable, especially for those who are not directly involved in the conflict.
non_fbis_04.33.07-17094-19	neutral	The country took the news of Mugabe's victory with  no great celebrations or protests.
temp_fbis_20.55.24-19278-29	positive	The dominant role of the European climate protection policy has benefits for our economy.
20020507_22.11.06-28210-23	neutral	He said beneficiaries of the program have included government ministers, MPs, army and police officials -- even Mr. Mugabe's in-laws.
20020204_20.23.24-6873-11	negative	Iran's Ayatollah Ali Khamenei has described the US itself as "the greatest evil".
non_fbis_16.01.44-19040-3	positive	Cardoso made his remarks as he sent congress a message calling  for ratification of the Kyoto Protocol by Brazil and committing  the country to reducing greenhouse emissions by 5.2% by 2012.
20011114_20.42.07-7434-21	neutral	But it is evident that, during the past few weeks, the official has taken responsibility for a fundamental task: to tone down Cavallo's tendency toward confrontation.
non_fbis_06.48.28-6852-12	neutral	The Chavez administration said it ordered the  deployment to "prevent public order disturbances."
temp_fbis_20.53.10-15177-7	positive	Sharon's government has embarked on building 10 bypass roads, some of which were approved by the previous government.
20010927_23.18.15-25073-0	neutral	Leaders of the United States probably withheld their breath Monday evening while watching on television what Russian President Vladimir Putin was about to say to his people.
20020204_20.41.31-29293-1	neutral	Meanwhile the United States is raising the volume in the matter of the struggle against terrorism.
20020405_21.35.14-9737-7	negative	The Israeli army has also strongly denied reports about an assault on the Cathedral of the Nativity in Bethlehem, which allegedly began recently.
20011218_21.00.22-21144-13	positive	Despite this, the Palestinian resistance has formally recognized the existence of Israel and begun a peace process in Oslo, while the state of Israel has recognized the Palestinians represented by the PLO and its leader Yasser Arafat.
20020316_20.35.03-16511-14	negative	Indignant protests apart, nothing was done to prevent the disaster awaiting one of the key countries in southern Africa, seen as the continent's growth pole.
20020207_20.37.46-24515-5	neutral	This is less than the registration rate of migrant women with no or one child.
temp_fbis_21.24.00-10191-7	positive	Nevertheless, in his subsequent remarks, Bush encouraged Sharon to continue.
20011119_20.45.31-22188-1	neutral	The Kyoto Protocol was made by members of the United Nations Framework Convention for Climate Change at its seventh session held in Marrakech, Morocco at the start of the month.
non_fbis_08.03.23-18607-13	neutral	"If we're not making progress  toward our goal," he said, "we will be considering a full range  of programs."
20020116_21.28.14-6829-6	neutral	Sebi also gave out certificates.
non_fbis_08.09.29-13319-38	negative	Mr. de la R?ruling Alianza coalition of centrists and Social  Democrats fractured, and his cabinet became a revolving door of  officials and constantly changing economic policies.
non_fbis_04.51.05-27505-8	neutral	It signed the Optional Protocols to Convention  on the Rights of Child.
non_fbis_03.47.06-11142-3	negative	The 78-year-old former guerrilla leader, who has governed since  independence in 1980, took another swipe at the former colonial  power Britain and other western nations, which he said have  prejudged the vote.
temp_fbis_20.45.06-5529-1	positive	The Ministry of Foreign Affairs and Trade said in a statement that "the Government of the Republic of Korea appreciates continued interest shown by the Government of the United States in climate change and their efforts in presenting on February 14 a new initiative to address this issue which is one of the greatest challenges humankind faces in the 21st century."
non_fbis_07.52.36-18982-21	neutral	They wore surgical masks as some prisoners had tested positive  for tuberculosis and at least one prisoner was sedated.
non_fbis_12.30.38-25095-7	neutral	Two  Russians are also among the six-member crew.
temp_fbis_20.57.35-19171-6	neutral	So this new version has new bases.
20011114_21.19.18-13373-3	neutral	In the first 10 months of this year, it was 133m US dollars, which is almost double of the amount of last year when it was 71m US dollars.
20011231_21.05.45-10422-32	neutral	The concern now is security.
temp_fbis_20.44.41-9757-2	positive	The minister however said Japan will press on with ratification of the 1997 Kyoto pact on global warming, which environment ministers from 160 countries -- with the exception of the United States -- agreed on in Morocco last November after marathon talks.
20020217_20.42.51-22299-7	positive	The government plans to deploy some 18,000 police to boost security during Bush's first visit to Japan as president.
20020312_21.16.59-4123-4	neutral	A Singapore government statement identified Indonesian Muslim cleric Abu Bakar Ba'asyir as one ofthem.
non_fbis_06.29.16-13721-39	positive	Still, things could be worse.
20020306_15.01.41-17868-1	negative	The "Country Reports on Human Rights Practices for 2001," submitted to Congress, said North Korea's human rights record remained poor, and it continued to commit numerous serious abuses.
non_fbis_08.46.28-13637-7	negative	"I'm up to my ears in Vieques," says Navy Lt. Corey  Barker, of the nearby bombing range/public relations fiasco that  has been protested by everyone from Al Sharpton to obscure  Kennedys.
20011130_12.36.18-4189-4	negative	According to Dr. Ren, humans released excessive amounts of greenhouse gases, primarily carbon dioxide, into the atmosphere in the past century, particularly in the past 50 years.
non_fbis_08.27.54-12647-32	neutral	Mr. Chavez's daughter, Mar?Gabriela, speaking in an interview  on state television in Cuba, said that her father had not  resigned.
20010705_01.24.22-5235-1	neutral	As a consequence, the cow was infected as well.
20020207_20.22.42-14586-10	neutral	Deputy Cilia Flores, chief of bloc of the Fifth Republic Movement [MVR], used the same tone to express her opinion.
20020122_20.36.01-11616-17	negative	Such a building enjoys the highest possible protection, and can and should never be the object of an attack, unless it is clearly established that it is being used for military purposes.
20011129_21.35.18-3709-7	neutral	Getting back to the problem of broadening all-round cooperation between the CIS countries, Nazarbayev said that a new factor - globalization - is accelerating this process.
20011210_20.21.48-16389-20	negative	The third is the perception of the President as an incapable leader, which is already happening, and the fourth is that Venezuelans are able to find a substitute leader.
20020205_20.41.01-8736-17	neutral	The article says that the United States tried hard to establish a new relationship with Iran last fall and expressed its appreciation for Iran's condemnation of terrorism.
20020422_21.26.55-3999-6	negative	"All the governments are saying that Argentina has to make arrangements first with the IMF before receiving any kind of aid, and they know perfectly well that they are asking us to put 450,000 fellow citizens out of work, and that is only possible with a military government," he asserted.
20020410_22.24.21-25298-2	positive	United Nations Secretary-General Kofi Annan, the European high representative for the common foreign and security policy (CFSP), Javier Solana, and the foreign ministers of Spain and Russia, Josep Pique and Igor Ivanov, on Wednesday called on Israel to "withdraw immediately" from all Palestinian areas that have recently been occupied and collectively expressed their full support to the Middle East mission US Secretary of State Colin Powell is going to undertake.
non_fbis_08.12.40-1611-2	negative	Bush told a news conference that the United States is consulting  with other countries to decide how "to deal with this flawed  election."
20011111_20.41.07-12494-33	positive	This is the only responsible course of action and it will be a historic success for Doha and we want this meeting to be a success.
temp_fbis_20.41.29-25820-65	negative	The current treatment for the detainees:       The prisoners were brought to the prisons in a brutal manner.
non_fbis_12.03.26-29353-1	negative	When the local currency rapidly decreases in value, it is a sign  of serious economic trouble.
20020507_17.55.10-20068-1	neutral	Speaking on behalf of the NGOs , human rights organisation, Hakam president Ramdas Tikamdas said the boycott was to protest the government's poor response to Suhakam's numerous recommendations thus far.
20020320_12.04.40-21590-11	neutral	In a preliminary, Motsuenyane declared the Zimbabwe poll "legitimate", adding they could, however, not be openly described as free and fair.
20020423_21.35.03-11178-4	neutral	As per the tariff plan announced by Bharti, peak-time call charges to the SAARC [South Asian Association for Regional Cooperation] region will be offered at Rs 21.18 per minute as against the present Rs 21.82, while for the rest of the world it will be Rs 24 per minute as against Rs 31.30 to Rs 40 that are applicable now.
20020304_20.50.30-97-2	neutral	By taking this decision, the EU has reaffirmed its commitment to pursuing multilateral solutions to issues of global concern.
non_fbis_11.08.55-4179-4	positive	U.S. Rep. Ileana Ros-Lehtinen, R-Miami, said she supported the  idea, in part, because it would underscore the naval base's  strategic importance at a time when some members of Congress  have urged returning the territory to Cuba.
20020320_20.36.59-7133-54	positive	Australia should adhere to the Cardinal Principle of International Law, which states that all nations in the world must first respect and promote the humanitarian interests and progress of all humankind.
non_fbis_12.08.27-27397-24	neutral	Mr. Mugabe has not been seen since Friday's pre-election rallies  and made no appearance or comment yesterday.
20020204_20.24.49-8480-2	negative	This markedly reveals [the United States'] extremely dangerous attempt to link our Republic to terrorism by force and crush us at all costs with military strength and is no more than showing, to the international community, Bush to be the most vicious war maniac himself.
non_fbis_12.09.12-23643-13	negative	"The Americans seem  to have retreated from an earlier position of the death penalty  for foreigners, but we are still worried about the extent to  which this guy's legal rights are being subjugated to the  Australian government's shuttle diplomacy with the US."
non_fbis_12.46.57-22041-10	neutral	A few  call to each other.
non_fbis_11.09.24-151-28	neutral	The lines were far longer than during  parliamentary elections in June 2000, which saw a strong  challenge to Mugabe's Zimbabwe African National Union Patriotic  Front party, though it narrowly won.
non_fbis_05.22.13-11526-12	negative	Tendai Biti, the MDC's foreign affairs spokesman, said Mugabe  was trying to hide his policies of violence and intimidation  behind his rift with Britain.
non_fbis_08.22.04-29634-1	negative	On April 9, the 23rd anniversary of the United States '  troublemaking Taiwan Relations Act, the US Congress is due to  unveil a 70-member Taiwan caucus.
20020121_21.25.31-10464-14	neutral	A team from the International Red Cross is interviewing each of more than 100 Taleban and Al-Qa'idah members being held prisoner in Guantanamo about the treatment they are receiving, a situation that Defence Secretary Donald Rumsfeld has said does not interest him.
temp_fbis_21.10.31-12974-47	neutral	True, this position makes one think of Yemelya's [illusory] happiness and worry about the future development of the country (both technological and economic as a whole).
20020204_20.38.59-25700-11	positive	His speech was "brilliant, full of strength and eloquence.
20020314_20.23.54-19638-22	negative	A spokesman of the EU Commission, at a press conference, expressed concerns over the Bush gaffe labeling [North] Korea, Iran, and Iraq as the "axis of evil" and said that "the EU's high representatives do not agree to such policy."
non_fbis_08.09.29-13319-32	neutral	This scheme is designed to help middle-class people with home  mortgages and car loans that are currently valued in dollars.
non_fbis_12.22.23-26451-25	neutral	The government is also apparently continuing to register ZANU-PF  supporters long after the official closing of the voters roll.
20020403_21.25.24-12160-5	neutral	This accounts for roughly 40% of Iraq's total oil exports, he said.
20020202_20.37.54-21168-60	neutral	In other words, refunds will not begin until January 2003.
non_fbis_08.46.28-13637-104	neutral	Those who think the prisoners are  getting coddled (Rep. John Mica, a Florida Republican, visited  the camp and said it's "too good for the bastards") will be  happy to know that the shampoo is not jojoba-enriched.
20011015_22.26.42-7148-3	neutral	Assisted by medical inspectors, firemen - wearing antichemical suits and respirators - put the envelope into a plastic bag.
20020301_20.57.02-23111-11	negative	It is the United States that possesses the world's largest quantity of WMD and inflicted nuclear disaster on humankind.
20020128_20.46.06-8042-10	neutral	The Taiwanese authorities had to respond in low key.
non_fbis_05.20.33-11163-22	neutral	What is the United  States doing to actively promote democracy and human rights with  Saudi Arabia?
20020320_21.03.16-25474-6	positive	The army would like to request whoever is engaged in this criminal activity, to stop," he said.
20020219_20.52.48-16582-11	neutral	If it was viable to describe terrorist organizations as evil, then it is not viable to do the same for countries.
non_fbis_04.33.07-17094-27	positive	In Zimbabwe the leadership of the congress of trade  unions is considering calling a two-day general strike to test  whether there would be popular support for a longer protest, and  various civil rights groups are meeting today to discuss mass  civil disobedience.
20020122_20.32.22-8496-13	negative	" Social Democratic Party: Raise Denmark's Voice
non_fbis_11.09.24-151-22	negative	The government refused to accredit most independent Zimbabwean  voting monitors, but many of them showed up outside of polling  stations anyway.
non_fbis_08.35.40-23372-15	positive	A weekend poll by Aresco consultancy showed 52  percent of Argentines "highly" in favor of Duhalde's stated  economic plans and another 34 percent giving him "medium"  approval - an indication of public confidence.
non_fbis_08.03.05-5625-4	negative	Others say the fund made the  opposite mistake, repeatedly offering loans to Argentina despite  indications that the country's policies had become unworkable,  delaying the day of reckoning.
20011115_20.41.29-15150-14	neutral	Jun Mu, deputy director of the industry and environment team at the Korea Chamber of Commerce and Industry (KCCI), said, ``So far, industries have been rather passive in dealing with emission reductions, as is has been something that was considered to lie far off in the future.
20011130_12.07.32-18094-18	negative	It appears that if the directive issued by Bush becomes law, then that country's re-entry into the UN Human Rights Commission, from which it was expelled this year, will become much more difficult.
20020204_20.38.59-25700-21	positive	As for responses abroad, in order to make them somewhat less sharp, the administration has introduced some qualifications.
20011124_20.49.56-27748-18	neutral	Lecaros said that Misuari had developed ties with the Abu Sayyaf rebel group that has carried out a spree of kidnappings.
temp_fbis_21.10.31-12974-8	neutral	Participants in the debate also proceeded from the postulate that the earth's atmosphere has been heating up over the past 100 years.
20020327_20.50.33-2917-3	positive	"The priority now is to unshackle the credit system, for there is no modern economy that can function without credit.
non_fbis_04.33.07-17094-10	negative	"We find ourselves unable to endorse the  purported election of President Robert Mugabe as Zimbabwe's  president in this election.
20020315_20.21.54-4382-14	neutral	Apparently President Bush's attitude looks like a reaction to the events of 11 September 2001.
20011224_21.09.23-6361-20	neutral	The chairman of the British arm of the Great Eastern Shipping Company, Sudhir Mulji, confirmed that the vessel had stopped over at Djibouti before its current journey to drop off American grain as part of a food aid shipment.
20020208_20.29.29-13302-8	neutral	Earlier in the evening a crowd prevented a group of military police from arresting Soto, hours after he appeared at an event in a Caracas hotel, calling Chavez "undemocratic" and demanding the president's resignation.
20020115_21.11.08-11611-13	neutral	Under the Geneva Convention, prisoners of war must be treated humanely.
20011114_20.42.07-7434-18	neutral	Foreign Minister Adalberto Rodriguez Giavarini continued to cultivate his new role as conciliator in the United States yesterday, at a meeting with his counterparts from the Mercosur [Common Market of the South] countries.
20020430_22.09.32-24118-19	neutral	This reminds one of a witty remark made by US President Franklin Roosevelt in the old days.
20011207_21.20.02-17431-20	neutral	Ironically, some 200 armed Russians, who appeared to be from the military although they were dressed in uniforms of Russia's emergencies ministry, set up camp 10 days ago in the centre of Kabul.
temp_fbis_21.28.50-13504-2	negative	Opposite the cages, those cages of theirs not even two meters by three meters -- which seen together look like a chicken farm run by a sadist -- built from wooden beams and sheets of metal, cement, and barbed wire, exposed to the rain and the wind of the Tropics.
temp_fbis_20.41.29-25820-1	neutral	While mankind has unquestionably become more civilized with respect to "humanitarian treatment for POWs" today on the basis of the principles in international law in comparison with ancient times when POWs were slaughtered or enslaved, we should watch out for the possible regression in this regard.
20020221_21.03.19-22060-3	positive	Chien voiced his gratitude to Bush for "having honored his commitment" he pledged to Taipei before his Asian trip, which also took him to Japan and South Korea.
20020331_21.09.25-22686-33	neutral	According to these sources, Sharon had accepted the cease-fire proposal, while Arafat hesitated.
20011114_21.16.57-11242-4	neutral	Briefing on the remarks by the representative of Thailand, it said: "Human rights and development were two sides of the same coin, and should be addressed in tandem."
non_fbis_07.20.20-11694-6	negative	Australia said it feared violence if voters thought the election  had been stolen.
non_fbis_15.13.45-21190-8	negative	Atvan said that Bush's speech looked  like one of Hitler's.
20011125_21.01.04-6923-9	neutral	However, night fell before the Alliance could secure the city, increasing the danger of militants fighting back.
non_fbis_12.46.57-22041-17	negative	On entering Camp X-Ray, one  inmate vowed to kill an American before he left.
20011107_16.03.28-26714-0	neutral	Moscow, 6 November: Three spacecraft will be launched from the Baykonur space centre in November.
20020204_20.41.31-29293-9	neutral	The priority for Belgium is to verify the identity of the detainee who claims its nationality.
20020507_17.55.53-20579-15	neutral	A soldier sustained injuries in the shoot out.
non_fbis_15.08.17-13301-4	neutral	At present, citizens from Poland, Japan and the United States  are being tested by Rosaviakosmos.
non_fbis_15.36.10-18917-4	neutral	Referring to the difficult period the venezuelan nation went  through in the past week, President Chavez said the  anti-democractic attempts to topple his government failed with  the help of the Almighty God and the people.
20011218_21.00.30-21204-37	negative	Also, the risk that its bankruptcy will cause a chain reaction and lead to a grave crisis among emerging nations is, according to economists, not very likely or at most limited.
20020322_21.05.41-14545-72	neutral	A presidential election is not necessarily six years away.
temp_fbis_20.45.09-11809-1	negative	This left the impression that Japan stands alone on this issue because European countries have been cool to Bush's "axis of evil" rhetoric.
non_fbis_03.23.00-19213-29	positive	"What we have done all along is (said) that they are being  treated humanely in accordance with the Geneva Convention,"  Clarke told reporters.
non_fbis_12.30.38-25095-25	negative	At the moment it's a  challenge."
20020111_21.05.06-7601-14	neutral	According to industry, relocation, with the resulting job losses, would be the only solution.
20020303_21.09.29-14261-1	neutral	Political violence in the lead up to Zimbabwe's elections next weekend again overshadowed the Commonwealth Heads of Government Meeting (CHOGM) during a second day of crunch talks here.
20020416_21.44.44-3823-4	positive	As a friend of Venezuela, China hoped to further strengthen friendship and cooperation with the country, Zhang said.
20020312_21.16.59-4123-6	neutral	Singapore late last year 13 suspected members of the Jemaah Islamiyah terrorist group for allegedly plotting to blow up US targets there.
20020326_20.55.44-16289-2	neutral	The sources said Halasa also made a deposit of $6 million at the Central Bank of Jordan.
non_fbis_08.47.00-17401-0	negative	Tokyo irked by US stance on Kyoto
non_fbis_05.22.13-11526-20	negative	The opposition accuses the government of using violence,  intimidation and new security laws to cow its voters and to  prevent it from effectively campaigning.
temp_fbis_21.26.05-29959-1	neutral	Since the United States switched its diplomatic recognition from Taipei to Beijing in 1979, ROC Representative to the United States Chen Chien-jen said substantive Taiwan-U.S. relations have never been as close as they are at the present time.
20020301_21.00.59-25256-15	neutral	Unemployment prevails mainly among chemical, mechanical and civil engineering graduates, he said, adding that engineers specialised in electrical, computer and architectural engineering have no problem finding jobs.
temp_fbis_21.10.31-12974-125	neutral	But to what extent does this reflect real life?
non_fbis_06.51.18-1222-19	negative	The MDC, charging that the Mugabe government had followed a  deliberate strategy of impeding the urban vote, went to the High  Court and won an extra day of voting on Monday, but polls opened  several hours late, and only an additional 24,000 votes were  cast.
20020212_20.42.04-19290-11	neutral	Meanwhile, economist Miguel Bein, a former secretary of economic policy, said that "the overshooting already happened when the dollar went from 1 to 2 pesos.
non_fbis_06.44.52-19992-148	neutral	Hot.
20011201_21.19.03-816-17	positive	His dynamism is an asset.
non_fbis_06.44.52-19992-52	neutral	Each meal the detainees get is considered halal, or religiously  appropriate for Muslims.
20020204_20.38.59-25700-26	positive	The President said he was confident about the US allies' support against countries trying to acquire mass destruction weapons.
20020109_14.12.17-21564-7	neutral	As many as 117 people and 58 vehicles crossed the border through that checkpoint on Monday, the spokesman said.
20020207_20.23.04-14788-44	neutral	Soldiers will never point their weapons at unarmed people
20020315_20.42.26-19148-27	neutral	Zuma had informed Mugabe of the SAOM report and that it was part of a process involving various bodies such as SADC, the OAU and the Commonwealth.
20011119_20.45.31-22188-4	negative	The government and business circle expect the nation's exports to be damaged in direct and indirect ways from 2008, when advanced nations will begin to be regulated by the protocol.
20020213_20.55.56-1089-0	neutral	Italian farmer charged with illegally slaughtering cattle
20011029_20.27.05-27044-5	neutral	Lt. General (Retd) Khalid Maqbool was the defense and military attache at the Pakistani Embassy in the United States for two and a half years.
20020205_20.41.01-8736-23	neutral	Difficult for Britain and France To Agree with US
non_fbis_15.11.50-23748-9	negative	Ordinary Venezuelans are  even less happy with the generals and local oligarchic elite.
20020207_20.22.42-14586-30	negative	He indicated: "These reports have tried to suggest the existence of ties between Miraflores [Presidential Palace] and terrorist groups: There are documents presumably drafted by the FAN [National Armed Forces] expressing discontent with the government; the video disclosed by the journalists; and [Justice First Deputy] Gerardo Blyde's remarks on the creation of militia groups trained by the guerrillas.
