non_fbis_12.22.23-26451-24	neutral	Meanwhile, as many as 100,000 soldiers and police officers have  already voted under the watchful eye of their commanders and far  from the gaze of any outside observers, Mr. Matchaba-Hove said.
20011229_21.12.57-28994-5	positive	The lower the living standards of those polled, the less frequently they spoke in support of the US campaign, Tomenko said.
20011224_21.09.23-6361-21	neutral	The ship then went on to Mauritius to pick up the sugar and left on November 20 to transport it to Britain.
temp_fbis_22.34.58-23977-0	neutral	BEIJING, April 11 (AFP) - China on Thursday slammed increasingly close ties between the United States and Taiwan, demanding an end to official exchanges between the two and to US weapons sales.
non_fbis_08.12.40-1611-3	neutral	Bush suspended U.S. entry privileges for Mugabe, his family or  senior members of his government.
temp_fbis_20.41.29-25820-24	neutral	They are not allowed to look around, talk, hear, or touch anything; nor are they allowed to move freely.
non_fbis_10.12.58-29108-27	neutral	Now  O'Keefe's is to fix the space station."
temp_fbis_21.10.31-12974-37	negative	Models are flawed, including the greenhouse model, and the only thing that is beyond dispute is that warming is underway, and the contribution of human beings to this alarming condition is very large, possible at least 30 percent.
non_fbis_11.08.55-4179-5	positive	``It's an excellent location,'' she said.
20020223_20.53.55-17301-2	positive	Hong Kong media also generally maintained a positive stance toward the trip and welcomed the visit.
non_fbis_06.44.52-19992-57	neutral	"If you do your job right," says Campion, 32, of Kansas City,  Mo., "nothing is scheduled to happen."
non_fbis_12.08.27-27397-31	negative	Although Mr. Tsvangirai said the people were "seething with  anger," Mr. Tsvangirai ruled out open rebellion.
20020121_21.31.10-15710-11	neutral	Accompanying the president at the Khrunichev centre are Deputy Prime Minister Ilya Klebanov, deputy chief of Presidential Administration, Sergey Prikhodko; chief of staff, Anatoliy Kvashnin, presidential assistant, Yevgeniy Shaposhnikov, Deputy Defence Minister Aleksey Moskovskiy and Space Forces Commander Anatoliy Perminov.
non_fbis_08.35.40-23372-34	negative	But that's exactly  what Duhalde most lacks.
20010907_00.16.28-8800-24	neutral	What, however, was most remarkable in the conferences in New York and Genoa, was the fact that most decisions made, were based on interests and tastes of particular groups [lobbies].
20020415_21.33.22-7140-33	negative	However, it could be better.
20011218_21.00.30-21204-15	positive	Unconditional Support
20020124_20.24.37-12857-1	negative	The so-called US-led campaign against terrorism is inspiring opportunistic attacks on civil liberties around the world, 'Human Rights Watch' warned in its annual global survey released recently.
20020225_21.00.49-23712-2	neutral	It cannot integrate itself into the region, it is an alien seedling and, thus, it is better to isolate and fortify itself as a lowly outpost.
non_fbis_06.44.52-19992-154	neutral	Within a couple months, he says, the operation will move to  another part of Guantanamo called Radio Range, where utilities  are more readily available and cells will have cots, air  conditioning and toilets.
temp_fbis_21.31.56-18015-3	neutral	Referring to the difficult period the venezuelan nation went through in the past week, President Chavez said the anti-democractic attempts to topple his government failed with the help of the Almighty God and the people.
20020509_22.11.01-7259-3	neutral	Research newly released by the WHO indicates that societies with a heavy burden of disease tend to experience a multiplicity of severe impediments to economic progress especially to sustainable economic growth.
20010926_22.11.18-10696-3	negative	The businessman said he turned down an offer of a 200,000 dollar commission for the sale.
temp_fbis_21.03.47-22424-51	neutral	However, Taiwan announcing independence to the outside world is a variable.
20020320_20.36.59-7133-50	neutral	Indonesia can exploit this principle of the Space Treaty 1967.
20010916_21.24.32-9824-16	neutral	The LTTE staged a kamikaze-style assault on a merchant vessel in June last year.
non_fbis_13.05.15-16517-44	positive	The air force chief, Gen. Regulo Anselmi, said the military  urged Chavez on Wednesday to negotiate.
20020117_21.05.07-9115-8	neutral	Koizumi made a weeklong tour of the Philippines, Malaysia, Thailand, Indonesia and Singapore earlier in the month.
non_fbis_06.56.31-3120-20	neutral	Information Minister Jonathan Moyo said the result was a blow to  British Prime Minister Tony Blair whom Mugabe accuses of  sponsoring Tsvangirai.
non_fbis_08.40.56-18707-7	neutral	However, U.S. officials also note that some of the rebels do not  have international ties, and they have criticized Russian  military and police abuse of civilians -- although the criticism  was toned down greatly after Russia became an enthusiastic  member of the anti-terrorist coalition, sharing intelligence  information, opening its airspace to humanitarian flights and  giving a green light to U.S. military deployment in Central  Asia.
non_fbis_15.08.17-13301-5	neutral	Russia pioneered space  tourism in April, 2001, when the Californian millionaire Denis  Tito was taken to the ISS for a ten-day space trip.
20020125_20.20.40-16093-1	neutral	At a joint news conference with Annan, interim Afghan leader Hamid Karzai read out the members of the commission, which he described as "the most important task for the interim administration and for the United Nations".
20020421_21.33.09-24778-3	neutral	During the talks, also developments about the Middle East peace process will be evaluated and Cem will hold bilateral contacts with foreign ministers of some of the participating countries on the Middle East dispute.
non_fbis_12.30.38-25095-4	neutral	He flew onboard the  Space Shuttle Columbia in 1992.
non_fbis_08.09.29-13319-5	negative	Argentina, with widening budget deficits, is heavily indebted to  foreign lenders and is battling to prevent more defaults.
20020205_20.21.49-25548-8	neutral	For the countries that regard the three countries as friends or not evil, they are considered to be enemies of the United States.
non_fbis_08.01.38-4843-30	negative	And some argue that  both the Clinton and Bush administrations should have acted  sooner to steer Argentina away from its doomed efforts to defend  a 1-to-1 peg of its peso to the dollar.
20020201_20.45.53-22539-32	neutral	"There is virtually no more room; work needs to be done on making the place bigger and better," a Department of Defense spokesman announced.
20011113_20.27.12-885-28	negative	How could the United States be asked to do such a thing if Argentina was unable to show a modicum of internal political discipline in advance?
20020205_20.23.27-26526-2	neutral	No one was injured, and the fighting stopped when local authorities intervened, Jan told AFP.
non_fbis_08.54.02-18235-31	neutral	Modern barnstormers
temp_fbis_21.50.57-15245-26	negative	Finally, America prescribes liberal democracy for others yet fails itself to accord any value to democratic principles in the world.
non_fbis_08.03.23-18607-30	negative	In the face of lobbying  from coal companies and utilities, Mr. Bush abandoned a campaign  pledge last March to control the four plant emissions together  and has shown no signs of reconsidering that idea.
20020118_21.16.16-1134-8	neutral	A four-member International Red Cross team flew into the US navy base on Cuban soil on Thursday and was due to begin interviewing detainees later Friday.
non_fbis_06.12.31-26764-18	neutral	If this is  the case, Rice could have elaborated more precise criteria for  membership in the "axis of evil," by establishing more clearly  the connection between the nature of the regime and the  acquisition of weapons of mass destruction.
non_fbis_06.44.52-19992-91	neutral	"In the beginning, they were very unsure," says Carrico.
20020304_20.42.01-25605-9	negative	In his report, the UN human rights rapporteur also interfered in Iran's internal affairs.
20020326_21.07.32-24343-11	neutral	At the rear of the spaceship is the propulsion capsule to provide thrust to the spaceship in orbital control and return to earth.
temp_fbis_20.41.29-25820-36	neutral	Therefore, on the issue of defining these prisoners' "status," the United States must test the attitudes of the international community, especially the attitudes of European countries.
20020122_20.32.22-8496-3	negative	Criticism From the Red Cross
20011111_20.41.07-12494-25	neutral	The WTO claims that it wants to protect the environment.
non_fbis_04.33.07-17094-20	negative	The government, sensing murmurs about revolt, put the army on  full alert, deployed troops in key townships and the police set  up roadblocks on the main roads into Harare to stop and search  vehicles for weapons.
non_fbis_12.07.16-6586-12	positive	He has reportedly suggested Argentina will have to declare a  moratorium on payments on its crushing debt load and has vowed  to leave in place a key economic law pegging the Argentine peso  to the U.S. dollar.
non_fbis_10.03.26-15373-10	neutral	But curbs on CO 2 mean curbs on burning coal, oil, and natural  gas - the fuels of booming economies.
20011130_12.36.18-4189-23	neutral	Furthermore, on a per capita basis, emissions by developing nations are also far less than that by industrialized nations.
20020331_21.11.01-23492-8	positive	The pressing matter of the moment is that Israel and Palestine should both exercise maximum restraint and adopt concrete measures to stop the conflict immediately and create conditions for resumption of the peace talks, Tang said.
non_fbis_12.44.14-20223-2	negative	Well, heaven without the 72 virgins.
20020316_20.25.51-11532-14	neutral	Earlier, Israel had launched fierce assaults on Palestinian targets in the Gaza Strip and West Bank areas.
20020118_21.16.16-1134-5	neutral	London insists it supports US reassurances that the men are being treated humanely, although there has also been criticism here over why it was taking diplomats so long to see the men.
20020415_21.33.22-7140-40	neutral	Dervis came together with Greek Development Minister Akis Tsokhatzopoulos following the opening of the ceremony.
20020507_22.11.06-28210-28	neutral	"The international community can support us so far, but it can never remove the shackles of repression," he said.
20011007_03.17.23-6711-34	neutral	The Japanese aerospace industry has an ambitious plan to explore the planets.
non_fbis_08.09.29-13319-25	neutral	The text of the  speech said the resignation was to "assure the peace."
20020204_20.38.59-25700-20	neutral	Dick Gephardt, the Democratic leader in the House of Representatives, and Tom Daschle, the Democratic leader in the Senate, have attempted the impossible feat of "setting partisan attitudes aside and supporting our President 100 percent in the war on terrorism," while at the same time trying to criticize economic and social policy.
20020301_20.57.02-23111-10	negative	The United States is indeed the ring leader and empire of evil, which perpetrates spiteful conduct of all kinds worldwide.
20011208_20.31.54-28680-6	negative	Despite the opposition, Bush went it alone.
20020316_20.37.48-18053-2	neutral	Khumalo said Nigerian President Olusegun Obasanjo would also attend the talks, which would culminate on Tuesday when the two met Australian Prime Minister John Howard in London.
20020320_12.04.49-21742-29	positive	A Namibian woman member of the Commonwealth observer mission, who is the well-respected, Deputy Speaker of the National Council in her country, held different views to those stated in the interim Commonwealth report that was released only after the election results were known.
20020413_21.18.25-12166-9	neutral	Iran's anti-drug campaign costs the country 800 million dollars per year, according to officials.
temp_fbis_21.24.00-10191-15	negative	This would soon erode both what is left of the army's reputation and its military cutting edge.
non_fbis_16.23.04-4326-13	negative	Under a driving rain, more than 10,000 Argentines  banged pots and pans in the Plaza de Mayo to protest the banking  freeze, shouting insults at the country's political leaders, the  Supreme Court, and banks - all of whom the Argentines blame for  plunging the country into its worst economic crisis in decades.
20020419_21.47.55-9546-16	neutral	Why didn't the United States inform Venezuela's constitutional government of the coup attempt by Rincon and the others?
20011024_18.09.35-13708-21	neutral	We have, for instance, sold arms to many French-speaking countries.
temp_fbis_21.28.50-13504-29	negative	As for the rest, they are raising the objection of reason of State, and an emergency which is definitely not over: Since September 11, 1,500 suspected terrorists have been captured in 50 countries, but the intelligence services claim that at least 10,000 affiliates of al-Qa'ida are still scattered across the world, "their network all around us."
20011208_20.31.54-28680-29	neutral	Bush stressed that the war is not only the "US war" but also a "world war."
20020121_21.25.31-10464-17	neutral	Guaranteeing justice in the way we perceive it, even for the possible promoters of terrorism, is a question of principles that impedes, among other things, comparisons with the regime on the other side of the fence to the US base.
20020122_20.32.22-8496-28	neutral	Otherwise it must be a matter between the United States and the countries which have citizens who are directly affected," Peter Skaarup said, alluding to the United Kingdom and Sweden.
non_fbis_09.53.15-23595-14	negative	Film footage also caught armed supporters of Mr Chavez firing  indiscriminately at the marchers.
20020315_20.22.38-4806-30	neutral	Every effort is called for to prevent the US action that could cause great misfortune to the whole mankind.
non_fbis_08.15.19-23507-15	neutral	In Mugabe's view, the March election is a new chapter in his  long struggle against colonial rule, which he led from the early  1960s until the country's independence.
20020403_21.25.24-12160-8	neutral	Of this, Russia's Zarubezhneft foreign trade organization secured 45 contracts valued at about $140 million.
20020424_21.45.56-26903-5	neutral	Other industrial sectors posted output increases of 0-7% in annual terms.
20011220_21.22.09-18839-88	neutral	In September real wages decreased 1.2% as against August of the current year.
non_fbis_11.09.24-151-38	neutral	The court decided  Friday night to defer a decision until after the election.
20020127_20.20.54-21851-2	neutral	"...To seek vengeance, the United States has ignored principles of justice, human rights principles and all international principles which it had accepted," he told reporters after opening a seminar for PAS elected representatives from throughout the peninsula here.
20011014_22.00.23-1236-4	positive	Ecolo and Agalev [ecologist parties] are asking for the ending of the bombing of Afghanistan.
20010630_00.48.42-17806-22	negative	"But the costs of failing to support Yugoslavia as it struggles to break with the past would surely be higher still.
20010916_21.24.32-9824-19	neutral	In September 1999, the Sri Lankan navy fought Tiger rebel boats off the island's northeastern coast to prevent the guerrillas from seizing a Chinese merchant vessel.
temp_fbis_21.10.31-12974-24	positive	In addition to the suggestion from the sixth continent, it is a good idea to recall the Great Flood, which has been depicted, apart from the Bible, in many of the world's mythologies: "What was it?
non_fbis_15.16.19-1897-6	neutral	According to the Russian Mission Control, the space walk may  last from 3 to 6 hours because of the mission's difficulty.
20020122_20.31.55-8089-7	neutral	With its behavior, therefore, the United States is not only compromising the image of the war against terrorism as an expression of a higher form of justice, but also of itself as an unshakeable defender of this same justice.
20020204_20.41.31-29293-13	neutral	However, this paper was told Sunday by the Foreign Affairs Ministry in Brussels that the diplomat sent to Guantanamo, who is supposed to stay at camp X-ray until Tuesday, also has the task of learning about the detention conditions of the "Belgian Taliban" or both.
temp_fbis_20.46.47-22286-1	negative	A former director-general of the Pakistani Inter-Services Intelligence (ISI), Hameed Gul told IRNA in an interview here that each country which resisted American hegemony was deemed a violator of human rights.
non_fbis_09.53.15-23595-30	positive	"I think people are happy because Chavez has fallen.
20020115_21.04.01-4695-0	neutral	ANKARA, Jan 15 (A.A) - Uzbek general Rashid Dostum will pay a visit to Turkey.
20020318_20.48.00-11907-30	neutral	Also, the opposition's 57 members of parliament stayed away.
20020129_20.27.21-24397-8	negative	From election to election and plebiscite to plebiscite, Venezuela is moving rapidly toward a "legal coup" that may be the logical consequence of the clashes inside Miraflores Palace.
20011217_20.37.28-19761-27	negative	Israel is adamantly against the creation of a completely independent Palestinian state.
non_fbis_09.11.12-16761-17	neutral	Bush stands firm
20020118_21.15.18-84-14	neutral	The United States has not given the captives the status of prisoners of war, which would grant them certain rights under the 1949 Geneva Convention.
20020304_20.42.01-25605-0	negative	["Opinion": "Independence of UNCHR impugned by biased reports"]
20020207_20.23.04-14788-17	negative	The FN-30 rifle given to Castro, besides constituting a military crime, was seen as an act of submission.
non_fbis_07.52.36-18982-13	negative	They say they will be holding the detainees in cells,  but really they are cages...
20020208_20.29.29-13302-2	neutral	"We are here at the president's house, where a man sleeps every day, and we are waiting for him to tell us when he's going to resign, when he's going to call elections," Soto told reporters, adding that protesters would stay put until Chavez arrived.
non_fbis_08.27.54-12647-8	negative	The Bush administration laid the blame for Mr. Chavez's  overthrow firmly with the ousted leader.
20020318_20.48.00-11907-7	positive	In his inauguration speech shortly after he was sworn in as president, Mugabe vowed to continue with his government's controversial land reform program.
20011007_03.17.23-6711-29	neutral	It proposes to construct a gigantic solar power plant in space.
20020315_20.21.54-4382-25	negative	It can be derived from this that the US attack on Afghanistan without any logic, was not an impulsive action but the psychology of maintaining US supremacy was fully involved in it.
20020124_20.45.56-235-9	negative	What is clear - if this was not so obvious all along to some of these organisations - is that nothing whatsoever will deter Mugabe from doing anything and everything to claim victory in the ballot, however fraudulent.
20020505_21.59.17-14271-2	positive	"It was a tough but gratifying experience.
non_fbis_12.09.12-23643-0	negative	Aussies see US double standard
20020314_20.23.54-19638-52	positive	As seen in the above, the world's public sentiment stands on the side of justice.
20011017_22.36.22-2937-4	neutral	Capital was invested in renewing the main facilities, increasing volumes of drilling and wells and upgrading them.
20020124_20.45.56-235-3	positive	So have been attempts by Zimbabwe's civic bodies such as the Crisis Group, the National Constitutional Assembly, well-meaning churches such as the Roman Catholics and even the so-called National Economic Consultative Forum.
temp_fbis_22.34.58-23977-9	neutral	China has considered Taiwan a renegade province since 1949 and has threatened to bring it back by force if it continues to indefinitely refuse proposals for "peaceful reunification."
20020507_17.55.10-20068-21	negative	"In the meantime, we will monitor the commissioners in the discharge of their statutory duties in respect of the pending complaints and inquires," he said.
20020315_20.42.17-18974-8	negative	"This explains why the two groups were critical of the election.
temp_fbis_21.29.08-21533-3	negative	Answer: The Venezuelan experience during the past few days showed that regimes that are based on the votes and support of the masses and adopt relatively independent policies toward the big powers and especially America are not favored by the American leadership.
20020210_20.31.39-22620-21	negative	EU commissioner Chris Patten, also speaking in a newspaper interview, accused Bush's administration of a dangerously "absolutist and simplistic" stance.
20020320_20.36.59-7133-10	negative	Even more worrying is the possibility that a space station could be transformed into a military base and pose a threat to Indonesia's national sovereignty.
20020129_20.27.21-24397-0	negative	The dismissal in Venezuela of Minister of Interior and Justice Luis Miquilena, who up to that point had been the central figure in the process that put Hugo Chavez in power, again triggers the red light in those countries which, like Argentina and Colombia, border on Brazil.
20020115_21.11.08-11611-31	neutral	But President George W. Bush determined otherwise.
non_fbis_11.21.37-22256-10	neutral	The attempt failed, and about 100  of the invaders were killed and 1,000 captured.
20020315_20.42.26-19148-15	neutral	The government had also noted the SA Observer Mission (SAOM) report which had found that although the election was not adequately free and fair, it should be considered legitimate, the statement said.
20011024_18.09.35-13708-3	negative	The arms embargo was imposed on Harare last year by Europe and the United States on President Robert Mugabe's government because of its appalling human rights record.
20011210_20.21.48-16389-3	positive	From this group, 49 percent believe that a hypothetical replacement of the chief of state should take place through the institutional channels, whereas 5 percent agree with using forceful means.
20020220_20.52.31-12963-6	neutral	we want a warm peace, not a cold peace, between our nations."
20020106_20.37.28-1540-0	neutral	OVER 2,374 Bayelsa State people have received free medical services for various ailments, courtesy of the Niger Delta Development Commission (NDDC).
temp_fbis_20.41.29-25820-68	neutral	This little cell will house two or more prisoners with the arrival of more captives in the future.
non_fbis_07.52.36-18982-40	neutral	The most important is former Justice Minister Mullah Nuruddin  Turabi - known to be close to Taleban leader Mullah Omar -  former Defence Minister Mullah Ubaidullah and former Industry  Minister Mullah Saadudin.
non_fbis_10.12.58-29108-17	negative	And this month, a task  force on the project's budget concluded that NASA's cost  estimate for finishing the "core" station between 2002 and 2008  "is not credible."
temp_fbis_20.42.47-22260-2	neutral	at Tameike-Sanno Station, close to the embassy in Tokyo's Minato Ward.
20020120_21.15.19-21938-13	neutral	Straw pointed out the United States had accepted visits to Guantanamo Bay by a team from the International Committee of the Red Cross and by British officials.
20020320_12.03.37-20669-12	negative	"To some extent we have the sense that this is a halfway house," he said.
non_fbis_08.46.28-13637-2	neutral	GUANTANAMO BAY, CUBA -- It's 5 A.M. at the Roosevelt Roads Naval  station in Puerto Rico, and 20 journalists straggle to the gate  in sleep-deprived silence to catch a plane to Guantanamo Bay.
20011107_16.03.28-26714-3	neutral	Autonomous tests of a booster are under way at an assembly and testing hangar at Baykonur, and the spacecraft is simultaneously being loaded with fuel components, the press service of the Russian Space Forces reported.
20020218_21.01.07-18921-11	neutral	In his view, Chien went on, the main purpose of Bush's current Asia visit is to promote world peace and security.
20011130_12.36.18-4189-7	negative	If emission of greenhouse gases is not rigorously limited and is allowed to continue to climb, then the average global temperature may surge by 1.5 to 5.8 C. The sea level will rise by nine to 88 millimeters.
non_fbis_08.09.29-13319-33	neutral	The losers would be bank lenders because the loans would not be  fully repaid.
20020322_21.05.41-14545-24	negative	Secondly, the designation of polling stations, as is now well known, was specifically done in a way that favoured ZANU PF by granting ridiculously few polling stations in urban areas.
20010906_12.55.04-23296-45	neutral	"Certain excesses at EU meetings and, above all, at 'summits,' the so-called 'high masses,' sometimes call for a reaction.
non_fbis_12.19.24-26050-30	neutral	JTF-2 members have not yet taken any prisoners in Afghanistan  but they have been on missions in which prisoners were taken,  Mr. Eggleton said.
20020326_21.07.32-24343-3	neutral	It is learned that the manned spaceship will have a liftoff weight of about eight tonnes, and is less than 10 meters long and 3.5 meters in diameter.
non_fbis_09.53.15-23595-23	neutral	As tanks surrounded Miraflores, Mr Chavez was holed up with  senior military officers in a bid to save his presidency.
20020331_21.09.25-22686-23	neutral	As a first step Israeli forces were sent into the main Palestinian town, Ramallah, where Arafat has his headquarters and from where the autonomous Palestinian areas are administered.
20020314_20.23.54-19638-29	negative	In the past, it was their attitude trying to read Washington's mind and doing nothing that would incur its displeasure.
20020320_12.04.40-21590-18	neutral	At another station we were ordered to stay at least 100 metres away.
20020212_20.42.04-19290-61	neutral	In the view of Leopoldo Oilvari Sivori of Bacque Sociedad de Bolsa, "the behavior of the stock market is linked to the exchange rate.
