100015994440925185	neutral	@olejp3 http://t.co/ldMxHLq Im sure it will replay on NFL network tomorrow too.
259610599309312000	negative	@queensarmsbar not a very attractive line up. Have you got Mackems v. Mags tomorrow?
262921864836440064	negative	@McMwiti Really? really? Terry's guilt was well proven, TV footage was available. Suarez was punished of the strength of Evra's word. C'mon!
264239027232854016	negative	Oh no she didn't! BGV RT"@merfreistroffer: I can't wait to make @C_Lassyy listen to two hours of taylor swift during our drive tomorrow."
264259168419065856	positive	@LaurenDrain I admire you with all my heart, Lauren. May the God, that watches over the rest of the world, bless you and keep you x
257782133656023040	neutral	@SimonBorchardt Exactly. Back to Super Rugby ending at the end of May again - when the new deal is signed for 2016 onwards...
250913728441249792	neutral	Our founder (@CharlieHilton) will be speaking at Social Media Week (#SMWLDN) on Friday. Read about it: http://t.co/kSmthXV8 #SMWfrienefits
240513665525248001	positive	Mushu at The Hurricane wearing Tressa's rockstar bday foam guitar after our show last Saturday. We killed it http://t.co/hS178hfp
263734506308108288	neutral	New Glory Gang music Janet at the Superbowl http://t.co/uvKpMUkX on #SoundCloud
100305279236845568	positive	It's that time of year again!! The Plains and the smell of Saturday morning tailgates..it's Auburn football season!! #wareagle
248088921488117760	positive	Dancing On Ice tour highlights on sun going to be good :)
262462681649393664	negative	it's a sunday, i think in the spirit of douglas adams and feeling like shit i will have a second bath
156452586218717184	negative	Although there was that one time he finished 3rd and Cannavaro finished 1st. Yes, Fabio Cannavaro. Bullshit.
261821456269324288	neutral	#Forbes CUPERTINO, CA - OCTOBER 04: Apple CEO Tim Cook speaks at the event introducing the new iPhone 4s at the ... http://t.co/zKoYHwsJ
102976668825698305	positive	@hughhefner Make sure you & the girls watch seasons 1-5 of #Dexter, before season 6 premieres Oct 2.  Seasons 1 & 4 are the best!
100049306941276161	negative	Pretty upset I'm not goin to see the jets practice tomorrow /:
262462510232371200	neutral	November 11 you'll probably see me at the House Of Blues. #MP #TheMaine
118167201797775360	positive	RT @PeterBurnsRadio: Curtis Painter is totally going to get lucky tonight, probably with another girl that looks just like him
100729533342285824	positive	Please believe on Sept 9th I will be in the theater watching Kevin Hart's new movie...
263772250250039296	neutral	@teensara Hahaha Did you see how upset AJ was during the Susan G Coleman segment on Monday :/
100802691848089601	negative	Sad I didn't see @Greg_Sherwood today. Do work in Nebraska man I'll see you when you get back!
111718863531548672	neutral	RT @pinkysibbs: RT @pinkysibbs: I've got one ticket to the Michael Jackson tribute gig for sale on Oct 8th dm me for details,please RT!
262159851751370752	negative	Toni Gonzaga will be in Legazpi on October 30. Huhuhuhu. I wanna cry i want to come but how? I dont have money. Waaaah @ToniGfanpage
251750524779651072	positive	2 Plains Rd- Lots of space in this 4 bed, 4 bath home in East York! Come to the open house this Sun 2-4 pm! Big space, reno'd bathrms+ more!
212242319095767040	positive	@OurLadyPeace Will be at Irving Plaza NYC, no doubt! will be the 4th show ive seen so far. the band that saved, inspired and showed me life.
101843919100313600	neutral	http://t.co/EX9q5wX - #ElastixWorld first Sponsors - Mexico City  November 3rd and 4th, see you all there #fb
264176468131713024	positive	I still have a lot of candy left anyone want tomorrow :')
262664798473445377	positive	With the election right around the corner, RRFP is pleased to announce Super Tuesday!  Get an additional 5%... http://t.co/aKR98s83
241382989374820352	neutral	So theres a Jordan's release tomorrow at Florida Mall, am I going to be a sneaker head and go get them ??
257737069776998400	neutral	Australia Test and ODI captain Michael Clarke at the launch of the international season in Sydney on Monday  http://t.co/g9gbgOhi
90854967476363265	neutral	Microsoft issues critical patch for Windows 7, Vista users: Microsoft issues light Patch Tuesday, with just one... http://cnet.co/qLgoLP
264155231804346368	neutral	@_Sherwood12 he's on the plane to Amsterdam now, bet he's not in class tomorrow
112700633777315840	positive	RT @GimmieDatBoom: Steelers gonna beat the Ravens tomorrow lol
248387681699102721	positive	@HoesHateVeziaa_: Im sooo glad we dont have school monday , Imaaa sleep all day man .we don't!!?????
259429866456371201	neutral	Spending Friday night with my main man Charles Dickens.
256930249579843584	negative	The ending to The Grey may be one of the most bad ass endings to a movie I've ever seen
263701469289644032	neutral	Eli Manning hopes the Giants can uplift the spirits of the millions affected by Sandy in NY with their game against the Steelers on Sunday
263792197999136768	positive	Scott & Evelyn Swanson, both work for FEMA.  Happy to host trick-treaters tonight, Evelyn heads out tomorrow http://t.co/cgzl3hcR
264145749829369858	negative	This Thursday Night Football game sucks. But Go Chiefs! I just want to see hot head Rivers explode on the sideline tonight.
264232344746086400	neutral	@aaronlinzy Hello Aaron, will you be with Israel tomorrow night?
264214577443655681	positive	Just walking to the victor! Happy 21st birthday Lauren! http://t.co/Pewv6lwl
263823227686625280	neutral	Austin Rivers strugglin he like 1 for 10 just got his first bucket mid way threw da 4th
255649019634794497	neutral	It's this Thursday night!  B95's 11th annual Hold 'em For Hope Texas Hold 'em Poker tourney at the Eagles Club in... http://t.co/AqoeaKt7
263422793998299137	neutral	Ghost of Mississippi The story of the ghost that tripped Eli Manning on 4th down that fateful autumn night in Oxford. #30for30
103052887596343297	positive	Tomorrow's the day 2 Fleebaggers get sent packing for good! On Wisconsin! #tcot #teaparty #wiunion #wirecall #gop #tpx
262082580361379840	positive	Yeah I'm pretty sure I'm going to Selma tomorrow.
261806482436288512	neutral	supposedly the Black Forest is getting some snow this weekend! Did we only imagine the 27 Celsius last Sunday?... http://t.co/CqgAr7lA
263169865295216642	neutral	It has been at least three months since I've heard an LMFAO song.  Give it another month or two and I may once again venture outside.
258524380907335680	positive	Happy Wednesday!!Glad to see IEBC blow the first whistle with voting zone list !MPs protest!
258871402348834816	neutral	Nas takes over the London O2 Arena on 19/03/2013! Pre-sale tickets available here - http://t.co/DMNnwiTW Pre-Sale ends tomorrow!
259521317039116288	neutral	October 19, 2012 book news: 20,000 Turn Out for the Southern Festival of Books What do Keith Richards and Margar... http://t.co/v5Coq2Vt
263668416173469697	neutral	@HeffronLove it does! And Big Time Rush on Saturday counts for a musical, right? Haha
262578266794250242	positive	You may think you've tried them all but I'll bet you haven't tried taking on The Challenge...   Stop wasting time... http://t.co/wZNp9F99
263897921152499712	neutral	Y'all be sure to download that YeHive app on Friday too. We're trying to put MSU and Starkville on the map.
264145476524322818	neutral	Tennessee game Saturday with @King_Gunter :)
216948978137305088	positive	Dr. Mohamed Morsi announced as Egypt's 1st elected President after the glorious 25th of Jan Revolution. Congratulations to #Egypt!
101315206885552129	neutral	Come celebrate India's Independence Day at New Jersey's Official  India Day Parade on August 14th 2pm Oak Tree Road in the Iselin sectio ...
264194494793129984	positive	Janowicz was #221 in January and the win over Murray today takes him to #46 - Good year! Mega potential! #36 if he beats Tipsarevic.
100380000469004288	positive	Sunday Night Concert in the Park! Eagles cover band, pretty good! http://t.co/2pAb8wI
100788103031164928	negative	crap i meant to let #oomf use my microsoft office thing for their computer today...well he'll get it one weekend when we both in town!
263051101098635264	neutral	Madonna may have helped paved the road for singers like Rihanna, Katy Perry , Gaga etc.. but Rih owns that road now.
261489844222578688	neutral	@GeorgeMonbiot on how fungal spores are dispersed - Tories bring 'em back from lederhosen rallies in the Black Forest:  http://t.co/NWYpfAcd
262231318010662913	neutral	Coming to DC: Open Acting Workshop with Tom Todoroff on Nov 14th #constantcontact http://t.co/ZeKC38jm
255848522581164033	neutral	Negros and nigglettes, all who would like to attend the a$ap rocky concert on  November 17th at starland lemme know tickets are only 25
256145127381291008	positive	Congrats @JimmyDykesLive on your new contract. Can believe this is you 18th season at ESPN. Time flies. Always delighted to see you at Rupp.
259286418612948992	positive	On this Friday morning, as I await news of my fate, I want you all to know that Turbo Lover is my favourite Judas Priest song.
263506758625005568	positive	@JacqDowling @CougFanTMB I finished 1st in a Bowling 101 class of 50 that included members of the Bowling team... You're totally effed.. :D
226978597687132160	neutral	scrap my last tweet! At 5:22 on the 24th for Australian Directioners it will be two years for the boys
100681801948860416	positive	I'm excited to see the lions tomorrow :3
262487322715627520	neutral	Nick Watney hit a course-record 61 on Sunday to take the CIMB Classic title: http://t.co/bx4xSxQC
216098777235329024	positive	Dear Christina Grimmie, you may not know it but sometimes your songs are all I need when I'm feeling down.
263087341399326722	negative	@dorcov YUP. And did you watch Degrassi from friday yet? looool awkward campbell
264175058812018688	positive	Mee& my grandpa are going to the rita game tomorrow #CutiePies
261884545568227329	positive	The #LAKings hve been so good on #NHL13 that the real team might disappoint me. Jeff carter has 43 goals thru January. #IsThatPossible
100017848314900480	positive	Excited to go see Rise of the Planet of the Apes tonight
263875540660928512	neutral	Who's going to walgreens tomorrow for the 75% off all of the halloween candy? I AM!
264217261278130176	neutral	I just did a shit load of typing. My group better call me Queen tomorrow.
263278003017113600	neutral	@JoshCribbs16 you too. we need you on sunday to knock the purple out of the Ravens.
264220957219102720	positive	HAPPY BIRTHDAY to my ACE, BESTFRIEND & lowkey SISTER @_NorthpoleCOLD ..!! Hope you have fun, see you Sunday so we can TURN UP!! #Ayyyeee
100487712041209856	neutral	@elelibs there's a shop in Auburn called 'Morning Glory' as well. Don't know if it's a toy shop!!! #unbelievable
263946400071561216	neutral	DSTV dumps VH1 from 13 November and replaces it with the VH1 classic channel. Something tells me (cont) http://t.co/i6CapNk1
262844713323859968	negative	I haven't bought my kit and NCS is tomorrow. My frame of mind right now is just #leaveityeah
263504269783736320	negative	@Dopee_Dayy i went trick or treating every year of high school except senior year only cuz negros was faking. im going tomorrow too.
263153990114635777	neutral	listening to POETIC JUSTICE for the 1st time #DontJudgeMe
262193907973124096	negative	@Peter_Owen1: Bulls season tips off Wednesday night vs Sacramento Kings. Excited is not the word. Frustrated is the right one...
100484397739933696	neutral	I just found that Barcelona and Real Madrid are playing on Sunday... I need sleeping pills...
263991462847447040	neutral	Aaron Brooks and Marcus Thornton combine to go 8-25 and we lose to the Bulls by 6. Everybody have a good Thursday.
264176866435399680	positive	skipping school tomorrow and going to Tennessee instead. #soundsgoodtome
264207628392075265	negative	Olive Garden's Dinner Today & Dinner Tomorrow special, for the person who thinks "Hey, that was terrible! Wonder what it's like microwaved?"
264189218878783488	positive	Start your weekend off right at EAST tonight with PURE FRIDAY.   Enjoy delicious Graze dining from 6pm and... http://t.co/la5xGQun
261550720992567296	neutral	I might go to Pierce the Veil at Northern Lights (SOLD OUT) in Albany, NY - Oct 31 http://t.co/HNEWJYgi
226730837616492544	positive	A new favorite: Jason Vernau Live @ SurfComber March 16 th 2012 Miami WMC Pool Party with Robbie Rivera & Friends http://t.co/ruEaugHY
261970604738109440	positive	I have the same birthday as both Anderson Cooper and Nadal. June 3rd is an awesome day I guess!
259048276672782336	positive	#tbt a year ago tomorrow i would have met the amazing Christina Grimmie :) #takemeback http://t.co/leQjLVx1
262047382651420672	neutral	Early Voting is open check out the Mommy Forum for a list of locations to get your votes in before Super Tuesday!... http://t.co/KNVTNu5q
262382031613329408	negative	I realize Bellamy is a freshman QB but the play selection leaves a lot to be desired, option toss on 3rd and 7 #CmonMan
241603562633838593	neutral	Nasheed, you have endorsed CoNi report today. Please don't change your mind tomorrow
263113337037025280	neutral	Hey #RedArmy, vote for your @PerthWildcats to be part of the All-Star game on December 22! Go the South! http://t.co/MkZtKTHx
247667123596451840	neutral	Elon University's colors are maroon and gold. We want to see some green, white and orange tomorrow at 7:30. http://t.co/7CsCsKwW
264254298983108609	neutral	Bird on the Wire is one of the 1st songs I learned as a child. And now daddy and I go see Leonard Cohen! http://t.co/pvANSpi6
262666845574807554	neutral	@BadmanTips commentator says Porto dominated 1st half & looks that way again in the 2nd
264071379333287936	neutral	Anonymous asked: Just realized while watchin fri-end that the youtube account that uploaded the video is... http://t.co/ljUqkCaG
264162727788953600	neutral	[INFO] TaeTiSeo will perform on "Love In Asia" tomorrow (11/02) at 02:30PM (KST), KBS will broadcast the concert on 13 November at 07:30PM
118800010371530753	neutral	RT @AP: CBS says commentator Andy Rooney will make his final weekly "60 Minutes" appearance on this Sunday's edition: http://t.co/4qFD65 ...
263727438377398273	neutral	Gonna be on the news tomorrow. I'm going to be the girl wearing the Big Time Rush shirt. :D
263843999146733568	neutral	The season opener for the New York Knicks is now Miami @ New York On Friday. That's how it should be.
100168940155699200	positive	Morning all! me he despertado he peusto la MTV y estaban hablando de Green Day! que bonito despertar!
262650827418783744	neutral	Who starts at QB on Friday? I'd play Nichols. Have said that all year. He had a big Q4 with key targets and has already played Calgary.
264140098680008704	positive	I just hope Danica meets Justin tomorrow. And Danielle. They both deserve it. They support Justin with everything they have. #jbmeetdanica
264015624324411392	negative	@yosp why doesnt Sony promote 1st party games? AC3 commercials are on tv all the time. And no one (cont) http://t.co/6uXrjMvC
263309346706956288	neutral	@iiAMAdam every Saturday night at the Roxy... lol
228771763880869888	neutral	Tmr is Saturday . Tmr is Duels Official Bars and Bloodshed Rap Battle ! To whoevers down , i shall see you there . http://t.co/BSpejC6l
105693349322829824	positive	watched all of @Mr_Grimshaw X Factor video's last night. he needs to start making music, wicked voice!
217966300725657601	positive	Hopefully doing a meet and greet Friday Night With Stan Walker and Elen Levon :D  Bring on the celeb life!!
259079924441284608	positive	Hopefully watching the Lorax will get my mind off tomorrow
264084352340742145	positive	PUMPED to open the season tomorrow night against Georgetown!  Women's Preview: http://t.co/1k3PAK3C | Men's Preview: http://t.co/n5oFat9V
111583736323260416	positive	RT @marcohanna: @afairclub sold out tonight!! Charlie Sheen's Cake Party!! Marco Hanna Live with Dudu Sax !!!
261497696496533505	neutral	Zulu is the 26th largest mother tongue of Christians (10.4 million), representing 0.5% of all Christians.
233676683947941889	neutral	@like_the_song I first heard them when "Farewell to the Fairground" was their single, whenever that was. I think they have a 2nd album now
264230079494770688	negative	Parker, Leonard steal OKC's thunder: Ninety minutes before tipoff Thursday night at the AT&T Center, Oklahoma Ci... http://t.co/NNjbPSWk
240541125209890816	neutral	Endymion is responsible for the 6th Q-BASE update. Here's the preview of their Thunderdome anthem. Watch, listen... http://t.co/zAc61Qop
264140401567477760	negative	The new Bruno Mars song is wicked. It sounds like a cross between the Police and Michael Jackson. I may or may not play it 14 times/day..!
259293630706110464	neutral	Headlines: Nadal confirms for Mexican Open in February: Rafael Nadal plans to play at the Mexican Open in Februa... http://t.co/a5UTIdcE
240628203134271488	positive	@bobmcbobbob1 Optimism: Pancake day on Sunday.
264106460785557504	neutral	Yardbarker: Announcing the November 17 Smashville Express to Knoxville http://t.co/4qQsMtBR
263741813402259457	neutral	OpenStack is powering production clouds. In this General Session at the 11th International Cloud Expo, Nebula CE... http://t.co/go7yARJu
262384414623936512	neutral	C'mon Avila! You just got tagged out by a guy who looks like the kid Bill Murray was researching in The Royal Tenenbaums! #Tigers
100197935970652160	neutral	If your still running Windows XP, then it may be time to upgrade to Windows 7 to ensure you receive latest upgrades and support in future
261613299282624512	neutral	C'mon @chucktodd, you KNOW the BCA IS a budget, and STRONGER than a resolution. It's a LAW. #OHSEN
261626632647872513	neutral	Video Game Trailers - Launch Trailer: Check out the launch trailer for Mass Effect 3. Added: Fri Oct 26 00:11:11... http://t.co/8BHGTbtJ
233293514346229760	neutral	Updated #PackinSpain blog with some stat totals, like Lorenzo Brown and C.J. Leslie with double-doubles: http://t.co/YkzyDc8z
260541067286417409	neutral	@erin_hanson if it makes you feel any better CBC national is doing a feature on the Kinder Morgan pipeline Wednesday night. #defendourcoast
262325698750992385	neutral	@spenceh95 Phew, I'm still on edge after the Wenger out stuff! You going to SJP tomorrow?
263986227856936960	positive	Happy November 1st SWEET friends!!! SWEET Thursday NOD's (names of the day) are.....Charrish, Selma, and Aiden.... http://t.co/xzJgrSfd
257301261962055681	neutral	Finished season 3 of the league and am now finally watching Act Of Valor. Operation lazy Saturday night nearing completion.
263897304828874753	neutral	Jennifer Aniston, Justin Theroux high end shopping; time to decorate the crib: Tuesday, E! Online shared the vid... http://t.co/8Q6Plbfm
235765330746695681	neutral	Kinder Morgan Foundation grants of $1000-$5000 for education are due the 10th of each month. http://t.co/bk43mKQz
264246162444402688	positive	@HeffronDrive Congratulations Kendall in Germany it is 7 clock Friday November 2, so Happy B-day
263006954446790656	neutral	#3DT begins THiS Thursday at the "S.E.C" #SignatureEventCenter 2001 South Lumpkin RD $3 w/ College ID $5 w/ regular ID til 11pm!!! #iParty
263686137435009025	neutral	Review : black friday 2012 Gerber 31-000758 Gator Machete with Sheath:  Find, shop, See Reviews , buy black frid... http://t.co/OJJ4pF10
255650445559734273	neutral	@bigshaoon also I wasn't aware that the buffalo had escaped from its paddock and made its way to Tayside. I'll try to round it up on Sunday.
101738132487151616	neutral	RT @htgth: There is also a second Mexico City, Mexico show on October 19th. Same venue as the show on the 18th, Palacio de los Deportes.
104245846148792321	positive	@38special_  Good luck agaist Tampa Bay tonight.
264251377138679808	neutral	Should i have an engagement party?  Any who.. SAN FRANCISCO this weekend then... I officially move to Colorado on the 13th.
261468072114798593	neutral	http://t.co/77CAjSFD Today's Al-ien #Nascar Person of the Day is Friday Hassler- died in a crash  1st Daytona 500 qualifying race in 72
100696473406144512	neutral	Pre-practice odds and ends: The Raiders return to practice today after an off day Sunday. The provisions set for... http://bit.ly/qdWJdZ
264100832864247808	neutral	2 days till Jack White at Alley Pally then I find out the Ruskies need me to work on Saturday. What's is it like to have a personal life?
262770806331953152	positive	moving to covina in december things are looking up rite about now!:)
261602737693814785	neutral	I recorded The Wanted on Celebrity Juice so if anyone missed it, I'll stream it again on Saturday if anyone wants to see it?
263777521710006272	positive	@ChemicalJericho @xCescaCenax @Vasso_Cenation @HeadshotZombie Happy Halloween spend it with Bruno Mars and shenanigans http://t.co/KTV8sfFl
261330977408831489	neutral	I want to watch The Vow, so guess whose gonna watch that tomorrow night,.with tissues?! ---->>> Thiss girl :))
262254456400392192	neutral	@BethFishReads Do you have chocolate? Sunday is National Chocolate Day.
235740770513072128	positive	OMG! Look like it's gonna be very hot in Gampel on Sunday... xD
259698100321546241	positive	Guess which star is the 5th most greatest women in the world and won many Grammy awards and is a singer?
261999318007963648	neutral	SIU up 2 sets to 0 at Drake (25-16, 27-25), looking to keep sole possession of 4th place in MVC. just underway in the 3rd set
264235523349045249	negative	ART @CarolineManzo: Do you think NYC should host the Marathon Sunday?..why would they when soooo many desperately need help,where is Respect
111326159253413888	neutral	Today's Google Offer in Seattle - Up to 50% off at the Seattle Aquarium http://t.co/VLK6nnC
263326970182512640	negative	ECHO: Sex offender is warned he may face jail over offences http://t.co/VetvYrYh #Dorset
104154416113913856	negative	RT @MsHighbury: @SheKicksdotnet I'm going to the Arsenal ladies v Everton tonight, I'm nervous already. #FAWSL
103081382959513601	neutral	The FA will be bringing a new interactive Road Show to Arsenal Ladies ahead of the game against Everton on Thursday
234012786802454528	positive	@DutchJools I have a date with Christian Kane and the Leverage team that I recorded tues, then The Finder, sexy!, have fun, night night xx
261894079342841856	positive	So excited for these upcoming shows! Its time to get HALLOWEIRD!   10/27(TOMORROW NIGHT) @ the Fox Theatre w/... http://t.co/idWbDyLf
100257595364868096	negative	@PGATOUR Tiger Woods is awful. Luckily for him his terrible golf is only going to be seen on TGC today and not CBS - where everyone can see.
262552841409949699	neutral	C'mon Cam and the Panthers! U r the missing link in my quinfecta weekend.  Hard to do...App win, UNC win, State loss, Dook loss, Panther win
262786850777866240	negative	I think I may have spent too much on Carmelo Anthony. I only hope that his thick-framed black glasses will console me in the post-season.
263962593155219456	positive	National Council on Patient Information & Education celebrates its 30th anniversary! Thanks 4 helping many learn about patient & med safety
262072861982859264	neutral	Someone should come with me November 9th to see Romeo Santos meet&greet at Fye at 6 pm at downtown (:
244951104507486209	neutral	This Thursday, DESTRUCTO, creator of HOLY SHIP, comes to Ignition at Firestone Live! Surrender your booty, it's... http://t.co/AA0xOs2R
264200833707679745	neutral	Even though I already know how it ends... Im watching the CMAs tomorrow just to see blake drunk
111419511248400384	neutral	Amanda Knox Wins Another Round in Appeal: Amanda Knox won a skirmish today in the appeal of her murder convictio... http://t.co/CZaLPtZ
264063732961923072	negative	ATTENTION DIRECTIONERS! Beliebers are posting this picture! Tomorrow we'll replay the video all day! #Jealousy! #Hate! http://t.co/89aPZ0qe
90984113938509824	negative	The wisdom of not running phony Republicans tonight is this: All six Dems are now winners. All six Repubs are losers-to-be. #WIrecall #p2
264144101941846016	positive	Rare, 300kg meteorite discovered in Poland, biggest in Eastern Europe and may provide clues about Earth's core: http://t.co/KEp3zkLZ
247741813962723328	positive	Monday already. That's OK - at Volare Restaurant Chicago we have the perfect meal waiting for you today.   We... http://t.co/fWNb7ADX
264084520108707841	negative	This time tomorrow, @Jas_Stringer and I will be well on our way to Starkville for a sick weekend...the USM game is going to be atrocious.
264186739881570306	neutral	@zurr08 will you be joking the naugles to be for dinner on Saturday night at Olive Garden for Kayla jos b-day...
260604708610248704	negative	Shit's going down this Sat. at Neighborhood Theatre #DROP!THARD
100576188094881792	neutral	RT @AdamSchefter: Awaiting update on Mikel Leshoure's injury. But so far, WR Titus Young is the only one of the Lions top three picks in ...
100063092603502592	negative	My random rant of the night:Lady Gaga being considered a fashion icon!Who in their right mind considers that fashion?She dresses in trash.
264199814126919680	negative	@kelly_carlin I just got back from Hawaii on Monday and I'm feeling sick too.
263911979188645888	negative	I have an important race tomorrow, which determines if we make CIF, and I'm sitting here eating donuts..
264239668516753409	neutral	BIG BANG CONCERT IS TOMORROW. OH MY LORD !! BOO HOO HOOOO )': *Cries all the 7 seas*
264167487912943616	positive	@ritaora Us UK bots cannot wait for your arrival tomorrow! We love you Rita! X
250339916398092288	negative	@AnnoyingAssRob Yeah, but one of them is an old lady who looks like a Jim Henson creature left out in the Sun.
225881846544740352	positive	Australian Directioners! iGo One Direction (iCarly) is premiering on Nickelodeon the 24th of July at 4:30pm. (: how exciting! x
