264034436419555328	positive	@rinithyme He'll be the Eli Manning of the NBA,they r both 2 of the best 4th quarter players in their sports #Closer #KillerInstinct #Splapa
260066583769120769	neutral	[NEWS] Stuck-Up Sunday: Shepard Fairey - Andre the Giant Uncut Sticker Sheet - @ObeyGiant @StuckUpPieceOf http://t.co/wpCHDDL4
100576230503497728	neutral	Nature's own 'Cloud' went head to head with Amazon and Microsoft on Sunday...and won.  http://bit.ly/oMba2x #cloud
263953741877764096	neutral	Snow may fall for parts of CNY the next few days. Find out where the best chances will be at 6:42 am on TV & online: http://t.co/F0Kb0gqD
114390835163971584	neutral	Also happening tonight: Nina Burleigh on the trials of Amanda Knox. At the New York City Bar Association. Details here: http://t.co/Eogh4lw8
255164012780744704	negative	Going to watch Goon for the 4th time, cry, then go to sleep. #NHLLockout
262664182414061568	negative	@NeilHarmanTimes Just noticed you using the Spanish abbreviation "NO sure", no? Think you're missing Rafa, mon brave
236144504405635074	neutral	This Saturday we're in scenic Petrolia - Come one, come all to the Mattole Valley Community Center's Mid-Summer... http://t.co/DbponJNf
261321272217182208	negative	Valor is official screwed tomorrow.. Audis and BMWs aren't good in the snow.... #ValorProblems #richkidproblems #letsgetoursecondcarsout
255463540897505281	neutral	Music of the Sun, "A Girl Like Me", "Good Girl Gone Bad", "Rated R", "Loud", "Talk That Talk". > > > > > > > >
207902904525393922	neutral	It's Presidents Day at the White House Thursday. Barack Obama hosts George W. Bush for unveiling of portrait. George H.W. Bush there too.
261579029679845377	neutral	We get to dress up in Halloween costumes on Wednesday. Sophia Grace and Rosie in the building ladies and gentleman.
247350652244721664	positive	Brandon Weeden is going to be a player someday. He's not right now - Ron Jaworski just now on Sunday NFL Countdown #countdowntokickoff
251317752512532480	neutral	[ABS-CBN News] Aquino on Enrile's memoirs: May all of us seek in this book the lessons that will allow us to advance as a people
111415835624607745	positive	Good morning! Need a Google + invite? http://t.co/XgXdIFf I have a few #plusinvites. Love to see the #gtchat folks there!
247160478038642689	negative	@DrPhil watching the Trayvon episode I recorded. The Martins are incredibly strong & I am so sorry for their loss May God bless them #rip tm
255131522426875904	neutral	Of course Pottstown has to be ass backwards & have off school on the 15th instead of tomorrow !
252072488060727296	neutral	Now: "There's only one Roger Johnson" to Winter Wonderland. But now a Wed corner...which ends with Mattock rifling high into the South Bank.
114799203749859328	positive	@myturtleneck cool! yah, lots of stuff going on that night with Nuit Blanche as well! It's going to be fun! @sbnuitblancheTO
260493298202980352	positive	Tomorrow, the Jimmy Donn "Eastbound & Down" pre-order begins. Only 100 Pre-Orders will be available. And it's a pretty sick combo pack!
111567378193711104	negative	@ChristPA Best friend just arrived in NYC from Australia. Damn it, means I can't watch the two-hour opener of Terra Nova tonight.
262669928698609664	neutral	Last Sunday night for the Haunted Castle and Black Forest is tonight! Come on out!
194550050129592321	positive	I love Texas A&M, but any team that drafts Tannehill before the 7th round has lost their minds.
118799675598979072	neutral	RT @BreakingNews: Andy Rooney, 92, will make last appearance on CBS' '60 Minutes' this Sunday - TVNewser http://t.co/qLGZsAjf
264064103805497344	positive	SNEAK PEEK: Check out the 12 Freebies you can get at CVS on Black Friday!  Link in the first comment:
263796815932051456	positive	The bulls are back! @haralabob what seed do you think the bulls can finish assuming a 75% rose comes back by March
261217201871273984	neutral	#FavouriteMovieQuotes  "After all, tomorrow is another day!" Bill Murray, Groundhog Day
262971264254242816	neutral	Coni is still looking for volunteers for the painting project that is expected to be completed on Saturday, November 10 and November 17.
261971302288601088	positive	I wish I was out MD I wanna bear on Negros shit is fun , going out Sunday to Ross snighter Sunday Finna pop off on TWL
247411290119733249	neutral	#nowplaying Jim White - Crash Into the Sun http://t.co/H8AfTJm2
264179944727396352	neutral	@fluorksa yes! >3< Tomorrow we'll see a lot of fancans about this concert <3 MBLAQ, CNBLUE, After School and others will attend this concert
239993536198631424	positive	#np BAGSAKAN by parokya ni Edgar, Gloc 9 and Francis M. <3 I may sound baduy but it's the only tagalog song nga NINDOOOOOT JOD KAAYO DMD <3
258231600008028160	neutral	World Tomorrow with Julian Assange - Wikileaks - All Episodes: All twelve episodes plus the trailer for the show... http://t.co/tmcrdGzs
251821718425985024	positive	Apple CEO apologizes for error-ridden new map app (+video): Apple CEO Tim Cook apologized Friday for the company... http://t.co/dpHhFypj
109137504225067008	neutral	@RosaAcosta Noticed that you going to be in Tampa tomorrow and wanted to see if we can do a Q&A for Metormix Tampa Bay and feature you ???
111416468951941120	positive	child like excitement building ahead of the #RWC think my 2nd team is going to be Tonga #loveabitofbiff
263985178576297984	negative	This may be a reason to swap, iOS has too many daft games.  "Android is a desolate wasteland when it comes to games." http://t.co/RjN9RrFT
111477989807628288	negative	@ItsTheSituation Watched last week's Jersey Shore last night, you put your own head into the wall? Seriously, CRAZY! atleast Ronnie didn't!
263795814470664192	positive	Aww love you Austin Rivers and happy to see you get start in 1st NBA game...but it's against my boys, LETS GO SPURS! #Spurs #NBA
102103122167607298	positive	Tuesday September 6th. The return of the best show EVER! Sons of Anarchy. Hell yeahhhh! #SOA
263834573530611712	positive	#Linsanity"@ESPNStatsInfo: Jeremy Lin was a +23 for Rockets in his debut. That's the 2nd-best plus-minus for him in any game in his career."
240808370511179776	positive	@4everAM_ber *as i sat and thought* i lied. Total Praise, Thank You, then the Winans joints
264237743578685440	positive	@JbaGs17 good looks homie, Im goin to pretty lights tomorrow night so lets burn it down ASAP after that.
264084748345962496	neutral	AT&T offers free cloud storage for iOS and Android AT&T on Thursday announced a new service it calls AT&T Locker th... http://t.co/7yoVkmMX
264173696116224000	neutral	@brianaauerbach me and Katie are busy after school we have to go to playtoes and stuff. But Saturday morning. Lets do it! Then beach
261695210260684800	positive	Iguana in the desert. No shade. The sun is high in the sky. He can handle it. Don't bet against him.
264207077793206272	neutral	@MeganBrookeAbe @jesswillis10 /: I'm going to Philadelphia Saturday morning. & I have a Volleyball game tomorrow night.
262845848713584641	neutral	Demon Gaze, a next-gen Dungeon RPG for the the PlayStation Vita [1st trailer and screens]: Kadokawa Games today ... http://t.co/BBuO2Vzt
262174264080363520	positive	Yay tomorrow I'll be going to Putrajaya for a walk. Woweee.
194523485689753600	positive	http://t.co/LU533wG7 vote for UT for college game day visiting. We are 10th and Texas A&m is #1. Get on it
248496890205851648	negative	Mncim, the rain that stopped last Saturday's game wasted our time waitse! Maybe SS4 would be playing something better tonight.
107611052459569152	positive	RT @SMR_J_Star Kevin Hart : Seriously Funny tonight at 10 on Comedy Central something to look forward too.
247063122295275520	positive	Sophia Grace and Rosie: we know one of your songs!! the sun comes down NA NA NA NA @TomTheWanted http://t.co/eyykN7iF
100484644390174720	positive	Every time I don't have anything to do, I'll watch the shows I stopped halfway. LOL And it's Teen Top's MTA today. :P
193758541868314624	neutral	Tomorrow?? Who promised you tomorrow?? Give yourself to the lord today!! The Winans.
209800499820625922	neutral	@mac_b_from_tn yeah but we have Memorial Day, 4th of July, Cinco de Mayo, Thanksgiving, Presidents Day, MLK day, and do they do Labor Day?
100079174001238016	positive	@Yuki_18_j Good morning, yuki~! Oh, i like your name too. Does It means snow? Riko isn't my real name, i've chose it because i like japan.
211688789448466433	neutral	@AlexisClark17 @TakersGirl1998 Im going to Hell in a Cell in ATL, The December PPV in Memphis, and Elimination Chamber in NOLA
257853886499536897	neutral	DTN Kazakhstan: : Capello Ill Tweak Lineup for Azerbaijan GameCoach Fabio Capello said Monday he will tweak the ... http://t.co/l3wZthK0
264235528247988224	positive	AHHHHH just got Lauren's email!!! We are going to snap tomorrow #beready
110753194166059008	neutral	RT @suzanne_moore: Am going on Womans Hour tomorrow. Whats more so is PJ Harvey.
260787675873824770	neutral	Cupid and Psyche isn't an original Greek myth. It was a story in The Golden Ass by Apuleius and often cited as the 1st Fairy Tale.
109001452000788482	neutral	RT @tonygrace: Tonight on CTV News at 6, I'll have a conversation with Lloyd Robertson as he prepares to anchor CTV National News for th ...
262395238813954049	negative	Im so mad at Catholics im going to a Baptist church tomorrow and converting #boilingmad
254559475531403264	positive	Wifey & Princess are going up to Granda's for thanksgiving today. I go Sunday. I think I'll watch Goon!
264070267867906050	neutral	@PullingLinemen I'm amazed you keep coming up with new names for the league. May want to consider formatting Phil's GOTW though.
263874847623503873	neutral	I'm going to Walgreens tomorrow because I know there's gonna be a sale on Halloween candy.
263469011633860609	positive	@PeteAbe hold out hope for Valentine, he may win manager of the year
259941479148040192	neutral	gunna be a 6hour journey to NCS trip next monday :( LOOOL idc im gunna bring nuff chicken to eat on the coach!
100077741050830848	positive	Caught up on True Blood!! I love it... Now time for bed! Night peeps.. be safe tonight :)!!!
263603322274070528	neutral	@laurenlaverne Dutch Uncles obviously 'crept up on you' more than u realise 'Dutch Uncles' LP on Tapete pre dated Cadenza... are on 3rd now!
263008225354469377	neutral	The Ravens release their first injury report of the week on Wednesday. Sounds like it will be loaded with names: http://t.co/JzvwEGHy
257620687785689088	positive	well bummer the Vikings JUST LOST to WSH :(    ......Oh well tomorrow is another day,good try boys!  BUCK UP BOO'S WE STILL LOVE U ALWAYS!
103142957296795648	neutral	The final B-Lg draft pick game is tonight on MNF (ESPN).   @sfgiantsfan55 (NYJ) vs @OsunnyG (HOU).  Current leader is Ken with 27 pts.
237938906526539776	positive	Happy Birthday Wilt Chamberlain! He may be dead, but was also known for being stiff when he was alive.
260119690922303489	neutral	So I haven't seen this friend since 7th grade and I just found out she's in the Covina band! They go to Utah!
108170719875182592	positive	@KarenChristian2 GM The new cast of DWTS is going to be on Good Morning America on Tuesday Morning, hope your appts. go well, love U!!
263453340925583362	neutral	Channing tatum will be in white oak tomorrow...for all you stalkers out there
252045110517309443	neutral	Where could the Il Divo guys be performing tomorrow night? Tell us where you think they are
225672733084749824	negative	Frank Gaffney is not insane. He may not even be a true hater. He is a bigot for pay, just like Steve Emerson. Hate is their racket.
100395078731837441	neutral	President Obama on Thursday named former Microsoft and FCC executive Steven VanRoekel as the new federal Chief Information Officer (CIO).
102976601473552384	positive	RT @BDUTT: 15th august. The anthem still chokes me up. The flag still makes me proud. Gandhi still looks over us. happy  Independence day
256571600353239040	neutral	Grappling with corruption and business in Brazil: The World Bank is sponsoring a  panel discussion on October 17... http://t.co/SwDRWHy9
263137858599153664	positive	Thanks, Dave! Great show tonight.  Sorry, Craig. I've got to get to bed. I'll catch you tomorrow. @Late_Show  David Letterman
246995811899162625	neutral	#Trayvon My daily tweet (9/15) in memory of Trayvon Martin- killed 203 days ago. ~May you Rest in Peace~ (Keep family in your prayers -Love)
263748118091276288	neutral	FAQ: What is 'skeuomorphic design' and the executive shakeup at Apple: SAN FRANCISCO, CA - MARCH 07:  Apple CEO ... http://t.co/YCvoPl98
101042643252944896	positive	@serenawilliams doesn't this make you love them even more RT @BJAofficial: SURPRISE GREEN DAY SHOW Thursday August 11th, http://t.co/nROhM1q
213277369056768001	positive	Hear keynote speaker Doug Wead this Saturday, June 16th at E2 the Event. Don't miss it! http://t.co/MXv5onSt
262837557874790400	neutral	Boateng put through his own net in the dying seconds to hand Bayer Leverkusen a 2-1 victory on Sunday evening... http://t.co/hIXmqOqS
226474324599635968	positive	Watching full 1st season of The Finder on Hulu plus. So funny @lazydaysies I see why you liked it! on episode 2
222673014184099840	positive	#Ramadan #mubarak to all #Muslims who have began early. May Allah bless our souls now and forever with Good Deeds.
252405498433896449	positive	Every Thursday I fall more and more in love with Maya Rudolph
258268292232396800	positive	@MyGoldMusic  can you play wah wah or bware of darkeness by george harrison tomorrow please :)
194362813806952448	positive	CULTURE (Down Town, Mon 23, 1:00pm): Come celebrate spanish literature at World Book Day by the Cervantes... http://t.co/1JD5prgg
264244275452198912	neutral	MAYBE. i'll text you tomorrow Lauren lol i get queasy giving blood. we'll see....
259740383368601600	neutral	http://t.co/sAdtjuy5  Boris Johnson Times. Ed moans abt George going 1st class but David Miliband travelled by Royal Jet. #boris johnson
220597931839995904	positive	Happy 4th from the Bomb Squad! http://t.co/aEkrD7OV
101240164889788416	positive	Remember to tune into this weeks #Legend Quest on #SyFy tonight. The team are on the trail of Merlin and King Solomon - what a fine blend!
227281688227635201	neutral	#house #music #FB Jason Vernau Live @ SET Nightclub Miami February 25th 2012: Jason Vernau is back with some swe... http://t.co/Q82NnU6E
263928322604544000	neutral	BREAKING.. Apparently Jeremy Kyle is set to star in the 7th Star Wars film by Disney.  He's going to try and find Luke's REAL father.
251954639119974401	neutral	I have to finish reading Paterno by tomorrow so I can watch football Sunday and Monday and prepare for the #NBA2k13 release #120pagesleft
112580927087050752	neutral	RT @gabrielst: The only dirty bombs on Sunday will be the ones launched by Mark "Dirty" Sanchez and the Jets as they pummel Romo's Homos ...
256769689361997824	neutral	We're playing with Jim White on Tuesday! Static on the Radio por favor? http://t.co/C8E8JIct via @byt @jamminjava @JimSuperwhite #DCSHOWS
261270806305312768	neutral	#.:Aubig Black Leather Camera Case Bag Pouch Case with Strap for Olympus OM-D OMD EM5 E-M5 Cyber Monday Deals http://t.co/1UmT7aPM
264212198400864256	neutral	State unveiled their Snow Bowl uni's 5 weeks ago. Tonight, some Greenville viewers heard words Mullen spoke about them from September 26th
264200442886623232	negative	Heres everybody's warning nobody better piss me off tomorrow, Idc who you are I'm gonna snap #done #imatmybreakingpoint #canttakethisanymore
250251320395710466	positive	Occupy Unmasked with Andrew Breitbart - Citizens United Productions http://t.co/ppVuF9K4 via @sharethis*hAPPY & CHEERY MONDAY!* LOL or NO???
263851615147134976	negative	Hackers have already defeated windows 8, and ReadWrite Mobile ranked it 5th in interface design, behind iOS and Android.
263996503457148928	neutral	Tiffany, CNBLUE's Yonghwa and B2ST's Kikwang will MC for the SBS K-Pop Super Concert in America on Nov 10
263995165365116930	positive	I love Thursdays....Grey's Anatomy....One day closer to Friday.....and No driving to Huntsville.
264013071855529984	neutral	Headed back to Huntsville this weekend just for this Alumni stuff goin down Friday
174423831245627393	neutral	watched Unofficially Yours with Richard Mark Morcella, his partner and Jaja Abastillas
260181746350432256	positive	Going to see @JohnCena and @CMPunk along with all the other @WWE superstars December 3rd in Greensboro NC :)
263985418943471616	negative	@IhsanOmi seriously i think he may pull out his gat and shoot me! i need to call upon castle greyskull for my powers #IHaveThePower
262143223819022336	positive	Real test for #Bayern this weekend against the in form Bayer Leverkusen. A win at home on Sunday will go a long way towards a 15 win streak.
100122178984488960	neutral	@astitchintime @charliemoontm we have the new laptop for skyping! We fly to Ireland wednesday morning, perhaps we can skype before then?
104186079791423488	neutral	RT @ImJustTez: COWBOYS ! RT @AdamSchefter: NFL just declared Terrelle Pryor eligible for the supplemental that will take place Monday, A ...
264023107327651840	positive	Don't forget FCA won't meet tomorrow morning. We will just meet after the football game on the field with SAHS FCA. #dontmissit #freepizza
258081431685840896	neutral	Tuesday is my Sixteen hour day and I'm still up...
100560700388278272	neutral	This is the binder Dexter picked out for 1st grade! http://t.co/kHuTCAS
196603337079132161	positive	If Dontari Poe runs the 40 .3 slower at the NFL Combine, he's maybe a 2nd round pick. Nice work #Chiefs.
224057065746862080	neutral	This time NEXT SATURDAY NIGHT we will be about to kick off MEGAchurch with Stan Walker, JC Epidemic & Michael Franzese! 7 sleeps!
214292429480787969	neutral	Watching the kids movie Journey 2 Mysterious Island for the 4th time in 24 hrs. I can now recite dialogs from this movie in my sleep!
239678747593285632	positive	Just caught the last few minutes of @orjan_nilsen's track Endymion on @SiriusXMArea. Great track to get ready for work with. Its my FRIDAY!!
262234426996576256	positive	Tonight, I roast a chicken. Tomorrow, I make chicken soup. Love my job but wish I could cook for social justice.
264245091298865152	negative	So I heard my old crush is going to the bell game tomorrow and wanna talk? Wtf? :o  #weird
263833206086832128	neutral	Remember, 1 November is the Solemnity of #AllSaints: a holy day of obligation.  Be sure you assist at Mass or it's a mortal sin. #Catholic
262618255888359425	neutral	How we do football Sunday at the Turner house. Big screen, little screen, iPad. #gobigorgohome http://t.co/et3rfs5H
255833579299414016	negative	@IvanCarterCSN billy cundiff. His missed FG at the end of the 2nd quarter changed the game. He'll never play again
263589560934625280	neutral	@RambleAndWander @xavieremir since ET went via BKK and has 5th freedom rights (which can load/unload pax), it's a indirect flight.
259870557946904576	neutral	@KButter5: dook football, even the sun shines on a dog's a$$ some days. #UNC Dook...
264240880658022400	negative	How many of you believe that Andrew Breitbart very well may have been murdered?
248543278138523653	neutral	Malkin playing Thursday: QuotePenguins center Evgeni Malkin is set to play his first game of the season ... http://t.co/7WzXZCVd #Hockey
259224351478521856	neutral	It's Radio 1 Rocks next -  week starting off with a Live lounge on @fearnecotton's show with Bullet for my Valentine on Monday
264097575395794944	neutral	Top TEN strikers who are on the Premier League's January wishlist http://t.co/BBN99w2D via @FootballFanCast
228336950883528704	neutral	Endymion for the 4th time i blieve.! ahaha #TeamOrjan #CLHRDay
100156280366313472	positive	@peterfacinelli Good luck tonight @ The Teen Choice Awards :) i know Twilight is gonna take them all!! Ill b watching Xoxo
262911247773728768	positive	@Tiffany_Evonne o ok they got me off today wed &friday but ima talk to Zachary to see if I can work split shifts the rest of the week
251780516003581952	positive	@jessradio - Hope you have been entered in the Marie Colvin prize at The Sunday Times, Jess.
264240176614735872	neutral	@CrazyCougar9 not with UNLV, but my first game for Team Nevada is November 9th, as long as California doesn't cancel.
263764977544986626	neutral	Omg, Bullet For My Valentine are coming to the Netherlands march 21th. I might attend that one too :P
94613445332303872	neutral	Nokia N9, BlackBerry Bold Touch clear FCC: The Nokia N9, as you may remember, showed a bizarre twist in the comp... http://bit.ly/oCxHkd
177954195096346624	positive	#RonPaul campaign manager Doug Wead: Contrary to media lies, doing JUST GREAT with delegates even after Super Tuesday http://t.co/cjsRQgrx
100563359832866816	positive	RT @Nick136 Astonishing! Police raid Milan offices of Standard & Poor's http://t.co/QKXH4vb || Did u see this? This is the 1st time I have!
100152865456259072	neutral	And finally.. @billy_knott's dad says he will play 'with a point to prove' if he starts against Nigeria in #u20worldcup last 16 on Wednesday
264071572925603841	positive	Looks like Andy the Android may have had a little too much fun yesterday. http://t.co/7ZDEfzEC
223296177926443008	neutral	Next Sunday, the 15th, were having our 2nd Comic Book Swap meet at the Apothecarium! Comics, games, movies, more #ComicSwapMeet
264187943365783552	positive	@j3ybyrdswyf What Makes You Beautiful is their 1st big hit... Played on the radio 2 death? I 'm koolin' n u?
111405551396724736	neutral	Earliest possible date for Amanda Knox appeal verdict: Sept 29, per court schedule just released. Final arguments begin Sept 23
263544814379880448	neutral	Anyone out there know how I can go along to the Rugby Expo at Twickers on Nov 14th? #takemeimyours
251340401997385728	positive	@ukbieberday Justin is going tea time with sophia grace and rose tomorrow on the Ellen show at 4 on Really :)
258934276161171456	neutral	This seem like a long time tryin to make us 4getRT @TOSHAMAKIA: June 10 Trial Date Set for George Zimmerman, trial is said to last 3wks...
255963127924015105	positive	'May the Odd's be Ever in Your Favor' Australian Directioners.
263982937924587520	neutral	Liverpool, CHAMPIONS of the Carling Cup last season, now KICKED OUT in just the 3rd round of the competition 3-1 by SWANSEA at ANFIELD.
102842251767586817	positive	I'm not going on holiday until the 25th because me and my dad wanted to watch the Inbetweeners movie when it came out LOL :') - Georgia
259884564359548928	positive	Mark Martin: Morning! *Yawn*  Good weekend so far?   'Like' this status if you're having a lazy Sunday or... http://t.co/3zaI1oSJ
103114987739942912	positive	Big night. Going to watch the Cards thrash the Pirates for a bit and then the 2011 @nyjets debut on MNF. #CANTWAIT
264178284177264640	negative	Can anyone help me with Physics? Universal Gravitation. I have this worksheet due tomorrow and I honestly can NOT figure it out
226350031974830080	neutral	Our beautiful new firepit is complete, just in time for the Friday night movie, Journey 2 the Mysterious Island.... http://t.co/nMBwdjNa
263251709898416128	neutral	2nd movie for the night - Ghost Rider :") #nowwatching ~
263326991267287040	neutral	@MrsDirection55 ugh sooooo mean!! Oh yeah before I forget! We have a quiz on NCA and English tom, the English analysis she gave us last wed
100879239909351424	positive	@mcr_ellamae hahahhahaha lol,its probably cuz im sat here in a green day hoodie.....xx :)
100171000318136320	positive	:* :* :* RT @kikakikutz: ;> ;> :))) RT @raindraingga: milan & bontet, 2 things that make me happy last night... ^_^
198638111700418560	neutral	Looks like I'm going to Knicks Vs. Heat this Sunday.
101468391130415104	neutral	August 28 I'm playing a Los Angeles charity event at Bootleg Theater...Mia Kirshner of Vampire Diaries heading it up. Come out!
263304259615981569	negative	@whiteboytatted @PaperChaseEnt_ y'all tryna fuck with Chapel Hill tomorrow night???
264156108329988096	neutral	RIP to Capt. Walbridge of #HMSBOUNTY. Fair winds and following seas wherever you may be http://t.co/u2zHR3hC
264159683084943360	neutral	Livication is playing next Friday night at dipiazza's! Mark your calendars, and prepare for your newsfeed's to be blown up with info!
103866210113949696	positive	Midweek Service tonight! 7:15 Gulport  7:00 Wiggins. There is not a better place to be on Wednesday Night than Church!! See ya soon
263590015743954944	neutral	Question Time comes from London tomorrow night wth Jerry Springer and David Miliband amongst those on the panel: http://t.co/CQOsl5L5
256872328082903040	neutral	Our @YepRoc 15 celebration continues with this long interview with Jim White, who plays Sat. at Cats Cradle for YR15. http://t.co/bZOV4oBV
264172194555383808	positive	Even though we just play Troy this Saturday, I still can't wait to watch Tennessee play! #truevolfan #gobigorange
100320179166265344	negative	I haven't talked to you since July 19 th and all you can say is "So do you like Beyonce's new cd" GTFO
90832477970636801	neutral	Today's news: Democrats offer Republicans everything they asked for; Republicans demand more. Not hard to understand: R's want a shutdown.
255732290246815744	positive	Billy Cundiff may be leaving Washington.  Hopefully he won't miss the door on the way out.
254699577515593728	positive	Just saw Won't Back Down the 2nd time! Wow! Viola Davis and Maggie Gyllenhaal are PHENOMENAL! Even better the 2nd time! Amazing cast too!!!
100062984994426880	positive	keen for the eagles game today. #goeagles
258228644164558849	positive	Robert Pattinson paid tribute to his Bel Ami co-star Uma Thurman as he presented her with an award at the 19th W ...  http://t.co/DiAJVN1V
257755536555114497	neutral	Australia Test and ODI captain Michael Clarke at the launch of the international season in Sydney on Monday... @PCBcricketPK
