259136986131075072	neutral	#BOOM!!! Come party with the MB Family next Saturday night at Sydney's infamous RED ROOM! NRL & Super Rugby  http://t.co/HEsk3HWn
262591499710115840	positive	Can't wait for opening night at Madison Square Garden. Will be there for the Knicks/Heat game on Friday! #fun
261360146339491840	positive	Watching last night's #redeye - the @Gavin_McInnes hipster may just be the greatest character since Stevie on Eastbound & Down!
106435132289843200	neutral	RT @Johnny_Shah: Comedy Central RT @Lord_Sugar What channel is Arsenal game on tonight
111642751401082880	neutral	Anyone going to tomorrow night's NZ vs Tonga game? What colours will you be wearing?
263755663577055232	positive	Getting @Jassy_Baby transcript and shot. Tomorrow accuplacer and group advising. Turning in fafsa tonight. Making moves before NY. Love you
264211558014529536	neutral	@oohheeyitsSarah Are u coming up the 17th. Davis is playing Hawaii for vball so we will see Chris Webb and Scott Wong. ur mom & my mom are!
253310466024169472	positive	Just got him tickets to the Knicks vs Celtics game on October 20 Lmfao how mad would he be ?
256353471085805569	positive	PlayStation Network maintenance scheduled for October 15 http://t.co/P9jkuYJ9 That'll be the new store then. Exciting!
255545007199621120	negative	Tom Boonen has been summoned to man the polling station in Mol this Sunday. If he doesn't, he'll get fined http://t.co/zEPnatOJ
100213519680679937	positive	Marty was in Nebraska yesterday giving a talk that included bullying that made the news there. Fun times learning! http://fb.me/yY2tcgfI
262268094586703872	positive	I'll be doing the Senior Bowl fun run with my niece next Saturday
263690516183519233	neutral	Due to accidents/traffic my sat-nav took me through the Blackhall Tunnel instead of DartfordGot a nice drive past the Olympic Park though!
262111068011257856	positive	@crixacus @EllenHollman @stevendeknight Keep yr eyes open for Incursion. It may not be Spartacus, but it's going to be out of this world :-)
115871164794019840	positive	RT @TheEllenShow: I just talked to Melissa McCarthy. So happy she won last night. She called to offer me a role in Bridesmaids 2.
264247218633060353	positive	Amazing day today. I can't wait for tomorrow; I get my braces then movie night at my bf's house with Rosa & Jose. YAAAAY.
257972573093109760	positive	#TragicKingdom is the best album of all and my favorite song off this album is #ExcuseMeMr. Sunday Morning and Sixteen are close seconds...
257369508086423553	positive	Omg. Ricky Martin may be gay but he is one fine ass gay man.
261570451241836544	neutral	@swannydmp Did you tell Rio in the weeks before Rudd was knifed there would be no mining tax introduced in the May 10 budget?
263651602072760321	neutral	I'm Volunteering at the 8th grade Construction Rodeo!!!!
231034470084538368	neutral	V-P nominee Jaswant likely to meet Jayalalithaa on August 6: 'Some of our leaders are also in touch with ... http://t.co/UYVk8Rv4 #india
264210601952280577	positive	@lakeshow73 it's out already?  Thought it was tomorrow? Denzel is the best EVER. Movie looks amazing.
253911661944131584	neutral	Come to the Art Walk tomorrow night to see me perform my original acoustic guitar songs at Coni and Franc from 6pm-9pm!!!
250705732087971841	neutral	Repio CEO Neil Cox is speaking at Chicago's Social Media Week tomorrow about "Social Media & The Changing Face of Employment - Check it...
256137049114025987	neutral	I regularly drink THWAITES Best at the Welly on a Monday. Nectar.  In The Fox @ Twickers, utter shite.
263640016641724416	neutral	@tancredipalmeri Hi Tancredi, today spurs are again being linked with Roma's Pjanic. Any truth in the rumours of a january move? #thfc
258625516481953792	positive	Looper was amazing!!! Now to the theatre to see Simon Callow's 'The Mystery of Charles Dickens' ...loving my Wednesday off work :-)
263646437458452480	positive	@OilOnWhyte @albertaoilfire another center? Gagner is a good cheap 2nd line option that we can afford and keep the kids.
259955476224147456	positive	[$] BLACK FRIDAY BEST PRICE Underwater Case for the Following Olympus Evolt Digital SLR... http://t.co/icQ5WHBq
100017103955963904	neutral	@Rob_Scotland getting there slowly mate! Have you seen there are riots in London tonight? I only just noticed myself and i am not even drunk
254342883967127552	neutral	@MieshaTate @MieshasArmy just saw Rhonda Rousey will be at UFC event in Seattle December 8. You should have the rematch here, near home!
264170909542252544	negative	@HarrySilk Aston Villa are a joke mate and so is your profile pic u may wanna hit the gym b4 u head to the Bridge w your bitch slaps #JogOn
100303249697021954	positive	1st episode of @arsenalscotland's Arsenal podcast, I guested alongside @BCole90 and @antmaley - http://t.co/DAWvTkg Check it out!
253213326627176449	positive	Redlicki/Tahir are set to play Wichita State duo of Gregurovic/Nicol at 5 pm ET in the 1st round of doubles. #TulsaITA #goduke
216017882012856320	neutral	Did you know that Doug Wead and Jeremy Richter, the short film "Elektable" out June 28, is going to be doing a... http://t.co/b4PuJ1c7
205784097694556160	neutral	I got tomorrow off!! Woooop!! (@ Adrienne Arsht Center for the Performing Arts) http://t.co/mzdD0SYo
262298853385060353	neutral	Typical Saturday afternoon, hanging with Steve Whitmire - who plays Kermit, Ernie, Rizzo the Rat, and others http://t.co/LW27dLvj
264214590869618688	neutral	Bashaara Graves had 17 points and 15 rebounds in her debut with Tennessee in an exhibition game on Thursday. She played 23 minutes.
261038961206652928	neutral	India is the 132nd country out of 185 countries in the world to do business easily, by World Bank! Singapore is the 1st and 4th is USA!
263839524189261825	neutral	The Fox shows watched moving onto a movie, George Clooney no thank you. I may be one of the few on the planet who has never watched Titanic
260493482815287298	positive	@ben_hatton rumour has it Cupid has you on a piece of string ! Friday not sure Saturday rumours are funky town in gants hill the big V
263811073726099457	negative	Physics tomorrow is going to be a shit show
260624498787762176	neutral	Charles Dickens may just have been me in another life. #thisisme http://t.co/Jb70qAyi
264248524596707328	positive	Finally in bed. Such a long day, but so much was accomplished. Athens tomorrow!!
234804357311377408	neutral	Jinja Safari have Hiccups, catch them live this Thursday with Opossom and White Arrows on the Blind Date Tour http://t.co/u572cXVW
252013711605256192	positive	Next Sat's KIDS' CLUB film is THE LORAX with more fun 'n' free activities before the film from 10:30am, film 11:15  http://t.co/rpx9lRY1
263424953116930048	positive	The 1st article pointed out to me for my FB page dedicated to the announcer at Bethnal Green - hoping the 1st of many! https://t.co/1WqEQTpJ
261545687106322432	positive	Remember Cupid at Convo last year with the bomb candy bar?? If you liked that, you'll LOVE next Tuesday's Tr http://t.co/af9hu4pU
256397624326885379	neutral	JR Smith wanna be a starter so damn bad lol, nigga said 6th Man of the Year Award is not what he's thinking about
226266513080979456	neutral	Presidents Day Tomorrow.  Come on down, there might even be cricket to watch before the festivities.
261914270307065858	negative	C'mon Rebels, put an apple in the pigs mouth!!!   Red Wolves fans focus all of your hate & anger at the pigs tomorrow.
259405019336548352	positive	There is still time to register AND find your red dress for tomorrow's Rampage!  Get on it! http://t.co/r6sqDyYX
260905747418845184	neutral	Champions League is in Mourinho's blood: Paulo Sousa thinks Jose Mourinho may consider his time at Real Madrid a failure if he does...
258918845417418752	neutral	Ivanovic reaches Kremlin quarters: Ana Ivanovic advanced to the quarter-finals of the Kremlin Cup on Thursday by... http://t.co/xbIC4XmT
100544750414864384	neutral	@iheardavoicesay is finally catching up to me with #Dexter. I'm only up to season 4, but he has almost finished season 2 today @ home, ill.
264221432463114240	positive	@USC_Zack @broncopeyton @gsf_23 lmfao when May comes around, watch Zachary cheer for the Bulls or Celtics lololol
254209468907257856	neutral	SHUT UP & HIT THIS PARTY SATURDAY!  - POP recommends:  One of our all time heroes, the legendary James Murphy... http://t.co/PXOGCctS
259400669453246465	positive	Now that the sun is on him, my iguana is more active.
263871782979764224	neutral	Oh and being the weird person I am ok going down to Starkville late Friday night @662King
234920132038762497	neutral	VERY SOON Police marching Towards the Crowd  #Ramdev supporters start march towards Ramlila maidan  #likeaboss
263727836593008640	positive	Catholics tomorrow is the Holy Day of All Saints many many gave their lives for Jesus and the church. All the Saints defended the church!!
259859019584385025	neutral	NEON theme! first round Monday night at the volleyball game in West Liberty! #wakawaka
262987035558682624	neutral	@pvoelkel In your defense,my love of Dickens' original may be regarded unnecessarily high in my eyes because of the history I have with it
227674000917159936	positive	Dear @misskahi and @SsoSso_1004 finally tomorrow Dream High 2 will be aired in my country...finally i can see you again^^ miss u alot~~
119268781557161984	neutral	I've got a blog post coming up tomorrow. Topic? It's time to learn once and for all what Curtis Painter's got. Start the man. #Colts
253622693042208768	positive	Ticket prices go up Friday! Get your tickets TOMORROW!! At the Murphy Center Ticket Office! You don't wanna miss this years #MTSUStepShow
264165377418862592	neutral	Physics test tomorrow, so it's about time I open my book... but really there was a layer of dust on it
233624395866845184	neutral	Its about that time! Filthy Rich presents...... SATURDAY AUG 18. Email me for more info or check out our fac http://t.co/GwDPHQD9
259938141878759424	positive	@ChestersShop This is one of my favourite things about Chesters, the pizza's taste fantastic! Alternative to a sunday lunch?
264214955862138881	positive	@MaverickManiacs I know, it went from way too far off to here. I'll see IUPUI at Maryland on Jan 1, just excited to go back to Baltimore lol
262691370890838017	positive	Make sure that you're decked out in your Red, White, and Blue tomorrow for America Day!  Let's make this homecoming week great.  #Merica
166921966878588928	neutral	Italy: Former PM Silvio Berlusconi was indicted Tuesday with new criminal charges   - Breaking News Buzz http://t.co/vs9lQCNC
260188814633492480	neutral	@kylepetty : Pit road speed limits are the major cause of fuel mileage racing. The King's 7th Daytona 500 win is the only mileage race prior
234433845917802496	negative	Men's latest bedroom worry: '50 Shades': E L James' 'Fifty Shades of Grey' may be supercharging the sex-drives o... http://t.co/bUdnfyFz
263686883530379265	neutral	Which camera rep are you most excited to see at Demo Days on Nov 16 & 17? (Nikon, Canon, Tamron, Sony, Sigma etc...)
251003446562545664	negative	OKC Thunder center Kendrick Perkins may miss the preseason due to a wrist injury
263963523669975043	positive	Higgins "Great experience for the young group and to meet with Premier League teams a real highlight" "Very young squad to play on Sat"
262415290200100864	positive	@PimpMamaNayy GOOD GIRL, I'll see you tomorrow?
249880400254599168	neutral	@mrdavidhaye David the UK bookies have got you penciled in with Vitali for 30th December : Do they know something we don't ??
262925618470072321	negative	What's worse than being stuck in a time loop of Groundhog day? Being stuck in a Monday loop.
260938062631149569	neutral	Ricky Ponting has passed 23,000 First Class runs - the 12th Australian to do so!
246436190218223616	neutral	sept 27th | Cherub, Pell | Ricks Cafe | $5 advance tix | get at me before the date of show cause the price will go up.
111718983148904448	positive	@LeighFrancis: Celebrity Juice tonight 10pm itv2. Hurrraaaaah! its a Back to school special who's featuring ! The wait is too much ! Ooosh
264201422076264448	negative	14th page in Hindu TN edition :(.  Gadkari was on first page though. Media will one day sell India for bread crumbs thown by dynasty
220309544025341952	negative	If Volstead went against #Braves on a Monday, he'd give up 5 runs in first, then cubs make a furious rally late to win #twostreaks
241552338849001473	positive	I'll be rooting for Penn State tomorrow...even tho THEY MURDERED JOE PA FOR SOMETHING HE DIDN'T DO! the new coach & kids deserve that
253403686590636033	neutral	@janehamsher ICE may still issue an NTA against her, though unlikely. Let me know if Melany needs a lawyer in the area for #DACA.
227430095269289984	neutral	Officially confirmed: Tom Boonen will ride at the Olympics this Saturday
232415485512253440	positive	If @TheRock wins the @WWE Title at #RoyalRumble, then he would have to defend it in his 1st ever Elimination Chamber match.
254210411933618176	neutral	All black tonight . 1st Carroll & Richwood game ...
100077040413315072	positive	Went to see "Rise of the Planet of the Apes" tonight Great movie B+ for sure.  !!lChris-Rockz!!!
263235196516700160	neutral	Tom hanks and bill Murray may be the two people I would most like to meet. Well, them and Scarlett Johansen. Different reasons though...
264162655835680768	neutral	I'm not Mexican on cinco de mayo, I'm not black in Feb & I'm not Chinese on the Chinese New Year so you're not Irish on st. Patrick's day.
263482993690161152	positive	Psych and garage rock fans will love @THEVACANTLOTS @LovelyBadTweets & @__cosmonauts__  at the Echo on Nov 6th! Tix http://t.co/Kh7ZPEqE
262876088743632896	positive	Can today already be over with? I am ready to go to Murray State tomorrow!!! #CollegeVisit :)
263040847703064576	positive	Project X is the best film ever made and someone with money needs to have one, like this Friday. #makeithappen
263527525819502592	negative	Cupid did so much work da 1st time that he don't wanna be my friend no more
263235660289298432	positive	Panellist from World Bank presentating on Understanding the potential for youth and women and wat may help guarantee success #GCARD2 #C22
263129125559095297	negative	Can we just haw class cancelled tomorrow? Cause I really don't want to go to BCA 101. I'd rather eat worms....
103731032200716288	neutral	@CXClausen If you can wait until tomorrow, Cowboys and Aliens comes out.
263711920597630976	negative	I guess Knicks/Heat is on for now. Pretty clear that tomorrow's game wasn't going to happen.
260806021642080256	neutral	Trying to come up with a rockstar for @LooveMeDo_ 18th, so far Emilie Autumn or Amy Lee seem like ideas
263635746156589056	neutral	@NoQuivering @skepchicks I'm everyday dressed up with my Spartacus costume. So, if you miss this Halloween, we may catch up anytime!
248762128033538048	neutral	@Ilardo just tickets go on sale tomorrow via Ticketek.
104515631365365761	positive	Can't wait to go to Colts game with my sweetness tonight.
262921934981971970	positive	I hope yall not sleeping on the #Blackout Homecoming Party this Friday at Club Pulse. Shit is really bout to crinack.
203977468904878081	positive	VeloNews: Tom Boonen happy with Amgen Tour so far, but hopes for first win in Sunday's final stage in L.A. Then ... http://t.co/iANQzifO
262627821908815872	negative	really bored of this host on Super Sunday doing nothing but talk and rave about Man Utd #BiasPrick
244634790576414720	positive	#factsaboutme When I was born. On that day , it was the 2nd day of Chinese New Year. Immediately , i gotten lots of redpacket :D
264088457490604032	negative	@PaperChasinAL: Damn next Saturday tho Niggas was trynna get shit over with #early
107598339922604032	positive	Anderson Silva better fuck up Yushin Okami tonight.
264259572192133120	neutral	Last day in Jeddah. Will be in Brunei tomorrow night. And then Surabaya the following night. And then Bali the night after that. Whee!
261697956787400704	neutral	UFO Sighting: Black Triangle Sighting in Perryton, Texas on October 20th 2012 - Black object that obscured the s... http://t.co/BSoMVMSR
263197243157397504	neutral	Here are the five Capital One Cup matches tonight and some potential upsets on the cards - Swindon to beat Aston Villa? http://t.co/DwDrysrp
103670215459618816	negative	I really hate to think it, but the same type thing that's happening to Miami could happen to Alabama tomorrow.
258300934046769153	neutral	So with Bey performing at the Superbowl in Feb. I'm assuming new material in the coming months before hand then album after Grammy's
101963773635600384	positive	Anyone else already getting goosebumps about how loud goodnight Irene will be at 2:55 tomorrow afternoon #blackthornendmyrealhome
257594767532244993	negative	Seems my new iPod doesn't like Kasabian very much- laptop has crashed every time it's got to syncing Empire. 10th time lucky...
264165424617365504	neutral	Played Dishonored (360), Darksiders 2 (360) and Mass Effect 3 (360) in the last 24 hours. http://t.co/sJGYXZsG
247504084423307265	negative	Wow Drew Peterson was just convicted on september 6th for murder of his 3rd wide and they never found the body of his 4th wide Smfh
259186885044363264	positive	. @kyusslives may just be the ultimate face melting summer rock band. Can't wait to see them again at Soundwave
264156021742784512	positive	I love that boy ! Jacob just sat in the bck and was laughing
100650724005912576	neutral	@stewardsfolly I think he and Sanchez should both be sat down. Time to bring back the 4-man rotation.
264107454948835328	neutral	@thehill @repjeffdenham @dccc @petekthehill Were the House votes cited accurate? Take a Midol and call us Wednesday morning!
243848916418822146	neutral	Presidents Day is this coming Sunday (9th) at the Windmill starting at 1pm.  Arrive at 12.45 for pairs to be drawn - all Members welcome.
263734377148710912	neutral	Red delays new price anouncement till tomorrow 6PM. Sounds like they want to dig for Sony prices some more.
249900060123488256	negative	Not able to watch the Enrile documentary, but I've a sense he (yet again) won't like tomorrow's INQ editorial.
259281045873123329	positive	Stimulating & promising speech of the World Bank's President Jim Yong Kim in the Annual Meeting held in Tokyo on Oct 12 http://t.co/4cg3LMJR
264082200927031297	positive	Oooh yha and the DMC and A$AP ROCKY one is 2-4th
108156619417845760	neutral	Morning paper: Georgia gets ready for the big opener it 'needed.' Boise State looks for a kicker. The Bangles. http://t.co/g0scXUL
111406627818717185	neutral	RT @Carly_Coughlan: Big Brother last night on Channel 5 peaked at 2 million and beat BBC TWO, ITV1 and C4 in it's slot. Plus CBB Final t ...
263771834867122176	positive	Having to read Charles Dickens for homework may be the greatest thing ever
263918513083781122	negative	With all Benson's attention, Frankie feels like a forgotten stepchild. Lets 'founding father' him so he know we will never forget 2nd place.
263748939285659650	neutral	Ward 2 May Have Two Members on the DC State Board of Education http://t.co/6DsUHvgL
264223113963773953	positive	Monroe bound tomorrow! It's a must leave Ruston for a day
256903922340483072	positive	@TThomasxoxo 1win from the Superbowl! Game tomorrow at noon! Git r done! http://t.co/n8ptYIrE
262960905120260096	positive	@ugodofwutang Holy shit, you really replied! So my birthday is coming up December 31st. Any chance the Wu will be around Greensboro NC then?
263965467109109760	positive	COOL!!! There's a Criminal Minds season 3 marathon on, and tomorrow it's a Castle season 3 one. http://t.co/GRRUt9mq
247809005790048256	negative	Dongwoo gets so scared the whole time. This is like the 5th time he got scared because of the staff that's filming them lol ...
264143428986748928	neutral	April & I are having dinner in Jacksonville tomorrow night with Milford & the future Mrs. Milford!  @FlightTimeRadio #SebringLSA13
261641728426127362	positive	This "Too Cute" puppy show on Animal planet might just be the greatest thing ever. I may never leave my room. #HomeworkCanWait
264234794509017089	neutral	I just need to see Lauren on Saturday already.
214119611464040448	neutral	@JenStevensDub golf is the Camilla Parker Bowles in our relationship. And yes, two!! U heard I'm going freelance? 1st order of business!
264208747520462848	neutral	Alright nicky Fwd: From: 4028890972 Sent: Nov 1 10:28pm Message: Idc what he says.
264181656154435585	positive	Pretty good Thursday night with @juliecbirch! If only Rivers would stop sucking so bad! # @ Qualcomm Stadium http://t.co/opLRzq4a
253526896338432000	neutral	@RissaHope12 you went to Henryville up til like 4th grade right??
261396125473439745	negative	@ohyesitsmatt @hotspurkeeno yeah i'm not to sure about Klass -jan think he'll be an Andy Carroll type striker -bang em in or flop
253193540732059649	neutral	I want to see White Arrows at North Star Bar Sat + @Radio1045 Studio Session on Wed
246910354003738624	positive	Big Bangs new season starts on the 27th YEAH BOII
263387414423298048	positive	@parkiesc everythings good thanks mate (arsenal aside), jobs going really well - hope everythings well your end? Should be at cobham on Sat!
263952294939332609	neutral	Had a dream about a Chardon football last night. Makes me wanna go to the game tomorrow
261673957722320896	positive	Thursday Night Football:Tampa Bay Buccaneers V Minnesota Vikings ...: Vimeo is the home for high-quality videos ... http://t.co/b5IJeryN
254526902298083328	positive	Don't miss Plies at Belo Nightclub on Saturday 10/6 with Z90.3 | San Diego!! Get your tickets now -... http://t.co/hje8AvTl
241711277532119040	positive	happy 15th anniversity kuya gloc9 you are number 1 rapper and francis M. .........
100046190648885248	positive	just got back to the crib today wasnt so bad went to Detroit and Somerset
263694340579274752	neutral	@KellyEstaLoca February 2, aka Groundhog Day, we can pull it off, right?
263549707744325633	neutral	Jan with the new cat at Royal,Star and Garter #solihull http://t.co/MlmndyVm
261853381256163328	neutral	Trey Songz will be here December 7 at the Fox Theatre
263598002806079489	neutral	@LatifahDee yesssss it's true. Wednesday London Thursday Luton Friday Luton. ARE YOU DOWN. GO HARD 'OUR' GO HOME (remember that) LMFAO
263238987597107201	neutral	@echelleprakash 1st its like Imma play Headlock, and then Safe and Sound, and now you gonna play All Star. hmmmm
264198793812127747	neutral	A reminder to all Hong Kong Optimist Sailors: you must pre-book your Prizegiving Curry Buffet for Sunday. Deadline... http://t.co/KIeqRfbO
255983114126520320	neutral	If any Baltimore team mascots come up missing 1st person of interest should be Billy Cundiff! Or the Redskins mascot is taken blame him!
264176275655106560	positive	@addismom22 Feb 22 at KFC YUM center, you down?!
263983521956249600	negative	Ignored again Man C v Ajax ITV Tues, Celtic v Barca SkyS2 Wed, @ITV sort it out ya fuds
263488695225692160	neutral	STAR's office hours are in SCC room 324 Sunday and Monday: 1-8pm, Tuesday-Thursday 1-9pm Come talk to us about anything!
264190899083423744	positive	First time I ever heard SS was in 6th grade and I actually loved it. I didn't know the song at the the time so I couldn't continue to listen
112973204452147200	negative	If Tony Romo doesn't score 50 fantasy points for me tonight, I'm screwed. Wait, you're saying that's not going to happen?
243678818156564481	positive	Chillin in traffic listening to Wiz. Taylor Allderdice is my favorite mix tape of his. Actually it may be in my top 10 period
264130758522839040	positive	Going to Olive Garden with my family! So happy it's my 15th Birthday!
264199927511515137	neutral	That kind of year in KC. Rivers over 18 fantasy its for only 3rd time of the season....for now.
101466897983356928	neutral	Just like Clemson beat GT in the ACCCG@ACCSports: Touche again RT @TheDevilsDen: @ACCSports Umm Rutgers may very well have 'won' that game.
264192980498386944	neutral	@walkerackerson a dance on december 8th for all the cheerleaders in the district at east
264157010679967744	positive	On Election Day, November 6 MDC WILL be having class as a make up day. We will see all of our Dance III lovelies then!
257886032060637185	negative	Robbie Keane speaking now: "We let ourselves down and we let the country down. It wasn't good enough on Friday." #rtesoccer
264247419888365568	positive	@Anqel09_ Ima ask for the day off! Im not gonna miss watching Breaking Dawn for our 10th month anniversary!(:
223299809140936705	positive	I think I'm going to watch The Artist for the 5th time in 2 weeks 2nite before I got to sleep. <3 Jean Dujardin & his charming smile :D haha
253585284594286592	neutral	.@Marvel's Phase Two Kicks Off with 'Iron Man 3' Trailer on October 23rd http://t.co/5HvrM27A via @firstshowing
261286622589485056	positive	@Serious_Sound yeah that's wha I'm doing tomorrow. Your topic seems interesting as fuck. Lol my shit is on Malcolm X. But ima just
249061280449703936	neutral	FM Preview: West Ham United v Sunderland 22 Sep 2012 - FootyMad attempt to assist you with their form guide as West ... http://t.co/vYmrr56h
264201880283004928	negative	Ryan's going to Amsterdam tomorrow :( wahhh but who the fuck even goes there
262915421232058368	neutral	From satellite images, it appears that Muscat may get some thundershowers tonight
244525624943865858	negative	They better take Joe Pa to the Pet Semetary... They may never win agdin
264225747638566912	positive	Mr. Travis took the SATs in the 7th grade! #nerd #fact @BestUeverChad
249061274258911232	neutral	FM Preview: West Bromwich Albion v Reading 22 Sep 2012 - FootyMad attempt to assist you with their form guide as Wes... http://t.co/PHJIMufB
244156171102076929	positive	Looking forward to seeing all our potential 4:19 participants next Saturday for our free taster at the Joseph wright center.
