264255172623093760	neutral	If you see me tomorrow don't talk to me unless if you want to talk about  WHAP, Chinese, DECA or TRIG #zombie #iwontbesocial
258681137222795264	neutral	Rob on the 'Kyle and Jackie O' show on Oct 23rd: http://t.co/qznYakjw
100185571913244672	positive	@MarlitaH Pretty cool names. I have one cat, a black cat named Merlin, who leaps on my chest in the middle of the night. A heart attack soon
245558175561048064	positive	Loved the hair style from Friday's Jason Wu #NYFW show? We're giving you the step-by-step to recreate the look http://t.co/ToqV0jJC
113047005558878208	negative	Tony Romo better not fuck up tonight , I'm just hoping
248891658379350016	neutral	Lauryn Hill's going to be at Constitution Hall on   November 4th >>>>>>>> I'm in there like swimwear !!!
259733030669787136	neutral	Nick Diaz getting the start at PK for the 2nd straight week.
231554887937310720	positive	Are there any Aussie Directioners from Canberra?? going there on the 12th of September would love to meet some More Aussie Directioners <3
244951082315431936	positive	@teenystweeting see you tomorrow in Port Charles hope you're enjoying Big Brother :)
237956036340895744	positive	The only 2nd coming I'm interested in is @springsteen bringing his Wrecking Ball back to the UK  #HisAlmightyBruceness
249710611083165696	negative	Acta on Choo getting thrown out at 2B with 1 out and down by 2 in 9th. "You have give the tying run a chance to come to the plate."
264214825096314880	positive	Shout out to my boy @JshapMMA who fights tomorrow night on the Las Vegas #rfa card. He's put in the work so I don't need to wish him luck.
262034145457356800	positive	@limmengkeong hahaha.... Rest assured it will be something big on Tuesday in Putrajaya
264206494587834368	positive	Going to see Kendrick Lamar with @Pea_Starks in jan :D
262781444051582976	positive	Can't wait until April 7 going to see RiRi in concert
239781099901960193	neutral	Jungle Island says it will be open as usual on Monday. To see what's open & what's closed click on this link #IsaacOn6 http://t.co/DznGJ7EB
250156149276545024	neutral	@lindalukita Chinese? On top of the international holidays, we have Chinese New Year Eve,Chinese New Year (Day 1& 2),Chap Goh Mei (15th day)
264082013177397248	negative	Doing some serious sucking up tonight so I can go Harry's tomorrow :( @hellomnamesjim
251061126765350913	neutral	I know Flatbush Zombies wont be at the concert on Friday but I still hope the Asap mob performs #BathSalts at least, or rockys part atleast
101496696877486080	negative	I fail to see why the Rams are playing TWICE on MNF this Fall-isn't once enough?And their 1st div game isnt til wk9!Un-frickin-real.
264193723913601024	positive	LMAOO! @NVme68 gonna have to fight me now... Think Ima wear my Warriors gear tomorrow just cause... LOL
262017896056750080	positive	4 days until VintageNOW. We want to raise a bundle for the Safe House for Women. Support us by attending 0ct 30th.  http://t.co/oMptA9pe
103926602785759232	neutral	Saw X-Men: First Class last night. Still gotta see Captain America, Transformers, Cowboys & Aliens and Rise of the Planet of the Apes #whew
117577445380599808	neutral	Just realized it's Nuit Blanche the night before the Run For The Cure. I feel like I'm in a stare down. Who's gonna win?
100109081813057536	positive	Tweet di Brintey So amazing to have the beautiful Lady Gaga at the show in AC tonight. Love you girl.- Britney http://fb.me/13C1kUZaw
228337840633823232	neutral	Elimination Chamber is going to be in St. Louis May 19th.. I have to go.
261011903764123648	neutral	Fourteen environmental protesters arrested at Eskom on Tuesday have been released on bail, after the group... http://t.co/fKGYi3a3
264171912903675904	positive	So proud of @wakemenssoccer for the huge upset against Maryland. Time for us to do the same tomorrow night #godeacs
258599234645946368	neutral	http://t.co/TtQf1MqA Haye: Vitali deal 'signed': David Haye still expects a fight with Vita... http://t.co/hPW1ggRp CLICK-1st-LINK! 2WIN
101149621740515328	neutral	Nokia N9 will not launch in the United States: Nokia confirmed on Tuesday that its flagship MeeGo-powered N9 sma... http://bit.ly/ojyWQa
264032355398844416	positive	A1 Live in Cebu at the Waterfront Cebu Hotel and Casino on November 23 http://t.co/BL41iSUa #CebuFinest
263939764024135681	negative	Bad news, no Gibbs for Saturday. Unless we play TV5 at LB, we have lost before it's started. Santos is a liability and will be cut to shreds
263097631142711296	neutral	Watch me walk into a Columbia on a nice Saturday afternoon and get clipped up like im fucking Trayvon Martin with the pillz
262611581152657408	neutral	Jennifer Aniston shows she's Prada her figure at fashion bash - The Sun: The SunJennifer Aniston shows she's Pra... http://t.co/q42IDY8U
263765493595373569	neutral	UEFA Women's Champions League update, including @Yael_Averbuch scoring in a game with lots of Americans: http://t.co/YhM7h5Y5
264011506604195840	positive	Big game with VCU tomorrow night! Second-place is on the line. #LetsGoX http://t.co/rUGy8UMJ
237426623908040704	positive	Playing @garbage all day to prep for tomorrow's concert at Fort Canning. Go, baby, go go!
263396381736177664	positive	@p4_da_PRINCE @lakers SACRAMENTO KINGS, we just beat y'all Sunday and thurs night so what it was preseason won me some money. Nov11
158798279889526784	negative	Costa Concordia accident: Ship's owners say the captain may have committed errors   - Breaking News Buzz http://t.co/M5IgiM3R
261460749715660801	neutral	#pakistan#news Procter and Gamble sales fall 6.7 %: P&G said net earnings in the quarter to September 30 fell to... http://t.co/NYnfUupZ
246760239221858306	positive	Drew Peterson is #Untouchable no more! Check out these movie photos before you watch on Sun at 7/6c: http://t.co/LT9WUkOD
205750107377909761	negative	I'm not even gonna bother watching Eurosong tonight. Saw enough of it on Tuesday.
262040778740727808	neutral	@SweetSpotNation son...I left them so open. I got em hot and said 'u can hear the rest of that poem on Nov 11th at Santos Party house' lmao
262634521533480960	positive	Monday is a Moon Day!  Enjoy a sleep-in tomorrow & a little extra rest.  Come to the Workshop with Harmony Lichty... http://t.co/tvkXm886
258050302689808385	neutral	Economic TimesWashing hands will keep the doctor awayDAWN.comISLAMABAD, Oct 15: The World Bank's Strategic Environmental Assessment r...
91687000574394370	neutral	Democrats defeat Republicans 8-2 in Congressional baseball game tonight.
261131735209758720	negative	Not sure what im going to be for halloween yet. Sun Shine is just too obvious, Larry Bird is the front runner as of right now.
263152627540455424	neutral	As confirmed on tonight's episode of Monday Night Raw, CM Punk and WWE Legend Mick Foley will both captain teams heading
245853635068706816	neutral	Don't forget, I'll be at Volare tonight and tomorrow for my birthday. Instead of gifts, please donate a food item... http://t.co/wOqHMCTp
248851718627004416	neutral	Late Night with Jimmy Fallon clips - Maya Rudolph, @DaveAnnable10, @theavettbros  http://t.co/TXP7f5LK @NBCUpAllNight @666ParkAve_ABC
238666543704199168	positive	Roger Johnson looked good on Tuesday. Looks like he wants to play for us now. Hopefully he'll show why we paid the money for him! #wwfc
199618391097622530	neutral	Debating on going to the Memphis vs Clippers game Wednesday or watching the Knicks vs Heat game on TV #Decisions
238777540804767744	neutral	Video: Unsold Simpsons stamps cost USPS $1.2 million: The U.S. Postal Service had marked the 20th anniversary of... http://t.co/R2pmZhFh
100049053403975681	positive	morning tweeps! i'm going to Milan today! yaay
262882510378254336	neutral	Carling Cup on Wednesday. No extra time please.  Have to play more england internationals and give the kids a rest. #lfc #stillinthehat
264172194555383808	positive	Even though we just play Troy this Saturday, I still can't wait to watch Tennessee play! #truevolfan #gobigorange
103383649352814592	negative	I lost respect for #AnnaHazare the minute he sat at "Duratma" Gandhi's graveyard yesterday. India does not need another Gandhi. Vandemataram
101228295659597824	neutral	More information on the new Comme des Garcons fragrance being launched at CHURCH next Wednesday (17th of August): http://t.co/1WZQnE6
100621753209982976	positive	RT @BmoreGoodFellaz #jeopardy Where everyone will be watching the Ravens vs Eagles game THIS Thursday... What is @PlaybookMD ?  #goodAnswer
263973153271865344	neutral	Last hectic day in office b4 3 weeks in ASIA. 1st to IFEAT in Singapore. Then Taiwan, HK, CHINA.Then 3 wks of jet lag!Gets to me every time!
262477406521151488	positive	Watney fires 61 to win CIMB Classic: Nick Watney fired a 10-under 61 on Sunday to rally and win the CIMB Classic... http://t.co/eFmBbfkZ
264198711113039872	positive	@grandvincenzo on November 16 be ready to head to the movies. Breaking Dawn: Part 2. (;
264241159486976000	neutral	@clownpeople Yeah your game against The Ravens was a Thursday night game. Im sure you will pull for The Giants these next 2 games
224623217078308864	negative	Red Cross: Syria conflict is now a civil war: The International Committee of the Red Cross said on Sunday it now http://t.co/2qmInBUf
264074618489417728	neutral	Everyone go to volleyball game Monday at 7 in the AC @jillkatz8 @tesschands3 @WKThal @alxpetro7 @SyddTHEkid
104214530766274560	neutral	@PierreGarcon85 come out and watch THOSE GUYS softball next Saturday august 27th for the COLTS softball tournament,, IT would be great
262723766558261248	positive	Ranked 2nd in the BCS! Which is pretty much first because Bama isn't even real. Just another great day to be a Wildcat.
259358550869024768	negative	UK: Chancellor Osborne try to sneak into 1st class train with standard ticket   - Breaking News Buzz http://t.co/LV8RbngU
256147357874393089	positive	@SarahHanan @NickHughesAW Nice to be missed Maino.  Hope you're having fun. 2nd night all all-inclusive?
263407623141990401	negative	Shit here comes all the hawker tweets. Don't worry Wildcat fans they will all be gone on March 20 (first round of NCAA tourney)
218786804575379456	neutral	Come to the Petrolia Farmers Market tomorrow to pick up the last of your long wknd food supplies!
229203459252035584	negative	@investwatchdog Interested? My EXCLUSIVE: TD Bank denies allegation it aided $7-billion Ponzi fraud; 2nd only to Madoff http://t.co/bQ9QqRQa
262421642007941120	negative	Big Time Rush may be considered to be just a show or a kiddie band but no one can say that they don't have talent or care about their fans!
263025815401418752	neutral	Come to the Eagles Club tonight for Monday night football.
263853498293182464	neutral	Los Poboycitos debut 2 songs from the forthcoming CD tomorrow on WWOZ 90.7 FM New Orleans at noon CST.
262646697681895424	negative	wait if the power is out tomorrow then i'm going to miss a new how i met your mother, NOOOOOOOOO
240039164383469568	positive	Nebraska placed a nation-leading nine players on the first-ever Senior Bowl watch list released Saturday... http://t.co/xXEbwBKQ
261773111475703808	neutral	@olaideolutayo__ omdayss , you're turning sixteen tomorrow , mum sent my cash so im going to do some shopping. anything you want?
263651843727585280	positive	David Letterman had an interesting show on Monday. He is located in New York City. Because of the hurricane he... http://t.co/Rt5ORbLK
260207838461296640	positive	@Bryn2renner forget about Dook now we own that series anyways!  let's "Beat State" this saturday as we continue on to a succesful season.
100032821590110209	positive	@Just1Jerrah vegas here i come yeah watch out las vegas the  bring back the brown sd is taking over at las vegas next week and tomorrow
263293642716872704	neutral	Oscars 1st time at Nursery tomorrow, they can wear fancy dress being Halloween ,damn it had not planned for that. #Mommyonamission
262500699470966784	positive	Mersey side derby then the NFL at wembley. Nice little Sunday lined up.
264224115882348545	neutral	friday- to jack in the box then party at her house. saturday- go to the park and live up the YOLO life xD. sunday- watch movies c:
263992195437195265	neutral	Which players do you think deserve to be in SAF starting XI against Arsenal on saturday's game?
261021661959163905	neutral	New Basics Foundation for January just listed, beginning Monday January 28th - that's right, Australia Day public... http://t.co/hXTClX0E
100200646946455552	negative	Not sure if I want to go to Eng v Holland game on wed, only got tickets coz of Arsenal players, might not feature now :-(
260961069923721216	positive	@ashhellaflush haha Black Dahlia was my favorite song by them too!! I miss you too. Are you still going to miss may I?? :)
222100424767979520	neutral	The birthday boy and his lamb. The lamb's name is Balki. Come out to the Volstead tomorrow for a taste. #ouimybuddy http://t.co/QhjXM968
262376030457704449	positive	... may be that's why BJP is defending Gadkari: they are all in the 'game'. As Shourie famously said, Cong & BJP are now one  party.
256232993394413568	negative	Why all y'all going to NCA tomorrow? It ain't gone solve nothing . Just create another problem.
260973999746592768	neutral	Oct 30 its goin down at the CONGRESS THEATER I will be performing along wit MACHINE GUN KELLY!!!! http://t.co/ZjolDY7P
263815888338317312	neutral	TOK tomorrow is going to be heated over ObamaCare .
110526768821190656	neutral	Gonna go school supply shopping tonight, the only thing I have for school is my Tony Romo folder.. :)
230152573187923968	neutral	@spinenumber408 Then I will refrain from telling you about my plan to watch Mysterious Island with my son tomorrow night.  (He's 6)
176585828447948800	neutral	Premier League Team of the Week: Van Persie makes cut for 10th time this season as Szczesny, Ashley Young & Jonn... http://t.co/r0HWM5zu
230756998218649600	positive	Join us in shops at 9am tomorrow to hear Tom Segal, #Pricewise of the Racing Post preview every race at Glorious #Goodwood. #horseracing
100275029866057728	neutral	Ha! They got pics of Nicki Minaj boobies coming out when she performed on Good Morning America
172260611965718528	neutral	On Thursday over fifty countries and international organisations will come together for the London Conference on... http://t.co/9wWJT5dC
261130606967152640	neutral	Just added a Google+ Hangout to the schedule--see YOU on November 21?! Details here: http://t.co/uMZmyC4l
263236924960026625	neutral	One space has just become available on my Photography for Parents workshop on Sat 24 Nov in Cobham...more details here: http://t.co/fGP822iT
264175462480232448	neutral	I'm tired but I'm not... I may watch the end of Zombieland just because Tallahassee is my spirit animal ADKAHSK;
264190981048500224	negative	SS but they have really good music and it's a very sad thing that Mitch Lucker died may he rest in peace #RIPMitchLucker
255599217555423232	positive	@Matt_Law_SM he is one of the 1st names on Mancini's team sheet and he was one of the 1st names on capello's team sheet and that says it all
109378820536147969	positive	Just seen that Four Lions is on C4 on Sunday night for anyone who hasn't seen it yet. So proud of my big brother; the associate producer :)
247142872162369536	neutral	Photos are up from last Thursday's party with DESTRUCTO, courtesy of edm ORLANDO! http://t.co/LbrMPZMG
263980804462497792	negative	'SOS' not an over the top comedy: Ashwni Dhir: Mumbai, Nov 1 (IANS) Forthcoming comedy "Son Of Sardaar" might be... http://t.co/cUSIitOF
203656695283597313	neutral	Dalken with RBI single to RF scores Cofield from second. Jags lead 11-3 with 2 out in the 9th. Troy pitching change coming up.
263863335408267264	positive	Oh man, tomorrow I'm definitely going to have a Young Life hangover after that dance party! It was so worth it! #totalYLmove #YtheLnot #best
237365243653787650	positive	@piersmorgan Come on Pires! Enjoy the show! Shout out to people in the U.K. and Ireland wouldn't go astray! It's almost 3 am on a sunday!
261405148448948225	neutral	Anonymous' WikiLeaks like Project Tyler to Launch in December: A hacker, who claims to be a member of the hackin... http://t.co/Kzs7yZoX
258227256638455809	neutral	Foes to city, HISD, HCC bond measures emerge. http://t.co/wyFtDKhI The antis make 1st appearance just 3 wks b4 election day.
100576088266256384	neutral	According to reports, Lions rookie RB Mikel Leshoure was carted off field today with a left leg injury. Anyone surprised?!?!
263218057126768641	neutral	@johnfernpalma you came from Palawan right? Just came from there with Danica!! Saw Josh Lao last sat in the airport & he told me! :)
194636321149558786	positive	@DENIESSEsters: Mallshow with the #PBBUnlimited BIG 4 + Wendy, Divine, Deniesse at Pacific Mall Legaspi Landco Plaza, April 30, 6pm! :)
252524419728175105	negative	Apple CEO 'extremely sorry' for problems with new maps: Source: http://t.co/uKRV96Bg --- Sunday, September 30,... http://t.co/SiClT5TP
261967682386137088	positive	Movie night with the kids at church! Watching The Lorax! Couldnt thing of a better way to spend my Friday night!
262744624798511104	negative	but my bday is tomorrow and i have to spend it in Natchitoches away from my family<<<<<<<<<<<<<<<
264117958836633600	neutral	@asampson930 first, *Rondo. 2nd, you know who's higher? Darko Millicic, LeBron James, Carmelo Anthony, etc.
111432022186139648	neutral	Timezones outside of Canada seem to confuse me, but I'm cheering for Tonga in tomorrow's #RWC opener.  At least, I think it's tomorrow.
256254993294827520	neutral	Does Girls Gone Wild still make commercials?  If, God Forbid, this one goes to extras, we may find out.
263099001145028609	positive	Gotta love being Catholic, sitting in a Lutheran church on reformation Sunday. I guess the Catholics pushed it with the whole "pay" for sin
262601342965673985	neutral	@_witnessMyrise uhmmm are you sure ? Cuz Groundhog Day isn't til like February or march lol
244633721108578305	neutral	There is still time to register for "Happiest Baby on the Block"!  Come have brunch tomorrow morning, learn how... http://t.co/K2eziHlx
264145622649692161	neutral	@Rhayne_Mac1 was it Becky? cause she told me about it.. i'll figure it out tomorrow..
261771792497143808	neutral	Its Friday people!!! Get that Kermit the frog cycling feelin ;) http://t.co/V0Rc0goT http://t.co/0NlDUjcW
258771133543874560	neutral	@theprawnguy This Sunday the actual work is just east of Edmonds. But there will be a couple of delays impacting all Eastbound service^DA
230787492394201088	neutral	Join us at The Donkey Show at Adrienne Arsht Center for the Performing Arts THIS Friday! SAVE $5 OFF tickets to... http://t.co/1Y28RGud
264240197498191872	neutral	Britain may be in for a new bout of flooding in the coming months, the Environment Agency warns, as 6 Oxon waterways remain on flood alert.
102601475817078784	neutral	Im getting The Carter IV when it comes out august 29
264160316592619520	neutral	@Webwych QEII in Woolwich. Only 20 mins from home. :) my sister Becky is going to come and stay sat-mon I think.
117186087671181312	positive	Would love to know the truth about Amanda Knox. http://t.co/CqW8Nbw8
262596155450478592	neutral	Hoya, Sungyeol and sungjong with Bae yong jun. look..sungyeol's hand! http://t.co/0qXMyy9J
264211159501115393	neutral	Rodeo Saturday anyone going?
200007533623128065	positive	Just heard my bud @familycycling rode with Tom Boonen @specialized yesterday. #tourofcalifornia goes off Sunday
248724211395338240	neutral	Can you all send Get well soon messages to Tressa she is the co-owner and she broke her leg and tomorrow is her Birthday
251706777488461824	neutral	Continental Senior Living will have a booth on the square for Pancake Day on Saturday. Come by to learn more about... http://t.co/zvNlIyvL
187742971859451904	neutral	Track meet tomorrow South Florence, Timmonsville, and the worlds finnest West Florence #tracknation
261166871062126592	neutral	via @all_bangla_news BPL issues to be decided Nov 1: Bangladesh Cricket Board will take a final decision on the ... http://t.co/1oatDijM
264195065885384704	neutral	@jwwashburn @ebertchicago slow down. He's a lib. U may hav 2 explain 2 him. Remember Charlie Gibson told DonWade&Roma he dnt know abt ACORN.
109409380293816321	neutral	Is this on tv again? "@kugrlover: Most of Redskins starters will sit tonight vs Tampa Bay, but 1st OL will play as long as Beck..."
255259343589609472	negative	@verumserum Vandals in Oakland same as the night before in SF with Afghans grown in. http://t.co/hTOswj4n
253194892338155520	neutral	@Radio1045 I want to see White Arrows at North Star Bar Sat + @Radio1045 Studio Session on Wed!!!
256395784038277120	neutral	On the set of the Axis of the Nigerian Economy, airing every tuesday 8:30pm on NTA international (DSTV) http://t.co/qFvON8Uj
220437745837932544	neutral	@PHSamsungMobile My 4th of July song is 'Ito Ang Gusto Ko' by Francis M. (Best for Independence Day here in the PH) #GalaxyPlayTrackoftheDay
210813049102282753	neutral	@RavensburgerPC: Enter our competition to win a London Children's Map Puzzle just follow and RT.Closes tomorrow @4pm.  http://t.co/lD5hFvUn
249229909917069312	neutral	Edsall gotta play the Gregg Williams tapes in the locker room before the game tomorrow.
100592502184214529	neutral	Just realized Facebook is using Bing Maps now.. http://t.co/A6EePGh  I guess it makes sense given that they're partly owned by Microsoft.
263855905337139200	negative	@DJmizuhara right! Where is the 2nd Vita heaven? Vita is a zombie right now. Maybe Sony is busy on the PS4 and just forgot about the Vita.
263893912748425216	neutral	Also need to be at least accredated in ACT or REBT before the end of 4th yr.
261439085179187202	negative	Born in February close to Valentines. Through all the heart pains I still look for Love guess Imma always b crazy
262905551233613824	neutral	##$$## Black Friday Deals Olympus OM-D E-M5 16MP Live MOS Interchangeable Lens Camera with 3.0-Inch Tilting OLED Tou... http://t.co/LJDqpdlX
100002606734245888	negative	Uh drunk and tired and just remembered I'm going to Ireland in the morning and need to pack. Ireland :(
264195011174866944	neutral	Workin all week, then to Rupp for the UK game Monday. #SoundsGoodToMe #TeamBBN #CATS
258444547493879808	neutral	@PeterVecsey1 Millsap, Al... Favors is getting there and Kanter will.  Is Jeremy Evans your 5th? Idk about that. If Evans is legit, I think
259452211883569152	neutral	JACKALS GOAL! Jimmy Martin sneaks a rebound past Killeen to give Elmira a 2-1 lead. Bushee & Bellamy with the assists.1:09 left 2nd period
209410565007880192	positive	Looking forward to some March Fourth Marching Band madness tonight at @LevittShell
100378714008850432	neutral	Tiger Woods' former caddie Steve Williams made about $140,000 for his work with Adam Scott today. Tiger Woods' new caddie made $5,800 #golf
263039309068767232	neutral	And tomorrow Swindon Town have a date with Aston Villa. Villa- fans nervous? #STFC
197137687239593984	negative	@WoodysGamertag Your mail monday with Fps Russia was such a tease lol
100031826797670401	positive	Good luck and have fun! I'm think about ya'll in Dallas today. @DallasBVB @BrunetteInBigD #Fight #Alzheimers
247522166663417858	positive	The Girl with the Birthday Cake on her in the "Birthday Song" video.. Can somebody bring her to my house Thursday?
262603955954143233	neutral	Bayer Leverkusen are winning 1-0 at Bayern Munich - the apocalypse starts tomorrow
105558608678363138	neutral	Wales' Rugby World Cup squad will be named at 9:00pm tonight, Melbourne time. We'll soon find out whether the... http://t.co/FzPpyp2
247675178597879808	negative	With Krul injured for Newcastle does that mean that Rob Elliot will start in goal? Has he been on bench this season or 3rd choice. #cafc
226474708487532546	neutral	Smooches from Fido: Yea or Nay? - July 6th was International Kissing Day (of the human sort). Later in the month, Ca... http://t.co/ctBrbIFt
263341779531735040	neutral	A little tid bit of info about a local band, Beitthemeans, who will be playing here Nov 23 with Capt. Stabb Tuggo... http://t.co/EVDqoSrw
245211658002259969	neutral	@Q98Rocks Presents: DETHKLOK with MACHINE HEAD, ALL THAT REMAINS, and BLACK DAHLIA MURDER! TUESDAY, NOVEMBER 13TH AT THE VENUE AT THE HUB!
263380138220191744	neutral	Thought i would try the black glasses look....i may need the Malcolm X joints tho' http://t.co/TJC1Zvzx
251399860056625154	neutral	ESPN- Indians fire manager Acta with six games left: The Cleveland Indians fired manager Manny Acta on Thursday,... http://t.co/JPMbt9Cy
100469186538651649	neutral	Lions taken back to den for repairs: IF YOU follow the Pride In Bournemouth trail today, you might be left scrat... http://bit.ly/pq8Pj6
250040196068941824	neutral	@__ChelleBell__: @iRock_1000 @jesssicaannn oh ok. Pick Jessica ass up too when you come. Imaaa just come tomorrow!
226092344540266496	neutral	Pics of the March Fourth Marching Band at the Oregon Country Fair closing out the show Sunday night. Their... http://t.co/x80szqux
256464266952069120	positive	Rg is cleared for the Vikings game Sunday #goodmood   p.s. thank God we got rid of Cuntsniff or is it Cundiff?
253291058279092224	neutral	who's going to the pottstown football game friday?
264246894358843392	neutral	@jazzpastord back to AZ? Won't see you Sunday then?
246363542385741825	neutral	@leonelwell check @mrdavidhaye timeline mate, looks like we'll find out if we found the gym. If Vitali steps up we may have to go too
100637319375224832	neutral	He smokes weed RT @TakeF_Light :O RT @ravensbuzztap Baltimore Sun >> Ravens agree to deal with Ricky Williams http://buzztap.com/-M81AWM
253205086946344960	positive	@ernasty49 Great season, it's been a pleasure listening to Volare in the 9th inning! Mas Ernasty ano q viene!
254313836209917952	positive	Friday night lights at east York lol remember when it was good
