204_ 10	neutral	even if there happened to be identical track titles on the same disc , you could still edit the file name manually and get them both onto the player .
135_ 2	positive	the macro works great for medical photographs and the auto mode is terrific for point and shoot .
233_ 2	neutral	nearly 4000 songs went up in smoke .
115_ 1	negative	it was ( i sold it after a few months ) too expensive for the shots that i got .
262_ 21	neutral	i also got a ur-e 4 step down ring adapter , lc-e 900 lens cap , and the nikon 28mm filter set .
208_ 19	neutral	was it a full moon that night ?
236_ 5	negative	the controls are somewhat harder to use , and there are some oddities about the software tagging system , but most people can live with this .
195_ 18	neutral	while the listing process is accurate for track names ( unlike windows ' reliance on the amg , which frequently gets track listings out of order ) , the results can be odd .
113_ 1	neutral	before i "" get used to it "" , here are my first feelings :
231_ 21	negative	the only thing missing is an option to adjust the balance .
226_ 22	neutral	now i use ms mediaplayer , musicmatch ( free downladed ) , and "" explorer / my computer / grab files from disk c or d into the player "" to replace the mediasource .
228_ 9	positive	accessing files by artist and album ( i mostly look things up by artist ) is easy and intuitive .
173_ 9	negative	1 ) fragile ( i broke the 1st one within 10 days )
125_ 4	neutral	i do n't need to go into exhustive review of this camera .
285_ 12	positive	it receives very nice mms pictures from other gsm phones .
134_ 0	neutral	bought this product about a month ago and have used it in a variety of situations .
265_ 2	positive	i have not been disappointed with my purchase .
143_ 3	neutral	rather heavy for point and shoot but a great camera for semi pros .
294_ 3	positive	technology wise , i think this is awesome plus the speaker makes it even great ! ! ! ! i love this phone ! ! !
170_ 27	negative	the cut-outs for the controls is not thought out as there is too much material in the way to adequately access the controls , especially the scroll wheel .
145_ 4	neutral	that takes up half the space of mp3 's .
236_ 16	neutral	like many others , i had not abused the product , and had tried to take care of it .
236_ 35	neutral	you will be sorry if you do .
161_ 21	neutral	the mediasource itself was flaky ... crashing my explorer twice within the first hour ( the crash did n't require a reboot ) ... but after another reboot , it has n't crashed since .
203_ 20	neutral	a good player at a great price with terrible software that makes ripping and transferring way more difficult than it should be .
270_ 19	neutral	3 battery has to be removed to recharge .
207_ 3	positive	after some consideration i chose the 40gb nomad zen xtra from creative , and i have not been disappointed .
182_ 3	neutral	- price : see above .
173_ 56	neutral	software :
145_ 13	neutral	can 't complain and i recommend it over all the other players , just hope that remote will come out soon .
177_ 11	neutral	it can get pretty lonely out there .
118_ 14	neutral	i always shoot using the lcd panel .
231_ 11	positive	sound : exceptional , though i can 't really compare it to the ipod .
108_ 0	neutral	what else can you say about a camera that works for both of you ?
222_ 9	neutral	the good news is if you can 't get it to reset / reboot you can still pull the battery and reinstall it .
186_ 47	neutral	the headphone jack acts as a pseudo line out jack .
287_ 2	neutral	it allows me to place the phone on the table while talking and working on my computer or other jobs .
106_ 3	positive	4 megapixels is enough for anybody and the photo quality is awesome .
173_ 41	neutral	if you decide to encode at 320 you will fit less on this device than someone who encodes at 128kps .
277_ 19	negative	i am bored with the silver look .
282_ 28	positive	this is a benefit for many reasons ; one being just for appearance , your pants wo n't be bulging with this phone in your pocket .
311_ 8	neutral	bottom line , if you 're attracted to this phone because of its tri-band feature so you can take it abroad , forget it .
285_ 22	neutral	pros :
136_ 14	neutral	based on my used , 1 full charge was enough for at least 255 shots .
274_ 43	neutral	and no t-zones .
213_ 29	neutral	be forewarned .
203_ 9	neutral	does n't always register push-button movement .
162_ 29	neutral	i got it now , and i 'm diggin ' it .
189_ 1	neutral	i did a little research on the web and this is the player i decided on .
312_ 0	positive	this phone is good with a huge array of features built into it .
203_ 0	neutral	pros :
292_ 3	positive	we hardly ever have to charge them , get great reception ( live in chicago ) , and the customization and applications are awesome .
224_ 26	negative	enough people have reported that their headphone jack does n't work after a month of using the device to believe that creative has some inbuilt manufacturing or quality control problem .
302_ 10	neutral	so when the quad bands start appearing i will be upgrading again .
242_ 10	neutral	3 . with low battery , it twice wiped out the entire pictures in the memory chip .
121_ 1	neutral	yes , all cameras except g3 were 5mp but i was looking for a lot more than just megapixel power .
175_ 18	neutral	after all those players have 40-60 gb of hard drive , so better organization is required .
191_ 15	negative	creating playlists using the included software to minimize issue 3 was n't as easy as i would have liked .
268_ 7	neutral	but it works perfectly fine on my parent 's computer .
195_ 33	neutral	in other words , to locate a track using the software on the computer and add it to a playlist , you must know the name of the cd it appears on and then find the track by locating the location of the unlisted cd by looking for tracks that appear on it .
186_ 71	neutral	i am willing to overlook it 's problems to get superior sound quality and low price , although i feel the player has a lot of room for improvement .
208_ 22	neutral	do not underestimate this in your purchase decision .
207_ 19	negative	however , i do n't like to carry it on my belt because the clip is n't secure and the case can slip off .
215_ 46	neutral	4 ) a set of speakers and a wireless transmitter are accessories that will add to your player 's usability ( the latter will allow you to play it on your car radio , home receiver , etc. )
204_ 1	positive	despite its being slightly larger than the ipod , i must say i was surprised to see how small it was when i unwrapped the box !
168_ 5	neutral	i 've got 1200 songs on it now and about 4000 more to go .
104_ 7	positive	5 ) its focusing system is also very flexible .
111_ 2	positive	night mode is clear as day .
110_ 2	positive	seriously , this thing has everything that a pro or expert amateur could want .
201_ 4	neutral	there are a couple things i didnt like though but nothing serious : a little larger than other mp3s but still light , the software takes some time to get used to ( maybe 10-15 mins ) , and this thing would definitely be destroyed with one fall .
204_ 4	neutral	several people have complained of difficulty transferring multiple songs with the same title .
215_ 40	neutral	i did already have mediasource installed due to owning the creative audigy 2 soundcard but i did need to re-install it from the supplied cd as the older version did not have the connector to the zen .
134_ 32	neutral	a lot of my opinions are more relevant for those who are switching from film .
171_ 2	negative	1 . the size is a little bit bigger than the ipod , and it weighs a little bit more .
198_ 3	negative	the only thing i would complain about the zen xtra is that the controls are n't as easy as the ipod 's , or as "" sexy "" looking .
186_ 32	neutral	the top of the player is a thin metal piece that covers up the battery and is removable .
197_ 20	neutral	if you happen to push the wrong button , you can wipe out the order of songs you had put in .
285_ 10	neutral	but that 's not an insurmoutable obstacle .
217_ 7	negative	the only thing i do n't like about this is the cover does suck .
134_ 9	neutral	negative points :
289_ 14	negative	pc cable is too expensive ... $ 50 for a usb cable ?
164_ 18	neutral	the dial on the original zen was perfect and i wish it was on this model .
116_ 1	neutral	i have been watching the development of digicams for years , waiting to make my first move .
246_ 9	neutral	nikon got the final nod for its settings auto and manual along with movie modes , medium; compact size , price , brand name , good software that is included and previous reviews .
115_ 20	neutral	if you shoot in lots of light and desire high quality , this will be your camera .
194_ 8	neutral	not just the transfer software ( which was a hellishly horrible experience ) but also the player 's software .
243_ 8	negative	. images taken indoor were n't so clear .
136_ 15	neutral	i also got myself a 512mb viking compact flash ( enough for 255 shots at full 4mp resolution and max picture quality ) and a used $ 250 3lb subnotebook with usb connection and tons of hard drive space for long trips so i can verify what i 've taken and that subnotebook also saves me from having to buy extra compactflash .
213_ 0	neutral	like many reviewers , i really wanted to like this product .
186_ 68	negative	as it stands now , the case is pretty useless unless you 're packing the player up for travel , or if you load up all your songs beforehand .
193_ 4	neutral	anyway , on with the review .
109_ 8	positive	with a quick spin of the dial you can select shutter priority ( for high speed subjects ) , aperture priority ( for focal length ) or full program mode where the camera selects both for ideal photo quality .
195_ 35	neutral	you need your computer , however , if you want to add tracks to a playlist .
236_ 21	negative	the headphone jack failure seems to occur just about when the warrranty period is to expire .
258_ 10	neutral	for more , you sacrifice weight and size : more optical zoom requires more glass and focal length .
228_ 13	neutral	i personally am not crazy about the looks of either the ipod or the nomad .
310_ 5	negative	unfortunately , the 6610 does not offer voice dialing like my previous phone , but the other features it packs outweighs this shortcoming .
222_ 0	positive	overall , a good buy for the price .
186_ 61	negative	i think this is it 's biggest flaw .
306_ 6	positive	it is extremely light and dissapears in your pocket .
256_ 4	positive	my friends were impressed with the quality of the pictures i took !
302_ 14	positive	great features .. .
175_ 4	positive	for the price and features it is really good .
208_ 25	neutral	i did n't use it long enough to know , but clearly you need to use it with caution .
173_ 37	neutral	i 'm starting to listen to cd 's that i have n't listened to in years now that i have them all handy in one place .
131_ 13	neutral	get the canon 850 printer and an ex flash .
153_ 7	neutral	zennx 's capacity / price ratio on the 30g model ( $ 10/gig ) ) trumps ipod 's 30g model ( $ 14/gig ).
134_ 5	positive	in the hands of someone who does n't , it will yield good results on idiot program / auto mode .
134_ 11	neutral	go out and get a 256meg card , it 's worth the expense .
186_ 25	negative	fm receiver - it has none .
238_ 0	neutral	i first bought a 6 gig nomad jukebox ( original ).
300_ 20	neutral	i felt that i should write this comment asap , as i am quite excited in using its features .
173_ 54	neutral	sometimes you skip past things or have to press it twice to select items .
165_ 1	negative	i have windows xp pro and when installing the enclosed software i did receive a message that there was a problem installing the driver .
218_ 11	neutral	i do n't want to install software and drivers on every computer i 'm ever at .
285_ 21	neutral	i 'd like a camera phone , but i 'd rather have a phone than a toy that takes pictures but makes no calls ...
199_ 3	negative	as mentioned in other reviews the headphones are useless and need to be replaced right away !
186_ 48	neutral	so you can plug your nomad directly into your stereo or use a car adapter , but you do n't get the quality from a true line out jack .
200_ 14	neutral	this explains why you see what appears to be such weird pricing on mp3 players .
226_ 15	neutral	con :
215_ 16	positive	b. fast mediasource cd ripping - takes about 40 seconds for a cd on my pentium 4 pc ( 2.4 ghz with 1gb ram ) with 52x drive .
175_ 7	neutral	not sure , if customer rep. did not know the product exactly , it is still new or they just give an anser which users would like to hear .
162_ 20	neutral	this is not the unit you should use if you go jogging anyway .
273_ 7	positive	the speaker phone is very functional and i use it in the car , very audible even with freeway noise .
268_ 5	neutral	i can 't connect it to my computer though , but that 's a problem with windows me , not the camera .
161_ 15	neutral	once you start sending files , it 'll continue until it 's done or it hits a song that has the same title as another song ... at which point you can skip , skip all , replace , replace all , or cancel .
244_ 3	neutral	worse of all , they claim that it 's some kind of internal damage and refuse to cover the cost via warranty !
170_ 25	negative	it is some protection for the unit , but for useability , forget it .
178_ 5	neutral	i only have one question , when i add tracks to my nomad , via nomad explorer , they are automatically put in alphebetical order , rather than album order .
312_ 2	neutral	i did n't had any problem till now .
270_ 4	positive	3 it is very compact but the controls are so well designed that they 're still easy to use .
151_ 18	negative	although the sound-quality is good , it takes more than good sound on a portable-mp 3 player to result in a good product .
214_ 1	negative	i purchased a jukebox , it got fried while being recharged , they asked for $ 20usd just to look at it and said that they would charge me for repaing the damned thing .
125_ 14	negative	it had a heavier and more sturdy casing .
119_ 1	positive	but canon never fails to amaze .
220_ 13	positive	usb 2.0 transfer is insanely fast .
202_ 3	negative	its far more difficult to select songs and has no easy to use on the fly playlist creation such as the new ipod not to mention it does n't sinc with contact lists , phone numbers , address books , ect. like the ipod ( which eliminated my need for any kind of palm device ) .
224_ 45	neutral	otherwise feedback seems to be good .
168_ 4	neutral	if you arent hooked up to cddb to get the album info i guess you have to manually input the stuff , but that little work will save you looking for songs .
166_ 8	negative	the locations of various buttons on one side or the other is somewhat illogical
166_ 14	positive	- best in class sound
234_ 16	neutral	now honestly , i love this player , but with all seriousness , i would not recommend it to other people , because of the breakdown flaw. and i honestly would not recomment the people of the ipod , that crap sucks big donkey ..... never mind .
161_ 8	negative	the cons are n't really a big deal to me ... except one con that does annoy me is the way it stores files ... no folder structure ... and it 's based on the title of the songs ... many of my songs where seperated into folders ( on the pc ) ... and a few had same titles ... so i had to change the titles to make sure that i did n't have any that might be the same as another .
151_ 9	negative	the player hangs up on file transfer every once-in-a-while , prompting a reset .
288_ 6	neutral	the time taken in shifting from one menu option to other is in microseconds only .
216_ 3	neutral	it 'll take 10-15 business days for them to decide form when they get it .
180_ 2	negative	the software failed repeatedly .
117_ 5	positive	manual functionality is excellent , downloading pictures is quick and a breeze , and the quality is astounding .
208_ 45	neutral	i am not associated with the company , i am not providing a url , but search for notmad and you should find it pretty easily .
258_ 19	positive	they take excellent macro shots as well .
111_ 3	positive	i have not played with all the features yet , but the camera is easy to use once you get used to it .
197_ 13	neutral	lastly , ipod / itunes will not play wma formatted songs .
206_ 10	neutral	so i 'm screwed .
204_ 17	negative	navigation could be better , but there is n't really anything the zen xtra can 't do once you 've gotten comfortable with it .
140_ 24	positive	i was worried that 4 megapixel photos would download more slowly , but there 's no difference in working with the files .
213_ 27	neutral	my gut tells me i 'll also end up buying an ipod .
170_ 0	neutral	i received this as a gift .
302_ 11	neutral	but for now this will do .
116_ 37	neutral	what the photoshop plug-in gives you is reality , and then if you want fantasy , you can use photoshop to create it .
200_ 45	neutral	so if you have xp , be prepared for this and do n't be alarmed .
148_ 18	neutral	( did i mention you can actually change the battery ? hello ? apple ? are you listening ? )
111_ 4	negative	the only drawback is the viewfinder is slightly blocked by the lens .
208_ 4	positive	the zen has minimal stoppage between tracks ; when listening to music that continues from one track to the next the gap is just a hesitation - a slightly audible click ; if i am not listening for the progress from one track to the next i do n't even notice the click .
224_ 42	neutral	there are n't many reviews for the iriver ihp .
170_ 15	neutral	the warranty is 90 days .
229_ 1	neutral	the pros :
290_ 24	neutral	personally i found the integrated digital camera of the t610 to be very nice .
171_ 3	negative	2 . the scroll button is n't the best , as it sometimes can be hard to select .
144_ 9	neutral	yes , the ipod looks in tune with the carefully articulated urban-hipster persona thats become popular as of late , but sure-as-hell is n't worth the $ 200 premium ( unless you are just dying to match your music player with that volkswagen beetle and urban outfitters wardrobe ) .
136_ 6	negative	yes there is a corner lens barrel distortion ( i do n't like it too but no harm done since i always use the camea lcd screen to see exactly what i 'm going to get ) in the viewfinder when you do n't zoom ( when you zoom the lens distortion goes away ) , canon knows this and engineered it that way to minimize the parallax phenomenon ; that is what lmost exactly ot the picture .
226_ 21	neutral	ps : ( mediasource provides similar functions with ms mediaplay such like cd ripping , tagging , music database managing , music file transfering , and more )
302_ 13	positive	great phone .. .
191_ 26	neutral	one minor complaint :
304_ 4	positive	the service from t-mobile is very good too .
200_ 12	neutral	that said , they are pretty sturdy machines and i would n't let this dissuade you from getting an mp3 with a lot of memory .
136_ 18	neutral	it 's a winner .
116_ 23	neutral	the second problem is solved by more direct lighting from the metz ( with the attendant shadows unfortunately ) .
258_ 16	neutral	it is easy to "" focus "" in on the drawbacks , so do n't think i hate this camera .
186_ 12	neutral	this almost made it worth the price alone .
218_ 9	negative	software definitely sucks , hangs up my notebook about half the time , but i do n't mind buying notmad .
303_ 6	neutral	friends of mine are always asking about it and wanting to use it .
184_ 13	neutral	the less computer-saavy might find apple 's software a bit friendlier , though ( i use it at a friend 's house and it does do a lot more for you . )
187_ 11	neutral	i tried to take a cd and simply rip it onto a hard drive and then transfer into the player .
310_ 8	neutral	the phone has several color schemes you can choose from .
199_ 2	positive	the software is quick & easy to use & i found the entire process very easily mastered .
148_ 2	positive	it 's worth it .
244_ 5	neutral	it is a good camera in terms of the function and quality , but take your chance with it because nikon absolutely sucks when it comes to customer service .
138_ 11	neutral	i cancelled the order .
206_ 6	neutral	moreover , they want a total of $ 107 to repair it .
182_ 20	negative	the case is strong and stylish , but unfortunately lacks a window ( now a big deal ) .
164_ 0	positive	i just received my 40gb zen xtra yesterday and i 'm extremely pleased with it .
243_ 0	neutral	the other reviewers have clearly pointed all the good things about this camera , which i do agree .
197_ 18	neutral	here 's where the ipod drives me nuts .
290_ 17	neutral	the 6610 is still easier to use than the other two phones ( t610 , t720i ) .
161_ 18	neutral	so i do n't know what the previous review that could n't do more than 30 songs is talking about .
310_ 17	neutral	the gprs connection is sometimes slow , and writing instant messages with the included aol instant messenger software is a pain , but the other t-zones applications are quite useful .
290_ 28	negative	it also has a stock tracking app built in ( also useless ) and a somewhat useful application which converts all types of metrics ( currency , length , area , etc ) .
177_ 9	neutral	however , if anyone has participated in violent or extreme sports while using their zen , please share your experiences .
237_ 2	negative	the other day when i was listening to a song , it locked up and will not do anything now .
184_ 1	neutral	first there 's the unit itself .
177_ 8	neutral	i have n't checked the resilience of my xtra yet , and do n't plan to .
177_ 0	neutral	originally i wanted the ipod .
173_ 14	neutral	2 ) fm transmitter - so you can place the unit in your car and listen to the unit through your car stereo .
278_ 7	neutral	you have to buy better ones .
158_ 3	neutral	this puts the zen in line with players like the rca jukebox and the whole line of archos players ( the newer ones are a bit better than the original archos jukeboxes ... but i popped out the drive in my 20 gig jukebox recorder and put in a 60 gig drive and use it exclusively as a powered portable usb 2.0 drive ).
227_ 26	neutral	and i read today that you can also have online fill out the id3 , so its not a problem .
144_ 0	neutral	this is an edited review , now that i have had time to use the device .
206_ 12	neutral	if you buy a creative mp3 player , be sure to get the optional extended warranty .
247_ 14	positive	over all a fantastic very compact camera , which made us experience photography on a totally new level !
200_ 21	neutral	review of zen xtra - 40 gb
203_ 2	positive	* slick-looking design and improved interface
132_ 4	positive	also , the display is "" hinged "" and it can be placed in a myriad of positions , or to protect it against any damage .
238_ 2	neutral	the batteries would not charge .
286_ 5	neutral	word ... peace in the east bruvah .
119_ 4	positive	2 . battery life is over 4.5 hours , compared to about 2.5 hours for the g2 or the 2 hours for most nikons .
227_ 10	neutral	1 .
202_ 10	neutral	before anyone says hey you have n't used the product , i have , my friend received one for christmas instead of an ipod and has since envied me for my vastly superior product .
246_ 12	neutral	a few things that might make it even better :
234_ 8	neutral	if it does , ill give up .
173_ 22	positive	overall i like it .
155_ 15	positive	the sound quality is also nice ... after i hooked up my sony headphones instead of those factory earbuds it comes with .
290_ 25	neutral	my girlfriend is paranoid when i am not around her and i just take a pic and send it to her on the spot so she can regain her sanity .
207_ 16	positive	i 've played around with the equalizer settings and am satisfied at the range of choices i have there too .
148_ 15	neutral	( i would have appreciated having a firewire plug , however )
237_ 1	neutral	i bought the nomad when i went home on leave and it worked great for about a month .
138_ 3	neutral	i called them twice and both times they said it is "" about to ship "" .
191_ 10	neutral	i have my mp3 's stored on my workstation .
242_ 11	neutral	i used lexar 256 mb and i still use it which means nothing is wrong with lexar .
290_ 37	neutral	personally i like the samsung phones better because i found myself liking the flip phones so much more .
305_ 16	positive	i have not had any distortion problems with this phone and am more pleased with this phone than any i 've used before .
208_ 40	neutral	i experimented with installing mediasource on 2 other computers at home and it worked fine .
162_ 21	positive	it still fits in the palm of your hand , and it 's not heavy .
197_ 33	neutral	if i had to do this again , i might get the 40gb zen .
248_ 8	neutral	anyway , i ended up purchasing the lumix .
119_ 11	positive	you could take a picture of a stone glinting in the sun and still avoid the shining glaze and get the contours right .
236_ 27	neutral	you will have a very expensive paperweight .
193_ 3	positive	not only is it more affordable , but its a better player for windows , which is what i have .
251_ 3	neutral	if you cant get great pics from this camera its because you havent read the manual .
222_ 12	negative	at the very least , a sturdier more protective carrying case would be nice .
219_ 2	negative	always carried it in a case in by briefcase but one day the hard drive just zapped .
105_ 8	positive	the menus are easy to navigate and the buttons are easy to use .
148_ 12	negative	it could be a little bit bigger , but it 's easy to get used to .
256_ 7	positive	battery life is ok .
173_ 52	neutral	scroll bar :
123_ 28	neutral	cameras capture moments .
130_ 3	neutral	for those of you who already bought this camera , i suggest you buy a hi-ti dye-sub photo printer .
301_ 9	negative	although i find it more convenient to use 1-touch dialing , this phone does not have voice dialing .
