247743169167511552	positive	If you are in #OrangeCounty / near Laguna Hills, please come visit me at Awakenings this Thursday at 7PM! http://t.co/nDH2xQRT
241664946692296704	neutral	@rav_sagar @spencermorgan93 they will have the last laugh when we get to the Carling Cup Final.. result may vary.
239184804149616640	neutral	I'm going to Anthony Hamilton at DAR Constitution Hall in Washington, DC - Sep 15 http://t.co/PEcRmVHl
232072967826337795	neutral	Sport: Calling ALL Tayside football fans! The #wave102footballphonein kicks off at 6pm on Wednesday! join the debate! #DUFC #dfc #SPL
232904049362628608	positive	Reminder- We hope to see you tomorrow night at Volstead! details on our FB page at https://t.co/Cj5uQD12
263827162891698177	positive	i honestly cant wait to get out of greensboro with @HannaBananas94  tomorrow!
264054648640524288	neutral	RVP shit on AFC by moving to MUFC, yet served them brilliantly over 8 years, will the fans give him shit on Saturday? #cantwaittofindout!
261437005261570048	neutral	My photos up at Photoplus and the Olympus booth. Come out and say hello! Ill be here till Saturday. http://t.co/iIAxfJn3
235446383891582976	neutral	#MentionDateIWillNeverForget.. The Saturday Of the Strawberry Festival, Which i think was 6/17/12
256746460417249280	neutral	@russellthevoice Russell u beat me 2 it lol I was gonna tweet about the Classical Brit Awards being on this Sunday xxxxxxx
257906348728143873	neutral	Waiting for my training season with Dawgs tendy @aaronmantle31 ,may as well watch Goon while I'm waiting
263719007146872832	neutral	@LiamGib We've got the sponsor form and box on our desks. I think Becky is going to send an email tomorrow.
264233544178597888	positive	-Saturday night be at the Barack Shrine in Monroe ! #TeamLCF gone be in full affect ! #GSU #JSU #ULL #ULM #LaTech #LetzGetIt @LaCollegeFest
262931020192546816	negative	Distin's derby disappointment: Sylvain Distin has voiced his frustration at taking just a point from Sunday's Mersey... http://t.co/Fob4ZxLR
103368845988872192	positive	@Julia_White You too lovely! I was like a big kid. See you tomorrow for X Factor fun x
263505544353034240	positive	Like a good neighbor State Farm is there...with a check for the damage to my truck...hopefully tomorrow!
100757232685301760	neutral	@lordhebe hours are 9:15 to 13:30 (GMT+1) for the public. As you're in Turin, they may refer you to the Milan embassy, and here's their....
264125591337463808	negative	AFC away fans on Saturday. All this stuff about the 'she said no' chant. It's bollocks. When he has the ball, just turn your back on him.
241118272823648256	positive	@cerysmatthews Saw Bruce Springsteen in June. "Wrecking Ball" great but "Jack of All Trades" v moving song of life in the Credit Crunch
263968514048667648	neutral	On the show now, TSU HC Rod Reed, his Tigers take on Murray State on Saturday.  TSU is 8-1 (4-1 in the ovc)
246465722543398913	neutral	I have either just made an awesome king cake for work tomorrow...or the worst darn thing to ever hit a persons mouth...we shall see
261260809861210112	neutral	- Joseph Prince (FB):When your problems were in your hands, the weight and the burden may have crushe...When you... http://t.co/ZnKsuOPt
111868924253048833	positive	RT @Fearnecotton: Also back to school special Celebrity Juice on itv2 tonight! Oushhhhh
100336547433431041	positive	RT @sheilatweetss: #rungeordierun Should be given a HEROS welcome at the Arsenal game on Saturday.@nufcfans @NUFCOfficial
264204267370450944	positive	Cant wait to see "Flight" on Saturday, Denzel is one of the best actors in the world alongside Leo and De Niro
102734017216000000	positive	Yay inbetweeners is in the cinemas august 17th    Should be well funny
256796300031442945	positive	Sacha Baron Cohen to star as Freddie Mercury. He's the only one for the role, IMHO. http://t.co/CUvazmDx via @Zee
259147552996327424	positive	Get the Skinny on Verizon announces Ice Cream Sandwich for Motorola Droid Bionic: After waiting for what may hav... http://t.co/tlq6roQG
210480183331926016	positive	Won tickets on the @RoeConn Show with @RichardRoeper to see @TomDreesenComic at @CDandME this Sunday. Tom's from Alsip, right? ;-) #Harvey
111375934975787009	neutral	So the dude on shameless last night is lucien from big brother
175166573672280064	neutral	And apparently it's also National Bieber Day (young Justin's 18th birthday) as well as St David's Day and #worldbookday
100487712041209856	neutral	@elelibs there's a shop in Auburn called 'Morning Glory' as well. Don't know if it's a toy shop!!! #unbelievable
259561711005212673	neutral	Watching the 2nd Ghost Rider film is like watching Nicholas Cage go through a drug induced psychosis.
172468232459001856	negative	How have I missed that today is National Margarita Day?!?!?  Kinda doesn't go with Ash Wednesday.....
261231064578678786	neutral	THE SKINNY: Breezy may be getting it from RiRi AND ex, KT. Getting that cake! cake! cake! and eating it too. <3... http://t.co/S7I4RVCe
101482478065291264	positive	I would love to watch Vampire Diaries tonight :) and some Heroes! Great combination
244949313900388353	neutral	Imaaa be quiet all day tomorrow ...
259749230879576064	positive	Thank you St David for $7 parking on a home game Saturday. #aff2012
256362567792992256	positive	Clever! || Australian captain Michael Clarke teams up with Louis Vuitton in special cricket trunk design | Herald Sun: http://t.co/Cc1Ctr9Q
247138535457570816	positive	My Gosh! Nandito ako na NIA 3 ang guess what? Andito si Mon Tulfo!! Lolokohin ko nga! Hahaha #AnnabelleEnglish101 i shall play with him!
261600464120983552	positive	@AlexaHorannxx aww! Im just kidding with you! ;) and YEEESSSS! You don't have school tomorrow? Thalia doesn't either!
242816476501917697	362841166	neutral	My car ride to school tomorrow>>> #mexicans<3 @seximexi44 @JF_Gnarly34 and Estella :) im the only white girl
115674753829830656	positive	I have 2 say I thought the #emmys were great tonight. Melissa McCarthy, Peter DInklage, Kyle Chandler, Ty Burrell, Julie Bowen- all amazing!
263438077480022016	neutral	@GiniMartinez just scheduled it today for this Saturday! Quite possibly a day trip with no overnight stay in beautiful Covina.
102674718359957504	neutral	RT @quizderek: Elvis Presley's 34th death anniversary is on Aug 16. 14 Aug, Today is the independence day of Pakistan.
262287038278152192	positive	Monarchs II 2 v 1 Madras goals from @kendo_22 and Capt. Teare in the 2nd half gave the second team another great win #midland #hockey #fig
201027798251479042	neutral	On Sunday Come to @NikkiBeachMiami - Jason Vernau - Say "TRAVIS's LIST" at the Door for FREE Entry 4pm-Midnight or Reduced $10 Midnight-2am
111426001124343808	negative	Why oh why does Toronto's Nuit Blanche have to be the same night as a wedding I have to attend?!? #snbTO
256827998165151744	positive	Big Redd, Young Savage and Reed Dollaz will be on stage tomorrow night! Philly it's Going Down!!
103731032200716288	neutral	@CXClausen If you can wait until tomorrow, Cowboys and Aliens comes out.
217704485198372865	negative	@KALi_BORiCUA real shit ray Allen meeting with the Knicks tomorrow
252897478272249856	neutral	Bucks backcourt mates Brandon Jennings and Monta Ellis had a "little brother-big brother" talk on Sunday, as Jennings described it.
258012862646206464	positive	@SUJagAlum I really and positively dgaf about Ted Nugent's Bronco rebuild. In fact if I see Bronco with zebra stripes I may have to stfosb.
246382892685615104	positive	Eric Arc Elliott may be the best rapper in Flatbush ZOMBiES.
261602737693814785	neutral	I recorded The Wanted on Celebrity Juice so if anyone missed it, I'll stream it again on Saturday if anyone wants to see it?
262585396666458113	neutral	Low-fat Oasis - Edmonton Sun: Low-fat OasisEdmonton SunPoor Noel Gallagher -- up there all alone with his new ba... http://t.co/z5dpTxD4
103112103824601088	neutral	RT @DuaneBrown76: RT @DerrickWard32: Monday Night FOotball vs the JETS 1st game of the year lets see what we are made of. Road to Indy f ...
262318278364524544	positive	Muse on Jonathan Ross  brilliant.        We have some exciting news about Muse to announce Monday  from Gotham Records
264244428963733505	positive	@HBBlanks @kaycegilman20 sparks fly by Taylor swift may or may not have been in the background. It was moment I'll never forget lol
264217191191302144	positive	its my Birthday on the East coast now. I was born EST, so I get to party now.   I live on the west coast so the party will last till Monday
221870336273154048	negative	@Joe_Sardelli Sorry that we couldn't get you in the party. The guys I was playing with refuse to play ground war. Open Lobby on Wed.
101949677515177984	neutral	@zavvionline the 1st Deus Ex game was only ported to the PS2 home console. #DeusEx
214864129553477633	positive	I rented Sherlock 2 and Ghost Rider 2 this last friday! They were both good! I rented Journey 2 last night! It had a really cute guy in it!!
232504247130935296	neutral	Oneil's Barber & Beauty open right now...449 Acadian thur (next to chicken shack) $7 All Even with a line Back 2 School Special(domino only)
262444330390798336	neutral	Just found out about the @theatreeagles production of Dickens performs A Christmas Carol, surely a must this December. http://t.co/mEhqFeCX
263700470143533056	negative	Fucking part time fans. Where were you at Boro away on Saturday?
264211478670884866	neutral	@katec311 Thursday & Friday nights usually! Kinda depends with school though but I'm usually free those nights
103399578719621120	neutral	RT @djlogansama: After Hours tonight - Jammin, Dimples, Durrty Skanx, Harry Shotta, Byron & Romo audio download: http://t.co/gV3p2wn> BIG!
256340930414645248	positive	Fabio Capello: "From what I've seen these days I can assure you Russia are capable of getting a good result vs Portugal tomorrow". #cantwait
264162367263346688	positive	Well, settled in to the next temporary residence. I have some very nice coworkers. Going to check out Long Beach and the apt tomorrow.
242273480874266626	positive	Won the 400 and the 200 and came 2nd in the 800 at Tayside and fife championships!
101197408385503232	positive	A win over England on the 5th day of the 3rd test match will give us one more reason to celebrate the INDEPENDENCE Day! Via @Sachislife
260949777687117824	neutral	Crazy I was in a meeting with an old NBA player that was picked 3rd before Larry Bird
263354499370979329	positive	Delicious grilled cheese with ham cooked in Sun Dried Tomato, Parmesan & Garlic oil from Olive That in Montclair http://t.co/Wf0pNsHQ
255165563444285442	positive	COME TO THE CLUB MONDAY NIGHT! Hope to see you there! OPEN MIC NIGHT 6:30 - 9 PM at IGUANA located at 240 W 54 St, NYC http://t.co/TXqjxfqH
234029530820526080	positive	Thanks everybody for the bday wishes!! Gonna have a big celebration tomorrow at Ostend!!!  CHERRY MOON RETRO... http://t.co/fJvQAPwH
258019269097431040	positive	Excited about the bump in RAM for Raspberry Pi. Such a nice surprise for a Monday. : )
100001071937748992	neutral	RT @RedArmy49: Therefore i still expect Arsenal to sign Jag, but Cahill is next option, Bolton are just willing to talk to Arsenal on mo ...
100741944627560449	neutral	@JasonLaCanfora: Free agent WR Jerricho Cotchery, formerly of the Jets, traveling to Baltimore tonite to begin visit with Ravens. #whytho
264200538864906240	neutral	I don't want a love like Jonny and June, I want a love like Blake and Miranda.
216924737501265920	neutral	Dr. Mohamed Morsi announced as Egypt's first elected President after the glorious 25th of Jan Revolution..
264259973775769600	negative	@PierceTehV3il_ how excited i was because dec 9th i was going to see Asking Alexndria, SS and MMF but i came home and found out what
251338852277563394	neutral	Kalispell mail processing center to close by March: KALISPELL -- The U.S. Postal Service has announced it will c... http://t.co/Iug1D3XX
100893739857354754	positive	Good Night guys, not in the mood for anything right now :D Enjoy today! To all Singaporeans, Happy Independence Day!
224222360570564608	positive	@Jangleton Come to Book Swap on Thursday. All of Twitter will be there. All the best ones, anyway.
251120807957364736	positive	Jasmine Curtis-Smith is nominated as Best New Female TV Personality (for Nandito Ako) in the 26th PMPC Star Awards for TV. Yay! =))
111345751807889408	neutral	One of the main influences for @GOTK's 2nd album is Michael Jackson... No joke.
100816091399462912	neutral	Camp Notebook Day 10: The Raiders took the field for their 10th practice of training camp and started to prepare for... http://dlvr.it/fRj82
262998464739282946	negative	Uniontown all ready has a 2 hour delay tomorrow smh Brownsville is gonna be the only school that don't have shit
264077482016251904	positive	@scooterbraun Im from South Africa and will be leaving the States on the 5th  of Nov, really wanna see JB!!! Life would be perfect then!
264163089245691904	neutral	Nov  1, Las Vegas Massage Gift Certificates - Las Vegas massage gift certificates for the best massage anywhere in S... http://t.co/2jefKASF
100591108240838657	neutral	Did I just see what I think I did on @SportsCenter? Real Madrid signed a 7th old? #wow
263001060451438593	neutral	@CryerRovers Any truth in this interview with Harry Redknapp tomorrow?
259825309275283456	positive	My Heart is Gold, my Twat is glass, c'mon baby can't ya see? Yes..a glass twat..better known as a "womb with a view" ;D LOL!
264187448853151744	neutral	Calling all voters, I'm calling on Nevada,Florida,Ohio,Tuesday night is the night u guys will i repeat will shine for the president lets go!
250219930623037440	positive	@Daniel_Dennehy Just saw u with Cannavaro, didn't know u were here in Italy! Congratz for being the 2nd best in the world!!! #Legend
257193595201789952	negative	The U16s game with shotton has been called off due to a waterlogged pitch, so they're now going to llani on wednesday night. Sorry lads!
263851452500410368	positive	@JamieLynnDrohan Will miss ya on the Red Carpet tomorrow!! #Nashville
253870956018294784	positive	omg wait, Bel Ami comes out tomorrow! I'm going to watch it, finally.
103145127261904896	negative	Tuesday will be my last day in Florida :-(
106782817962311680	positive	In an ideal world Oregon and Boise State will win Sept 3rd and give power to the PAC NW! #GoDucks
255758962312486912	neutral	@bacana1 MT@wingoz: The Baltimore Sun reporting that the Redskins have just Cundiff-ed Billy Cundiff"
259446983733964800	neutral	might as well go ahead and download the parade tracker app. Think a Zulu float may show up before the bus.
253213326627176449	positive	Redlicki/Tahir are set to play Wichita State duo of Gregurovic/Nicol at 5 pm ET in the 1st round of doubles. #TulsaITA #goduke
224705328644755456	positive	Blessed is the heart that bends, it will never be broken--- Lucas Scott Good pre-bedtime OTH after a busy day! Can't wait for tomorrow #zzzz
212255275858657280	positive	Just met with CJ, banjo player in @MatrimonyBand! Come out to Neighborhood Theatre on June 23rd for the concert! You won't want to miss it!!
263896714686124032	neutral	@Vinay_Kumar_R, part of the India 'A' playing XI, will be available for the Ranji Trophy opening fixture against Baroda starting tomorrow.
249004311764406272	neutral	Western Force kicks off new Super Rugby season on the road - Herald Sun http://t.co/RD6If1yI #Melbourne #News
264208965196455936	negative	Hearts throbbing, might not make it to my 21st... #SIKE! Better watch out world, Courtney's here & no ones stopping me.
255967602873085953	positive	May the odds be ever in your favour Aussie Directioners, #Hot30sGo1DenTicket
102463043530797056	positive	@iansomerhalder @paulwesley @ninadobrev you know what? Vampire Diaries starts in Germany on monday! I can't wait!
261527660126171136	positive	Campbell must feel like he's won the lottery tonight. Sat in SJP, on a European night, with Krul, Coloccini, Cabaye, Ben Arfa, Ba and Shola.
229050961316954113	positive	I'mma probably just watch "Good Deeds" for like the 3rd or 4th time!
248505895699484673	positive	Ni**as In Paris. May be better than the original. http://t.co/KO3cUPyR via @devour
261220940669677569	neutral	gunna snow. WC says Winter Storm Watch till 5pm tomorrow .. it was 80*F yesterday
264168503639150592	neutral	Watching the Eli young band on the cmas right now.. About this time tomorrow I will be watching them in person in Starkville!!!!
100092691462893568	positive	i quoted nicki minaj tonight and i'm sorry and i know god will forgive me
101950699180523520	positive	...Gandhi said, 'Be the change you want to see in the world.' In this simple sentiment we can find hope... http://t.co/7MMWwgt
263841914191749120	neutral	Hoping I can somehow make the Volleyball game tomorrow #please
252699728666558464	neutral	Cong to hold rallies on FDI. The first rally will be held at Delhi's Ramlila ground on Oct 28, to be addressed by the PM and Mrs S Gandhi.
100032742246449152	positive	@justinbieber is creeping! RT me Justin LOVE YA so excited for the concert in october MEXICO LOVES YOU<3 u inspire me
101526088089481216	positive	Looking forward to ring in the new school year @uncsangam for Aladdin...UNC Memorial Hall, Sat Aug 27th 6:30
264179454211940354	positive	@jarediero aw lucky, I was sat on my aunt's couch somewhere in Germany at the time watching the livestream and bawling my eyes out omg
100167560519094272	positive	@steffmcshane hiya good morning raining in scotland today mite just have a pj day ;]
262069754737610753	neutral	Emmylou Harris & @danlanois singing "The Maker" to close the entire 'Wrecking Ball' performance in Nashville on Wed. http://t.co/h9ECZHc5
213342817081233409	neutral	Several new series available Friday at the All Arts Market at Neighborhood Theatre! http://t.co/ikr4u6Sd
104245039835783168	positive	Heading back to Chesterfield for a job tomorrow after an intense & amazing few days in Derby with the @lostalone lads! DVD is looking ace!
169830605201211392	neutral	@ProductiveOuts If you find someone on D-1 please share.  I may try to do some with Wichita St. and their opponents this season.
107702559711571968	positive	comedy central is a good look tonight
260101904296718336	neutral	@genuine_rp true. First is valid (I have 3). 2nd is misguided. More likely to have it taken & used against you, or used ala Trayvon Martin
259714773934026752	neutral	Perry: Morgan State is beating Howard, 7-0 at the end of the 1st quarter of Howard's Homecoming football game.
259802064803217408	neutral	What will happen to #PortChuck if Port Charles voters vote to change the name of the city to Port Pine View on the Nov 6th referendum?
262977992077221889	neutral	Well that's it, the very last one. That may stop you. - The Lorax
264152086290264064	negative	@LiterallyFedUp 1/2 white? does'nt matter;Malcolm X may hv been as well.Still no specifics.U ppl don't hv ideas except make bombs killem all
103112754122063872	negative	@sardesairajdeep Why govt loosing sleep over Anna Hazare's fast. May be they don't want another Gandhi like figure.
248568179272589313	positive	Long Princeton (and Diggy)  #imagine : Happy Valentine's day (yn)...  February 14  It's been 9 m http://t.co/0S4VVpy2 via @Nounouche10
100123913681514496	neutral	Jackson back in camp Monday @ESPN_Colin you ready to see the Eagles lift up that trophy!
261310617602904065	neutral	@InVinceAble_45 Yeah with Miss May I too. It's on the 1st at Backstage Live
263866464304508928	neutral	So happy NBA is back. Feeling a bit disappointed in the Nuggets tonight but the Laker's 2nd consecutive loss helps to compensate.
252727217841397760	positive	@AcousticCrowds DM me your number and I'll send you a pic of the dress I'm wearing Wednesday. It's perfect for being the Black Dahlia.<3
256812865300873216	neutral	Sacha Baron Cohen in The Lesbian? SBC 2 make film on man offering $65m 2 any man who could wed his gay daughter #jspace http://t.co/97O7AsCP
210663845025431552	neutral	Enter our competition to win a London Children's Map Puzzle just follow and RT.Closes Friday 8th@4pm http://t.co/4JP1Zs6y
259281045873123329	positive	Stimulating & promising speech of the World Bank's President Jim Yong Kim in the Annual Meeting held in Tokyo on Oct 12 http://t.co/4cg3LMJR
259452211883569152	neutral	JACKALS GOAL! Jimmy Martin sneaks a rebound past Killeen to give Elmira a 2-1 lead. Bushee & Bellamy with the assists.1:09 left 2nd period
263817956088221696	neutral	The regular-season opener Thursday between the Brooklyn Nets and the New York Knicks, wh... http://t.co/kvPXXch4 :: http://t.co/ZxIgzMCV
259938141878759424	positive	@ChestersShop This is one of my favourite things about Chesters, the pizza's taste fantastic! Alternative to a sunday lunch?
262048615449645056	negative	Dana gets two false starts called on them trying to punt, 3rd one gets returned to their 18. Laguna Hills scores with 30 sec left, up 31-27
261966259892142080	negative	I was going to move to Siberia last Wednesday.Now I don't have to.Siberia has moved here.It's bloody freezing. #heatingtime.
259175928662474753	neutral	Will be at Manly Market & Mittagong on Saturday. Crows Nest  Fair and Kiama Market Sunday.  Hope to see you there
256769689361997824	neutral	We're playing with Jim White on Tuesday! Static on the Radio por favor? http://t.co/C8E8JIct via @byt @jamminjava @JimSuperwhite #DCSHOWS
246064617514737664	neutral	BMP is coming to the Volstead! Grand opening HH this Fri 5-9. What are you gonna order first?
262578031267311617	positive	Daniels good-humored on comedy show: Indiana Gov. Mitch Daniels was a good sport Thursday when he appeared on "T... http://t.co/5idcFj3B
264172491650514944	neutral	Amazon has deals on Home Theater items on during the countdown to Black Friday. http://t.co/u84VkEEo
227840994090037248	neutral	An Evening with Maya Angelou 7:30 p.m. Oct. 4 in Elon University's Alumni Gym. $12. Tickets available Sept. 13. (336) 278-5610.
256217193421869056	negative	Lmfao , she gone die . All the niggas gone be at NCA tomorrow
262987035558682624	neutral	@pvoelkel In your defense,my love of Dickens' original may be regarded unnecessarily high in my eyes because of the history I have with it
261847409766846464	neutral	@TheLitPlatform An informal networking day about digital publishing, Bethnal Green, 8 Nov.... http://t.co/a6N5XH10
263338193968037889	negative	A 19th journo murdered in Somalia / Tokyo 2020 unveils stadium design rivals/ Why Madrid says it needs 2020 Olympics / http://t.co/ylSLefYT
249989252144836608	neutral	@tiffzero Hey got your tix for Looper on Wed :) it's 630 at Sylvia Park - do you work in town?
248932056250331136	neutral	Estella has become really dramatic all of a sudden. It's really cute now but I feel like at some point it may become a problem  #girls>boys
190307740156051456	positive	@dougwead1234 Doug Wead: Owners of the MSM are the "Prince of the Air" Ouch! Feel the burn. Too clever. =) #RonPaul
263853674479116288	positive	I'm taking the SAT at Bob Jones. lol I feel cool.
255403512081551360	positive	Congrats to team Spleaders for winning the Kickball Tournament that was held October 6th! http://t.co/D3gwQrgI
262773238592053248	positive	@MissPawee yes, it's doable. I was at BKK from march 1-4 at night then flew to europe on march 5 in the morning.
192417988778016768	neutral	Knicks vs Celtics is just a 3pt shootout New York has 9 and there's 5 mins left in the 2nd
262531324877877249	neutral	After the 9th of November, i'll be partying like the teenagers in Project X.
100999772130906112	neutral	So if the Premiership is called off on Saturday who is for Inbetweeners?
100033024174985216	positive	@Social3i Do it! With all the shade, it's the perfect summer outing. Plus the penguins, lions, bears, wolves... were all very active today.
263980804462497792	negative	'SOS' not an over the top comedy: Ashwni Dhir: Mumbai, Nov 1 (IANS) Forthcoming comedy "Son Of Sardaar" might be... http://t.co/cUSIitOF
100170544636375041	negative	Hello there, I hear that the stinking working class,were rioting in London last night, do you see why I'm in Italy, bloody Rif Raf.Hear Hear
106434672107597824	positive	Must get all my work done and ahead with cleaning my house before 10pm so I can have a night in with the Sons of Anarchy
208394662195642368	neutral	Galaxy Foams painting sneak peak. Finishing in the morning. Vid tomorrow night!  http://t.co/U8TD96f4
263992195437195265	neutral	Which players do you think deserve to be in SAF starting XI against Arsenal on saturday's game?
264187979340316672	positive	Another awesome tweetup (this time in Cebu) with a Rafa-tard! Great meeting you @scorpio1641! Thank you! See you, Monday. Zubuchon on us!!!
201244078304800768	negative	Just met the players for the 1st time: this Roger Johnson fella walks around like he owns the place. So I debagged him & flicked his helmet!
264228902195589120	neutral	DEPARTURE of ship: AMS 111 Port: ABU DHABI Time: Nov 2 2012 4:47AM (UTC) (Time of arrival/departure is the time the vessel approa...
100668742882705409	neutral	@PsychoSix-Smoker Beohner "got 98% of what he wanted."  Fact: Dow down 634 today and Boehner OWNS every point. #p2 #fok #maddow #teaparty
262129098288152576	neutral	Go try and win a PS Vita at the Lollipop Chainsaw Event at Fish & Co. @ Glasshouse. You may get bitten by zombies, but it's a PS Vita!
264113138037821440	positive	But a very happy 21st birthday to my niece's Mommy, Jess. I love you with all my heart and Miss Payton too (who will be 1 in 12 days.)
262975345106509825	positive	Porto is even more amazing as the sun sets... http://t.co/Fz0tXHuF
264216473063550976	neutral	Buzzer beater jump shot by Parker. On a primetime Thursday game...NO WAY that CAN happen! How great is the NBA?!?!
262544381616197633	neutral	These are 3 new Avril Lavigne songs from the 5th album:  1. HUSH HUSH: Songwriter/Composer: David Hodges,Chad Kroeger & Avril Lavigne.
