239817382045044736	neutral	Look for Monday's edition of The Record for full package of stories, photos and more about Friday's plane crash
261239838869704704	positive	I'm SO excited I'm gonna meet Buddy from Cake Boss at Ruth Eckerd Hall with Grammy on Jan 12. Can't wait !!!! http://t.co/mI1trUlp
175868913911988224	positive	McIlroy keeps a steady hand during the Honda Classic second round | Golf Channel http://t.co/Oqnj1t0I via @golfchannel
262167771717177344	positive	Mum couldn't help but laugh at the fact she's sat on this boat watching Dt Seuss's The Lorax with her 18 year old daughter :) #hellyeah
100138966010966016	positive	MMA - ESPN.com: ESPN Video: On the night of his explosive win, Dan Henderson relives his ...espn.go.com/video/cl... http://bit.ly/pVuGAC
100016387854053376	neutral	lol cause we went to the zoo today & saw lions and tigers and all lat
259099866574245888	neutral	PSA: Since I got my cast off, I will be taking my 2K talents to the Playstation Network and asking for names to play me Saturday morning!
100034443431002112	neutral	Torre Calls for More Respect as Player Feuds Cross Line: On Saturday morning, Torre's iPad chimed with news of a... http://bit.ly/oEme0C
264193430513651712	positive	@SamBraik96 won twice on the last day to stay up. Finished 10th and carling cup final. Sent West Ham down!!! Lot of good times, more to come
100230063630467072	negative	@piersmorgan @flintoff11 Reminded you of Arsenal's traditional Februray-April breakdown? Get off your high horse...
263948238170763264	positive	Happy Birthday to the coolest golfer in Bali! @tjvictoriacnd !! :) may you become cooler and cooler everyday! Stay humble little sister! Xx
259461958074507264	neutral	Friday nite after the DWC reading raided Sound Garden...3 DVDs & a CD 4 $20! Cruising home 2 Raphael Sadiq. Friday note in CNY.
221594970858061824	positive	Today is National Kissing Day coz it's no work day tomorrow!!!
100364586548600832	neutral	@Mr_HighNotes yall going to lions park tomorrow?
263715846407483392	neutral	I think I'm gonna head to Ulta tomorrow and see if they carry the Red Carpet Manicure gel polishes in stores. I want black gel polish ASAP
100825084763185152	positive	@justinbieber I'm so excited because you are coming to Mexico City in October! I love you Follow me please #NSN
171043953087483904	neutral	Just witnessed the 1st ever black king of Endymion
108291720541777921	negative	@Hopesolofans1 @hopesolo I hope my iPhone gets service tonite to find out about DWTS cause I have no power from the storm. No tv no nuttin
100001422170529792	positive	@jordanknight Hope u have a great show tonight. Me & the Chi/IN girls are so excited to see you in London tomorrow!
100003668115460096	neutral	Wantin to go out tonite....but no one to go out with so i guess i'll be on netflix  tonite
258292690951761921	positive	See Robbie Keane jumping off the bench claiming that 4th goal!! #greathattickfromrobbie
215167745426333697	neutral	July 8th... It's goin down at DAR Constitution Hall... I'm gonna make this last part rhyme... MB Y'ALL!!!!!
263961750142062592	neutral	@xBecx92 it may be Indian time tonite Becky :-) xx
106812661567733763	positive	can't wait to see the anderson silva fight saturday woop woop
262155234435018752	positive	How badly I miss Andy Carroll. Knowing that the derby game is tomorrow, he always played very well and scored against blue noses.
264185791692025856	neutral	Reruns of Big Bang Theory > CMA Awards. Everyday of the week & twice on Sunday.
261731552520724480	positive	Hello man in pointy, multicoloured, snake skin cowboy boots, a suit and Axl Rose's hair, you've made my Friday heart even happier.
254809549494681600	neutral	the sports arena office.. (:"@AdrianaGee Anyone know where I can buy arolladora tickets? For pico Rivera? On the 14th?? WSS sold out:("
257392425390194688	positive	Michael Clarke looked reasonabley comfortable against the Gordon CC 1st Grade attack today.. #player #cheersforthenetboys
263433841400745984	neutral	Trip to Fredonia in the works for this Friday. Looking to play on Valentine's new table. Msg me for more details.
250720130303131648	neutral	Meet the Dragon's Den at Social Media Week in #Vancouver on Sept 28 http://t.co/y8SQSA5s
205266527086329856	negative	God he's a daft thing! He (Merlin) is not very bright sometimes! She (Circe) apparently sat there washing her paws, ignoring him! #girls
105332660733353984	negative	Don't want to play one that's too long, what with Street Fighter III: 3rd Strike on Wednesday, and Deus Ex: Human Revolution on Friday.
262328256806674433	positive	@netanyahu Dear Mr. Netanyahu if a new "Cast Lead"might be needed I wish you success and total victory, may the enemies of Israel perish.
261838319753777152	negative	If they play New Born tomorrow instead of SS I will throw one of the mouldy donuts in the flat at Bellamy and his shitey roulette wheel
263705033567252481	positive	YES!! Allowed to go to the @onedirection concert in Oslo in May!! :D now all I need is to get those tickets...
100047849340940290	negative	Today a white boy told me nicki minaj was the best female rapper. I beg to differ. Since when do schizophrenics get recognized like that?
102250571066654720	negative	Megavideo is being SUCH a little bitch tonight. I don't understand it. Ugh. I just want to watch the last episode of Merlin, kay
264228783706472448	negative	Post of the night:  Anonymous (ID: ExcV6jkR) 11/02/12(Fri)00:52:39 No.434329650      This thread is like watching a monkey fuck a coconut
263138001058664448	neutral	For April to try to make me come to Richwood <<
110630946876821504	positive	RT @Recite_Films: Excellent performance by PJ Harvey last night! Hairs on back of neck stuff! Good company too with @ClareKirstin, @Fi a ...
261620996618981376	neutral	Tomorrow night at 7 p.m... We need madison city stadium packed with everyone wearing RED  as Bob Jones defends its Region 8 championship
262774447927357440	negative	Why the hell does Selma have school tomorrow but Parlier, clovis & others don't?
263986064010670080	neutral	@CarlsbergSports Would the bar be showing Pittsburgh Steelers V New York Giants on Sunday night?
264216696213090306	neutral	tomorrow gonna be hell yall. though, i am going to the golden modes in chapel hill!
263695604578914304	neutral	FRIDAY NIGHT LIVE! We are going to a Maulers Game! Meet at MVC at 6:30, bring $5 + fastfood $ + funds to buy CaseyFace some chocolate pie...
176948244851589120	neutral	US: Sen John McCain called Monday for US to begin another war with airstrikes on Syria   - Breaking News Buzz http://t.co/UJa6So4f
250260611999617024	neutral	Uploading a new video tomorrow! Nandito Ako (Jonya) FANVID, The first cut is the deepest (Cover) & Elevator - David Archuleta (Short Cover).
263670714844971008	neutral	World Bank's "Africa can help feed Africa" report, 1 reason the "Borderless 2013" is so important: finding solutions. http://t.co/BgqSO96Y
200668275510743040	neutral	Join Team PML(N) representative to support PMLN vs PTI kids at Front Line with Kamran Shahid Recording tomorrow... http://t.co/D16qLSLU
261131735209758720	negative	Not sure what im going to be for halloween yet. Sun Shine is just too obvious, Larry Bird is the front runner as of right now.
227386894655315968	positive	Look how far they've come since July 23rd 2010. They have a smash album, Brit Award, and the even beat out Justin Bieber for a TCA.
254050969510359040	neutral	Pacino might play Paterno in the PSU movie. It'll be the 2nd movie in his career w/ the phrase "Say hello to my little friend." #ScarFacial
263137951129665536	neutral	Nick Diaz may be suspended, but his manager is trying to set up his next fight, saying a match with Josh Koscheck... http://t.co/HOVcUE22
262956264957562880	neutral	NBC writer @DanielJMartin_ has Lorenzo Brown as 4th best PG in the nation. Ryan Harrow comes in at No. 19: http://t.co/P2GnpG0E
259698100321546241	positive	Guess which star is the 5th most greatest women in the world and won many Grammy awards and is a singer?
262002023556317184	neutral	Stroudsburg vs Pleasant Valley for the MVC title next friday #repeat #MountieNation
249688948199272448	neutral	Bruh like was this the DJ from Club Bodi i swear i heard the same music Thursday night lol
195581931939835904	neutral	Auburn will square off with UCF, Texas A&M, Ohio St, LSU, Tennessee, Texas Tech and Houston in the women's finals of the 4x1 at 12:05 on Fri
101468783788556289	neutral	working on scouting report for Clemson vs. USF soccer exhibition on Friday, always on the job
252650346873245696	neutral	iPhone 5: Apple CEO pledges to improve new map app: Apple CEO Tim Cook apologized on Friday for the company's er... http://t.co/7dzvgXNz
197137687239593984	negative	@WoodysGamertag Your mail monday with Fps Russia was such a tease lol
264047678986518528	positive	Eli manning best 4th quarter QB in the game!
262047947234095106	neutral	Animal Planet has a show that just shows puppies...guess I know how I'm spending my saturday's for the next 20 years or so.
198349496156028928	positive	haha blocked by @Tom_Seagul because its @alan_hinton 2nd account and he backs everything Tom Segal puts up, oh the irony #stoproguetipsters
262174264080363520	positive	Yay tomorrow I'll be going to Putrajaya for a walk. Woweee.
264244983673012224	positive	They made a sky zone here in Covina across the street from the AMC. I'm definitely going sunday!(: who's down?
253560294452895744	neutral	Taken 2 comes out Friday and the Afghans will have it Saturday guaranteed
263507092227383296	negative	Kobe in the 4th is like Eli Manning. #Beware
250453057735913474	neutral	I'm going to Stephen Kellogg and The Sixers at Rex Theatre in Pittsburgh, PA - Oct 30 http://t.co/LaSTN3JL
261297700354535424	neutral	... bit of lightning? He may have been the boss of Olympus but Poseidon controls the majority of weather phenomenon, also ...
257276155084804097	positive	Skyline Drive/ Shenandoah w the fambam tomorrow! Afghans at a park.. on a Sunday.. how unique lol
111929406846545920	negative	balls. i forgot celebrity juice was on tonight.
247276269006360576	neutral	@KBCChannel1: Independent Electoral and Boundaries Commission (IEBC) says all is set for Monday's by-elections in the three constituencies.
246588959247974401	neutral	Gov. Mitch Daniels will announce his Indiana Supreme Court pick at 10 a.m. Will the 3rd time be the charm for a female member of the panel?
253403686590636033	neutral	@janehamsher ICE may still issue an NTA against her, though unlikely. Let me know if Melany needs a lawyer in the area for #DACA.
260035860332945408	neutral	Doing two keynotes in #KC tomorrow http://t.co/mavkgxNt . Goint to #NASCAR today.  I want to see if I can sit shotgun with Danica Patrick.
235616936795467777	neutral	@mahesha13 Ying wants to know if you still desire her Competition readers? She can bring them in tomorrow if so.
264169849067028480	negative	Give me 5 mins with Candy the dancer from Deja Vu I'm nutting on my 4th pump she that bad lol
223503248856854531	positive	February 13th, the day before and best buddy to valentines day, Desperation Day
264179944727396352	neutral	@fluorksa yes! >3< Tomorrow we'll see a lot of fancans about this concert <3 MBLAQ, CNBLUE, After School and others will attend this concert
264165906870050816	neutral	Gonna write this paper tonight, turn it in, and not look back at it because I get to go home tomorrow so IDC.
263737966306942976	positive	@Jennykeast Elimination Diet starts tomorrow don't you mean ;) #lean #vegvegveg!
227273342653198336	neutral	#Canada #sweden Jason Vernau Live @ SET Nightclub Miami February 25th 2012:   Jason Vernau is back with some ... http://t.co/EFGXlWtE
261265435918491648	neutral	#Pistons struggle in 1st.  Trail Minny 27-10 at end of 1 in Winnipeg.  Det 3/17 FG with 6 turnovers.  Derrick Williams 12 pts for Minn.
257865075933728771	positive	The Grey and Yellow Gold Wedding Puzzle is now up with the first piece being a unique two-tone dress by @shopbop! http://t.co/1RYso3ZZ
263928322604544000	neutral	BREAKING.. Apparently Jeremy Kyle is set to star in the 7th Star Wars film by Disney.  He's going to try and find Luke's REAL father.
231421831368810496	positive	Like, "Sweet You." "Happy Valentines day." (when it's July). "I'll meet you at the shop every Tuesday.".......
263741813402259457	neutral	OpenStack is powering production clouds. In this General Session at the 11th International Cloud Expo, Nebula CE... http://t.co/go7yARJu
262752594106122240	negative	How I'm going to miss senior year's Selma vs k-town game Friday cuz I have work! <<<
263992907957145600	positive	Going to south korea or japan for research in my 7th semester..wow it'll be amazing #faith
261166872114888704	neutral	DTN Bangladesh: BPL issues to be decided Nov 1: Bangladesh Cricket Board will take a final decision on the Bangl... http://t.co/U7if5epy
264181308115271680	neutral	I challenge Katie to stick pins in my eyes tomorrow. I dare you.
264007446257864704	neutral	Going to 3MPH: a Woman's Walk Around the ... at Chautauqua Community House on Mon, Nov 12 http://t.co/rsOCU9z7
215722813619847168	neutral	Danny Care and James Haskell recalled to the England side for the third Test against South Africa on Saturday,
111597464968101888	neutral	Pavol Demitra with the Blues: 5th in scoring ALL TIME with 493 points in 494 games, 2000 Lady Byng Trophy, & 3 All Star Games in 8 seasons.
250284668753170432	positive	KPop: Will Psy be the first Korean to win a Grammy?: Psy may qualify for the upcoming Grammy Awards. Gangnam Sty... http://t.co/UzYofPAE
264175553316282371	positive	@degrassihaha Going to the Holy Land (Canada) tomorrow. If I'm lucky, I'll meet some of the Degrassi gang. Well, in my dreams :P.
260565894755909633	negative	@EdFrankovic so they should've ran the ball on 3rd & 7? Blame Cam all U want but Flacco is the problem. Elite QBs dont have games like that
263722500863713280	neutral	@ThijmenK You may want to contact Sony at http://t.co/d8K6pSRF or we can post a question on MS Community for you. Let us know! ^NY
264200011393404928	positive	Heading to the @MarilynDenisCTV show tomorrow morning with Mommy. Lets hope we get front row #TVTime
171079323292405760	neutral	I'm such a groupie...just watched the "Ni**as In Paris" video---> 1st thing I said was..."I just ordered that snapback Jay is wearing!!!
262076288276234240	positive	Safe and sound at Narita airport! Feels good to be back at the land of rising sun
100260419721117696	positive	@taylorswift13 I'm 13 my 1st concert was yesterday at the eagles field. I wish i was able to hug you when you were walking back <3 Lexie
263916267776389120	positive	Yay Bruno Mars is coming out with a new album on December 11th.(; I MUST HAVE IT!!
212938977727102976	neutral	1st Journey to the Center of the Earth, 2nd Journey to the Mysterious Island, and the 3rd??? Journey from the Earth to the Moon :))
103142803332280320	positive	Heading back to the states today after two months.. Then moving to Florida tomorrow! Very exciting times :)
263932747620442112	positive	Fab review of the wonderful Kneehigh's production of Steptoe & Son in today's Echo. Runs until Sat. Don't miss! http://t.co/x5a4nstW
264248910816636928	positive	@realrominarey Way to go.  I dropped my ballot marked OBAMA off on Wednesday in Colorado, gives you a good feeling.  I hope CO goes OBAMA.
111696058136018944	positive	you know what would be pretty funny? if NZ lost the first game against tonga tomorrow lol
244770711078592512	neutral	Food Fact of the Day: Sept 9, 1890 Harland Sanders was born near Henryville, Indiana. Founder of Kentucky Fried Chicken restaurant chain.
251965883914784768	positive	Enjoyed watching the people working out during the tour of #technogymvillage in Cesena, Italy. Workouts for attendees tomorrow.
262298554184388608	neutral	What are the FAFSA and a Pell Grant? | Begin College: What are the FAFSA and a Pell Grant? October 26, 2012 Cate... http://t.co/uH9ig9eo
240979624589398016	positive	Hey don't forget our show at the Rex Theatre is Sunday! Anyone want a ticket contact us! http://t.co/qe99ciW0
259085020449349633	positive	Especially nice to have Rosedale @DCPL open in the neighborhood while NE Branch at 7th & Maryland is closed for renovations.
260851260956221440	positive	@TeamStradley mines personal thinking Tebow is better then Flacco. I don't care how bad he played Sunday
263656013541027840	neutral	How are they going to act in new york with the subways out? They better clutch it out like Eli Manning 4th quarter
245597031127728128	neutral	This is Buffon's 122nd cap for Italy, now just 4 behind Maldini in 2nd and 14 behind the leader, Cannavaro. #Legend
248863471784046592	positive	ERMAGERD! Conor Oberst @comvb @brighteyesband is playing the Barbican Centre in February. I must find a way.
179791422445207552	neutral	So This is how it's gonna be #NCAA South 3rd Round Winners UK, Iowa St, Wichita ST, Ind, UNLV, Baylor, Xavier (upset) Duke
247350652244721664	positive	Brandon Weeden is going to be a player someday. He's not right now - Ron Jaworski just now on Sunday NFL Countdown #countdowntokickoff
263840764285575168	positive	Mizzou beats Kentucky 2-1! Tigers advance to face top-seed Florida in the semis on Friday at 6:30 p.m.
188857697985249282	negative	Careless World tour hit up 8 places in Cali. Haha the fuck, yoo.
205234689936592896	neutral	Australian Directioners! Up All Night Tour DVD will be posted tomorrow, you guys should be getting them some time on Friday or so.
263579191394574336	positive	@teafortree Goon is always a good idea! It will probably taste better than the $10 bottle of vodka I have for tomorrow...
258772742378242048	neutral	@TheBigLead I need to see Jeremy Evans on Roni Turiaf all over the place tomorrow.
260259755816267776	positive	Monday feels a little easier after Safc res fantastic win...and the Mackems couldnt even beat us with 10 in own backyard #alwaysinourshadow
195014022603616256	negative	Did you just tell me Lucas scott leaves in the 6th season of tree hill with peyton to travel the wolrd?#YOUJUSTRUINEDMYLIFE #FUCKYOU
262871005490454528	neutral	@AnfieldFM Hi there. Counting down the days until Im back in UK and going to see LFC - NUFC on Sunday from my Season Ticket seat in The Kop!
262213727158407168	neutral	Took and hour to vote...first day of early voting..please try not to wait until Super Tuesday #earlyvoting
263543591727689728	positive	Looking forward to going to Carrow Rd tonight. Last time we were there, Bale scored 2 and we were 3rd. Do not want extra time though
261023683412369408	neutral	I see the French Rail unions are striking on the 25th, do the French have Half Term or is it just aimed at the Brits?
263921038352580608	neutral	@juliecrawley25. @GininjaDesign. @Donna_Butlin. Nope, it's just Camden, eating Greek food with a pumpkin... Just another Wednesday.
263391524769898496	neutral	If I can get my equipment working correctly we will have a live show on Friday at 6 pm CST with contactee Ray... http://t.co/9LVKwcYJ
264118734619283456	negative	@ChicagoBears can not let be a let down game Sunday with Houston and San Fran coming up. Gotta focus on beating Tennessee. #JayisourQB
264184508297908224	neutral	Just got the call the magazine is ready for pickup get your copy at the "Hands That Heal Fashion Show" Nov 4th Mr. Reggie 404-246-9582
236612161600909312	positive	@YingUllmann Whatever plans you may have with your family, have a beautiful weekend, Ying! #FF
262356333829963776	positive	DePaul WBB practice, wine, ND Football, dinner with big brother in Lincoln Park = great Saturday
104487009413890048	positive	Gym tonight dependent on how, erm... fresh, my kit is. Otherwise its a pilgrimage to Bolton first, or Saturday morning. Feeling good.
106857111551619072	neutral	See what we Just published at #MMA Rants Today: Anderson Silva made the most disturbing Burger King Comme http://t.co/7QS19HS @adominguez
264154175628275712	neutral	Buyers of Wal-Born supplements may get refunds from Walgreens: The company touted the supplements' likeness to t... http://t.co/b3ngExov
262559858535059456	neutral	What march just went through Bethnal green?
218995084966887424	neutral	I am going to @NetrootsUK 1st and then to the London Conference of Critical thought http://t.co/UC1pnX0Y
262610868049686529	negative	Damn Drexel and Penn have canceled classes for Monday and Tuesday due to the hurricane.
263204041776066560	positive	And, SURPRISE SURPRISE, majority of the people, sat in the window seats, have gotten off at Murdoch. Wankers
111356385106722816	negative	@kwan1926  I laugh to death!!!lol!! Don't trust the translation of google anymore! It's is full of errors!! btw u played truant today .\_/.!
254982286049693697	negative	@Reality_Touch: Hamid Mir has rejected the negative views of Saleem Safi,Sana bucha & Kamran Shahid on PTI peace march. Read his tweets !
264170532935696384	neutral	Sunday's at 5pm CST, Tune in for "The Sunday Blues" on Underground Radio. An hour show with Blues musical styles,... http://t.co/Af9N6flZ
257951107530252289	negative	@MelmurMel @PBandJenelley_1 @vl_delp_ham_ Jenelle lies,1st she said she was alone &the hosp.now she's saying how weird it was for Keiffer's
234408683994492929	positive	Come to MTSU Football Fan Day tomorrow from 2-4 PM at Murphy Center! Meet the team for autographs and enjoy hotdogs and drinks!
262859887904710656	neutral	@TaylorJet_187 i had OKC im playin online... the nigga had da knicks.. I was bustin dey ass then the 4th come, raymond felton and JR smith
100469185699782656	neutral	#bournemouth Lions taken back to den for repairs: IF YOU follow the Pride In Bournemouth trail today, you might ... http://bit.ly/oHbrBu
263592835369009152	neutral	Pics: The KBC episode on Sony on November 4.  a treat for all the Big B and SRK fans. http://t.co/xyQSL2ym @yashchoprafilm #fb
263925399053021184	neutral	@ForeverJeTi: Tiffany will be one of the MCs along with CNBlue's Yonghwa and Beast's Gikwang for SBS KPOP Super Concert on November 10.
105075429332877312	neutral	RT @Michael_R_Grant: Remember that Janet Devlin girl on tonight's X Factor, the 'obviously in the final 12' one? She has a Youtube chann ...
261127405769465856	positive	@T_yeon9 eonni!!! please win the MAMA award for OST! Fighting! and take care, i want to see you on Jan 19... an ordinary fan from somewhere!
195137821449789440	neutral	Did you get a full, part-time job or internship offer? Let us know! Signing Day tomorrow in LBJSC Amphitheater-tell where you will work!
258799241743454208	negative	I had a "nightmare" last night where I missed the 2nd rd of my #FantasyBasketball draft and they autodrafted me JR Smith. #truestory lol
264201822770696193	neutral	Gonna go to the north game tomorrow night. I better see some of you north kiddos
104154416113913856	negative	RT @MsHighbury: @SheKicksdotnet I'm going to the Arsenal ladies v Everton tonight, I'm nervous already. #FAWSL
264053197310672898	neutral	Denzel Washington & Brian Geraghty gear up for one heck of a ride in this exclusive clip from FLIGHT! See it tomorrow. http://t.co/b74QaR0B
264023107327651840	positive	Don't forget FCA won't meet tomorrow morning. We will just meet after the football game on the field with SAHS FCA. #dontmissit #freepizza
263763678283849729	neutral	@ben_higham we put a 2nd team out and get beat and you go #Rafa ... Behave Ben !! You sound like a wool calling for Rafa
232925641908031488	neutral	I am selling 2 tickets to see @onedirection at london o2 arena on the first date on their 2013 tour. Friday, (cont) http://t.co/B4iA7koz
236315334557175808	negative	David Guetta's playing with Alesso at Fort Canning 8th Oct. Only want to hear Alesso leh.
251780516003581952	positive	@jessradio - Hope you have been entered in the Marie Colvin prize at The Sunday Times, Jess.
217090205772038146	neutral	@CoreyBBrooks Lorenzo Beasley. He was killed on July 17th of last year on the corner of 53rd and King Dr.
223128257271312384	neutral	In his session at the 11th International Cloud Expo, Ronald Bradford, Founder & CEO of Effective MySQL, will dis... http://t.co/lG8ownYV
261860733485195264	positive	@HIBanffHostel @mtnorquay would love to! flying out to Van on the 14th and working in Whistler! Will defo head over to Banff tho!! #Canada
109227767333265408	neutral	@CTVNationalNews's Lloyd Robertson set to sign off tonight after 41 years as a national news anchor.
264148403112517633	neutral	@bbcquestiontime From this performance it is obvious why David Miliband comes up 1st when you google Miliband! #onetowatch
260189318121943040	neutral	@mikepib @matthewroesch I was confused as well. I guess it's always Saturday Night at the Ritz Carlton. Oooh lala.
104639613175463936	positive	@SuperSkin1 after tonight Colts fans are going to say Manning is John Beck like.
257886032060637185	negative	Robbie Keane speaking now: "We let ourselves down and we let the country down. It wasn't good enough on Friday." #rtesoccer
111718983148904448	positive	@LeighFrancis: Celebrity Juice tonight 10pm itv2. Hurrraaaaah! its a Back to school special who's featuring ! The wait is too much ! Ooosh
100077968503750656	negative	why did i just hear some car driving slowly down 24th street blarring.............. Elvis Presley?
100047265045020673	neutral	Looks like sports teams owners r studying the Congressional playbook. 1st the NFL, now the NBA, lock out players/threatening the season.
212127802454056960	positive	Gut decision. Sharon Van Etten > Cat Power. Elicited emotion in me like the 1st moment I heard Trespassers William, or Casimir Pulaski Day.
261740771902881794	negative	Lol super awkward if its hella foggy at Rim tomorrow and the games suppose to be on tv lol  Uhhhh.. Where's the ball? Lol
100048128195051520	positive	@britneyspears: "So amazing to have the beautiful Lady Gaga at the show in AC tonight. Love you girl.- Britney"
