BOOKS_160_3	neutral	It did not capture my interest as I thought it would, nevertheless I really liked the psychological aspects of how to cope with the death of a beloved one.
VIDEOGAMES_276_4	negative	Original character expressions replaced with medicore digital drawings.
VIDEOGAMES_124_9	negative	And I also find myself running through a lot of people.
VIDEOGAMES_278_0	neutral	""Broken"" The Good: Decent story, tons of gore, great graphics and audio, new features are neat The Bad: Abysmal combat, terrible control, extremely slow pace, laughable voice acting I tried so hard to love RE1 and look beyond it's major flaws.
VIDEOGAMES_143_10	negative	And the frame chugs every so often.
VIDEOGAMES_287_13	negative	-Similarly to games like Black and White who let you decide to either be naughty or nice, the good and evil aspect isn't exactly balanced.
ELECTRONICS_222_5	positive	On the plus side, there are buttons to program for radio stations and this is done like in the car.
VIDEOGAMES_132_11	negative	In truth, I was expecting a lot more than what I got in terms of graphics.
VIDEOGAMES_134_11	negative	Zidane is a girl crazy teen who's idealistic immaturity is as boring as his one line pickups.
MUSIC_112_10	positive	Definitely one of the better tracks on the album.
DVDS_189_2	negative	Thomas Allen is a singer I greatly admire - however on this night he just doesn't seem vocally up to the challenge, his aria `Fin ch'han dal vino' Is taken so fast by Muti that he is breathless and seems unable to cope, by the end of the opera he is evidently flagging.
VIDEOGAMES_143_2	positive	The controls are spot on.
VIDEOGAMES_131_5	negative	If you get killed, you have to do it all over again, and again, and again, ... I recommend playing this game at the ""normal"" setting the first time - perhaps then it would have been more fun.
VIDEOGAMES_291_23	positive	Sound Sound... I LOVE THE KH MUSIC!
VIDEOGAMES_288_1	positive	Graphics - 9.5/10 Beautiful.
MUSIC_259_2	positive	The CD book takes those concepts and Douglas-Klotz' scholarship into the realm of the auditory.
DVDS_181_19	negative	Wil Smith's son just gets a C+ and only because he finally delivered on the closing scenes.
MUSIC_112_8	neutral	""Never Let This Go"" is a welcome change of pace to the album, and the melody kind of reminds me of ""The War"" by Melee, though LOOSELY.
VIDEOGAMES_273_6	negative	I want more Diego!""
VIDEOGAMES_136_36	positive	Score: 8.5/10 Overall score: 9/10 Final Recommendation - Look for it, find it, buy it!!
DVDS_192_10	neutral	Musically, Nobuo Uematsu's talent translates into movie form fairly well, and feature some of the more noteworthy tracks from the game with some original content thrown into the mix.
MUSIC_97_1	positive	The last few intensive notes end this song beautifully.
VIDEOGAMES_136_29	positive	This makes the game even scarier.
DVDS_189_7	positive	The set itself is of highly polished architectural splendour and so in keeping with the period of the opera as indeed are the costumes, not exaggerated or over sumptuous and all the better for that.
VIDEOGAMES_137_1	negative	Don't think this is a true port of the really good SNES game Harvest Moon, because Natsume, the company who created all the HM games, took of the major part of the game: interacting with others.
BOOKS_168_13	negative	* The book could stand another 100 pages or so.
VIDEOGAMES_118_5	negative	Wow, could have been a expansion pack.
VIDEOGAMES_266_2	positive	I would enjoy it because you would get weapons such as swords and daggers.
VIDEOGAMES_135_7	positive	They definitely improved the sound on the this game compared to banjo kazooie Value- worth every cent!!!
VIDEOGAMES_118_7	negative	If anything this is a crappy version of Halo 3 that comes with a Halo 3 multiplayer disk...
VIDEOGAMES_134_5	neutral	The graphics are pretty, but uninspiring.
VIDEOGAMES_118_2	negative	The missions are dark and pretty dull.
MUSIC_102_4	neutral	The rest of the songs, original compositions all, are a little less stellar.
MUSIC_244_7	negative	After listening to the first disc, I almost felt I had to check my stereo to make sure I didn't have the same song on repeat over and over.
MUSIC_87_5	negative	I encourage you to buy this cd....my copy is available.
MUSIC_235_3	negative	The music contains full of pretentious French lyrics and the beat is flat.
MUSIC_105_8	positive	it takes a small while to get used to the new style but now i relly love ""fly or die"".
ELECTRONICS_224_1	neutral	I specifically chose this model because it was marketed by Canon as fully supporting Macs. My experience with the printer is that 'support' is an exaggeration.
ELECTRONICS_84_3	positive	I am very impressed with the quality of the playback.
MUSIC_252_10	negative	For example, compare Eric's lame take of ""When You've Got A Good Friend,"" with Savoy Brown's excellent version from their 1999 album Blues Keep Me Holding On. No contest: Guitarist Kim Simmonds and his famous Gibson Flying V fly circles around Eric's rendition.
VIDEOGAMES_291_24	positive	This is good too!!
VIDEOGAMES_277_25	negative	And I agree the game should not be easy, but it is almost impossible, which really ruins a game based on stealth.
VIDEOGAMES_136_35	positive	It depends on how you like the game, but it took me a long time before I even got a little bored.
VIDEOGAMES_124_0	negative	I must by saying Universal Studios is a fantastic theme park but the game just offends it.
MUSIC_240_3	negative	So obviously designed for kids, to allow them to shock mummy and daddy, i find it quite sad that 9 blokes decided to adopt this image to sell records.
ELECTRONICS_78_9	positive	It must be one of the best anti shake designs made.
VIDEOGAMES_132_20	neutral	The game is simply a port from the N64, with not a lot added in, but it is a breath of something from the N64 age.
VIDEOGAMES_292_11	positive	There is so much too do.
ELECTRONICS_221_3	negative	it was loud and incomparable.
MUSIC_260_18	positive	Simply godly.
VIDEOGAMES_127_25	negative	That's it for 51 whole events!?
ELECTRONICS_226_9	positive	But that is very minor and the computer is all around a great computer and I would recommend it to everyone who's looking to buy a new computer!!
VIDEOGAMES_134_1	negative	Final Fantasy VII had no plot, and Final Fantasy VIII played like a Jane Austin Novel. Final Fantasy IX regurgitates every possible cliche in history, and draws out these cliches for hours.
ELECTRONICS_81_5	positive	Glad I didn't take it back.
VIDEOGAMES_274_6	negative	If ya want emmersion, and overall the highest levels of reality you can get, buy the original Falcon4.0 disk and then go download either FreeFalcon4 from www.freefalcon.com/forums OR Openfalcon 4.5 from: www.f4forums.com/forum The best thing about those 2 sims are 1 - they're free 2 - They're not junk like Falcon4.0 allied Force is.
ELECTRONICS_224_2	neutral	It can be made to work with Macs, but not all the time, and certainly not if they are running Snow Leopard.
VIDEOGAMES_277_15	negative	Let me explain the most annoying part, even more annoying than the repetitiveness.
VIDEOGAMES_141_7	negative	The cities are all dark; I suppose from smog and smoke from guns, and cannons, ect.
ELECTRONICS_73_27	negative	The one feature lacking on this model is the inability to copy DVDs to a videotape.
ELECTRONICS_225_6	negative	Now - i used the included software to run a backup of a roughly 300 gig drive that is relatively full and it took almost 2 days for the 1st image to complete...
MUSIC_101_6	neutral	This DVD was interesting but was a far cry from the complete picture.
VIDEOGAMES_137_33	positive	People do look like people!
ELECTRONICS_222_3	neutral	I has a nice feature in that there are 2 alarms and you can set each one to go off on certain days of the week but once again I was unable to set the days of the week.
MUSIC_264_14	positive	Incomparable is really the best word to describe ""Le Fil.""
VIDEOGAMES_141_15	negative	I hated them and they stopped me form playing the game over again.
VIDEOGAMES_122_10	negative	No soldier in his right mind would scramble to a fence when being fired on, unless it was his last and only place to try and hide.
DVDS_204_17	positive	The words ""I love you"" have never resonated so much overwhelming emotion that if you are not in tears then you my friend are not human.
ELECTRONICS_73_3	negative	Each disk starts out playing fine, then starts to stop and start repeatedly, and finally just stops playing.
ELECTRONICS_214_1	negative	This Virtual CD cannot be disabled, unmounted, removed, eradicated, or partitioned away - EVERY!!!!!
MUSIC_112_16	positive	Others Escape"" by Underoath, because the song starts slow, seems to be another basic song just like the last two, but at the end Josh adds some screams and it really makes for a pumped up ending to the album.
MUSIC_258_2	positive	Richard Perlmutter has done it again - this cd is brilliant and has quickly become a beloved cd for our entire family.
VIDEOGAMES_292_10	positive	You also have to beat rivals, explore the mountain, complete every extra bonus missions and collect stickers, drawings and dolls of the characters.
ELECTRONICS_210_10	negative	I will return this one and gladly pay more to get rid of this crap.
VIDEOGAMES_118_4	negative	3 maps...
DVDS_200_3	positive	To wit: veteran scribe Mike Klein (Duchovny giving deadly dead-pan, is a study in noble rot) is desperately trying to get his current project ""The Wexler Chronicles"", a dramedy based in part of his real-life brother's suicide's affect on him, past the pilot stage for the fictitious Panda Network (think CW lite) and the biggest hurdle is vacuous, yet tenaciously 'my way or the highway' Lenny (Weaver, a dry riot), a harpy in a suit, who is not Mike's biggest fan but has her current junior exec Richard McAllister (Gruffudd in a modulated turn of a decent guy in a deceptive business), a Brit late of the BBC, whose come to LA for the network to give a fresh perspective on the new crop of shows for the seasonal line-up.
MUSIC_250_4	neutral	One of the few bright spots in this album was L'Alba del Mondo, an Italian adaptation of Ennio Morricone's I Knew I Loved You (Deborah's Theme).? The addition of some more familiar renditions, such as Hallelujah? and Amazing Grace? make it more bearable but are not enough to overcome the dreary, one-note atmosphere that plagues the album.
ELECTRONICS_216_21	positive	4. The battery life is impressive.
BOOKS_170_7	positive	Although oppinion, the basis of his oppinions are based in factual information and with anticipated counter aurguements addressed in advanced.
ELECTRONICS_73_12	negative	I assured him that my front door doesn't know how to write, and that I still had not received my new unit.
ELECTRONICS_218_4	negative	I have two major complaints about this phone.
VIDEOGAMES_137_43	negative	With 5-6 different tunes in the game, that you keep hearing overand overandover!!
DVDS_192_9	positive	The effects in the action segments are noteworthy as well, featuring vibrant colors and creative lighting.
VIDEOGAMES_136_0	positive	It surprises me how this game is underrated!
VIDEOGAMES_117_16	negative	Also the multiplayer sucks, blow up gold crates....
ELECTRONICS_230_8	positive	I like the wired remote w/ volume and bass controls & headphone and line-in jacks.
VIDEOGAMES_282_19	positive	It's definitely worth the $10 I got it for.
BOOKS_172_9	positive	He speaks candidly about his youth, his addictions, and his career, giving much credit to wife Tabitha for her contributions to both his writing and his sanity.
ELECTRONICS_229_7	positive	I would highly recommend this to all.
VIDEOGAMES_269_17	negative	But with FFL2, the music just is so repetitive, and melancholy, even during the ''happy'' parts of this game.
MUSIC_99_1	positive	Wilco too.
VIDEOGAMES_137_20	neutral	You can have a little fun riding your horse, if you like that
MUSIC_107_21	positive	:D Anyways, overall this is a great album and Venus Malone has a great voice.
MUSIC_98_9	negative	In my own opinion, this release and Wings' VENUS & MARS are DTS' worst 5.1 CDs on the market.
VIDEOGAMES_294_7	positive	The DNA option, which updates rosters and player ratings/tendencies to reflect real life NBA performance, is superb, and it really feels like you're playing in the NBA. If you want a great online sports game, grab this, just don't expect EA to get everything right.
VIDEOGAMES_284_1	neutral	Not to be misconstrued I love the story of the one ring, the hobbit is also very entertaining, however this game is just a cheap and uninspired leech that gets all it's inspiration from the motion picture.
MUSIC_92_3	negative	Extremely bland performance from Eddie (three note riff on Don't Tell Me?)
VIDEOGAMES_273_11	negative	And I would get a game that's not so easy that a 3 year old can beat it in 3 days.
VIDEOGAMES_143_5	positive	The ability to chose the dark side or light side through random killing or giving a way money is beautiful.
VIDEOGAMES_124_18	negative	The games are too quest based and if the rides were just rides then, it may have received a six or even a seven, but the gameplay stopped it from getting a 4. OVERALL 3/10 This game is amazingly unique, but the gameplay, graphics, music and sound effects ruin it.
DVDS_178_27	neutral	Had it been a made-for-TV movie, I would have given it at least a 7/10 because it was (again) lacking in everything except acting and atmosphere.
BOOKS_168_24	positive	I give it 4 out of 5 stars.
MUSIC_260_19	positive	I could go on and on about this wonderful album, but I won't.
MUSIC_109_5	positive	No longer does the music feel constrained by the mono recording.
ELECTRONICS_225_8	negative	I also noticed a marked slowdown on the machine with the active backup software monitoring in the background.
865	neutral	The compromise formula has been worked out with Zardari,
1471	neutral	Our demands are well known and have been submitted to the Egyptians. If they agree to our demands and release our prisoners, Schalit will be free,
1178	neutral	Murr opposed the obstruction of the presidential elections. He supported Bkirki and its principles, which were violated. The development of his position led to rapprochement. However, this possibility does not mean that we authorized MP Murr to form alliances in the Metn. His vision of the [electoral] battle in the Metn is different from ours,
997	neutral	Every gun or bullet tells a story. The National Ballistics Intelligence Service (NABIS) helps police unravel that story and track down offenders. NABIS's specialist CSI-style analysis of ballistics - effectively giving guns and bullets a fingerprint which can be tracked - will help police to match guns to offenders in double quick time.
754	neutral	We (Congress and Trinamool Congress) will jointly fight the coming Lok Sabha elections in West Bengal against the ruling Left Front,
437	neutral	The White House believes those that have committed atrocities should be held accountable,
856	neutral	Today we've witnessed the start of construction of what, with the help of Sir Chris Hoy who helped design the velodrome, we hope will be the fastest track in the world for London 2012, helping Olympic and Paralympic cyclists better their awe-inspiring performances last summer.
354	neutral	We know about Deputy Dempsey now.
388	neutral	If the Chinalco deal with Rio Tinto goes ahead the communist bosses in Beijing will exert control over the management of Rio Tinto's Australian mineral resources,
1558	positive	after conclusion of ratification process of the Lisbon Treaty, problems related to institutional actions will be overcome to a great extend.
1376	positive	I haven't made the team yet but Walcott and Eduardo will certainly be in the squad. The more resources you have the better it is and they are two guys who can score goals,
1477	negative	ETA is the threat that hangs over all elections in the Basque Country,
783	neutral	It is in the common interest of everyone here today therefore that this network functions efficiently, reliably and transparently into the future. It is a system which supplies gas to 16 European countries -- 12 of which are EU member states. We cannot afford for it to become -- very frankly -- an unreliable conduit, as it was for a few dark weeks in January,
984	neutral	The transfer of authority from elected local councils to a new quango, which will make more planning decisions than in any other National Park, is a step in precisely the wrong direction at a time when local communities should be given more of a say over their own affairs, not less. 'I therefore intend to keep the effectiveness of the new park under review, in particular the accountability arrangements, to ensure that communities retain local control over decisions affecting their own area. 'There is no gua
544	neutral	If the Dalai Lama doesn't come, I'm not going ... I'm very disappointed,
310	neutral	A long shot has been returned to Mr Obama and into the US field,
785	neutral	It is in the common interest of everyone here today therefore that this network functions efficiently, reliably and transparently into the future. It is a system which supplies gas to 16 European countries -- 12 of which are EU member states. We cannot afford for it to become -- very frankly -- an unreliable conduit, as it was for a few dark weeks in January,
1335	negative	It's our desire that the Republicans would work with us and try to be constructive, rather than adopt the philosophy of somebody like Rush Limbaugh, who is praying for failure.
1101	positive	I sell authentic items and when people come to my website and see the name David Irving, they know they are buying an authentic item. I have a living to make and this is how I make my money. 'There are some very wealthy people, mainly in the U.S., and I know how much they will pay for these items.
278	neutral	I've had two excellent meetings with President Obama,
309	positive	The challenge for everyone is that (Obama's new language) is a prelude to a sincere change (of direction) in US and European foreign policy,
620	neutral	It is our hope that Ms Lohan will surrender herself so that this matter can be resolved in a timely manner.
1534	neutral	One consisting of 20 people or more would continue working in Georgia. The other one consisting of eight people, as before within the old OSCE Mission in Georgia, would operate in the regions adjacent to Georgia from the side of South Ossetia,
1040	neutral	I have been the member of Rajya Sabha from Madhya Pradesh for last three years and this state is not new for me,
464	negative	Terrorist activities of the Taliban, Al-Qaeda and other extremists are constantly mounting and undermining the basics of the Afghan statehood and impeding stabilization and restoration. Specific concern is caused by the fact that terrorists actually control several regions of Afghanistan and form parallel bodies of authority there,
913	neutral	I think that the best way to judge movies is, like, 10 years after they're released. I think they should actually do the awards that way. I think they should have done the Academy Awards this year for movies from 1998,
1215	neutral	The part was written for Mickey Rourke and for whatever the reason they couldn't get financing with Mickey.
1181	positive	This is an important step for us as a standalone business. It also confirms our determination as a team to steer Jaguar Land Rover through these extraordinary and challenging times, so that our business is ready to take advantage when the downturn finally ends.
1334	negative	However, Chairman Steele's reversal this evening and his apology to Limbaugh proves the unfortunate point that Limbaugh is the leading force behind the Republican Party, its politics and its obstruction of President Obama's agenda in Washington,
1083	neutral	I am certain that President Ahmadinejad would have wanted to give this response to President Obama himself as that would have boosted his chances of reelection,
392	neutral	A failure of General Motors would be negative for the other carmakers, as it would drag along a large number of suppliers,
344	neutral	The decision on captaincy was taken by keeping into account three considerations. One, player's availability during each phase of the tournament; two, flexibility in selection of playing squad during the phases; and three, the fact that Dravid will not be available due to personal reasons for the entire tournament,
1388	negative	It's like Aston Villa's passing - you're not quite sure where it's going to!
894	neutral	By recognizing Serpent as an island the International Court ignored any claims made by Romania on it,
1099	neutral	I am certain that we should neither be seen to second-guess the contents of the final Competition Commission report, nor the response of the airport operator until after it has had time to consider its findings and implications.
1527	positive	Why is the Israel Police not esteemed by some members of the public, unlike other bodies, and especially by some public servants... who attack the police and its investigators only because they fulfill their duty?
1296	neutral	We are older than Google, Slashdot, or Facebook, and I'm not aware of any Web hosts that were organized in 1995 and are still privately owned and operating under the original management,
302	neutral	The co-sponsors of the previous bill were Secretary of State (Hillary) Clinton and now President (Barack) Obama,
728	neutral	We need to have a defence minister in whom the Australian Defence Force has confidence, in whom the Australian public has confidence and who can work effectively with his department,
876	neutral	and sparked panic. Witnesses told WINS radio that the situation was compounded when a man leapt from a car and began grabbing women's purses. A New York Police Department official said two women and a man were arrested on charges of inciting to riot and disorderly conduct. It is so important to me to redefine beauty and make sure that everyone gets a fair chance to pursue their dream,
616	neutral	Unilateralism is a fading theory in the modern era, whereas regional organizations like NAM (the Non-Aligned Movement), OIC (the Organization of the Islamic Conference) ECO (the Economic Cooperation Organization) are growing,
1171	positive	Founded just over five years ago, Air Arabia is now firmly established as one of the region's true success stories % and we are very pleased to be able to share that success with our shareholders, while still preserving sufficient capital to ensure the implementation our ambitious long-term growth strategy,
294	positive	President Obama has stated quite clearly what we all believe,
606	neutral	Let me say very clearly that the way the European Union will relate to an [Israeli] government that is not committed to a two-state solution will be very, very different,
1175	negative	The Mafia is neither unbeatable or immortal. That is the strong message of this demonstration,
415	neutral	The United Nations High Commission for Refugees (UNHCR) in Malta has been turning down our request to allow EU member states to host some of the refugees in Malta,
365	neutral	I don't know whether Mr Salmond has ever set out the implications of what would happen to Scotland as an independent country if one of the world's biggest banks, RBS, had collapsed,
923	neutral	I was by myself with Brodeur and saw Richie on the corner on the left side. I thought it would be open net for him,
1548	positive	This is a fantastic opportunity for Puma and we are thrilled to announce our partnership with the Irish Rugby Football Union - one of the world's leading rugby teams
871	neutral	You mustn't expect that this trip will change the position of the Catholic Church towards the problem of AIDS,
1223	neutral	According to the tradition cosmonauts arrive here before a space flight to drink some water from Gagarin's well-known well,
847	neutral	She's the one who's in crisis. Renamo's not in crisis. She was recruited by Renamo to be head of the parliamentary group. It was me who put here there. It was Dhlakama's will
645	negative	Only an NGO like Amnesty International that has no political responsibility has allowed itself to make such allegations based on very partial enquiries and to launch a call to the UN on the basis of partial testimonies and newspaper clippings is totally irresponsible,
1404	neutral	strengthen NATO in that France of course would take a significant number of important positions within the integrated military structure. It would also give a wind in the sails of European defence,
793	neutral	We believe this referendum serves to extend the life of the Aliev regime,
770	neutral	given the serious pressure that the Irish Prison Service has been experiencing during the last 12 to 18 months, in 2008 it became necessary to introduce additional contingency accommodation through the doubling up of cells in Mountjoy, Wheatfield, Cloverhill, Midlands and Arbour Hill Prisons and in the Training Unit. This provided 180 temporary bed spaces.
1102	positive	the meetings between Prime Minister Fouad Siniora and American and international officials in Sharm al-Sheikh gave Lebanon huge reassurances that no compromises or rapprochements would take place in the region at its expense.
651	neutral	The Supreme Court has dismissed the appeal by the state against the High Court decision to grant him bail,
762	negative	Once again, in her eagerness to hide Labour's cosy relationship with Sir Fred Goodwin and his government-endorsed perks, Harriet Harman has ignored the facts. 'Instead of worrying so much about her campaign to succeed Gordon Brown, she should focus on mastering the detail.
1092	positive	We have been dreaming of Dolce & Gabbana make-up for years,
311	neutral	This budget will protect President Obama's priorities education, energy, health care, middle class tax relief and cut the deficit in half,
