temp_fbis_20.13.06-23605-2	positive	He emphasized the importance of bilateral cooperation between the two continents in dealing with environmental issues, noting that this meeting will serve as a foundation for Asia and Europe's future cooperation.
20011228_21.10.24-16924-2	neutral	"Since they have realized that this train is not stopping and that they are not going to stop it or run it off the track, ideas about destabilization have once again surfaced.
20020122_20.36.01-11616-38	negative	The need for timely and accurate information about possible new attacks is naturally particularly great, but whether the global ban on torture can be abused on that account is another matter.
20011220_21.22.09-18839-103	neutral	This group totalled 971,200 persons at the beginning of November
non_fbis_06.11.16-17420-18	neutral	"At the least the difference between some estimates clearly  shows a great deal more talking and assessment is needed,"  Reuters quoted Prescott as telling the delegates, who  represented both business and environmental groups.
20011208_20.31.54-28680-30	positive	The United States views itself as a "major force of anti-terrorism," for in the world only the United States has the capability to carry out the global war against terrorism.
non_fbis_08.46.28-13637-29	negative	After another hour or two of waiting, a mouthy reporter  loudly calls his editor so we can all hear him report the  latest: "Same shit, different day.
20020314_20.41.01-29272-22	neutral	He also said the European Union will consider toughening sanctions on the Mugabe regime when foreign ministers meet ahead of the Barcelona summit on Friday and Saturday.
non_fbis_08.46.28-13637-3	neutral	Many of us haven't been up this early in years.
non_fbis_15.11.50-23748-14	positive	Vice-president Diosdado  Cabello, a Hugo Chavez supporter, is acting president as of now.
20020314_20.23.54-19638-31	negative	Inside the United States itself, too, there were widespread debates against the Bush gaffe.
non_fbis_08.10.09-13801-19	negative	A  sudden, widespread drop in deposits threatened to choke economic  activity and worsen the country's financial troubles.
20011218_21.00.30-21204-34	negative	President Bush now needs parliamentary votes to get more powers on trade negotiation matters and a green light on the economic stimulation plan that has been dragging along for the past two months.
20020109_14.12.17-21564-4	neutral	According to the spokesman, heavy snowfalls and the risk of avalanches still limit the traffic on the Caucasus highway and Military Georgian highway.
20011008_22.32.10-2528-0	positive	Taipei, Oct. 8 (CNA) -- The United States military action in Afghanistan will help spur global investment sentiment by brushing aside many uncertain factors, Council for Economic Planning and Development (CEPD) Chairman Chen Po-chih said Monday.
20011024_19.59.31-21964-5	negative	Elsewhere in his remarks, Khatami lashed out at the recent US-led attacks on Afghanistan, and voiced Iran's displeasure with developments in the war-ravaged country.
non_fbis_13.24.42-23228-0	neutral	Russian ship might have missed proper linkup with space station
non_fbis_11.30.45-27115-33	neutral	Leeward is left to the single functioning air  strip, some Marines and overnight flight crews.
non_fbis_13.10.41-18948-4	negative	International condemnation of Mugabe's win mounted yesterday  with US President George Bush and British Foreign Secretary Jack  Straw delivering further criticism.
20011208_20.31.54-28680-31	neutral	Bush said, "Either you are with us or you are with the terrorists" and "any nation that continues to harbor or support terrorism will be regarded by the United States as a hostile regime."
non_fbis_12.09.12-23643-6	neutral	Mr. Hicks is one of a handful of Westerners - including three  British fighters - who fought with the Taliban and Al Qaeda.
20011124_20.49.56-27748-11	neutral	Malaysia's official Bernama news agency said that Misuari and six of his men were arrested on an island off the Malaysian state of Sabah, which is on Borneo island, while trying to enter the country illegally.
20011210_20.21.48-16389-2	neutral	The most telling result is that more than half of those polled believe that it is necessary to remove Chavez from office to solve the crisis.
20020109_14.06.40-17312-12	neutral	Studsvik expects to get confirmation of the information it has received today.
20011112_20.33.43-387-39	negative	They think she is travelling too much, while internal problems sap the country's energy, and that she has misplaced strategic priorities in her overseas visits.
non_fbis_12.19.24-26050-22	neutral	"Do I believe that they are following the Geneva Convention?
20020212_20.42.04-19290-8	neutral	Yesterday was also the first day that holders of salary direct-deposit accounts were able to access all their money.
non_fbis_11.09.24-151-20	negative	Police have canceled scores of opposition rallies and Mugabe has  used his presidential powers to restore controversial election  laws struck down by the Supreme Court that appear to make it  easier to rig the vote.
20010718_23.47.18-27024-1	neutral	According to reports from Afghan sources, high-ranking Taleban commanders, including [Interior Minister] Mola Abdorrazaq Akhond and Mola Abdol Qahir [phonetic], visited the front line in [northeastern] Takhar Province yesterday morning, Tuesday.
non_fbis_12.22.23-26451-28	negative	It is using state agencies,  state institutions that have been built specifically to  terrorize the population," Mr. Tsvangirai said yesterday.
20011228_21.10.24-16924-5	negative	Even if such a thing were to happen, it would not solve the problem," the president said during his year-end message to the Vargas and Caracas garrisons, speaking from the Caracas Poliedro.
non_fbis_16.03.54-17435-2	positive	Cardoso spoke of opening  communication channels and achieving social harmony.
20010906_12.55.04-23296-24	positive	Neyts is a resolute defender of world trade and the World Trade Organization (WTO).
20010831_23.55.20-21157-1	neutral	The 28 fishermen who were abducted on Tuesday [28 August] morning in Lake Tanganyika have been released without any ransom being paid.
20020207_20.23.04-14788-7	negative	Following a brief introduction, it recalls that on 4 February 1992 the now president violated his military oath when he rose up in arms against the democratic institutions.
temp_fbis_21.07.24-28603-24	negative	The Pentagon's quadrennial defense review issued last September -- which highlighted the rising Chinese threat -- and the recent testimony by the CIA director to the US Senate on China's military modernization were indicative of the Bush administration's perception of China as a growing threat to US national security.
temp_fbis_20.34.33-18786-60	neutral	In addition to producing climate benefits, such measures will contribute to development and reduced local pollution in poor countries.
20020314_20.38.10-27533-11	neutral	A further four suspects were arrested in a similar operation in Frankfurt.
non_fbis_12.22.33-10622-36	negative	In short, because  the estimates of the scale and timing of atmospheric warming are  so uncertain, it is just not possible to assess the costs and  benefits.
non_fbis_08.35.40-23372-25	negative	"He's not just steering the economy into disaster, but he's  breaking fundamental concepts like right to savings and the rule  of law," says Abel Viglione, senior economist at local think  tank Fiel.
non_fbis_06.51.18-1222-16	negative	`To put it mildly the figures are very odd, with very low  turnouts in the cities and massive ones in the rural areas,  which is unprecedented in this country,' he said.
20011211_20.40.04-14266-5	positive	The law, which clarified voting procedures but maintained the controversial one-person, one-vote formula, was endorsed by the government in July, just over a month after the dissolution of the Lower House. 
temp_fbis_21.10.31-12974-131	neutral	As a result, the temperature doesn't change much in the equatorial and middle latitudes but changes a great deal in the polar regions.
temp_fbis_20.42.47-22260-5	positive	Protesters carried banners reading, "Ratify the Kyoto Protocol," and "Koizumi say 'No' to Bush: Stick to Kyoto Protocol."
20020330_20.59.14-2538-9	positive	The just-concluded Arab summit had unanimously adopted a Saudi peace initiative, which called for full Israeli withdrawal from Arab territory occupied in the 1967 war, the creation of a Palestinian state with East Jerusalem as its capital and a "fair solution" to the Palestinian refugee problem based on UN resolutions.
non_fbis_08.46.28-13637-6	negative	If we're not happy, that goes double for our public affairs  babysitters.
20020129_20.27.21-24397-15	neutral	As the opposition raises its head, the climate of plots takes shape.
20020224_20.48.55-4975-14	positive	It is preferable to gain China's understanding and cooperation on antiterrorism and strategic issues.
temp_fbis_21.37.46-9337-34	negative	The US human rights report also accuses China of taking advantage of anti-terrorism campaigns to crackdown on ethnic group people living in the Xinjiang Uygur Autonomous Region.
20020221_21.03.10-21966-3	positive	Meanwhile, Chang Shiao-yue, spokeswoman for the Ministry of Foreign Affairs, reiterated that the United States had briefed Taiwan on Bush's mainland visit before his departure and made it clear that the trip would not hurt Taiwan's interests.
temp_fbis_20.45.09-11809-14	neutral	If Japan does not give any support to possible US attacks on Iraq despite its understanding of the axis of evil rhetoric, Bush's expectations on the Koizumi administration will certainly change to disappointment.
temp_fbis_20.23.33-17594-16	positive	Japan even called for working out practical measures to have it enter into force.
non_fbis_11.08.55-4179-26	neutral	No updated figure was available  Thursday.
20020316_20.25.51-11532-9	neutral	According to reports, Israeli tanks, in the middle of the night on 20 February, attacked the eastern part of Gaza City housing the key facilities of the Palestinian Authority, shelling and destroying Palestinian broadcasting center, among other things.
20020315_20.42.08-18791-5	neutral	US Secretary of State Colin Powell said Washington was considering new sanctions following the results of the March 9-11 election.
20011003_21.57.16-1319-6	neutral	In April, in waters off Sumatra Island, an armed group ambushed a cruise ship.
non_fbis_08.09.29-13319-40	negative	Cabinet officials on Wednesday publicly accused the Buenos Aires  governor, Carlos Ruckauf, a former vice president and one of the  most powerful leaders of the opposition, of instigating the  looting to overthrow the government.
non_fbis_12.44.14-20223-19	negative	I was embarrassed by some of the press corps' comments during  Tuesday's Pentagon briefing.
20020321_21.05.18-8344-7	neutral	Zhu said the U.S. side should stop interfering in China's internal affairs by interfering in the Taiwan issue.
non_fbis_06.25.38-22700-1	neutral	GUANTANAMO BAY NAVAL BASE, Cuba -- You're the first-ever  American Muslim cleric to minister to a prison camp full of  suspected terrorists and one confides he has a weapon.
20020304_20.50.30-97-23	neutral	"The fact that at least 25-30 industrialised countries are likely to ratify the Protocol within this year is a clear signal that the Kyoto Protocol, with its legally binding targets and timetables, is the only effective international framework for combating global warming."
non_fbis_07.52.36-18982-25	neutral	The camp gets chilly at night and there are swarms of  mosquitoes.
non_fbis_04.51.05-27505-8	neutral	It signed the Optional Protocols to Convention  on the Rights of Child.
20011007_03.17.23-6711-50	neutral	After two years of stalemate, the Japanese government recently reorganized its aerospace development agency.
non_fbis_16.23.04-4326-16	positive	But what  began as a peaceful protest in downtown Buenos Aires, later  turned violent as riot police riding on motorcycles used tear  gas and rubber bullets to disperse hundreds of peaceful  demonstrators.
non_fbis_08.14.55-18533-3	neutral	The prisoners, their hands and feet shackled and their heads  covered by hoods, were loaded single file onto the plane at  Kandahar Airport.
20020202_20.37.52-21155-19	neutral	And there is no guarantee that a political destabilization of the region would bypass even Chile, where memories of the military dictatorship are still very strong.
20020315_20.22.38-4806-15	neutral	According to ITAR-TASS, a famous Russian politician (Piacheslav Nikonov), president of political fund, said that it would be hard to imagine something more ineffective than Bush's axis of evil dogma, and went on to point out the following: In recent years on the Korean peninsula, all efforts were channeled to promote dialogue between the North and the South.
20020121_21.31.10-15710-0	neutral	Moscow, 21 January: President Vladimir Putin visited the Khrunichev space centre on Monday evening [21 January].
20020128_20.36.05-804-7	neutral	Former Hamas spokesperson Ibrahim Ghosheh and spokesperson for the Muslim Brotherhood Jamil Abu Baker took part in the conference.
20020314_20.23.54-19638-33	negative	A typical example: An international conference of representatives of nongovernmental organizations from more than 150 countries, held in Brazil, adopted a resolution criticizing Bush's "axis of evil" argument.
20011218_21.00.30-21204-8	negative	Moreover, he found the measures taken by the government to control the [movement] of foreign exchange and limit the flight of capital were "regrettable", even though these measures were made more flexible later on.
20020125_20.20.40-16093-6	positive	"We set out to get a group that would be independent, a group of men and women that would have integrity, who are highly respected within the society, to request them to help organise the Loya Jirga," Annan said.
20020419_21.31.07-25924-3	positive	He added "we understood that if there were a civilian who had committed himself to call for elections he should receive a vote of confidence."
20020128_20.43.50-5456-5	negative	One must not confuse "justice and vengeance," lest one lose one's "moral advantage," European commissioner Chris Patten explained.
20020206_20.23.00-9795-30	neutral	We must prevent his attempt to exercise power as if he had won on 4 February.
20020322_21.03.06-12522-8	neutral	Two PM pistols were found at the site.
20011024_17.55.28-22100-11	negative	The US official told reporters traveling with Powell en route to Shanghai for an APEC meeting that he unequivocally denied the Washington Post report that said the Bush administration was considering such a move, specifically to allow sales of spare parts for mainland Chinese-owned helicopters as another weapon in the US war on terrorism.
non_fbis_06.21.24-4640-25	neutral	Rep. Vito Fossella represents the 13th Congressional District of  New York, including Staten Island and parts of Brooklyn.
temp_fbis_20.36.23-26588-3	neutral	To this end, Aznar and Prodi report that only the internal ratification processes in each of the member states have now to be concluded and they emphasize that these are at an advanced stage and in some cases have been completed.
non_fbis_11.11.15-6639-16	negative	Such desperation by  Mugabe should not be condoned by African leaders.
20020206_20.31.05-16359-10	negative	The US administration has already decided to "punish" any country it believes poses a danger to the Hebrew State.
20011124_20.49.26-27556-1	neutral	The talks focused on the need to rehabilitate Afghanistan to pave the way for the safe return of the estimated four million Afghan refugees living in neighbouring countries, foreign ministry spokesman Daisuke Matsunaga said.
non_fbis_06.29.16-13721-27	negative	Washington says no, because the Taliban had  no clear chain of command and was not a legitimate government.
20020201_20.45.53-22539-9	negative	"The accusations of ill treatment," Secretary Rumsfeld said, "are completely untrue.
20020320_11.58.59-16532-6	neutral	Li Jiaquan, research fellow at the CASS Institute of Taiwan Studies, said: During his visit to China, Bush steered clear of the Sino-US three joint communiques and one China on two important occasions, his joint conference with Jiang Zemin and his speech at Qinghua University.
20020322_21.05.41-14545-48	negative	If Mugabe were to announce his retirement before the expiry of his six-year term and ZANU PF were to field any of his less illustrious colleagues as a presidential candidate, without a fundamental change to the rules, Zimbabweans will learn an even more bitter lesson: ZANU PF will "steal" that election again.
20020125_20.19.13-15223-3	positive	"Thus, the Supreme Council calls on the Foreign Ministry to send a memo to the United States government," he said at a press conference after chairing the meeting at the Umno headquarters, here.
non_fbis_06.21.24-4640-13	negative	As I toured Camp X-Ray, I stared into the faces of evil.
non_fbis_11.08.55-4179-24	neutral	With an outdoor movie theater, bowling alleys, a McDonald's and  a mini-mall, Guantanamo Bay is a curious slice of Americana on  the edge of the Caribbean.
temp_fbis_20.13.06-23605-1	neutral	He said the Vietnamese Government has mobilized all resources and strengthened its international cooperation in addressing environmental issues.
20011224_21.09.23-6361-6	neutral	It had recently stopped in the east African country of Djibouti, a neighbour of Somalia, which has been linked to Usama Bin Ladin's al Qa'ida terror network.
20011111_20.49.23-18398-4	neutral	Saini said the rebels, most of them foreign mercenaries, had recently entered the district across the Line of Control -- the de facto border that divides Kashmir between India and Pakistan.
non_fbis_06.21.24-4640-6	neutral	Far from being treated inhumanely, the al Qaeda and the Taliban  terrorists are better fed, better clothed and better cared for  than they would be if they were still roaming the cold caves of  Afghanistan.
non_fbis_20.43.13-27926-6	neutral	US  military engineers are preparing to build up to 2,000 such  cells, if necessary; more than 400 prisoners are still being  held in Afghanistan.
20020114_11.18.53-27931-12	positive	Local Government Assistant Secretary Abraham Iribani called on Saturday for sobriety among Muslim leaders and Moro National Liberation Front commanders amid alleged attempts by certain groups to start a religious war over Misuari's detention.
20020318_20.48.00-11907-24	positive	The two, along with Australian Prime Minister John Howard, are members of a Commonwealth panel charged with assessing the election and recommending possible action by the group against Zimbabwe.
non_fbis_08.54.02-18235-10	neutral	'N space?
non_fbis_12.22.23-26451-3	negative	Meanwhile, a group of up to 800 veterans of Zimbabwe's  independence war has asked for foreign help to mount a rebellion  against Mr. Mugabe if he steals the election.
20020214_20.43.10-5176-1	neutral	Bush's Asian trip was initially scheduled for October last year but was delayed due to the Sept. 11 terrorist attacks in the United States and subsequent U.S.-led war in Afghanistan.
20020224_20.48.55-4975-18	positive	For the US-China cooperation to become a "new milestone" for peace and stability, it is necessary for China to become a nation with higher transparency.
20020219_20.52.48-16582-19	neutral	It is very unlikely that the United States would be involved in a war with it.
non_fbis_12.22.33-10622-6	neutral	Herb Dhaliwal, the federal Energy Minister, weighed in with even  more qualifications: "Some important details have to be worked  out before Canada ratifies the Kyoto Protocol," he said.
20011017_22.36.22-2937-6	neutral	Kazakh Oil paid more than 34bn tenge [the current exchange rate is 148 tenge to the dollar] to the budget in the period, that is 60 per cent up year on year...
20020221_21.03.13-21992-5	positive	Bush reiterated his support for the Taiwan Relations Act, under which the United States is committed to providing the island with the means to defend itself.
20020118_21.16.15-1122-16	neutral	"For us there cannot be special courts.
20020131_20.58.51-26741-17	neutral	Cde Mudenge said since the Malawi summit, the Government had taken a number of initiatives to implement most of the decisions in relation to Zimbabwe.
non_fbis_12.46.57-22041-19	negative	Such incidents have been rare, however, and most of the camp's  158 Muslim fanatics are compliant, the guards say.
20020326_21.07.32-24343-11	neutral	At the rear of the spaceship is the propulsion capsule to provide thrust to the spaceship in orbital control and return to earth.
20020220_20.52.31-12963-4	positive	But what was most interesting is that, for the first time, a Palestinian Arab, Dr Sari Nusseibeh, the top Palestinian National Authority official in Jerusalem and president of Al Quds University, addressed the Israeli pro-peace rally.
20011207_21.24.12-20558-2	neutral	They will be shipped to Islamabad on Tuesday from Narita airport, east of Tokyo, ACEC officials said.
20020403_20.59.27-22386-8	negative	He said Pakistan is attempting hard to put India in communal flames so that forces are withdrawn from the borders to deal with the internal situations, thereby leaving field day for ultras to cross over to this side.
20020225_21.00.49-23712-15	negative	Israel does not want the Palestinians to be part of the same country, or have one of their own.
non_fbis_13.08.06-1812-6	neutral	The problem cropped up after the empty flatcar moved down 17  feet of track at a snail's pace of less than a half-inch per  second.
20011125_21.01.04-6923-19	neutral	"So there is quite a job to be done in creating a secure environment for humanitarian assistance."
non_fbis_12.22.33-10622-12	neutral	It would cost Alberta somewhere between  $3-billion and $6-billion.
20011231_21.05.45-10422-4	neutral	Legislators Request Action from the Brazilian Government
20011220_21.22.09-18839-49	neutral	The amount of freight transported by pipelines totalled 184.2 million metric tons, which was 2.1% less than in January-October 2000 as a result of a decrease of 5.5% in the volumes of natural gas pipage and a 6.4% decrease in through shipments of oil.
20020322_21.03.06-12522-4	neutral	The incident happened on the Perm-Kudymkar motorway 6km from the Karagai village of the Perm region at about midnight.
non_fbis_11.57.16-2305-2	neutral	The space shot might be rescheduled for this evening, but a  decision won't be made until this morning, a NASA official said  Thursday.
20020131_20.50.32-16604-18	neutral	Therefore, even if Powell agrees with the refusal to grant prisoner-of-war status to the 158 captives, he believe that the US refusal to cover the captives under the Geneva Convention would set a precedent that could affect the fate of US soldiers sent out to risky areas of this planet.
20020322_21.05.41-14545-42	neutral	The latter are alleged to have voted for Mugabe.
non_fbis_10.12.58-29108-20	positive	Fixing the problem may require not just  accounting savvy, but also deft diplomacy.
non_fbis_16.01.33-12919-39	neutral	Therefore, the "Chinese Gagarin" will probably say "Go!" no  later than 2005.
20020125_20.18.05-14490-8	neutral	Another 270 are being detained by the US military in or near Afghanistan.
non_fbis_08.03.05-5625-39	neutral	The chances of contagion are now  viewed as minimal.
20020322_21.05.41-14545-41	negative	Thus, it was the President who banned postal voting by all Zimbabweans outside their constituencies except members of the army and the police.
non_fbis_16.01.33-12919-2	positive	The 47th congress of the International Federation of  Astronautics that took place six years ago in Beijing was  remarkable for the large number of cosmonauts who participated.
non_fbis_16.01.33-12919-3	positive	There was even an Austrian there, but the country who organized  the forum, the third country on the rating of space explorers,  was not represented.
20020320_11.38.42-28823-1	positive	Boyce acknowledged that the Indonesian government had taken serious steps to ensure the personal safety of American investors and other foreigners, who appeared at risk several months ago during the political tension following the US-led war against Afghanistan's Taliban regime.
20020418_21.37.20-19607-17	negative	These criminals know this fact, as much as we, the Arabs, do, because they are in direct contact with it.
20020201_20.45.53-22539-47	negative	And in any case, it did not apply even to black people held in jail in the southern United States until a few years ago.
20020304_20.50.30-97-16	neutral	To protect our climate we will have to reduce emissions.
20011124_20.49.56-27748-5	neutral	He suggested that Kuala Lumpur would have to take the initiative, saying that Misuari had apparently violated Malaysian law by entering the country without a passport.
20011112_20.33.31-29984-4	neutral	During September alone, this average dropped to 1.64 million.
20020326_20.55.44-16289-4	neutral	Halasa and the other two suspects are out on bail pending further investigations, the sources said.
non_fbis_06.44.52-19992-39	neutral	The detainees also get fingerprinted and photographed.
non_fbis_07.05.30-9348-6	negative	President Bush caused an international outcry when he rejected  the 1997 Kyoto protocol on climate change last year, saying it  hindered US economic growth.
20020228_21.12.01-14811-4	neutral	The second reactor, which is to be commissioned in 2005, is also built on CANDU technology and estimated to cost $700 million to complete.
non_fbis_05.22.13-11526-5	neutral	The fledgling MDC won 57 of 120 elected seats in June 2000  parliamentary elections as Mugabe's popularity plunged amid  economic devastation and chaos.
