20020509_22.11.01-7259-2	negative	"AIDS is casting shadow on Asia's economic miracle, and is turning into a global crisis, as the region accounts for 60 percent of world's population," says Michel Sidibe, Director of the Country and Regional Support Department of UNAIDS.
non_fbis_12.22.33-10622-7	neutral	"I  wouldn't sign a contract in business unless I knew exactly what  it meant."
temp_fbis_21.37.46-9337-11	negative	But it nevertheless uses human rights issues to slander China," CSSHR President Zhou Jue said.
non_fbis_10.24.29-21670-5	neutral	China always holds that anti-terrorism campaigns should be based  on irrefutable evidence, and anti-terrorism attacks should not  be expanded arbitrarily, said Kong.
20011220_21.22.09-18839-9	neutral	In the manufacturing industry , which accounts for nearly three-quarters of all industrial production, output volumes increased 19.6% over the course of the first ten months of 2001 as against the corresponding period last year.
temp_fbis_20.58.47-19000-13	negative	Furthermore, a review of the effectiveness of the measures will not take place before 2012.
20020118_21.16.16-1134-9	neutral	A spokesman for Prime Minister Tony Blair refused to say how many British officials had travelled to the camp.
20020326_21.07.32-24343-1	neutral	People have seen the true features of these space capsules.
non_fbis_08.14.55-18533-30	negative	Senior military officials have said they are increasingly  concerned that there are other equally sophisticated and  well-fortified underground complexes elsewhere in Afghanistan  that could become guerrilla bases for remnants of the Taliban  and Al Qaeda forces.
20020121_21.25.31-10464-15	negative	Humanitarian organizations, however, believe that the Geneva Convention can be applied to these prisoners and that it states that they must be treated humanely and be subject to other rights in the place that has been baptized "Camp X-Ray", in allusion to the building of the covered sheds with barbed wire in place of walls [that house the prisoners].
non_fbis_12.46.57-22041-1	negative	American Marines are bruised by criticism of their treatment of  Taliban and al-Qa'eda prisoners, reports Toby Harnden in  Guantanamo Bay, Cuba
20010914_22.24.21-23558-3	positive	The file said that Libya had demanded his extradition.
20020225_21.00.49-23712-0	negative	The buffer zones that Ariel Sharon intends to establish are an explicit admission that Israelis can no longer live by the sword, that the occupation is not working, and Israeli reprisals are not meeting with success.
non_fbis_13.44.36-19236-31	negative	"If the people of Zimbabwe have a sense that they have been  cheated through the election process, it is possible that some  could resort to violence," said the foreign minister, Alexander  Downer.
non_fbis_04.08.51-29183-19	neutral	One of them had lost not just its  face but its entire head.
20020202_20.37.54-21168-67	neutral	The 12, 18, or 24 installments into which time deposits will be divided, depending on their amount, may be endorsed.
temp_fbis_21.50.57-15245-7	negative	Following a series of domestic reforms, especially in the agriculture, energy and banking sectors and describing communism and capitalism as futile, Chavez caused the business leaders, bankers and capitalist to distance themselves from him and thus paved the way for their opposition to his power.
non_fbis_03.47.06-11142-6	negative	Tinkering has left voting procedures so confusing in Harare that  even Mugabe and his top aides appeared unsure of where the  president was to vote.
non_fbis_09.35.06-27851-0	negative	Mugabe rigged Zimbabwe polls: Britain
20020114_11.18.53-27931-28	negative	Aside from the sensitive legal questions, Pimentel said there is a growing impression that Misuari could pose a security threat to the country.
temp_fbis_20.34.33-18786-57	neutral	Regardless of the shape of the measures in Norway, Norwegian businesses as well ought to contribute to reducing emissions in poor countries.
20020314_20.41.01-29272-20	neutral	Germany's Foreign Ministry spokesman Andreas Michaelis said that "all information points to the fact it cannot be assumed there were equal chances for the candidates in this election."
20011208_20.31.54-28680-7	neutral	One of the main US diplomatic goals for this year is to persuade the international community to accept the NMD and Russia to agree to revise the Anti-Ballistic Missile Treaty [AMD] by flashing a carrot on a stick.
20011230_21.17.41-25537-41	neutral	That leaves the most economically realistic solution, the one backed by the technical experts: Floating the currency, but it is also the most risky.
non_fbis_08.46.28-13637-46	negative	"This  is bullshit," thunders another print reporter.
20020403_20.59.27-22386-17	positive	Dr. Abdullah presented best teacher award and appreciated the performance of student artists who presented cultural items.
non_fbis_12.45.44-23455-12	positive	The world's latest space tourist -- dubbed an Afronaut back home  -- has generated huge excitement in South Africa.
non_fbis_06.11.16-17420-4	neutral	Prescott, Britain's front man in pushing the accord, said the  United States until recently was critical of the science that  led to the Kyoto pact but has now accepted it, and he remains  optimistic that the goals of the United States and of other  signatory nations would converge.
20020129_20.52.23-14674-9	negative	The Government has accused Britain of being a player in Zimbabwe's internal politics, saying it would therefore not be an impartial observer.
20020201_20.41.37-18755-3	negative	Bush specifically named North Korea, Iran, and Iraq, countries that were formerly referred to as pariah and evil nations.
temp_fbis_21.37.33-17834-12	neutral	11 terrorist attacks on the United States and for its participation in the post-war reconstruction of Afghanistan.
20011107_15.37.27-28157-6	positive	Israel seems to think that this tactic will circumvent the Palestinian move toward independence and will put an end to the Palestinian intifadah by surrounding the areas of tension and dealing with them separately.
20020207_20.23.04-14788-34	neutral	"President Hugo Rafael Chavez Frias' is not a military pathology, but that of a man blinded by power, who believes himself to be the incarnation of our Liberator [Simon Bolivar].
temp_fbis_22.34.58-23977-4	negative	"China has always resolutely opposed any form of official exchanges or military intercourse between the United States and Taiwan," Zhang said.
non_fbis_12.09.12-23643-7	negative	Not only has Australia's opposition Labor Party called for  Hicks, currently held at Guantanamo Bay, Cuba, to be returned  home, but a Supreme Court justice has described Hicks as "a  casualty" of his own government's attempt to maintain favor in  Washington.
20020217_20.53.10-28693-11	neutral	On the eve of his departure for Asia, Bush said he would discuss with Beijing trade issues arising from China's entry into the World Trade Organisation (WTO), the global war on terrorism and the fate of Taiwan.
non_fbis_08.39.09-12713-32	neutral	Police fired tear gas and rubber bullets at one restless crowd,  injuring at least 12 people.
non_fbis_11.35.22-9439-7	neutral	He watched as the shuttle,  a ghostly white against the blackness of space, drew ever  closer.
20020331_21.09.25-22686-2	neutral	The escalation of the conflict has now cost over 1,000 people their lives in the space of the past 18 months.
20020226_20.56.51-26264-13	negative	However, the repeated Israeli message is the resort to all means to impede the march for peace and to consecrate violence and counter violence.
non_fbis_08.39.09-12713-45	negative	"I think this is the final nail on the  government's coffin.
temp_fbis_21.03.47-22424-54	neutral	Taiwan has no need to announce independence, and there won't be any problem if only the name "Taiwan" is used.
20020418_21.37.20-19607-6	neutral	All this is one thing, but the Palestinian people's will is something different.
non_fbis_08.39.09-12713-28	positive	But he wanted to sound his voice.
20011221_20.54.40-10484-12	positive	I would like these representatives to explain the fact to the EU, which forgot the 1960 Constitution that the Turkish Cypriots are not minority and the Greek Cypriot side which wants to join the EU unilaterally and as if it was the legitimate government of Cyprus is not expected in the EU.``
20020211_20.26.52-10078-3	neutral	NIEHS said that the conference will mark the start of joint scientific research on the impact of defoliant sprayed by the US Air Force during the war in Vietnam.
20020218_21.01.07-18921-8	negative	They need not be nervous," he said.
20020121_21.15.10-2135-3	neutral	Participants in the meeting included Afghan interim administration chairman Hamid Karzai, US State Secretary Colin Powell, US Treasury Secretary Paul O'Neill and World Bank President James Wolfensohn.
temp_fbis_21.31.45-20536-0	negative	Govt dismisses US rights report
20020206_20.23.00-9795-20	negative	4 February was such a failure that Chavez, even though it pained him, had to accept democratic methods to reach power.
non_fbis_04.33.07-17094-9	negative	"We foresaw electoral fraud but not daylight robbery,"  Tsvangirai said.
non_fbis_12.22.23-26451-38	negative	The opposition leader has been  accused of trying to assassinate Mr. Mugabe.
non_fbis_11.35.22-9439-8	neutral	As Endeavour slowly closed the final 40 feet, Culbertson rang  the ship's bell aboard the space station and announced in the  tradition of the high seas, ``Endeavour arriving.''
20020128_20.41.17-4020-2	neutral	Two additional transports will carry the other soldiers (a total of 48).
20010627_23.46.20-17835-4	neutral	Forestry experts said dry weather and temperature fluctuations were the main cause of sandstorms.
20020215_20.43.51-9328-3	neutral	Iliescu met with Shoichiro Toyoda, honorary Toyota chairman, and Fujio Cho, president of Japan's largest automaker.
non_fbis_15.16.19-1897-5	neutral	Experts  believe that the 4mm gap between the ship and the station's  docking unit has been caused by an object, which now prevents  the tight joining of the two space vehicles.
20020327_20.50.33-2917-14	neutral	In the group were former Bank of Mexico Governor Miguel Mancera, who dealt with the peso crisis in 1995; a former Chilean Central Bank president who faced the 1982 crisis, when the Chilean GDP dropped by 14 percent; former IMF Fiscal Affairs Director Vito Tanzi; an expert in restructuring the Spanish debt; and former Brazilian Central Bank President Gustavo Loyola, who lived through the time of the Collor government's withholdings and of the Proer [Program to Encourage the Reorganization and Strengthening of the National Financial System] - the program to restructure the Brazilian banking system.
non_fbis_12.21.28-26118-8	neutral	Governments are expected to  protect the national economy, and they should deviate from that  mission only when crucial national interests are at stake  (fighting terrorism, for example).
20020204_20.38.59-25700-10	positive	The unanimous opinion of the media is that he was successful in this.
20020217_20.53.05-28623-13	negative	Taiwanese officials are nonetheless concerned.
20020122_20.36.01-11616-53	neutral	If it emerges that the person concerned cannot be removed from British territory because he is in serious danger in his own country, he can be detained almost indefinitely under this law.
20020320_11.41.36-1407-27	neutral	Then what?
20010927_23.18.15-25073-4	positive	Putin has exceeded the "positive neutrality policy" his country (the Soviet Union at the time) has pursued during the Gulf War, and whose continued validity the military leaders also regarded as desirable.
temp_fbis_21.28.50-13504-41	negative	And, around this small piece of the United States, the Cuba of old man Castro, who up until now has not batted an eyelid, and has renounced using the scandal of X-Ray and attacking the 'hated Yankees' with his propaganda, relying on the possible end of the embargo against his regime.
20020314_20.38.10-27533-16	neutral	According to a police spokesman, more than 500 officers took part in the joint operation.
non_fbis_08.47.00-17401-14	negative	While there are no protesters in the streets, there is an air of  indignation here over Washington's "do-it-our-way" decision on  something that effects the whole globe.
non_fbis_11.08.41-17418-3	neutral	Speaking publicly for the first time since government election  officials declared him the winner four days ago, Mugabe returned  to the themes he struck during his campaign against Morgan  Tsvangirai, a former trade union leader.
non_fbis_08.46.28-13637-64	positive	(He declared January  "Americans' Month" and invited Jimmy Carter for a visit.)
20011218_20.35.25-594-17	neutral	People will likely remember the fact that the United States withdrew its delegation from the UN conference against racism held last September in Durban, South Africa.
20010830_01.03.02-16670-9	neutral	However, through the protests of local labor groups, foreign laborers' working rights were protected, bringing extra attention to the power of Taiwan labor groups.
20020331_21.09.25-22686-28	neutral	Prior to the Natanya massacre Washington had imposed a number of limitations on Sharon.
20011218_21.00.22-21144-36	neutral	But in the future?
non_fbis_08.09.29-13319-17	neutral	More than 50  police officers were reported hurt in the disturbances in the  capital alone.
20020128_20.50.06-12228-2	neutral	In order to avoid any misinterpretation, the president let it be understood that the Kremlin is full of resolve to maintain both Russia's place in the civilized world and its defense capability at the proper level.
temp_fbis_20.34.33-18786-13	neutral	In the eastern part of Norway the biggest increase in precipitation will be in the winter.
20020224_20.48.55-4975-8	negative	Bush redefined China as a "strategic competitor" and increased the sales level of arms to Taiwan.
20020205_20.41.01-8736-8	negative	Whereas Bush has "single-handedly destroyed" the initial relationship she had established with Korea during the Clinton age.
non_fbis_03.23.00-19213-14	neutral	"These were two isolated incidents, in that the detainee  movement was something that we did not get official notification  that we were going to do until this morning," Lt. James Jarvis  said.
non_fbis_08.06.09-13335-5	negative	The Bush administration has been under international criticism  for not treating the detainees humanely.
temp_fbis_21.28.50-13504-0	neutral	On their knees during an inspection, and chained up in their orange overalls.
20011218_21.00.22-21144-34	neutral	The other solution is the opposite of the first one: the departure of the Israelis to more hospitable climes, in the United States or Europe.
20010906_12.55.04-23296-60	neutral	Their criticism that we obstruct agricultural products from the south is justified.
20020217_20.53.05-28623-1	positive	Washington had guaranteed Taipei that it would not dilute its backing for the island in return for better relations with Beijing, Taiwan's foreign ministry spokeswoman Chang Siao-yueh told AFP.
non_fbis_10.12.58-29108-14	negative	The project's  costs, like those of the space-shuttle program before it, have  ballooned far beyond original estimates - from an initial $17.4  billion to more than $30 billion.
20020225_21.13.42-3998-7	negative	What is Europe.
20011029_20.27.05-27044-11	neutral	He was promoted to the rank of Lt. General on 28 October 1998, following which he was made the Corps Commander of Lahore.
20011220_21.22.09-18839-80	neutral	From the beginning of the year, the consumer price index (inflation index) measured 103.9% (123.3% during the corresponding period last year).
non_fbis_11.21.37-22256-4	positive	He said it was a ''beautiful historic coincidence'' that the  celebration came so soon after Venezuelans ``have written a page  of dignity and honor by going out into the streets to overthrow  the coup attempt.''
20020202_20.37.52-21155-29	neutral	"This is the minimum that has to be done.
20020122_20.32.32-8613-12	neutral	For the time being, the members of the British government who interviewed three prisoners of their nationality have received no complaints about the treatment they are receiving.
20020403_21.25.24-12160-9	neutral	Zarubezhneft has shipped $45 million worth of equipment and materials in keeping with 33 contracts.
non_fbis_08.10.09-13801-18	neutral	Depositors who worried that the  peso's fixed one-to-one exchange rate with the dollar was about  to be broken by a devaluation, despite Mr. Cavallo's insistence  to the contrary, were withdrawing dollars from bank accounts.
20010620_13.40.05-15087-7	neutral	She also had a skin rash and was vomiting.
20020212_20.42.04-19290-54	neutral	Last Wednesday the Merval index posted a sharp 5.94 percent rise when the stock exchange reopened.
non_fbis_06.20.40-8369-6	neutral	We have to  keep them happy and healthy.
20020318_20.33.16-3417-2	negative	America, in the guise of its so-called war on terror, has killed and injured thousands of innocent Afghans and the prisoners of war are maltreated."
20020508_21.58.34-17613-7	negative	Reacting to the threats launched by the US president George W. Bush against Iran he condemned the United States expansionist policies.
non_fbis_08.21.04-13527-11	positive	Japan and the U.S. can cooperate over the development of new  technologies in the field and that such technologies will help  notonly the environment but also economic development, they  agreed.
20011118_21.04.32-17074-1	neutral	A study by Dr Neil McKerrow, chief paediatrician at Pietermaritzburg's Metropolitan Hospitals Complex, shows that 50 000 Aids orphans live in the city.
20011220_21.22.09-18839-25	neutral	AGRICULTURE
20020414_21.16.03-15717-6	neutral	Venezuela is the third largest exporter of oil within OPEC and the fourth as far as worldwide production is concerned.
temp_fbis_21.10.31-12974-58	positive	" It is hard to disagree with this.
20020320_12.04.49-21742-25	negative	Instead, an Australian member of the Federal Parliament, Julie Bishop, vented her anger towards the President and Government, and the electoral process, in Australia's media.
20020118_21.15.18-84-8	negative	The six have been accused of having links to the al-Qa'ida network of fugitive Usama Bin Ladin.
20020315_20.42.26-19148-19	negative	Kaunda declined to give details and said Zuma would report back to Mbeki later on Thursday.
20020131_20.58.51-26741-2	negative	In his opening address to a Southern Africa Development Community land task force on Zimbabwe, the Minister of Foreign Affairs, Cde Stan Mudenge, said Zimbabwe was tired of being dictated to by the EU and the Commonwealth Ministerial Action Group instead of being engaged in dialogue.
non_fbis_08.39.09-12713-4	positive	A better life," says Martha, explaining why she voted for  MDC candidate Morgan Tsvangirai.
non_fbis_08.03.05-5625-27	negative	"But the I.M.F.  and both the Clinton and Bush administrations let them stay in  denial.
20011130_12.07.32-18094-11	negative	And, under the pretext of fighting terrorism, it violates human rights - rights which are global.
20010829_01.48.48-11084-9	positive	In his latest speech, Chen said the long-standing dispute with China must be resolved through dialogue with respect to the principles of democracy and freedom.
20020414_21.16.03-15717-12	negative	The fall of Hugo Chavez in Caracas is a crystal-clear message and warning by the US to anyone in the world who is contemplating to use oil as a political tool in the future.
20020122_20.36.01-11616-34	neutral	Under the protest of international and US human rights organizations but with the approval of large sections of the population, antiterrorism measures are being adopted in great haste.
non_fbis_08.10.09-13801-0	neutral	Finance Minister of Argentina Resigns Post
temp_fbis_21.28.50-13504-11	neutral	Because they are prisoners, admittedly, but in the view of the Americans they do not have the status of prisoners of war, and the Geneva Convention is not valid for them: "They are unlawful combatants, and we are not running a recreational center.
20010926_23.17.57-23406-9	neutral	Washington has remained the biggest arms supplier to Taiwan despite switching diplomatic recognition from Taipei to Beijing in 1979.
20020318_20.48.00-11907-4	positive	"I, Robert Gabriel Mugabe do swear that I will be faithful to the laws of the Republic of Zimbabwe, so help me God," said Mugabe who was flanked by first lady Grace.
20020415_21.33.22-7140-33	negative	However, it could be better.
20011221_20.54.40-10484-8	negative	They should not condemn us with lies and by deceiving the world,`` he said.
20020323_20.58.35-24209-10	neutral	Moscow and Ulaanbaatar are continuing a political dialogue, actively developing bilateral trade, and consulting each other on international problems where their stands coincide or are close.
temp_fbis_20.20.10-3414-14	negative	The US judgment of the practice of human rights depends on US interests as well.
20020216_20.54.07-4914-0	neutral	Washington has expressed concern to the Lebanese authorities about the possibility of a Hizbullah attack against Israel within the next couple of days, and requested that efforts be deployed to prevent such a development, official sources disclosed Friday.
temp_fbis_21.10.31-12974-87	neutral	This means the problem of reducing emissions is a problem of energy efficiency and energy saving.
temp_fbis_20.34.33-18786-55	neutral	The possibility of cooperating with other countries' early quota systems.
non_fbis_12.19.24-26050-7	positive	They should be brought to justice.
20010818_01.09.50-14694-19	neutral	Charges against the MDC leader arose after he allegedly told a crowd at the party's first anniversary last year that "... Zvatichada, what we would like to tell Mugabe today is that... please go peacefully.
non_fbis_08.11.35-9355-24	neutral	- Carmona resigns the interim presidency, and Chavez's  vice-President, Diosdado Cabello, takes over as acting  President.
non_fbis_12.45.44-23455-3	positive	The 28-year-old smiled broadly as he floated into the space  station and was embraced by its three occupants.
20011218_21.00.22-21144-47	neutral	This applies to all the problems under discussion, including, of course, the issue of Jerusalem and of the refugees.
20020314_20.23.54-19638-40	negative	Like this, it is inevitable for injustice to meet denunciation and rejection.
20020217_20.42.51-22299-4	negative	The peaceful protest was held at Ebisu park some four kilometers (2.5 miles) west of the US embassy, where the US president is to stay until Tuesday.
non_fbis_08.01.38-4843-19	positive	Officials say Mr. O'Neill supported the decision by the I.M.F.  to cut off Argentina's loans because it had failed to meet the  fund's demands for fiscal restraint.
20020315_20.42.26-19148-9	neutral	Mbeki, Obasanjo and Howard were mandated at the recent Commonwealth Heads of Government Meeting in Australia, to decide on Zimbabwe's fate once the Commonwealth observers mission submitted its report on the presidential election.
non_fbis_06.48.28-6852-14	negative	This is most unfortunate.
20011210_20.28.15-21486-10	positive	The statement urged the statesmen in different countries to heed the religious teachings calling for respect for human rights and said that no peace will be established without honoring human
20010916_21.24.32-9824-15	neutral	Tiger guerrillas, leading a campaign for an independent homeland in the island's northeast, have carried out several attacks against navy and merchant ships, including using boats carrying suicide bombers on more than a dozen naval craft.
non_fbis_04.24.14-26782-2	positive	The United States has demanded that wording on bringing the  Kyoto Protocol on global warming into effect in 2002 be excluded  from the implementation documentation of a global environmental  agenda being drawn up at the third session of the preparatory  meeting of the U.N. Conference on Environment and Development  (UNCED), sources said Thursday.
20011201_21.19.03-816-27	neutral	The SSTC's overall budget will not suffer from this.
20020204_20.24.49-8480-5	positive	It convened a joint meeting by the Republic's government and political parties and organizations and announced the three appeals and three proposals, which reflect the entire nation's unanimous desire and will.
20020320_12.04.49-21742-13	neutral	But there was still an unanswered question in the minds of the Commonwealth leaders: How had the British Prime Minister seen the purported "Commonwealth report on Zimbabwe" when they had not?
non_fbis_12.09.12-23643-3	neutral	But the detention by US forces of Australian Taliban fighter  David Hicks has provoked tensions that could fray the bilateral  goodwill.
20020124_20.36.11-21342-4	neutral	He was speaking after American John Walker Lindh, captured while fighting for the Taliban, arrived handcuffed and shackled at Dulles International Airport outside the US capital late Wednesday and was taken to a nearby jail.
20020320_12.04.49-21742-11	positive	Then Mudenge proposed that Britain and Zimbabwe bury past differences and work together in the future.
20011024_21.14.53-15562-2	neutral	The forum attracted wide attention both at home and abroad, as China is to be admitted into the WTO at the forthcoming new round of WTO multilateral trade talks in Doha, Qatar, in November.
20020207_20.23.00-14747-5	neutral	We have yet to visit Korea and the relationship with Iraq and Libya is a result of the fact that both countries are OPEC members."
20020122_20.31.55-8089-5	neutral	As such they face the prospect of being subjected to the due course of law and in the final analysis perhaps sentenced to death in closed military courts instead of in open courts, as is the right of prisoners of war under the terms of the Geneva Convention.
