1377	positive	Rockers big winners at Brit Awards
1051	negative	Judge threatens to shut down Air-India inquiry
1422	neutral	Cuban official: Web a 'wild colt'
1081	positive	Canadian breakthrough offers hope on autism
80	neutral	Google to unveil election mashup
1020	neutral	Basics: a mammal in winter with a furnace of her own
1073	neutral	Livingstone's transport empire may extend
1401	negative	South Africa mourns Adelaide Tambo
1306	negative	Sex torture claims hit Russia army
1210	neutral	There can be no greater injury than the killing of one's spouse. The attempts to make the position of Mrs Hani irrelevant is completely out of context with our common law,
812	neutral	by William A Fleckenstein that his policy of keeping rates too low for too long inflated the housing bubble. The collapse in the US subprime-mortgage market led to about $1.2 trillion in write-downs and the bankruptcy of Lehman Brothers Holdings Inc. Given the decoupling of monetary policy from long-term mortgage rates, accelerating the path of monetary tightening that the Fed pursued in 2004-2005 could not have prevented the housing bubble,
1133	negative	It worries me and it should also worry Hamas. That is why I would recommend to Hamas to quickly make a deal. They will not get better terms than these,
680	neutral	It's hugely dangerous to the Labour Party,
701	neutral	Perhaps McLaren Mercedes doesn't come to Melbourne with the same prospects to challenge at the front that we experienced in both 2007 and 2008, but the whole team will be working tirelessly to help us move back to the front,
921	neutral	The meeting, convened and chaired by His Highness the Amir Sheikh Sabah Al-Ahmad Al-Sabah, dealt with key domestic issues and concerns of the homeland,
965	neutral	The Gospel According to Jesus Christ,
1152	neutral	There was an agreement through the Egyptian mediator that Israel releases 450 Palestinian prisoners whose names were submitted by Hamas in exchange for Schalit,
1232	positive	We will not release a player like Ribery who still has two and a half years on his contract. You don't sell such a player, you keep him,
280	neutral	Go wash that avocado tree, Mr. Obama, go wash that avocado tree (...) whoever wants to can translate it to him in creole, I have nothing more to say. Don't say later I began to throw stones,
1525	neutral	Lieberman tried to delegitimize the Israel Police,
1428	neutral	The assumption made in our focus on Europe was that there would be no invasions of anyone's land borders. Well, that turned upside down. And that created an angst, a sense of tension among many of the NATO nations,
950	neutral	Confronting the Yugoslav Controversies: A Scholars' Initiative,[*]instructed his principal assistant, Christopher Hill, to draft the memorandum to be signed by Karadži?,
1543	neutral	We are currently negotiating with certain international institutions, in particular, the European Investment Bank and the European Commission. The next round of the talks is due to be conducted in Brussels on March 19 with the participation of Ukraine's Prime Minister,
1165	neutral	I will not call anyone in place of Di Natale,
1185	neutral	I believe Ozawa will decide on his own fate. As secretary-general, I will make every effort to get the entire party together behind whatever that decision is and I pledge to work together with unity.
1157	neutral	It is ironic to link this convoy with Hamas though we're still unsure if there was a convoy bombed by airplanes,
1040	neutral	I have been the member of Rajya Sabha from Madhya Pradesh for last three years and this state is not new for me,
1460	neutral	My forecasting record on this recession is about the same as the win-loss record of the Washington Nationals.
1111	neutral	The players want to finish on Sunday because they have to leave for Indian Wells (the venue for next week's ATP event), but we?ll see.
443	negative	Such parties mainly try to play on rhetoric, but the voter has become intelligent and does tactical voting. The Muslim voter's primary concern is to keep the Bharatiya Janata Party (BJP) out of power.
688	neutral	We are looking for the resumption of that dialogue so we can engage in discussion with our colleagues in the People's Republic of China and their Army, Navy and Air Force so we can have a sense of their way ahead,
1193	neutral	Due to the force's current financial position, we are unable to increase the number of police officers employed within South Wales Police,
289	positive	anybody who wants [Mr Obama] to fail is an idiot, because it means we're all in trouble
1390	neutral	Any changes to KFOR will only be made on the basis of a political decision by all allies. Such a decision will only be taken if all allies are assured that a possible reduction of KFOR will not jeopardize the safety and security of Kosovo. And that time has not come,
1003	neutral	At the moment we are going to take $20 million out of the Medical Fund of the National Insurance Board and use that to fund, initially, the unemployment benefit,
1171	positive	Founded just over five years ago, Air Arabia is now firmly established as one of the region's true success stories % and we are very pleased to be able to share that success with our shareholders, while still preserving sufficient capital to ensure the implementation our ambitious long-term growth strategy,
742	negative	The results were tampered with 100 percent by Kurds and the Iraqi Islamic Party,
1434	neutral	I would like to inform you that I signed the ratification ... so Croatia can join NATO at the summit at the end of next week,
685	negative	Ken Clarke is causing political carnage in the Conservative Party once again by coming clean on the Tory tax giveaway for millionaires.
448	negative	Now there will be efforts to come up with an excuse not to register the dangerous candidates -- primarily Nemtsov and Lebedev. They might let Lugovoi in, although that, of course, would be a bit of a scandal for the election,
1526	positive	Their kindness was exploited by the terrorists… Helping citizens - This is Israel Police's true calling, this is how commanders and officers educate officers. We will continue that tradition and protect the country everywhere,
650	positive	First, I wanted people to see that the Supreme Court isn't all male,
1451	neutral	When I saw Leon Osman getting hit on the head at Blackburn this week I just felt, please no, with our luck it could have been a fractured skull!
814	neutral	We have had a big advantage and Real Madrid have cut it back by eight points in three weeks. But we will continue forward,
1425	neutral	The secretary is not backing off his fundamental criticism that NATO needs to do a better job in training for counterinsurgency. But he is not -- nor has he ever -- criticized any particular nation for their service in Afghanistan.
367	neutral	Mugabe is going to try to hold onto his man (Gono) as much as he can because I don't think he wants to create an impression that the men and women who have been with him through thick and thin are expendable,
732	neutral	I haven't offered much advice on this tour to Strauss nor have I been asked for it,
433	positive	a great kickoff of what we hope will be an atmosphere here in the White House that is welcoming and that reminds everybody that this is the people's house,
1230	neutral	Australia will only support changes within the International Whaling Commission that bring us closer to our goals to eliminate whaling for good,
1134	positive	Hamas exerts its utmost effort to end the peevish rift which has divided the Palestinian family and destroyed the Palestinian society,
372	positive	It has truly been a most memorable season in Irish rugby history and great credit is due to the coach Declan Kidney, team captain Brian O'Driscoll and the entire playing squad.
1440	positive	We need Russia for the resolution of European and global problems. That is why I think it would be good for Russia to join NATO,
1532	neutral	The only way to do this is to depoliticize the debate and focus on a practical necessity of robust OSCE presence Flexibility on all sides is the key word.
798	neutral	The Arab League is watching with interest the improvements in Iraq as it continues along a path towards stability,
741	neutral	Peace... is a common and enduring goal for all Israelis and Israeli governments, mine included. This means I will negotiate with the Palestinian Authority for peace,
777	neutral	It was evident from today's discussions that a large number of member states ... do not want further extensions of reduced VAT rates,
684	neutral	I totally refute these allegations. Since 2001 when I opened my constituency office in Swansea, I have always had a joint leasing arrangement with Swansea West Labour Party for certain equipment, which is used by both my office and the local party. This equipment has been upgraded as and when they are no longer functional for the job required. All of these costs have been cleared by the National Assembly's Fees Office.
1278	neutral	The latest rally is rebounding from the most recent lows in mid February when oil has fallen to 34 dollars a barrel, and supported more recently by recovering in equity indices and speculation about further OPEC supply cuts,
529	positive	We want to congratulate Brad Pitt for making it right and to hear more about how we can work together so this can be replicated throughout the country.
1017	neutral	A little bit of profit-taking and a little bit more reality. Whatever spending plans the Federal Reserve put in place will take half a year at least to seep through,
1416	neutral	The Taleban can't beat us. They don't pose a tactical or strategic threat to Nato and Isaf forces.
1380	neutral	As the Bank of England is to try quantitative easing, this should, theoretically, encourage banks and building societies to lend more to their customers,
1066	positive	This is very important. We are talking about the Airbus of the car industry. The Government cannot afford this brinkmanship. GM Europe has just a month of money left.
1121	neutral	Hamas has no veto on presidential and parliamentary elections despite our large majority at the parliament,
1168	positive	Even when the country is going through tough times, Comic Relief shows us that Britain is filled with people willing to go that extra mile to help somebody else.
651	neutral	The Supreme Court has dismissed the appeal by the state against the High Court decision to grant him bail,
327	neutral	In a nutshell, it is 11 years since the fixed-line business was supposedly open to competition. After 11 years, France Telecom still has an overwhelming position.
534	negative	The Dalai Lama has not served the religious harmony but instead repeatedly makes troubles,
936	neutral	Now we must improve the team that we can reach our goals in the Bundesliga and the Champions League,
1219	neutral	We would urge anyone who has seen or found trousers similar to these, possibly abandoned, to contact North Wales Police.
335	negative	raise significant questions about what information Merrill Lynch and Bank of America executives shared with federal officials that oversaw the Merrill acquisition by Bank of America,
1559	neutral	This is the Greens' views ... And the agency caused problems the last time when we tried to get a majority of our members to support the Lisbon Treaty,
508	neutral	With an Oceania qualifier still outstanding it is quite likely that we will have Samoa in our pool again, which will also be a tough one. For the first time in our World Cup participation since 1995 we will play another African team in the Pool phase, which will be challenging.
736	neutral	I would like to insist in agreement with the president that the mechanism used to deploy the money is the one that represents the Palestinian Authority,
383	neutral	A foreign element was almost certainly involved. It could be India, Afghanistan, the Tamil Tigers,
1154	neutral	I am sure that there are Hamas members on the UNRWA payroll and I don't see that as crime,
1542	neutral	&gt;Bharrat Jagdeo has handed over documents to Bahamian Prime Minister Hubert Ingraham, as proof of Clico Guyana's $6.9 billion (US$34 million) investment in Clico Bahamas. According to a report in the Nassau Guardian, the Bahamian Prime Minister told reporters on Monday, that he had had a face-to-face talk with Jagdeo at the Caricom Heads of Government meeting held last week in Belize. Ingraham told reporters that he had
302	neutral	The co-sponsors of the previous bill were Secretary of State (Hillary) Clinton and now President (Barack) Obama,
827	neutral	The United States wants the Islamic Republic of Iran to take its rightful place in the community of nations. You have that right -- but it comes with real responsibilities,
853	neutral	The persecution of the opposition is beginning, and I'm sure that Rosales won't be the last to go to jail,
1200	neutral	Oh no, come on - this is small beer in the NHS budget.
699	neutral	This is the price of New Labour's
368	neutral	Mugabe is going to try to hold onto his man (Gono) as much as he can because I don't think he wants to create an impression that the men and women who have been with him through thick and thin are expendable,
1088	neutral	clear through the words of Syrian Foreign Minister Walid al-Mouallem on the matter.
868	neutral	We will reintroduce the National Women Development Policy adopted during the last Awami League government's tenure. We gave nomination to maximum number of women for contesting the December 29 polls,
558	neutral	If the Congress strength in the next Lok Sabha exceeds 130-135, Manmohan Singh will become PM in all probability. If that party's strength is reduced to a number less than 120, a leader of the any of the UPA allies can stake his claim for the top job
1240	neutral	Congressman Jefferson is at present being tried in the USA and Atiku had never been indicted on the matter,
839	neutral	This is a positive move, which I hope now draws a line under the debate and allows the British Olympic Association to move forward with planning for 2012.
1033	neutral	We expect the ECB to cut interest rates by a further 50 basis points to one percent in April,
721	negative	The second explanation for the bank being comfortable is because the Finance Ministry has pretty much mopped up all that the banks offered in January and February. On the one hand, the ministry needed to pay out its outstanding debt to business operators, the now famous 2 billion euros, and then it needed to offset the almost 7?percent deficit in the revenue projected and revenue collected,
1304	neutral	At the start of the day I ordered the closure of AngloGold Ashanti,
1467	positive	Just as the State of Israel is committed all the way to bringing back a captive soldier and locating a missing fighter, this is what we are doing these days to speed up the return of Gilad Shalit, national commitment is strong before you and your loved ones,
1505	neutral	Someone from Raising Malawi visited me last week and told me that my son may be visiting me sometime next week. I am delighted, I want to see my son.
1521	neutral	&gt;Pablo Escobar (1987-1993) on our Rich Lists,
1046	negative	After having picked up snowdrops for five years, Basescu should be sent about his business on the occasion of the elections, and our duty within the party is to find the best formula of counter-candidate for Basescu,
494	positive	The future prosperity of this country depends on getting higher education right. As these proposals show, Fine Gael is determined to reform the higher education sector and reposition our Universities and Institutes to become world leaders in education. Delivering quality higher level education cannot be left to chance,
1203	negative	We cannot continue with a postcode lottery where people like the Tadley residents can't have access to NHS dentistry.
1367	negative	Contrary to his empty grandstanding and the embarrassing ignorance of members of the National Assembly, Iwu's term expired last August by effluxion of time.
425	positive	I believe the PKK will accept the wish of all Kurdish parties, laying down its arms and putting an end to violent action,
627	negative	A gathering of friends in the chairman's room at the Defense Ministry is not a legal gathering of the party secretariat, and in any case there is no validity to a decision made at a bizarre gathering in which even the secretary general is not present,
697	negative	The false idols of trickle down economics worshipped by Tories and New Labour alike have turned to dust. Constructing a new order, built on compassion, on social mobility, now falls to us. Resurrecting Britain's battered economy, this time with fairness at its foundations, now falls to us.
858	neutral	We had discussions with Pakistan President Asif Ali Zardari, Prime Minister Syed Yousuf Raza Gilani and Foreign Minister Shah Mehmood Qureshi,
1552	neutral	The oil markets are entering the second quarter, proverbially a time when US and OECD crude inventories build, with stockpiles already at highs more commonly seen, if at all, towards the end of that process,
468	negative	We welcome the recognition that the Al-Qaeda threat is emanating from Pakistan,
333	negative	Today's decision in the Bank of America case is a victory for taxpayers. Let the sun shine in. Justice Fried's decision will now lift the shroud of secrecy surrounding the $3.6 billion in premature bonuses Merrill Lynch rushed out in early December,
894	neutral	By recognizing Serpent as an island the International Court ignored any claims made by Romania on it,
954	neutral	In the case of Zimbabwe, it is important to note that we would need to do a lot in terms of fully repaying what we owe the IMF, the World Bank and the African Development Bank,
729	neutral	I have never worked for the government of Uganda and that's why Kony trusts me and has kept me,
707	neutral	I have prepared a legal proposal that would explain and clear the Presidential immunity, as it is improperly defined by the Constitution. Due to the decision of the High Court of Cassation and Justice in the Mihaileanu case, the Romanian President is the only citizen that benefits of total immunity and cannot be sanctioned as no legal charges may be filed against him. The draft law is intended to confer the President the status of a Romanian citizen, who has equal rights to all the others. I want to offer B
825	neutral	There are few people around the world that have the type of disaster experience that Craig Fugate has,
779	neutral	There are many common interests between Iraq and ECO member states and I ask you to help Iraq in many areas such as campaign against terrorism because the security of Iraq will help establish security in the region.
509	neutral	So far in this group, Bulgaria have drawn all of their three World Cup qualifying matches,
706	neutral	I invite all nations and organizations around this table and others to provide financial contributions to this trust fund so that we can sustain the Afghan National Army,
294	positive	President Obama has stated quite clearly what we all believe,
1039	positive	We got Kevin Garnett sitting on the bench and I didn't want to look down there, because I wanted to put him in,
1512	neutral	The facts revealed today reflect the way the U.S. government has consistently tried to cover up the truth of Binyam Mohamed's torture,
1352	positive	We view our partnership with Microsoft as key to delivering solutions on a scalable level to a community of more than 190 nations and the UN system as a whole,
1362	positive	I thought it was a great job by Spezza,
1115	neutral	Expanding the opening of the crossings to non-humanitarian aid is conditional on Hamas releasing Gilad Shalit,
694	neutral	I am of the view that it would be better if UPA contests in alliance. Even if it is only between the Congress and SP, it is good. Now we will decide our candidates in consultation with Mr. Singh.
829	neutral	These statements show the depravity of this man's beliefs. They must incite hatred and encourage terrorism, and I would encourage the Metropolitan Police to investigate them as rigorously as possible.
1322	negative	We submitted a bailout program only a week after the coalition was formed, and it's not the government's fault that the government's anti-crisis program has not been considered and supported by the Verkhovna Rada.
296	positive	As far as the expectations I had for a president who is a pro-choice president and did not share my pro-life views, President Obama has been honest about what he intended to do and has done those things,
1339	positive	My intent was not to go after Rush % I have enormous respect for Rush Limbaugh. I was maybe a little bit inarticulate,
735	negative	The appointment of Dennis Ross, whose track record shows his unacceptable radical viewpoints about Iran, is inconsistent with Mr. Obama's claims about his willingness to create change in Iran-US relations and contains no positive messages for Iran,
1570	positive	The promotion of human rights in any society is, to a great extent, dependent on the commitment of its political forces and public representatives to fundamental entitlements of the citizens. For the Pakistan Peoples Party Government, politics and human rights are closely linked to each other. The PPP set an example when it made human rights the basis of Pakistan's 1973 Constitution, which remains the sole guarantor of fundamental freedoms and rights enjoyed by the Pakistani people.
550	neutral	The comments of the minister of health were rather unfortunate in the sense that this position on the Dalai Lama is an official position of this government,
545	neutral	We certainly believe South Africa has decided not to give a visa to His Holiness the Dalai Lama under pressure from the Chinese government,
1243	negative	We've been wrestling with OPEC for more than 40 years and we haven't really made any progress reining them in,
1199	positive	All NHS providers will be legally obliged to have regard to the NHS Constitution, which gives patients a legal right to choice.
525	neutral	He makes quite a stable impression. We know that we need him on the way to the 2010 World Cup and afterwards,
301	neutral	It's almost like Barack Obama is using late night to give us all a little hug before we go to sleep at night,
1101	positive	I sell authentic items and when people come to my website and see the name David Irving, they know they are buying an authentic item. I have a living to make and this is how I make my money. 'There are some very wealthy people, mainly in the U.S., and I know how much they will pay for these items.
313	neutral	Is patriotism something you like only when it is brandished by Barack Obama?
1192	positive	As our ambassador to Afghanistan, General Eikenberry will be able to draw upon extensive experience in engaging international partners and facilitating a more collaborative effort with the Afghans,
1112	neutral	I arrived in Indian Wells earlier this week and I am eager to get back out on court,
925	neutral	Vote for selecting between the Japanese representative (to the agency) Yukiya Amano and the South African representative Abdul Samad Minty will be held at the IAEA board of governors' extraordinary session on 26-27 March,
802	negative	The main fault lies with the Interior Ministry that did not submit even fundamental evidence. The NSS´s decision is therefore not a verdict on the Workers´ Party, but a verdict testifying to the Interior Ministry´s and Minister Langer´s incompetence,
488	neutral	The EPP-ED Group is already preparing, together with the EPP Party, the nomination of the new European Commission. It is important that the transition period between the elections and the nomination of the Commission President is a short as possible, so that Europe can continue to actively build the future in these times which are so difficult for many citizens.
1358	neutral	Neither Microsoft nor [Microsoft PR agency] Burson-Marsteller has ever paid money to either Privacy International or 80/20 Thinking, nor has any benefit in kind been given,
1015	neutral	After the rained-out game we've got to win, Dans (Vettori) told us it's a must-win game,
461	neutral	If an ally of al Qaeda and Iran comes to power in El Salvador, the national security interests of the United States will require certain immigration restrictions and controls over the flow over the four billion dollars in annual remittances sent from the U.S. back home to El Salvador.
1556	positive	I have had upwards of 10 interactions with Kayani. He wants to do the right thing for Pakistan. But he is in a very tough spot,
666	positive	Its main purpose is to emphasize the inextricable links with our homeland, with the colossal riches created by our ancestors which we are now responsible for. The great experience accumulated by the Orthodox Church during many centuries is of great value for the present day generation. This experience inspires and encourages people,
366	negative	If Alex Salmond is defending the Dunfermline building society and the directors, he is really defending the indefensible.
341	negative	Rick Wagoner stands for an imploded centralist system,
1290	negative	The costs of badly run NASA projects are paid for with cutbacks or delays in NASA projects that didn't go over budget,
763	negative	If Goodwin is exceptionally to be held to account because his recklessness was so extreme, then he should be stripped of his knighthood since this was granted for
988	neutral	It is inevitable that this verdict will be compared to the acquittal of Ramush Haradinaj. This will additionally strengthen the impression about the Hague tribunal's double standards,
517	neutral	That view will be among several positions that will define security requirements for the Soccer World Cup,
