1045	neutral	Not even in my sleep have I talked to someone thereof. The PD?L candidate is Traian Basescu. It is just that PD?L should not hinder Traian Basescu, to stay where he is right now, a support and a factor pulling him down
437	neutral	The White House believes those that have committed atrocities should be held accountable,
970	neutral	We can aid the business sector, and SMEs especially, by reducing red tape. The Romanian state collects over 200 taxes, many of which bring little income to the state, but imply higher expenses for the public administration and taxpayers. Also, Romania has committed itself, along with its European partners, to reducing by 20% administrative costs imposed on SMEs. We took part in this decision in the European Council of December 2008. I urge the Government to focus on this opportunity to provide quick aid to
574	neutral	so far we have announced candidates for 28 out of the 42 Lok Sabha and 195 out of the 294 assembly constituencies in the state.
507	neutral	It's vitally important that first and foremost not only do we qualify for the World Cup, but it's imperative that we qualify for the Asian Cup,
526	neutral	As the department of transport we are delighted that this is once again an accomplishment of an important milestone in fulfilling the Fifa requirements for the World Cup,
852	neutral	The persecution of the opposition is beginning, and I'm sure that Rosales won't be the last to go to jail,
753	neutral	But, it is also wider than just SA. There are areas where the rest of the Southern African Development Community can chip in,
871	neutral	You mustn't expect that this trip will change the position of the Catholic Church towards the problem of AIDS,
326	neutral	They are reluctant to send more troops and put them in harms' way. However, there are signs they are willing to do those other non-combat missions. I think that is going to have to be the way forward for the Obama administration,
421	neutral	The United Nations is deeply concerned over a lack of direct information from his abductors on the condition of John and has reason to believe he could now be very seriously ill,
1027	positive	Neil Young to play this year is a dream come true for me personally. He is one of my all-time favourites and we have always wanted him to play.
867	neutral	I do not know whether COAS General Kayani persuaded President Asif Ali Zardari to restore the judges, but I am sure some people must have persuaded him.
1356	negative	Microsoft should have done this a long time ago,
1469	positive	This government must not clear its table before Shalit is back home,
1296	neutral	We are older than Google, Slashdot, or Facebook, and I'm not aware of any Web hosts that were organized in 1995 and are still privately owned and operating under the original management,
1022	negative	The Common Agricultural Policy in its current form doesn't serve the best interests of the farming industry or consumers across Europe, which is why we've consistently pushed for far-reaching reform.
1373	neutral	We've done well away from home in the UEFA Cup so I think we're strong and peaking at the right time of the season,
523	neutral	I accept the (responsibility for) defeat, and I apologise to the Iranian people. But we still have the opportunity to make it to the World Cup.
1288	neutral	A request for FBI assistance was sent through the US State Department. No decision has been made at this point,
611	neutral	If you're any of those six at this point, you don't want to go to the twenty-five countries that make up the European Union, because you may be subject to immediate arrest. What will happen next is this investigation will most likely continue in a very vigorous form,
747	neutral	I just said that the gas chambers were a detail of Second World War history, which is clear,
309	positive	The challenge for everyone is that (Obama's new language) is a prelude to a sincere change (of direction) in US and European foreign policy,
754	neutral	We (Congress and Trinamool Congress) will jointly fight the coming Lok Sabha elections in West Bengal against the ruling Left Front,
1522	positive	I was a first lady and I know how important that role is. I think Michelle Obama is doing a wonderful job and she is also balancing her responsibilities very well,
304	neutral	The budget President Obama has proposed isn't the same-old document Washington has come to expect year after year,
376	neutral	Human Rights Watch has been monitoring human rights in Cuba for nearly two decades and the dismal state of human rights has not improved,
397	positive	However, South Africa supported the decision of the African Union to defer the issuing of the warrant of arrest against President Al-Bashir by a year to give the peace processes in the Sudan a chance,
1028	neutral	With revised ECB staff forecasts set to reflect both the weaker GDP outlook and more benign inflation, the euro looks set to remain on a weakening trend over the coming months,
449	neutral	Fatah tries to draw Hamas to recognize the Israeli occupation by putting pressure on us that the commitments of the Palestine Liberation Organization (PLO) must be respected,
300	neutral	We're very struck that the Obama administration wants to have a discussion of ectives, of strategy, and better resources, and they want to do it in that order,
1132	positive	I will work to involve Hizbullah and Hamas in the negotiations to achieve peace in the region,
1177	neutral	to wait and see what the alliance between the Kateeb party and MP Michel al-Murr achieves.
1461	neutral	Crude prices are up, I think, in a knee-jerk reaction to the news of Chinese vessels harassing a U.S. Navy ship in the South China Sea,
1499	positive	Not all of the member-countries are quite as committed to the idea [of human rights], but the existing traditional Asean spirit of consensus is already a significant progress. As long as there dialogue [among them], the HRB is likely to be given a mandate that will address protection as well as promotion [of such rights], and will underline the universality of human rights,
451	negative	Fatah is still deceiving and it doesn't meet its obligations, it released 45 of our prisoners in West Bank but arrested 39 new people,
354	neutral	We know about Deputy Dempsey now.
1182	neutral	This is an important step for us as a standalone business. It also confirms our determination as a team to steer Jaguar Land Rover through these extraordinary and challenging times, so that our business is ready to take advantage when the downturn finally ends.
403	neutral	This is in addition to the five million pounds (7.2 million dollars) that we have already given directly to the African Union for AMISOM,
1256	neutral	I thought the OPEC cuts would have had more of an effect by now,
285	neutral	My theory is they would rather have the argument with Rush than with the congressional Republicans over the substance of the stimulus, the omnibus or the Obama budget,
1191	positive	At such a time, Karl Eikenberry brings exceptionally valuable skills to the table,
1162	neutral	It is testimony that next time, we should go to something more complete in order to prevent the rearmament of Hamas,
442	neutral	In his White House run, Obama assailed the economic policies of his predecessor, President George W Bush. But the dismal deficit figures, if they prove to be accurate, would amount to more than four times the deficits of Bush's presidency and raise the prospect that Obama and his Democratic allies c ontrolling Congress would have to consider raising taxes after the recession ends. By the auditors' calculation, Obama's budget would generate deficits averaging almost $1 trillion a year of red ink over 2010-2
1509	positive	Against the advice of the EC, I said that the candidature of Varun Gandhi will not be cancelled at any cost and I would go to his constituency (Pilibhit) for campaigning,
1350	neutral	My name is Peter Moore, I have been held here for nearly eight months now.
548	neutral	Very few, if any, of the Western powers allow the Dalai Lama to visit their countries in March - It is an internationally recognised diplomatic protocol,
1507	neutral	If Varun Gandhi's comments are correct, then it is very unfortunate,
910	neutral	&gt;Pfizer Foundation and the Carnegie Corporation. But the key player today is the Swedish International Development Agency (Sida), with its Bilateral Collaborative Research Support programme worth 238 million Swedish Kroners (US$27 million). In 1999 Sida started working with Makerere to help it reach a position where it could set about finding its own solutions to Uganda's problems. Initially, the agency worked with individual researchers and faculties. But a bigger idea emerged: that the changes they were h
1312	positive	Today's announcement of 'Partners in Education' demonstrates the willingness of Volkswagen Group of America to partner with K-12 and higher education in Tennessee to help prepare our young people for the highly skilled jobs of the future,
835	neutral	I respect him as he is a senior politician and would like to tell you all that I have my roots here. My father (late actor-turned-minister Sunil Dutt) used to get emotional whenever he remembered the good old days he had spent here,
559	neutral	Left parties are an important component of the Third Front who always have about 40-50 members in the Lok Sabha,
616	neutral	Unilateralism is a fading theory in the modern era, whereas regional organizations like NAM (the Non-Aligned Movement), OIC (the Organization of the Islamic Conference) ECO (the Economic Cooperation Organization) are growing,
565	neutral	so far we have announced candidates for 28 out of the 42 Lok Sabha and 195 out of the 294 assembly constituencies in the state.
1053	positive	Francis Maude has always been open and transparent about his outside interests.
357	neutral	Currently we estimate it (the unemployment % Itar-Tass) within the range from 2.2 to 2.8 million people,
1357	negative	Microsoft should have done this a long time ago,
760	negative	I don't think it's appropriate that the taxpayer should be providing any more benefits to Fred Goodwin.
856	neutral	Today we've witnessed the start of construction of what, with the help of Sir Chris Hoy who helped design the velodrome, we hope will be the fastest track in the world for London 2012, helping Olympic and Paralympic cyclists better their awe-inspiring performances last summer.
789	neutral	It is clear that today's outcome will not kill off the proposals to extend copyright term, but rather that member states need more time to consider that details of the proposal and reach an agreement,
1413	neutral	Hopefully, appropriate Pakistani officials worry as we do that their civilians could become nuclear targets -- as could NATO soldiers in neighboring Afghanistan or civilians in any number of Western countries,
312	negative	It is an embarrassment for the Obama administration to continue the Bush administration's practice of refusing dialogues with others,
321	neutral	I think the chances of this strategy (announced by US President Barack Obama on Friday) working are far better than the purely military strategy of the past, (because) it has a socio-economic component, a political component, and it has a military and intelligence component,
1042	neutral	I have been the member of Rajya Sabha from Madhya Pradesh for last three years and this state is not new for me,
544	neutral	If the Dalai Lama doesn't come, I'm not going ... I'm very disappointed,
306	neutral	I don't know that they've arrived at any final conclusions on which President Obama has signed off on, but their thinking is now very close to the conclusion of the process.
441	neutral	To have a successful presidency, the social life of the White House has to match the times. That's when it becomes such an added benefit to the presidency. It happened in its greatest form with the Kennedys,
1466	neutral	right from the very beginning that the truce and Shalit would be separate tracks
905	neutral	Fox News Sunday.
1403	neutral	The U.S. policy review is very important, but in this very important year for Afghanistan, with the elections coming up, with the NATO summit coming up, with the new U.S. President Obama in Europe on a NATO summit, it is also very important that this alliance delivers in a very short term,
298	neutral	 to debate me on the issues. Let's talk about free markets versus government control. Let's talk about nationalizing health care and raising taxes on small business.
681	positive	The main reason is to put some make-up on his face, to be able to present a kind of pragmatic, if you like, moderate coalition. The Labor Party is perceived as the party that started the peace process, the Oslo process. Once they are on board it is much easier to convince the international community that this government is not a radical-right government,
1008	positive	As far as I am concerned the National Anthem should stay exactly as it is, which is fine. 'Secondly, those lines are so utterly banal that even an 11-year-old would disown them. 'I am perfectly happy to be British and perfectly happy with the National Anthem as it is. I certainly don't aspire to rewrite anything.
923	neutral	I was by myself with Brodeur and saw Richie on the corner on the left side. I thought it would be open net for him,
1108	neutral	In spite of their cheerful statements, Bakiyev will not be a candidate for a second term. So far he has only behaved as if he's going for a second term, otherwise the [governing] party [Ak Zhol] and its command structure would disintegrate,
708	neutral	We'll get them in as quickly as possible ... but I don't want a situation in which they are subject to a legal challenge in the High Court,
876	neutral	and sparked panic. Witnesses told WINS radio that the situation was compounded when a man leapt from a car and began grabbing women's purses. A New York Police Department official said two women and a man were arrested on charges of inciting to riot and disorderly conduct. It is so important to me to redefine beauty and make sure that everyone gets a fair chance to pursue their dream,
346	neutral	We are the only city where Wall Street is just a subway stop away from Main Street. White-collar crime, as we have seen, affects our pensions, affects our not-for-profit institutions and it affects our businesses,
1274	neutral	Is this the first step to Russia joining OPEC? Stay tuned,
343	positive	Rick Wagoner has worked for that company for 31 years, and he is a good man. He clearly is a sacrificial lamb,
939	neutral	We are aware of the huge significance of the 15 April date for both Liverpool and their fans, and that is why we will do our utmost to make sure that the club does not have to play its Champions League second leg quarter-final match on that day,
793	neutral	We believe this referendum serves to extend the life of the Aliev regime,
1127	neutral	We want to make sure we're not working through Hamas, but we also want to make sure we support the Palestinian Authority,
1052	neutral	Comrade Basescu got scared of Crin Antonescu and realizes that as time passes, the chances of Basescu to be reelected decrease and the chances of Crin Antonescu increase. I don't think that this is a decision, but definitely Berceanu did not make this declaration at random, he probably wanted to test the reactions of the public opinions to such a political move,
1103	positive	Syria's doors are open to [Prime Minister Fouad] Siniora,
1198	neutral	In England, 89% of prescription items are dispensed for free, the remainder provide valuable income to the NHS, of £437 million in 2009/10, which goes towards to the safety and speed of healthcare. But we are making the system fairer. Cancer patients will be eligible for free prescriptions from April 1 this year and we're looking at how we can do the same for people with long-term conditions.
626	negative	A gathering of friends in the chairman's room at the Defense Ministry is not a legal gathering of the party secretariat, and in any case there is no validity to a decision made at a bizarre gathering in which even the secretary general is not present,
560	neutral	I am not in the race... the prime ministerial candidate will only be known after the results of the Lok Sabha elections are announced,
497	neutral	Bob Hawke is nowhere near as Irish as I am,
1366	neutral	I inform you of my decision to quit my post as member of the Council of State, deputy of the National Assembly of People's Power and as member of the Central Committee of the Communist Party of Cuba.
822	neutral	Simulation is not new but I think we did really bring it to Formula One more aggressively than anyone has in the past and hopefully that will give us an advantage this season,
478	neutral	We have submitted to the European Commission our plan to stabilise the economy by 2013 and to take whatever decisions necessary to work within the stability and growth pact guidelines. And they have accepted this,
887	neutral	I arrived at the headquarters of the Ministry of Education, which is an 18-story building in Harare,
1457	positive	This is a dream come true for 11 of our member countries. It will surely help to lift the bar of football in these countries. My sincere hope is that the governments and business organisations join with us in this FIFA initiative that will take the sport to even greater heights
1545	negative	When it comes to the banks squandering their customers' money ... I have discovered that it wasn't only Sir Fred who was getting money off RBS, it was also the right honourable member opposite who got £30,000 off the Royal Bank of Scotland for just two after-dinner speeches.
424	neutral	My message to the PKK is to end the violence, to end the armed conflict,
1096	neutral	Under Fifa rules, Nacho Novo could have played for Scotland, but we the associations of Great Britain had ruled that out and left it for birth in the country or bloodline, which was parent or grandparent,
833	neutral	It is said that Pawar has friends in all states. But it should be kept in mind that all his friends too are eyeing for the top slot and are not expected to clear ground for him for prime ministership (if UPA comes to power),
757	negative	I think Scudamore is an absolute disgrace,
1297	negative	Google is great for Google but it's terrible for content providers.
1289	neutral	the reason for the huge number of no-records responses is that it's become a cult phenomenon to ask the FBI for records on yourself, and most people don't have FBI records.
1294	neutral	Scott is an exceptional astronaut who has served NASA and the Astronaut Office with distinction during these past 17 years,
1319	neutral	I spoke with the President before putting forward my candidature in the Verkhovna Rada. The President told me that he intended to set forth my candidature. He expects me to continue the course towards European and Euro-Atlantic integration, that is, our strategic course,
330	neutral	The option is to appoint Mirek Topolanek because the Civic Democrats will not allow for any other appointment,
1097	positive	The Hon. Minister of Finance's (Tendai Biti's) thrust on capacity enhancement in our productive sectors, as well as an incisive focus on social safety nets are all robust policy anchors that should see us emerge a much more self-reliant and equitable economy,
1528	positive	Only through the awareness of citizens and the quick actions of the Israel Police did a miracle occur and this terrorist attack ended without casualties,
1332	neutral	Rush Limbaugh is an entertainer,
1408	neutral	That decision stands: Ukraine and Georgia will eventually be members of NATO [...], but enlargement is a performance-based project, and the question of when depends on their performance,
982	neutral	If it is suggested -- as I believe that it is -- that I was involved in any conversations, the ective of which was to manipulate the National Prosecuting Authority or use it as a tool to frustrate Zuma's ambition to occupy the highest office in the land by prosecuting him, I am confident that, if any authentic record of my conversations with whomsoever is produced, no evidence would be found that would implicate me in such a conspiracy,
510	neutral	England's women have been the team to beat since the 2009 World Cup began - but they have out-scored and out-bowled all their rivals so far.
935	neutral	We want to be in at the end of all three competitions; Bundesliga, Champions League and DFB Cup. The boys are hungry for this game,
1514	neutral	Any song that's been uploaded to YouTube is available in Muziic,
1462	neutral	I have maintained throughout that I am innocent and that the (Scorpions) orchestrated a campaign against me and the South African Police Service to tarnish my image and the image of the (police) to further their own interests and to justify their continued existence.
375	neutral	Human Rights Watch, one of the world's leading independent organizations dedicated to defending and protecting human rights, has informed Zack Shahin's U.S. legal counsel that a letter expressing concern with Zack Shahin's case will soon be sent to the government of the United Arab Emirates Zack Shahin has spent a year in custody, but UAE authorities have yet to produce any evidence against him or even charge him with a crime,
516	neutral	This is a stocktaking a year before the World Cup in South Africa,
810	neutral	No one is calling for the disarmament of Hezbollah right now,
1034	positive	We've no present plans to go near any of these institutions because we'll be in a position to fund ourselves as a state this year and the European Central Bank stands behind our banking system, so we're a solvent state and we're well able to do our business,
784	neutral	Without enough good quality water our economies and societies can neither thrive nor survive. Europeans realise the seriousness of the issue and they understand that action is needed to maintain clean and sufficient water resources for the survival of our society. Member States must swiftly take steps to fully implement all EU legislation on water.
1186	positive	I am willing to work with Your Excellency and carry forward the Sino-Pakistan Strategic Partnership of Cooperation to a new high.
1143	neutral	the overwhelming majority of casualties were Hamas operatives and others who were, under international law, legitimate targets.
1424	neutral	A person who is making war against the NATO forces, he must be present in Afghanistan, in [the Afghan province of] Kandahar or somewhere,
1255	positive	Our message is that non-OPEC [countries] should join OPEC [in helping the market] and we emphasize that a price lower than the current one does not have a justification at all and it stops development,
339	negative	We are left to look back and say that Wagoner's appointment as both chairman and CEO in 2003 was little more than an act to ensure the dynasty of GM boardroom arrogance and failure continued,
668	negative	Sadly, every week we see businesses down-sizing and others going to the wall and more people losing their jobs. What we need is real leadership from James Purnell (Work and Pensions Secretary) and this tired Labour Government.
352	neutral	. Outgoing Foreign Minister Tzipi Livni had earlier warned that Israel would not shy away from striking Gaza in response to persistent rocket fire. If it turns out that Hamas has not got the message, it will be hit again,
847	neutral	She's the one who's in crisis. Renamo's not in crisis. She was recruited by Renamo to be head of the parliamentary group. It was me who put here there. It was Dhlakama's will
1374	neutral	The financial problems at Bear Stearns, AIG, and Lehman Brothers elicited different responses from government, which contributed to uncertainty. Arguably, this uncertainty in itself became a source of systemic risk,
1280	neutral	I think it is as you compare it to other teams, the teams that went to the Super Bowl,
1484	negative	The truth is that Secretary Geithner didn't inherit the policy of throwing billions of taxpayer dollars at failing companies -- he helped create it,
458	negative	Al-Qaeda is conducting attacks with no planning and no clear goals,
1211	positive	The callous murder of Isithwalandwe Chris Hani in 1993 struck a grave blow to those South Africans who regarded him as a hero of the liberation struggle, and threatened to derail the process towards a political settlement in this country,
996	neutral	If we really want consumers to buy green, the sustainable choice must be an easy choice. Product information must be clear, and sustainable products must not be a luxury option. European retailers are in a unique position to help us get there. They are a part of consumers' everyday life and can have an immediate impact on the choices they make. That is why I am truly happy to launch the Forum today, alongside Commissioner Dimas. And I believe this is a good starting point for a concerted approach among reta
586	neutral	It is an obligation for our all our states to guarantee harmonised reception procedures throughout the European Union and for this reason the European Parliament has asked for a review of the mandate of Frontex, which should be to ensure the protection of the most vulnerable people and, in particular, of potential refugees
978	neutral	That has always been the Green Party position before entering government and that is still our position,
396	neutral	&gt;Pakistan Muslim League-Q Chief Chaudhry Shujaat Hussain said on Thursday that his party has no deal with any political party on formation of government in Punjab. Talking to journalists here, Chaudhry Shujaat said although they would hold an important meeting with Pakistan Muslim League-N Quaid Mian Nawaz Sharif yet their party has no deal with any one. ‘A strong Punjab means a strong Pakistan
